M	CHARACTER	DIALOGUE
M	SHUTTLE CAPTAIN	Command station, this is ST 321. Code Clearance Blue. We're starting our approach. Deactivate the security shield.
M	DEATH STAR CONTROLLER	The security deflector shield will be deactivated when we have confirmation of your code transmission. Stand by... You are clear to proceed.
M	SHUTTLE CAPTAIN	We're starting our approach.
M	OFFICER	Inform the commander that Lord Vader's shuttle has arrived.
M	OPERATOR	Yes, sir.
M	JERJERROD	Lord Vader, this is an unexpected pleasure. We're honored by your presence.
M	VADER	You may dispense with the pleasantries, Commander. I'm here to put you back on schedule.
M	JERJERROD	I assure you, Lord Vader, my men are working as fast as they can.
M	VADER	Perhaps I can find new ways to motivate them.
M	JERJERROD	I tell you, this station will be operational as planned.
M	VADER	The Emperor does not share your optimistic appraisal of the situation.
M	JERJERROD	But he asks the impossible. I need more men.
M	VADER	Then perhaps you can tell him when he arrives. The Emperor's coming here?
M	VADER	That is correct, Commander. And he is most displeased with your apparent lack of progress.
M	JERJERROD	We shall double our efforts.
M	VADER	I hope so, Commander, for your sake. The Emperor is not as forgiving as I am.
M	THREEPIO	Of course I'm worried. And you should be, too. Lando Calrissian and poor Chewbacca never returned from this awful place.
M	THREEPIO	Don't be so sure. If I told you half the things I've heard about this Jabba the Hutt, You'd probably short-circuit.
M	THREEPIO	Artoo, are you sure this is the right place? I better knock, I suppose. There doesn't seem to be anyone there. Let's go back and tell Master Luke.
M	STRANGE VOICE	Tee chuta hhat yudd!
M	THREEPIO	Goodness gracious me!
M	THREEPIO	Artoo Detoowha bo Seethreepiowha ey toota odd mischka Jabba du Hutt.
M	THREEPIO	I don't think they're going to let us in, Artoo. We'd better go.
M	THREEPIO	Artoo, wait. Oh, dear! Artoo. Artoo, I really don't think we should rush into all this.
M	THREEPIO	Oh, Artoo! Artoo, wait for me!
M	THREEPIO	Just you deliver Master Luke's message and get us out of here. Oh my! Oh! Oh, no.
M	BIB	Die Wanna Wanga!
M	THREEPIO	Oh, my! Die Wanna Wauaga. We -- we bring a message to your master, Jabba the Hutt. ... and a gift. Gift, what gift?
M	BIB	Nee Jabba no badda. Me chaade su goodie.
M	THREEPIO	He says that our instructions are to give it only to Jabba himself.
M	THREEPIO	I'm terribly sorry. I'm afraid he's ever so stubborn about these sort of things.
M	BIB	Nudd Chaa.
M	THREEPIO	Artoo, I have a bad feeling about this.
M	THREEPIO	Good morning.
M	JABBA	Bo Shuda!
M	THREEPIO	The message, Artoo, the message.
M	LUKE	Greetings, Exalted One. Allow me to introduce myself. I am Luke Skywalker, Jedi Knight and friend to Captain Solo. I know that you are powerful, mighty Jabba, and that your anger with Solo must be equally powerful. I seek an audience with Your Greatness to bargain for Solo's life. (Jabba's crowd laughs) With your wisdom, I'm sure that we can work out an arrangement which will be mutually beneficial and enable us to avoid any unpleasant confrontation. As a token of my goodwill, I present to you a gift: these two droids.
M	THREEPIO	What did he say? ... Both are hardworking and will serve you well.
M	THREEPIO	This can't be! Artoo, you're playing the wrong message. There will be no bargain.
M	THREEPIO	We're doomed. I will not give up my favorite decoration. I like Captain Solo where he is.
M	THREEPIO	Artoo, look! Captain Solo. And he's still frozen in carbonite.
M	THREEPIO	What could possibly have come over Master Luke. Is it something I did? He never expressed any unhappiness with my work. Oh! Oh! Hold it! Ohh!
M	NINEDENINE	Ah, good. New acquisitions. You are a protocol droid, are you not?
M	THREEPIO	I am See-Threepio, human-cy...
M	NINEDENINE	Yes or no will do.
M	THREEPIO	Oh. Well, yes.
M	NINEDENINE	How many languages do you speak?
M	THREEPIO	I am fluent in over six million forms of communication, and can readily...
M	NINEDENINE	Splendid! We have been without an interpreter since our master got angry with our last protocol droid and disintegrated him.
M	THREEPIO	Disintegrated?
M	NINEDENINE (to a Gamorrean guard)	Guard! This protocol droid might be useful. Fit him with a restraining bolt and take him back to His Excellency's main audience chamber. Artoo, don't leave me! Ohhh!
M	NINEDENINE	You're a feisty little one, but you'll soon learn some respect. I have need for you on the master's Sail Barge. And I think you'll fit in nicely.
M	JABBA	Da Eitha!
F	OOLA	Na Chuba negatorie Na! Na! Natoota...
M	JABBA	Boscka!
M	BOUSHH (in Ubese subtitled)	I have come for the bounty on this Wookiee.
M	THREEPIO	Oh, no! Chewbacca! At last we have the mighty Chewbacca.
M	THREEPIO	Oh, uh, yes, uh, I am here, Your Worshipfulness. Uh... yes!
M	THREEPIO	Oh. The illustrious Jabba bids you welcome and will gladly pay you the reward of twenty- five thousand.
M	BOUSHH (in Ubese subtitled)	I want fifty thousand. No less.
M	THREEPIO	Uh, oh... but what, what did I say? Uh, the mighty Jabba asks why he must pay fifty thousand.
M	THREEPIO	Because he's holding a thermal detonator. This bounty hunter is my kind of scum. Fearless and inventive.
M	THREEPIO	Jabba offers the sum of thirty-five. And I suggest you take it.
M	BOUSHH	Zeebuss.
M	THREEPIO	He agrees!
M	BOUSHH	Just relax for a moment. You're free of the carbonite.
M	BOUSHH	Shhh. You have hibernation sickness.
M	HAN	I can't see.
M	BOUSHH	You eyesight will return in time.
M	HAN	Where am I?
M	BOUSHH	Jabba's palace.
M	HAN	Who are you?
F	LEIA	Someone who loves you.
M	HAN	Leia!
F	LEIA	I gotta get you out of here.
M	HAN	What's that? I know that laugh.
M	HAN	Hey, Jabba. Look, Jabba, I was just on my way to pay you back, but I got a little sidetracked. It's not my fault. It's too late for that, Solo. You may have been a good smuggler, but now you're Bantha fodder.
M	HAN	Look... Take him away!
M	HAN	Jabba... I'll pay you triple! You're throwing away a fortune here. Don't be a fool! Bring her to me.
F	LEIA	We have powerful friends. You're gonna regret this... I'm sure.
F	LEIA	Ugh!
M	THREEPIO	Ohhh, I can't bear to watch.
M	HAN	Chewie? Chewie, is that you?
M	HAN	Ah! Chew--Chewie!
M	HAN	Wait. I can't see, pal. What's goin' on?
M	HAN	Luke? Luke's crazy. He can't even take care of himself, much less rescue anybody.
M	HAN	A...Jedi Knight? I--I'm out of it for a little while, everybody gets delusions of grandeur.
M	HAN	I'm all right, pal. I'm all right.
M	LUKE	I must speak with Jabba.
M	LUKE	You will take me to Jabba now!
M	LUKE	You serve your master well.
M	LUKE	And you will be rewarded.
M	THREEPIO	At last! Master Luke's come to rescue me.
M	BIB	Master.
M	BIB	...Luke Skywalker, Jedi Knight.
M	JABBA (in Huttese subtitled)	I told you not to admit him.
M	LUKE	I must be allowed to speak. He must be allowed to speak.
M	JABBA (in Huttese subtitled)	You weak-minded fool! He's using an old Jedi mind trick.
M	LUKE	You will bring Captain Solo and the Wookiee to me. Your mind powers will not work on me, boy.
M	LUKE	Nevertheless, I'm taking Captain Solo and his friends. You can either profit by this... or be destroyed! It's your choice. But I warn you not to underestimate my powers.
M	THREEPIO	Master Luke, you're standing on...
M	JABBA (in Huttese subtitled)	There will be no bargain, young Jedi. I shall enjoy watching you die.
M	JABBA	Bascka!
M	THREEPIO	Oh, no! The Rancor!
M	JABBA (in Huttese subtitled)	Bring me Solo and the Wookiee. They will all suffer for this outrage.
M	LUKE	Han!
M	HAN	Luke!
M	LUKE	Are you all right?
M	HAN	Fine. Together again, huh?
M	LUKE	Wouldn't miss it.
M	HAN	How are we doing?
M	LUKE	The same as always.
M	HAN	That bad, huh? Where's Leia?
F	LEIA	I'm here.
M	THREEPIO	Oh, dear. His High Exaltedness, the great Jabba the Hutt, has decreed that you are to be terminated immediately.
M	HAN	Good, I hate long waits.
M	THREEPIO	You will therefore be taken to the Dune Sea and cast into the pit of Carkoon, the nesting place of the all-powerful Sarlacc. Doesn't sound so bad.
M	THREEPIO	In his belly, you will find a new definition of pain and suffering, as you are slowly digested over a thousand years.
M	HAN	On second thought, let's pass on that, huh?
M	LUKE	You should have bargained, Jabba. That's the last mistake you'll ever make.
M	HAN	I think my eyes are getting better. Instead of a big dark blur, I see a big light blur.
M	LUKE	There's nothing to see. I used to live here, you know.
M	HAN	You're gonna die here, you know. Convenient.
M	LUKE	Just stick close to Chewie and Lando. I've taken care of everything.
M	HAN	Oh... great!
M	JABBA (in Huttese subtitled)	Soon you will learn to appreciate me.
M	THREEPIO	Oh, I'm terribly sor... Artoo! What are you doing here?
M	THREEPIO	Well, I can see you're serving drinks, but this place is dangerous. They're going to execute Master Luke and, if we're not careful, us too!
M	THREEPIO	Hmm. I wish I had your confidence.
M	THREEPIO	Victims of the almighty Sarlacc: His Excellency hopes that you will die honorably. But should any of you wish to beg for mercy, the great Jabba the Hutt will now listen to your pleas.
M	HAN	Threepio, you tell that slimy piece of... worm-ridden filth he'll get no such pleasure from us. Right?
M	LUKE	Jabba! This is your last chance. Free us or die. Move him into position.
M	JABBA (in Huttese subtitled)	Put him in.
M	LUKE	Easy, Chewie.
M	LANDO	Whoa! Whoa! Help!
M	HAN	Chewie, you okay? Where is he?
M	HAN	I'm okay, pal.
M	LANDO	Han! Chewie?
M	HAN	Lando!
M	HAN	Boba Fett?! Boba Fett?! Where?
M	HAN	Lando, grab it!
M	LANDO	Lower it!
M	HAN	I'm trying!
M	HAN	Whoa! Whoa! Grab me, Chewie! I'm slipping.
M	HAN	Grab it! L--Lando. Grab!
M	HAN	Grab it! Almost... You almost got it!
M	LANDO	Hold it! Whoa!
M	HAN	Gently now. All... all right. Now easy, easy. Hold me, Chewie.
M	HAN	Chewie! Chewie, give me the gun. Don't move, Lando.
M	LANDO	No, wait! I thought you were blind!
M	HAN	It's all right. Trust me. Don't move.
M	LANDO	All right! A little higher! Just a little higher!
M	HAN	Chewie, Pull us up! Come on! Okay... up, Chewie, up!
F	LEIA	Come on. We gotta get out of here quick.
M	THREEPIO	Not my eyes! Artoo, help! Quickly, Artoo. Oh! Ohhh! You beast! Get the gun! Point it at the deck!
M	LUKE	Point it at the deck!
M	THREEPIO	Artoo, where are we going? I couldn't possibly jump.
M	LUKE	Come on!
M	LUKE	Let's go! And don't forget the droids.
M	LANDO	We're on our way.
M	HAN	I don't know. All I can see is a lot of blowing sand!
F	LEIA	That's all any of us can see.
M	HAN (blinking)	Then I guess I'm getting better. I've got to hand it to you, kid, you were pretty good out there. I had a lot of help. Think nothing of it.
M	HAN	No, I'm thinking a lot about it. That carbon freeze was the closest thing to dead there is. And it wasn't just sleepin'. It was a big wide awake nothing! I'll see you back at the fleet.
M	HAN	Why don't you leave that crate and come with us?
M	LUKE	I have a promise I have to keep first... to an old friend.
M	HAN	Guess I owe you some thanks, too, Lando.
M	LANDO	Figured if I left you frozen like that you'd just give me bad luck the rest of my life, so I might as well get you unfrozen sooner or later.
F	LEIA	He means "You're welcome."
M	LANDO	Come on, let's get off this miserable dust ball.
M	LUKE	I'll meet you back at the fleet.
M	LEIA (over comlink)	Hurry. The Alliance should be assembled by now.
M	LUKE	I will.
M	HAN (over comlink)	Hey, Luke, thanks. Thanks for comin' after me. Now I owe you one.
M	LUKE	That's right, Artoo. We're going to the Dagobah system. I have a Rise, my friend.
M	VADER	The Death Star will be completed on schedule.
M	EMPEROR	You have done well, Lord Vader. And now I sense you wish to continue your search for young Skywalker.
M	VADER	Yes, my Master.
M	EMPEROR	Patience, my friend. In time he will seek you out. And when he does, you must bring him before me. He has grown strong. Only together can we turn him to the dark side of the Force.
M	VADER	As you wish.
M	EMPEROR	Everything is proceeding as I have foreseen.
M	YODA	Hmm. That face you make. Look I so old to young eyes?
M	LUKE	No... of course not. I do, yes, I do! Sick have I become. Old and weak. (Points a crooked finger) When nine hundred years old you reach, look as good you will not. Hmm?
M	YODA	Soon will I rest. Yes, forever sleep. Earned it, I have.
M	LUKE	Master Yoda, you can't die.
M	YODA	Strong am I with the Force... but not that strong! Twilight is upon me and soon night must fall. That is the way of things ... the way of the Force.
M	LUKE	But I need your help. I've come back to complete the training.
M	YODA	No more training do you require. Already know you that which you need.
M	LUKE	Then I am a Jedi? Ohhh. Not yet. One thing remains: Vader. You must confront Vader. Then, only then, a Jedi will you be. And confront him you will.
M	LUKE	Master Yoda... is Darth Vader my father?
M	YODA	Mmm... rest I need. Yes... rest.
M	LUKE	Yoda, I must know.
M	YODA	Your father he is.
M	YODA	Told you, did he?
M	LUKE	Yes.
M	YODA	Unexpected this is, and unfortunate...
M	LUKE	Unfortunate that I know the truth? No. Unfortunate that you rushed to face him... that incomplete was your training. Not ready for the burden were you.
M	LUKE	Well, I'm sorry.
M	YODA	Remember, a Jedi's strength flows from the Force. But beware. Anger, fear, aggression. The dark side are they. Once you start down the dark path, forever will it dominate your destiny.
M	YODA	Luke...Luke...Do not...Do not underestimate the powers of the Emperor, or suffer your father's fate, you will. Luke, when gone am I (cough), the last of the Jedi will you be. Luke, the Force runs strong in your family. Pass on what you have learned, Luke... (with great effort) There is... another...Sky...Sky...walker.
M	LUKE	I can't do it, Artoo. I can't go on alone.
M	BEN (OS)	Yoda will always be with you.
M	LUKE	Obi-Wan! Why didn't you tell me?
M	LUKE	You told me Vader betrayed and murdered my father.
M	BEN	You father was seduced by the dark side of the Force. He ceased to be Anakin Skywalker and became Darth Vader. When that happened, the good man who was your father was destroyed. So what I have told you was true... from a certain point of view. A certain point of view!
M	BEN	Luke, you're going to find that many of the truths we cling to depend greatly on our own point of view.
M	BEN	I don't blame you for being angry. If I was wrong in what I did, it certainly wouldn't have been for the first time. You see, what happened to your father was my fault.
M	BEN	Anakin was a good friend.
M	BEN	When I first knew him, your father was already a great pilot. But I was amazed how strongly the Force was with him. I took it upon myself to train him as a Jedi. I thought that I could instruct him just as well as Yoda. I was wrong. My pride has had terrible consequences for the galaxy.
M	LUKE	There's still good in him.
M	BEN	I also thought he could be turned back to the good side. It couldn't be done. He is more machine now than man. Twisted and evil.
M	LUKE	I can't do it, Ben.
M	BEN	You cannot escape your destiny.
M	LUKE	I tried to stop him once. I couldn't do it.
M	BEN	Vader humbled you when first you met him, Luke...but that experience was part of your training. It taught you, among other things, the value of patience. Had you not been so impatient to defeat Vader then, you could have finished your training here with Yoda. You would have been prepared.
M	LUKE	But I had to help my friends. And did you help them? It was they who had to save you. You achieved little by rushing back prematurely, I fear. I found out Darth Vader was my father.
M	BEN	To be a Jedi, Luke, you must confront and then go beyond the dark side - the side your father couldn't get past. Impatience is the easiest door - for you, like your father. Only, your father was seduced by what he found on the other side of the door, and you have held firm. You're no longer so reckless now, Luke. You are strong and patient. And now, you must face Darth Vader again!
M	LUKE	I can't kill my own father.
M	BEN	Then the Emperor has already won. You were our only hope.
M	LUKE	Yoda spoke of another.
M	BEN	The other he spoke of is your twin sister.
M	LUKE	But I have no sister.
M	BEN	Hmm. To protect you both from the Emperor, you were hidden from your father when you were born. The Emperor knew, as I did, if Anakin were to have any offspring, they would be a threat to him. That is the reason why your sister remains safely anonymous.
M	LUKE	Leia! Leia's my sister.
M	BEN	Your insight serves you well. Bury your feelings deep down, Luke. They do you credit. But they could be made to serve the Emperor. When your father left, he didn't know your mother was pregnant. Your mother and I knew he would find out eventually, but we wanted to keep you both as safe as possible, for as long as possible. So I took you to live with my brother Owen on Tatooine... and your mother took Leia to live as the daughter of Senator Organa, on Alderaan. politically quite powerful in that system. Leia became a princess by virtue of lineage... no one knew she'd been adopted, of course. But it was a title without real power, since Alderaan had long been a democracy. Even so, the family continued to be politically powerful, and Leia, following in her foster father's path, became a senator as well. That's not all she became, of course... she became the leader of her cell in the Alliance against the corrupt Empire. And because she had diplomatic immunity, she was a vital link for getting information to the Rebel cause. That's what she was doing when her path crossed yours... for her foster parents had always told her to contact me on Tatooine, if her troubles became desperate.
M	LUKE	But you can't let her get involved now, Ben. Vader will destroy her.
M	BEN	She hasn't been trained in the ways of the Jedi the way you have, Luke ... but the Force is strong with her, as it is with all of your family. There is no avoiding the battle. You must face and destroy Vader!
M	HAN	Well, look at you, a general, huh?
M	LANDO	Oh, well, someone must have told them about my little maneuver at the battle of Taanab. Well, don't look at me, pal. I just said you were a fair pilot. I didn't know they were lookin' for somebody to lead this crazy attack. I'm surprised they didn't ask you to do it.
M	HAN	Well, who says they didn't. But I ain't crazy. You're the respectable one, remember?
M	MON MOTHMA	The Emperor has made a critical error and the time for our attack has come.
M	MON MOTHMA	The data brought to us by the Bothan spies pinpoints the exact location of the Emperor's new battle station. We also know that the weapon systems of this Death Star are not yet operational. With the Imperial Fleet spread throughout the galaxy in a vain effort to engage us, it is relatively unprotected. But most important of all, we've learned that the Emperor himself is personally overseeing the final stages of the construction of this Death Star. Many Bothans died to bring us this information. Admiral Ackbar, please.
M	ACKBAR	You can see here the Death Star orbiting the forest Moon of Endor. Although the weapon systems on this Death Star are not yet operational, the Death Star does have a strong defense mechanism. It is protected by an energy shield, which is generated from the nearby forest Moon of Endor. The shield must be deactivated if any attack is to be attempted. Once the shield is down, our cruisers will create a perimeter, while the fighters fly into the superstructure and attempt to knock out the main reactor. General Calrissian has volunteered to lead the fighter attack
M	HAN	Good luck. You're gonna need it.
M	ACKBAR	General Madine.
M	GENERAL MADINE	We have stolen a small Imperial shuttle. Disguised as a cargo ship, and using a secret Imperial code, a strike team will land on the moon and deactivate the shield generator.
M	THREEPIO	Sounds dangerous. I wonder who they found to pull that off.
M	GENERAL MADINE	General Solo, is your strike team assembled?
M	HAN	Uh, my team's ready. I don't have a command crew for the shuttle.
M	HAN	Well, it's gonna be rough, pal. I didn't want to speak for you.
M	HAN (smiles)	That's one.
F	LEIA	Uh, General... count me in. I'm with you, too!
F	LEIA	What is it? Ask me again sometime.
M	HAN	Luke.
M	LUKE	Hi, Han... Chewie.
M	THREEPIO	"Exciting" is hardly the word I would use.
M	HAN	Look. I want you to take her. I mean it. Take her. You need all the help you can get. She's the fastest ship in the fleet.
M	LANDO	All right, old buddy. You know, I know what she means to you. I'll take good care of her. She-she won't get a scratch. All right? Right. I got your promise now. Not a scratch.
M	LANDO	Look, would you get going, you pirate.
M	LANDO	Good luck.
M	HAN	You, too.
M	HAN	You got her warmed?
M	LUKE	Yeah, she's comin' up.
M	HAN	No. I don't think the Empire had Wookiees in mind when they designed her, Chewie.
F	LEIA	Hey, are you awake?
M	HAN	Yeah, I just got a funny feeling. Like I'm not gonna see her again.
M	LEIA (softly)	Come on, General, let's move.
M	HAN	Right. Chewie, let's see what this piece of junk can do. Ready, everybody?
M	LUKE	All set.
M	THREEPIO	Here we go again.
M	HAN	All right, hang on.
M	VADER	What is thy bidding, my Master?
M	EMPEROR	Send the fleet to the far side of Endor. There it will stay until called for.
M	VADER	What of the reports of the Rebel fleet massing near Sullust?
M	EMPEROR	It is of no concern. Soon the Rebellion will be crushed and young Skywalker will be one of us! Your work here is finished, my friend. Go out to the command ship and await my orders.
M	VADER	Yes, my Master.
M	HAN	If they don't go for this, we're gonna have to get outta here pretty quick, Chewie. We have you on our screen now. Please identify.
M	HAN	Shuttle Tydirium requesting deactivation of the deflector shield. Shuttle Tydirium, transmit the clearance code for shield passage.
M	HAN	Transmission commencing.
F	LEIA	Now we find out if that code is worth the price we paid.
M	HAN	It'll work. It'll work.
M	LUKE	Vader's on that ship.
M	HAN	Now don't get jittery, Luke. There are a lot of command ships. Keep your distance though, Chewie, but don't look like you're trying to keep your distance.
M	HAN	I don't know. Fly casual.
M	LUKE	I'm endangering the mission. I shouldn't have come.
M	HAN	It's your imagination, kid. Come on. Let's keep a little optimism here.
M	VADER	Where is that shuttle going? Shuttle Tydirium, what is your cargo and destination? Parts and technical crew for the forest moon.
M	VADER	Do they have a code clearance?
M	PIETT	It's an older code, sir, but it checks out. I was about to clear them.
M	PIETT	Shall I hold them?
M	VADER	No. Leave them to me. I will deal with them myself. As you wish, my lord. (to controller) Carry on.
M	HAN	They're not goin' for it, Chewie. Shuttle Tydirium, deactivation of the shield will commence immediately. Follow your present course.
M	HAN	Okay! I told you it was gonna work. No problem.
M	THREEPIO	Oh, I told you it was dangerous here.
F	LEIA	Shall we try and go around?
M	HAN	It'll take time. This whole party'll be for nothing if they see us.
M	HAN	Chewie and I will take care of this. You stay here.
M	LUKE	Quietly, there might be more of them out there. Hey... it's me.
M	SCOUT #1	Go for help! Go! Great. Come on.
F	LEIA	Over there! Two more of them!
M	LUKE	I see them. Wait, Leia! Quick! Jam their comlink. Center switch!
M	HAN	Hey, wait! Ahhh!
M	LUKE	Move closer!
M	LUKE	Get alongside that one!
M	LUKE	Get him! Keep on that one! I'll take these two!
M	THREEPIO	Oh, General Solo, somebody's coming. Oh!
M	HAN	Luke! Where's Leia? What? She didn't come back?
M	HAN	I thought she was with you.
M	LUKE	We got separated.
M	LUKE	Hey, we better go look for her.
M	HAN	Take the squad ahead. We'll meet at the shield generator at 0300.
M	LUKE	Come on, Artoo. We'll need your scanners.
M	THREEPIO	Don't worry, Master Luke. We know what to do. And you said it was pretty here. Ugh!
F	LEIA	Cut it out!
F	LEIA	I'm not gonna hurt you.
F	LEIA	Well, looks like I'm stuck here. Trouble is, I don't know where here is.
F	LEIA	Well, maybe you can help me. Come on, sit down.
F	LEIA	I promise I won't hurt you. Now come here.
F	LEIA	All right. You want something to eat?
F	LEIA	That's right. Come on. Hmmm?
F	LEIA	Look, it's a hat. It's not gonna hurt you. Look. You're a jittery little thing, aren't you?
F	LEIA	What is it?
M	SCOUT #l	Freeze! Come on, get up!
M	SCOUT #1	Go get your ride and take her back to base.
M	SCOUT #2	Yes, sir.
F	LEIA	Come on, let's get outta here.
M	GUARD	Halt! The Emperor does not wish to be disturbed at the moment.
M	VADER	The Emperor will see me, now!
M	GUARD	The Emperor will see you, now.
M	EMPEROR	I told you to remain on the command ship.
M	VADER	A small Rebel force has penetrated the shield and landed on Endor. Yes, I know. My son is with them. Are you sure?
M	VADER	I have felt him, my Master.
M	EMPEROR	Strange, that I have not. I wonder if your feelings on this matter are clear, Lord Vader.
M	VADER	They are clear, my Master.
M	EMPEROR	Then you must go to the Sanctuary Moon and wait for them. He will come to me?
M	EMPEROR	I have foreseen it. His compassion for you will be his undoing. He will come to you and then you will bring him before me. As you wish.
M	HAN (OS)	Luke! Luke!
M	THREEPIO	Oh, Master Luke.
M	LUKE	There's two more wrecked speeders back there. And I found this.
M	THREEPIO	I'm afraid that Artoo's sensors can find no trace of Princess Leia. I hope she's alright.
M	HAN	What, Chewie? What? Chewie!
M	HAN	Hey, I don't get it.
M	HAN (cont)	Nah, it's just a dead animal, Chewie.
M	LUKE	Chewie, wa-wait! Don't!
M	HAN	Nice work. Great, Chewie! Great! Always thinking with your stomach.
M	LUKE	Will you take it easy? Let's just figure out a way to get out of this thing. (trying to free an arm) Han, can you reach my lightsaber?
M	HAN	Yeah, sure.
M	THREEPIO	Artoo, I'm not sure that's such a good idea. It's a very long dro-o-op!!
M	HAN	Wha--? Hey! Point that thing someplace else.
