M	CHARACTER	DIALOGUE
M	OLD SALIERI	It was incomprehensible. What was God up to? Here I was denying all my natural lust in order to deserve God's gift and there was Mozart indulging his in all directions - even though engaged to be married! - and no rebuke at all! Was it possible I was being tested? Was God expecting me to offer forgiveness in the face of every offense, no matter how painful? That was very possible. All the same, why him? Why use Mozart to teach me lessons in humility? My heart was filling up with such hatred for that little man. For the first time in my life I began to know really violent thoughts. I couldn't stop them.
M	VOGLER	Did you try?
M	OLD SALIERI	Every day. Sometimes for hours I would pray!
M	SALIERI	Please! Please! Send him away, back to Salzburg. For his sake as well as mine.
M	COLLOREDO	No! I won't have him back. But he needs to be here in Salzburg, Your Grace. He needs me and he needs you. Your protection, your understanding.
M	COLLOREDO	Hardly.
M	LEOPOLD	Oh sir, yes! He's about to make the worst mistake of his life. Some little Viennese slut is trying to trick him into marriage. I know my son. He is too simple to see the trap - and there is no one there who really cares for him.
M	COLLOREDO	I'm not surprised. Money seems to be more important to him than loyalty or friendship. He has sold himself to Vienna. Let Vienna look out for him.
M	LEOPOLD	Sir -
M	COLLOREDO	Your son is an unprincipled, spoiled, conceited brat.
M	LEOPOLD	Yes, sir, that's the truth. But don't blame him. The fault is mine. I was too indulgent with him. But not again. Never again, I promise! I implore you - let me bring him back here. I'll make him give his word to serve you faithfully.
M	COLLOREDO	And how will you make him keep it?
M	LEOPOLD	Oh, sir, he's never disobeyed me in anything. Please, Your Grace, give him one more chance.
M	COLLOREDO	You have leave to try.
M	LEOPOLD	Oh, Your Grace - I thank Your Grace! I thank you!
M	LEOPOLD (V.O.)	My dear son.
M	LEOPOLD (V.O.)	I write to you with urgent news. I am coming to Vienna. Take no further steps toward marriage until we meet. You are too gullible to see your own danger. As you honour the father who has devoted his entire life to yours, do as I bid, and await my coming.
F	MOZART	I will.
M	PRIEST	And will you, Constanze Weber, take this man, Wolfgang to be your lawful husband?
F	CONSTANZE	I will.
M	PRIEST	I now pronounce you man and wife.
M	MOZART (V.O.)	Most beloved father, it is done. Do not blame me that I did not wait to see your dear face. I knew you would have tried to dissuade me from my truest happiness and I could not have borne it. Your every word is precious to me. Remember how you have always told me Vienna is the City of Musicians. To conquer here is to conquer Europe! With my wife I can do it. I vow I will become regular in my habits and productive as never before. She is wonderful, Papa, and I know that you will love her. And one day soon when I am a wealthy man, you will come and live with us, and we will be so happy. I long for that day, best of Papas, and kiss your hand a hundred thousand times.
M	JOSEPH	Good morning, Court Composer. This is my niece, the Princess Elizabeth.
M	SALIERI	Your Highness.
M	JOSEPH	She has asked me to advise her on a suitable musical instructor. I think I've come up with an excellent idea.
M	SALIERI	Oh, Your Majesty, it would be such a tremendous honour!
M	JOSEPH	I'm thinking about Herr Mozart. What is your view?
M	SALIERI	An interesting idea, Majesty. But -
M	JOSEPH	Yes?
M	SALIERI	You already commissioned an opera from Mozart.
M	JOSEPH	And the result satisfies.
M	SALIERI	Yes, of course. My concern is to protect you from any suspicion of favouritism.
M	JOSEPH	Ah-ha. Favouritism. But I so want Mozart.
M	SALIERI	I'm sure there is a way, Majesty. Some kind of a little contest. I could perhaps put together a small Committee, and I could see to it naturally that it will select according to Your Majesty's wishes.
M	JOSEPH	You please me, Court Composer. A very clever idea.
M	SALIERI	Sire.
M	JOSEPH	Well. There it is.
F	MOZART	What is this, Herr Chamberlain?
M	VON STRACK	What is what?
F	MOZART	Why do I have to submit samples of my work to some stupid committee? Just to teach a sixteen-year-old girl.
M	VON STRACK	Because His Majesty wishes it.
F	MOZART	Is the Emperor angry with me?
M	VON STRACK	On the contrary.
F	MOZART	Then why doesn't he simply appoint me to the post?
M	VON STRACK	Mozart, you are not the only composer in Vienna.
F	MOZART	No, but I'm the best.
M	VON STRACK	A little modesty would suit you better.
F	MOZART	Who is on this committee?
M	VON STRACK	Kapellmeister Bonno, Count Orsini- Rosenberg and Court Composer Salieri.
F	MOZART	Naturally, the Italians! Of course! Always the Italians!
M	VON STRACK	Mozart -
F	MOZART	They hate my music. It terrifies them. The only sound Italians understand is banality. Tonic and dominant, tonic and dominant, from here to Resurrection! Ba-ba! Ba-ba! Ba-ba! Ba-ba! Anything else is morbid.
M	VON STRACK	Mozart -
F	MOZART	Show them one interesting modulation and they faint. Ohime! Morbidezza! Morbidezza! Italians are musical idiots and you want them to judge my music!
M	VON STRACK	Look, young man, the issue is simple. If you want this post, you must submit your stuff in the same way as all your colleagues.
F	MOZART	Must I? Well, I won't! I tell you straight: I will not!
F	CONSTANZE	I think you're mad! You're really mad!
F	MOZART	Oh, leave me alone.
F	CONSTANZE	One royal pupil and the whole of Vienna will come flocking. We'd be set up for life!
F	MOZART	They'll come anyway. They love me here.
F	CONSTANZE	No, they will not. I know how things work in this city.
F	MOZART	Oh yes? You always know everything.
F	CONSTANZE	Well, I'm not borrowing any more money from my mother, and that's that!
F	MOZART	You borrowed money from your mother?
F	CONSTANZE	Yes!
F	MOZART	Well, don't do that again!
F	CONSTANZE	How are we going to live, Wolfi? Do you want me to go into the streets and beg?
F	MOZART	Don't be stupid.
F	CONSTANZE	All they want to see is your work. What's wrong with that?
F	MOZART	Shut up! Just shut up! I don't need them.
F	CONSTANZE	This isn't pride. It's sheer stupidity!
M	SALIERI	Yes.
M	SERVANT	Excuse me, sir, there is a lady who insists on talking to you.
M	SALIERI	Who is she?
M	SERVANT	She didn't say. But she says it's urgent.
M	SALIERI	Excuse me, my dear.
F	CONSTANZE	Excellency!
M	SALIERI	Madame. How can I help you?
M	SALIERI	Frau Mozart?
F	CONSTANZE	That's right, Your Excellency. I've come on behalf of my hus band. I'm - I'm bringing some samples of his work so he can be considered for the royal appointment.
M	SALIERI	How charming. But why did he not come himself?
F	CONSTANZE	He's terribly busy, sir.
M	SALIERI	I understand.
M	SALIERI	I will look at them, of course, the moment I can. It will be an honour. Please give him my warmest.
F	CONSTANZE	Would it be too much trouble, sir, to ask you to look at them now? While I wait.
M	SALIERI	I'm afraid I'm not at leisure this very moment. Just leave them with me. I assure you they will be quite safe.
F	CONSTANZE	I - I really cannot do that, Your Excellency. You see, he doesn't know I'm here.
M	SALIERI	Really?
F	CONSTANZE	My husband is a proud man, sir. He would be furious if he knew I'd come.
M	SALIERI	Then he didn't send you?
F	CONSTANZE	No, sir. This is my own idea.
M	SALIERI	I see.
F	CONSTANZE	Sir, we really need this job. We're desperate. My husband spends far more than he can ever earn. I don't mean he's lazy - he's not at all - he works all day long. It's just! he's not practical. Money simply slips through his fingers, it's really ridiculous, Your Excellency. I know you help musicians. You're famous for it. Give him just this one post. We'd be forever indebted!
M	SALIERI	Let me offer you some refreshment. Do you know what these are?
M	SALIERI	Cappezzoli di Venere. Nipples of Venus. Roman chestnuts in brandied sugar. Won't you try one? They're quite surprising.
F	CONSTANZE	Oh! They're wonderful.
F	CONSTANZE	Thank you very much, Your Excellency.
M	SALIERI	Don't keep calling me that. It puts me at such a distance. I was not born a Court Composer, you know. I'm from a small town, just like your husband.
M	SALIERI	Are you sure you can't leave that music, and come back again? I have other things you might like.
F	CONSTANZE	That's very tempting, but it's impossible, I'm afraid. Wolfi would be frantic if he found those were missing. You see, they're all originals.
M	SALIERI	Originals?
F	CONSTANZE	Yes.
M	SALIERI	These are originals?
F	CONSTANZE	Yes, sir. He doesn't make copies.
M	OLD SALIERI	Astounding! It was actually beyond belief. These were first and only drafts of music yet they showed no corrections of any kind. Not one. Do you realize what that meant?
M	OLD SALIERI	He'd simply put down music already finished in his head. Page after page of it, as if he was just taking dictation. And music finished as no music is ever finished.
M	OLD SALIERI (V.O.)	Displace one note and there would be diminishment. Displace one phrase, and the structure would fall. It was clear to me. That sound I had heard in the Archbishop's palace had been no accident. Here again was the very voice of God! I was staring through the cage of those meticulous ink- strokes at an absolute, inimitable beauty.
F	CONSTANZE	Is it no good?
M	SALIERI	It is miraculous.
F	CONSTANZE	Oh yes. He's really proud of his work.
F	CONSTANZE	So, will you help him?
M	SALIERI	Tomorrow night I dine with the Emperor. One word from me and the post is his.
F	CONSTANZE	Oh, thank you, sir!
M	SALIERI	Come back tonight.
F	CONSTANZE	Tonight?
M	SALIERI	Alone.
F	CONSTANZE	What for?
M	SALIERI	Some service deserves service in return. No?
F	CONSTANZE	What do you mean?
M	SALIERI	Isn't it obvious?
M	SALIERI	It's a post all Vienna seeks. If you want it for your husband, come tonight.
F	CONSTANZE	But! I'm a married woman!
M	SALIERI	Then don't. It's up to you. Not to be vague, that is the price.
M	SALIERI	Yes.
M	OLD SALIERI	Yes, Father. Yes! So much for my vow of chastity. What did it matter? Good, patient, hard-working, chaste - what did it matter? Had goodness made me a good composer? I realized it absolutely then - that moment: goodness is nothing in the furnace of art. And I was nothing to God.
M	VOGLER	You cannot say that!
M	OLD SALIERI	No? Was Mozart a good man?
M	VOGLER	God's ways are not yours. And you are not here to question Him. Offer him the salt of penitence. He will give you back the bread of eternal life. He is all merciful. That is all you need to know.
M	OLD SALIERI	All I ever wanted was to sing to Him. That's His doing, isn't it? He gave me that longing - then made me mute. Why? Tell me that. If He didn't want me to serve Him with music, why implant the desire, like a lust in my body, then deny me the talent? Go on, tell me! Speak for Him!
M	VOGLER	My son, no one can speak for God.
M	OLD SALIERI	Oh? I thought you did so every day. So speak now. Answer me!
M	VOGLER	I do not claim to unravel the mysteries. I treasure them. As you should.
M	OLD SALIERI	Oh yes, yes, yes, yes, yes! Always the same stale answers! There is no God of Mercy, Father. Just a God of torture.
M	OLD SALIERI (V.O.)	Evening came to that room. I sat there not knowing whether the girl would return or not. I prayed as I'd never prayed before.
M	SALIERI	Dear God, enter me now. Fill me with one piece of true music. One piece with your breath in it, so I know that you love me. Please. Just one. Show me one sign of your favour, and I will show mine to Mozart and his wife. I will get him the royal position, and if she comes, I'll receive her with all respect and send her home in joy. Enter me! Enter me! Please! Te imploro.
M	SERVANT	That lady is back, sir.
M	SALIERI	Show her in. Then go to bed.
F	CONSTANZE	Well, I'm here. My husband has gone to a concert. He didn't think I would enjoy it.
F	CONSTANZE	I do apologize for this afternoon. I behaved like a silly girl. Where shall we go?
M	SALIERI	What?
F	CONSTANZE	Should we stay here? It's a charming room. I love these candlesticks. Were they here earlier? I didn't notice them I suppose I was too nervous.
F	CONSTANZE	Wolfgang was given some candlesticks by King George in England, but they were only wood. Oh, excuse me. Let's not talk about him. What do you think of this? It's real lace. Brussels.
F	CONSTANZE	Well, it's much too good for every day. I keep saying to Wolfi, don't be so extravagant. Presents are lovely, but we can't afford them. It doesn't do any good. The more I tell him, the more he spends. Oh, excuse me! There I go again.
F	CONSTANZE	Do you still want to look at this? Or don't we need to bother anymore? I imagine we don't, really.
M	SALIERI	Go! Go! Go!
M	SALIERI	Show this woman out!
F	CONSTANZE	You shit! You shit! You rotten shit!
F	CONSTANZE	What are you staring at?
M	OLD SALIERI (V.O.)	From now on, we are enemies, You and I!
M	OLD SALIERI	Because You will not enter me, with all my need for you; because You scorn my attempts at virtue; because You choose for Your instrument a boastful, lustful, smutty infantile boy and give me for reward only the ability to recognize the Incarnation; because You are unjust, unfair, unkind, I will block You! I swear it! I will hinder and harm Your creature on earth as far as I am able. I will ruin Your Incarnation.
M	OLD SALIERI (V.O.)	What use after all is Man, if not to teach God His lessons?
F	MOZART	Stanzi! Stanzi! Stanzi-Manzi!
F	MOZART	Sssh!
M	SCHIKANEDER	Stanzi-Manzi-Banzi-Wanzi!
F	MOZART	Sssh! Stay here.
M	SCHIKANEDER	Sssh! You're dishgrashful!
F	MOZART	Stanzi? How's my mouse? Mouse-wouse? I'm back - puss-wuss is back!
F	MOZART	Stanzi!
F	MOZART	What's the matter? What is it? Stanzi!
F	MOZART	Stop it now. Stop it. I've brought some friends to meet you. They're next door waiting. Do we have anything to eat? They're all starving.
F	CONSTANZE	Tell them to go away. I don't want to see anybody.
F	MOZART	What's the matter with you?
F	CONSTANZE	Tell them to go!
F	MOZART	Sssh. What is it? Tell me.
F	CONSTANZE	No!
F	MOZART	Yes!
F	CONSTANZE	I love you! I love you!
F	CONSTANZE	I love you. Please stay with me. I'm frightened.
M	JOSEPH	I don't think you understand me, Court Composer.
M	SALIERI	Majesty, I did. Believe me, it was a most agonizing. decision. But finally, I simply could not recommend Herr Mozart.
M	JOSEPH	Why not?
M	SALIERI	Well, Sire, I made some inquiries in a routine way. I was curious to know why he had so few pupils. It is rather alarming.
M	JOSEPH	Oh?
M	SALIERI	Majesty, I don't like to talk against a fellow musician.
M	JOSEPH	Of course not.
M	SALIERI	I have to tell you, Mozart is not entirely to be trusted alone with young ladies.
M	JOSEPH	Really?
M	SALIERI	As a matter of fact, one of my own pupils - a very young singer - told me she was - er - well!
M	JOSEPH	Yes?
M	SALIERI	Molested, Majesty. Twice, in the course of the same lesson.
M	JOSEPH	Ah-ha. Well. There it is.
M	SERVANT	Sir, there is a Herr Mozart waiting for you in the salon.
M	SALIERI	What does he want?
M	SERVANT	He didn't say, sir. I told him I didn't know when you would be back, but he insisted on waiting.
M	SALIERI	Come with me. And stay in the room.
M	SALIERI	Herr Mozart, what brings you here?
F	MOZART	Your Excellency, you requested some specimens of my work. Here they are. I don't have to tell you how much I need your help. I truly appreciate your looking at these. I have pressures on me - financial pressures. As you know, I'm a married man now.
M	SALIERI	So you are. How is your pretty wife?
F	MOZART	She is well. She is - well, actually, I'm about to become a father! She only told me last night. You are the first to know.
M	SALIERI	I'm flattered. And congratulations to you, of course.
F	MOZART	So you see, this post is very important to me right now.
M	SALIERI	Why didn't you come to me yesterday, Mozart? This is a most painful situation. Yesterday I could have helped you. Today, I can't.
F	MOZART	Why? Here is the music. It's here. I am submitting it humbly. Isn't that what you wanted?
M	SALIERI	I have just come from the palace. The post has been filled.
F	MOZART	Filled? That's impossible! They haven't even seen my work. I need this post. Please, can't you help me? Please!
M	SALIERI	My dear Mozart, there is no one in the world I would rather help, but now it is too late.
F	MOZART	Whom did they choose?
M	SALIERI	Herr Sommer.
F	MOZART	Sommer? Herr Sommer? But the man's a fool! He's a total mediocrity.
M	SALIERI	No, no, no: he has yet to achieve mediocrity.
F	MOZART	But I can't lose this post, I simply can't! Excellency, please. Let's go to the palace, and you can explain to the Emperor that Herr Sommer is an awful choice. He could actually do musical harm to the Princess!
M	SALIERI	An implausible idea. Between you and me, no one in the world could do musical harm to the Princess Elizabeth.
F	MOZART	Look, I must have pupils. Without pupils I can't manage.
M	SALIERI	You don't mean to tell me you are living in poverty?
F	MOZART	No, but I'm broke. I'm always broke. I don't know why.
M	SALIERI	It has been said, my friend, that you are inclined to live somewhat above your means.
F	MOZART	How can anyone say that? We have no cook, no maid. We have no footman. Nothing at all!
M	SALIERI	How is that possible? You give concerts, don't you? I hear they are quite successful.
F	MOZART	They're stupendously successful. You can't get a seat. The only problem is none will hire me. They all want to hear me play, but they won't let me teach their daughters. As if I was some kind of fiend. I'm not a fiend!
M	SALIERI	Of course not.
F	MOZART	Do you have a daughter?
M	SALIERI	I'm afraid not.
F	MOZART	Well, could you lend me some money till you have one? Then I'll teach her for free. That's a promise. Oh, I'm sorry. I'm being silly. Papa's right - I should put a padlock on my mouth. Seriously, is there any chance you could manage a loan? Only for six months, eight at most. After that I'll be the richest man in Vienna. I'll pay you back double. Anything. Name your terms. I'm not joking. I'm working on something that's going to explode like a bomb all over Europe!
M	SALIERI	Ah, how exciting! Tell me more.
F	MOZART	I'd better not. It's a bit of a secret.
M	SALIERI	Come, come, Mozart; I'm interested. Truly.
F	MOZART	Actually, it's a big secret. Oh, this is delicious! What is it?
M	SALIERI	Cream cheese mixed with granulated sugar and suffused with rum. Crema al Mascarpone.
F	MOZART	Ah. Italian?
M	SALIERI	Forgive me. We all have patriotic feelings of some kind.
F	MOZART	Two thousand, two hundred florins is all I need A hundred? Fifty?
M	SALIERI	What exactly are you working on?
F	MOZART	I can't say. Really
M	SALIERI	I don't think you should become known in Vienna as a debtor, Mozart. However, I know a very distinguished gentleman I could recommend to you. And he has a daughter. Will that do?
M	SCHLUMBERG	Quiet! Quiet! Quiet! Down there, damn you. Welcome to you. Pay no attention, they're impossible. Stop it, you willful things! Come this way. Just ignore them. They're perfectly harmless, just willful. I treat them just like my own children.
F	MOZART	And which one of them do you want me to teach?
M	SCHLUMBERG	What? Ha-ha! That's funny - I like it. Which one, eh? You're a funny fellow. Hannah! Come this way.
M	SCHLUMBERG	Hannah!
M	SCHLUMBERG	You won't be teaching this one either. She's my wife.
F	MOZART	Madame.
M	SCHLUMBERG	This is Herr Mozart, my dear. The young man Herr Salieri recommended to teach our Gertrude. Where is she?
M	FRAU SCHLUMBERG	Upstairs.
M	SCHLUMBERG	Gertrude!
M	FRAU SCHLUMBERG	You can't be Herr Mozart!
F	MOZART	I'm afraid I am.
M	SCHLUMBERG	Of course, it's him. Who do you think it is?
M	FRAU SCHLUMBERG	I've heard about you for ages! I thought you must be an old man.
M	SCHLUMBERG	Gertrude!
M	FRAU SCHLUMBERG	It's such an honour for us to have you here, Herr Mozart. And for Gertrude.
M	SCHLUMBERG	People who know say the girl's got talent. You must judge for yourself. If you think she stinks, say so.
M	FRAU SCHLUMBERG	Michael, please! I'm sure you will find her most willing, Herr Mozart. She's really very excited. She's been preparing all morning.
F	MOZART	Really?
M	FRAU SCHLUMBERG	Ah, now! Here she comes.
F	MOZART	Good morning, Fraulein Schlumberg.
M	SCHLUMBERG	Strudel, this is Herr Mozart. Say good morning.
M	FRAU SCHLUMBERG	Perhaps a little refreshment first? A little coffee, or a little chocolate?
F	MOZART	I'd like a little wine, if you have it.
M	FRAU SCHLUMBERG	Wine? Quite right. He's going to need it. Klaus! A bottle of wine. Prestissimo! Now let's go to it. I've been waiting all day for this.
M	SCHLUMBERG	Now sit down all of you and behave. Zeman, Mandi, absolutely quiet! Especially you, Dudelsachs - not one sound from you.
M	SCHLUMBERG	Come on, then. Up and at it!
F	MOZART	Now, please play me something. Just to give me an idea. Anything will do.
F	GERTRUDE	I don't want you to stay.
M	FRAU SCHLUMBERG	That's all right, dear. Just go ahead, as if we weren't here.
F	GERTRUDE	But you are here.
M	SCHLUMBERG	Never mind, Strudel. It's part of music, getting used to an audience. Aren't I right, Herr Mozart?
F	MOZART	Well, yes! on the whole. I suppose. How long have you been playing, Fraulein?
M	FRAU SCHLUMBERG	Just one year.
F	MOZART	Who was your teacher?
M	FRAU SCHLUMBERG	I was. But she quite outgrew the little I could show her.
F	MOZART	Thank you, Madame. Come on now - courage. Play me something you know.
F	MOZART	Perhaps it would be better if we were left alone. I think we're both a little shy.
M	SCHLUMBERG	Nonsense. Strudel's not shy. She's just willful! You give into her now, you'll be sorry later. Strudel - play.
M	SCHLUMBERG	I said play!
M	FRAU SCHLUMBERG	Michael!
F	MOZART	Perhaps if I were to play a little first, it might encourage the Fraulein. Why don't you let me try the instrument? All right?
M	SCHLUMBERG	Stop that, Dudelsachs! Stop it at once! Don't let him disturb you. He'll be all right. He's just a little willful too. Please, please - play. I beg you.
M	SCHLUMBERG	Stop it! STOP!
M	SCHLUMBERG	No, not you. I was talking to the dog. You keep playing. It's most important. He always howls when he hears music. We've got to break them of the habit. Play, please. Please!
M	SCHLUMBERG	That's it. Now keep going, just keep going. Now you stop that noise, Dudelsachs, you stop it this instant! This instant, do you hear me? Keep going, Herr Mozart, that's it. Go on, go on!
M	SCHLUMBERG	Good, good, good! Very good dog! Very, very good Dudelsachs. Quick, quick, dear, bring his biscuit.
M	SCHLUMBERG	Now guess who's going to get a nice reward? Clever, clever Dudi.
M	SCHLUMBERG	It's a miracle, Herr Mozart!
F	MOZART	Well, I'm a good teacher. The next time you wish me to instruct another of your dogs, please let me know. Goodbye, Fraulein, goodbye, Madame! goodbye, Sir!
M	FRAU SCHLUMBERG	What a strange young man.
M	SCHLUMBERG	Yes. He is a little strange.
F	MOZART	Papa! PAPA!
F	MOZART	Why are you here?
M	LEOPOLD	Am I not welcome?
F	MOZART	Of course, welcome! Welcome ten thousand times. Papa! my Papa!
M	LEOPOLD	You're very thin. Does she not feed you, this wife of yours?
F	MOZART	Feed? Well, of course she feeds me. She stuffs me like a goose all day long. She's the best cook in the world. I mean, since Mama. Just wait, you'll see.
M	LEOPOLD	Is she not here?
F	MOZART	I don't know. Stanzi? Stanzi!
M	LEOPOLD	Do you always live like this?
F	MOZART	Oh, yes. Oh, I mean no - not exactly like this. I mean today - just today, Stanzi - I remember now. She had to go - yes! She had to help her mother. Yes, she's like that. Her mother's a very sweet woman, you'll see.
F	MOZART	Oh! I didn't know you were home. Stanzi, this is my father.
F	MOZART	We'll wait, we'll wait. Why don't you get up now, darling?
F	MOZART	She's very tired, poor creature. You know me: I'm a real pig. It's not so easy cleaning up after me.
M	LEOPOLD	Don't you have a maid?
F	MOZART	Oh we could, if we wanted to, but Stanzi won't hear of it. She wants to do everything herself.
M	LEOPOLD	How is your financial situation?
F	MOZART	It couldn't be better.
M	LEOPOLD	That's not what I hear.
F	MOZART	What do you mean? It's wonderful. Really, it's - it's marvelous! People love me here.
M	LEOPOLD	They say you're in debt.
F	MOZART	Who? Who says that? Now that's a malicious lie!
M	LEOPOLD	How many pupils do you have?
F	MOZART	Pupils?
M	LEOPOLD	Yes.
F	MOZART	Yes.
M	LEOPOLD	How many?
F	MOZART	I don't know. It's not important. I mean, I don't want pupils. They get in the way. I've got to have time for composition.
M	LEOPOLD	Composition doesn't pay. You know that.
F	MOZART	This one will.
M	LEOPOLD	What's that?
F	MOZART	Oh, let's not talk about it.
M	LEOPOLD	Why not?
F	MOZART	It's a secret.
M	LEOPOLD	You don't have secrets from me.
F	MOZART	It's too dangerous, Papa. But they're going to love it. Ah, there she is!
F	MOZART	My Stanzi - look at her! Isn't she beautiful? Come on now, confess, Papa. Could you want a prettier girl for a daughter?
F	CONSTANZE	Stop it, Wolfi. I look dreadful. Welcome to our house, Herr Mozart.
F	MOZART	He's not Herr Mozart. Call him Papa.
M	LEOPOLD	I see that you're expecting.
F	CONSTANZE	Oh, yes.
M	LEOPOLD	When, may I ask?
F	CONSTANZE	In three months! Papa.
F	MOZART	Isn't that marvelous? We're delighted.
M	LEOPOLD	Why didn't you mention it in your letters?
F	MOZART	Didn't I? I thought I did. I'm sure I did.
F	CONSTANZE	May I offer you some tea, Herr Mozart?
F	MOZART	Tea? Who wants tea? Let's go out! This calls for a feast. You don't want tea, Papa. Let's go dancing. Papa loves parties, don't you?
F	CONSTANZE	Wolfi!
F	MOZART	What? How can you be so boring? Tea!
F	CONSTANZE	Wolfi, I think your father's tired. I'll cook us something here.
M	LEOPOLD	Thank you. That'll be fine. Don't spend any money on me.
F	MOZART	Why not? Oh, come, Papa! What better way could I spend it than on you? My kissable, missable, suddenly visible Papa!
