M	CHARACTER	DIALOGUE
M	SCHIKANEDER	No, no! You both lost. You both lost. You both have to forfeit. And the penalty is you must exchange your wigs.
M	LEOPOLD	No, please! This is ridiculous! No, please!
M	LEOPOLD	No, really!
F	MOZART	This is just a game, Papa.
F	CONSTANZE	This is just a game, Papa!
M	BYSTANDERS	This is just a game, Papa!
F	MOZART	Oh no, Papa, please! Don't spoil the fun. Come on. Here, take mine.
M	SCHIKANEDER	Herr Mozart, why don't you name your son's penalty?
F	MOZART	Yes, Papa, name it. Name it. I'll do anything you say!
M	LEOPOLD	I want you to come back with me to Salzburg, my son.
M	SCHIKANEDER	What did he say? What did he say?
F	MOZART	Papa, the rule is you can only give penalties that can be performed in the room.
M	LEOPOLD	I'm tired of this game. Please play without me.
F	MOZART	But my penalty. I've got to have a penalty.
M	SCHIKANEDER	I've got a good one. I've got the perfect one for you. Come over here.
M	SCHIKANEDER	Now, I want you to play our tune - sitting backwards.
F	MOZART	Oh, that's really too easy. Any child can do that.
M	SCHIKANEDER	And a fugue in the manner of Sebastian Bach.
M	GUESTS	Another! Do another! Someone else.
F	MOZART	Give me a name. Who shall I do? Give me a name.
M	GUESTS	Gluck! Haydn! Frederic Handel!
F	CONSTANZE	Salieri! Do Salieri!
F	MOZART	Now that's hard. That's very hard. For Salieri one has to face the right way around.
M	OLD SALIERI	Go on. Mock me. Laugh, laugh!
M	OLD SALIERI (V.O.)	That was not Mozart laughing, Father. That was God. That was God! God laughing at me through that obscene giggle. Go on, Signore. Laugh. Rub my nose in it. Show my mediocrity for all to see. You wait! I will laugh at You! Before I leave this earth, I will laugh at You! Amen!
F	CONSTANZE	Wolfi! Wolfgang!
F	MOZART	What is it?
F	CONSTANZE	There's a young girl to see you.
F	MOZART	What does she want?
F	CONSTANZE	I don't know.
F	MOZART	Well, ask her!
F	CONSTANZE	She won't talk to me. She says she has to speak to you.
F	MOZART	Oh, damn!
F	MOZART	Yes?
M	LORL	Are you Herr Mozart?
F	MOZART	That's right.
M	LORL	My name is Lorl, sir. I'm a maidservant. I was asked to come here and offer my services to you.
F	MOZART	What?
M	LORL	They'll be paid for by a great admirer or yours who wishes to remain anon - anonymous.
F	CONSTANZE	What do you mean? What admirer?
M	LORL	I can't tell you that, ma'am.
F	MOZART	Are you saying that someone is paying you to be our maid and doesn't want us to know who he is?
M	LORL	Yes. I can live in or out just as you wish.
F	MOZART	Papa, is this your idea?
M	LEOPOLD	Mine?
F	MOZART	Are you playing a trick on me?
M	LEOPOLD	I never saw this girl in my life. Is this a kind of joke?
M	LORL	Not at all, sir. And I was told to wait for an answer.
M	LEOPOLD	Young woman, this won't do at all. My son can't possibly accept such an offer, no matter how generous, unless he knows who is behind it.
M	LORL	But I really can't tell you, sir.
M	LEOPOLD	Oh, this is ridiculous.
F	CONSTANZE	What is ridiculous? Wolfi has many admirers in Vienna. They love him here. People send us gifts all the time.
M	LEOPOLD	But you can't take her without reference. It's unheard of!
F	CONSTANZE	Well, this is none of your business. Whoever sent you is going to pay, no?
M	LORL	That's right, ma'am.
M	LEOPOLD	So now we are going to let a perfect stranger into the house?
F	CONSTANZE	Who is we? Who is letting who? Could you please wait outside?
M	LORL	Yes, ma'am.
F	CONSTANZE	Look, old man, you stay out of this. We spend a fortune on you, more than we can possibly afford, and all you do is criticize, morning to night. And then you think you can -
F	MOZART	Stanzi!
F	CONSTANZE	No, it's right he should hear. I'm sick to death of it. We can't do anything right for you, can we?
M	LEOPOLD	Never mind. You won't have to do anything for me ever again. I'm leaving!
F	MOZART	Papa!
M	LEOPOLD	Don't worry, I'm not staying here to be a burden.
F	MOZART	No one calls you that.
M	LEOPOLD	She does. She says I sleep all day.
F	CONSTANZE	And so you do! The only time you come out is to eat.
M	LEOPOLD	And what do you expect? Who wants to walk out into a mess like this every day?
F	CONSTANZE	Oh, now I'm a bad housekeeper!
M	LEOPOLD	So you are! The place is a pigsty all the time.
F	CONSTANZE	Do you hear him? Do you?
F	CONSTANZE	When can you start?
M	LORL	Right away, ma'am.
F	CONSTANZE	Good! Come in. You'll start with that room there. It's filthy!
M	LEOPOLD	Sorry, sorry! I'm sorry I spoke! I'm just a provincial from Salzburg. What do I know about smart Vienna? Parties all night, every night. Dancing and drinking like idiot children!
M	LEOPOLD (O.S.)	Dinner at eight! Dinner at ten! Dinner when anyone feels like it! If anyone feels like it!
M	LORL	They're out every night, sir. Till all hours.
M	LORL	Oh, thank you, sir.
M	SALIERI	Do any pupils come to the house?
M	LORL	Not that I've seen.
M	SALIERI	Then how does he pay for all this? Does he work at all?
M	LORL	Oh, yes, sir, all day long. He never leaves the house until evening. He just sits there, writing and writing. He doesn't even eat.
M	SALIERI	Really? What is it he's writing?
M	LORL	Oh, I wouldn't know that, sir.
M	SALIERI	Of course not. You're a good girl. You're very kind to do this. Next time you're sure they'll be out of the house, let me know, will you?
M	LORL	Oh, thank you, sir!
M	LORL	I think I've found out about the money, sir.
M	SALIERI	Yes what?
M	LORL	He kept seven snuff boxes in here. I could swear they were all gold. And now look there's only one left. And inside, sir, look - I counted them - tickets from the pawnshop. Six of them.
M	SALIERI	Where does he work?
M	LORL	In there, sir.
M	JOSEPH	Bravo, Mozart. Most charming. Yes, indeed. Clever man.
F	MOZART	Thank you, Sire!
M	VON SWIETEN	Well done, Mozart. Really quite fine.
F	MOZART	Baron!
F	MOZART	Majesty, may I ask you to do me the greatest favour?
M	JOSEPH	What is it?
F	MOZART	May I introduce my father? He is on a short visit here and returning very soon to Salzburg. He would so much like to kiss your hand. It would make his whole stay so memorable for him.
M	JOSEPH	Ah! By all means.
M	LEOPOLD	Your Majesty.
M	JOSEPH	Good evening. We have met before, Herr Mozart.
M	LEOPOLD	That's right, Your Majesty. Twenty years ago. No, twenty-two! twenty- three! And I remember word for word what you said to me. You said - you said --
M	JOSEPH	Bravo?
M	LEOPOLD	No! Yes, 'bravo,' of course 'bravo'! Everybody always says 'bravo' when Wolfi plays. Like the King of England. When we played for the King of England, he got up at the end and said, 'Bravo! Bravo! Bravo!' three times. Three bravo's. And the Pope four! Four bravo's from the Holy Father, and one 'bellissimo.'
F	MOZART	Father -
M	LEOPOLD	Hush! I'm talking to His Majesty. Your Majesty, I wish to express only one thing - that you who are the Father of us all, could teach our children the gratitude they owe to fathers. It is not for nothing that the Fifth Commandment tells us: 'Honour your Father and Mother, that your days may be long upon the earth.'
M	JOSEPH	Ah-ha. Well. There it is.
M	SALIERI	I've just learned something that might be of interest to you, Herr Director.
M	ORSINI-ROSENBERG	Yes?
M	SALIERI	Mozart is writing a new opera. An Italian opera.
M	ORSINI-ROSENBERG	Italian?
M	BONNO	Aie!
M	SALIERI	And that's not all. He has chosen for his subject, Figaro. The Marriage of Figaro.
M	ORSINI-ROSENBERG	You mean that play?
M	SALIERI	Exactly.
M	ORSINI-ROSENBERG	He's setting that play to music?
M	SALIERI	Yes.
M	ORSINI-ROSENBERG	You must be mad.
M	BONNO	What is this Marriage of Figaro?
M	ORSINI-ROSENBERG	It's a French play, Kapellmeister. It has been banned by the Emperor.
M	BONNO	Hah!
M	ORSINI-ROSENBERG	Are you absolutely sure?
M	SALIERI	I've seen the manuscript.
M	ORSINI-ROSENBERG	Where?
M	SALIERI	Never mind.
M	VON STRACK	I know we banned this play, but frankly I can't remember why. Can you refresh my memory, Herr Director?
M	ORSINI-ROSENBERG	For the same reason, Herr Chamberlain, that it was banned in France.
M	VON STRACK	Oh yes, yes. And that was?
M	ORSINI-ROSENBERG	Well, the play makes a hero out of a valet. He outwits his noble master and exposes him as a lecher. Do you see the implications? This would be, in a grander situation, as if a Chamberlain were to expose an Emperor.
M	VON STRACK	Ah.
M	LACKEY	Herr Mozart.
M	JOSEPH	Sit down, gentlemen, please.
M	JOSEPH	Mozart, are you aware I have declared the French play of Figaro unsuitable for our theatre? Yes, Sire.
M	JOSEPH	Yet we hear you are making an opera from it. Is this true?
F	MOZART	Who told you this, Majesty?
M	JOSEPH	It is not your place to ask questions. Is it true?
F	MOZART	Well, yes, I admit it is.
M	JOSEPH	Would you tell me why?
F	MOZART	Well, Majesty, it is only a comedy.
M	ORSINI-ROSENBERG	What you think, Mozart, is scarcely the point. It is what His Majesty thinks that counts.
F	MOZART	But, Your Majesty -
M	JOSEPH	Mozart, I am a tolerant man. I do not censor things lightly. When I do, I have good reason. Figaro is a bad play. It stirs up hatred between the classes. In France it has caused nothing but bitterness. My own dear sister Antoinette writes me that she is beginning to be frightened of her own people. I do not wish to see the same fears starting here.
F	MOZART	Sire, I swear to Your Majesty, there's nothing like that in the story. I have taken out everything that could give offense. I hate politics.
M	JOSEPH	I think you are rather innocent, my friend. In these dangerous times I cannot afford to provoke our nobles or our people simply over a theatre piece.
F	MOZART	But, Majesty, this is just a frolic. It's a piece about love.
M	JOSEPH	Ah, love again.
F	MOZART	But it's new, it's entirely new. It's so new, people will go mad for it. For example, I have a scene in the second act - it starts as a duet, just a man and wife quarreling. Suddenly the wife's scheming little maid comes in unexpectedly - a very funny situation. Duet turns into trio. Then the husband's equally screaming valet comes in. Trio turns into quartet. Then a stupid old gardener - quartet becomes quintet, and so on. On and on, sextet, septet, octet! How long do you think I can sustain that?
M	JOSEPH	I have no idea.
F	MOZART	Guess! Guess, Majesty. Imagine the longest time such a thing could last, then double it.
M	JOSEPH	Well, six or seven minutes! maybe eight!
F	MOZART	Twenty, sire! How about twenty? Twenty minutes of continuous music. No recitatives.
M	VON SWIETEN	Mozart -
F	MOZART	Sire, only opera can do this. In a play, if more than one person speaks at the same time, it's just noise. No one can understand a word. But with music, with music you can have twenty individuals all talking at once, and it's not noise - it's a perfect harmony. Isn't that marvelous?
M	VON SWIETEN	Mozart, music is not the issue here. No one doubts your talent. It is your judgment of literature that's in question. Even with the politics taken out, this thing would still remain a vulgar farce. Why waste your spirit on such rubbish? Surely you can choose more elevated themes?
F	MOZART	Elevated? What does that mean? Elevated! The only thing a man should elevate is - oh, excuse me. I'm sorry. I'm stupid. But I am fed up to the teeth with elevated things! Old dead legends! How can we go on forever writing about gods and legends?
M	VON SWIETEN	Because they do. They go on forever - at least what they represent. The eternal in us, not the ephemeral. Opera is here to ennoble us. You and me, just as much as His Majesty.
M	BONNO	Bello! Bello, Barone. Veramente.
F	MOZART	Oh, bello, bello, bello! Come on now, be honest. Wouldn't you all rather listen to your hairdressers than Hercules? Or Horatius? Or Orpheus? All those old bores! people so lofty they sound as if they shit marble!
M	VON SWIETEN	What?
M	VON STRACK	Govern your tongue, sir! How dare you?
F	MOZART	Forgive me, Majesty. I'm a vulgar man. But I assure you, my music is not.
M	JOSEPH	You are passionate, Mozart! But you do not persuade.
F	MOZART	Sire, the whole opera is finished. Do you know how much work went into it?
M	BONNO	His Majesty has been more than patient, Signore.
F	MOZART	How can I persuade you if you won't let me show it?
M	ORSINI-ROSENBERG	That will do, Herr Mozart!
F	MOZART	Just let me tell you how it begins.
M	VON STRACK	Herr Mozart -
F	MOZART	May I just do that, Majesty? Show you how it begins? Just that?
M	JOSEPH	Please.
F	MOZART	Look! There's a servant, down on his knees. Do you know why? Not from any oppression. No, he's simply measuring a space. Do you know what for? His bed. His wedding bed to see if it will fit.
M	ORSINI-ROSENBERG	Well, Mozart is already rehearsing.
M	SALIERI	Incredible.
M	ORSINI-ROSENBERG	The Emperor has given him permission.
M	BONNO	Si, si! Veramente.
M	SALIERI	Well, gentlemen, so be it. In that case I think we should help Mozart all we can and do our best to protect him against the Emperor's anger.
M	ORSINI-ROSENBERG	What anger?
M	SALIERI	About the ballet.
M	ORSINI-ROSENBERG	Ballet? What ballet?
M	SALIERI	Excuse me - didn't His Majesty specifically forbid ballet in his opera?
M	ORSINI-ROSENBERG	Yes, absolutely. Is there a ballet in Figaro?
M	SALIERI	Yes, in the third act.
M	ORSINI-ROSENBERG	Mozart! Herr Mozart, may I have a word with you please. Right away.
F	MOZART	Certainly, Herr Director.
F	MOZART	Five minutes, please!
M	ORSINI-ROSENBERG	Did you not know that His Majesty has expressly forbidden ballet in his operas?
F	MOZART	Yes, but this is not a ballet. This is a dance at Figaro's wedding.
M	ORSINI-ROSENBERG	Exactly. A dance.
F	MOZART	But surely the Emperor didn't mean to prohibit dancing when it's part of the story. It is dangerous for you to interpret His Majesty's edicts. Give me your score, please.
M	ORSINI-ROSENBERG	Thank you.
F	MOZART	What are you doing?
F	MOZART	What are you doing, Herr Director?
M	ORSINI-ROSENBERG	Taking out what you should never have put in.
M	SERVANT	Herr Mozart.
F	MOZART	Please! Please. I've no one else to turn to. Please!
M	SALIERI	Wolfgang, what is it? Sta calmo, per favore. What's the matter?
F	MOZART	It's unbelievable! The Director has actually ripped out a huge section of my music. Pages of it.
M	SALIERI	Really? Why?
F	MOZART	I don't know. They say I've got to re-write the opera, but it's perfect as it is. I can't rewrite what's perfect. Can't you talk to him?
M	SALIERI	Why bother with Orsini-Rosenberg? He's obviously no friend of yours.
F	MOZART	Oh, I could kill him! I mean really kill him. I actually threw the entire opera on the fire, he made me so angry!
M	SALIERI	You burned the score?
F	MOZART	Oh no! My wife took it out in time.
M	SALIERI	How fortunate.
F	MOZART	It's not fair that a man like that has power over our work.
M	SALIERI	But there are those who have power over him. I think I'll take this up with the Emperor.
F	MOZART	Oh, Excellency, would you?
M	SALIERI	With all my heart, Mozart.
F	MOZART	Thank you! Oh, thank you.
M	SALIERI	No, no, no, Herr Mozart, please. It's not a holy relic.
M	OLD SALIERI	I'm sure I don't need to tell you I said nothing whatever to the Emperor. I went to the theatre ready to tell Mozart that His Majesty had flown into a rage when I mentioned the ballet, when suddenly, to my astonishment, in the middle of the third act, the Emperor - who never attended rehearsals - suddenly appeared.
M	JOSEPH	What is this? I don't understand. Is it modern?
M	BONNO	Majesty, the Herr Director, he has removed a balleto that would have occurred at this place.
M	JOSEPH	Why?
M	ORSINI-ROSENBERG	It is your regulation, Sire. No ballet in your opera.
M	JOSEPH	Do you like this, Salieri?
M	SALIERI	It is not a question of liking, Your Majesty. Your own law decrees it, I'm afraid.
M	JOSEPH	Well, look at them.
M	JOSEPH	No, no, no! This is nonsense. Let me hear the scene with the music.
M	ORSINI-ROSENBERG	But, Sire -
M	JOSEPH	Oblige me.
M	ORSINI-ROSENBERG	Yes, Majesty.
M	ORSINI-ROSENBERG	Can we see the scene with the music back, please?
F	MOZART	Oh yes, certainly. Certainly, Herr Director!
F	MOZART	Ladies and gentlemen, we're going from where we stopped. The Count: Anches so. Right away, please!
M	JOSEPH	What I hoped by that edict, Director, was simply to prevent hours of dancing like in French opera. There it is endless, as you know.
M	ORSINI-ROSENBERG	Quite so, Majesty.
M	OLD SALIERI	So Figaro was produced in spite of me. And in spite of me, a wonder was revealed. One of the true wonders of art. The restored third act was bold and brilliant. The fourth was a miracle.
M	OLD SALIERI (V.O.)	I saw a woman disguised in her maid's clothes hear her husband speak the first tender words he has offered her in years, only because he thinks she is someone else. I heard the music of true forgiveness filling the theatre, conferring on all who sat there a perfect absolution. God was singing through this little man to all the world - unstoppable - making my defeat more bitter with each passing bar.
M	OLD SALIERI	And then suddenly - a miracle!
M	OLD SALIERI	Father, did you know what that meant? With that yawn I saw my defeat turn into a victory. And Mozart was lucky the Emperor only yawned once. Three yawns and the opera would fail the same night; two yawns, within a week at most. With one yawn the composer could still get -
F	MOZART	Nine performances! Nine! That's all it's had - and withdrawn.
M	SALIERI	I know; it's outrageous. Still, if the public doesn't like one's work one has to accept the fact gracefully.
F	MOZART	But what is it they don't like?
M	SALIERI	Well, I can speak for the Emperor. You made too many demands on the royal ear. The poor man can't concentrate for more than an hour and you gave him four.
F	MOZART	What did you think of it yourself? Did you like it at all?
M	SALIERI	I think it's marvelous. Truly.
F	MOZART	It's the best opera yet written. I know it! Why didn't they come?
M	SALIERI	I think you overestimate our dear Viennese, my friend. Do you know you didn't even give them a good bang at the end of songs so they knew when to clap?
F	MOZART	I know, I know. Perhaps you should give me some lessons in that.
M	SALIERI	I wouldn't presume. All the same, if it wouldn't be imposing, I would like you to see my new piece. It would be a tremendous honour for me.
F	MOZART	Oh no, the honour would be all mine.
M	SALIERI	Grazie, mio caro, Wolfgang!
F	MOZART	Grazie, a lei, Signor Antonio!
M	OLD SALIERI (V.O.)	What was this? I never saw him excited before by any music but his own. Could he mean it?
M	OLD SALIERI	Would he actually tell me my music had moved him? Was I really going to hear that from his own lips? I found myself actually hurrying the tempo of the finale.
F	MOZART	Well?
M	SCHIKANEDER	Sublime! Utterly sublime!
F	MOZART	That kind of music should be punishable by death.
M	JOSEPH	I believe that is the best opera yet written, my friends. Salieri, you are the brightest star in the musical firmament. You do honour to Vienna and to me.
M	SALIERI	Mozart. It was good of you to come.
F	MOZART	How could I not?
M	SALIERI	Did my work please you?
F	MOZART	How could it not, Excellency?
M	SALIERI	Yes?
F	MOZART	I never knew that music like that was possible.
M	SALIERI	You flatter me.
F	MOZART	Oh no! One hears such sounds and what can one say, but - Salieri!
F	MOZART	Oh. Everybody's here! We've got guests. Good. I've brought some more.
F	MOZART	We'll have a little party. Come in. Come in. You know Herr Schikaneder? This is! a very nice girl.
F	CONSTANZE	Wolfi.
F	MOZART	Yes, my love?
F	CONSTANZE	These gentlemen are from Salzburg.
F	MOZART	Salzburg. We were just talking about Salzburg. If you've come from my friend the Fartsbishop, you've arrived at just the right moment. Because I've got good news for him. I'm done with Vienna. It's over, finished, done with! Done with! Done with!
F	CONSTANZE	Wolfi! Your father is dead.
F	MOZART	What?
F	CONSTANZE	Your father is dead.
M	THE COMMENDATORE	Don Giovanni!
M	OLD SALIERI (V.O.)	So rose the dreadful ghost in his next and blackest opera. There on the stage stood the figure of a dead commander calling out 'Repent! Repent!'
M	OLD SALIERI (V.O.)	And I knew - only I understood - that the horrifying apparition was Leopold, raised from the dead. Wolfgang had actually summoned up his own father to accuse his son before all the world. It was terrifying and wonderful to watch.
M	OLD SALIERI	Now a madness began in me. The madness of a man splitting in half. Through my influence I saw to it Don Giovanni was played only five times in Vienna. But in secret I went to every one of those five - all alone - unable to help myself, worshipping sound I alone seemed to hear.
M	OLD SALIERI (V.O.)	And hour after hour, as I stood there, understanding even more clearly how that bitter old man was still possessing his poor son from beyond the grave, I began to see a way - a terrible way - I could finally triumph over God, my torturer.
M	EMMANUEL SCHIKANEDER	Impresario de luxe PRESENTS The Celebrated SCHIKANEDER TROUPE OF PLAYERS IN PARODY Music! Mirth! Magic! ALL SONGS AND SPEECHES WRITTEN BY EMMANUEL SCHIKANEDER who personally will appear in every scene!
M	SCHIKANEDER	Who is it?
M	SCHIKANEDER	C-c-c-come in!
M	COMMENDATORE	Don Giovannnnnnnnnni!
M	COMMENDATORE	Down! Down!
M	COMMENDATORE	I'm here! I'm here!
M	COMMENDATORE	Don Giovannnnnnnni!
M	SCHIKANEDER	Who the devil are you? What do you want?
M	COMMENDATORE	I've come to dinnnnnner!
M	SCHIKANEDER	Dinner? How dare you? I am a nobleman. I only dine with people of my own height.
M	COMMENDATORE	Are you drunk? You invited me. And my horse. Here he is. Ottavio!
M	COMMENDATORE	Whoa! Whoa! Stop it!
M	FIRST LADY	Be careful!
M	SECOND LADY	Be careful!
M	THIRD LADY	Be careful!
M	ALL THREE TOGETHER	Hold tight now!
M	COMMENDATORE	Leave me alone! Stop it! I'm a famous horseman.
M	OTTAVIO	And I'm a famous horse!
M	FIRST LADY	He's adorable!
M	SECOND LADY	Adorable!
M	THIRD LADY	Adorable!
M	THREE LADIES	Give me your hoof, my darling, And I'll give you my heart! Take me to your stable, And never more we'll part!
M	OTTAVIO	I'm shy and very bashful. I don't know what to say.
M	THREE LADIES	Don't hesitate a second. Just answer yes and neigh.
M	COMMENDATORE	Stop it. What are you doing? Remember who you are! You're a horse and they are whores.
M	SCHIKANEDER	This is ridiculous. I won't have any of it. You're turning my house into a circus!
M	SCHIKANEDER	Shut up. Women, women, women! I'm sick to death of them.
M	SOPRANO	Dash me! Bash me! Lash me! Flay me! Slay me! At last I will be freed by death!
M	COMMENDATORE	Shut up.
M	SOPRANO	Kill me! Kill me! Kill me! Kill me! At last I shall be freed by death. At last I shall be freed by dea -
M	EIGHT DWARVES	We're going to make a soprano stew! We're going to make a soprano stew! And when you make a soprano stew! Any stupid soprano will do! Any stew- stew-stew-stew-stew! Any stewpid soprano will do!
M	FIRST LADY	Behold!
M	SECOND LADY	Behold!
M	THIRD LADY	Behold!
M	COMMENDATORE	How long does it take to cook a soprano?
M	DWARVES	Five hours, five minutes, five seconds.
M	COMMENDATORE	I can't wait that long. I'm starving!
M	OTTAVIO	So am I.
M	SCHIKANEDER	In the pot, I have got a good dinner. Not a sausage or stew, but a singer. Not a sausage or stew but a singer. Is the treat that I'll eat for my meat!
M	COMMENDATORE	Oh shut up. I'm sick to death of that tune.
M	THE THREE GIRLS	Give me your hoof, my darling, and I'll give you my heart.
M	COMMENDATORE	Shut up. I'm sick of that one too.
M	COMMENDATORE	And that one, too!
M	SOPRANO	Oil me! Broil me! Boil me!
M	SOPRANO	Soil me! Foil me! Spoil me!
M	HORSE	I can't eat her. Sopranos give me hiccups. I want some hay!
M	FIRST LADY	Hey!
M	SECOND LADY	Hey!
M	THIRD LADY	Hey!
M	SCHIKANEDER	Hey what?
M	ALL THREE LADIES	Give him some hay, my darling, and I'll give you my heart!
M	COMMENDATORE	Shut up.
M	SCHIKANEDER	Leporello! We want some hay - prestissimo! Leporello - where are you?
M	FIRST LADY	Behold!
M	SECOND LADY	Behold!
M	THIRD LADY	Behold!
M	COMMENDATORE	Hey! Hey! Watch out!
M	COMMENDATORE	Whoa! Whoa, Ottavio! Whoa!
M	SCHIKANEDER	Well, how do you like that?
F	MOZART	Wonderful! He liked the monkey, didn't you?
M	SCHIKANEDER	Yes, well, it's all good fun.
F	MOZART	I liked the horse.
M	SCHIKANEDER	Isn't he marvelous? He cost me a bundle, that horse, but he's worth it. I tell you, if you'd played Don Giovanni here it would have been a great success. I'm not joking. These people aren't fools. You could do something marvelous for them.
F	MOZART	I'd like to try them someday. I'm not sure I'd be much good at it.
M	SCHIKANEDER	'Course you would. You belong here, my boy, not the snobby Court. You could do anything you felt like here - the more fantastic the better! That's what people want, you know: fantasy. You do a big production, fill it with beautiful magic tricks and you'll be absolutely free to do anything you want. Of course, you'd have to put a fire in it, because I've got the best fire machine in the city and a big flood - I can do you the finest water effects you ever saw in your life. Oh, and a few trick animals. You'd have to use those.
F	MOZART	Animals?
M	SCHIKANEDER	I tell you I picked up a snake in Dresden last week - twelve foot long - folds up to six inches, just like a paper fan. It's a miracle.
M	SCHIKANEDER	I'm serious. You write a proper part for me with a couple of catchy songs, I'll guarantee you'll have a triumph- de-luxe. Mind you, it'll have to be in German.
F	MOZART	German!
M	SCHIKANEDER	Of course! What else do you think they speak here?
F	MOZART	No, no, I love that. I'd want it to be in German. I haven't done anything in German since Seraglio.
M	SCHIKANEDER	So there you are. What do you say?
F	CONSTANZE	How much will you pay him?
M	SCHIKANEDER	Ah. Well. Ah, I see you've got your manager with you. Well, Madame, how about half the receipts?
F	MOZART	Half the receipts! Stanzi!
F	CONSTANZE	I'm talking about now. How much will you give him now? Down payment?
M	SCHIKANEDER	Down payment? Who do you think I am? The Emperor? Whoops, I have to go.
