M	CHARACTER	DIALOGUE
M	SCHIKANEDER	Stay where you are. You're going to like this next one. We'll speak again. Triumph-de-luxe, my boy!
F	CONSTANZE	You're not going to do this?
F	MOZART	Why not? Half the house!
F	CONSTANZE	pays now, or you don't do it.
F	MOZART	Oh, Stanzi.
F	CONSTANZE	I don't trust this man. And I didn't like what he did with your opera. It was common.
F	MOZART	Well, you liked it, didn't you? Monkey-flunki-punki.
F	CONSTANZE	Half the house! You'll never see a penny. I want it here, in my hand.
F	MOZART	Stanzi-manzi, I'll put it in your hand!
F	CONSTANZE	Shut up! I'll not let you put anything in my hand until I see some money.
M	SCHLUMBERG	Herr Mozart. What a surprise. What can I do for you?
F	MOZART	Is my pupil still anxious to learn the art of music?
M	SCHLUMBERG	Well, your pupil is married and living in Mannheim, young man.
F	MOZART	Really? Perhaps your dear wife might care to profit from my instruction?
M	SCHLUMBERG	What is this, Mozart? What's the matter with you?
F	MOZART	Well. Since it appears nobody is eager to hire my services, could you favour me with a little money instead?
M	SCHLUMBERG	What for?
F	MOZART	If a man cannot earn, he must borrow.
M	SCHLUMBERG	Well, this is hardly the way to go about it.
F	MOZART	No doubt, sir. But I am endowed with talent, and you with money. If I offer mine, you should offer yours.
M	SCHLUMBERG	I'm sorry. No.
F	MOZART	Please. I'll give it back, I promise. Please, sir.
M	SCHLUMBERG	My answer is no, Mozart.
F	MOZART	Please. Please. Please. Please. Please. Please.
M	VON SWIETEN	This is embarrassing, you know. You introduced Mozart to some of my friends and he's begging from practically all of them. It has to stop.
M	SALIERI	I agree, Baron.
M	VON SWIETEN	Can't you think of anyone who might commission some work from him? I've done my best. I got him to arrange some Bach for my Sunday concerts. He got a fee - what I could afford. Can't you think of anyone who might do something for him?
M	SALIERI	No, Baron, no. I'm afraid Mozart is a lost cause. He has managed to alienate practically the whole of Vienna. He is constantly drunk. He never pays his debts. I can't think of one person to whom I dare recommend him.
M	VON SWIETEN	How sad. It's tragic, isn't it? Such a talent.
M	SALIERI	Indeed. Just a moment - as a matter of fact I think I do know someone who could commission a work from him. A very appropriate person to do so. Yes.
M	SALIERI	Herr Mozart?
M	SALIERI	I have come to commission work from you.
F	MOZART	What work?
M	SALIERI	A Mass for the dead.
F	MOZART	What dead? Who is dead?
M	SALIERI	A man who deserved a Requiem Mass and never got one.
F	MOZART	Who are you?
M	SALIERI	I am only a messenger. Do you accept? You will be paid well.
F	MOZART	How much?
M	SALIERI	Fifty ducats. Another fifty when I have the Mass. Do you accept?
F	MOZART	How long will you give me?
M	SALIERI	Work fast. And be sure to tell no one what you do. You will see me again soon.
F	CONSTANZE	Wolfi? Wolfi!
F	CONSTANZE	Who was that?
F	MOZART	No one.
F	CONSTANZE	I heard voices.
F	CONSTANZE	What's the matter?
F	CONSTANZE	What's that? Oh! Who gave you this? How much is it? Wolfi, who gave you this?
F	MOZART	I'm not telling you.
F	CONSTANZE	Why not?
F	MOZART	You'd think I was mad.
M	OLD SALIERI	My plan was so simple, it terrified me. First I must get the Death Mass and then achieve the death.
M	VOGLER	What?
M	OLD SALIERI	His funeral - imagine it! The Cathedral, all Vienna sitting there. His coffin, Mozart's little coffin in the middle. And suddenly in that silence, music. A divine music bursts out over them all, a great Mass of Death: Requiem Mass for Wolfgang Mozart, composed by his devoted friend Antonio Salieri. What sublimity! What depth! What passion in the music! Salieri has been touched by God at last. And God, forced to listen. Powerless - powerless to stop it. I at the end, for once, laughing at Him. Do you understand? Do you?
M	VOGLER	Yes.
M	OLD SALIERI	The only thing that worried me was the actual killing. How does one do that? How does one kill a man? It's one thing to dream about it. It's very different when you have to do it, with your own hands.
F	CONSTANZE	Wolfi. Wolfi!
F	MOZART	No. Don't answer it!
F	CONSTANZE	Why?
F	MOZART	Tell him I'm not here. Tell him I'm working on it. Come back later.
M	SCHIKANEDER	Am I interrupting something?
F	CONSTANZE	Not at all.
M	SCHIKANEDER	Where's our friend?
F	CONSTANZE	He's not in. But he's working on it. He said to tell you.
M	SCHIKANEDER	I hope so. I need it immediately.
M	SCHIKANEDER	Is he happy with it?
M	SCHIKANEDER	Is this it?
M	SCHIKANEDER	What the devil is this? Requiem Mass? Does he think I'm in the funeral business?
F	MOZART	Leave that alone!
M	SCHIKANEDER	Wolfi!
F	MOZART	Put it down!
M	SCHIKANEDER	What is this?
F	MOZART	Put it down, I said! It's nothing for you.
M	SCHIKANEDER	Oh! I'm sorry! I'm sorry! What have you got for me? Is it finished?
F	MOZART	What?
M	SCHIKANEDER	What? The vaudeville, what'd you think?
F	MOZART	Yes.
M	SCHIKANEDER	Can I see it?
F	MOZART	No.
M	SCHIKANEDER	Why not?
F	MOZART	Because there's nothing to see.
M	SCHIKANEDER	Look, I asked you if we could start rehearsal next week and you said yes.
F	MOZART	Well, we can.
M	SCHIKANEDER	So let me see it. Where is it?
F	MOZART	Here. It's all right here, in my noodle. The rest is just scribbling. Scribbling and bibbling. Bibbling and scribbling. Would you like a drink?
M	SCHIKANEDER	Look, you little clown, do you know how many people I've hired for you? Do you know how many people are waiting?
F	CONSTANZE	Leave him alone!
M	SCHIKANEDER	I'm paying these people. Do you realize that?
F	CONSTANZE	He's doing his best.
M	SCHIKANEDER	I'm paying people just to wait for you. It's ridiculous!
F	CONSTANZE	You know what's ridiculous? Your libretto, that's what's ridiculous. Only an idiot would ask Wolfi to work on that stuff!
M	SCHIKANEDER	Oh yes? And what's so intelligent about writing a Requiem?
F	CONSTANZE	Money! Money!
M	SCHIKANEDER	You're mad! She's mad, Wolfi.
F	CONSTANZE	Oh yes, and who are you? He's worked for Kings. For the Emperor. Who are you?
M	SCHIKANEDER	Listen, Wolfi. Write it. Please. Just write it down. On paper. It's no good to anyone in your head. And fuck the Death Mass.
M	SALIERI	Now calm yourself. Calm. What's the matter with you?
M	LORL	I'm leaving. I'm not working there anymore. I'm scared!
M	SALIERI	Why? What has happened?
M	LORL	You don't know what it's like. Herr Mozart frightens me. He drinks all day, then takes all that medicine and it makes him worse.
M	SALIERI	What medicine?
M	LORL	I don't know. He has pains.
M	SALIERI	Where?
M	LORL	Here, in his stomach. They bend him right over.
M	SALIERI	Is he working?
M	LORL	I'm frightened, sir. Really! When he speaks, he doesn't make any sense. You know he said he saw - he said he saw his father. And his father's dead.
M	SALIERI	Is he working?
M	LORL	I suppose so. He sits there all he time, doing some silly opera.
M	SALIERI	Opera? Opera!
M	LORL	Please don't ask me to go back again. I'm frightened! I'm very, very frightened.
M	SALIERI	Are you sure it's an opera?
F	MOZART	I don't have it yet. It's not finished. I'm sorry, but I need more time.
M	SALIERI	Are you neglecting my request?
F	MOZART	No, no! I promise you, I'll give you a wonderful piece - the best I ever can!
F	MOZART	This is my wife, Stanzi. I've been sick, but I'm all right now. Aren't I?
F	CONSTANZE	Oh yes, sir. He's all right. And he's working on it very hard.
F	MOZART	Give me two more weeks. Please.
M	SALIERI	The sooner you finish, the better your reward. Work!
F	CONSTANZE	Wolfi, I think you really are going mad. You work like a slave for that idiot actor who won't give you a penny and here. This is not a ghost! This is a real man who puts down real money. Why on earth don't you finish it?
F	CONSTANZE	Give me one reason I can understand.
F	MOZART	I can't write it!
F	CONSTANZE	Why not?
F	MOZART	It's killing me.
F	CONSTANZE	No, this is really awful. You're drunk, aren't you? Be honest - tell me - you've been drinking. And I'm so stupid I stay here and listen to you!
F	CONSTANZE	It's not fair! I worry about you all the time. I try to help you all I can and you just drink and talk nonsense and - and frighten me! It's not fair!
F	MOZART	Go back to bed.
F	CONSTANZE	Please! Let me sit here. Let me stay here with you. I promise I won't say all word. I'll just be here, so you know no one's going to hurt you. Please, please!
F	MOZART	Stanzi? Stanzi-marini-bini?
M	FRAU WEBER	She's not coming back, you know. She's gone for good. I did it and I'm proud of it. 'Leave,' I said. 'Right away! Take he child and go, just go. Here's the money! Go to the Spa and get your health back - that's if you can.' I was shocked. Shocked to my foundation. Is that my girl? Can that be my Stanzi? The happy little moppet I brought up, that poor trembling thing? Oh, you monster! No one exists but you, do they? You and your music! Do you know how often she's sat in that very chair, weeping her eyes out of her head because of you? I warned her. 'Choose a man, not a baby,' I said. But would she listen? Who listens? 'He's just a silly boy,' she says. Silly, my arse. Selfish - that's all you are. Selfish! Selfish, selfish, selfish, selfish, selfish.
M	QUEEN OF THE NIGHT	A hellish wrath within my heart is seething! Death and destruction Flame around my throne! If not by thee Sarastro's light be extinguished. Then be thou mine own daughter never more! Rejected be forever! So sundered be forever All the bonds of kin and blood! Hear! Hear! Hear God of Vengeance! Hear thy Mother's vow! The Actors of the Imperial and Royal Privileged Theatre of the Weiden Have the honour to perform THE MAGIC FLUTE A Grand Opera in Two Acts By Emmanuel Schikaneder
M	VOICE	Go back!
M	PAPAGENO	Merciful Gods! If only I knew by which door I came in. Which was it? Was it this one? Come on, tell me!
M	VOICE	Go back!
M	PAPAGENO	Now, I can't go forward and I can't go back. Oh, this is awful!
M	FIRST PRIEST	Man, thou hast deserved to wander forever in the darkest chasms of the earth. The gentle Gods have remitted thy punishment, but yet thou shalt never feel the Divine Content of the consecrated ones.
M	PAPAGENO	Oh well, I'm not alone in that. Just give me a decent glass of wine - that's divine content enough for me. instrument himself.
M	FIRST PRIEST	Man, hast thou no other desire on earth, but just to eat and drink?
M	PAPAGENO	Well!
M	PAPAGENO	Well, actually I do have a rather weird feeling in my heart. Perhaps it's just indigestion. But you know, I really would like - I really do want - something even nicer than food and drink. Now what on earth could that be?
M	ANDANTE	A sweetheart or a pretty little wife is Papageno's wish. A willing, billing, lovey dovey Would be My most tasty little dish. Be my most tasty little dish! Be my most tasty little dish!
M	ALLEGRO	Then that would be eating and drinking I'd live like a Prince without thinking. The wisdom of old would be mine - A woman's much better than wine! Then that would be eating and drinking! The wisdom of old would be mine - A woman's much better than wine. She's much better than wine! She's much better than wine!
M	ANDANTE	A sweetheart or a pretty little wife is Papageno's wish. A willing, billing, lovey dovey Would be My most tasty little dish.
M	ALLEGRO	I need to net one birdie only And I will stop feeling so lonely. But if she won't fly to my aid, Then into a ghost I must fade. I need to net one birdie only But if she won't fly to my aid, Then into a ghost I must fade. To a ghost I must fade! To a ghost I must fade!
M	ANDANTE	A sweetheart or a pretty little wife is Papageno's wish. A willing, billing, lovey dovey Would be My most tasty little dish.
M	ALLEGRO	At present the girls only peck me. Their cruelty surely will wreck me. But one little beak in my own, And I'll up to heaven be flown! At present the girls only peck me. But one little beak in my own, And I'll up to heaven be flown. Up to heaven be flown! Up to heaven be flown!
M	SALIERI	I'll take care of him.
M	SALIERI	I have a carriage. Excuse me.
M	UGLY OLD WOMAN	Here I am, my angel.
M	PAPAGENO	What? Who the devil are you?
M	UGLY OLD WOMAN	I've taken pity on you, my angel. I heard your wish.
M	PAPAGENO	Oh. Well, thank you! How wonderful. Some people get all the luck.
M	UGLY OLD WOMAN	Now you've got to promise me faithfully you'll remain true to me forever. Then you'll see how tenderly your little birdie will love you.
M	PAPAGENO	I can't wait.
M	UGLY OLD WOMAN	Well, promise then.
M	PAPAGENO	What do you mean - now?
M	UGLY OLD WOMAN	Of course now. Right away, before I get any older.
M	PAPAGENO	Well, I don't know! I mean you're a delicious, delightful, delectable little bird, but don't you think you might be just a little tough?
M	UGLY OLD WOMAN	Oh, I'm tender enough for you, my boy. I'm tender enough for you.
F	MOZART	What happened? Is it over?
M	SALIERI	I'm taking you home. You're not well.
F	MOZART	No, no. I have to get back. I have -
M	SALIERI	Thank you. Go.
F	MOZART	Papa! Papa!
M	SALIERI	Come now.
M	SALIERI	Where is your wife?
F	MOZART	Not here! She's not well, either. She went to the Spa.
M	SALIERI	You mean she's not coming back?
F	MOZART	You're so good to me. Truly. Thank you.
M	SALIERI	No, please.
F	MOZART	I mean to come to my opera. You are the only colleague who did.
M	SALIERI	I would never miss anything that you had written. You must know that.
F	MOZART	This is only a vaudeville.
M	SALIERI	Oh no. It is a sublime piece. The grandest operone. I tell you, you are the greatest composer known to me.
F	MOZART	Do you mean that?
M	SALIERI	I do.
F	MOZART	I have bad fancies. I don't sleep well anymore. Then I drink too much, and think stupid things.
M	SALIERI	Are you ill?
F	MOZART	The doctor thinks I am. But -
M	SALIERI	What?
F	MOZART	I'm too young to be so sick.
M	SALIERI	Shall I answer it?
F	MOZART	No! No, it's him!
M	SALIERI	Who?
F	MOZART	The man. He's here.
M	SALIERI	What man?
F	MOZART	Tell him to go away. Tell him I'm still working on it. Don't let him in!
F	MOZART	Wait! Ask him if he'd give me some money now. Tell him if he would, that would help me finish it.
M	SALIERI	Finish what?
F	MOZART	He knows. He knows!
M	SCHIKANEDER	Herr Salieri.
M	SALIERI	Yes, I am looking after him.
M	SCHIKANEDER	Can we come in?
M	SALIERI	Well, he's sleeping now. Better not.
M	SCHIKANEDER	But he's all right?
M	SALIERI	Oh, yes. He's just exhausted. He became dizzy, that's all. We should let him rest.
M	SCHIKANEDER	Well, tell him we were here, won't you?
M	SALIERI	Of course.
M	SCHIKANEDER	And say everything went wonderfully. A triumph-de-luxe - say that! Tell him the audience shouted his name a hundred times.
M	SALIERI	Bene.
M	SCHIKANEDER	I'll call tomorrow.
M	SALIERI	Yes. And congratulations to all of you. It was superb.
M	ACTRESSES	Thank you! Thank you, Excellency!
M	SCHIKANEDER	Oh, by the way, give him this. This is his share. That should cheer him up, eh?
M	SALIERI	Yes, indeed. Goodnight to you all now. It was perfection - truly!
M	ACTRESSES	Goodnight, Your Excellency. Goodnight!
F	MOZART	What happened?
M	SALIERI	He said to give you this. And if you finish the work by tomorrow night, he will pay you another hundred ducats.
F	MOZART	Another? But that's too soon! Tomorrow night? It's impossible! Did he say a hundred?
M	SALIERI	Yes. Can I - could I help you, in any way?
F	MOZART	Would you? Actually, you could.
M	SALIERI	My dear friend, it would be my greatest pleasure.
F	MOZART	But you'd have to swear not to tell a soul. I'm not allowed.
M	SALIERI	Of course.
F	MOZART	You know, it's all here in my head. It's just ready to be set down. But when I'm dizzy like this my eyes won't focus. I can't write.
M	SALIERI	Then, let us try together. I'd regard it as such an honour. Tell me, what is this work?
F	MOZART	A Mass. A Mass for the Dead.
M	OFFICER	What is it?
F	CONSTANZE	I want to go!
M	OFFICER	Where?
F	CONSTANZE	I want to go back to Vienna.
M	OFFICER	Now?
F	CONSTANZE	Yes!
M	OFFICER	Why?
F	CONSTANZE	I feel wrong. I feel wrong being here.
M	OFFICER	What are you talking about?
F	MOZART	Where did I stop?
M	SALIERI	The end of the Recordare - Statuens in parte dextra.
F	MOZART	So now the Confutatis. Confutatis Maledictis. When the wicked are confounded. Flammis acribus addictis. How would you translate that?
M	SALIERI	Consigned to flames of woe.
F	MOZART	Do you believe in it?
M	SALIERI	What?
F	MOZART	A fire which never dies. Burning one forever?
M	SALIERI	Oh, yes.
F	MOZART	Strange!
M	SALIERI	Come. Let's begin.
M	SALIERI	Confutatis Maledictis.
F	MOZART	We ended in F Major?
M	SALIERI	Yes.
F	MOZART	So now - A minor. Suddenly.
F	MOZART	The Fire.
M	SALIERI	What time?
F	MOZART	Common time.
F	MOZART	Start with the voices. Basses first. Second beat of the first measure - A. Con-fu-ta-tis. Second measure, second beat. Ma-le-dic-tis. G-sharp, of course.
M	SALIERI	Yes.
F	MOZART	Third measure, second beat starting on E. Flam-mis a-cri-bus ad-dic-tis. And fourth measure, fourth beat - D. Ma-le-dic-tis, flam-mis a-cri-bus ad- dic-tis. Do you have that?
M	SALIERI	I think so.
F	MOZART	Sing it back.
F	MOZART	Good. Now the tenors. Fourth beat of the first measure - C. Con-fu-ta-tis. Second measure, fourth beat on D. Ma-le-dic-tis. All right?
M	SALIERI	Yes.
F	MOZART	Fourth measure, second beat - F. Flam-mis a-cri-bus ad-dic-tis, flam- mis a-cri-bus ad-dic-tis.
F	MOZART	Now the orchestra. Second bassoon and bass trombone with the basses. Identical notes and rhythm. The first bassoon and tenor trombone -
M	SALIERI	Please! Just one moment.
F	MOZART	It couldn't be simpler.
M	SALIERI	First bassoon and tenor trombone - what?
F	MOZART	With the tenors.
M	SALIERI	Also identical?
F	MOZART	Exactly. The instruments to go with the voices. Trumpets and timpani, tonic and dominant.
M	SALIERI	And that's all?
F	MOZART	Oh no. Now for the Fire. Strings in unison - ostinato on all - like this.
F	MOZART	Second measure on B.
F	MOZART	Do you have me?
M	SALIERI	I think so.
F	MOZART	Show me.
F	MOZART	Good, good - yes! Put it down. And the next measures exactly the same, rising and rising - C to D to E, up to the dominant chord. Do you see?
M	SALIERI	That's wonderful!
F	MOZART	Yes, yes - go on. The Voca Me. Suddenly sotto voce. Write that down: sotto voce, pianissimo. Voca me cum benedictis. Call me among the blessed.
F	MOZART	C Major. Sopranos and altos in thirds. Altos on C. Sopranos above. Vo-ca, vo-ca me, vo-ca me cum be-ne- dic-tis.
M	SALIERI	Sopranos up to F on the second 'Voca'?
F	MOZART	Yes, and on 'dictis'.
M	SALIERI	Yes!
F	MOZART	And underneath, just violins - arpeggio.
F	MOZART	The descending scale in eighth notes, and then back suddenly to the fire again.
F	MOZART	And that's it. Do you have it?
M	SALIERI	You go fast!
F	MOZART	Do you have it?
M	SALIERI	Yes.
F	MOZART	Then let me hear it. All of it. The whole thing from the beginning - now!
F	MOZART	Do you want to rest a bit?
M	SALIERI	Oh no. I'm not tired at all.
F	MOZART	We'll stop for just a moment. Then we'll do the Lacrimosa.
M	SALIERI	I can keep going, I assure you. Shall we try?
F	MOZART	Would you stay with me while I sleep a little?
M	SALIERI	I'm not leaving you.
F	MOZART	I am so ashamed.
M	SALIERI	What for?
F	MOZART	I was foolish. I thought you did not care for my work - or me. Forgive me. Forgive me!
F	CONSTANZE	What are you doing here?
M	SALIERI	Your husband is ill, ma'am. He took sick. I brought him home.
F	CONSTANZE	Why you?
M	SALIERI	I was at hand.
F	CONSTANZE	Well, thank you very much. You can go now.
M	SALIERI	He needs me, ma'am.
F	CONSTANZE	No, he doesn't. And I don't want you here. Just go, please.
M	SALIERI	He asked me to stay.
F	CONSTANZE	And I'm asking you -
F	CONSTANZE	Wolfi, I'm back. I'm still very angry with you, but I missed you so much.
F	CONSTANZE	I'll never leave you again. If you'll just try a little harder to be nice to me. And I'll try to do better, too. We must. We must! This was just silly and stupid.
F	CONSTANZE	What is this?
F	CONSTANZE	Oh no, not this. Not this, Wolfi! You're not to work on this ever again! I've decided.
F	CONSTANZE	This is not his handwriting.
M	SALIERI	No. I was assisting him. He asked me.
F	CONSTANZE	He's not going to work on this anymore. It is making him ill. Please.
F	CONSTANZE	Please.
F	CONSTANZE	Thank you.
M	SALIERI	But - but - but -
F	CONSTANZE	Good night.
F	CONSTANZE	I regret we have no servants to show you out, Herr Salieri. Respect my wish and go.
M	SALIERI	Madame, I will respect his. He asked me to stay here.
F	CONSTANZE	Wolfi? Wolfi?
M	VOGLER	Why? Why? Why? Why add to your misery by confessing to murder? You didn't kill him.
M	OLD SALIERI	I did.
M	VOGLER	No, you didn't!
M	OLD SALIERI	I poisoned his life.
M	VOGLER	But not his body.
M	OLD SALIERI	What difference does that make?
M	VOGLER	My son, why should you want all Vienna to believe you a murderer? Is that your penance? Is it?
M	OLD SALIERI	No, Father. From now on no one will be able to speak of Mozart without thinking of me. Whenever they say Mozart with love, they'll have to say Salieri with loathing. And that's my immortality - at last! Our names will be tied together for eternity - his in fame and mine in infamy. At least it's better than the total oblivion he'd planned for me, your merciful God!
M	VOGLER	Oh my son, my poor son!
M	OLD SALIERI	Don't pity me. Pity yourself. You serve a wicked God. He killed Mozart, not I. Took him, snatched him away, without pity. He destroyed His beloved rather than let a mediocrity like me get the smallest share in his glory. He doesn't care. Understand that. God cares nothing for the man He denies and nothing either for the man He uses. He broke Mozart in half when He'd finished with him, and threw him away. Like an old, worn out flute.
M	LOCAL PRIEST	The Lord giveth. The Lord taketh away. Blessed be the name of the Lord.
M	OLD SALIERI	Why did He do it? Why didn't He kill me? I had no value. What was the use, keeping me alive for thirty-two years of torture? Thirty-two years of honours and awards.
M	OLD SALIERI	Being bowed to and saluted, called 'distinguished - distinguished Salieri' - by men incapable of distinguishing! Thirty-two years of meaningless fame to end up alone in my room, watching myself become extinct. My music growing fainter, all the time fainter, until no one plays it at all. And his growing louder, filling the world with wonder. And everyone who loves my sacred art crying, Mozart! Bless you, Mozart.
M	ATTENDANT	Good morning, Professor! Time for the water closet. And then we've got your favourite breakfast for you - sugar-rolls. He loves those. Fresh sugar-rolls.
M	OLD SALIERI	Goodbye, Father. I'll speak for you. I speak for all mediocrities in the world. I am their champion. I am their patron saint. On their behalf I deny Him, your God of no mercy. Your God who tortures men with longings they can never fulfill. He may forgive me: I shall never forgive Him.
M	OLD SALIERI	Mediocrities everywhere, now and to come: I absolve you all! Amen! Amen! Amen!
