M	CHARACTER	DIALOGUE
M	Supervising Visual Effects Editor	ARTHUR REPOLA Visual Effects Editors HOWARD STEIN, PETER AMUNDSON, BILL KIMBERLIN Assistant Visual Effects Editors ROBERT CHRISOULIS, MICHAEL GLEASON, JAY IGNASZEWSKI, JOE CLASS, TOM SMITH Production Supervisor PATRICIA ROSE DUIGNAN Production Co-Ordinators WARREN FRANKLIN, LAURIE VERMONT Administrative Staff CHRISSE ENGLAND, LAURA KAYSEN, PAULA KARSH, KAREN AYERS, Production Assistants SUSAN FRITZ-MONAHAN, KATHY SHINE, GEOFFREY DeVALOIS Supervisor-Still Photography TERRY CHOSTNER Still Photographers ROBERTO McGRATH, KERRY MORDQUIST Electronic System Designers JERRY JEFFRESS, KRIS BROWN Electronic Engineers MIKE MacKENZIE, MARTY BRENNEIS Computer Graphics WILLIAM REEVES, TOM DUFF Equipment Engineering Supervisor GENE WHITEMAN Machinists UDO PAMPEL, CONRAD BONDERSON Apprentice Machinists DAVID HANKS, CHRIS RAND Design Engineer MIKE BOLLES Equipment Support Staff WADE CHILDRESS, MICHAEL J. SMITH, CRISTI McCARTHY, ED TENNLER TED MOEHNKE Stage Foreman PATRICK FITZSIMMONS Stage Technicians BOB FINLEY III, ED HIRSH, JOHN McLEOD, PETER STOLZ, DAVE CHILDERS, Pyrotechnicians THAINE MORRIS, DAVE PIER Steadicam Plate Photography GARRET BROWN Ultra High Speed Photography BRUCE HILL PRODUCTIONS Color Timers JIM SCHURMANN, BOB HAGANS Negative Cutter SUNRISE FILM INC. Additional Optical Effects LOOKOUT MOUNTAIN FILMS, PACIFIC TITLE, MONACO FILM LABS,
M	APOSTOCOS LINDA BOWLEY	ARMSTRONG PETER BURROUGHS BAKER DEBBIE CARRINGTON H. BALHAM MAUREEN CHARLTON BELL SADIE CORRIE BENNETT TONY COX BENNETT JOHN CUMMING BETTS JEAN D'AGOSTINO
M	BLACKNER LUIS DE JESUS	DIXON JOHN LUMMISS FERNANDEZ NANCY MACLEAN FONDACARO CAROLE MORRIS FRIEL STACY NICHOLS FRISHMAN CHRIS NUNN GAVAM BARBARA O'LAUGHLIN GILDEN BRIAN ORENSTIEN GRANT HARRELL PARKER JR. GREEN APRIL PERKINS GRIZZ RONNIE PHILLIPS HERD KATIE PERVIS J. JACKSON CAROL READ JONES NICHOLAS READ JONES DIANA REYNOLDS JONES DANIEL RODGERS SHACKENFORD JOSEPHINE STADDON SHAH KEVIN THOMPSON SILLA KENDRA WALL SPRIGGS BRIAN WHEELER STADDON BUTCH WILHELM
M	Mime Artists	FRANK ANDERSON, AILSA BERK, SEAN CRAWFORD, ANDY CUNNINGHAM, TIM DRY,
M	Stunt Performers	ANDERSON, DIRK YOHAN BEER, MORC BOYLE, MIKE CASSIDY, TRACY EDDON, Photographed in Buttercup Valley, Death Valley, and Smith River, California and EMI-Elstree Studios, Borehamwood, England Cameras and Lenses by Joe Dunton Cameras Ltd. Aerial Camera System by Wesscam Camera Systems (Europe) Color by Rank Film Laboratories Prints by Deluxe TM & Lucasfilm Ltd (LFL) 1983 All Rights Reserved CODE NO. 26991 MPAA RATING: PG Running Time: 2 hours 13 minutes
