M	CHARACTER	DIALOGUE
M	STAFFORD	Mary...I love you. There..I've said it. From the moment I joined your family..
F	MARY	Wait.. MARY It was you, wasn't it? At the masked ball?
M	STAFFORD	Yes.
F	MARY	Oh, Stafford..
M	STAFFORD	Mary..I have watched how your family has treated you.
M	If you came withFFORD(cwould )never	STA me..I ont'd betray you...or take you for granted..I would love you and cherish you to my dying day..
F	MARY	But it's impossible. You know that. Now Anne's Queen, my family would never allow it.
M	STAFFORD	And you would CARE? What THEY think? After everything they have done to you? MARY's face. Lost in thought. STAFFORD's words still ringing in
F	ANNE	God, I look hideous.
M	EORGE	Does it hurt?
F	ANNE	Little nips and stabs.
M	GEORGE	Just imagine. It it's a boy. The unholy trinity will be mother, uncle and aunt to the next King of England.
F	ANNE	But if it isn't? The King will take that as evidence of God's displeasure. And will turn further against me. He's already become so cold.
F	ANNE	They say you can tell by the shape of the stomach. Mary, what do you say? Boy or girl?
F	ANNE	What's the matter with her?
F	ANNE	You've been like this for days.
F	MARY	What?
F	ANNE	Mooning. You're not in love, are you?
F	MARY	What? Certainly not..
F	MARY	In love! A darkened room. ANNE screams out. She is in the middle of
M	MIDWIFE	And again, one more..
M	MIDWIFE	It's done, your Majesty..!
F	MARY	Well done...
F	ANNE	And..?
F	MARY	It's a girl!
F	MARY	A beautiful, healthy girl.
F	ANNE	A girl? MARY watches from a distance, as SIR THOMAS and NORFOLK tell the
M	SIR THOMAS	She has named her Elizabeth. After your mother.
M	HENRY	Is the child healthy?
M	SIR THOMAS	Perfectly, Sir.
M	ENRY	Well, if we can have a healthy daughter, we can have a healthy son. ANNE stands by a window, staring out. Her hands wringing with ANNE Who is it?
F	MARY	Lady Somerset, I believe.
F	ANNE	Yesterday it was the wife of the French Ambassador. The day before with the Countess of Salisbury. How could he DO that to me? So SOON?
F	ANNE	Now I know how it must have been for you. MARY is with her children, reading them a bedside story. From You can't ignore me like this. I am your wife! Why don't you just admit it!
M	HENRY (O.S.)	ecause it's not true!
M	ANNE (O.S.)	Liar! I can smell the whore on you! Get away from me! You disgust me! ANNE and MARY are together. ANNE is combing her hair. Strands of
F	ANNE	I struck him today. What am I doing? I am destroying this all on my own..
F	ANNE	I can't sleep at night! And without sleep I cannot think!
F	MARY	Oh, Anne..
F	ANNE	nd it's getting more and more difficult to arouse him. Some nights he cannot do it...at all. I have to resort to ever more disgusting...then he hates himself in the morning...hates me even more for what I made him do...
F	ANNE	It's slipping away, Mary. I can feel it. The sound of ugly, loveless sex. Cries of pain. ANNE tries to
M	SIR THOMAS	And..? A magnificent winter party to celebrate ANNE's pregnancy. The
M	EORGE	And so, it's come to this. Our sister is with child, and all England's fate is in the balance.
M	GEORGE (cont'd)	If it's a boy, the King will have been vindicated in getting rid of his first wife, and his authority will be unassailable. But if it isn't. Or if, God forbid, she miscarries.
M	GEORGE	The King will have to move swiftly to silence his enemies. He will claim innocence. That he was corrupted. Anne will swiftly be replaced as Queen, by someone more `acceptable'. And we Boleyns will never be able to show our faces at court again.
F	MARY	That's no bad thing.
F	MARY	Anyone with any sense would have run away from this hell-hole already. As far as they could go.
M	GEORGE	ike the wise William Stafford.
F	MARY	What?
M	GEORGE	You didn't know? Sold up and went. Left for the country. Just like that. Gone to live in some place called..
F	MARY	..Tatton.
M	GEORGE	Where he grew up, apparently. Did you know he came from a better stable than all of us? His grandmother was a Beaufort, cousin to the King. And he never mentioned it. Who'd have guessed?
F	ANNE	I'm fine, thank you. Just a bad dream.
F	ANNE	But fetch my brother and sister, will you?
M	W	hen ANNE sees what lies beneath, she howls in horror. MARY and GEORGE arrive breathlessly in ANNE's room, to find.. Y
F	ANNE	I lost it. Almost without pain. And so fast it was over in a moment.
F	MARY	Oh, Anne..
F	ANNE	ou have to get rid of it. Bury it. Get rid of it somehow. No one must know.
F	ANNE	It's not the first. Miscarriage.
F	ANNE	They will take it as proof that I cannot bear children. That I am cursed by God. And should be dispensed with.
F	MARY	Why? There's still time. You could sleep with the King, and fall pregnant again. No one would know..
F	ANNE	he King would never lie with me now, and risk damaging the `child' he believes I'm carrying.. Besides, he is barely capable anymore. And I couldn't go through that again.
F	ANNE	No, if I am to survive..I have to take matters into my own hands. I..I don't understand.
F	ANNE	Must I spell it out?
F	MARY	You mean lying with another man?
F	ANNE	Of course.
M	GEORGE	But that would be treason.
F	MARY	esides, where would you find someone you could trust?
F	ANNE	Obviously, it would have to be someone close. Very close..
M	GEORGE	What..? No..!
F	MARY	Stop it, Anne! It's madness..
F	ANNE	Don't you see? This affects all of us. If I go down, so do all of you. The only way to save ourselves..is to do this.. And pray it's a boy.
F	MARY	I can't listen to this.. ...this is monstrous..
F	ANNE	Mary, sit down..
F	MARY	No, Anne! I understand you have had a shock tonight. A terrible shock. But there is no need for this..
F	MARY	Come, George..
F	ANNE	George is staying. He understands this involves the whole family..
F	MARY	No. Come, George..
F	ANNE	George, is STAYING!
F	MARY	I pray for you both.
F	ANNE	Mary! Come back!
M	I	t's JANE PARKER. Who turns, holding her head, covering her MARY runs through the corridors in an agitated state. MARY rushes into her room. She goes to the beds where her
F	MARY	Come on, darling wake up.
M	YOUNG HENRY	Where are we going?
F	MARY	Away from here. Far, far away. ANNE and GEORGE stare at one another. ANNE pours a mug full of MARY and her CHILDREN ride through the night. ANNE and GEORGE are making love. Silent tears are streaming down Afterwards: ANNE and GEORGE lie in silence. ANNE strokes her JANE PARKER gets to her feet. Numb with shock. She stares ahead. MARY arrives in a market village. She asks directions. Then A simple farmhouse, nestling in a valley. MARY stands in front of the door, protectively holding her
M	YOUNG HENRY	Who lives here, Mother?
F	MARY	Someone. A friend. MARY enters, calls out, `Hello?'. No answer.
F	MARY	William?
M	OUNG HENRY	Mama, I'm hungry.
F	CATHERINE	Me, too. The CHILDREN eat hungrily. A clock ticks on the wall.
M	T	F MARY puts CATHERINE to sleep in a bed. YOUNG HENRY is already MARY walks along a corridor. She looks in the bedroom. MARY pours hot water into a bath. The room is thick with steam. WILLIAM STAFFORD and several FARM-HANDS return from working in STAFFORD dismounts his horse. A quizzical look. Then he walks STAFFORD enters his house to see empty bowls of food on the STAFFORD pushes open the door. MARY is in the bath. Washing M T
F	MARY	I'm sorry. I just didn't know where else to go. Time has passed. Winter has become spring. We're in an idyllic
M	RIEST	Do you, Mary, take William as your lawful wedded husband?
F	MARY	I do. A dance is in progress. MUSICIANS play. Fifty or so GUESTS.
F	MARY	What is it?
M	STAFFORD	News from court.
F	MARY	hat? It's Anne. Tell me.. She miscarried the child? ANNE is walking alone. Her MAIDS follow at a distance. Presently Back at the dance. STAFFORD continues..
M	STAFFORD	They say it was deformed...monstrous. She is charged with incest and of summoning the devil. Your brother, too. He has already been sentenced. Anne is in the Tower, awaiting trial. ANNE in a prison cell at the Tower. Frightened. Vulnerable.
F	MARY	I must go.
M	STAFFORD	And do what? George is doomed. For Anne it's only a matter of time.
F	MARY	I can petition the King..
M	STAFFORD	ou think he will listen? It's his own neck he's saving by getting rid of them, can't you see?
M	STAFFORD	Fine, go. But if you do, you might as well kiss your children goodbye. You are Anne's sister. That alone makes you her accomplice and co-conspirator.
F	MARY	I have no choice. Anne and George are my family. I cannot desert them.
M	STAFFORD	And what of your new family? Your CHILDREN?
F	MARY	Henry and Catherine have you. Anne and George have no one. I'm sorry.. ANNE is led into a great courtroom lit by flickering torches,
F	ANNE	It is a sad day for England when the nobles do not rise for their Queen.
M	NORFOLK	And even sadder when that same Queen is charged with adultery and incest.
F	ANNE	Charged is different to convicted, Uncle. Or is it not? In this court?
M	NORFOLK	Master Cromwell, read out the indictment..
M	CROMWELL	The charge is that in the twenty-eighth year of the reign of our Sovereign Henry, King of England, his wife, the Queen, being seduced by the Devil, did knowingly commit adultery, high treason and offences against God.
M	NORFOLK	How do you plead?
F	ANNE	Not guilty, my Lord. MARY thunders across bridges, through villages. Urging on her ANNE faces the LORDS, as she makes her case..
F	ANNE	My noble Lords..the love I have for my brother is the love any sister would have for someone with whom she has grown up in the same house, nursed when sick, played games as children, shared life's celebrations.
F	ANNE	That is the love I have for him. Not what you suggest.
M	ANNE (V/O)	Judge me, my Lords, as you see fit. But never forget that your verdicts will be judged again by God, in the greatest court of all..
M	NORFOLK (V/O)	My Lords, the time has come to cast your vote. MARY gallops through shallow streams, spraying water.. ANNE watches on as each LORD takes it in turn to get to his
M	NORFOLK	Guilty.
M	NORFOLK	In which case, the burden falls on me to pass sentence. A terrified GEORGE BOLEYN is led to the scaffold. He is watched MARY reaches the outskirts of London. Gallops through villages.. GEORGE BOLEYN's eyes are covered with a cloth. He puts his head MARY arrives in time to hear the ROAR from the crowds. She
F	MARY	ho was it? HENRY walks through corridors arm in arm with JANE SEYMOUR,
M	HENRY	Mary..? ENRY Leave us.
M	HENRY	ALL of you! His private room. His sanctuary. Where he took her before. The
F	MARY	Your Majesty.. I understand my family has offended you. But having taken my brother today, I beg you to spare my sister.
M	HENRY	Oh, Mary...
F	MARY	I realise you must replace Anne as Queen. But must she die, too?
M	HENRY	She has been tried and found guilty.
F	MARY	You could send her away.
M	ENRY	I am bound by the law.
F	MARY	You could send her to a nunnery. No one would know.
M	HENRY	Anne? To a nunnery?
F	MARY	There is precedent, my Lord. Louis of France did it, too. When his wife could not conceive.
M	HENRY	The French Queen was a blameless woman. Your sister a witch.
F	MARY	I understand Anne has offended you. I ask only that if there is any regret you might..feel yourself.
M	ENRY	What?
F	MARY	For your part in the matter..
F	MARY	..does not unduly colour your thinking. Killing Anne will not make it go away. It would only make it worse.
M	HENRY	How could I have made that mistake? Choosing her over you?
M	HENRY	o. I will reflect on the matter. A team of CARPENTERS erect gallows and scaffolding. Hammers n the hill: a blood-stained chopping block is put into place. The doors to ANNE's cell open. ANNE looks up. In the doorway is
F	MARY	Oh, Anne..
F	ANNE	How has it come to this?
F	MARY	Ssshhhhh. A LIEUTENANT gives a nod. SOLDIERS raise a barrier, and allow ANNE looks out through a narrow window. Her intense, fearful
F	ANNE	They're letting the crowds in.
F	MARY	It's all right. You will be spared. The King as good as gave me his word.
F	ANNE	The King saw you?
F	MARY	Yes.
F	ANNE	We all made a mess of that, didn't we? We all underestimated little Mary.
F	ANNE	I don't think he ever stopped loving you.
F	MARY	That's not true.
F	ANNE	It is. He never loved me in the same way. And deep down you know it.
F	ANNE	You should have been Queen. You even gave him a son. But instead all this has happened because.. Because I couldn't bear to be the Other Boleyn Girl.
F	ANNE	And now look?
F	ANNE	Hold me..
F	ANNE	You'll look after Elizabeth?
F	MARY	It will be all right. Trust me.
F	ANNE	he couldn't ask for a better moth...
F	MARY	e will spare you. I am sure of it. A roar of the crowd. ANNE, wearing a shawl of white ermine, is M MARY shoots a signal, "Don't worry." ANNE climbs the steps, and
F	ANNE	I...I come here to die...a loyal subject..
F	MARY	Come on..
F	ANNE	..I..I do not blame the King. Never was there a more just or goodly Lord..
F	ANNE	..I beg God's forgiveness and his mercy..
M	CROMWELL (V.O.)	"Madam..." THOMAS CROMWELL, the former assistant to WOLSEY, who has now
M	CROMWELL (V.O.)	..the King has spared you because of his respect and affection for you and because you are the mother of his son." MARY continues to read the letter, as ANNE is forced to kneel by
M	CROMWELL (V.O.)	"But you risked your life coming to court and you are advised you not to do so again. You will not be shown the same clemency a second time. Your sister Anne was tried and found guilty, her crimes were high treason and she deserves to die. Cromwell."
F	MARY	No! SIR THOMAS BOLEYN sits by a window. Staring out at the fields We're moving through a cornfield. At speed. The sound of
