M	CHARACTER	DIALOGUE
M	KAPITONICH	Oh yes, you would have sent her packing! Ten years I've been keeping the door and the mistress was always kind to me. You should stick to stealing the master's clothes.
M	LUKICH	I've had enough of this--it's my job to get the boy out of bed before His Excellency comes . . . TIME--DAY ANNA Darling Kutik, Maman can't stay . . .
M	SEROZHA	Don't go!--he's not coming yet.
F	ANNA	Yes, I must, and you must love Papa-- he's better than I am. When you're grown-up . . .
M	SEROZHA	No one in the whole world is better than you. SAME TIME-- DAY
F	ANNA	Where's Anya?
M	ANNUSHKA	She's still asleep. Should I take your coat?
M	ANNUSHKA (CONT'D)	Are you feeling unwell, Madame?
F	ANNA	I'm not sleeping.
M	ANNUSHKA	I can send out for something.
F	VRONSKY	Why are you in the dark? Yashvin is going to call . . . you remember him. Are you going out?
F	ANNA	To where? To whom?
F	VRONSKY	What's the matter?
F	ANNA	I didn't know what happened to you.
F	VRONSKY	But I told you yesterday . . . My brother . . .
F	ANNA	Does it take all day for you to meet your brother? Does he need you more than I do?
F	VRONSKY	What's happened?
M	VRONSKY (CONT'D)	Well . . . Alexander agreed to everything. Mother's house in Moscow will go to him, and the country estate will be our new home . . . as soon as the divorce . . . Karenin hasn't answered your letter yet?
M	YASHVIN	It's wonderful to have you both returned.
F	ANNA	How good you are to come. You're the very first person to call on me since our return.
M	ANNA (CONT'D)	I received a note from Princess Betsy asking me if I'd call on her between six-thirty and eight. Or was it seven?
M	ANNA (CONT'D)	Alas, between six-thirty and seven is just when I'm unable to see her!
M	YASHVIN	But perhaps you'll meet at the opera tonight?
F	ANNA	I would love to be there if I could get a box.
M	YASHVIN	Madame, your box is number four! You'll find me there with Princess Myagkaya. Will you come, Vronsky? Vronsky shakes his head. Yashvin kisses Anna's hand.
F	ANNA	I see why . . . Alexei is so fond of you.
F	VRONSKY	You know you can't go to the theatre?
F	ANNA	Annushka!
F	VRONSKY	For heaven's sake--
F	ANNA	A bath. I'll come in and choose a dress.
F	VRONSKY	Anna--I implore you--don't you know . . . ?
F	ANNA	I'm not ashamed of who I am or what I've done: are you ashamed for me? Why do you keep a room at the hotel? Aren't we together? Have you changed towards me?
F	VRONSKY	It's because I love you and care about you. ANNA If that's the case, I don't know why you aren't coming with me.
F	VRONSKY	That would make it worse.
F	ANNA	You're afraid. Well, I'm not.
M	PRINCESS MYAGKAYA	Anna . . . ! Something has done you good--you look wonderful. NIGHT
M	PRINCESS MYAGKAYA	Should we visit or stay put?
F	ANNA	Stay put. PRINCESS MYAGKAYA Minister! Congratulations. Come in for a moment.
M	princess myagkaya (cont'd)	Princess Sorokina and her daughter, they're from Moscow, neighbours of Countess Vron- sky, quite well off, no sons, she's a widow.
M	princess myagkaya (cont'd)	My dear, I'm a sales catalogue.
F	VRONSKY	You'll come up to see us afterwards . . . ?
M	ALEXANDER	Talk to Varya. Alexander indicates his seat to Vronsky. Vronsky sits by Varya.
F	VRONSKY	Will you call on Anna?
M	VARYA	Oh, Alexei . . . I'm fond of you . . . but . . .
F	VRONSKY	For God's sake, Anna isn't a criminal!
M	VARYA	I'd call on her if she'd only broken the law. But she broke the rules.
M	PRINCESS MYAGKAYA	Who has made the decor? Haven't we got a programme? Colonel, would you be so kind . . . ?
M	YASHVIN	Of course. NEIGHBOUR Please . . . I would be honoured if you would take mine . . .
F	ANNA	Thank you, how very . . .
M	PRINCE TVERSKOY	Catullus, printed in Venice, 1501 . . . remarkable.
M	HOUSE MANAGER	A thousand apologies, Princess, but . . .
F	VRONSKY	Captain Makhotin . . . WIFE'S VOICE It's a disgrace! Take me home!
M	WIFE	Fetch my cloak!
M	WIFE	What are we coming to?
M	WIFE (CONT'D)	Is this the opera house or a--or a French music hall-- ?!
M	BETSY	Yes, why don't you? Rescue her and put your seal on the fiasco. Alexei . . . you see why she must divorce. Marriage will solve everything. When will it be?
F	VRONSKY	As far as I'm concerned, she's my wife.
M	BETSY	But, as you saw, she isn't.
F	VRONSKY	We're going to Moscow, and then to my place in the country.
M	BETSY	That sounds like a good idea.
F	VRONSKY	But for a day or two, Anna will be at home, at my flat. Then, I'll say goodbye now.
F	ANNA	. . . you had an excellent night! Does your mother want you to marry the widow or the child?
F	VRONSKY	Either one.
F	ANNA	Don't make a joke of it. If you loved me, you would have locked me in to stop me going.
F	ANNA	Go to bed. VRONSKY Yes, it was my fault.
F	ANNA	I won't sleep.
F	VRONSKY	I know how to make you sleep. DOLLY Anna . . . I am very glad to see you. Are you well? How is your little one? Stiva wanted to invite you and Count Vron- sky to the house but it's impossible . . .
F	ANNA	I understand.
F	DOLLY	No, no--you don't. Kitty and her husband are with us. She's in Moscow to have the baby.
F	ANNA	Kitty . . . ? Oh, tell her how pleased I am . . . !
F	DOLLY	Perhaps I'll wait a year or two. Oh . . . love!
F	ANNA	Yes . . . love! Don't you disapprove of me for what I've done?
F	DOLLY	No. I wish I'd done the same. But no one asked me! Well . . . I wouldn't have been brave enough. Stiva, you know . . . he doesn't change . . . like all men, I suppose. She doesn't notice her tactlessness but it lands on Anna, who manages a
M	ANNUSHKA	Madame . . . Madame . . . Are you ill?
F	ANNA	What time is it? Is Anya up? ANNUSHKA It's afternoon, Madame.
F	ANNA	I'm all right. It's all right. Get them to bring up all our trunks and travel cases. We've been here long enough.
F	ANNA	I had an inspiration. Why do we have to wait here? Why can't we wait in the coun- try? I don't want to hear any more about a divorce, or think about it.
F	VRONSKY	Good! I'm bored here. When should we go?
F	ANNA	If I bore you here, I'll bore you in the country.
F	VRONSKY	I didn't say you bore me. Moscow bores me. When should we go? . . . Tomorrow? ANNA I can't be ready by tomorrow.
F	VRONSKY	The day after, then.
F	ANNA	If you like.
F	VRONSKY	No, wait. That's Sunday. I have to see Maman.
F	ANNA	That's twenty minutes away in the train-- you could go to see her tomorrow--or was it that you wanted to spend Sunday with Princess Sorokina?
F	VRONSKY	Please don't spoil everything. I can't see Maman tomorrow because she won't have read the papers she has to sign. Oh, and then there's the bank . . . But we can leave on Tuesday.
F	ANNA	In that case, let's not bother. I'll leave on Sunday or not at all.
F	VRONSKY	That's absurd! ANNA It's absurd to you because you have no understanding for my life here.
F	VRONSKY	Anna . . . Anna . . .
F	ANNA	You've stopped loving me. You've given up everything for me, and it's turned you against me. Why lie about it?
F	VRONSKY	Stop. I put off our departure for a day or two, and you tell me I don't love you.
F	ANNA	Because I've been living off your love and there's none left, so this is over! Finished.
F	ANNA	I'm sorry. I don't mind when we go.
F	VRONSKY	I'll telegraph Maman. We'll go on Sunday. I'll do anything you want. ANNA You should leave me.
F	VRONSKY	I don't want to. I love you.
F	ANNA	Why?
F	VRONSKY	You can't ask why about love.
F	VRONSKY	So--will you be all packed? I'll be out today making the arrangements.
F	ANNA	Is that your way of telling me you'll be at your mother's with that simpering little princess? VRONSKY No. I'll be with my lawyers. I'm waiting for some documents. Then I'm having dinner to say goodbye to old comrades.
F	ANNA	Well, I know what that means.
F	VRONSKY	My God, this is unendurable.
M	VRONSKY (CONT'D)	I can invite them here if you like.
F	ANNA	Thank you, but if I'm not fit to dine in soci- ety, I won't eat with the band. Who was the telegram from?
F	VRONSKY	I didn't show it to you, because Stiva keeps telegraphing what we already know. Kare- nin promises nothing, but will consider . . .
F	ANNA	I told you I don't care about the divorce, so why hide the telegram? What else do you hide from me? VRONSKY I hide nothing from you.
F	ANNA	Why do you care about the divorce? What has it got to do with us loving each other?
F	VRONSKY	Until we're married, our daughter is legally Karenin's. I care about it because we need to be free to marry.
F	ANNA	You're perfectly free to marry anyone your mother wants.
F	VRONSKY	But we aren't talking about--
F	ANNA	Yes, we are, and, by the way, compared to your mother I'm the Virgin Mary.
F	VRONSKY	Is there anything you wish to say to me?
F	ANNA	So it's the child.
F	VRONSKY	She brought papers from Maman.
M	VRONSKY (CONT'D)	Anna?
F	ANNA	Unpack everything. We're not going.
M	ANNUSHKA	Anna Arkadyeva . . .
F	ANNA	When Count Vronsky comes back, tell him . . . I don't want to be disturbed. TIME--DAY
F	ANNA	Count Vronsky . . . ?
M	ANNUSHKA	He went out early, to the stables, he said.
F	ANNA	Oh, Annushka . . . I should have died. Do you remember?
M	ANNUSHKA	Don't take it to heart, Anna Arkadyeva . . .
F	ANNA	I've made him hate me. ANNA Tell Michael to hurry.
M	MICHAEL	Count Vronsky had already left, Your Excel- lency. He took a cab to the station . . . to the Countess. Anna's body jerks involuntarily. She half rises. The image, however, is
F	ANNA	Are you waiting for the Princess Sorokina? COACHMAN No, Your Excellency, both princesses are at the house of Countess Vronsky. I'm waiting FOR HIM--
M	MAIDSERVANT	Look at that lace on her . . . STANDING HAY.
M	LEVIN	I'll be buying in feed before winter's over.
M	THEODORE	Well, you don't press people hard, but you live rightly, for your soul, not your belly.
M	LEVIN	My soul! What's that? I know what my belly is. How do we know what's rightly? I believe in reason. THEODORE Reason? And was it reason that made you chose a wife?
M	LEVIN	No.
M	THEODORE	You're a great one for reasoning, Konstantin Dmitrich, but what's rightly is outside your mathematic--that's what's rightly about it! TIME--DAY The grown-ups are: Levin, Oblonsky, Dolly, the Oblonsky Nurse, Prince
M	LEVIN	Where's Ekaterina Alexandrovna?
M	AGAFIA	It's all right, the mistress is giving Mitya his bath. LEVIN I came looking for you . . . I understood something . . .
F	KITTY	And what was that?
M	LEVIN	He smiled at me.
F	KITTY	He's very advanced for his age.
M	KITTY (CONT'D)	What did you understand? Serozha picks up Anya like a parcel under his arm and walks on with her
