M	CHARACTER	DIALOGUE
M	VIRGINIA (O.S.)	Oh boy am I ready.
M	MALE VISITOR (O.S.)	Good. Let me help you off with that. Come on, lie down. Wai t a minute. Do you have protection? Right here. Okay, now I ' m gonna show you something new.
M	VIRGINIA ( O . S . )	Oh, I've never done it like this before. .·.
M	MALE VISITOR (O.S.)	Don't worry, you can take it. Oh yeah. That's it. There you go. Yes! Yes! WE HEAR labored rhythmic breathing.
M	MALE VISITOR (O.S) (CONT'D)	Yes, yes, yes -- As Dana fast-forwards again, then resumes... with still
M	MALE VISITOR (O.S.) (CONT'D)	Oh yeah, bring it on .home -- yes! Yes! Yes! Yes! YES! YES! The groans reach their incredible climax. There's a still As the shy COURT REPORTER, the macho BAILIFFS and the no-
F	DANA	Your witness.
M	FLETCHER	No questions.
M	JUDGE STEVENS	No questions? .
M	VIRGINIA	No questions?
M	FLETCHER	No questions. Petitioner rests.
M	JUDGE STEVENS	All right, Mr. Reid. You may proceed.
M	FLETCHER	How?! Gathering his courage, he stands, downs the last of his
M	FLETCHER (CONT'D)	Would the Court be willing to grant me a short bathroom break?
M	JUDGE STEVENS	It can't wait?
M	FLETCHER	Not unless you want to mop up. All right, but get back in here immediately so .we can finish this. Fletcher beams. Then necessity compels him to race out.
M	FLETCHER	What did I think? That I could piss for forty-five minutes?! He HITS HIS FOREHEAD in frustration... and gets an idea.
M	MAN	What's going on in-there? I ' m abusing myself! Do you mind?! The man looks disgusted. He carefully leaves the room.
M	BAILIFF	I found him like this in the bathroom. Somebody beat the hell out of him.
M	JUDGE STEVENS	Who did this? A madman, Your Honor.. A desperate fool at the end of his pitiful.rope.
M	JUDGE STEVENS	-What did he look like? About five eleven, hundred eighty-five pounds, crazed look in his eye.
M	JUDGE STEVENS	Bailiff, have the deputies search the building. A HUBBUB rises. He bangs the gavel.
M	JUDGE STEVENS (CONT'D)	Under the circumstances, I have no choice but to recess this case until tomorrow morning at nine. Fletcher smiles serenly -- until --
M	JUDGE STEVENS (CONT'D)	-- Unless, of course, you think you can still proceed? Fletcher covers his mouth in a desperate attempt to avoid Can you?
M	FLETCHER	Yes, I can.
M	JUDGE STEVENS	Splendid. I admire your courage, Mr. Reid. I'll give you a few minutes to compose yourself, and then we'll get started. Fletcher looks as if he has just been sentenced to death.
M	FLETCHER	Hello.
M	MAX	Dad...
M	FLETCHER	Maxi-pad. How's it going?
M	MAX	Great. You know Paul and Emanuel from across the street?
M	FLETCHER	The twins. Well, they never want to play baseball with me, but I told them I was gonna play tonight with my Dad, so now they want to play with us. Is it okay?
M	FLETCHER	Sure.
M	MAX	Oh boy. We're setting up a whole field in the yard. Where we buried Petey the hamster is second base. You're still coming right?'
M	FLETCHER	I'11 be there. I gotta go now, Max. I'll see you in two hours. Max hangs up.
M	MAX	He's really coming. She smiles, but she's worried. .
M	VIRGINIA	Mr. Reid, you remember Laurence Falk, the man from the tape.
M	FALK	How are you?
M	FLETCHER	I've slipped into the seventh circle of Hell, thank you, and you? Virginia exchanges an anxious look with Falk.
M	VIRGINIA	Shouldn't we go over our testimony?
M	FLETCHER	Well, basically the plan is I walk you through the tape step by step, I ask you questions--
M	VIRGINIA	And we give the explanation you came up with.
M	FLETCHER	Exactly.
M	FALK	So all we have to do is lie. Sounds simple enough.
M	FLETCHER	Do esn't it? And I'll finish up with a dramatic series of questions, something like... "Mr. Falk, isn't it true that you and Mrs. Cole have never made lo--" But Fletcher GAGS. He CAN'T GET THE QUESTION OUT. The
M	FLETHCER (CONT'D)	Sorry. I'm fine. "Mr. Falk, isn't it true that you and Mrs. Cole have never made lo--
M	FLETCHER	Oh my God! I can't do it! I can't finish the question if I know the answer is a lie! At this moment Miranda and Mr. Allan come up the steps.
M	MR. ALLAN	Don't let me interrupt, Fletcher. I just want you to know I'll be observing this a fternoon. Miranda insisted I see you in action. Fletcher shoots a hateful look at Miranda. She smiles.
M	MR. ALLAN (CONT'D)	I'm looking forward to it. Go get 'em!
M	FLETCHER	C'mon! Gotta rephrase the question!
M	FLETCHER	Respondent calls... Lawrence Falk. Fletcher's clears his throat. Here goes...
M	FLETCHER	Mr. Falk, do you know my client, Virginia Cole?
M	FALK	Yes.
M	FLETCHER	Isn't it true that your relationship with my client is entirely platonic, not? The "not" was INVOLUNTARY. It takes everyone by surprise.
M	FALK	Excuse me?
M	FLETCHER	If I might rephrase your Honor. Is your relationship with my client entirely patonic, not?
M	X\	Is your relationship with my client not entirely platonic? Is not your relationship with my client entirely platonic? Mr. Falk, is not your relationship with my client entirely platonic? No. I mean, yes. I think.
M	FLETCHER	Yes, is your relationship with my client not entirely platonic, or yes, is not your relationship with my client entirely platonic?
M	FALK	What?
M	FLETCHER	How 'bout just answering the question you think I'm asking? '
F	DANA	Your Honor, he's badgering the wintness!
M	JUDGE STEVENS	It's hig witness!
M	FLETCHER	Did you ever not make lo-- Did you not ever make lo--
M	YOU?!!	Falk looks shaken as Fletcher barrels on, unable to stop
M	FLETCHER	
M	FALK	No further questions.
F	DANA	Uh...no questions.
M	JUDGE STEVENS	Call your next witness.
M	FLETCHER	I have no further witnesses, your Honor. A MURMUR erupts from the crowd.
M	JUDGE STEVENS	You have no further witnesses?!
M	VIRGINIA	What are you doing? Call me.
M	FLETCHER	I can't.
M	JUDGE STEVENS	Mr. Reid?
M	VIRGINIA	Call me, damn it!
M	FLETCHER	You don't understand. I can't lie . Until nine-sixteen tonight, I can't even.ask a question that calls for a lie! Virginia GRABS HIM BY THE TIE, pulls him CLOSE to her face.
M	VIRG INIA	L is ten , you bastard. I want m y money. I am not gonna wind up a 31 year old divorce on welfare because my scum bag attorney had a sudden attack of conscience! Fletcher suddenly stops -- focused on something Virginia
M	FLETCHER	Thirty-one?
M	JUDGE STEVENS	Mr. Reid, we're not getting any younger... Fletcher quickly looks at the blowup of Virginia's prenup
M	JUDGE STEVENS	Mr. Reid you have presented virtually nothing in the way of evidence and as such I have no choice but to rule in favor of -- FLETCHER Your Honor, I call Virginia Cole to the stand. Stunned, Virginia nervously makes her way up,
M	MR. ALLAN	What the hell is he doing?
F	MIRANDA	Kissing his career goodbye. The Baliff stands before the witness.
M	BALIFP	Do you swear to tell the truth, the whole truth and nothing but the truth, so help -you God?
M	VIRGINIA	I do. Fletcher approaches,. CONFIDENT NOW, COCKY.
M	FLETCHER	Mrs. Cole -- may I call you Virginia?
M	VIRGINIA	Yes.
M	FLETCHER	But that would be a lie, wouldn't it?
M	VIRGINIA	What do you mean?
M	FLETCHER	Isn't your true name... Carlotta?!
M	VIRGINIA	Well, yes. But it wasn't me so I started using Virginia. Is there anything wrong with that? Not really. It's just the first and smallest in the tissue of lies that is the Kleenex of your life. Let's take one simple document as a sample of your veracity, shall we, Carlotta? He grabs her purse from the desk, rifles through it,
M	F LETCHER	Your driver's license. What color are your eyes?
M	VIRGINIA	Blue.
M	FLETCHER	Tru e blue? What if I asked you to remove your contact l enses? What color would they be then? Brown.
M	FLETCHER	And here it says you're a b l on de . Are you? C'mon, Carlotta, there's a very easy way for us to check. If you don't remember, perhaps Mr. Falk will.
M	VIRGINIA	Brunette.
M	FLETCH ER	More like a dirty brown, isn't it? Let's see - . - " Weight: one-o- five"? Please...
M	VIRGINIA .	One-eighteen. One-twenty-six. I swear!
M	FLETCHER	So on this single document, you basically lied at every opportunity. I'm sure a woman as vain as you would also lie about her age. It says you were born in 1964. What's the truth? 1962? '60? How young did you try to make yourself? Wrong! I didn't lie to make myself younger. I made myself older. I was born in 1965!" What? You're trying to tell us you lied to make yourself older?
M	VIRGINIA	Yes! " lied so I could get married! So .there Mister 'I
M	GOT-ALL-THE-ANSWERS-BECAUSE-I-	went-to-law-school'!
M	JUDGE STEVENS	Mr. Reid, does this have a point?
M	FLETCHER	Oh, you bet it does, your Honor! My client lied about her age because she was only 17 when s he got married. Which makes h er a minor. And in the great state of California, NO MINOR
F	DANA	Prenuptual agreements.
M	FLETCHER	YOU VERY LITTLE! This contract is void!!! The fact that my client gets nailed · more often than a two-by-four is irrelevant. Standard community property applies and this woman is entitled to half of the marital assets or thirty-seven point three-nine- five million dollars!! Yo . . . . a e . . . . T A T T T ! ! u r OSTT! Nothing further, your Honor!
M	JUDGE STEVENS	Q uie t! Let me see-the license and birth certificate. All is quiet while the Judge reviews the documents. Then:
M	JUDGE STEVENS	In light of this new evidence, the court must rule in favor o f the defense. Mrs. Cole is hereby awarded half of the marital assets -or thirtyrseven million three hundred and ninety-five thousand dollars. The courtroom ERUPTS. FLETCHER'S WON! Dana, Mr. Cole are
M	MR. ALLAN	That son of bitch pulled it off! Mr. Allan gives Fletcher a thumbs-up; simultaneously,
M	JUDGE STEVENS	O r d e r ! Order!! Now i understand both parties have agreed to joint custody. Is that correct? FLETCHER AND DANA
M	VIRGINIA	No! I'm contesting custody.
M	FLETCHER	What?
M	VIRGINIA	Payback. For him trying to prevent me from collecting my thirty-seven million.
M	FLETCHER	He was entitled to prevent you. You committed adultery.' You only won because you're a liar, remember? .
M	VIRGINIA	No. You pointed out that my husband took advantage of a poor underage girl. I was the vic tim here. And now I'm going to hit him where it hurts.
M	FLETCHER	But -- but -- you said he was a good father.
M	JUDGE STEVENS	M r. Reid? Do we have an agreement on custody or not? Fletcher takes a distressed look at the children.
M	FLETCHER	No. .
M	JUDGE STEVENS	In that case, there will be a custody hearing tomorrow mor ning at nine. Court is adj ourned! He BANGS THE GAVEL. Everyone gets up, but Fletcher's
M	VIRGINIA	Stop that! We're leaving now!
M	CHILD	I want to go with Daddy. Fletcher watches, horrified, as she drags the kids away
F	MR. COLE	Don't worry. I'll see you no matter what. I promise. Mr. Allan has made his way up to Fletcher.
M	MR. ALLAN	I love kids. They give you so much leverage in a case like this. Congratulations, partner. how does it feel? And with that question asked, as he watches poor Mr. Cole
M	FLETCHER '	Excuse me. Just a second. Y our Honor? Your Honor? Wait!
M	JUDGE STEVENS	We',re adjourned, Mr. Reid.
M	FLETCHER	Screw that!! She lies and she wins ?! What are we, nuts? Everyone stops, watches Fletcher.
M	FLETCHER (CONT'D)	T his woman --my client -- goes down with the frequency of a nuclear submarine and we just gave her thirty seven million dollars because she's a liar! And now as an extra added little bonus, we're going to let her steal, the kids, too?
M	JUDGE STEVENS	Mr. Reid, you are out of order! MEN'S ROOM!! Do you ever stop to ask yourself, why do people hate us? Could it be because what we did here today sucks?! We don't care about the truth! We don't want to find the t r u th ! We want to win! We want to win at all costs...and you know what the worst thing about wanting to win so badly i s ? WINNING! Winning and finding out you're left with nothing!
M	JUDGE STEVENS	That's enough, Mr. Reid --
M	FLETCHER	-Let' s see what I' ve done today. I've helped a gold digging slut get richer. I'm taking this guy's kids away. I don't like you in the least, now I'm one of your partners!
M	GREAT 1 I	Fletcher does feel strangely fantastic. Free,
M	JUDGE STEVENS	That's it, Mr..Reid. I find you in contempt!
M	HAIR? --	
M	MOUSSED! SHOULDERS --	
M	LIFTED! TEETH --	
M	JUDGE STEVENS	Bailiff! Remove Mr. Reid from the courtroom!
M	FLETCHER	Yo u wanna know the truth? Oh yeah, let's let it rain... The truth is is that I've traded my life...a beautiful wife, an incredible son for THIS PISS The bailiff grabs Fletcher, forces him out...
M	INSUFFICIENT EVIDENCE?!!	
M	HAPPY TO SEE ME??	Fletcher is pushed passed Mr. Allan.
M	MR. ALLAN	You just killed your career. I hope you're happy.
M	PAUL	We're going home.
M	EMMANUEL	Yeah, thanks for the great game, Max. Emanuel knocks Max's hat off. Audrey's been watching from
F	AUDREY	Max, honey. Your dad had a very big case today. It probably just--
M	MAX	I don't want to talk about it.
F	AUDREY	Okay. I hate dad! I hate him!
F	AUDREY	Honey, don^t say that. Max is really upset. It's "that look" and then some. The
F	AUDREY	Max, there's something I-want to talk to you about. . . Pho ne call!! Phone call!! I g et to make a phone call!!
M	MAX	When would we move?
F	AUDREY	Soon. My semester's almost over. You only have a week left of school... You like Jerry don't you? So what do you say, should we check it out? Jerry wants us to come with him tonight. He live and he really wants our help?
M	MAX	Could I get a sled for when it snows?
F	AUDREY	Of course you can. Max thinks, then:
M	MAX	Okay.
M	F L E TC H E R	Answer! Answer!! Answer!! !
F	AUDREY	Hello. . Audrey! It's Fletcher-- I can't talk now, Fletcher. We have to pack.
M	FLETCHER	Wait, the most amazing thing's happened to me! I am feeling so good... Pack?! Did you say pack?!
F	AUDREY	Max was sitting on the porch again, waiting for his dad. I won't let you do this to him anymore. I won't let you do this to me.
M	FLETCHER	A ud rey , wait. Please, I need to talk to you. I .swear, I'm a changed man. Just come to the courthouse with a thousand dollars and bail me out... Hello? O ne more call!! I need another call!!
M	FLETCHER	And what about our water su pply ? You don't think "the man's" dumped enough toxins to render every dick in this cell as lifeless as a beached minn ow? You're damn rightJ "The man" does anything he w an ts. We're nothing but pu ppets... Little game pieces they move back and forth. A DEPUTY appears. '
M	DEPUTY	Mr. Reid. ^
M	FLETCHER	That's me. Fletcher T. Reid. Pawn no. 332-154-9867.
M	DEPUTY	You made bail. Some woman.
M	FLETCHER	Audrey? Greta?!
F	GRETA	Am I too late? Have you been se xu al ly molested yet? I could circle the block.
M	FLETCHER	Greta! Greta!! . . . . Look at you, you well preserved, underpaid, overworked, underappreciated thing you. G iv e me a hug! You came and got me out!! Hug me!!
F	GRETA	Yes, well, I heard you went all noble in front of Mr. Allan so--
M	FLETCHER	Y ou know what?! I love you. I loveyouloveyouloveyou. I wa nt to hug you. Come here..,
F	GRETA	Mr. Reid, what has gotten intc to you?!
M	FLETCHER	Just the truth, Greta. Fifteen years of being stuck in a lie is nowhere near as powerful as one day of being stuck in the truth. Oh, my God!! I have to go! Thanks again, Greta! By the way, the truth is that I need you and I couldn't file a paperclip without you! Greta smiles, then catches herself, and quickly regains her
M	FLETCHER	Answeransweransweranswer... We HEAR a RECORDED VOICE: The subscriber you called is either unavailable or outside the calling area.
M	FLE TCHER	Shit!!
M	JERRY	A little going away present. I was gonna get you a bowl of clam chowder but they only had Manhattan.
M	A UDREY	Say thank you, Max.
M	MAX	Thanks. ·. Max takes off the hat his dad gave him and replaces it with
M	FLETCHER	Shelton, Jerry Shelton. What time's that flight leave? 7:50. Thank you. Oh, shit! Shit!! Shit! Fletcher spots the FLASHING LIGHTS.
M	FLETCHER	Shiiiiit!!! He pulls over -- so quick he jumps the curb.
M	POLICE OFFICER	Would you step out of the car, please? Fletcher obeys.
M	FLETCHER	Listen; I know I'm driving a little crazy but i have an emergency to attend to... The cop's just getting off his walkie talkie.
M	POLICE OFFICER	I'm impounding this vehicle.
M	FLETCHER	W h y ? What for? For changing lanes?
M	POLICE OFFICER	I just ran your tags through the computer. You've got. seventeen unpaid parking tickets.
M	FLETCHER	No ! I paid them! This morning! That's the truth! I swear!!
M	POLICE OFFICER	Not according to the computer.
M	FLETCHER	The computer is wrong! It ' hasn't been updated. The computer's a liar!
M	POLICE OFFICER	You can straighten it out at the impound yard.
M	FLETCHER	
M	POLICE OFFICER	No?
M	FLETCHER	That's right, no! I'm not gonna lose my son because some stupid clerk was too lazy to update the computer. Now if you want to follow me, . you can follow me and take the car after I get where I'm going. I'm a lawyer and I k now my rights! Understand?! A TOW TRUCK drives away with Fletcher's car, leaving
M	FLE TCHER	T axi! Taxi!! No luck. He spots
M	A PAYPHONE	digs through the Yellow Pages. Finds "Ten Minute Taxi".
M	FLETCHER	Noooo!!! He spots a man walking by.
M	FLETCHER	'Scuse me, sir. Do you have any - - The man turns. It's the same BEGGAR Fletcher was rude to
M	BEGGAR	Change? Absolutely. He continues walking.
M	FLETCHER	Could you spare some?
M	BEGGAR	Unquestionably. The beggar continues on.
M	' FLETCHER	Alright, I get your point. But this is a crisis! Look, I'll give you ten bucks. The beggar pulls out a quarter and holds it up. It's so shiny and new.
M	FLETCHER	Tw ent y. .
M	BEGGAR	Minted in Denver. Imagine that.
M	FLETCHER	Thirty-four. That's all I have. A moment as the beggar thinks, then:
M	BEGGAR	It's worth twice that to screw you. He walks off, grinning. Fletcher turns, spots a familiar building in the distance.
M	FLE TCH ER	M y office!!
M	SECURITY GUARD	Whoa, where do you think you're going?
M	FLETCHER	I just need to use the phone to call a cab. I work here.
M	MR. ALLAN (O.S.)	Used to work here. Mr. Allan has just exited the elevator. Son, that man is tresspassing. The guard starts toward Fletcher threateningly.
M	FLETCHER	Hold it! I've got ten years worth of dirt on you and this firm, and I'm in the kind of mood today to get a lot off my chest. You let me use the phone or I start talking!! Fletcher's is THROWN ON HIS ASS in the street. Mr. Allan
M	MR. ALLAN	Still euphoric, Reid? He goes back inside.· Fletcher starts to get up when a CAR
M	MAN'S VOICE ( O . S . )	Fletcher! · It's PHILIP.
M	PHILIP	Seven-thirty... It's Karaoke time! Fletcher runs up and HUGS the astonished man,
M	FLETCHER	You're saving my life, Philip.
M	PHILIP	You know, it's funny, but for some reason I was beginning to think you didn't like me. Isn't that silly?
M	FLETCHER .	No. It's not silly. I don't like you.
M	PHILIP	What?
M	FLETCHER	I don't like you. I'm sorry. I find you boring. I hate ch ara des . And you wouldn't know a good time if it sat on your face. I'm sorry. It was easier than telling you how I really felt. Are you upset? A moment, then:
M	PHILIP	No. To be honest, I don't like you either. You treat people like obstacles and you cheat at charades. .
M	FLETCHER	Then why are you always trying to socialize with me?
M	PHILIP	You're a client. I figured if I didn't try to be your friend, you'd get a new accountant.
M	FLETCHER	Philip, I don't like you as a person, but I'm crazy about you as my accountant. I ' d never hire a new accountant. Never!
M	PHILIP	So we don't have to like each other anymore?
M	FLETCHER -	Not at all.
M	. PHILIP	All right. Sooner I get you ·to the airport, sooner I can dump your sorry ass off.
M	FLETCHER	Bedelayed. Bedelayed. Fog, rain, something, anything... He sees the DEPARTURE BOARD " F li g ht 69. Departs 7:50. On Time. Gate 17." Fletcher looks at the clock -- It's 7:46!! Holy Shit!!
M	FLETCHER	Excuse me. . . excuse me. . . Come on folks, let's let the frantic man pass... Sorry... Thank... you... Standing on the right, passing on the left. They can't make this- deal any easier than it is... Come on... coming through... At the top,- a WOMAN in a NURSES UNIFORM asks for money...
M	WOMAN	Help the poor?...
M	FLETCHER	I don't trust you. I don't know what the hell that uniform is. Sorry.
M	INSPECTOR	Please step through again.
M	FLETCHER	Ahhh!! ! Damn..; Fletcher frantically tosses his keys, cufflinks, his Rolex He tries again. It BUZZES again!
M	FLETCHER	What? I'tii practically naked! A guy in a TURBAN passes over him with a DETECTOR WAND.
M	FLETCHER	It's called a ZIPPER, Hodgy...
M	FL E TC H ER	N ooo!!! Fletcher spots a door marked "NOT AN EXIT". Goes for it
M	FLIGHT ATTENDANT	Can I help you?
M	FLETCHER	Look out!! ! -- The woman raises her eyebrows and looks anyway. And No way he'll catch it. Then, he sees a MECHANIC working on a MOBILE STAIRS UNIT The worker hears an ENGINE START, looks up to SEE FLETCHER
M	WORKER	Hey!! Hey!!!! But Fletcher's gone. Soon, the "stairs" are racing alongside the plane. He grabs the TOOL BOX'on the passenger's seat,-puts it on F LET CH ER
M	STEWARDESS	In case of a water landing, please use your seat cushion ·Her MOUTH DROPS as she notices Fletcher. Fletcher looks ahead, SEES the stairs about to CRASH INTO ... and RAISES UP THE STAIRS at the other side. Fletcher SCREAMS to get their attention. But it's TOO Then, Fletcher looks ahead and his EYES GO WIDE!
M	FLETCHER'S POV	The RUNWAY is ENDING!.
F	AUDREY	It's right here, honey.
M	M AX	Mom! Mom!! '
F	AUDREY	Just a second, Max.
M	MAX	Mom, it's dad!
M	AU DREY	W hat? What about dad? Audrey turns. Then she sees Fletcher WAVING weakly...
F	AUDREY	Fletcher?! And BAM! FLETCHER, THE STAIRS, THE LUGGAGE ALL GO FLYING!
M	FLETCHER	Oh boy, the truth hurts. Yes indeed.
M	DEPUTY	Mr. Reid. Someone made bail for you. Greta? Is that you? He looks up and is surprised to see AUDREY and JERRY Max is sitting at the bottom of the stairs, still ANGRY.
M	FLETCHER	Sorry I made you miss your flight, not really. You're obviously a little . upset, not that I blame you... although I'll bet you'll still get the bonus miles. . .
F	AUDREY	Fletcher, are you crazy? What were you doing?
M	FLETC HER	That's two questions. A; Yes, but I think the legal term is temporarily insane. And B; I was trying to finally have that talk with you about Boston. Audrey's patience are growing thin...
M	FLETCHER	Okay, okay... The whole truth and nothing but the truth, I tried to stop the plane because it was taking off with my life... you and Max. This comes as a surprise to Audrey. Not just what Fletcher
M	FLETCHER	I know you've met somebody... somebody pretty great... and the truth is I wish you didn't but you did and... All I ' m asking i s . . . Please don't move to Boston. Please don't take Max away. She's definitely moved by Fletcher, but not convinced.
F	AUDREY	You can come visit anytime. It's only a four hour flight.
M	FLETCHER	I don't want to visit him. That's what I've been doing-- visiting him, dropping by, stopping in. I want to be in his life. I don't want to be some jerk that sees him at Easter. I want to be his father. Fletcher turns to Jerry.
M	FLETCHER	I know I have no right to ask, but can I talk you out of taki ng that job? I can get you a better job here in L.A. I've got all kinds of connect ions... what do you do again?
M	JERRY	I design security systems.
M	FLETCHER	How symbolic. Okay great. You know Pac-Tec?
M	JERRY	The biggest.
M	FLETCHER	One of their systems shorted out and burned down a supermarket. I got them off. Another proud day for justice. If I ask them they'll beat your Boston offer in two s ec on ds . ..
F	AUDREY	Don't put Jerry in the middle.
M	JERRY	It's okay. Boston means this to me. All I want is for this lady and Max to be happy. Preferably, with me. Whatever they want, I'll go along with. They both look to Audrey.
F	AUDREY	All I want is for Max to be happy. Audrey looks over to Max seated at the bottom of the
F	AUDREY	You better know your jury. You're hot exactly Max's hero today.
M	FLETCHER	Just let me present my case. Fletcher walks over,, tries to be playful, starts WALKING,
M	FLETCHER/TERMINATOR	I have been sent from the future to destroy you. . . Argghhh! You mad at me? Max nods. Fletcher's at a loss for how to begin. Then:
M	FLETCHER	You wanted me to stop lying. But lying isn't the problem. .. Why we lie ~ that's the problem. Sometimes we lie to make someone else feel better. But sometimes we lie because the truth gets in our way... But being an adult means you sacrifice some things for more important things. I was so stupid, Max. Malfunction in vector one. All this time you've been here and I could see you anytime I felt like it. And I... didn't. Please don't go to Boston. Max, I love you more than anything else in the world and you know it's true. I couldn't say it if it weren't true. Not today. A moment as Max studies his father, then:
M	MAX	He's telling the truth, Mom. He's not allowed to lie. I made a wish and anything Dad says has to be the truth. Right? But Fletcher's looking at his watch...
M	FLETCHER	Max. .. it's 9:22.
F	AUDREY	What?
M	FLETCHER	Max, you made the wish at 9:15. I've been able to lie for the last seven minutes. Max steps away from Fletcher.
M	MAX	So then, you were...
M	FLETCHER	No! It wasn't a lie. I just wanted to be honest with you and tell you -- there was no wish to guarantee it anymore. You just have to believe me. Max looks at Audrey, who is letting Max decide for himself
M	MAX	Mommy... do we have to go to Boston? Audrey looks at Jerry, then back at Max.
M	AUDR EY	No. We don't have to. Fletcher hugs his son -- the kind of hug that says "I'll never let you go."
M	MAX	Can we play catch tomorrow? Fletcher smiles. . .
M	M AX	Dad! !
M	FLETCH ER	Ma x i mu m ! ! Fletcher picks Max up.
M	MAX	Transformer!!! . Fletcher and Max do the TRANSFORMER ROUTINE again...
M	FLETCHER	Malfunction in vector seven. I have lost control of my affection reflex... Fletcher starts KISSING MAX on the head over and over. He
M	FLETCHER	Procreate! Procreate! Fletcher... You're gonna lose a limb--
