M	CHARACTER	DIALOGUE
M	LESLIE (CONT'D)	Bill Krogstad told me he's switching our policy to some fella down in Milwaukee. Allstate. Says I won't notice a bit of difference in coverage or nothin'.
M	TIM	No, you probably won't.
M	LESLIE	Mm. Anyhow, I told the cocksucker to go fuck himself. Says I'm going with Tim Lippe. A man I can trust. It's a good thing you're doin'-- keepin' work in Brown Valley.
M	TIM	I'm trying... Cedar Rapids, 6-12-09
M	LESLIE	Let me know when them red squirrels show up at your feeder. I'll borrow you my 22.
M	TIM (V.O.)	The chances we take in life are called risks.
M	TIM (V.O.)	We pay insurance companies premiums as a way of hedging our bets, in case those risks we take cause us or our property harm.
M	TIM (V.O.) (CONT'D)	That's the point of insurance-- so we can live and love life to the fullest.
M	TIM (CONT'D)	At Tim Lippe Insurance, we can't guarantee that you'll live your life without devastating losses. But we can give you peace of mind-- knowing that if something awful or unfortunate does happen-- we'll have you covered. Tim Lippe Insurance. Insuring your Home and your Hopes. Cedar Rapids, 6-12-09
M	RONALD	Can I be honest here, Tim?
M	TIM	You bet.
M	DEAN	What was with the fuckin' unicorn?
M	TIM	What? It represented hope...
M	RONALD	All's I'm saying is you might've wanted to hire an actor with some professional training...
M	DEAN	Jesus-- a retarded kid just sitting there yelling would've been better than you.
M	TIM	Aw, you're both a couple of a- holes...
