M	CHARACTER	DIALOGUE
M	LADY ELIZABETH	What's to smile about? I'm a mother with one child on his wedding day looking like he's been condemned to death.
M	LADY ELIZABETH	Another banished abroad, in disgrace. And a third whoring in public with an adulterer.
M	SIR THOMAS	For the moment she's happy.
M	LADY ELIZABETH	But will she be happy when he leaves her? Because you know that's how it will end.
M	SIR THOMAS	Only God knows how anything will end.
M	LADY ELIZABETH	God..? He turned his back on all this a long time ago.
M	WILLIAM	You're in love with him, aren't you?
F	MARY	illiam, you're drunk.
M	WILLIAM	How is it? With him?
F	MARY	He pleases me. Is that what you want to hear?
M	WILLIAM	What does he do to you? Tell me. I want to know..
M	WILLIAM	I know you look at me with contempt. But I had no choice. Your father insisted I stand aside. What was I expected to do?
F	MARY	Say `no', husband. That was all you had to do. HENRY and MARY make love. Two people giving everything of ...that she has fallen in love. The sound of groaning. Wretching. Shooting through a half-open
M	P	resently, she emerges from the bathroom. White-faced. Her hands SIR THOMAS BOLEYN and the DUKE of NORFOLK stare at MARY. Also
M	SIR THOMAS	Are you certain?
F	MARY	Yes.
M	SIR THOMAS	n that case...I suppose...someone should tell the King. Shooting through a half-open door..
M	SIR THOMAS (O.S.)	Keep them shut...still shut.. A blindfolded MARY is led through doors by SIR THOMAS..into a
M	SIR THOMAS	Now open!
M	SIR THOMAS	There's more. Thanks to you, I am to become an Earl. Your brother a Viscount.
M	SIR THOMAS (cont'd)	In addition, we have received a number of new grants and estates. So our debts are paid off.
M	LADY ELIZABETH	Just be aware. These `gifts', this `favour' can go as swiftly as it comes. These rooms belonged to the Duke of Buckingham. Once the King's closest friend. Now his head rots on a spike..
M	SIR THOMAS	Because he committed treason.
M	ADY ELIZABETH	But what is `treason'? It's anything the King or his lawyers decide it to be. Anything that offends him, or causes him displeasure. And can you assure me we'll never do that?
M	SIR THOMAS	Pay her no heed.. MARY wakes up. She gets out of bed. She goes to the window and MARY lies on the bed being examined by several PHYSICIANS. SIR
M	PHYSICIAN	Happily, the baby lives. She's not miscarried. S SIR THOMAS's face. Overcome with relief..
M	PHYSICIAN	But the placenta is weak. For the sake of the child..
M	PHYSICIAN	She must begin her lying-in immediately.
F	MARY	What?
F	MARY	But I'm only three months.. Darkness. The KING stands at the foot of MARY's bed. He is
M	HENRY	ou poor girl. All alone in here. But the time will fly by.
F	MARY	Will it? It's six months?
M	HENRY	I know. But the most important thing is a healthy child. I'll come and see you as often as I can. I promise. H ENRY kisses MARY, then goes. An archery competition is in progress. But HENRY pays no The KING is visiting MARY. He sits by her bed. They hold hands
M	NORFOLK	For the moment he's still visiting Mary. But for how long? The Queen will soon have his head spinning with pretty little Spanish things. Not to mention the Seymours with that girl of theirs. What we need is someone from OUR family who will keep the King focused on Mary, reminding him of her while she is absent.
M	NORFOLK	What? Speak..
M	SIR THOMAS	It's just...I was going to suggest Anne.
M	NORFOLK	You couldn't control that girl last time. What makes you think it would be any different now?
M	SIR THOMAS	I've had favourable reports from the Dowager Queen in France. It seems she is quite changed. MARY sits up. Her eyes widen in horror..
F	MARY	Why?
M	GEORGE	I suppose they felt three years of exile was punishment enough.
F	MARY	But the King visits me every day. There's no need for her. Or anyone else.
M	GEORGE	They just want to protect you. Leave nothing to chance.
F	MARY	But in who's interests do they imagine Anne will act? Certainly not mine. Why DO they make this room such a dungeon? Does it really need to be this dark?
M	GEORGE	Don't worry. She's had three years to forgive you. And she's not going to risk being sent away again. She'll do as she's told, I'm sure. Besides, the most important thing is..
M	GEORGE	The three of us will be together again. The thunder of galloping horses. The RIDERS and the WOMAN gallop through villages, spraying mud. The RIDERS and the WOMAN ride in silhouette against a perfect HENRY and several of his COURTIERS return from a hunting trip. A dinner at court. HENRY is at one end, in serious conversation H ENRY looks up, then returns to his conversation.
M	HENRY	What's the noise? I can hardly hear myself think!
M	BRANDON	It's Mistress Boleyn, your Majesty. Her stories about life at the French court. They are particularly amusing.
M	HENRY	I'm only aware of one Boleyn girl and she is lying-in with a certain child in her belly!
M	SIR THOMAS	It's my elder daughter, Anne, your Majesty. She has returned to court.
M	HENRY	What? That awful girl, Thomas? The one that almost killed me? You allowed her back?
M	SIR THOMAS	The time abroad has done her good, your Majesty. I'm certain you'd find her much improved.
M	HENRY	Really..?
M	HENRY	Well, come on. Where are you, other Boleyn girl? Show your face.
M	HENRY	So? What is so amusing, Anne? Perhaps we might hear and judge for ourselves?
F	ANNE	I was just giving my thoughts on the new French King.
M	HENRY	Which are..?
F	ANNE	That for someone with such great wealth, and power..he has surprisingly little authority as a man.
M	HENRY	Hah!
F	ANNE	And is SO consumed by one particular rivalry he can barely think.
M	HENRY	eally? And who is this rival?
F	ANNE	A neighbouring King, who's name one is forbidden to mention at court. Whose reputation haunts him in his thoughts and dreams.
F	ANNE	Whose armies and navy thwart his every endeavour. Whose physical and intellectual endowments are known far and wide.
F	ANNE	In order to restore his confidence, this French King spends a fortune on anything that glitters, on building of castles with large towers..
F	ANNE	But these symbols of wealth and virility fail to convince. Talk among the ladies at court in France suggests..
M		stops herself...
M	HENRY	What?
F	ANNE	That in this department too, the King has his shortcomings. SIR THOMAS beams with excitement and satisfaction...
M	SIR THOMAS	You should have seen the Seymours! Their faces!
M	SIR THOMAS	They must have thought that with you out of the way, they had a real opportunity with that pale-faced thing of theirs, Jane...
M	SIR THOMAS (cont'd)	But Anne put pay to that. Last night, the King only had eyes for us Boleyns.
F	MARY	Or HER, you mean.
M	SIR THOMAS	What?
F	MARY	'm wary of any suggestion that Anne would serve anyone but herself. France can't have changed her THAT much.
M	SIR THOMAS	n this occasion I am quite satisfied she was being loyal to you.
F	MARY	Really? Then ask yourself this. If she is really so concerned for my well-being... since she returned? HENRY and several of his closest COURTIERS are sparring close- AFTERWARDS: HENRY and his COURTIERS, (among them GEORGE), are
M	HENRY	You're a fortunate man, George. To be blessed with G two such sisters.
M	EORGE	Yes, my Lord.
M	ENRY	Tell me. Are they as different in temper as they are in looks?
M	GEORGE	Oh, yes. Each has her own, quite distinct virtues. Mary for example..
M	HENRY	I'm familiar with Mary's. Tell me about Anne's.
M	GEORGE	Anne? Well, she's strong. Some might say `difficult'.
M	ENRY	Headstrong. With a fiery temper.
M	GEORGE	But with it comes great passion, too. It's both the best and the worst thing about her. There are no half measures with Anne.
M	HENRY	Careful, you'll make me think I chose the wrong Boleyn girl.
M	GEORGE	Oh, no. I'm certain Mary is the right choice. You will have a serene, happy, life with her. The risk is with Anne, it might be like being caught in a wild summer storm.
M	HENRY	Is that so..?
M	HENRY	storm, you say..? A small, precious-looking GIFT BOX sits on a table.
M	ERVANT	From the King, madam.
F	ANNE	Open it.
F	ANNE	I said `open it.'
F	ANNE	Now close it again. And send it back. You heard me. The SERVANT nervously stands in front of the KING, holding the
M	HENRY	She did what?
M	SERVANT	Sent it back, your Grace.
M	HENRY	Sent it back? A ROYAL MESSENGER, in the King's livery, holding a larger, more ANNE shakes her head, and sends the gift back. She looks The MESSENGER stands in front of the KING, holding the rejected
M	HENRY	What? Again? The same ROYAL MESSENGER walks towards the BOLEYN house. This Again, ANNE shakes her head, and sends the gift back. The KING is in a meeting with several AMBASSADORS on an `Crash', the KING, flanked by several of his most intimidating The KING bursts in. Everyone leaps to their feet. SERVANTS stop
M	LADY ELIZABETH	Your Majesty.
M	HENRY	Your daughter. Where is she?
M	LADY ELIZABETH	Mary..?
M	HENRY	Anne! ANNE hears the KING's voice. Her eyes widen. She looks down. ANNE, who is not properly dressed for the KING, rushes back to
M	HENRY	Anne.. A
F	ANNE	Your Grace?
M	HENRY	You received my gifts?
F	ANNE	Yes.
M	HENRY	And? They did not please you?
F	ANNE	On the contrary, my Lord. They pleased me greatly.
M	HENRY	Then why did you return them? ANNE steps into the corridor. Closes the door behind her.
F	ANNE	ecause my sister lies in bed with your child. If you wish to please me, Sir, then send her the gifts you send me.
M	HENRY	I have shown Mary enough kindness and generosity. It's you I want, Anne.
F	ANNE	beg you, my Lord, do not do this. What has changed so?
M	HENRY	YOU. Don't you see? YOU have changed.
F	ANNE	But Mary is still the mother of your child. And even if she weren't..
M	ENRY	What?
F	ANNE	How could I forget that you chose her above me when we first met? You liked her better.
M	HENRY	Not true..
F	ANNE	Either way, I could never betray my own sister.. AN Now I beg you, leave me. This is too difficult to bear.
M	HENRY	You see! The same pain as mine! It proves you feel the same way!
F	ANNE	Perhaps. But since it can never come to anything..
M	HENRY	Let me decide that. For now, you have given me hope. H ENRY goes on bended knee, kisses her hand, and goes. ANNE is SIR THOMAS is asleep. The sound of voices. A commotion outside.
M	STAFFORD	Sir Thomas! It's Mary..! MARY cries out in pain. The contractions become stronger. The DUKE of NORFOLK, SIR THOMAS, and GEORGE BOLEYN arrive in
M	SIR THOMAS	Does the King know?
M	GEORGE	He's on his way.
M	SIR THOMAS	Any moment, your Grace.
M	HENRY	Anne..
M	HENRY	Anne, I love you..
F	ANNE	Your Grace, this is not the time..
M	HENRY	I love you Anne. I cannot stop thinking about you. I cannot eat, I cannot sleep..
F	ANNE	But how could I ever TRUST you?
F	ANNE	When I have seen how you have betrayed first your wife. And now my sister.
M	HENRY	I vow from this moment forth I will never lie with my wife, or speak to your sister again. I will do anything you ask..
F	ANNE	Then don't acknowledge the child.
M	HENRY	What?
M	PHYSICIAN	A boy!
M	SIR THOMAS	It's a boy, your Majesty. A strong, healthy boy.
F	ANNE	What my sister has given you, I could, too.
F	ANNE	Very well. M MARY Henry..? My Lord..? `Crash', SIR THOMAS and NORFOLK burst into the study, angrily
M	NORFOLK	Damn you! Three years we've been working on this! Not a single detail was left to chance! And now, in the moment of our greatest glory..
M	NORFOLK	All I can say is you'd better have a plan. And it had better work.
F	ANNE	Or what...Uncle?
M	LADY ELIZABETH	Stop it! Both of you. What shall we do about Mary? And the child? Or have we forgotten them already?
F	ANNE	Mary should go back to her husband.
F	ANNE	She has been inconvenienced long enough by this family.
M	ADY ELIZABETH	Fine. Then you can be the one to tell her. A
M	LADY ELIZABETH	I think you've earned that privilege. MARY lies in bed. She looks pale. Exhausted. ANNE stares into the room through a crack in the doorway. MARY looks up as ANNE enters, and freezes..
F	MARY	How can you show your face in here?
F	ANNE	I understand you're angry - but be assured. I did nothing, except remind him of you.
F	MARY	Oh, spare me. You did this deliberately. As revenge. And now you have what you wanted you probably think justice has been done.
F	ANNE	Well, hasn't it?
F	MARY	Be careful, that's my advice. Learn from my experience. Because he'll only do to you what he has done to me.
F	ANNE	Never. I'll make sure he understands I'm a greater thing by far. That he can never have me until he makes me a far greater offer.
F	MARY	You'll never get Henry Percy back, if that's what you mean.
F	ANNE	That's not what I mean.
F	ANNE	And don't you ever mention his name to me again. I'll never forget how you betrayed me.
F	MARY	If that's what you think, fine. Tell yourself that.
F	ANNE	I did, sister. Every day for three years. MARY is leaving COURT. Pale. Weak. Her belongings have been MARY and her entourage travel through the countryside in a small The rain continues. MARY's carriage approaches the manor house. MARY sits at the dinner table with her husband, WILLIAM CAREY, W WILLIAM Have you christened the child?
F	MARY	Henry.
M	WILLIAM	I see.
M	WILLIAM	And is he to take my name? Or is he to be a Fitzroy or some other sign that he is a royal bast...
F	MARY	He is to be Henry Carey.
M	WILLIAM	I see.
M	WILLIAM	Well, then, here we are.
M	WILLIAM	I could pretend none of this ever happened. Start again. If you could. MARY lies in bed, her eyes open and staring blankly at the moon
M	M	Gorgeous sunshine. Greenwich Palace at it's most beautiful. HENRY and ANNE walk through the gardens. Out of earshot of the
M	HENRY	Well, I have done what you asked. Will you give yourself to me, now?
F	ANNE	As what?
M	HENRY	My one true mistress. To whom I am loyal above all others?
F	ANNE	But it's not true. You are loyal to the QUEEN above all others.
M	HENRY	My wife? I barely see her.
F	ANNE	But she sits on a throne beside you. Accompanies you to every state function.
M	ENRY	For appearance sakes only. In every other regard, our marriage is a sham.
F	ANNE	Still, she is your WIFE. And ever present. And I feel her eyes on me. And those of her spies.
F	ANNE	And look at us. Forever reduced to meeting in secret like this. Speaking in whispers. Hardly conducive to passion?
M	HENRY	Well, what would you have me do? ANNE watches from a distance as HENRY talks to WOLSEY. We do not ANNE enters a lavish drawing-room, and sits down. She picks up a
M	HENRY	Wolsey has agreed to draw up plans for the Queen to be sent to a nunnery.
M	HENRY	She will protest, of course. She won't go quietly, but she knows she has failed to give me a son, and deserves her exile. Which leaves you all alone at court..
M	HENRY	...queen in all but name. Mother to any future heir.
M	HENRY	So, is this assurance enough? Will you give yourself to me now?
F	ANNE	I'd like to. But I'm afraid I find the insult too much to bear.
M	HENRY	What insult?
F	ANNE	Because as long as we remain unmarried, any child I gave you would forever be daubed `bastard' and I a `whore'.
M	ENRY	ut what alternative is there? throws hands up in My love for the Queen may have died, but even you must concede, she is still very much alive. A
F	ANNE	Katherine of Aragon is alive. That woman is not worthy of the title `Queen'.
M	ENRY	Oh, Anne.
F	ANNE	I really do not know why we waste time talking of convents when you could annul the marriage.
M	HENRY	Annul it?
F	ANNE	That woman married two brothers and therefore sinned against God.
M	HENRY	But she never consummated the marriage with my brother.
F	ANNE	They were married six months.
M	HENRY	Arthur was a sick man.
F	ANNE	And Katherine is a shrewd woman who knew that her position as Queen would never be safe until she bedded your brother. Talk to your advisers. They will tell you as much. ANNE sits in her study working. HENRY appears in the doorway.
M	HENRY	Wolsey has agreed to charge the Queen?
F	ANNE	But that's wonderful.
F	ANNE	Why do you look sad?
M	HENRY	Because she will contest it. Which means putting her on trial. And hearing these delicate matters in public.
F	ANNE	es. But any court made up of YOUR Bishops will surely find in YOUR favour. And declare the marriage invalid.
F	ANNE	hen you, my sweet Lord, will be free to remarry. Then I can give myself to you fully. And give you everything you.. ..desire. It's mid-winter. A lone RIDER appears on the snowy crest of the A fire roars. STAFFORD warms himself, staring at MARY's new baby
M	TAFFORD	She's beautiful.
F	MARY	Thank you.
M	STAFFORD	I brought gifts from your family. A night-dress from your mother. This from your Uncle George.
F	MARY	Please be sure to thank them - though one wonders what's kept them so busy that not a single one of them found time to visit the new baby.
M	STAFFORD	It's Anne. She's turning this country on its head. She has persuaded the king to test the validity of his marriage, and put the QueenM on trial.
F	MARY	What?
M	STAFFORD	She continues to hold out. Expertly witholding her favours until...
F	MARY	..until what?
M	STAFFORD	Until he makes her the ultimate offer.
F	MARY	High stakes indeed. MARY follows STAFFORD out to the stables where freshly watered
F	MARY	And my brother George?
M	TAFFORD	Continues to be promoted. As does your Father. I lost track of their latest titles. H
M	STAFFORD	ow is your husband? I heard he was unwell.
F	MARY	He is.
M	STAFFORD	I'm sorry. Mary..! At that precise moment, WILLIAM STAFFORD's horse reaches the top
M	STAFFORD	Whoa.. MARY watches him go, then stops - catches herself feeling A hall filled with LAWYERS and AMBASSADORS from both sides.
M	HENRY	The Queen has insisted a Papal representative be present at the trial. But Wolsey has assured me the trial will proceed for appearance sake only. We have our verdict.
F	ANNE	Then what troubles you?
M	HENRY	One or two friends have refused to lend their support. Among them, Thomas More. And then there's the small matter of my conscience.
F	ANNE	Why? You have justice on your side.
M	HENRY	Do I? HENRY sits at breakfast. Reading official correspondence. Legal SIR THOMAS and the DUKE of NORFOLK storm down a corridor. Their `Crash', the door flies open. SIR THOMAS and NORFOLK burst in.
M	SIR THOMAS	`Mary Talbot'.
F	ANNE	Who?
M	SIR THOMAS	Mary Talbot!! The girl that married Henry Percy. It seems she has petitioned the King, demanding a divorce from her husband( on the grounds.. he can hardly bring himself ...that his prior betrothal to you was actually.. ..consummated.
M	SIR THOMAS	I knew this would come back to haunt us!
F	ANNE	I must go to the King.
M	SIR THOMAS	No! He doesn't want to see you! Or hear a word from your lips! He's far too angry. It seems the only Boleyn he will speak to, the only person who's testimony he will trust in this matter.. ...is Mary.
F	ANNE	Mary? A cemetery in mid-winter. WILLIAM CAREY's coffin is lowered into
M	SIR THOMAS	Mary.
M	SIR THOMAS	We're so sorry. About your husband.. Several MAIDS are assembled, fussing over MARY. Transforming her
M	A	ANNE enters, (unseen by MARY), and ushers everyone out. She
F	ANNE	uch beautiful hair.
F	ANNE	Thank you for coming.
F	ANNE	I hate how this matter has come between us. I wanted to come to see you after your daughter was born, and again when your husband died, but..
F	MARY	It's fine.
F	MARY	Leave me. Please..?
F	ANNE	I'm frightened, Mary. What have I done? The KING sits in his private apartment. He looks up as MARY
M	HENRY	Ah! Mary! Come in.
M	HENRY	Closer.. Into the light.
M	HENRY	The Other Boleyn Girl. I'd forgotten how beautiful you were.
F	MARY	ou asked to see me, your Grace? The BOLEYN FAMILY members are pacing outside. Anxious. ANNE and
F	ANNE	And..? MARY is putting the children to bed, tucking YOUNG HENRY in.
M	OUNG HENRY	Mama? What's the matter?
F	MARY	Nothing. MARY closes the door behind her. ANNE stares at her, then..
F	ANNE	I am forever in your debt.
F	MARY	You owe me nothing, sister. I did it that we may finally draw a line beneath everything that has happened between us.
F	ANNE	hen let it be exactly that. A new start between us. Here at court. Thank you. But I'd rather go back to our home in the country.
F	ANNE	What? That damp old ruin? With no food? Or warmth? Why don't you let your family look after you? Your children would have the best of everything here. They would grow up safe and secure.
F	MARY	ho's that?
M	SIR THOMAS	The Papal Legate. Sent by the Pope to preside over the Queen's trial.
F	MARY	So, it's true. It's really happening?
F	ANNE	Yes, it is. Stay with me, please? I need my sister by me side. A huge crowd is assembled. Despite the intimidating presence of We're in a packed courtroom. The room is filled with the
F	MARY	The crowds are with her.
F	ANNE	The crowds have no vote. And the bishops that do are in Wolsey's pocket.
M	ANNE (cont'd)	God, she's coming towards us. it aside, intimidatingly flanked by her LAWYERS..
M	UEEN KATHERINE	So..the Boleyn whores. Two former ladies of mine. Hiding in shadows. What did I do to upset you, that you should turn against me like this?
F	ANNE	You failed to give England an heir.
M	QUEEN KATHERINE	And that upsets you so?
F	ANNE	What upsets the King upsets me.
M	QUEEN KATHERINE	How dare you!
M	CRIER	Katherine, Queen of England, come into court..!
M	QUEEN KATHERINE	ou want me to creep away and become a nun? Well, I shall not. You want me to lie before God and admit my first marriage was consummated? Well, it was not. Q retire and withdraw my daughter's claim as sole rightful heir to the throne? Well I shall not. Not in a thousand years, not if you rack me to within an inch of my life... I am Katherine, Queen of England, the King's one true wife, and mother of the heir to the throne. Beloved of the people, and beloved of a King you have bewitched.
F	KATHERINE	My Lord, how have I offended you? For twenty years, I have been a true, obedient wife. I have loved all those whom you loved, and given you children though it has pleased God to take them away. If there is any just cause that you can allege against me, I will happily depart to my shame and dishonour, but I tell you, as God is my witness, there is none.
M	ATHERINE (cont'd)	So, I beg you, dear husband, to spare me this humiliation. But if you will not, and I am to be tried..
M	HENRY	You are.
F	KATHERINE	..then let it be in a proper court and by the only authority I recognise. His holiness himself.
M	WOLSEY	Since it has pleased the Queen to absent herself from the court, the trial will simply proceed without her. The entire BOLEYN FAMILY is assembled. ANNE paces up and down.
F	ANNE	Wolsey promised the King his verdict. Instead he has humiliated him.
M	SIR THOMAS	But they are continuing with the trial. And the Bishops will still find in the King's favour.
F	ANNE	Yes. But without the Pope's blessing, the result will seem hollow. If only the King would take matters into his own hands.
M	ADY ELIZABETH	And do what? His only option would be to reject the Catholic Church? And his faith would never allow it.
M	SIR THOMAS	Nor his good sense. Breaking with Rome would isolate England politically. Leave us at the mercy of the Protestants.
F	ANNE	But the alternative is leaving this country without an heir. Failing in his duty as a King. And risking civil war. S omehow I need to make him understand that it is a fair price for a legitimate heir. One he could hold in his arms..
M	ANNE (cont'd)	A strong, rosy-cheeked boy..
F	MARY	What? HENRY, along with THOMAS CROMWELL and several of his LAWYERS are HENRY walks towards ANNE. And bends so as not to frighten the
M	HENRY	Who's this? ANNE Go, on..
M	YOUNG HENRY	My name is Henry.
M	HENRY	Is it, now? A fine name. And how old are you?
M	YOUNG HENRY	Four, Sir. Is that sword real?
M	HENRY	I think so. Would you like to see it?
M	HENRY	Now, `on guard'. From a window high up, we notice: QUEEN KATHERINE has appeared, HENRY continues to play with the boy. It's clearly a powerful Gradually, other FACES appear at the palace windows.. A clap of thunder. A storm breaks. Rain pours. QUEEN KATHERINE, screaming in protest, surrounded by wailing
F	KATHERINE	How dare you! Take your hands off me.. The door flies open. ANNE is reading, alone. She looks up to see
M	HENRY	Now you will give yourself to me.
F	ANNE	I thought I had made myself clear. Until we are married, there is no questi..
M	HENRY	Silence! Enough of your GAMES! I have torn apart this country for you, gone against every principle in my heart, I've endured the doubts and counsel of good men and silenced them with the axe...just to be with you.. Now prove to me it was worth the sacrifice.
F	ANNE	Stop, you are hurting me..! That night: ANNE is being groomed by MARY.
F	ANNE	How was he with you? As a lover?
F	MARY	Surprisingly so. Why?
F	ANNE	No reason. A small ceremony. Held in secret. The distant sound of crowds
M	ARCHIBISHOP	Do you, Henry Tudor, take Anne Boleyn as your lawful wedded wife..?
M	HENRY	I do. MUSICIANS play in the corner, struggling to drown out the sound
F	ANNE	Did you hear? On the way to the church? They were calling me a witch.
F	MARY	All that will die down as soon as they get to know you.
F	ANNE	But what if it doesn't? What if they hate me forever?
F	MARY	They won't. They will see how much the King loves you, and follow.
F	ANNE	How much the King loves me?
F	MARY	ister, I wonder if you've given any thought..to the matter of my returning to the country. With the children.
F	ANNE	What? No! I need you here more than ever. Besides, as the Queen's sister, you can't live alone out there like some gypsy. We need to make you a proper match.
F	ANNE	What about the Duke of Suffolk?
F	ANNE	All the ladies at court are mad for him. Or Lord Fardingly. Marry him and you'd own half Scotland.. MARY is walking back to her apartments, when WILLIAM STAFFORD
M	STAFFORD	Wait! Mary..
M	STAFFORD	I couldn't help overhearing. And before you agree to any of your sister's matches, let me just say..
M	STAFFORD	..I have saved money...not a lot...but enough. I've my eye on a place in the West...Tatton...near where I grew up..
F	MARY	hat? Stafford?
