M	CHARACTER	DIALOGUE
M	MAX	Come on, dad, let's play catch!!
M	FLETCHER	Sr. . .
M	UE	Here you go, mom. Oh, you mean with a ball... He puts Max down. Max runs into position. Fletcher stops
M	FLETCHER	I take back every dirty, dishonest thing I ever said about you, wrote about you, faxed about you, E-mailed about you.
M	JERRY	Appreciated. Fletcher tosses the baseball up and down.
M	FLETCHER	So, you up for a little friendly competition?
M	JERRY	No, you go play with your son.
M	FLETCHER	I wasn't talking about basesball. A slow smile from Jerry. Fletcher winks and tosses the
M	FLETCHER	Alright, it's time to show you the old Fletcher Reid change up.
