M	CHARACTER	DIALOGUE
F	DANA	Can the sarcasm, Reid. All right, I admit it -- I've seen you make even the lamest case fly. But this time I have you. Even Clarence Darrow couldn't explain this away. She brandishes the audiotape.
M	JUDGE SAMIOAN	Wel l, Mr. Reid? without a dynamite explanation, I'd say you're dead in the water. How's you client's story?
M	FLETCHER	The best that money can buy, Y o u r Honor. ·
M	JUDGE STEVENS	Strong corroborating evidence?
M	FLETCHER	We have evidence that you are not going to-believe. Despite herself, Dana is beginning to look worried.
M	JUDGE STEVENS	You're pretty confident how this trial is going to come out, eh, Mr. Reid?
M	FLETCHER	"Confident" is too weak a word, Your Honor. I am certain what will happen if I take this puppy to trial. The verdict will be a stunning, humiliating defeat that will cut a spectacularly promising legal career off at the knees. Fletcher is referring to himself, of course, but Dana
F	DANA	All right! Double the offer! Four point eight! And not a penny more. Bastard! She storms out, leaving an astounded Fletcher behind.
M	JUDGE STEVENS	You are some negotiator, Mr. Reid. If your client has half a brain, she'll jump at the offer.
M	VIRGINIA	No! We are --
M	FLETCHER	No? ! Mrs. Cole, this offer was a miracle. I'm talking about a walking-on-water, Lazarus-rising-from-the-dead,
M	FIND-NO-LINE-AT-THE-FRIGGIN'-	DMV miracle! You've gone from two point four to four point eight million in... four minutes. Think of it this way -- now you're getting paid seven hundred thou per schtupp!
M	VIRGINIA	Mr. Reid, you convinced me yesterday -- I'm the victim here, starved for affection, driven into the arms of another man--
M	FLETCHER	Seven! ·
M	VIRGINIA	-- Seven other men. With the story you came up with, I don't think I can lose. I want to proceed.
M	FLETCHER	Mrs. Cole, you don't ·. understand, I-- But before Fletcher can finish, the judge enters.
M	JUDGE STEVENS	Well , Mr. Reid. Do we have a settlement? Fletcher looks pleadingly at his client, but she is firm.
M	JUDGE STEVENS (CONT'D)	Th ere' s no settlement. Trial to start at one-thirty sharp. He BANGS the gavel. Fletcher emits an involuntary whimper.
F	JANE	What do you think?
M	FLETCHER .	I think you need help. HORRIFI ED, Fletcher hurries on. The heavyset Thomas
M	THOMAS	What's shakin', Fletcher?
M	FLETCHER	Your cellulite, Tubster. The now panicked Fletcher breaks into a run, passing Fred.
M	FRED	Hiy a, Fletcher. How's the Cole case going?
M	FLETCHER	'Straight into the crapper, you wuss, with my career right behind it.
M	P	Fletcher is RUNNING NOW, COVERING HIS EARS and SINGING
F	· GRETA	Hi, boss. What's happening
M	PLEASE DON'T ASK!	-- And races into his office. Do n't panic. You can beat this -- it's all a matter of willpower. He dives for his desk and rifles through it.
M	FL ET CH ER	A test. . . Something small... Aha! He holds up a BLUE PEN.
M	FLETCHER (CONT'D)	Red. Red. All right. Focus, The color of this pen is · r--. R--. R--! The color of this pen is--blue! AAAAHH! Ahhhh! One' tiny lie and I can't say it!! ' I'll write.it! He takes a sheet of PAPER, his pen and writes "This pen
M	INADVERTENTLY:	"This pen is blue." Greta enters to find-- FLETCHER running around the office, shaking the blue pen in
F	GRETA	Boss, what's wrong?
M	FLETCHER	. The pen is blue!! The pen is . b l u e ! ! The GODDAMN PEN IS
M	BLUE !!!	Almost weeping, he collapses into a chair. A moment --
F	GRETA	Red? FLETCHER Oh, that's easy for you to say?!
F	GRETA	Are you all right?
M	FLETCHER	I have to go home.
F	GRETA	Home? Was the case settled?
M	FLETCHER	No. I have to be in court at one-thirty.
F	GRETA	Well, then how can you.go home?
M	FLETCHER	I don't know, I don't know!!!
F	GRETA	Okay. Before I forget -- Rubin and Dun n called. They want to know where the Darvis settlement offer stands.
M	FLETCHER	I only proposed a settlement t o dick with them. I never had any intention of going th ro ug h with it. . Not certain why her boss would .shoot himself in the foot,
F	GRETA	'·...dick with them." Okay. Your accountant, Philip, called to remind you about getting together. .
M	FLETCHER	I'd rather shave my ass and sit in vinegar..
F	GRETA	Got it. And your mother called again. Are you still on vacation? No.
F	GRETA	So then you're here? Yes.
F	GRETA	I ' m having a little trouble following you. what do I say to your mom? Tell her I'm a thoughtless son who'd rather spend ten hours clogging the wheels of justice than five minutes talking to her-- but only if she asks. You.might also add that she deserves better, though I hope to God you don't.
F	GRETA	Thanks for clearing that up. And that's it, except your ex called and asked when you were cowing over to see your son. He reacts, particularly stunned by this truth.
M	AUDREY'	Hey, Fletcher. T was wondering if you were going to still pick up Max after school today.
M	FLETCHER	I don't think I can. I had a case I was certain would settle and it didn't. I have to go to trial this afternoon, God help me.
F	AUDREY	Right.
M	FLETCHER	It's true... I really do want to see Max, today. Fletcher considers what he just said, realizes it is true.
M	FLETCHER (CONT'D)	How about that. I really do. But things keep coming up at the last minute.
M	FLETCHER	Yes, but-this time it's different.
F	AUDREY	I see. And how is that?
M	FLETCHER	This time I'm telling the truth.
F	AUDREY	But last night you weren't?
M	FLETCHER	No.
F	AUDREY	What were you doing?
M	FLETCHER	Having sex.
F	AUDREY	It must have been with someone very "special."
M	FLETCHER	No. It was with someone I don't even like. But I thought it would help my career and at the moment that attending my son's birthday!
M	A U D R EY	M y God!! She SLAMS DOWN the phone. Audrey gets out. She leans over to say good-bye to her
M	MAX	Is dad picking me up?
F	AUDREY	No, I'm sorry, Max. He can't make it. I will. I'll work it out. Max is disappointed.
M	MAX	I guess my wish didn't come · true.
F	AUDREY	What wish?
M	MAX	I wished that, for just one day, Dad couldn't tell a lie. Max heads toward his teacher. Audrey is deeply moved.
M	FLETCHER	Answer, answer, answer... Hello.
M	FLETCHER	Audrey, let me explain. Something has happened to me--
F	AUDREY	Fletcher, something else is about to happen to you. What do you mean?
F	AUDREY	Max and I are moving to Boston.
M	FLETCHER	What?!
F	AUDREY	Jerry asked me to marry him. He wants Max and I to fly with him this weekend to pick out a house. And I'm going to go. God knows I don't have any reason to stay here.
M	FLETCHER	Wait, you can't move! If you take Max away... I'll practically never see him.
F	AUDREY	Well then you'll have pretty much the same relationship you have with him now.
M	FLETCHER	Audrey, please.... Is this because of what I just said on the phone?
F	AUDREY	That was the straw and this is the camel's back saying goodbye.
M	FLETCHER	Where are you?
F	AUDREY	Heading home.
M	FLETCHER	there. I'll be right over. We have to talk.
M	FLETCHER	I'll be right- there! Aaaah!
F	MIRANDA	Flet cher. Fletcher, Fletcher, Fletcher. I must confess-- after last night's incident, I was. . . hurt. So hurt. I was tempted to do whatever little things lie in my power to scuttle your chances of making partner. Fletcher is FRIGHTENED.
M	MIRANDA (CONT'D)	But then I thought, "No, that 's not fair. Fletcher didn't mean to insult me." "It was just some massive, boneheaded misunderstanding, and Fletcher is very, very sorry." Fletcher smiles. It looks like he's off the hook, until--
M	MIRANDA (CONT'D)	Isn't that right, Fletcher?
M	FLETCHER	Uh -- not really, no.
F	MIRANDA	N o ? No?! What are you sayi ng? Have you no respect for me?!
M	FLETCHER	None, whatsoever. I mean, I ' d like to respect you, and if it weren't for your mistreatment of the associates, your rudeness to the staff, and the fact that your work sucks, I would.
M	M IRANDA	But -- what about last night?
M	FLETCHER	I was afraid you wouldn't support my partnership if I turned you down. Plus, I have an immature need for sexual conquests.
M	FLETCHER	Gotta focus. . . gotta focus. He's so preoccupied that he speeds through a crosswalk and
M	FLETCHER	The color of the pen is -- re d ! . But he hasn't regained the ability to lie -- he's referring
M	DRIVER	What's your problem, schmuck?!
M	FLETCHER	I ' m an inconsiderate prick!
M	FLETCHER (CON "ID)	C'mon, you can do this! The color of the pen is -- RED! This time he's referring to the flashing red light of a
M	FLETC HER	S hi t !!
M	POLICE OFFICER	Do you know why I stopped you?
M	FLETCHER	Depends on how long you were following me.
M	POLICE OFFICER	Why don't we take it from the top.
M	FLETCHER	Here goes -- I didn't fasten my seatbelt, I didn't glance in my rearview mirror, I didn't signal when I pulled away from the curb, I sped, I followed too closely, I ran a stop sign, I almost hit :a Chevy Camaro, I almost hit a ge ezer, I sped some more, I failed to yield at a crosswalk, I changed lanes in the intersection, I changed lanes without signalling, and I changed lanes in the
M	INTERSECTION-WITHOUT	signalling while running a red light and speeding. A long moment.
M	POLICE OFFICER	May I see your driver's license?
M	FLETCHER	No.
M	POLICE OFFICER	And why is that?
M	FLETCHER	It's in my other pants.
M	POLICE OFFICER	I see. And where are your · other pants?
M	FLETCHER	Hanging from my boss's credenza.
M	POLICE OFFICER	Do you expect me to believe that?
M	FLETCHER	No.
M	POLICE OFFICER	Do you think I'm an idiot?
M	FLETCHER	Yes -- but that's beside the point! My license actually is in my other pants, and they actually were hanging from a credenzaJ I wouldn't lie to you! I mean, I would if I could, but I can't!
M	POLICE OFFICER	I see. So you ..have no reason to try and hide your license from me?
M	FLETCHER	I didn't say that. I have other reasons. Seventeen reasons, to be precise. Unpaid parking tickets. Be gentle. Audrey, wait!
F	AUDREY	Wait? You know, I just had an insight into myself. I ' m crazy. You call me up and . tell me to wait here because you'll be right over and -- here's the crazy part -- I actually wait.
M	FLETCHER	I can explain--
F	AUDREY	I missed a department meeting. I. . . Did you come in a cab?
M	FLETCHER	Yes.
F	AUDREY	Where's your car?
M	FLETCHER	Thank you. . I can't tell you how much this means to me.
F	AUDREY	I can. One thousand, six hundred, and fifty-four dollars and eleven cents.
M	FLETCHER	Ow.
M	FLETCHER (CONT'D)	You scratched my car!
M	TOW-YARD EMPLOYEE	Where? .
M	FLETCHER	Right there!
M	TOW-YARD EMPLOYEE	Oh that? That was already there. Why, you -- you liar! Do you know what I ' m going to do about this?
M	TOW-YARD EMPLOYEE	What?
M	FLETCHER	...Nothing! Because if I take you to small-claims court, it will just drain eight hours out of my life, and you probably won't show up, and if I finally got the judgment you'd just stiff me anyway, so what I'm gonna do is piss and moan like an impotent jerk and . then bend over and take it up the tail pipe!
M	TOW-YARD EMPLOYEE	You've been here before, haven't you? He flips Fletcher the keys and goes.
F	AUDREY	Well I can't remember when I've had more fun, now if you'll excuse me, I have a class. She starts out.
M	FLETCHER	Audrey, wait. I want to talk to you about this Boston situation. What do you want to say?
M	FLETCHER	You can't go. It's not fair. Taking Max three thousand miles away is not fair.
F	AUDREY	Let' s define "fair." Last · night a five-year old boy was crushed because his father lied to him about coming to his birthday party. Fair?
M	FLETCHER	Last night--
F	AUDREY	-- Was none of my business. When it happened two years ago it was my business, but now I don't have to care anymore. See, that's the magic of div orce . But it does matter to Max. Everything you do matters to him... and everything you don't do.
M	FLETCHER	All right-- now let me tell you something...you're absolutely right. I'm guilty of all charges. I'm throwing myself on the mercy of your -court. Audrey doesn't know what to say. Fletcher seems very I have an idea. I'll come over tonight, right after court lets out and play with M ax. Have him invite some fri ends over. We'll have a game and everything. Then, you and I can sit down and talk.
F	AUDREY	We're suppose to be on a plane
M	FLETCHER	No, Audrey. Just talk to me abou t this first. Please. Au drey, I've lost you. Don't make me lose Max, too.
F	AUDREY	You're really coming?
M	FLETCHER	This is iron-clad. This is the mother of all promises. What time?
F	AUDREY	...Six?
M	FLETCHER	Ten-to-six. All right... only if I tell Max you're coming and you don't show up and I have to see that look on Max's face -- that heartbreaking look-- it's Boston, Fletcher.
M	FLETCHER.	I will be there. I hope so. Do you know what your son was doing at nine- fif teen las t ni ght? He was making a wish on his birthday c ake. He was wishing that, for just one day, his dad couldn't tell a lie. She drives away. Fletcher starts for his car, pensive,
M	FLETCHER	Oh my God! That-'s it! An innocent kid - - a heartfelt plea-- a birthday wish! Sure, it' s impossible --but it 'makes sense!..! If he can wish it, he can unwish it!
M	MAX	Dad! Are you Max's dad? I ' m Ms. Berry, Max's teacher!
M	FLETCHER	Hi. Listen, I need to talk to
F	MS. BERRY	Mr. Reid, we were just talking ab ou t careers. You're a lawyer, aren't you? Yes.
M	MAX	Mr. Reid it'would be wonderful for the children to hear something positive about lawyers!
M	FLETCHER	Well, actually-- ·
F	MS. BERRY	Children! .Mr. Reid is going to tell us what it's like to be a lawyer. She leads the kids in APPLAUSE. Fletcher takes center
M	FLETCHER	Uh, hi. Uh, I'm a lawyer and I work at a big law firm with a lot of other lawyers and I do stuff in a law court. Thank you. He starts out.
F	MS. BERRY	One moment, Mr. Reid. Maybe some of the children have
M	QUESTIONS	Jeffrey?
M	JEFF	What kind of lawyer are you?
M	FLETCHER	Mostly, I ' m a divorce lawyer.
M	BILLY	What's that?
M	FLETCHER	It means if you're daddy left your mommy, he'd call me.
M	CRAIG	So what do you do?
M	FLETCHER	I help people fight over their money and their children.
M	THEODORE	Can't they fight without you?
M	FLETCHER ' "	They could but then J wouldn't make a living.
M	JILL	Why would my daddy leave my mommy?
M	FLETCHER	To marry a younger woman. To escape a loveless marriage and have cheap meaningless sex. To cling to an illusion of youth as his body gives way to sore backs, flat feet, spare tires, gum disease, hair loss, liver spots, kidney stones, clogged arteries, diabetes, goiter and eventual death. The kids EYES GO WIDE. A moment, then: Well, I think it's time for fingerpainting.
M	FLETCHER	Monster-Max.
M	MAX	Dadzilla. You came to play catch?
M	FLETCHER	No. I ' d like to, but I can't right now. Max is disappointed again.
M	FLETCHER (CONT'D)	I ' m sorry I missed your party la st night. How was your Uncle Glen?
M	MAX	Stupid. His big nose and stupid orange hair...
M	FLETCHER	That's why he should have worn make-up. Fletcher elbows Max, playfully, trying to induce a laugh.
M	' MAX .	I want to play kickball with my friends.-
M	FLETCHER	Yeah, okay, urn... Your mother told me about... the wish you made last night. It came true. Max is amazed.
M	MAX	Really? You mean you have to tell the truth?
M	FLETCHER	Yes. No matter what?
M	FLETCHER	No matter what.
M	MAX	Is wrestling real?
M	FLETCHER	In the Olympics, yes. On . Channel 23, no.
M	MAX	Will sitting close to the TV set make me go blind?
M	FLETCHER	Not in a million years.
M	MAX	If I keep making this face-- will it get stuck that way?
M	FLETCHER	Uh-uh.
M	MAX	.If I go in the water right after lunch, will I drown?
M	FLETCHER	Only if you can't 'swim.
M	MAX	Why do I have to eat squash?
M	FLETCHER	Because your mom buys it.
M	MAX	How come you're always too busy to play with me? The sudden shift in tone startles Fletcher. He feels
M	FLETCHER	I . . . I don't know. I ' m . . . Hey, you know I'm coming over to nig ht. We're gonna play together.
M	MAX	Baseball?
M	FLETCHER	. Yes! This is absolutely an A-number one promise. You and I -- tonight -- baseball. Fletcher and Max do their ritual "five" slap.
M	FLETCHER	Now, listen, Max, I need a favor from you. I ' m in a little trouble today. I need you to take that wish back.
M	MAX	So you can lie?
M	FLETCHER	Not to you.
M	MAX	To who?
M	FLETCHER	Max, sometimes grownups... need to lie. It's hard to explain, but i f . . . Look, here's an example. When Mommy was pregnant with you, she gained a little weight. Se venty pounds. I thought she was gonna give birth to a car. But she'd say to me "How do I lo ok?" So I'd say, "Oh, honey, you're beautiful, you're glowing.11 Otherwise, I would've hurt Mommy's fee ling s. Understand? Max nods.
M	MAX	You didn't think she was beautiful.
M	FLETCHER	Right. No... Max, I don't know how to get along in the grown-up world if I have to stick to the truth. I could lose my case, I could lose my promotion, I could even lose, my job... Do you understand? Max shakes his head "no." Will you help me anyway? A moment -- then Max reluctantly nods.
M	FLETCHER (CONT'D)	That's my boy! Fletcher opens the box, revealing a cake and candles.... He Now, do whatever you did last night... only this time, make an un-wish. Not really happy, Max turns to the candles on the cake. He
M	MAX	I did it. ^
M	FLETCHER	Great! Great! Now to test --
M	SLAPS HIM.	Fletcher returns to his son.
M	MAX	Did it work?
M	FLETCHER . .	Not like I ' d hoped. Did you really unwish it? Max nods.
M	MAX	Only...
M	FLETCHER	Only what?
M	MAX	Yesterday, when I wished it, I r ea lly meant it. This time when I unwished it I only did it 'cause you told me to.
M	FLETCHER	Well, then do it again. Only this time, mean it.
M	MAX	I can't.
M	FLETCHER	Why not?!
M	MAX	Because I don't want you to lie.
M	FLETCHER	I explained this to you! I have to lie. Everybody lies! Mommy lies, even the wonderful Jerry lies--
M	MAX	But you're the only one who makes me feel bad. Fletcher is stunned by how much this hurts. Max, recess 'is over, come on in.
M	MAX	I have to go.
M	FLETCHER	I am coming over, tonight, Max. You believe me, don't you? Max hesitates, then nods. I'll see you tonight, buddy... That's a promise. Max heads back to class. Fletcher picks up the cake, looks
M	MACHO ATTORNEY	Yo, Fletcher! How's it hanging?
M	FLETCHER	Short and shrivelled. Fletcher hurries up the steps when he spots Philip. He
M	PHILIP	Fletcher! I'm still waiting for your call. I guess you must've lost my card --
M	FLETCHER	No --
M	PHILIP	Or my phone was busy --
M	FLETCHER	No -- Or you just forgot --
M	FLETCHER	No --
M	PHILIP	Or something. So anyway,' why don't you swing by my place around seven-thirty! Philip starts off, when Fletcher calls after him resolutely.
M	FLETCHER	Philip... I don't want to come over to your house! A long moment, then --
M	PHILIP	Fi n e ! We'll go out! There's this new karaoke bar I've been dying to try. I'll pick you up at your office! Seven- thirty! ! And he runs off. Frustrated, Fletcher hurries on.
F	GRETA	Do you want your messages?
M	FLETCHER	No. He goes into his office. Greta is concerned. She follows
F	GRETA	Are you okay?
M	FLETCHER	My son hates me.
F	GRETA	No! He loves you. I've seen y ou together. You're his hero.
M	FLETCHER	O h yeah? Last night at his birthday party, he made a ·wish. That I wouldn't be able to tell a lie for one whole day.
F	GRETA	Kids...
M	FLETCHER	It came true.
F	GRETA	What?
M	FLETCHER	It's true. Didn't it seem odd to you that I kept telling the truth all morning?
F	GRETA	Well, yeah, but... You're telling me that you can't lie.
M	FLETCHER	That's right! I am incapable of lying.
F	GRETA	Just today?
M	FLETCHER	Apparently until 9:15 tonight. It's a twenty-four hour curse.
F	GRETA	Yes, those are going around.
M	FLETCHER	You don't believe me.
F	GRETA	Of course not.
M	FLETCHER	Go ahead. Ask me something I ' d normally lie about. She thinks.
F	GRETA	A ll right. Remember a few months ago, I wanted a raise-- Forget it. Let's not do this.
F	GRETA	-- and the firm wouldn't.give me one. And I asked you if you would give it to me out of your own pocket and you said the company wouldn't permit it because it creates jealousy among the other secretaries? Was that true or did you just not want to pony up the dough?
M	FLETCHER	Greta, please... Yes Judge Stevens, hi!.. Fletcher Reid. I ' m scheduled to be in your court in half- an-hour... Judge Stevens, I badly, badly need a continuance. . . so I can go home and stay there the rest of the day...111? Am I ill? He wants to say "yes", but he can't.
M	FLETCHER	In a way. Please, lie to him for me. Greta holds up a framed photograph.
F	GRETA	I remember when you. bought me t hi s silver frame. From Tiffany's. . . . Tiffany's?
M	FLETCHER	Jumbo's House of Junk. She thrpws it in the trash and keeps packing.
M	FLETCHER (CONT'D)	I'll give you the raise!
F	GRETA	Here's your raise.
M	FLETCHER	Hi, Judge Stevens?... Yes, I know I haven't given you a reason. The PHONE RINGS.
M	FLETCHER (CONT'D)	But if you could just do this for me, I-- The phone won't stop ringing. .·'
M	FLETCHER (CONT'D)	Hold on, please, Hello... Mom!! The phone flies into the air. He catches it. Mom... Well, I wasn't actually on vacation... Because I didn't want to talk to you... Because you insist on talking to me about Dad's bowel movements -- size, color, frequency... I'll call you later... No, not really. He pushes -two more buttons. Then SCREAMS.
M	FLETCHER (CONT'D)	Oh dammit! I cut him off! I cut off the Judge! Greta... He falls to his knees.
M	FLETCHER (CONT'D)	I'm on my knees in a nine hundred dollar suit. Don't leave. Greta stops. She seems to consider.
F	GRETA	A few years ago a friend of mine had a burglar up on her roof.
M	FLETCHER	Yes?
M	GRETA ..	A burglar. -He fell through the kitchen skylight and landed on a cutting board on a butcher's knife, cutting his l e g. He sued my friend. The Thanks to guys like you-- he won. My friend had to pay him six thousand dollars. Is that justice?
M	FLETCHER	No. . . but what' s your poijit!
F	GRETA	My point is, it's hard to get justice. But this is justice, Have a nice day in court, bubbie. She leaves. Fletcher starts to give chase... He runs directly into Miranda.
M	FLETCHER	Aaaah! Miranda smiles like a cat that's trapped a mouse.
F	MIRANDA	Ah, Fletcher, so nice to bump i nto you. Are you busy?
M	FLETCHER	Extremely.
F	MIRANDA	Good. Would you follow me, please? Highly nervous, Fletcher follows Miranda down the hall.
M	MIRANDA (CONT'D)	Fletcher, did you know that the partnership committee is being headed up by Mr. Allan himself? Say, you used to work directly for Mr. Allan, didn't you? Tell me, what do you think of him? FLETCHER He's a pedantic, pontificating, pretentious bastard, a belligerent old fart, a worthless, steaming pile of cow dung. How delightful! She swings open a door, ushering Fletcher into --
F	MIRANDA	Pardon me for interrupting your, meeting. Mr. Allan, you remember Fletcher Reid. ·It's good to see you again, Fletcher. '. An involuntary WHIMPER from Fletcher.
F	MIRANDA	Oh, that's right. You used to work together. .Tell me, what do you think of Mr. Allah? Fl etc he r gulps. This is it. His career is history. He's
F	MIRANDA	I said... What do you think of Mr. Allan?
M	FLETCHER .	He's a pedantic, pontificating, pretentious bastard, a belligerent old fart, a worthless, steaming pile of cow dung. DE AN SILENCE. Then --Mr. Allan bursts into raucous
M	MR. ALLAN	Marvelous! Marvelous! That's what I love most about this firm-- the collegial atmosphere, the hearty good- fellowship! Miranda is incensed. And thanks for those flowers for my anniversary. My wife loved them.
M	FLETCHER	Well, I'm due in court... bye- bye.
M	BAILIFF	All rise. They do. Judge Stevens enters. He sits. Everyone sits.
M	JUDGE STEVENS	Counselors, are we ready to begin?
M	FLETCHER	N o sir! We are not ready to b eg in. My client has not arrived. The doors OPEN and Virginia Cole enters with her CHILDREN -- until now. Did you and Mrs. Cole ever make lo-- forni-- roll in the h-- make the beast with two ba -- Did you two ever fu-- fu-- Fu! He begins to hyperventilate. Virginia turns to Falk.
M	VIRGINIA	Wate r! Get him water! Falk hurries into the building as Fletcher hacks on.
M	FLETCHER	Fu-- fu--
M	VIRGINIA	S it down! Get some air! Try to relax! Breathe deeply! Falk hurries out with a cup, hands it to Fletcher, who
M	VIRGINIA (CONT'D)	W hat?! What?!
M	FALK	I couldn't find any water, so I got him coffee! Fletcher runs up and down the steps, frantically fanning
M	BAILIFF	Judge is taking the bench. Fletcher's expression turns to terror.
M	JUDGE STEVENS	You may proceed, Mr. Reid. . Everyone turns to Fletcher in anticipation. In a voice
M	VIRGINIA	Sorry. One of the kids threw up in the car. Virginia takes her seat, leaving her two young children You brought your kids. . . to your divorce?
M	VIRGINIA	Sympathy.
M	FLETCHER	Well, it's working. I feel sorry for them already. The judge BANGS the gavel.
M	JUDGE STEVENS	Ms. Appleton, you may begin. Dana Appleton questions BRYSON, a private investigator.
M	BRYSON	-- From March six through June twelve, I surveilled Mrs. Cole at the behest of Mr. Cole. During that period, I noted that Mr. Cole left each day between seven-forty and seven- fifty. Thereafter, Mrs. Cole would frequently have a male visitor arrive and stay for one to four hours. I was able to take several photographs of the male visitor. He shows a photo - - o f a strapping hunk. Fletcher TAKES A
F	DANA	I see. And do you .know what Mrs. Cole and her male visitor visits?
M	BRYSON	Well, they were pretty good about keeping the shades drawn -- but I sure was able to hear. I made an audiotape of one such., "session." H e hands her the tape. Fletcher refills his glass.
F	DANA	With the Court's permission, I would like to play the tape.
M	FLETCHER	Your Honor, I object!
M	JUDGE STEVENS	And why is that, Mr. Reid?
M	FLETCHER	Because it's devastating to my ·case. The judge is startled by his candor.
M	JUDGE STEVENS	Overruled.. As Dana pops the tape into a player, Fletcher anxiously Periodically CUTTING to Virginia, Mr. Cole, Dan and the So , what did you say? You ready?
