M	CHARACTER	DIALOGUE
F	DR. PATEL	You know, we must beat the Giants, my brother.
M	PAT	I'm not supposed to be seeing you, right? Outside the office?
F	DR. PATEL	Pat, Pat.
M	PAT	That's illegal!
F	DR. PATEL	Pat, today I'm your brother in green, not your therapist. I'm so happy to see you. How wonderful that you are here!
M	PAT	Hey, Jake this is Cliff. This is my doctor, Cliff.
F	JAKE	Look, two things. We gotta watch that bubble screen for fuckin' Manning in the backfield and we gotta make sure we knock the receivers on their ass on the line of scrimmage.
F	DR. PATEL	You can say that again. Those cocksuckers! DR. PATEL, PAT and JAKE LAUGH.
M	RONNIE	Okay, you know what? I don't have her phone number. If you want, if you really want, you can call Veronica `cause she does, but I don't want to talk to Veronica.
M	PAT	Why don't you wanna talk to Veronica?
M	RONNIE	Because she brings me down, man! She just brings me down.
M	PAT	You have to change. You're not gonna throw the marriage away. There's some kind of love there. I know, I used to see it.
M	PAT (CONT'D)	You guys have a beautiful thing that got broken somewhere along the line and you gotta fix it like a chiropractor. You gotta give it a chiropractic adjustment.
M	PAT (CONT'D)	Enough with awkwardness! I don't wanna walk in your house and not be able to say what I wanna say.
M	RONNIE	You're right, man. You're right, you're right, you're right, you're right, man.
M	FAN #1	Eagles, baby! Yeah! Let's go!
M	FAN #1 (CONT'D)	What the fuck? What's that smell? Nasty Indian curry! This is America, baby! Go back to your country!
M	PAT	What, what's wrong?
M	INDIAN MAN	Hey!
M	RONNIE	Whoa, whoa, what's going on?
F	JAKE	Stay back, Pat. Stay back.
M	JAKE (CONT'D)	Leave the fucking Indians alone.
M	RONNIE	Stay here, stay here!
M	PAT	I'm not gonna go anywhere.
M	RONNIE	Don't get in a fight!
M	PAT	I'm not gonna fight. I'm not gonna fight. Hey, not my brother! Hey, hey, hey! Break it up or you'll be arrested!
M	PAT SR.	What'd you do? What happened? What the fuck happened?
M	PAT	Dad.
M	PAT SR.	The birds lose, I lose a fuckin' fortune, a fortune to Randy! What the fuck did you do?! You fucking lost it! I thought you said you had it together! You were solid!
M	PAT	I am solid. I was solid at the game, Dad. I'm solid, I'm solid now.
M	PAT SR.	You fell apart! What are you fucking talking about?!
F	DR. PATEL	Your son was trying to--
M	PAT SR.	It's all fucking ruined now. It's all ruined.
M	PAT	No, Dad! It's all fucking ruined now! It's all fucking ruined!
M	PAT	No, Dad, Dad, Dad, don't! It's all ruined, you little fucking shit!
M	PAT	No, Dad! I didn't do a fucking thing! Come on, Dad! You loser! You loser! I'm not a loser.
M	PAT SR.	You fucking loser! You ruined everything!
F	DR. PATEL	He was defending his brother!
M	PAT SR.	You fucking idiot! You spike the ball on the one yard line, you fucking idiot!
M	PAT SR. (CONT'D)	Who is this?! Who's this?!
F	TIFFANY	We need to talk right now! When you make a serious commitment to somebody, it is not cool to not show up!
M	PAT	Wait a second, I tried to call, my God, what's happening, I called--, but I tried to call you, Tiffany,
M	PAT SR.	Who is this? What is this?
F	TIFFANY	Oh, really?
M	PAT	Yes. I told you I was gonna split my time with my dad and you, and my dad was pulling me in one direction. Doctor Patel, Ronnie--
F	TIFFANY	Well, that sounds great, Pat. That's great for all of them, but all of them didn't make a commitment to me in return for my help. I'm Tiffany, by the way.
M	PAT SR.	What is this craziness with Tiffany Maxwell?
M	PAT	There's no craziness. I told you who she was, I was doing this thing with her. We had a conversation!
M	PAT SR.	She's fucking nuts! When you started spending time with her, it all fell apart. This is the fucking reason right here.
F	TIFFANY	You think I fucked up the Eagles' juju, don't you?
M	PAT SR.	Ever since, ever since he was with you, ever since-- You think that I'm why today's happened?
M	PAT SR.	That's right, you are why today happened.
F	TIFFANY	I'm the reason why today happened?
M	PAT SR.	I think so.
F	TIFFANY	Let's talk about that. PAT SR. Be my guest.
F	TIFFANY	The first night that Pat and I met at my sister's, the Eagles beat the Forty Niners handily, forty to twenty-six. The second time we got together we went for a run and the Phillies beat the Dodgers seven to five in the NLCS.
F	JAKE	She's right, Dad.
F	TIFFANY	The next time we went for a run the Eagles beat the Falcons, twenty- seven to fourteen.
M	PAT	Wow.
F	TIFFANY	The third time we got together we had Raisin Bran in the diner and the Phillies dominated Tampa Bay in the fourth game of the World Series, ten to two.
M	PAT	Oh, wow.
M	PAT SR.	Let me think about that. Wait a minute.
F	TIFFANY	Well, why don't you think about when the Eagles beat the Seahawks, fourteen to seven.
M	PAT SR.	He was with you?
F	TIFFANY	He was with me. We went for a run.
M	RONNIE	Really? That's crazy.
F	TIFFANY	There have been no games since Pat and I have been rehearsing every day and if Pat had been with me like he was supposed to, he wouldn't have gotten in a fight, he wouldn't be in trouble, maybe the Eagles beat the New York Giants.
F	JAKE	She's making a lot of sense, Pop. That's all right on all counts.
F	TIFFANY	Does anybody here happen to know what the official motto of the state of New York is on the official seal of the State of New York? Huh? Anybody? (to Pat Sr.) Do you? Do you know? "Excelsior." Look it up. Yeah, "Excelsior."
F	DOLORES	Oh Pat.
F	TIFFANY	Not that I give a fuck about football or about your superstitions, but if it's me reading the signs, I don't send the Eagles guy whose personal motto is "Excelsior," to a fucking Giants game, especially when he's already in a legal situation.
M	RONNIE	Unbelievable.
M	PAT	Wow. How did you know all that stuff?
F	TIFFANY	I did my research.
M	PAT SR.	Well, I gotta say, I'm impressed.
F	TIFFANY	Thank you.
M	PAT SR.	I gotta rethink this whole thing. I didn't trust it before, but I gotta say, now I do.
M	PAT	Oh, now you like her, Dad?
M	PAT SR.	I have to say I do. Yup.
M	RANDY	Patrizio, I feel terrible, you know? You made the bet, I won a lot of money, and now look, your whole family is in turmoil.
F	TIFFANY	Oh, fuck off, Randy. You love it. You live for this shit. You've been betting against my father for years.
M	PAT	Is that right?
F	TIFFANY	You're twisting the knife right now. You get off on it!
M	RANDY	That's bullshit! That's not true! Don't say that!
F	TIFFANY	You get off on it! If not, then prove it. Prove it.
M	PAT SR.	Yeah, prove it, prove it!
M	RANDY	How do you want me to prove it?
M	PAT SR.	How's he gonna prove it?
F	TIFFANY	By giving them the chance to win back everything, double or nothing.
M	PAT	No, no, no, no, no, no, no.
M	RANDY	Double or nothing on the Bengals, next week? Is that what you're saying?
F	TIFFANY	No.
M	TIFFANY (CONT'D)	Against the Cowboys.
M	TIFFANY (CONT'D)	That's your team isn't it, Randy?
M	PAT	That's his team!
F	TIFFANY	I know who his team is.
M	RANDY	When is the game?
F	TIFFANY	December twenty-eight, last game of the season.
M	PAT	Oh, my God.
F	TIFFANY	Same day as the Benjamin Franklin Pairs Open Freestyle Dance Competition.
F	DOLORES	Oh God.
M	PAT SR.	Randy, I thought they were America's Team. Don't you believe in America's Team?
F	TIFFANY	Yeah, Randy, don't you believe in America's Team?
M	RANDY	Yeah, I believe in America's Team but if I win that bet, I win your book, you're out of action, you get no restaurant, no nothing.
M	PAT SR.	I like it.
F	DOLORES	No. No, Patrizio--
M	PAT SR.	I believe in the Eagles, I believe in my son, I'll take the action. I'll take it.
M	PAT	Dad!
F	DOLORES	Patrizio, don't! It's toxic!
M	PAT SR.	I have faith, I have faith. Excelsior belongs in this house--
M	PAT SR.	--not in the State of New York. In this house.
M	PAT	Dad, listen to me. I didn't know that "Excelsior" was the state motto of New York, okay?
M	PAT SR.	I didn't know, either, but now I know.
M	PAT	I know, but listen to me, this is toxic. Dad, Dad, Dad, this is toxic, you shouldn't be doing this, you shouldn't be doing--
M	PAT SR.	Be quiet, shut up. You already did enough. (to Randy) Randy, what do you say? My birds, Benjamin Franklin's team favored by one and a half points. I'll give you three more.
F	DOLORES	Patrizio, stop it! And Randy, don't you take the bet!
M	PAT SR.	In fact, I'll give you ten points.
M	PAT	No, Dad! Dad!
F	JAKE	Dad!
M	PAT SR.	You have to take that bet on the Cowboys.
M	RANDY	Dolores, would you stop him?
F	JAKE	Jesus!
M	PAT SR.	How could you not take that bet? Even with the ten points I give you, that's an insane spread to your advantage. Cowboys are cowards. And I'll bet you're such a coward, you won't take the ten. Plus, are you listening, plus whatever their score is at the dance thing. (to Tiffany) What's that? Tiffany, what's that?
M	PAT	What? No, no, no, no.
M	RANDY	You're crazy to give away that many points. That's ridiculous! I won't take that! However, wait a second. I do like the idea of a parlay.
F	DOLORES	What? No parlay! No!
M	PAT	No, don't do it. Don't do it.
M	RANDY	Pat, how do they run this dance competition? I mean, how do they score it and everything?
M	PAT	I don't know, I don't know how they fucking score! We're participating. We're not, we're not a part of it. There are people, this is a high- end dance contest. I don't know. Do not put it as part of the parlay, Randy. Don't--
F	TIFFANY	They go by the Philadelphia rules. Each dancer is scored on a scale of one to ten, ten being the highest. You have to average the four judges' scores.
M	RANDY	Okay, score is from one to ten, right? And you guys are how good?
M	PAT	We suck.
F	TIFFANY	We don't suck. Pat's a beginner, I'm okay, we're happy just to be going there.
M	RANDY	And how are the people you're competing against?
F	TIFFANY	They're good. Some of them are professionals.
M	RANDY	They're good? Better than you? Pause. Tiffany says nothing.
M	PAT	A lot better.
M	RANDY	A lot better. So if I was to say you only have to score five, I would be really very generous, right?
M	PAT	No, no, that would be amazing if we got five. Let's not get away--
F	TIFFANY	Oh, come on, we can get a five out of ten! Gimme a break! Gimme me a break!
M	PAT	We can't get five!
M	PAT SR.	Give `em a five. Give `em a five.
F	TIFFANY	We can do a five.
M	PAT	What are you talking about, Dad? You haven't even seen us dance!
M	RANDY	That's the parlay.
F	DR. PATEL	Will somebody please explain to me the parlay? Please?
M	RONNIE	You gotta win two bets or you lose the whole thing. For Pat Sr. to win, the birds gotta beat the Cowboys plus Pat and Tiffany gotta get at least a five at the dance.
F	DR. PATEL	That's very, very manic indeed.
M	RONNIE	That's the parlay.
M	RANDY	Shake on it.
M	PAT	You know what? I'm not gonna be a part of this. (to Randy) Randy, Randy, you're a sickness. You're a fucking sickness, Randy. I'm out.
F	TIFFANY	Pat, you can't quit.
M	PAT	I'm not doing the dance. I'm out.
F	TIFFANY	Pat, calm down. Thank about it.
M	PAT	See you later.
F	TIFFANY	Pat, no.
M	PAT SR.	What are you doing?
F	TIFFANY	Pat. I'm out. Here we are again at the one yard line. DeSean, snatching defeat from the jaws of victory. There you go.
M	PAT	What does that even mean, Dad? I'm not gonna make that, that, that connection that you're making with DeSean Jackson. It doesn't matter anymore okay? Just because I have the fucking jersey on...I'm not gonna do it. I'm sorry.
F	TIFFANY	You are not a stand up guy right now. If it's me reading the signs...if it's me reading the
M	PAT	If it's you reading the signs? You're reading the signs? Oh, okay.
F	DOLORES	Pat!
F	TIFFANY	You are not a stand up guy!
F	DOLORES	Pat!
F	DOLORES	I told you not to push it.
M	PAT SR.	Yeah, but he's gotta do this thing. He can't be a quitter. He cannot be a quitter. You took that stupid parlay thing, and now he won't do the dance and it was very constructive for him, and you ruined it.
F	TIFFANY	There's only one way to get him to show.
M	PAT SR.	What's that?
F	DOLORES	Oh, what's that?
F	TIFFANY	We have to tell him Nikki's gonna be there. They stare at her.
F	DOLORES	She won't come. She can't come.
F	TIFFANY	We have to tell him that she's coming.
M	PAT SR.	We have to tell him that she's going.
F	DOLORES	But that's a lie!
F	TIFFANY	It's a white lie. PAT SR. It's a white lie, what's that matter? That's no big deal. So it's a little lie.
F	TIFFANY	There's no other way.
M	PAT SR.	You know, we gotta leave a trail of bread crumbs so that he can live his life without ruining it.
F	DOLORES	No. I don't approve. You can't do it.
M	PAT SR.	Well, you know, I didn't approve when you called her and you told her where he was running, so she could ambush him. I didn't approve of that, but you did it anyway, so I'm doing this anyway. That's it.
F	TIFFANY	We're gonna tell him Nikki'll be there. You gotta be part of it.
F	TIFFANY	We have to do it.
F	DOLORES	Aren't you nervous to be lying?
F	TIFFANY	Yeah. A little bit. But it's for the best. "...but if it was me reading the signs...." That's it.
F	DOLORES	Okay.
F	TIFFANY	Hey.
M	PAT	Hey, what's up? Sorry I'm late.
F	TIFFANY	It's fine.
M	TIFFANY'S MOTHER	Is everything all right?
M	PAT SR.	Everything is fine. Cheers.
F	TIFFANY	This isn't working!
M	TIFFANY (CONT'D)	Stupid!
M	TIFFANY (CONT'D)	This just isn't working!
M	PAT	Come on, it's gonna be great. Nikki's gonna be there. You know? Everything's gonna come together. It's what's meant to be. You okay?
M	PAT (CONT'D)	Don't get wobbly on me.
F	TIFFANY	I'm not.
M	PAT	We have a dance to do. We have a parlay. You gotta stay focused.
F	TIFFANY	I'm focused.
M	PAT	Okay, let's go.
M	PAT	Look at the dancers. You see them?
F	TIFFANY	Shit.
M	PAT SR.	Hey, Randy, Jake. What do we got?
F	JAKE	Dallas just tied with another field goal, three-three. I'm worried about the bet.
M	PAT SR.	Don't worry about the bet.
F	JAKE	I'm worried about the bet.
M	PAT SR.	Holy shit.
M	PAT SR. (CONT'D)	Is this "Dancing with the Stars"?
F	DOLORES	Well, you knew that. Maybe you should've scouted `em. Look at those fucking dancers! You can give me the money now, you know? Patty, Patty, all we have to do is we have to make a five. That's all. You stay here and watch the game with me.
F	TIFFANY	The birds are better when Pat is with me. We settled that.
M	PAT SR.	Stay for the next quarter.
M	PAT	Relax, we're gonna do fine, okay? I'll see you in a little bit. I'll see you up there, okay?
M	PAT SR.	Okay.
M	DANNY	Hey, Pat, Tiffany!
M	PAT	Hey.
M	DANNY	What a glorious, beautiful occasion, man.
M	PAT	Yeah, yeah. All right, buddy, I'll see you. Alright. Wish me luck, man.
F	DR. PATEL	Excelsior! Pat and Tiffany walk to sign in.
M	PAT	hands) Wait, what's this?
F	TIFFANY	What? I thought you were doing it.
M	PAT	Oh, I thought you were doing it. We're doing a dance thing anyway, for God's sake.
M	PAT (CONT'D)	You okay?
F	TIFFANY	I want you to remember everything. I want you to remember all of the good stuff that we have here.
M	PAT	Of course I do.
F	TIFFANY	Just check in. I gotta go find Veronica.
M	PAT	Hi, good evening.
M	MALE OFFICIAL	Evening.
M	PAT	Check in? How many dancers are there? What?! Nikki? Nikki. Oh, Jesus. She seems devastated by Nikki actually being there for Pat. What the fuck?
F	VERONICA	Sweetie, sweetie. Honey, calm down.
F	TIFFANY	You're killing me. You're killing me!
F	VERONICA	Tiffany, please. She'll see how well he's doing, maybe she'll lift the restraining order.
F	TIFFANY	Oh, my God. Oh, my God.
M	RONNIE	Pat told me. He told me you should never throw a marriage out the window. Pat did not say that. He didn't say that.
M	RONNIE	He said it several times, Tiffany, and this is his chance. You gotta give him a chance.
F	TIFFANY	Bartender! Bartender, can I get a vodka, please?
M	GUY AT BAR	So, you want another one?
F	TIFFANY	Sure.
M	TIFFANY (CONT'D)	So what do you do?
M	GUY AT BAR	I'm a lawyer. Litigator, actually.
F	TIFFANY	Oh, the arguing kind.
M	EMCEE (O.S.)	And the scores for Santos and Aguilar are: seven point six, seven point three, seven point four, and six point nine for an average score of seven point three. Three, two, one! Philadelphia beats Dallas! They are on their way to the playoffs.
M	DANNY	Randy, what the fuck is happening, man?!
M	PAT SR.	Yeah, Randy, what the fuck is happening?! Where's Tiffany?
M	PAT	I don't know, Mom. Have you seen her?
F	DOLORES	You gotta find her.
M	PAT	I know, Mom, I know.
M	PAT (CONT'D)	Hey, WHAT are you doing?
M	GUY AT BAR	She's fine, buddy, she's with me.
M	PAT	She's fine?
M	GUY AT BAR	Yeah.
M	PAT	Why don't you shut up, okay?
M	PAT (CONT'D)	How many drinks have you had?
F	TIFFANY	I've had two vodkas.
M	PAT	Listen, I don't know what choices you've made, but you gotta deal with it right now, okay? We're in this.
F	TIFFANY	We're in what?
M	EMCEE	Next, Pat Solatano and Tiffany Maxwell.
F	TIFFANY	You know, I used to think that you were the best thing that ever happened to me, but now I think that you might maybe be the worst thing and I'm sorry that I ever met you.
M	PAT	Good for you. He pulls her out of her chair to go to the stage. TIFFANY AND
M	EMCEE	And the scores for Makarov and Tretiak are: six point seven, eight point one, seven point five and six point five for an average score of seven point two.
M	RONNIE	They were great and they only got a seven point two. This is a tough room.
F	TIFFANY	Got it.
M	EMCEE	Up next, ladies and gentlemen please welcome Pat Solatano, Jr. and Tiffany Maxwell.
M	DANNY	Damn.
F	JAKE	Let's go, Patty!
M	DANNY	Come on, Pat! Yeah, Pat! Yeah! We love you, Pat!
M	EMCEE	Alright, let's see the scores for Solatano and Maxwell.
M	EMCEE (CONT'D)	We have a four point nine, four eight, a four nine...
M	FEMALE DANCER	That's really too bad, guys. That's a lot of fours.
M	EMCEE	...and and a five point four for an average score of..five point zero.
M	MALE DANCER	Sorry about that, guys. What?! Come on! Pat and Tiffany run to Pat Sr., Dolores, everyone. Pat and
M	PAT	Dad, Dad, did the Eagles win?
M	PAT SR.	The Eagles won, forty-four-six! They won, forty- four-six!
M	RANDY	Come on! Why are they so excited about a five?
M	EMCEE (CONT'D)	We'll take a ten minute break.
F	TIFFANY	Thank you! You're amazing! Thank you for coming.
F	NIKKI	Of course.
M	PAT	How are you? You okay?
F	NIKKI	Good. How are you?
M	PAT	I'm really good. Yeah, thanks.
F	NIKKI	You looked really happy out there.
M	PAT	Did I?
F	NIKKI	Yeah.
M	PAT	Yeah, who'd have thought, dancing? Tiffany reacts from afar, stung.
F	NIKKI	You look incredible.
M	PAT	Thank you.
F	NIKKI	You lost a lot of weight.
M	PAT	I've been reading your books and, I have a positive attitude. I'm on medication, I'm in therapy.
M	PAT	Where's Tiffany?
M	PAT SR.	She left.
M	PAT	What do you mean, she left?
M	PAT SR.	She left. What do you think!
M	PAT	Where is she?
M	PAT SR.	Let me tell you, I know you don't wanna listen to your father, I didn't listen to mine but I'm telling you, you gotta pay attention to the signs. When life reaches out with a moment like this, it's a sin if you don't reach back. I'm telling you, it's a sin if you don't reach back, and it'll haunt you for the rest of your days like a curse. You're facing a big challenge in your life right now, at this very moment, right here. That girl loves you, she really loves you. And I don't know if Nikki ever did, but she sure as hell doesn't love you right now. I'm telling you, don't fuck this up.
M	PAT	I love you, Dad. Hey! Would you just leave me alone?!
M	PAT	Wait a second!
M	PAT (CONT'D)	I have one more letter for you to read, okay? What the fuck is the matter with you? Give it to her yourself!
M	PAT	Let me say something. You don't ever have to see me again if you just read it, alright?
F	TIFFANY	This is so fucked up.
M	PAT	Yeah, just read it. "Dear Tiffany... SHE STOPS, surprised it is addressed to her. "...I know you wrote the letter. (long pause) The only way you could meet my crazy...." "...was by doing something crazy yourself. Thank you. I love you. I knew it the minute I met you. I'm sorry it took so long for me to catch up. I just got stuck. Pat." I wrote that a week ago.
F	TIFFANY	You wrote that a week ago?
M	PAT	Yes, I did.
F	TIFFANY	You let me lie to you for a week?
M	PAT	I was trying to be romantic.
F	TIFFANY	You love me?
M	PAT	Yeah, I do.
F	TIFFANY	Okay. SHE LEANS FORWARD AND KISSES HIM, they kiss. Camera pulls The world will break your heart ten ways to Sunday, that's guaranteed. And I can't begin to explain that- -or the craziness inside myself and everybody else, but guess what? Sunday is my favorite day again. I think of everything everyone did for me and I feel like --a very lucky guy.
M	PAT SR.	We have to beat the Vikings by three. I'm givin' you a six, which is very generous after the beating you just took. So what are we doin', what are we talkin' about here?
M	RANDY	I'd like to do another parlay if we make it to the next round, that's all.
M	PAT SR.	But we are gonna make it to the next round. We're gonna beat...
M	RONNIE	No, that was me that did that.
F	JAKE	No that was me.
M	RONNIE	That was me. I played the Jack.
M	DANNY	So you put the bread crumbs, the garlic in the steak and you roll it up with the toothpicks?
F	DOLORES	Yeah. For, oh, maybe three hours, plus. Everything's good, everything's good, yeah. I got you, you're all down. (pause) No, Randy, he's complaining. You know he lost a lot of money. He's moaning and groaning. The restaurant's happening because of Randy, so everything's good. TIFFANY SITS DOWN ON PAT'S LAP AND THEY TALK (we cannot hear
