M	CHARACTER	DIALOGUE
M	DEAN	My moral compass is pointing true north, if you read me. Right Taco Bill?
M	DEAN (CONT'D)	And by the way, Ronimal-- I was married. Was.
M	RONALD	Oh jeez. You and Patti split? Sorry to hear that.
M	DEAN	Ah, she's a fucking asshole. Cedar Rapids, 6-12-09 Together 17 years. Lucky if one of `em was decent. ASS. FUCKING. HOLE.
M	DEAN (CONT'D)	What I was talking about anyway, Ronimal, is that from what I can deduce, young Timbo Lippe here has led a-- shall I say-- sheltered existence. And I think we oughta help him, y'know, aroo-aroo!
M	RONALD	ASMI isn't a vacation for everybody, Dean. End of the day, Tim's here to work and to win. For his agency.
M	TIM	Exactly. And P-S, I would never, ever have "relations" or whatever with another woman.
M	JOAN (O.S.)	Hubba-hubba, check out these studs.
M	RONALD	Joan Ostrowski-Fox.
M	DEAN	The O-Fox!
F	JOAN	Here she is, Miss America.
M	RONALD	You fly in from Omaha, Joan?
F	JOAN	Yup. And boy are my arms tired. Cedar Rapids, 6-12-09 No, not really. I drove. Deanzie, let me say... ... you look maah-velous!
M	DEAN	Oh yeah baby. Shag-a-licious!
M	DEAN (CONT'D)	Tim, this is the Queen Bee of ASMI, Joan Ostrowski-Fox. The O-Fox.
M	TIM	Hey. Ha. From the fitness center.
F	JOAN	Hey! It's Tim "don't get lippy with me" Lippe.
M	RONALD	You guys met?
F	JOAN	Oh yeah, and I was very naughty in there. I'm sorry about that, Tim.
M	DEAN	No she's not.
F	JOAN	No I'm not. Shots! What'll it be, gentlemen?
M	DEAN	Oh yeah, Jaeger time!
M	RONALD	Oh what the heck. Drambuie.
F	JOAN	Lippe?
M	TIM	Oh, I don't, ah... Cedar Rapids, 6-12-09 Ah... Grenadine? Please.
F	JOAN	Careful you don't get too loaded, Lippe, or I might have to take advantage of you.
M	TIM	It's been a super long day. I, ah, better... Good night...
M	DEAN	Whoa-o here she comes-- she's a man eater!
M	TIM	Hello Bree.
F	BREE	Hey. Hey.
M	MILLIE	Marlene's brother's back in the hospital, so bridge got canceled. So we just watched hockey.
M	TIM (O.S. ON PHONE)	We? Cedar Rapids, 6-12-09
M	MILLIE	Me and Wade.
M	TIM	Wade.
M	MILLIE (O.S. ON PHONE)	He says hey.
M	TIM	Oh. Tell him hey.
M	MILLIE (O.S. ON PHONE)	Tim says hey...
M	MILLIE (O. S. ON PHONE) (CONT'D)	I picked up that diet wet food for Brandy today.
M	TIM	I have to do some work before bed, so... Well I should let you go.
M	TIM	No, it's-- I love you so bad, babygirl. It's so hard here. I just miss you.
M	MILLIE (O.S. ON PHONE)	I miss you, too, Tim. But this was your decision. You have to act like a big boy now.
M	TIM	Tss. Yeah, yeah. Keep reminding me.
M	MILLIE (O.S. ON PHONE)	You'll be fine. Just be careful.
M	TIM	OK. You, too. I love you. Cedar Rapids, 6-12-09
M	TIM	Current risk mitigation mechanisms available to hog farm operations include futures and options to...
M	TIM (CONT'D)	I'm in here!
M	DEAN	I know. This needs to be private. Whoa. Something didn't agree with you, did it? Second thought, meet me in the stairwell after you wrap things up in here.
M	TIM	What the heck is going on here?
M	DEAN	You sound like my fuckin' wife, Timbo. Jesus. Ex, I should say. EX.
M	TIM	Are you drunk?
M	DEAN	Fuck yeah! Fuck yeah. But we didn't get to finish our little confab back at the bar. I figured some shit out. Cedar Rapids, 6-12-09 Like I told you, no shocker-- Helgesson's buttering you up to get you in his camp, because he knows you and me are close...
M	TIM	We're not close...
M	DEAN	Close enough. You're voting for me for President, right?
M	TIM	No I'm not.
M	DEAN	Well anyway, there's a petition going around trying to take away your company's Two Diamond Awards.
M	TIM	I know. I heard.
M	DEAN	Well hear this: After you left the bar, Mike Pyle comes up to me-- Pyle of shit, I call him-- and he asks do I want to sign this thing. And I go, "Lemke might have been a class-A deviant, but the guy was tits as a rep..."
M	TIM	Pardon my French, Dean, but that's a bunch of bull roar. My boss, Bill Krogstad? He told me how you called up Joyce Armbrüster and smeared Roger's name all over town...
M	DEAN	Joyce who...? Oh, no-no-no, whoa- whoa-whoa, that old whore called ME. Harping about Lemke being a pervert and how she wants to take her business elsewhere. So I says, "OK, I'll run some numbers." Well, she calls back later that same day, says she got Krogstad to lower her premium. Which is all the greasy twat wanted in the first place.
M	TIM	So wait, you didn't call her? Cedar Rapids, 6-12-09
M	DEAN	I may be a lot of things, but poacher ain't one of `em.
M	TIM	So what's with this petition?
M	DEAN	Personally? I think Mike Pyle of Shit started the thing as a way to drive down the price of your agency. Dollars to donuts he wants to swoop in and pick up Northlands at a bargain basement price. And you know what else I think? I think Orin's in on the deal somehow.
M	TIM	What? That's impossible.
M	DEAN	I can't quite figure it myself, but I know what I know. And what I know is you're wading into some duvious, er dubious, shit. Just be careful. Cedar Rapids, 6-12-09
M	ORIN	... In Your Name we pray Lord Jesus, Son of God, Author of our Salvation, our Redeemer, our Truth. Amen.
M	RONALD	Orin knows how to lead a prayer breakfast, tell you what.
M	TIM	Hmm...? Oh. Yeah.
M	RONALD	Little overwhelming? All this?
M	TIM	Hello, thank you. I feel like my head is gonna like... Y'know?
M	RONALD	Oh I hear ya L & C. Loud and clear. I was the same way when I first came to ASMI. The deciding which break-out sessions to attend, plus the politics, the pressure, the not knowing who to trust...
M	TIM	Excuse me, Ronald. It's my boss. This is Tim. Cedar Rapids, 6-12-09
M	BILL KROGSTAD	Tim. Bill Krogstad. Got a call from Orin Helgesson. Tells me he's worried about you. Tells me you're palling around with Dean Ziegler. Laughing at his jokes, buying him drinks...
M	TIM (O.S. ON PHONE)	I... No...
M	BILL KROGSTAD	What's the ONE thing I told you to do? The one thing, Tim? Steer clear of Dean Ziegler. GODDAMNIT, you're lousing the whole thing up!
M	DIONE KROGSTAD	Bill...
M	BILL KROGSTAD	Not now Dione.
M	TIM	Bill, I... That Dean Ziegler-- he was trying to warn me about Orin.
M	BILL KROGSTAD (O.S. ON PHONE)	Warn you about Orin? Orin Helgesson has been ASMI Midwest Region President for 13 years! He is a LEGEND! And what do you do?! You go and pal around with his sworn enemy-- who, P.S., is a drunken loser!
M	TIM	Bill, I'm sorry... Cedar Rapids, 6-12-09 I sent you to ASMI to restore our image, Tim. One day into the deal you're lousing the whole thing up! See how far Gladstone is from Cedar Rapids, Dione. Look in the atlas.
M	DIONE KROGSTAD	You're not driving to Iowa, Bill. This is your daughter's wedding.
M	BILL KROGSTAD	Oh cripes, you know as well as I do that Polack's gonna head for the hills the second he gets his papers. But no, you want to end up in the poor house, Dione, we'll go. Let's just keep on cashing checks we don't have...
M	DIONE KROGSTAD	We are going to our daughter's wedding, Bill.
M	TIM	I didn't know I did anything wrong.
M	BILL KROGSTAD (O.S. ON PHONE)	Well you better try doing something right, Lippe. Because if you keep lousing up, we all by god starve! And don't you tell me to calm down Dione!
F	JOAN	I'm a very bad girl. But I swear I only smoke in Cedar Rapids. Care for a Virginia Slim, Lippe? Cedar Rapids, 6-12-09
M	JOAN (CONT'D)	Whoa, what's wrong?
M	TIM	Mm, I don't know. Only everything.
M	TIM	He didn't have to yell at me. I didn't do anything wrong. I'm trying my hardest.
F	JOAN	D'you want me to kick his butt?
M	TIM	Could you?
F	JOAN	Absolutely. I know Krogstad. I could take him. `Sides, I'm a ninja. A nin- jette, actually. Hoo-waaaah! So Lippe, how'd you end up in the insurance game? God that sounded dorky-- insurance game. Look here, see, how'd you end up in the insurance game, see...?
M	TIM	You are freaky. No, it's kind of weird how I got interested in insurance, actually. When I was six, my dad got killed in a sawmill accident.
F	JOAN	Oh my God. Cedar Rapids, 6-12-09
M	TIM	Yeah. Not good. But after he died, our insurance agent fought like a tiger against the sawmill to make sure me and my mom were taken care of. And we were. The crazy thing-- our agent was actually Bill Krogstad.
F	JOAN	No way. Really?
M	TIM	He had just opened Northlands. Anyway, I remember thinking, this guy's a hero. A real hero. So even if he doesn't always treat me, like y'know... whatever now-- I'll never forget that.
M	TIM (CONT'D)	This river-- the Cedar River? It flooded the whole city a couple years ago.
F	JOAN	I remember that. Massive disaster.
M	TIM	People talk about the firemen and policemen and that. But think about all the claims in a disaster like that-- how hard those agents worked to make sure people's lives weren't left in the lurch. We're talking billions of dollars in damages, literally. And claim by claim, dream by dream, those agents helped rebuild this city. I'm telling you, it's a noble calling. I really believe that.
F	JOAN	You realize you just made it sound cool to be an insurance salesman? You are a hero, Lippe.
M	TIM	Tss. I wish. Cedar Rapids, 6-12-09
F	JOAN	No, I can tell. You're the Superman type. Kind of dweeby on the surface but a real frickin' stud underneath. They'd call you Insurance Man-- put a big red "I" on your chest...
M	TIM	Well, even if you're being full of it, thanks for saying that anyway.
F	JOAN	Well, you're welcome. So can you fly me back to the hotel, Insurance Man? I'm freezing my arse off.
M	DEAN	I'm saying a Bridge to the 22nd Century is a stupid theme, Helgesson. Not a goddamn one of us is even going to be alive in the 22nd Century...
M	ORIN	Oh, and I suppose under a Dean Ziegler administration, we'd just abandon E-Commerce and all that, huh? What's your take, Ronald?
M	RONALD	End of the day, you know I'm a big supporter of yours, Orin...
M	DEAN	Stab me in the fucking back why don't you, Wilkes...
M	RONALD	Why would I stab you in the back, Dean, when I'm telling you to your face that I think you'd be a lousy President? Cedar Rapids, 6-12-09 That deflates the tension. The three men are laughing as Tim
M	DEAN	Timbo! Sorry about that gigantic boner I got while we were spooning.
M	TIM	We didn't spoon, Orin...
M	ORIN	To each his own, Tim. I'm teasing, of course. Well, I gotta run to an Executive Council meeting. You fellas really ought to check out Mike Pyle's Prop/Cas seminar...
M	DEAN	Pyle of shit.
M	ORIN	Mike's a dynamite orator. I think you'd enjoy it. We'll see ya.
M	DEAN	Smug fuck. So who's ready for a drink?
M	RONALD	It's 11 in the morning.
M	DEAN	It's 11 in the morning. Can you believe this guy? C'mon Timbo, let's get the flock outta here. You need to leave me alone. Cedar Rapids, 6-12-09
M	MIKE PYLE	I'd like to share a humorous anecdote. A gentleman is drowning in a lake or pond, and he's 20 feet offshore. Well, along comes an actuary. And this actuary sees the drowning gentleman and throws him an 11 foot rope. And the gentleman says, "But I'm 20 feet offshore!" And the actuary says, "Well, I'm meeting you MORE than halfway."
M	MIKE PYLE (CONT'D)	So Property/Casualty Insurance, or Prop/Cas, it's one of the most dynamic areas of our industry...
M	MIKE PYLE (CONT'D)	Ah, is there a Tim Lip in here? There's an emergency call.
M	TIM	Hello.
M	VOICE (O.S. ON PHONE)	Herro Mr. Tim, my name Chin Chang. There bad news about your fiancé.
M	TIM	Millie? Something happened...?
M	VOICE (O.S. ON PHONE)	Ah, you wise man Mr. Tim. She die in horrible car accident... Cedar Rapids, 6-12-09
M	VOICE (O.S. ON PHONE) (CONT'D)	... but her dying wish for you, Mr. Tim, to get shit-face with Deanzie.
M	DEAN	Timbo! Turn around!
M	TRENT	Gentlemen! I will call security.
M	TIM	What the H did I ever do to you, you a-hole.
M	DEAN	Come on bud, I was having fun.
M	TIM	I just wanted to hear your voice.
M	MILLIE (O.S. ON PHONE)	Brandy, no! Bad girl! Sorry, she's giving me grief over this new wet food. What did you need now, Tim?
M	TIM	Nothing. Nothing really...
M	MILLIE (O.S. ON PHONE)	Well I for one feel like I ought to be on the fire department, I'm putting out so many fires. Lucy Kofnetka asked me to do altar guild for her. Again. Cedar Rapids, 6-12-09
M	TIM	Oh.
M	MILLIE (O.S. ON PHONE)	Patti told me Lucy's seeing some guy who doesn't even go to church, so she apparently feels no need to maintain her responsibil... Brandy! No! She's going number two on the floor! No! You get outside! I'll call you later, Tim...
M	TIM	I'd like to sign up for the scavenger hunt.
M	WOMAN	Super. Teaming with a co-worker or are you in need of a partner? This is a team event, like the Amazing Race. On TV? But instead of going around the world, you look for stuff in Cedar Rapids. And instead of a million dollars, the winning team gets a $75 gift card for Westdale, which is...
M	TIM	Eastern Iowa's largest two-story mall. I know. Sweet. And yes, I do have a teammate. Cedar Rapids, 6-12-09 Everything OK?
F	JOAN	Yeah, what was that call?
M	TIM	Oh, nothing. Say Joan, you have something on your blouse.
M	TIM (CONT'D)	Burn.
F	JOAN	You are very weird...
M	TIM	Thank you. Thank you very much. So, ah, I signed you up for the Scavenger Hunt. To be my teammate. In the Scavenger Hunt.
F	JOAN	Really? Why?
M	TIM	Uh, well I... Because Ronald already had a teammate...
M	RONALD	Bill Hernandez?
F	JOAN	Taco Bill.
M	TIM	... And I thought you'd-- we'd-- be y'know, a decent team. So... I think you should do it.
F	JOAN	Heck yeah! I get to be Insurance Man's sidekick. We're going to kick some ASS! Cedar Rapids, 6-12-09
M	ORIN	Like last year there'll be a few physical challenges...
M	TIM	I am super pumped!
F	JOAN	Whoo-hoo.
M	ORIN	Course this should be considered a fun event, in the spirit of team building. You can find your first clue "under the sea." By which I mean in the pool area. So ready, set, race!
M	TIM	You're going down, a-hole.
M	DEAN	Let's roll, Perry-- Perry-plegic. Get it, like paraplegic? But...
M	PERRY	Yeah. Good one, Dean-tard. Like retard, but Dean-tard. Get it? Cedar Rapids, 6-12-09 TIM Check it out-- Planet X!
M	TIM (CONT'D)	I compiled a ton of info on Cedar Rapids. I've got a sweet laminator in my basement.
F	JOAN	Ooh, that's hot...
M	TIM	... Maps, area attractions, crime stats, local customs...
F	JOAN	Look at you...
M	TIM	Bingo! Right here-- Planet X Family Fun Center. Let's go. Act natural.
F	JOAN	What a gyp. There are no stinkin' clues in here.
M	TIM	OK, I think we're going to want to take Blair's Ferry Road to Avenue C, then probably east on 100.
F	JOAN	Why would you possibly know that?
M	TIM	I memorized the major thoroughfares and landmarks in the metro area.
M	MUSIC BED OVER:	Cedar Rapids, 6-12-09
M	TIM	"You've seen the future, now Czech out Cedar Rapid's past." But it's Czech, like Czechoslovakia. C'mon!
M	DEAN	Know what that cow's thinking, Pyle? She's thinking, "quit pulling on my tits and fuck me already."
F	JOAN	Ugh. I'm gonna puke.
M	TIM	No, you're doing great, Joan. And you look super awesome with a wiener in your mouth. Cedar Rapids, 6-12-09
F	JOAN	Oh my God, did you just make a dick joke, Lippe?
M	TIM	No. Maybe.
M	ORIN	OK guys, this is it. First team to complete this challenge wins the whole shootin' match. ASMI's past is behind us; But our future looks nice; Let's Build a Bridge to the 22nd Century... by scaling this silo of ice!
F	JOAN	That doesn't even... There's no such thing as silo ice climbing.
M	TIM	No, it's actually a big thing in Iowa. ABC news did a story about it. I saw it on YouTube.
F	JOAN	Of course you did. Well, you can do it then...
M	TIM	Uh-uh, absolutely not. I'm scared crapless of heights.
F	JOAN	You need to get over it, Lippe, cuz I'm not climbing jack. Cedar Rapids, 6-12-09 Come on Insurance Man-- leap tall buildings in a single bound and all that...
M	TIM	Yeah. Let's do this thing. Hang on... How's it...?
M	MIKE PYLE	Little help here...
M	TIM	Ugh. This is frickin' hard.
M	RONALD	Really hard.
M	DEAN	I think I just shit my pants. Cedar Rapids, 6-12-09
M	ORIN	OK gang, that was Rick Martini with the National Chapter. Here's the deal. Since no one could do the final task, and since Joan and Tim were the first team to get here, we're just gonna go ahead and award them the first place prize. Unless anyone's got a problem with that?
M	RONALD	Dangit. You could've done better, Wilkes.
M	TIM	Wait, we won?
M	ORIN	Yup. So here you guys go. Your $75 gift card for the Westdale Mall.
M	TIM	Oh crap. I forgot... Hey, Millie.
M	MILLIE (O.S. ON PHONE)	I have been trying to reach you for the last eight hours, Timothy. I was going to call the police. Where have you been?
M	TIM	I'm sorry, Mil. I signed up for this scavenger hunt, and check it out-- we won! My teammate and I, that is. Joan.
F	JOAN	Hi Millie! Cedar Rapids, 6-12-09
M	TIM	That was Joan saying hi. Millie says hi.
M	MILLIE (O.S. ON PHONE)	I did not say hi. I didn't say anything. If you had asked, I would have told you that I've been at the vet half the day because Brandy swallowed a pencil eraser.
M	MILLIE (O.S. ON PHONE) (CONT'D)	Lucky for us it came out naturally or we'd have been looking at surgery.
F	JOAN	I'll just meet you inside.
M	TIM	OK. Sounds good. Sorry Mil, go ahead.
M	MILLIE	So who's this Joan?
M	TIM	Just some gal from Omaha they paired me up with. Between you and me, she's a little different. Real hyper-- one of these types who kind of overdoes it. But for a 75 dollar gift card, I'm not going to complain. Cedar Rapids, 6-12-09 You promised you'd check in with me. I'm very disappointed.
M	TIM	OK, Mom...
M	MILLIE	Well. You obviously have more important things to do than talk to me. My brother and I were just getting ready to go for fish at the Eagles anyhow.
M	MILLIE (CONT'D)	Go warm up the car, Wade.
M	TIM (O.S. ON PHONE)	Mil, I didn't...
M	MILLIE	It's fine. You'll call me some time when it's convenient for you, Tim. Good Night.
M	TIM	Hey. What say we just use the gift certificate to get a nice supper here? At the mall. Cedar Rapids, 6-12-09
M	TIM	We have a gift card. But I didn't make a reservation. Is that OK?
M	MAÎTRE D'	Right this way, sir.
M	WAITER	Coors Lite for the madam. A cream sherry for monsieur. And here are some bottomless bread sticks.
M	TIM	Nice. Thanks.
M	TIM (CONT'D)	To victory. To new friends. To life. And all the joys of living it.
F	JOAN	That's really nice. Cheers.
M	TIM	Mm, it does taste a lot like communion wine. Awesome. Cedar Rapids, 6-12-09
F	JOAN	So Lippe, I'm trying to figure you out. Hopes, dreams, aspirations, blah-blah-blah? Whaddaya got?
M	TIM	Mine? Let's see. Um. I would love-- some day-- to put a little greenhouse in my backyard.
F	JOAN	Dream the impossible dream...
M	TIM	No, I've actually seen some fairly decent portable ones at Fleet Farm that won't break the bank...
F	JOAN	C'mon, man. I mean fantasy-land stuff. What do you really want?
M	TIM	Well. I always hoped I could take over Northlands when Bill retired. But that obviously isn't going to happen now.
F	JOAN	Oh, screw him. He wants to sell, why don't you just buy Northlands?
M	TIM	Yeah right.
F	JOAN	Why not? You could get a loan.
M	TIM	I don't... Probably not.
F	JOAN	You know the business. You know the clients. You actually care about your job. You'd be perfect. Cedar Rapids, 6-12-09
M	TIM	Grrrr. Ha. Time out. Sheesh. Let's. OK. What I'd really like is a family. To be a dad. So kids, I guess, that's what I really want.
F	JOAN	Yeah well, you can have mine.
M	TIM	You've got kids?
F	JOAN	Tyler's ten. Ashley'll be eight next month. My little squirrels.
M	TIM	Awesome. Beautiful kids. And that's...?
F	JOAN	My hubby. Rich Fox. Richie. We met when we were both Rotary exchange students in high school. Lived in Norway for a semester.
M	TIM	Norway.
F	JOAN	I was such a spaz. Band geek, total ugly duckling-- braces, acne, the whole nine. I didn't even get boobs until college. Anyway, we ended up getting married sophomore year. Then kids. Then blah-blah-blah, and here we are. Richie's a Supervisor in the Parks Department now. For the County.
M	TIM	Wow.
F	JOAN	I know it's effed up. And if I had it all to do over again, I don't know what I'd choose. Cedar Rapids, 6-12-09 But I don't have that option. So this is my fantasy-land, Tim. Cedar Rapids. ASMI. This. I come here, and for a few days I'm someone else. No kids. No husband. No responsibility. Wild woman. Sometimes a gal just needs a vacation from who she really is-- know what I mean, Lippe?
M	TIM	OK. I thought of another one.
F	JOAN	One what?
M	TIM	Wish. Or dream or whatever. It's still small potatoes compared to...
F	JOAN	No, let's hear it...
M	TIM	... to all you've done-- Norway and all that, but... Do you watch American Idol ever?
F	JOAN	You wanna be on American Idol?
M	TIM	No-no-no. Negative! Sheesh. But I do enjoy watching it quite a bit. Randy's always like, "That's awesome, dawg!" And Simon's such a-- "Oh, I'm so superior." Anyhow I was thinking of maybe trying-- trying-- to get a solo in my choir. At church. I mean, it's all super political. But I'm a fair to middlin' baritone, so... Cedar Rapids, 6-12-09
F	JOAN	That's great, Tim. You'll do it. I know you will. Very cool.
F	JOAN	Wanna get one for the road, stud?
M	TIM	Oh no, I have to practice my Two Diamond presentation. I can't...
F	JOAN	One nightcap. It'll loosen you up.
M	TIM	Ha. Nightcap. Kneecap, more like...
F	JOAN	What?
M	TIM	Yes.
M	DEAN	Timbo and the O-Fox! Wondered when you crazy kids were gonna show up.
M	RONALD	Can I buy the big-shot winners a drink? Coors Lite for Joan. And Tim, you want a pop? Cedar Rapids, 6-12-09
M	TIM	Actually, do they have cream sherry?
M	RONALD	Cream sherry. Jeez, guess that victory really did go to your head.
F	JOAN	Coors Lite's good for me, thanks. I gotta run wash my hands quick.
M	DEAN	You tag that yet, Timbo? Bet she's moist as a damp sponge, huh?
M	TIM	She is MARRIED. And you're just... What is wrong with you?
M	DEAN	Shit, what isn't wrong me? I drink too much, I weigh too much, I piss people off. Speaking of, that crank call earlier-- way outta line. People are right, I am an asshole.
M	TIM	Well. Yeah. You kind of are. But I guess I've seen worse.
M	DEAN	I love it! "I guess I've seen worse." I love it! Yeah shit, s'pose we all wish our lives had gone a little different. You don't come into this deal going, "Dear God, please let my wife toss me out on my ass. Please give my children the courage to hate my fucking guts. Thank you Jesus. Praise Jesus! Praise Jesus!" Ach, I'm just having fun. No offense Big Man! Right, Timbo? Cedar Rapids, 6-12-09
M	TIM	Ronald! Hello. Thanks mucho... So Ronald, what's your situation? You married, or...?
M	RONALD	Negative. I'm pretty well married to Ronald Wilkes Insurance. I also do quite a bit of work with the St. Cloud Chamber. I'm Senior Warden at my church. So really, no time for a Mrs. Ronald Wilkes.
M	TIM	Wow.
M	RONALD	Don't get me wrong, I have my guilty pleasures-- antiquing, I'm active in community theater. And I have to admit I'm a big enthusiast of the HBO program, The Wire. But shux, I haven't had a proper vacation in nine years.
M	TIM	I never use my vacation time.
M	DEAN	Maybe you two should take one of those gay cruises together.
M	RONALD	You know what you are Ziegler? You're what I call a real Richard.
M	RONALD (CONT'D)	Mr. Richard Head.
M	TIM	Dick head. Yeah Dean, you are a total Richard!
M	DEAN	Ha! I love it! Richard head! Cedar Rapids, 6-12-09 To Tim-- the young rookie comes in, takes the scavenger hunt. That right there is P-T. Prime Time.
M	DEAN	Would you rather toss a bum's salad, y'know, eat out his butthole or... give your dad a B-J?
M	RONALD	Come on Ziegler, this is supposed to be a clean game...
M	TIM	No, if you used some salad dressing a bum's a-hole might not taste that bad. Thousand Island!
F	JOAN	Shots! Kamikazes, good sir.
M	KARAOKE DJ (O.S.)	OK. We're ready for Tim Lip to rock the mic. Is there a Tim Lip?
M	TIM	Did he just...?
F	JOAN	Why wait for the church choir when you can take care of one of your dreams right now, dude?
M	TIM	No, no, no, no, no...
F	JOAN	I know you can do it, Lippe. Go be my hero-- Insurance Man. Cedar Rapids, 6-12-09
M	KARAOKE DJ	Tim Lip? You in the house?
M	TIM	I, um, I've met some really, just super neat people here. But this song, I'd like to dedicate to the first African-American person I've ever met. I mean, I've seen guys at the Oneida Mall in Rhinelander-- said hello and that. But... Anyway, I just think you're one of the most awesome guys around. Ronald Wilkes!
M	TIM (CONT'D)	I was born and raised down in Alabama. On a farm way back up in the woods. I was so ragged that folks used to call me Patches. Papa used to tease me about it. But deep down inside he was hurt, 'cause he'd done all he could.
M	TIM (CONT'D)	My papa was a great old man. I can see him with a shovel in his hands. See education he never had; He did wonders when the times got bad. The little money from the crops he raised barely paid the bills we made.
M	MUSIC BED OVER:	Cedar Rapids, 6-12-09
M	RONALD	The presentation's in 36 hours. I can't afford to be off my game. Frankly, neither can you, Tim.
M	RONALD (CONT'D)	This is ridiculous, you guys. Told you, it closed an hour ago.
M	RONALD (CONT'D)	Tim. Come on. This isn't you.
M	TIM	Uh-oh. Who is it then?
M	RONALD	You know what I mean. We've both worked our tails off. Why poop it away on...
M	DEAN	Check this out-- Captain Nemo!
M	TIM	I know. I just... No frickin' way!
F	JOAN	Whaddaya say, Lippe? Take a dippy?
M	TIM	Ich can nicht schwimmen. That's "I can't swim." In German. And I can't. `Sides, I didn't bring a bathing suit.
F	JOAN	So we stay in the shallow end. And neither did I.
M	TIM	Yow. Chilly. Ha.
F	JOAN	So.
M	TIM	Yep. Ha. Fun. Fun day.
F	JOAN	So.
M	TIM	Oh jeez. Cedar Rapids, 6-12-09
M	TIM (CONT'D)	You have tan. A tan. Tan line. You have a.
M	TIM (CONT'D)	You. Are. You're. Married. I have a fian...
M	TIM (CONT'D)	Oh jeez...
M	DEAN	Hell yeah.
M	ORIN	What the heck's going on down there?!
M	DEAN	Suck my ass, Helgesson.
M	ORIN	I'm calling security! Cedar Rapids, 6-12-09
M	TIM	Holy crap! We're so dead!
M	TIM (CONT'D)	I want to make love!
M	DEAN	Come on, Ronimal! My key got wet. Wake up, man! Ah, fuck it.
