M	CHARACTER	DIALOGUE
M	THEMAN	He's crazy! Frank and Charlie walk toward the stage. Buddy peels away. Frank and Charlie climb the makeshift stairs up to the stage.
M	FRANK	gentlemen. I'm Frank Quinn of Quinn Funeral Home. Welcome to the live funeral party of Mr. Felix Bush! People don't know whether to clap or not. Some do and the Buddy gets to Kathryn and hugs her and the baby.
M	BUDDY	Where's Mattie?
F	KATHRYN	She wouldn't come. I don't..
M	FRANK	I've done some things in my life, but never this. Bet you haven't either, bet no one has.
M	FRANK (CONT'D)	We try to make things predictable and safe but if we don't risk everything to get what we want, we don't want it enough.
M	FRANK	The person who made all of this happen for us doesn't like the spotlight but Buddy Robinson is the heart of Quinn Funeral Home and I'm proud to know him. Buddy is embarrassed and moved. Kathryn's eyes soften.
F	BUSH	Sonsabitches. Carl drops his can. The other men drop their cans but Gary
F	BUSH	Go on, I'll paint the porch with his head.
M	CARL	Don't do it! Gary drops the pistol.
F	BUSH	Now pick up them cans and keep pouring.
M	CARL	What?
F	BUSH	You heard me. The men cautiously pick up the cans..
F	BUSH	Pour it on your head. All of it. The men look at each other. Bush cocks the other barrel of
M	THEMAN	I won't!
F	BUSH	Pour it or die, I don't care which. The men hoist the cans and start to pour the gasoline over
F	BUSH	I got two barrels, anybody else wants to rabbit, now's the time.
M	FRANK	I know many of you have heard stories about Mr. Bush. But today I've been told that we're going to hear another kind of story, his. A murmuring moves in a wave across the crowd as they see.. Buddy, Kathryn, and Horton see Bush. Quinn and Charlie follow the crowd's eyes to Bush.
M	QUINN	Holy Mother of.. SHERIFF DEPUTIES beside the stage see Bush. Buddy starts toward Bush. Kathryn tries to stop him but he A shot rings out! Carl and Gary hit the ground like dead men. The crowd hunkers and scatters. Horton steps in front of Kathryn and the baby. Buddy freezes. Bush whirls and sees.. .Carl's old 45 still smoking. The gun is in Tom's small shaking hands..
M	CARL	Don't hurt him! It's my fault. Bush cracks his shotgun, walks slowly to the boy, gently
F	BUSH	A second chance is a precious thing, son. Don't waste it. The boy plops down, overwhelmed. And suddenly everyone is in motion. The Deputies run toward Bush. Frank and Charlie rush from the Buddy arrives at Bush first and sees the blood weeping onto
M	BUDDY	Are you alright, sir?! Without turning Bush glances at the Deputies.
F	BUSH	Tried to burn me out. Let the boy be, he didn't mean nothing. As the Deputies get a hold of Carl and Gary, Frank, Charlie,
M	CARL	Help him, Gus, please.. Horton goes to the trembling boy and picks him up.
M	ANNOUNCER	Folks, I've just received word of a tragic turn of events at the Bush Funeral Party. It seems that Mr. Bush has been shot. I repeat, Mr. Felix Bush has been shot. There is no word of condition..
M	ANNOUNCER (O.S.)	When I know more I will let you know. I'm sure he would appreciate your prayers..
F	BUSH	Close the door. Charlie slams the door. Frank examines the wound. Buddy
M	FRANK	Missed the bone. Got any alcohol and clean rags? Bush nods at the cabinet. Charlie finds an amazing assortment
M	BUDDY	Why don't you sit down, sir?
F	BUSH	Boil some water and I'll tell you how to make me a poultice. Frank takes the rags and alcohol from Charlie
M	FRANK	This is gonna hurt.
F	BUSH	Don't sugar coat it.
M	REVEREND HORTON	Lord, you say you move in mysterious ways and we believe you because we don't understand much of anything. And so we come to you today not seeking answers to what's happened here but asking you to help us open our hearts a little more to each other and find some forgiveness and understanding.
M	BUS H	Pretty good prayer. Mighta been wrong about that preacher.
M	CHARLIE	Why don't you lay down, Felix? Bush thinks about it, sees a way out. For a second he looks
F	BUSH	Let's go 'fore I lose my nerve.
M	BUDDY	Are you sure? Bush scowls at the huge blood stain on his shirt. He looks at Frank is putting on an old faded shirt of Bush's. As Bush
F	BUSH	You ain't nervous? All them white folks out there?
M	CHARLIE	There's white folks here?!
F	BUSH	Stick with me, you'll be all right.
M	CHARLIE	You're the one they're shooting at. As Charlie opens the door, Bush stops, all his misgivings
F	BUSH	Pretty interesting day so far, huh boy? Bush straightens himself up and goes out the door. Charlie gives him a look then goes on up to the microphone
M	CHARLIE	I'm Reverend Charlie Jackson. Felix wants to continue with his funeral. And he's asked me to say a few words. Just below the stage, Buddy and Frank are joined by Kathryn.
M	CHARLIE	We like to imagine that good and bad, right and wrong, are miles apart. But the truth is, very often they're.. and laces his fingers .all tangled up with each other. Bush raises his head and looks at Charlie's back.
M	CHARLIE	Some 40 years ago Felix Bush dropped into my life and then dropped out. In between he built the most beautiful sanctuary that I've ever seen. A lot of wonderful things happened in that church. Suddenly Bush breaks away, moves up beside Charlie, and puts
F	BUSH	Thank you, Charlie. Thank you. Charlie gives him a long look then steps away from the
F	BUSH	Had to go clear to Illinois to find somebody that had anything good to say about me. Hell of a thing. His voice booms out over the crowd, startling him. He looks He looks closer for someone most important but she is not
F	BUSH	I'm not a smart man or a wise one. I don't know what kind of man I am. I was always restless, thought I'd see the world. But I didn't hardly go nowhere.. on purpose.. Because.. because I did something that I was ashamed of. Something I couldn't ever fix. Ya'll probably think you know what you'd do or what you wouldn't. And I wish you good luck with that. I really do. When I told Charlie what I'd done, he told me to confess to God and the law and to.. to someone else.. so I could get forgiveness. But I didn't want forgiveness. I needed to hold on to what I did.. to be sick from it every day of my life. So I never told nobody else. He stops, not knowing how to go on. The crowd has quieted As as his eyes sweep over the sea of expectant faces, he Mattie's here. Seeing that Felix appears to alright, her face
F	BUSH	I fell in love with a married lady. And somehow she fell in love with me. It was the only time that I have been in love. We made a plan to run off and start a new life but she didn't show up at the time that we said we'd meet. I got a funny feeling and I went to her house. Buddy, Kathryn and Frank all see Mattie now, see Bush talking
F	BUSH	Her husband answered the door. He had blood on him. For Mattie all of this is like window into the past being
F	BUSH	I hit him pretty hard, knocked him down. Can't remember going upstairs but I remember I saw a hammer on the steps and it had blood and hair on it. The crowd gasps. Mattie is trembling.
F	BUSH	I found her in the bedroom. She was crawling across the floor. But before I could get to her and help her up.. a kerosene lamp hit the wall. And then her husband jumped on my back. Funny what happens sometimes when things go wrong. It's like the clock stops and you have all the time in the world to think. I could see that her husband had set the downstairs on fire before he came up.
M	BUSH (CONT'D)	And as I was slamming his head into the wall, trying to get shed of him, I could see clear as anything that it was all my fault. If I'd just never spoke to her.. And as I was thinking about that, I saw that the lamp he threw had set the room we were in on fire too. Bush forces himself to keep looking into Mattie.
F	BUSH	And then I realized that I was on fire. I tried to put myself out but I couldn't, everything was.. I dropped him, turned around and saw her lying on the floor and called her name. She looked up at me.. .and the next thing I knew, I was flying.. A loud roar of fire and crushing timbers.. With his clothes still smoking, he unbelievably tries to run Bush and Mattie are looking into each other, one anguished
F	BUSH	I don't know how I got out the window.
M	BUSH (CONT'D)	No matter how many times I play it in my mind, I can't remember jumping. I thought I killed him, but maybe he pushed me, I don't know... I swear to you, if I left her in there.. everything I know about myself is a lie. But that don't matter. I didn't get her out, Little Bit, I didn't. I'm sorry.
F	MATTIE	Oh, Felix.. He sniffs her hair and tenderly touches it.
F	BUSH	Wonder if her hair would be white? Mule is lead back to the barn. The equipment is disassembled and loaded back on the truck. Finally Mattie and Bush come out of the shack and walk down
M	BUDDY	How you doing, sir?
F	BUSH	Just fair, son.
M	HORTON	Carl said Ray paid them to set the fire. Paid them to break into the funeral home too.
M	FRANK	Can't stop pulling Aces out of his ass, can he?
M	HORTON	Spend his money on lawyers now. You know how thrifty they are. Frank motions to Buddy and they go to Bush. Buddy is still
F	BUSH	What's his name?
M	BUDDY	Larry, Lawrence, after my dad, sir.
F	BUSH	He ain't gonna throw rocks at me, is he?
M	BUDDY	Not if knows what's good for him.
F	BUSH	You boys did good. Real good. Let's settle up.
M	BUDDY	We don't have to do that now. You get some rest.
M	FRANK	Yeah. We'll come out tomorrow.
F	BUSH	Bring my shirt back, I just got it broke in. Bush pulls Buddy aside. Frank stares over at them but can't
M	FRANK	Are you alright, Mattie? She looks up at Frank for a long moment, her face softening.
F	MATTIE	Oh, I don't know. I'm still moving, I guess.. He doesn't know what that means but she has finally really Frank is staring at Buddy, looking for a clue as to what Bush
F	BUSH	Thanks again for coming, Charlie.
M	CHARLIE	I'm proud of you. Thank you for my church.
F	BUSH	Did you ever get my bill?
M	HORTON	Can we get a ride our car's about 2 miles down the road. Everyone piles into the hearse. There is no back seat so they As the hearse moves out, he waves to Buddy who is looking out Look at that. My funeral and everybody's in there but me. The hearse pulls onto the road and drives away. The place is suddenly quiet and beautiful. He looks down the A fourth grave marker just like the others leans against the
M	CHARLIE	Well, Felix, this one's for real, I guess. I didn't actually see them put you in the box so.. Charlie glances over and notices "Charlie" on one of the
M	CHARLIE	Wherever you are, you're probably giving someone a hard time or something wonderful and priceless just to confuse them. Not everything can be figured out, nor everybody. I wish you peace from the burdens of your mind and heart. I wish it for us all. Mattie moves toward the edge of the grave. Frank puts a hand
M	BUDDY	A 50 on the outside, all ones inside. Less than $100.
M	FRANK	What?!
M	CHARLIE	I told you. Nobody listens to the preacher. Buddy pulls some papers from his coat.
M	BUDDY	The day of the party he told me about the will he had in the secret drawer of his table. He left the raffle money to all of us. Everyone is shocked, touched. But you have to pay for Mule's upkeep for the rest of his life. Charlie grins and Buddy flaps the papers at him.
M	BUDDY	And he set up a fund for the upkeep of your church.
M	CHARLIE	What's the catch?
M	BUDDY	No catch, sir.
M	CHARLIE	Still don't get it, do you? With Felix, there's always a catch.
M	BUDDY	Maybe he just knew you'd go crazy wondering what it was. They all laugh and move down the hillside. As the laughter
