M	CHARACTER	DIALOGUE
M	GREAVEY	. what's that smell? -- as they TURN to the deck where the creature lays... ALL THEY LIGHTNING FLASHES, illuminating the ship -- and als4THE ALIEN alien then it SPRINGS -- SLICING THROUGH TWO MEN AT ONCE -- GREAVEY and 2 others manage to SCRAMBLE AWAY: HEAR the SCREAMS -- Happy takes off -- they RACE after him --
M	DOC AND MEACHAM	Hear them too -- grabs their PISTOLS -- and Doc, his CANTEEN -- Colorado snatches up a WINCHESTER, LOADS IT, throws another one
M	DOLARHYDE	Get behind me, Boy -- THE ALIEN SPRINGS INTO THE ROOM -- landing upside down on the Emmett SCRAMBLES down a FLOOR HATCH, disappears as Dolar keeps Paralyzed with FEAR, he EXHALES a terrified GASP and -- THE CREATURE RECOILS FROM HIS BREATH! HURLS Dolar aside -- hand with the pistol to the wall in return. He STRUGGLES as the BOOM! The Alien's shoulder EXPLODES ORANGE FLUORESCENT BLOOD as a GUNSHOT rings out -- it's Dolarhyde, back on his feet aid through the hatch where Emmett fled -- And the fire's GROWING around the boat -- Jake's bracelet OPENS UP into that BLASTER and it's AIMED at The
M	JAKE	Don't know if you understand me... but you hurt that boy and I hurt you. Meacham brings his CANTEEN down like a HATCHET, SPRAYING the alien with HOLY WATER... but NOTHING happens! And then -- The Alien STRIKES -- SLAMMING MEACHAM BACK INTO A JUTTING PIECE The Alien SPRINGS through a doorway, TAKING EMMETT WITH IT. Ella RUSHES after it as Jake RUNS to Meacham, hanging impaled:
M	JAKE	Easy, now... Don't move, dammit --
M	MEACHAM	Go after the boy... then you get our people back...
M	JAKE	Stop talking. DQW! GET YOUR ASS-- But Meacham GRABS Jake, EYE TO EYE. GASPING:
M	MEACHAM	Listen up... 'cause I'm not gonna be able to say it again -- God don't care who you were, Son... only who you Mg. ON JAKE. AFFECTED. With a last RASP, Meacham DIES just as DOC But Jake can't let go -- FURY -- HEARTBREAK -- Doc PULLS HIM away -- Jake SNAGS THE CRUCIFIX off Meacham's neck as he's forced OUT, leaving Meacham's body to be CONSUMED BY FLAMES -- Dolarhyde, Colorado, Greavey, 2 GUNMEN... and Ella and Happy atop a DUNE, following a TRAIL OF FLUORESCENT ORANGE BLOOD streaking into the desert. Happy BARKING MADLY. Ella drops to
M	NAT COLORADO	That thing... was dead... it was d-ead... DOLARHYDE, RAIN pouring down his face... VULNERABLE and GUILTY:
M	DOLARHYDE	I couldn't stop it -- It just... grabbed the kid. ON JAKE. Rage-filled against the flames... Meacham's CRUCIFIX in his hared, as his FIST closes around it. Looks up, HARDCORE:
M	JAKE	Then we'd better get him back.
M	EMMETT	Damn. You are one ugly bastar-- PSST! The alien spits a RESIN GOB on Emmett's mouth -- PSST PSST! More gobs PIN his limbs to the wall. Emmett can't move -- The creature looks down at an ARMOR PLATE on its bicep. Touches a series of keys and the armor spits out what looks like... .. a small RUBIK'S CUBE made of some alien alloy. The creature casually TOSSES IT in the air where it FLOATS and starts to SPIN -- as it does, its sides FLIP AND TURN (like a Rubik's Cube) -- emitting HIGH-PITCHED SONAR BEEPS: This thing's some kind of HOMING BEACON. Off Emmett's WIDE, GAPING EYES... BLOOD on some rocks.
M	NAT COLORADO	West. Greavey and the others share a LOOK. E o Turn to Dolar --
M	GREAVEY	Boss, only took one of them things to kill four of us. We got no chance here. Dolarhyde BURNS -- knowing he's being ABANDONED --
M	DOLARHYDE	You're a goddamn coward. You work for me, dammit. You're my m e 1 1 Qyees. And Greavey, finally FREE to speak his mind, says SPITEFULLY:
M	GREAVEY	Fine line between a coward and a fool. The men turn tail and RIDE AWAY. Dolarhyde SHOUTS after them --
M	DOLARHYDE	You're all FIRED! Doc takes the opportunity to TWIST the knife:
M	DOC	Looks like they finally found something to be more scared of than you. Dolarhyde feels his world CRUMBLING away man by man... Ella trots alongside Jake, who's staring at that DARK CLOUD MASS overhead with a bad feeling:
M	JAKE	Clouds've been moving east since sun- up... 'cept that one. ON ELLA. We SENSE she knows something, something more she isn't BLAMBLAN1111 GUNSHOTS from above suddenly PEPPER the ground -- the horses REAR and KICK UP, startled -- A DOZEN FIGURES ON THE CLIFFS ALL AROUND THEM. Badass OUTLAWS with RIFLES aimed at our heroes. One of them CALLS DOWN: SLOWLY, Jake draws his gun... tosses it. Now the rest of them. As they SEE -- TWO RIDERS -- incoming -- from the other end of the canyon. Rifles aimed and ready. Happy GROWLS... One of the outlaws knocks back the hammer on his rifle --
M	OUTLAW	I say we just shoot 'em and take their-- But the words catch in his throat as his EYES WIDEN:
M	OUTLAW (CONT'D)	. Boss? Sure enough, they're looking right at (BRONC -JAKE. Both outlaws and HUNT) lower their guns, hostility replaced by SURPRISE:
M	HUNT	What the hell you doin' back here, Lonergan? Oh, Christ. This is JAKE'S gang. ON DOLARHYDE. ELLA. COLORADO. All registering it. And JAKE, of course, doesn't REMEMBER these men as Bronc dismounts, NERVOUS:
M	BRONC	Jesus, Boss... Creek's gonna shit when he sees you. And who the hell're they? ON JAKE. Now does he handle this? Ht:nt rides up next to him, SUSPICIOUS, and for reasons yet to be known, UNFRIENDLY --
M	HUNT	What's the matter, Jake. Cat got your--? SMACKI Jake moves LIGHTNING FAST, SLAPS Hunt across the face,
M	JAKE	Since when're Qy the one asking the goddamned questions!?! Ella and our people REACT as Jake plays it up, beat defense a good OFFENSE. The outlaws are SCARED: this is the Lonergan they
M	HUNT	Christ, Jake... You broke my tooth
M	JAKE	Quit whining. Now bring me to the rest of the boys, if that meets with your goddamn approval. Bronc and Hunt nod, mounting up, SHOUTING to the OUTLAWS above: As they RIDE OFF, Dolarhyde looks to Jake and mutters:
M	DOLARHYDE	Nice company you keep.
F	ELLA	What the hell're you doing? If we don't catch up to that kid, we're never gonna--
M	JAKE	They called me "Boss." You wanna go after these things with five or fifty? Like you said: we can use every gun we can get. Qh. That actually makes SENSE. But --
F	ELLA	What exactly're you gonna say to 'em? Tell you when I figure it out. And he SPURS onward, leaving her to follow uneasily -- OUR ALIEN HANGS UPSIDE DOWN from stalactites by four spindly limbs. Mid sleep cycle. And inches below its head... EMMETT, still webbed to the wall. Unable to move or speak, FOUR DARK SHAPES blot out light, GLIDING IN... A gang of FOUR MORE ALIENS dismounts. The biggest and STRONGEST -- their LEADER -- barks GUTTURAL CLICKS at the alien who kidnapped Emmett. Kidnapper explaining as it removes another STRANGE DEVICE. The device beams a HOLO-PROJECTION... OF ELLA'S FACE! The aliens HISS in furious RECOGNITION. JESUS... is this some kind of otherworldly WANTED POSTER? PLUMES fan out angrily from the Leader's HUGE, ELONGATED SKULL -- It's the alien who killed Jake's woman! We'll come to know it as... THE SLAVER. It MOVES OMINOUSLY for Emmett, grasping the HANDLE of something that UNCOILS with fluid, frightening speed: A WHITE-HOT LASER WHIP. This will be The Slaver's SIGNATURE WEAPON. It spirals to its full length, FLASHING out at -- instead it SLICES THROUGH THE WEBBING that pins the boy to the FLAILS, punching, kicking to no avail -- but then:
M	DOLARHYDE'S FLASK	Tumbles from Emmett's pocket and SPLASHES WHISKEY on The Slaver -- IT.. S[iRIEM WILDLI-Aa THE BOOZE CONTACTS FLESH, SKIN SMOKING! the webbing from his mouth:
M	EMMETT	Holy SHIT. Another alien LUNGES for the kid but Emmett SPLASHES him with Emmett whirls -- sees the HOVERBIKES -- JUMPS onto one, twisting and setting two more aliens ABLAZE! The speeder KAMIKAZE BOUNCES out of the cavern at 90 MPH, Emmett screaming! back on their speeders and GIVE CHASE! Climbing onto an old desert stump -- BLAM! It's SHOT OFF by a piled on a WAGON. We're in an OUTLAW CAMP: roughly 40 fast guns now, most of them are GEARING UP to ride out for some reason... One of them, CREEK JOHNSON, with a chewed up face like swiss
M	CREEK JOHNSON	Hey --- �s 4 Lay off that whiskey and saddle up. Flyer's on its way and we best damn be sober for it. Creek turns; sees HUNT and BRONC crest the hill with the other
M	CREEK JOHNSON	'Bout time you got back. What the hell happened to you?!? Hunt nods over his shoulder --
M	HUNT	He did. The outlaws part to reveal JAKE, riding in with Ella and the
M	CREEK JOHNSON	well, shit. It gets very, VERY QUIET. Our people tread warily, knowing whatever reaction Jake's eliciting, it AIN'T GOOD. He runs the gaunt of ACCUSING GLARES. Smart enough to know that CREEK is the man in charge. Dismounts:
M	JAKE	You don't look happy to see me, Creek. Creek eyes him. TOUGH. Clearly, HISTORY here:
M	CREEK JOHNSON	We're fixin' to rob us a train in about twenty minutes and you come ridin' in like nothin' ever happened? No. Lonergan. I ain't happy to see you. ON JAKE. How to navigate bad blood that he doesn't REMEMBER?
M	JAKE	Well I'm sure you'll get over it. Then, pretty much DISMISSING Creek, Jake turns, addresses the
M	JAKE (CONT'D)	Nice to see you, Boys, but we're not going after a train -- We're going after something else. The men seem... . CONFUSED. Not sure what the hell is GOING ON.
M	BRONC	But Jake... you-- you said you didn't wanna be in charge no more. And this is a REVELATION. Jake glances at ELLA -- has to keep IMPROVISING to hold his ground:
M	JAKE	Well, I-- changed my mind. So saddle the hell up.
M	CREEK JOHNSON	They're not going anywhere with you. Creek's heard enough. Strides forward, a direct CHALLENGE:
M	CREEK JOHNSON (CONT'D)	You got some balls on you -- walkin' outta here a week ago sayin' what you said and doin' what you did and then ridin' back in here and givin orders. Just who the hell do you think you are? The IRONY of the question isn't lost on Jake, as Creek walks right up to Ella. CLOSE. Violates her space: studies her with a mixture of curiosity and CONTEMPT.
M	CREEK JOHNSON (CONT'D)	So. Are you her?
F	ELLA	Am I who?
M	CREEK JOHNSON	The whore Jake quit this gang for. OH. Another piece of the puzzle falls into place -- Jake's eyes " e." Jake does his best to stay cool, meets Creek's stare:
M	JAKE	Watch your mouth, Creek.
M	CREEK JOHNSON	Or what? These boys are with = now. jID in charge. You may be fast, but you are goddamned outgunned. ON JAKE. OUR HEROES. Shit. Jake turns to the men --
M	JAKE	That a fact, Boys? But Creek doesn't wait for them to respond:
M	CREEK JOHNSON	Put your guns on the whore. He so much as twitches, blow her brains out her ear. AT ONCE, 10 GUNS ARE LEVELED AT ELLA'S HEAD. No doubt as to who
M	JAKE	Call her a whore again, that'll be the last word you ever say.
M	CREEK JOHNSON	You ain't in no position to make threats, asshole. Hunt: take his gun. Hunt reluctantly scrambles over to Jake, oh-so-carefully pulls the PISTOL from Jake's holster:
M	HUNT	Sorry, Boss... nothin' personal. Creek now turns to BULL MCCADE, roughly the size of a BARN.
M	CREEK JOHNSON	Put him down, Bull. And Jake barely has time to react as Bull lets fly with a JAWBREAKING HAYMAKER that about knocks Jake out of his BOOTSI Dolarhyde and Colorado WINCE as Jake hits the dirt with a THUD --
M	CREEK JOHNSON (CONT'D)	Where the hell's our gold. Jake? "Gold?" Jake SPITS BLOOD, defiant:
M	JAKE	Don't remember. Creek NODS to Bull: SMASH! Another devastating BLOW. ON ELLA -- at GUNPOINT. Wishing she could intervene. DOC too.
M	CREEK JOHNSON	Well I _dg remember you tellin' us you was leavin' us high and dry because you were in love... You just left out the part about taking half our goddamned haul from the Yuma Bank. So I'm gonna ask you one last time -- Where. Is. Our. Gold? -- WHAM! Bull PUNCHES Jake so hard he FLIES OFF HIS FEET:
M	CREEK JOHNSON (CONT'D)	Man can't run away from who he ja, Lonergan... you really think you could go straight just cause you were fool enough to fall in love with some woman? WHAM! Bull PUNCHES Jake back into oblivion, and on the HIT we:
F	ALICE	You sure you wanna give it all up? ON JAKE. Clearly TORN. But just as clearly, in LOVE.
M	JAKE	What about you? Once we're gone, you ain't ever comin' back. She touches his face so gently. And whispers:
F	ALICE	You're the first person ever believed I was better than this place... so I gotta believe in y=. You're a good man, Jake Lonergan. PRESENT: as the words "Good Man" ECHO back to Jake. Stir=g_
M	CREEK JOHNSON	You figgered you could steal from us? All that gold was yours to take co you could go off and start a new life? Creek's next PUNCH takes us to another: TORY FLASECUTI REPLAY -- Jake and Alice in the cabin -- he
F	ALICE	Your boys'ii come after you.
M	JAKE	Let 'em come. BACK TO PRESENT -- as now Jake UNDERSTANDS the context of this moment -- what they were saying to each other -- He looks up at Creek, BEATEN AND BUSTED UP: Okay... okay, I remember now... Demons stole your gold, Creek. But when you get to hell, you can ask for it back. Okay then. That's the way you wanna do this... Kill the whore. ON THE GANG. As they all cock their guns -- Aimed at Ella -- This is IT -- JAKE -- slowly lifts his head, suddenly RAGE-FILLED as -- the SMOKING BOOTS that formerly belonged to Creek:
M	JAKE	Told you not to call her that. ON JAKE. Pure KILLER. As he turns his weapon on the rest of
M	JAKE (CONT'D)	You're all riding with me. Any one of you decides otherwise? So help me God, I'll kill you where you stand. I'm j2acj& and I'M in goddamne.d The gang quickly flips: "Absolutely, Jake/ Whatever you say, Boss..." Jake turns to the speechless Bull McCade and KICKS HIM Now he meets eyes with ELLA. She can't help SMIRKING, grateful.
M	DOC	Dios mio.
M	DOLARHYDE	Jesus... it's the kid. As Emmett ROARS IN, the shocked outlaws SCATTER: The kid TUMBLES off the speeder as it PLOWS RIGHT THROUGH CAMP,
M	DRAGGED AWAY!	Those who have their wits about them FIRE BACK, trying to hit the flying machines. CROSSFIRE. CONFUSION.
M	THE SLAVER	His speeder GROWLS to a halt. Dismounting like a killer biker. ON JAKE. As he SEES that horrible alien face across the crowd: QUICK BIT: Alice dying in his arms. And this same damn THING is the one responsible for it. And we're: BACK TO PRESENT. Jake's eyes LOCKED on the SLAVER as he says:
M	JAKE (CONT'D)	You. Outlaws start FIRING at the Slaver, who REACTS in mere annoyance. Flicks open a POUCH on his bandolier for what look like THUMB TACKS -- throws them and they tan out, PIERCING THE NECKS of the outlaws, activating "Blue": !NTLY E ZE. TUR an The Slaver draws a ROL) that TELESCOPES into a SIX FOOT LANCE -- limbs, then FOUR -- LEOPARD-LIKE for speed -- rises back up and the bladed-ends to SKEWER five more outlaws and turns -- Find cover!!! Jake FIRES his pulse blaster, providing cover as DOLAR, DOC, EMMETT, and ELLA rush to hide behind the WAGON. The Aliens FIRE life, MOWING DOWN tents as they try to hit the aliens --
M	ANOTHER ALIEN	Hurls a boomerang-like "SMART WEAPON." It circles past the GATLING COWBOYS, BACK into the alien's hand as: Ella REACTS -- WHAT? As an alien SKITTERS toward her, she grabs HORRIBLE SCREECH as its skin smokes, thrashing epileptically -- Oh my GOD -- Our people ESCAPE for the horses. Doc climbs up on the WAGON buckboard and pulls EMMETT in the seat beside him -- As ELLA leaps on a horse --
M	THE SLAVER	Climbs back on his speeder and GUNS FOR HER, firing a STEEL Too late: KA-CHANK! The collar CLAMPS her neck, RIPPING ELLA
M	SKIER BEHIND A SPEEDBOAT!	ON JAKE -- FURY -- HIS BRACELET ACTIVATES! And there's a LOGIC SUSPENDED just oft the ground while her heels BOUNCE HARSHLY --
M	JAKE ON THE HORSE	Riding hard -- aims his BLASTER, trying to get a TARGET on the ENTRANCE as Ella's fingers reach wildly for THE BOWIE KNIFE on Jake still in pursuit but suddenly...
M	PINKERTON #1	You hear.that?
M	PINKERTON #2	How many times I gotta tell you, Leonard. No one'd be stupid enough to rob this tr-- When the Pinkertons SNAP around, Ella's GONE... but now they SEE
M	PINKERTON #2 (CONT'D)	1 stand corrected. They DRAW GUNS, running to see what's happening and -- Through a slot between boxcars, the speeder BLURS in the She GRUNTS WITH EXERTION as their fingers GRAZE each other and choice, he LETS GO of the LADDER -- HITS the ground PAINFULLY
M	THE PINKERTONS RUSH TO THE ROOF EDGE	-- SXLSKLISH! The disc VIVISECTS THEM THEN CIRCLES BACK AROUND, cutting the IRON STRAPS that secure the logs in the tender car -- Then in a BLUR, it's GONE. Jake's blaster REVERTS into a bracelet. When the smoke clears: ELLA is revealed on the ground, thrown from the speeder. Jake REACTS -- EQ -- takes her in his arms. She desperately tries to SAY SOMETHING... but goes LIMP.
M	JAKE	Ella...? Her head just falls back. Yeah. Hard to swallow, but it's true. ELLA'S DEAD. And if this moment ECHOES Jake holding his dead wife, well that's just fine. He stares beseechingly as... HOOFBEATS. The rest of our people gallop in: Colorado, Dolarhyde, Doc and Emmett in the wagon:
M	EMMETT	Aw no... is she --? Jake looks up -- unhinged --
M	NAT COLORADO	We need to get out of here NOT. Not gonna leave her here -- L4Re.Xam -- -- I'M NOT LEAVIN' HER! -- This is Apache territory! They catch us, they'll kill u-- THHHHHHHUNKI The air SCREAMS as an ARROW pierces the ground inches from Jake's hand! Suddenly THIRTY MORE -- ALL AROUND THEM -- forming an instant circle perimeter as -- APACHE WARRIORS FLASH DOWNHILL. Dolar dismounts, swings Emmett to the ground --
M	NAT COLORADO (CONT'D)	Nobody move. Jake and Emmett freeze. The Apaches are ALL AROUND THEM. Fierce. BOWS and TOMAHAWKS drawn -- OFF THIS: Jake is alone. Overwhelmed. Raw. Something rising in him. Something he COULDN'T FACE... until this moment:.
M	JAKE	I remember now. I-- I did love her. And just saying it, saying those words, brings a swell of EMOTION to the surface... but he FIGHTS it. A losing battle, as She was like you. Seemed to think I was a good man. But I couldn't save either of you. A beat... his bound hands gently touch her face...
M	JAKE (CONT' D )	Where's the good in that? His eyes CLOSE. Too much.
M	JAKE (CONT'D)	I'm sorry, Ella. And that sits... then suddenly -- JARRINGLY -- THREE MORE BRAVES PYRE is ignited and if we ever had any doubt about Ella being dead, the BRAVES carry her roughly past -- -- he's YANKED BACK and held in place as... ELLAIg BODY IS
M	EMMETT	Wasn't your fault, Mr. Lonergan. Those things... were lookin' for her. Had a picture and everything. That breaks the spell. Jake looks over --
M	JAKE	What d'you mean... 'a picture'?
M	EMMETT	Floatin', like that arrow thing we found in its eye. Before Jake can makes sense of this, a teepee smoke flap OPENS and out steps the tribe's SACHEM. This is GREY WOLF -- dark,
M	DOC	What'd he say?
M	COLORADO	"Kill them. And make it quick." Doc is amply freaked. Turns to Jake as FIVE OF THE BRAVES move for them, MENACING --
M	DOC	Now'd be a good time to use your gun bracelet, my friend. But Jake is VACANT. BROKEN. All the fight seems GONE from him. His bracelet DOESN'T MOVE. Dolarhyde's grabbed first... PULLED FORWARD by one of the braves, raising his TOMAHAWK -- they're really gonna KILL HIM -- SURPRISED looks from just about everyone in the camp (besides Colorado) as we realize Dolarhyde just spoke APA ON GREY WOLF -- INTRIGUED as he approaches Dolarhyde:
M	GREY WOLF (SUBTITLE)	How is it that you speak our language?
M	UOLARHYUE (SUBTITLE)	Because I'm a damn genius. Grey Wolf's fascinated this man has the audacity to be a WISEASS given his circumstances. Turns to the Brave with the tomahawk --
M	GREY WOLF (SUBTITLE)	Forget about quick. Make him feel it. The Brave NODS, RAISES the Tomahawk again, but Dolar interrupts:
M	DOLARHYDE (SUBTITLE)	Two hundred head of cattle! Grey Wolf holds up his hand, halting the Brave's death blow --
M	DOLARHYDE (SUBTITLE) (CONT'D)	I'll have two hundred head of cattle u_a here in a day's time if you let me go. ON GREY WOLF. Considering this. And how do I know you'll come back? Dolarhyde nods to Colorado --
M	DOLARHYDE (SUBTITLE)	You can keep my associate here. if I don ' t come back, you can kill him. Colorado REACTS. He's the only one here who knows what the hell these two are saying to each other as Grey Wolf approaches Dolar, looks right INTO HIM --
M	GREY WOLF (SUBTITLE)	Why should I believe that you even care about this man? Dolarhyde's eyes flash EMOTION. Quickly bottled. Then:
M	DOLARHYDE (SUBTITLE)	Because he's my son. Wow. Didn't see that one coming. Grey Wolf levels Colorado with those unyielding eyes --
M	GREY WOLF (SUBTITLE)	Is this true? And Colorado answers in ENGLISH, for the benefit of the others:
M	COLORADO	Yeah... he's my father. REACTIONS. JAKE. EMMETT. DOC. Stunned silence. And so:
M	GREY WOLF (SUBTITLE)	Three hundred head. Dolar looks to Colorado, who won't meet his eyes. His FATHER's Two fifty. HOLD ON GREY WOLF for a beat. Then --
M	GREY WOLF (SUBTITLE)	Cut him loose. The Brave does exactly that. Dolar's FREE to go...
M	EMMETT	Hey! What about =?!? ON DOLAR. A FLASH of regret. But it's gone fast.
M	DOLARHYDE	What about you, kid? And he just walks out of the camp, leaving his son behind... GONE. And now, it's back to business --
M	GREY WOLF (SUBTITLE)	Kill all of them except the half-breed. Our people are GRABBED. Jake's yanked forward, PINNED DOWN -- a Brave raises a HATCHET to kill Jake, who glares back with lunatic eyes. Ready to die. Almost wanting it:
M	JAKE	What're you waiting for, asshole? DO IT. And as Jake's about to MEET HIS DEATH: close to us in physical appearance, her features acutely feminine, yet... ALJM. PANDEMONIUM. The Apache kneel in prostration, DROPPING weapons to human flesh-tone. Hair too. When she finally STOPS, she
F	ELLA	. what... happened? ON JAKE. Holy. SHIT. Everyone else equally STUNNED.
M	EMMETT	You... died. Ella looks around. Fifty dumbstruck faces staring at her. . oh. OFF ELLA, who's got a helluva lot to explain -- a step TOWARD him:
F	ELLA	If I'd told you on the boat, you never would'a trusted me -- -- but he takes a step BACK. If he's relieved she's alive, he isn't showing it:
M	JAKE	Did you hear what I said?
F	ELLA	.. What?
M	JAKE	When you were playin' possum. Did you hear what I mid? He's angry. Yes, even embarrassed. And because of it, something has SHUT DOWN in him again. That killer look is back.
F	ELLA	No. I was mendin'. It's like sleep. His eyes narrow, trying to understand:
M	JAKE	How's it you look like one of us?
F	ELLA	I can look like whatever I want to.
M	JAKE	So you can't die?
F	ELLA	Sure I can. If my heart stops beating... just like you.
M	.JAKE	You're nothin' like me, Ella. You're one'a them. we can see that hurt her. But she deserved it, too. So desperately wants to reach him...
F	ELLA	I'm not, Jake. I'm from a different place. He isn't sure what that means. Can he even trust her? Either way, she has ANSWER;. Darkly:
M	JAKE	The one that took you. It killed her. That LANDS on her. Knowing and painful.
F	ELLA	They call him The Slaver. He's the one, gave me the scars. Broke me. And made me watch... while he killed my family too. Even with his guard up... Jake can't help but be STRUCK. As the sound of HOWLING WIND takes us to: He stalks down, LEAVING FRAME -- as we HOLD on the field of
M	ELLA (V.0.)	For every drop of light in the sky, there's another world. Filled with life...
F	ELLA	Our race was first to map the stars... that's why they came for us. Took our planet, piece by piece. Slaughtered anyone who fought hack. Ones who survived were turned into slaves. Trackers. She says this meeting the eyes of GREY WOLF. There's immediate SIMPATICO here: a story the Indians could be telling.
M	ELLA (CONT'D)	They brought me aboard one of their scout ships -- a ship with only one purpose: to find other planets like mine. Planets they can take... people they can enslave. As the terrible gravity of all this HITS everyone, JAKE is first to understand...
M	JAKE	X lead 'em here. Ella swallows. Wracked with GUILT.
M	EMMETT	Well damn, lady, thanks a 1.
F	ELLA	I never wanted this. But they got... ways. Of making you do things. Her eyes are HAUNTED with memory. The inference is some kind of
M	ELLA (CONT'D)	Been tryin' to make it right... tried to blow the ship to hell by burnin' up all their fuel, then escaped down here. 'Cept it didn't work... damn thing survived.
M	JAKE	Where is it. Jake's determined -- he's got his OWN agenda. Ella looks up to that OMINOUS CLOUD. Those BLUE LIGHT FLASHES ripple within:
F	ELLA	Hiding in that cloud. Way I figure, they'll find enough fuel to leave by tomorrow, midday. Then they'll bring back the others.
M	DOC	"others"?
F	ELLA	The whole fleet. They'll take what they need. Everyone on this planet. Anything too weak to survive... they'll toss. Like that cow. Tomorrow. Midday. Hi noon. This is bad, bad news.
M	NAT COLORADO	What'd you mean, they're looking for "fuel"...? And before Ella can answer, Jake already GETS IT:
M	JAKE	Gold. That's why they're in a mine.
F	ELLA	. wherever it is, that's where you escaped from -- and it's the only way back up to the ship. Even with your memory wiped, your instincts kicked in -- That's how it works, Jake, the bracelet reads your impulse -- you wanna fight, it reacts. Somehow you took it off one of 'em... don't you remember any of it? ON JAKE. Deeply STIRRED. As he looks down at the BRACELET and: the TERRIFYING OCULAR PROBE lowers right in front of our eyes One of the ALIENS starts to activate the probe -- it begins to But our arm manages to BREAK FREE -- a BLADE hidden in our sleeve -- WE SLASH OFF THE. ALIEN'S HAND -- GRAB THE BRACELET off its severed limb -- it COILS around our wrist and ACTIVATES: BLAM SLAM! We BLAST the creature to oblivion -- we're FREE! JAKE IN PRESENT -- Eyes ALIVE with MEMORY:
M	JAKE	I-- I blasted my way out... MEMORY FLASHCUTI REPLAY POV as we RUN through the cavern -- ESCAPE -- a LIGHT at the end of the tunnel -- BLINDING SUN hits us as we emerge -- our eyes ADJUST to see: That STRANGE ROCK FORMATION HIGH ABOVE on the edge of a CANYON -- the STONE TOWER pointing to heaven -- JAKE IN PRESENT: The sequencing is COMPLETE for him now:
