M	CHARACTER	DIALOGUE
M	PAT (CONT'D)	Hey, how you doin'? Is Tiffany here?
M	TIFFANY'S MOTHER	What do you want with her?
M	TIFFANY'S FATHER	Is that another creep? What do you want, creep? Just beat it.
M	PAT	Whoa, no, no, no. No, I'm married.
M	TIFFANY'S FATHER	Oh, great, a married creep.
M	PAT	I'm her friend.
M	PAT (CONT'D)	We go running. Have you guys not seen us? I took her to the diner.
M	TIFFANY'S MOTHER	She's not here.
M	JORDIE	Hi, guys. How's it going? Hey. Is Tiffany home?
M	TIFFANY'S MOTHER	Go away.
M	JORDIE	I know her. I know her, we've dated. We still date.
M	PAT	What are you doing here?
M	JORDIE	I've called her, I've texted her.
M	PAT	Do you know this guy?
M	JORDIE	I still haven't heard back. We used to work together--
M	TIFFANY'S FATHER	Just get the hell out of here...
M	JORDIE	I just wanted to give you my card to give to her.
M	TIFFANY'S FATHER	Another rude creep.
M	PAT	Listen to what he's saying. Listen to what he's saying.
M	JORDIE	What's he saying?
M	PAT	He's saying you're being rude.
M	JORDIE	How am I being rude?
M	PAT	Oh, you know. You know. Come on. Sometimes it's okay with girls like this, they wanna have fun and
M	PAT	--it's not because they got a broken wing, and they're hurt, and they're an easy target. And in this case, in this particular case, I think that wing is being fixed. And you gotta make sure it gets mended. And you're gettin' in the way of that right now, okay? Because she's sensitive and she's smart, she's artistic. This is a great girl and you gotta be respectful of that. Come on.
M	PAT (CONT'D)	Let me walk you down to your car. You're a better guy than this. I can see it in your eyes.
M	JORDIE	She just texted me!
M	PAT	Hey! Hey, wait a second! What are you doing? What happened? How come you weren't outside? What the hell's going on?
F	TIFFANY	I can't, I can't do it. What do you mean, you can't do it? You can't do what?
F	TIFFANY	I can't give the letter to Nikki.
M	PAT	Tiffany, what are you talking about? What do you mean you can't give the letter to Nikki?
F	TIFFANY	Because what am I getting in return? What are you doing for me?
M	PAT	You said! You said if I wrote a letter, you'd get it to Nikki.
F	TIFFANY	I know.
M	PAT	That was the set-up.
F	TIFFANY	Because I do this time after time after time, I do all this shit for other people and then I wake up and, and I'm empty, I have nothing!
M	PAT	What are you talking about? You seem like you're a tough girl to me. Why don't you just do things on your own?
F	TIFFANY	I always get myself in these fucking situations. I give everything to other people and nobody ever, I never -- I don't get what I want, okay? I'm not my sister. Pat takes this in.
M	PAT	Alright, well, ask for you. What can I do for you?
F	TIFFANY	I can't do it.
M	PAT	Tiffany, what do you want me to do?
M	PAT (CONT'D)	Think of something.
F	TIFFANY	There's this thing.
M	PAT	There's a thing, okay. What kind of thing?
F	TIFFANY	It's a thing, it's a thing. It's a, it's a dance thing.
M	PAT	It's a dance thing, all right.
F	TIFFANY	It's a competition thing at the Benjamin Franklin Hotel. Tommy would never do it with me and I missed it every single year.
M	PAT	Well, Tommy's dead, so he's not gonna fucking do it.
F	TIFFANY	Would you please!
M	PAT	I don't have a filter when I talk.
F	TIFFANY	Can we have one conversation without you reminding me that my goddamn husband is dead? My God.
M	PAT	Yes, I'm sorry. I'm sorry. Okay, I'm sorry.
F	TIFFANY	But I can only do it if I have a partner...and now I'm about to miss it for another year.
M	PAT	Whoa, whoa, whoa, I'm not gonna fuckin' dance with you. What are you talking about?
F	TIFFANY	What, your schedule is so busy? "Grapes of Wrath" and watching football with your dad?
M	PAT	Tiffany, I'm not gonna do a dance with you.
F	TIFFANY	All right, then I'm not giving her your fucking letter.
M	PAT	Wait a second! But you promised you would do this.
F	TIFFANY	Think about it.
M	PAT	Well, I already did do something for you, you know.
M	PAT	I took care of that jerkoff that was in front of your house.
F	TIFFANY	What? Jordie?
M	PAT	Let me ask you something. Do you call him when you're lonely?
M	PAT (CONT'D)	That encourages him, Tiffany. You shouldn't do it.
F	TIFFANY	Couldn't you say the same about you and Nikki?
M	PAT	It's not at all like me and Nikki. What are you talking about? We're in love and we're married. It's completely different.
F	TIFFANY	How are you in love? Tell me about that. The big Nikki love. Tell me about it, I wanna understand it.
M	PAT	We have a very unconventional chemistry, it makes people feel awkward, but not me. She's the most beautiful woman I've ever been with.
F	TIFFANY	Wow.
M	PAT	It's electric between us, okay? Yeah, we wanna change each other, but that's normal, couples wanna do that, I want her to stop dressing like she dresses, I want her to stop acting so superior to me, okay? And she wanted me to lose weight and stop my mood swings, both of which I've done. I mean, people fight. Couples fight. We would fight, we wouldn't talk for a couple weeks. That's normal. She always wanted the best for me. Tiffany listens.
M	PAT (CONT'D)	She wanted me to be passionate and compassionate. And that's a good thing. You know? I just, look, I'm my best self today, and I think she's her best self today, and our love's gonna be fucking amazing.
F	TIFFANY	It's gonna be amazing, and you're gonna be amazing, and she's gonna be amazing, and you're not gonna be that guy that's gonna take advantage of a situation without offering to do something back. So think about the dance thing. Danny, you're out of the hospital? And you're here on game day?
M	DANNY	I'm out.
M	DANNY (CONT'D)	It's official, man. They didn't convert me to my Mental Hygiene Law admission status within two thirds of the maximum length of my felony sentence, so I'm out. They had to let me go.
M	PAT	I never understand what he's saying.
M	PAT SR.	Okay, jailhouse lawyer, come on, let's come back and sit down the way you were before. What a treat!
M	AND RONNIE STAND.	SPORTS ANNOUNCER (over television) (low and indistinct
M	PAT	Whoa, whoa, whoa. Dad's got you sitting here?
M	PAT SR.	Oh, yeah.
M	DANNY	He calls me "Jailhouse Lawyer."
M	PAT SR.	Hold the remote the way you were holding it before.
M	DANNY	Okay.
M	PAT	And now you're holding the remote?
M	DANNY	And it's working. Your dad's a genius. PAT SR. URGES DANNY TO SIT UP STRAIGHTER with remote.
M	PAT SR.	Now sit up.
M	PAT	And Danny's the good luck charm?
M	PAT SR.	Danny's from you. This is your house, so it comes down to you. You're the one.
M	DANNY	Yeah, you're the one, Pat.
M	PAT	Superstition, Danny. I don't know.
M	PAT SR.	Come sit down. Don't disappear doing God knows what with that Tiffany Maxwell.
M	PAT	Dad, Dad, Dad. She's my friend. Why would you say that?
M	RONNIE	Oh, she's a mess. You gotta be careful. She goes to a lot of therapy.
M	PAT	I go to a lot of therapy, Ronnie. What are you trying to say?
M	RONNIE	I'm just saying-- Am I messed up? Why don't you stop judging people? You judge everybody. You're the one who has a messed up marriage.
M	RONNIE	I'm just looking out for you, I'm just looking out for you. She's unstable. What's wrong with your marriage? What's wrong with your marriage?
M	RONNIE	Nothing's wrong!
M	PAT	You should have seen when I was at his house. It's like a circus over there.
M	RONNIE	Shh, shh.
M	PAT	What are you talking about? I'm not gonna hide this. You need to deal with it.
M	RONNIE	Stop breaking my balls.
M	PAT	Oh!!!!
M	RONNIE	I got you an iPod.
M	PAT	Whoa! Is this for me?
M	RONNIE	Yeah. Well, that's my old iPod, but- Oh, buddy, thank you. That's so nice of you. Wow.
M	RONNIE	Thirty-two gigabytes.
M	PAT	How many songs is that?
M	RONNIE	Seven thousand.
M	PAT	Oh, yeah, you got The Stranglers. You love The Stranglers. Oh, the Sex Pistols. The Clash.
M	RONNIE	Got some Clash.
M	PAT	Oh, "West Side Story."
M	RONNIE	Yeah, "West Side Story." It makes me peaceful. "Maria, I just met a girl named Maria..."
M	PAT	Right, right, right.
M	RONNIE	And then when I'm angry, which is a lot these days, I go to the garage...Metallica...Megadeth. I start fucking smashing shit.
M	PAT	You gotta get your marriage together. I start breaking shit, and I hurt my hand. And --
M	PAT	Ronnie, that's fucked up.
M	RONNIE	Yeah, but it makes me feel better. It's like my therapy, you know?
M	PAT	When I'm with Nikki, I'm never gonna do stuff like that...
M	JAKE (O.S.)	Whoa, Nikki? What's all this about Nikki? Pan from the framed photo of Jake on foyer wall, to Jake on
M	JAKE (CONT'D)	A restraining order is nothing to fool with, bro. [Walks down to Pat]. Holy shit, look at you! You are fit! You look absolutely amazing. You feel good?
M	PAT	How you doing, Jake?
F	JAKE	Good. You look like Schwarzenegger in his prime.
F	DOLORES	Didn't I say you wouldn't recognize him?
F	JAKE	So, listen, I'm sorry that I didn't come see you down at the hospital. You know how those places creep me out, and the firm's been expanding. I've been helping Pop with the restaurant `cause he needs to have a legitimate business. He needs a tax return. With all the money that he's making with his bookmaking, they're gonna come after him. And then it looks like I'm making, I'm gonna make partner at the firm. Pat just stares at Jake. The room is silent.
M	JAKE (CONT'D)	Well, I don't even know what to say to you anymore. You lost your wife, I'm getting engaged, and I wanna be able to tell you about those kind of things. You lost your house, I'm getting a new house. You lost your job, things are going great for me at the firm. PAT SR. Maybe stop talking about all the stuff that's good for you and bad for him. Just, you know, leave it alone. We're watching the game.
F	JAKE	You know what, I'm just gonna, I'm just gonna, I'm just gonna stop talking. I'm gonna shut my mouth. Pat stares down Jake. Tense.
M	PAT	As my friend Danny would say 00 The room hangs on Pat's words.
M	PAT (CONT'D)	I got nothing but love for you, brother.
M	DANNY	That's right. That's right.
M	RONNIE/RANDY/DANNY/DELORES (O.C.)	That's nice. That's nice.
M	PAT SR.	Well, thank God, finally.
M	PAT	DeSean Jackson.
F	JAKE	Yeah. Did it fit?
M	PAT	I wore it to Ronnie's for dinner.
M	RONNIE	Beautiful jersey. I love that jersey.
M	PAT	Veronica didn't like it.
M	RONNIE	Veronica hates the jersey.
F	JAKE	Whatever you do, watch out for that restraining order, okay?
M	PAT	I'm not doing anything!
M	RONNIE	Don't let Tiffany get you in trouble.
F	DOLORES	Pat, you're up to something, I know.
M	PAT	People like Tiffany, or Danny, or me, maybe we know something that you guys don't know, okay? Did you ever think about that? Maybe we understand something because we're
M	DANNY	We have a sixth sense. I mean, everybody's got it. Everybody's just not in touch with it.
F	DOLORES	Oh, no.
M	OFFICER KEOGH	How you doing, Pat?
M	PAT	Jesus.
M	PAT SR.	I guess his sixth sense forgot to tell him the cops were coming. I'm taking him back to the hospital.
M	PAT	What? No, no, he passed his thing, right?
M	DANNY	First of all, check with the latest legal development.
M	OFFICER KEOGH	Well, we got a call that they did convert you to a Mental Hygiene Law admission status by the deadline of your sentence, so.... Wait a minute. Are you an Eagles fan or are you not an Eagles fan?
M	OFFICER KEOGH	I'm an Eagles fan.
M	PAT SR.	Well then, what's the problem? He's not goin' anywhere. Just let him finish the game, that's all. The handkerchief is working. We're killing the Seahawks, twenty-seven- ten. What's the matter with you? Let him stay, please!
M	OFFICER KEOGH	I don't know what the hell you're talking about "the handkerchief". And I'm glad that the Seahawks are losing and we're winning, but I gotta take Danny McDaniels back to Baltimore, alright? He can contest his case from Baltimore.
M	DANNY	Not correct about the Mental Hygiene Law. You're not correct.
M	OFFICER KEOGH	Come on.
M	DANNY	You guys oughta be ashamed of yourselves.
F	TIFFANY	I used the insurance money to build this. I designed it. All the floors are hard oak. It has good bounce for dancers.
M	PAT	Wow.
F	TIFFANY	I'm not that great of a dancer, but who cares? It's therapy and it's fun. And the walls are good `cause I can play music really loud without anybody hearing.
M	PAT	Where do you sleep?
F	TIFFANY	Upstairs. It's a garage, I just renovated it. You know, I was thinking about putting a ballet barre here.
M	PAT	
F	TIFFANY	What?
M	PAT	The letter to Nikki.
F	TIFFANY	Probably tonight.
M	PAT	Really?
F	TIFFANY	Ronnie and Veronica and I are gonna see her tonight.
M	PAT	Oh, I actually changed the first paragraph. I did this thing about Shakespeare and how it's very
F	TIFFANY	Mm-hmm.
M	PAT	-and that maybe in the future if she wanted to go dancing, I can be able to do that because of all the No, that's good, that's really good.
M	PAT	I assume you're a good teacher.
F	TIFFANY	Yeah. I mean, I hope so.
M	PAT	Maybe you can teach us both, you know what I mean?
M	PAT (CONT'D)	And I also mentioned how generous it is, what I'm doing for you.
F	TIFFANY	Yeah. Mm-hmm. It's really generous.
M	PAT	You know, being of service.
F	TIFFANY	Yeah.
M	PAT	To your need.
F	TIFFANY	Uh-huh. All right, let's start simple. Start at that corner, walk towards me. Walk across the room. Pat stands in the corner, doesn't move.
M	PAT	Can we do something else besides the dance deal?
F	TIFFANY	Are you fucking kidding me?
M	PAT	I'm good with a hammer. You want me to fix something?
F	TIFFANY	A deal is a deal.
M	PAT	I know. Okay. I was just suggesting that maybe there's a better scenario.
F	TIFFANY	Why don't you walk towards me like I'm Nikki. And the only way to convey how much you've missed me is by your walk. By your slow walk. You can't talk.
M	PAT	I'm not doing it.
F	TIFFANY	Only walk. Do it.
M	PAT	No. That's stupid.
F	TIFFANY	No walk, no letter. Walk to me like I'm Nikki, come on. Do it. I'm Nikki. Come on.
M	PAT	You're not Nikki.
F	TIFFANY	Don't look up until you're halfway here.
M	TIFFANY (CONT'D)	That's right.
M	TIFFANY (CONT'D)	Not yet.
M	TIFFANY (CONT'D)	Yes. Do you feel that? That's emotion.
M	PAT	I don't feel anything.
F	TIFFANY	Has anybody ever told you how Tommy died?
M	PAT	No.
F	TIFFANY	We were married for three years and five days, and I loved him. But for the last couple months, I just wasn't into sex at all. It just felt like we were so different and I was depressed. Some of that is just me, some of it was he wanted me to have kids and I have a hard enough time taking care of myself. I don't think that makes me a criminal. Anyway one night after dinner, he drove to Victoria's Secret at King of Prussia Mall and got some lingerie to get something going. And on the way back, he stopped on 76 to help a guy with a flat tire and he got hit by a car and killed. And the Victoria's Secret box was still in the front seat. (pause) That's a feeling.
M	TIFFANY (CONT'D)	Okay, this is the waltz. I'm gonna teach you the waltz step.
F	DOLORES	Whoa! Slow down.
M	PAT	What?
F	DOLORES	Your father wanted you to have this.
M	PAT	He wants me to have-
M	PAT (CONT'D)	-all this Eagles information.
F	DOLORES	It's his living.
M	PAT	Um, tell Dad thanks.
F	DOLORES	Your father expects to spend time with you, Pat. Football stays out of this place, so does "Lord of the Flies."
M	PAT	Wait, wait, no, no, no, what are you doing? I'm behind on my syllabus.
F	TIFFANY	I don't give a fuck.
M	PAT	What the hell are you doing?
M	PAT (O.S.)	Hey, hey!
M	PAT	Did you just throw that outside?
F	TIFFANY	What? You're not gonna read that shit on my time. I can tell you all about the "Lord of the Flies." It's a bunch of boys on an island and they have a conch -- they have a shell -- and whoever has the conch has the power and they can talk. And if you don't have the conch, then you don't have the power. And then there's a little chubby boy, and they call him Piggy and they're really mean, and then there's a murder. I mean, humanity is just nasty and there's no silver lining.
M	PAT	Wow. That was a great synopsis. I still need to read it, though.
M	PAT (CONT'D)	Who's that? What the....? (laughing) What are you doing here, man?
M	DANNY	If one of your two supervising physicians loses their license, then your whole ajudication is thrown out.
M	PAT	How'd you know we were here?
M	DANNY	I went by your parents' house looking for you and they told me you was over here.
M	PAT	Danny, this is Tiffany. (to Tiffany) Tiffany, this is Danny.
F	TIFFANY	Hello. Pat told me about you.
M	DANNY	So is the girl, that you wrote about?
M	PAT	Yeah.
F	TIFFANY	What? He wrote about me? I'm "the girl"?
M	DANNY	He wrote about you, all right.
F	TIFFANY	What'd he say?
M	DANNY	He said you guys was helping each other out and you were nice and had a mouth on you, that you were mouthy, but--
M	PAT	Whoa, whoa, that's enough.
F	TIFFANY	No, please, tell me more about what he said in the letter.
M	PAT	Yeah, anything you wanna know, I'll just tell you. It was nothing. It was just a very general letter.
F	TIFFANY	Cool.
M	DANNY	She's fine.
M	PAT	She is my friend with an "F."
M	DANNY	A capital "F."
M	PAT	For "friend." The three stand there awkwardly for a beat.
M	DANNY	Hey, can I see what you guys are doing?
M	PAT	Yeah.
F	TIFFANY	Okay.
M	TIFFANY (CONT'D)	And then this goes into something else.
M	DANNY	That's it?
M	PAT	Why? What is it, what is it, what is it.
M	DANNY	Can I say something? Do you mind?
F	TIFFANY	No.
M	DANNY	You sure?
M	PAT	Just say it. Say it.
F	TIFFANY	No, please.
M	DANNY	I think Pat, you should be facing Tiffany.
M	DANNY (CONT'D)	Let me show you, Pat, let me show you what I mean. You gotta come at her with a little bit more soul, man. You should move more hips. Just, just sort of come in, Pat, come in like this. And....
M	PAT	Okay.
M	DANNY	Yeah. Can you move `em a little bit more? Yeah, that's it. Move `em a bit more. You could turn around, too, there's nothing wrong with that. Yeah. You're pretty good. Mm, yeah.
M	PAT	Okay, we got it, we got it.
M	DANNY	Okay. Okay.
M	DANNY (CONT'D)	Come on, Pat, come on. A little bit more soul. Black it up, Pat.
M	PAT	"Black it up"?
M	DANNY	You know damn well what it means.
M	DANNY (CONT'D)	Oh, wait a minute, wait a minute, wait a minute. Oh, man! I got an idea.
M	DANNY (CONT'D)	Come get some, Pat. Come get some.
M	DANNY (CONT'D)	Shuffle back, shuffle back. Shuffle back, shuffle back. Girl, you gotta move your junk.
M	DANNY (CONT'D)	I gotta get out of here. I gotta go see this girl, Tanya. She lives on this side of town.
M	PAT	Yeah, go see Tanya. Good idea.
M	DANNY	Okay, man, hey. I'm gonna be there, man. I want you guys to win!
F	TIFFANY	Bye!
M	DANNY	Excelsior, Pat!
M	PAT	Excelsior!
M	DANNY	That's my man.
M	PAT SR.	Hey. Patty.
M	PAT SR. (CONT'D)	Pat.
M	PAT SR. (CONT'D)	Patty. Where have you been? Huh?
M	PAT SR. (CONT'D)	We got a serious situation on our hands, you know that. Pat looks concerned, he could be in trouble.
M	PAT SR. (CONT'D)	We gotta beat the Giants if we wanna have a chance of getting into the division, any chance of playing in the playoffs. Do you realize that?
M	PAT	I didn't realize that.
M	PAT SR.	Yeah, that's the bind we're in. I mean, I think it would be wise if we spent father-son time, reading about the Eagles, talking about them, just to strengthen the good luck thing that you're in.
M	PAT	Okay.
M	PAT SR.	Yeah?
M	PAT	Right.
M	PAT SR.	Hmm?
M	PAT SR. (CONT'D)	I just wanted to, maybe I didn't, spend enough time with you growing up. I spent too much time with your brother. It might have made you feel worse about your behavior, but I didn't know anything, I didn't know how to handle it. I mean, that's what all this Eagles stuff is about. It's about us, spending time now. I wanna do everything I can to help you get back on your feet. That's the whole point. Yeah. I wish you'd watch these games with me so we could talk, we could get into things. (inhales) So would you, would you just come downstairs and talk to me and Randy now?
M	PAT SR.	Randy, tell him what I'm doing.
M	RANDY	He's betting everything on the Giant game. Everything. All the money that he needs for the restaurant, he's betting on the Giant game.
M	PAT SR.	Tell him why.
M	RANDY	Because he believes in you.
M	PAT	Is that true?
M	PAT SR.	I believe in you, Patty. I believe in you. I want you to know that. So I'm gonna bet heavy on this game.
M	PAT SR. (CONT'D)	You understand?
M	PAT	Yeah.
M	PAT SR.	Heavy. I want you to go to the game with your brother.
M	PAT	You want me to go to the game with Jake?
M	PAT SR.	Of course I do.
F	JAKE	Does he want me to go?
M	PAT SR.	Of course he wants you to go.
M	PAT	He told you that?
M	PAT SR.	He told me, yes.
M	PAT	Even with all his friends?
M	PAT SR.	With all his friends. He trusts you.
M	PAT	He's not embarrassed?
M	PAT SR.	No. I'd love to go to the game, too, but as you know, I'm banned from the stadium. `Cause I'd love to see us beat the Giants and take a lot of money from this asshole.
M	RANDY	Listen, personally, I think it's a stupid bet. As a matter of fact, I think it's ridiculous to bet all that dough for the restaurant on a game.
M	PAT SR.	Randy. (to Pat) I just hope you heard what I said. It's like a family business, it's our family endeavor. We all stick together on this. That's how it works. That's a positive, positive vibe.
M	PAT	I made a commitment to Tiffany about a project, and we have a very important part of it that we have to go over on Sunday, and it's good for me, Dad. It's making me disciplined and focused, and it's, it's--, I never would've thought this, but it's a good thing.
M	PAT SR.	What is this thing you're doing?
F	DOLORES	Yeah, what is it? What is this project, hon?
M	PAT	It's a dance thing, okay? There's nothing more to it, Dad. I swear.
M	PAT	Listen, I need to ask you something. Tomorrow can I spend half the day with you and half the day at the Eagles game?
F	TIFFANY	I'm gonna pretend that you didn't just ask me that.
M	PAT	Why?
F	TIFFANY	These are the two days that you have promised me and that we have prepared to nail the big move. It's not ready yet. And we don't have a move yet.
M	PAT	I know, but my dad opened up to me and it was really beautiful and I wanna be of service to him, okay? And he's worried that the juju from the Eagles is being fucked up and he's concerned that it's because I'm spending time with you.
F	TIFFANY	Oh, I messed up the Eagles' juju?
M	PAT	No, you're not messing up the juju, but the juju is messed up because I'm not with him during the games.
F	TIFFANY	Guess what?
M	PAT	What?
F	TIFFANY	Nikki replied to your letter. But you can't read it until after you nail the big move. Go.
M	PAT	Tiff, I'm sorry. I can't do anything else without reading Nikki's letter, okay? It's just--, it's in the back of my head. We don't almost have it, all right?
F	TIFFANY	I just hope you can handle it.
M	PAT	Thank you. What was her energy when she gave it to you?
F	TIFFANY	She was intrigued, excited, and a little scared.
M	PAT	She was scared? About what? Did she tell you?
F	TIFFANY	Try to stay positive.
M	PAT	I'm just gonna read it out loud, okay? Because if she says anything that's, you know, is that too much to ask?
F	TIFFANY	No.
M	TIFFANY (CONT'D)	I thought you were gonna read it out loud.
M	PAT	Okay. Sorry. "Dear Pat, It was very emotional for me to get your letter, as I'm sure you can imagine, but I'm glad you took the risk of discreetly getting it to me through Tiffany. This gives us a chance to communicate while I keep the restraining order until I feel safe. I must admit you sound terrific and I'm happy that you are feeling so positive and becoming a more loving and caring man, which I always knew you were. I was moved to read about `Excelsior' and your belief in happy endings. I am also moved by your act of love to read the books I have taught at the high school. I'm sorry you find them so negative, but I disagree. I think they are great works of art that reflect how hard life can be and they can also help kids prepare themselves for the hardness of life. In spite of all these positive developments, Pat, I have to say if it's me reading the signs, I need to see something to prove you are ready to resume our marriage. Otherwise I find myself thinking that we might both be better off moving on with our lives separately. Please don't react quickly to this, but take time to think about it. I'm glad you're doing so well. Love, Nikki." PAT FOLDS UP THE LETTER AGAIN. He is kind of crying.
M	PAT (CONT'D)	I think I'm done for today, okay?
F	TIFFANY	She said to show her something, Pat. This dance can be that something. You would have never done something like this in a million years. It shows all kinds of skills on so many different levels: focus, collaboration, discipline. It's romantic, like I said it would be. It's for her.
M	PAT	Thanks for the letter. I'll see you tomorrow, okay?
M	PAT	Can I use your phone?
M	PAT SR.	Is it an emergency?
M	PAT	Yeah, kind of.
M	PAT SR.	What kind of emergency?
M	PAT	Well, I'm just doing this project with Tiffany and I wanted to tell her I'm not gonna be on time.
M	PAT SR.	Just don't make her an emergency, that crazy girl, you know?
M	PAT	She's not crazy -- I'll just borrow Jake's phone. It's too bad you can't come in to the stadium, but I know you were kicked out, you know, for beating everybody up. Guess we're not that different, huh, Dad?
M	PAT SR.	That a bad thing?
M	PAT	No, I think, it's a good thing.
M	PAT SR.	Don't drink too much. Don't hit anybody. You'll be fine.
M	PAT	Yeah. I'm solid.
F	JAKE	This is my little brother Pat.
M	PAT	Hey, how you doing?
M	GUY #1	So, Pat, what's this I hear about you just gettin' out?
M	GUY #2	(laughs) Yeah, from the looney bin!
F	JAKE	What the fuck?! I talked to you about that already! I told you guys-- It's all right.
F	JAKE	Huh? No.
M	PAT	It's alright.
M	GUY #2	He's a good dude! He's a good dude.
F	JAKE	Oh, shit! The Asian invasion!
M	JAKE (CONT'D)	They're here every week!
M	PAT	No!
M	GUY #1	Uh, Jake you better get your brother. Cuckoo bird's takin' off.
M	PAT	Doctor Patel!
F	DR. PATEL	Pat!
M	PAT	Hey! What are you doing here?
