M	CHARACTER	DIALOGUE
M	WILL	For help, Chet. I need your help. Please. I can't do this alone.
F	CHET	Damn it! I'd like to tell you to get fucked, but you know what the problem is...I'm a better man than you. And someday, I might actually forgive you. So if I let you blow up, or whatever, that shit might come back and eat at my conscience, and totally affect my relationships with other people. Like my wife and kids and shit.
M	WILL	That's a...very rational way to look at the situation. And you're right, about being a better guy than me.
F	CHET	Are you sure that thing isn't gonna blow at any second?
F	CHET	Could you just walk a few feet in front of me for a while?
M	WILL	I can do that.
M	WILL	Thank you.
F	CHET	Yes, I'm still here. I really am this stupid. Just pay attention to where you're going.
M	WILL	I think I can handle it.
F	CHET	These floors get waxed once a week. On Tuesday, which today is. You hit a slick patch, trip and fall, and I got a classroom full of kids wearing their skin inside out.
M	WILL	Chet, I'm fucking nervous enough as it is. Please. I don't need you back seat driving me right now.
F	CHET	Obviously.
M	WILL	Just for the record, this isn't a nuclear weapon strapped to my chest. And there are metal lockers on either side of the hallway. If I fall, and if this thing goes off, I'm probably not taking out the whole school.
F	CHET	Do you really want to debate this?
F	CHET	You're an asshole.
M	WILL	Whatever. It's over.
M	WILL	Who was the chick in the white jeans?
F	CHET	Kristi Evans. Why?
M	WILL	You know why.
F	CHET	Oh, come on. Just keep walking.
M	WILL	Come on yourself. You knew exactly who I was talking about.
F	CHET	Fuck you. She's in the eighth grade.
M	WILL	I bet you love it when she calls you Mr. Chet.
F	CHET	She doesn't call me "Mr. Chet." She's not a foreigner.
F	CHET	...thanks so much, Mrs. Davis. I'll call you after I talk to the doctor.
F	CHET	So, this is it?
M	WILL	This is what?
F	CHET	Once I step inside this car, I'm basically in a steel coffin with you and...that thing. And if it goes off, all they're gonna find in there are two charred bodies and pieces of a bomb. They'll assume we were driving to a government building to blow it up. It'll be all over the news. Next thing you now, some militia or Islam group is claiming us as members. My family will be humiliated.
M	WILL	We'll also be dead, in that particular situation, so it won't really matter.
F	CHET	Exactly!
M	WILL	I get it. Take your time, man.
F	CHET	This is the world's biggest favor, you motherfucker. You didn't even help me move last winter.
F	CHET	Given the situation, I think you should obey all traffic safety laws.
M	WILL	Fine.
M	WILL	Okay, so where are we going?
F	CHET	I have no idea. I just got in your car. I thought you had a plan.
M	WILL	Well, I don't! I've been sorta preoccupied with this crushing fear of death!
F	CHET	No plan. I can't say I'm surprised.
M	WILL	Your plan is probably better. Just condescend me until I explode.
F	CHET	Maybe we should turn on the radio. See if the signal sets the bomb off. That would be an interesting experiment.
F	CHET	Listen, let's just go back to my place. Figure out our options. Maybe you can get the vest off or something. I just don't want to do anything stupid.
M	WILL	Unless we have to.
F	CHET	Holy fucking shit!
M	WILL	Stop it! You're scaring the fuck out of me!
F	CHET	Okay. Okay. Fuck!
F	CHET	I'm cool now.
M	WILL	Why did you do that?
F	CHET	Do what?
M	WILL	I saw you.
F	CHET	It's in case I have to jump out.
M	WILL	If I survive the day, and you don't because you jumped out of a moving car and broke your neck, I'm gonna laugh my ass off.
F	CHET	And if abandoning ship saves my life, then that laugh will be mine.
M	WILL	It's too tight!
F	CHET	What if we try to separate your shoulder? Fuck you!
F	CHET	Well, all these sites say different shit. There's not a lot of consensus in the bomb disarming community.
M	WILL	This is pointless.
F	CHET	I agree. We gotta call the cops, have them fly in the bomb squad or something.
M	WILL	We can't. These guys said they'd be following me. And I don't have a clue what they look like. For all I know, they're outside right now. They see the cops show up, they blow the vest and cut their losses.
M	WILL	What do I do, man? What do I do now?
F	CHET	I don't know, Will...I guess you gotta rob the bank.
M	WILL	I haven't been inside a bank in three years! How the fuck am I supposed to rob one!? They wouldn't even give me a savings account!
F	CHET	It's gonna be okay.
M	WILL	No, it's not! I'm gonna blow up! That's way worse than getting stabbed or shot. At least some people survive that. No one survives being blown up.
M	WILL (CONT'D)	No one is ever like, "Yeah, I heard Steve got blown up, tough break, but how's he doing now? Is he still in the Rec basketball league?" No of course he isn't, 'cause there's nothing left of Steve except a stain on the wall and a pair of fucking high tops!
F	CHET	Pull yourself together!
M	WILL	Ow! Fuck! I think you popped my eardrum.
F	CHET	Sorry. Shit. I didn't mean to do that. But just listen to me now. You're not gonna die. You wanna know why? Because you know exactly how to rob a bank.
M	WILL	What are you talking about?
F	CHET	Point Break.
M	WILL	The movie?
F	CHET	Yes. That movie is like a how-to guide for bank robberies. You just bust in. Masks. Guns. Move fast. Stick to the tellers and don't bother with the vault.
M	WILL	Yeah...I guess it's pretty simple, right? And it's just a local bank. The Donner-Wells on Charles Road.
F	CHET	Really? I applied for a job there like a year ago.
M	WILL	You wanted to be a teller?
F	CHET	Yeah, so what? It's a good job. You get benefits.
M	WILL	Like what, a name tag?
F	CHET	What kind of benefits do you get? Free toppings?
M	WILL	That's really clever. No one ever said that shit to me before. Anyway, this is perfect. You know the whole layout of the bank.
F	CHET	Not exactly. They didn't hand me the security schematics with the application. But I sat in the waiting area for like 20 minutes. I know what the place looks like.
M	WILL	How many guards?
F	CHET	One. I think.
M	WILL	That's a start.
F	CHET	It's a great start. You can do it.
M	WILL	You're gonna do it with me, right?
F	CHET	I was actually gonna stick to giving tips, ideas...motivational speeches. More of a consultant or advisory role.
M	WILL	Jesus Christ, Chet. Please. I'm begging you here. I need you on this. If I do it alone, I'm dead.
F	CHET	Are you gonna cry again?
M	WILL	That was a moment of weakness. Yes. I'll fucking cry again if that's what it takes.
F	CHET	I should make you blow me.
M	WILL	Sure. Whip that shit out. I'm actually kinda curious. I wanna see if Jenny Rifkin lied to you. She obviously lied to me.
M	WILL	All these guys want is 100 grand. We can do this.
F	CHET	We're gonna rob a bank for 100 grand? Just leave the rest of the money sitting there? Why?
M	WILL	I don't know. I guess they're very modest criminals. Who the fuck cares? Wait...you said "we" right?
F	CHET	I'm putting my life on the line for 100 grand...what does 100 grand even buy these days?
M	JUICY	I missed you so much, baby.
M	VAUGHN	You don't got enough dicks to keep you warm in that place?
M	JUICY	You know it's not like that. Those guys get Juicy, but you get Marisol.
M	VAUGHN	Well, Marisol...what I want is to get my money, kill that old ass man, then get the fuck out of here. Then that's how it's gonna go. We're just waiting on a call.
M	VAUGHN	This is my impatient face.
M	JUICY	Well, I think I can keep you entertained.
M	WILL	Should we go with the handguns...or the Uzis?
F	CHET	Handguns.
M	WILL	That's such a Murtaugh choice.
M	REGISTER WOMAN	You sure you don't want to grab some condoms?
M	WILL	Uh, no. Why?
M	REGISTER WOMAN	Because this is usually what men buy before they rape someone, and I want to make sure you all use protection.
M	WILL	Lady, we're just...buying some stuff.
M	REGISTER WOMAN	Is that cash or credit for your rape kit?
F	CHET	We'll pay cash.
M	DWAYNE	You really fucked up this mix tape.
M	DWAYNE	We're not speed freaks knocking off a 7-Eleven. We're masterminding a heist here.
M	JAY	Sorry, Dwayne. That song just means a lot to me.
M	DWAYNE	I wish he would hurry his shit up.
M	JAY	You worried about that other guy he's with?
M	DWAYNE	No, man. He picked him up at a school. So long as there ain't any cops, he can take the whole town with him. I just want my money.
M	JAY	What? You want me to run over to Subway, get us a couple sandwiches?
M	DWAYNE	If you had any vision, Jay, you'd know exactly what I'm thinking about right now. And it's not a sandwich. Look how well trafficked that shopping mall is. It's the perfect place for the tanning salon.
M	JAY	Oh, you're totally right.
M	DWAYNE	I've been thinking about it, and I want you to start off working the counter. Sounds like a demotion, I know, but it's an important position. Because we're gonna be using code words and shit. For example, if a customer walks in and says he wants a tan, that just means he wants a tan. But if he says he wants a "deluxe tan," that means a blow job and you gotta get one of the girls in there to suck him off. You with me?
M	JAY	So far. But what if he wants a fuck?
M	DWAYNE	There's gonna be codes for everything: missionary, anal, black chicks. I got it all written down back home in my files.
M	DWAYNE (CONT'D)	I'm not gonna bother getting into it with you right now, because you're supposed to be on lookout and you're no good at multitasking.
M	JAY	Okay. 'Cause they're about to get away.
M	DWAYNE	Fuck.
M	WILL	Be careful, you're getting paint everywhere.
F	CHET	Are you really worried about your upholstery right now?
M	WILL	Yes, because if I survive this shit I'm quitting my job. That means I'll probably have to give up my place and I'll be sleeping in the back of my car, which you're covering in toxic paint.
M	WILL	That side isn't dry yet. You're about to ruin it.
F	CHET	It says it's fast drying.
M	WILL	Fast isn't the same as instant. You gotta let it sit for like 20 minutes.
F	CHET	How would you know? You do a lot of graffiti?
M	WILL	No, but I spray painted my bike last year after I got my license suspended. I didn't let it dry properly and I fucked it up.
F	CHET	We don't have time to sit around and literally watch paint dry. Aren't we going straight to the bank?
M	WILL	I was actually thinking we need to stop and steal a car first.
F	CHET	What? No way! We've got a car.
M	WILL	Yeah, my car. I'm not gonna use it as a getaway vehicle. They can trace the plates. Even if we do get away, we'll be arrested.
F	CHET	Well, I can't hotwire a fucking automobile, and neither can you.
M	WILL	That's why I was thinking we'd steal one from your parents' friends. The Fishers. Remember how they used to pay us to clean their garage? They leave the keys in there. And they have a Datsun. That's a fast car.
F	CHET	I'm not stealing the Fishers' Datsun. Let's steal a car from your parents' friends.
M	WILL	What friends? My parents don't have any. My dad moved away after your big mouth ruined his marriage and humiliated him, and no one wanted to hang out with the mom who everyone knew fucked a lifeguard.
F	CHET	You never should have told me! I was 13 years old. I couldn't process that kind of information. I had to tell someone else. Fuck. I really am sorry about it. Okay? Despite what I said before. I was just a kid, but I messed up.
M	WILL	Okay.
F	CHET	That's it? You're not gonna apologize for selling my Cal Ripken ball?
M	WILL	Sure. I'm sorry...I'm sorry that my family was going through a rough patch and I was smoking a ton of weed and listening to the Wu Tang Clan all the time. And that I needed some extra dough to indulge my habit. Which, in hindsight, was probably just a cry for help. But you never even noticed.
F	CHET	Thanks. Now I feel even worse.
M	WILL	I shouldn't have stolen the ball. I knew it was wrong and I regretted it like the next day. I actually tried to buy it back but the guy wanted twice as much. I had to smoke even more weed just to get past the whole shitty incident. I guess that's why they call it a downward spiral.
F	CHET	I appreciate that you tried to buy it back. So, thanks.
F	CHET	We should probably get going.
F	CHET	Fuck! Fuck! I just want this goddamn day to be over!
M	WILL	The keys aren't here. They always used to leave the keys out.
F	CHET	Yeah. When we were teenagers. This is fucked.
M	WILL	Let's just find them.
F	CHET	Sorry.
F	CHET	You hear that?
M	WILL	What?
F	CHET	Mr. Fisher is coming!
F	CHET	Oh shit, oh shit. Are the keys in there?
M	WILL	No!
F	CHET	What are you doing?
M	WILL	I'm doing what I have to.
M	MR. FISHER	Oh, Jesus!
M	WILL	Where are the car keys?
M	MR. FISHER	They're in my pocket! I'm just reaching in my pocket for the keys!
M	WILL	Quiet down and do it already.
M	WILL	Now listen, I don't want you to report this car stolen or anything until later tonight. Let's say 5 o'clock. 6 to be safe.
M	MR. FISHER	Sure. Anything you say.
M	WILL	If you fuck with us, I swear, I will...I will shoot your son. Taylor. I know where he works. At the fucking travel agency. He's the douchebag with the bangs.
M	MR. FISHER	Please no. I won't do anything. I won't. Just leave Taylor alone.
M	WILL	I'm gonna trust you. But if you call the police, there's gonna be an undertaker styling his stupid fucking bangs! Now open the garage door.
M	WILL	The car's insured, right?
M	WILL	Okay. I feel better. Worse comes to worst, something happens to it, you can get a Honda. This thing doesn't even have airbags.
M	MR. FISHER	Please, just go.
F	CHET	That old man's got a heart condition! You could have killed him!
M	WILL	My hand was forced!
F	CHET	Awesome. I'm stuck inside an even smaller car with you and a bomb.
M	WILL	This thing's got some pickup.
F	CHET	Could you just take it easy, we're doing fine on time.
M	WILL	I know...but there's one last stop we have to make.
F	CHET	Do you have to take a piss first? Because I do. I need to see your sister.
F	CHET	Are you for real? Did you really just ask me that? You salt-in-an- open-wound motherfucker!
M	WILL	Chet, as if it isn't apparent, I may die today. I'll probably die today. And if there's one small thing that's clear to me now, it's that I've wasted two and a half decades as a pussy, watching everything I want pass me by. I don't wanna peace out of this world as a pussy. I need to tell her how I feel.
F	CHET	You're really gonna turn this into some sort of dying wish bullshit?
M	WILL	Yes, I really am. It means that much to me. I am not fucking around here.
F	CHET	I don't think you are. I mean, apparently, you love my sister so much that you're willing to put her life in danger by going to see her with a bomb strapped to your chest.
M	WILL	She won't be in danger. I promise. I got it all worked out. And you can even take a piss while I'm inside.
M	DWAYNE	Where the fuck is he going? What's in there? Some sort of FBI headquarters? I told that guy not to fuck around!
M	DWAYNE	Maybe I should give that bomb a call.
M	JAY	No! Let me just go see what he's up to.
M	DWAYNE	I was just fucking around. Are you gay for this guy or something?
M	JAY	I just wanna get the money, Dwayne. Same as you.
M	DWAYNE	All right. Then man up and go check it out.
M	DWAYNE	Don't even tell me you're about to do a reconnaissance without a cover. What's you cover?
M	JAY	I don't know...I'm from the telephone company?
M	DWAYNE	Yeah, nice fucking uniform.
M	DWAYNE	You're a personal shopper. You're delivering the latest fashions to Mr. Quilby in marketing. Got it?
M	DWAYNE	"He's got the whole world in his hands. He's got whole fucking world in his hands..."
M	WILL	...no, I'm here right now. Why are you acting so strange?
M	WILL	Because strange shit is going on. I'll explain everything. Just meet me where I texted you. WILL -
M	WILL	Please. Just do it.
F	KATE	Will?
M	WILL	Stop!
F	KATE	What are you doing?
M	WILL	Just don't come any closer.
F	KATE	Why not? What's going on?
M	WILL	I'm gonna give you the short version of an incredibly complicated and fucked up situation, so please be cool. Some very bad guys strapped a bomb to my chest and they are forcing me to commit a crime.
F	KATE	Will, I swear, if this is -
M	WILL	I wish I was joking, but I'm not. I know it's a lot to swallow, but you gotta take it on face value, because there's a timer attached to this thing and it's counting down.
F	KATE	Oh my god, Will...we'll get help. I'll get you help.
M	WILL	I didn't come here for help. I'm taking care of it. I came here because, should things not work out today as I would like them to, I want you to know why I was doing the things I did.
F	KATE	Please, just let me call someone. Let me do something. This is crazy!
M	WILL	I don't disagree with you. It's fucking nuts. But that's not even what this is about. Do you remember when you found that picture in my car of you, me and Chet, with Chet cut out of it?
F	KATE	Will, I can't remember about some stupid picture while you're - I need you to remember about the picture, and about how I stop by your office every Friday, and how I've always hated all your boyfriends, and how the two girls I've ever seriously dated have looked like less attractive versions of you. Do you see where I'm going with this? I love you Kate. I have for a very long time.
F	KATE	Will, this is a lot you're putting on me! You just told me people are trying to kill you or something, and now you say you love me. What the fuck is going on?
M	WILL	A whole lot of shit. I'm sorry to do this to you, but I was afraid I'd never get the chance to tell you. And I know you have feelings for me, too. Maybe you feel for me the way you feel for a good friend, or - if the world fucking hates me - a brother. But what I hope is that you don't really know how you feel for me, and that maybe when you figure it out you'll realize it's the same way I feel for you. Does that make any sense?
F	KATE	Yes. I mean, I've known you forever. It's not an easy thing to figure out.
M	WILL	I don't need an answer now. Just think about it. And no matter what you decide, you're too good for assholes like Mark and the rest of them.
F	KATE	Okay. I will process all of this. It's just, the bomb -
M	WILL	It's distracting. I know. Anyway, I'd love to stay and talk some more, but I can't. I gotta ask you to leave now, because I'm running out of time.
F	KATE	If I had time to think about it...I'd probably tell you that I've always felt very strongly for you. And I've never thought of you as a brother.
M	WILL	That's a huge relief. Don't say anything else. I just really don't want to die now.
F	KATE	Try not to. Please.
M	JAY	I'm, uh...I'm a personal shopper. I'm looking for Mr. Quilby.
F	KATE	I'm sorry, I don't know who that is.
M	DWAYNE	So?
M	JAY	It was just his girlfriend or something.
M	DWAYNE	Getting one last blow job in case he don't make it. I kinda like this guy.
F	CHET	Did you tell her how you saw her naked when she was 13? That always works.
M	WILL	I said my piece. She's gonna think about it.
F	CHET	Shut up. She was freaked out.
M	WILL	Yes. By the bomb.
F	CHET	By you.
M	WILL	Would it be so bad if we ended up together? You and I would be family.
F	CHET	I don't want you in the family. You bring very little to the table. I want her to be with someone awesome. A pro quarterback. A war hero. At the very least, someone I've never watched porn with.
M	WILL	Well, now it's up to her.
F	CHET	Not if I set that bomb off myself.
M	WILL	Then you'd probably never get to rob a bank.
M	WILL	You go for the money. I'll cover the crowd. In and out.
F	CHET	I'm not feeling so good. I drank like three of those 5-Hour Energy drinks.
M	WILL	It's just nerves. Let's pull our shit together and do this thing.
F	CHET	What should I call you in there, like if I need to ask you to do something?
M	WILL	Call me Tivon. You'll be Darius.
F	CHET	I can tell you're not a black guy through the ski mask.
M	WILL	Fine. Then you'll be Luis and I'm Cruz. We're two loco motherfuckers and that's the way we gotta roll when we get in there.
M	WILL	Everybody put your hands in the air!
F	CHET	No, get on the ground!
M	WILL	Actually, listen to him and get on the fucking ground!
M	WILL	Shut up! Please!
M	WILL	You, just stand right there and don't do shit! The rest of you get the fuck down! Spread your arms and legs! Why is no one listening to me!?
M	SECURITY GUARD	Just take it easy, man!
M	WILL	Don't be a hero, cowboy!
M	SECURITY GUARD	What the fuck does that mean? I'm not a hero! Or a cowboy!
F	CHET	All of you, back away from the counter and get out here! Anyone pushes a button and one of these people gets totally shot!
M	WILL	Very slowly, take out your gun and toss it away.
M	MOM	Oh, god! I don't want the gun!
M	WILL	What the fuck!? Did you do that on purpose!?
M	SECURITY GUARD	It was an accident!
F	CHET	Are you guys working together?
M	MOM	No! Please take this gun away!
M	WILL	Just toss it, lady!
M	MAN'S VOICE (O.S.)	Ah!
M	FAT MAN	I think she got the femoral artery!
M	MOM	I'm sorry! It was an accident!
M	FAT MAN	Fuck you! Who slides a gun like that!?
M	DAUGHTER	Mommy, what's happening!?
M	MOM	Christi, be quiet. These men are dangerous.
F	CHET	This is fucked. That dude is gonna bleed out and we're gonna go to prison.
M	WILL	Just calm down.
M	FAT MAN	Why is no one getting me help!?
M	WILL	Is anyone here a doctor?
M	WILL	Sir, let me see where you're hit.
M	FAT MAN	Just call me an ambulance!
M	WILL	Calm down, sir.
M	WILL	It's just a flesh wound. You're gonna be okay.
M	FAT MAN	But it hurts so bad.
M	WILL	You got shot, man. It's not supposed to feel good. But you're gonna be fine. And you'll have a great story to tell everyone.
M	FAT MAN	This is an awful story! This isn't a bank error in my favor! I got shot!
M	WILL	Point taken. Luis, how we doing on the money?
F	CHET	Oh, shit. Sorry, Cruz.
F	CHET	Hey, Sandra. I know you're probably scared right now, but if you go grab us 100 grand in a bag, we'll get out of here. This will all be over and you'll be fine. You trust me?
M	FAT MAN	My leg really hurts!
M	WILL	Can you please hurry up, Sandra!?
M	WILL	I'm really sorry, everyone. I know we probably fucked up your day. I'm thinking of you in particular, sir. Actually, you know what...
M	WILL	Quickly. Peel a few bills. On me. Anyone rats him to the cops and I'm coming for you. I remember faces.
F	CHET	What the fuck was that about, Sandra? I thought we had something going! What happened to trust?
F	SANDRA	I'm sorry! They make us do it!
M	WILL	Could you kindly fill another bag? Not a bank bag. A fucking garbage bag. And Luis, will you watch her this time?
F	CHET	Okay. That should be enough.
M	WILL	Fuck! Which one of you assholes tripped the alarm!? Was it you, Sandra!?
F	SANDRA	No! It was Mark! He pushed the button when you guys came in!
M	MARK	Sandra, you bitch! Now they're gonna kill us both!
F	SANDRA	Fuck you, Mark! You're the manager!
M	WILL	Fuck both of you! Fuck all of you! I'm a regular guy! Just like you! I'm a regular guy and you fucked me! Thank you for fucking a regular guy!
F	CHET	Let's just get the fuck out of here.
M	OFFICER ZURMAN	Drop your weapons!
F	CHET	Don't shoot us!
M	OFFICER ZURMAN	Drop the guns or I'll have to!
M	WILL	Fuck you! You just brought a gun to a bomb fight, officer! I pull these wires out and we all go! You got ten seconds to drop your gun and -
F	CHET	That was awesome. WILL He was tempting a desperate motherfucker. The guys jump in the Datsun and peel out as two more police Dwayne watches as the cars speed off into the distance.
M	DWAYNE	Holy shit! Our boy is causing some serious mayhem! JAY He's gonna get caught or killed. Dwayne whirls on Jay, punches him hard in the shoulder.
M	DWAYNE	Shut the fuck up! If you jinx this with your negativity, I'm gonna strap a bomb to your chest next. Jay massages his shoulder, pissed.
M	JAY	Oh, yeah, who's gonna build it?
M	DWAYNE	You are!
F	CHET	Shit! This is not cool!
F	CHET	Maybe we should pull over and surrender.
M	WILL	I can outrun these guys. They're not the FBI, they're local cops. Just shut up and let me concentrate. I do this for a living.
F	CHET	You don't do anything like this for a living! I am not a pizza, I am a man!
M	WILL	Holy fuck!
F	CHET	Go! Go! Go!
F	CHET	Stop! Stop! Stop!
M	WILL	That guy got fucked up.
M	WILL	Chet? Are you okay? Chet!?
F	CHET	Oh my god...
M	WILL	Talk to me.
F	CHET	I thought you were gonna blow up.
M	WILL	No. Luckily your side took most of the impact.
F	CHET	Awesome.
M	WILL	We gotta keep moving.
M	WILL	Oh, fuck, man. Come on.
M	WILL	Chet...I don't know how to tell you this...but you got a piece of the car in you.
F	CHET	
M	WILL	In your back.
F	CHET	Ah! Get it out!
M	WILL	I will.
F	CHET	Do it now!
M	WILL	All right.
F	CHET	Is it rusty? Am I gonna get tetanus?
F	CHET	Why are you moving so slowly?
M	WILL	It's a combination of cheap sneakers and this heavy fucking bomb on my chest!
M	WILL	Hey! Over here!
M	DWAYNE	You hear what happened to the guys they were after?
M	RANDOM LOCAL	Sounds like they got away.
M	WILL	I never thought I'd see you again.
F	CHET	I thought you hated this car.
M	WILL	It's actually not that bad. You know, as compared to that Datsun. The Mustang's got more comfortable seats. And it never would have flipped over.
M	WILL	There's a 100 grand in there. 100 fucking grand. Which we stole. From a bank.
F	CHET	I told a bunch of people I was gonna shoot someone. I was like "you fucking move, and I will kill you where you stand!"
M	WILL	I threatened to blow up a cop. And you never said "I will kill you where you stand."
F	CHET	I know. But shit did get pretty crazy.
M	WILL	Yeah, it did.
M	WILL	You know, there's no one I would have rather taken down a fucking bank with. I mean that.
F	CHET	Me, neither.
M	WILL	And as for all that shit I said...and all that shit I did...I hope you can forgive me. We've been friends for so long, and I guess you hurt the people you're closest to the most.
