M	CHARACTER	DIALOGUE
M	CPL. CORREGGIO	This was a dug-in marine Corps position that had armor, air and ground. Maybe we got nothing left to fight with... Michele MEETS EYES WITH NANTZ. His look tells us everything-- Nantz turns, spies an AIRPORT FIRE STATION by the runways.
M	SGT. NANTZ	Let's get under cover. Now.
M	SGT. NANTZ	Lock this place down. The marines fan out, securing doors, checking windows as...
M	SGT. NANTZ	You're a brave kid. When this is over, you're going to be a hero.
M	HECTOR	People always say that. "He's a hero." No one even knows what a hero is.
M	SGT. NANTZ	Your dad was a hero. Hector just stares back.
M	SGT. NANTZ	He saved Pvt. Adukwu up on that freeway. Hector exchanges a glance with Adukwu. Something passes
M	SGT. NANTZ	You save a marine under fire, you get a medal, y'know. Nantz pulls out a MEDALLION, the CREST of the 2/5 on it.
M	SGT. NANTZ	This is our medallion. It's yours. For your dad. You're 2/5 now, Hector. Hector takes the heavy medallion, looks it over, pointing to
M	HECTOR	What's that mean, "retreat hell?"
M	SGT. NANTZ	During World War I, an officer from our regiment was ordered to retreat. He said, "Retreat? Hell, we just got here!" Nantz is happy to see a slow smile from Hector now.
M	CPL. HARRIS	We're secure, sergeant. Nantz stands on this, addresses the marines:
M	SGT. NANTZ	Listen up. We need ammo. Kerns, Adukwu stay with the civilians. The rest of us, let's move. Nantz puts a hand on Hector's shoulder.
M	SGT. NANTZ	I'll be right back. As they go, the marines rifle the pockets and pouches of
M	PVT. IMLAY	Sorry, bro. He moves on to another fallen marine, searching.
M	PVT. IMLAY	Sorry, bro. Across the runway, Nantz pulls ammo from the pouch of a dead
M	CPL. STAVROU	Looks like it just rolled off the goddamn assembly line!
M	PVT. IMLAY	Good job, Sergeant! Can you drive this thing?
M	CPL. STAVROU	Hell, if it's got an engine, sergeant, I can drive it.
M	SGT. NANTZ	Good. Get it running.
M	CPL. CORREGGIO	Seems like vehicles are targets...
M	SGT. NANTZ	A minivan's a target, Correggio. A LAV with a Bushmaster chaingun... That's an asset. Imlay grins. Nantz motions to him, starting off.
M	SGT. NANTZ	Come on. Me? Where, sergeant? Nantz points to the CONTROL TOWER, its windows blown out.
M	SGT. NANTZ	High ground. We need to see the big picture.
M	PVT. KERNS	My dad's a fireman. They love their ice cream. Used to visit the firehouse with my little brother, they always had tons of it... My brother's not much older than these guys.
F	MICHELE	You don't look much older, either. She gazes at the kids, pain and anger washing over her.
F	MICHELE	Is this day ever going to end?
M	PVT. KERNS	Maybe the Sergeant'll find a way outta here. What's with you guys anyway? Doesn't anybody have a first name?
F	ADUKWU	Emmanuel. Manny.
M	PVT. KERNS	Pete. You married? Family?
F	MICHELE	I'm single. Lots of family back in Nebraska, though... Hopefully they're safe... She shakes the thought away.
F	MICHELE	What about you guys?
M	PVT. KERNS	Little Rock.
F	ADUKWU	Nigeria. I came here to be a doctor.
F	MICHELE	You should be a surgeon, the way you cut into that thing... Adukwu smiles. Then his smile fades as he looks around.
F	ADUKWU	Yeah. Maybe... On one desk, a COMPUTER is flashing a SLIDESHOW: Happy From this, high vantage point, they can see for miles... Then he turns, looks the other way, dead east...
M	SGT. NANTZ	Look how far east they've gotten. That's almost the whole city... Nantz looks out through BINOCULARS: Sees the HOLLYWOOD SIGN ablaze in the hills...
M	SGT. NANTZ	What the hell's that? Imlay peers out.
M	SGT. NANTZ	There's zero activity there. And the area does seem completely devoid of activity-- No
M	PVT. IMLAY	What are we gonna do, Sergeant? Nantz, panning with the binoculars, sees a CHOPPER TAKING OFF Nantz grabs a MAP on the desk, eyes roaming over it. Then
M	SGT. NANTZ	That must be the alternate extraction site. Maybe we can evacuate the civilians there... He turns to Imlay.
M	SGT. NANTZ	Get them in the LAV. I'll radio for an evac helicopter... When I do, they'll be coming, so we have to move fast.
M	PVT. IMLAY	Think we can make it, Sergeant?
M	SGT. NANTZ	We're gonna give it one helluva try, Imlay. He reassures the young marine with each-word:
M	SGT. NANTZ	We're not dying here. Any station, this is Foxtrot 2 November. I have four civilians and seven marines, we're heading to Alternate Extraction Point Charlie. Requesting evacuation. I say again, this is Foxtrot 2 November heading to Alternate Extraction Point Charlie. Out. Nantz turns immediately, hurrying out. He turns to Stavrou behind the wheel.
M	SGT. NANTZ	Use the thermal sight. No lights. Stavrou drives, spins away as Nantz climbs... He mans the M-240 MACHINE GUN. Imlay beside him on the 25MM
M	BUSHMASTER CHAIN GUN.	Headlights off, running dark, Stavrou drives, peering through
M	STAVROU'S POV THROUGH THERMAL	Washed green, the city a war zone, massive destruction..
M	IN THE TURRET	Nantz eyes a nervous Imlay.
M	SGT. NANTZ	Extract site's only a couple more miles, Imlay. Imlay nods back. Nantz peers down to...
M	THERMAL SIGHT POV	Green wash of the city passing by. Tall, empty buildings all Right in front of the LAV... A massive CRATER. The street's impassable.
M	SGT. NANTZ	We gotta go around. The LAV backs up, Nantz scanning the sky, gripping the M-240 FOUR ALIEN DRONE AIRCRAFT hovering... Then turning. Flying
M	SGT. NANTZ	Get ready, Imlay. Here they come. Stavrou looks out to see... A HELICOPTER in the distance.
M	CPL. STAVROU	Think I see our ride, sergeant!
M	SGT NANTZ	Get us there. Cause we're about to get lit up. The alien drone ships are winging at them. They are only 200
M	SGT. NANTZ	See what that Bushmaster can do, Imlay! Imlay OPENS UP on the 25MM BUSHMASTER CHAIN GUN.
M	PVT. IMLAY	Come on, you martian bastards! The Bushmaster is a rapid-firing CANNON spewing 200 rounds a One goes down IN FLAMES, the others PEEL OFF, flying behind
M	PVT. IMLAY	Where'd they go? Where'd they go? Nantz is scanning the sky, then...
M	SGT. NANTZ	Imlay, on your six! Imlay spins in the turret, picking up...
M	PVT. IMLAY	Son of a... Imlay targets, fires the Bushmaster...
M	SGT. NANTZ	Getting close, Imlay...
M	PVT. IMLAY	I got it. Imlay FIRES a burst. The last aircraft is hit... It PINWHEELS TO THE GROUND, exploding into FLAMING WRECKAGE
M	SGT. NANTZ	Stand on it, Stavrou! Stavrou pushes it, TRYING TO OUTRUN the burning wreckage...
M	PVT. IMLAY	The chopper! Nantz looks out, sees the CHOPPER LANDING in the street.
M	CPL. STAVROU	Last stop!
M	SGT. NANTZ	Everybody out! The marines rush the civilians OUT OF THE LAV... Nantz and
M	SGT. NANTZ	Pretty decent shooting, Imlay. Goddamn, you did it, sergeant! We're gonna get these people out! The marines begin loading the civilians in, the old-school
M	CREW CHIEF	You are in the middle of the shit, Sergeant! Everything's been pulled back.
M	SGT. NANTZ	What are you talking about?!
M	CREW CHIEF	We've lost most of our air assets. We're abandoning Los Angeles. This city's done...! Let's go! The chopper powers up, Nantz SCRAMBLES ON with the others. The HELICOPTER DIPS precipitously, suddenly losing altitude.
M	SGT. NANTZ	What the hell happened?!
M	CREW CHIEF	Something there was playing hell with our power! Nantz stares at this. Then notices Hector watching. him. Nantz looks back at the MYSTERIOUS BLACK PATCH of cityscape.
M	SGT. NANTZ	Set us back down!
M	CREW CHIEF	What?! The other marines in Nantz' unit look over, alarmed now. We need to recon that area!
M	CREW CHIEF	We can't land! May not have power to take off again... Nantz looks out. Spies a BUILDING with a FLAT OPEN ROOF. He
M	SGT. NANTZ	Then we'll rope down!
M	CPL. CORREGGIO	What the hell, sergeant? What's going on?
M	SGT. NANTZ	There's something over there... We could be the only ones left here to figure out what it is. Let's go, marines. The marines look frightened, confused. They start to pull
M	SGT. NANTZ	NOW! Go! Go! The marines start to RAPPEL DOWN, one after another as...
M	SGT. NANTZ	They'll get you safe. He smiles at the girls. Then turns, nods at Hector. Puts a
M	SGT. NANTZ	See you soon, buddy.
M	HECTOR	What are you gonna do?
M	SGT. NANTZ	We're gonna fight. Nantz turns, grabs a ROPE, drops out of the chopper. Then he turns to the marines, who stare back hopelessly,
M	PVT. KERNS	Why'd we get off the chopper, Sergeant?
M	SGT. NANTZ	'Cause we have a job to do.
M	PVT. IMLAY	But we were getting out...!
M	CPL. CORREGGIO	You have some hunch and now we're stuck out here in the shit?!
M	SGT. NANTZ	That's right. This fight's not over.
M	CPL. CORREGGIO	Sergeant's gonna get us killed! Just like my brother. A beat. Nantz eyes Correggio. It's laid open now.
M	SGT. NANTZ	Believe me, Correggio, I grieved for every marine I ever lost... Nantz looks around now, from marine to marine.
M	SGT. NANTZ	But we are in the fight of our lives right now. And our duty is to keep moving forward. Keep fighting. That's how we honor men like your brother, Correggio. And Lt. Martinez. And Hector's father, who saved Adukwu's life. He wasn't trained for that. He just picked up a rifle and did what needed to be done. If a civilian can do that... Well then I better square my shit away and do whatever I have to do to defeat this enemy. But I can't do it alone. Nantz stares. The tension is palpable.
M	SGT. NANTZ	I need you men. And maybe we'll die fighting today. Not because we're heroes. But because we're goddamn United States marines, and always will be. I'm willing to give my full measure for you. I'm hoping you'll do the same for me. A BEAT, glances exchanged. THEN ALL THE MARINES RISE AS ONE.
M	CPL. STAVROU	Sergeant. We'll follow you to hell and back. Nantz smiles, nods.
M	SGT. NANTZ	Good. 'Cause that's where we're going. Then an olive case marked: GLTD. He stuffs it in his pack.
M	PVT. IMLAY	Laser target, sir?
M	SGT. NANTZ	Might have to get some cruise missiles in here.
M	PVT. IMLAY	Shit, yes, Sergeant. Hostiles. Twelve o'clock. Nantz looks up to see... ALIEN SOLDIERS appearing on the street now.
M	SGT. NANTZ	Just hit the gas, Corporal. We got plenty of armor. Everyone looks up at this. Then looks out to see...
M	SGT. NANTZ	Reverse, Corporal.
M	CPL. STAVROU	Aye, aye, Sergeant. As he BACKS UP, mowing back over the remaining aliens... The
M	SGT. NANTZ	What's going on?
M	CPL. STAVROU	Losing power, Sergeant. Gauges are dropping... losing voltage... The LAV slows. The engine skips. Then the LAV DIES.
M	SGT. NANTZ	Stavrou?
M	CPL. STAVROU	She's dead, Sergeant. Nantz looks around, warily. The streets are quiet, deserted.
M	SGT. NANTZ	All right, dismount. Grab anything you think we can use. The men nod, and move OUT OF THE LAV to...
M	PVT. IMLAY	Hot as hell here.
M	CPL. CORREGGIO	No lights.
M	PVT. ADUKWU	My watch stopped.
M	SGT. NANTZ	Something's generating heat. Messing with our electronics. Sucking up all the power... Nantz scans the street. The sweat dripping into his eyes.
M	SGT. NANTZ	Where would you put a critical asset if you wanted to protect it? Or hide it?
M	CPL. HARRIS	Underground. Nantz points to A SUBWAY ENTRANCE AHEAD.
M	SGT. NANTZ	Harris, Adukwu, stay here, watch the street. Harris and Adukwu nod. Taking position at the entrance.
M	SGT. NANTZ	Let's go. Nantz leads Stavrou, Correggio, Kerns and Imlay down the You two stay here, watch our backs. Imlay, come with me. Nantz and Imlay slip through the doorway. They turn a corner and stop. It is PITCH BLACK here. No. Save it. Something is killing anything electronic we use. Imlay clicks his flashlight OFF. But now we see... A STRANGE LIGHT at the end of the hallway. THE LIGHT GLOWS Nantz moves to the grate, kneels, PEERING DOWN INTO...
M	A MASSIVE SUBWAY TUNNEL	Fifty feet wide, the dim tunnel has been further EXCAVATED. The huge space is illuminated by MASSES OF ALIEN MACHINERY. Tending the machinery: DOZENS OF ALIENS, bigger than the One of the ALIENS TURNS, focusing up, right at Nantz.
M	SGT. NANTZ	Run, Imlay! Run! BANG. The iron GRATE FLIES into the air. Nantz follows Imlay UP THE STAIRS as... Nantz backs up the stairs, pumping the shotgun, firing... Nantz nods. Signals for all the marines to head down the
M	SGT. NANTZ	How many?
M	CPL. HARRIS	Hard to tell. A lot.
M	SGT. NANTZ	I think I got their attention. Nantz kneels. He opens his pack, pulls out the radio and the
M	SGT. NANTZ	Look. There's something big down in the tunnels. It's sucking up a lot of power, could be a major Command &.Control asset. Nantz stares at his men. We need to destroy it.
M	PVT. KERNS	But we got no jets left, right, Sergeant?
M	SGT. NANTZ	Hopefully, they can still fire cruise missiles from Pendleton or Vandenburg... I'll radio in a strike, paint the target from the street. You know what that means. The man nod solemnly.
M	PVT. IMLAY	We gotta hold 'em off long enough to paint the target.
M	CPL. STAVROU	If we can get a transmission out before the radio dies...
M	CPL. HARRIS	And the targeting laser lasts long enough for command to get a lock on the target.
M	CPL. CORREGGIO	Hell, dying's easy, ladies. Everything else takes balls, right? They all laugh softly.
M	SGT. NANTZ	Let's do it. He takes a deep breath, raises the radio, and TRANSMITS: Any station, this is Foxtrot 2 November. Priority Fire Mission. I have identified a major enemy command and control asset-- located grid 459083. 1 WILL BE LASING.
M	COMMAND (V.0.)	Foxtrot 2. You have visual confirmation of this C&C; asset? We can't waste resources.
M	SGT. NANTZ	Affirmative. They're building a huge complex underground... I think it's the head of the snake. Repeat. I will be... Alien fire EXPLODES now, rocking the station. Nantz looks up. Rubble nearly fills the stairway. There is He sets the GLTD (LASER DESIGNATOR) up on top of the pile. Here we go... Nantz switches on the TARGETING LASER. A RED BEAM OF LIGHT shoots from the designator to a fixed Nantz looks up to see... The street fill with ALIEN SOLDIERS rushing out now.
M	PVT. IMLAY	Here they come! The marines FORM A PERIMETER AROUND THE LASER, OPENING UP on The mass of aliens surges forward like a wave.
M	SGT. NANTZ	Hold them back! We have to keep the laser on target! Nantz FIRES. An alien goes down. He picks another target But the rest KEEP COMING... closing in... NANTZ pulls his sidearm. He aim, FIRES, shooting a closing Rounds impact around Nantz as he shoots another alien... Knocking the laser away. Nantz struggles...TO THE LASER. RE-AIMING it as... Kerns is HIT. He is thrown to the ground, but is back up, An alien RUSHES AT CORREGGIO who spins just in time, FIRING Harris runs the alien through with his bayonet, twisting and All focused on SURROUNDING NANTZ. THEN THE LASER DIES.
M	PVT. IMLAY	Did we get a lock!?
M	SGT. NANTZ	I don't know! Then... An ear-splitting NOISE. The marines look up, see...
M	SGT. NANTZ	INCOMING! Fall back! This way! Nantz and his men begin BACKING AWAY. Firing as they do, Nantz, limping on his injured ankle, GOES DOWN. Correggio is
M	CPL. CORREGGIO	Think you just twisted your ankle,. sir. And through it all, Nantz still smiles at this.
M	SGT. NANTZ	Don't stop!! We're too close to the impact point!! The marines start running as... THE GROUND HEAVES UP. A MASSIVE EXPLOSION of fire and smoke AS ONE, the men rise out of the ash, standing tall. The marines fall in. A PHALANX with Nantz at its center. They move forward. Precise. Deadly. FIGHTING AS ONE. HIS MEN. His warriors. Standing with smoking weapons, ready
M	CPL. CORREGGIO	You know what, Sergeant? My brother said you were a bad ass. I had no idea...
M	SGT. NANTZ	Your brother was one helluva marine, Correggio. So are you.
M	PVT. IMLAY	Man, it's quiet.
M	CHOPPER PILOT (V.0.)	They're in full retreat throughout Los Angeles, heading back into the ocean. Units are mopping up. On this, Nantz turns to his SQUAD. Beat.
M	SGT. NANTZ	This has been a hell of a battle. Plenty of other battles to go. Everybody good with that? The marines don't hesitate.
M	MARINES	Yes, Sergeant!
M	CPL. CORREGGIO	Well, uh, actually, Sergeant... there's this girl I was supposed to meet up with tonight... I'm sure she'll understand. Nantz looks at his marines.
M	NANTZ	I think you men earned the right to call yourselves marines today. I'm damn proud of every one of you. Retreat!?
