M	CHARACTER	DIALOGUE
M	JENSEN (CONT'D)	I think I just found our way out of here...
M	ROQUE	Gotta admit, I always wondered how this would play out.
M	CLAY	Aisha thinks you kill me.
M	ROQUE	It's a distinct possibility...
M	ROQUE (CONT'D)	You don't have a knife?
M	CLAY	Don't need one.
M	ROQUE	Bit of as longshot for you...
M	CLAY	No. It's not.
M	ROQUE	Now I really am gonna cut your head off...
M	CLAY	SHIT-
M	CLAY (CONT'D)	Rifle...
M	CLAY (CONT'D)	Outstanding.
M	JENSEN	Not to rain on everyone's we killed all the bad guys parade, but we should probably get gone - legless Pooch has a Learjet all gassed up for us in the Hangar. It's a cool name-
M	CLAY	Hello?
M	MAX	We good?
M	CLAY	Not by a longshot. You're not having a real great day, Max.
M	MAX	Who is this?
M	CLAY	Just a voice on the phone.
M	MAX	Where's Wade?
M	CLAY	Working on the engines.
M	MAX	Clay.
M	CLAY	It's Colonel.
M	MAX	Colonel, yes. Well done.
M	CLAY	Thank you.
M	MAX	I understand you've always wanted to meet face to face. I'm sure that could be arranged...
M	CLAY	I don't think the guys you're about to stiff for a billion dollars are going to allow that to happen. We win. You lose. Goodbye.
M	CLAY (CONT'D)	Lear jet? POOCH Ready when you are.
F	AISHA	I wanted to find and punish those responsible for my father's death. Max, his men, everyone.
M	CLAY	That why you slept with me?
F	AISHA	That and the cardio.
M	CLAY	You coming?
F	AISHA	I'm coming.
M	CLAY	Good cause there's no way I could walk it... She helps him up and we begin to PULL UP AND BACK as they
M	SHORT SCIENTEST	Time is up, Stretch.
M	MAX	Stretch. That's a good one.
M	SHORT SCIENTEST	Because you are so much taller than I.
M	MAX	Yeah, no, I get it...
M	MAX (CONT'D)	You gentlemen consider yourselves to be soldiers or businessmen? FADE OUT
