M	CHARACTER	DIALOGUE
M	DOUGLAS (CONT'D)	One wants to trust, in general, don't you think? But you never really know, do you? Jamshed stops fiddling with the tap. And takes a hammer to
F	EVELYN	The day I met my husband was the day the fair came to town. My girlfriend and I went on the carousel. Her horse was fine. But when the ride began I felt mine give a little, like it might collapse. Then these strong arms were around me, holding the horse together. And a voice in my ear said "Just trust me". And I did. Without question. Until the day he died.
M	DOUGLAS	How wonderful.
F	EVELYN	The sale of our flat went through last week. I had to sell it to pay off Hugh's debts. I've been forced to get a job out here. Which, in fact, I love. But even at Sonny's rates, I still couldn't make ends meet. After what my own husband did to our life savings. So no. You're right. You never know. Jamshed holds up the tap. Which is now in several parts.
M	JAMSHED	No good. You must be buying another. Finally, she steps out. And is of course immediately As anxiety begins to engulf her, she quickens her pace, Anokhi speaks. Ajit translates.
M	AJIT	She wants to thank you for your kindness.
F	MURIEL	I haven't been kind.
M	AJIT	You're the only one that acknowledges her. Anokhi brings out a plate of food.
F	ANOKHI	Tarkha dhal. Chapati.
F	MURIEL	I'm not eating that.
M	AJIT	You will insult her very deeply if you do not. Muriel looks up. They're all still watching, waiting She looks at Anokhi's grandmother, as dignified as she is Muriel reaches out, takes something off the tray. And has
F	MURIEL	I'd still rather a Scotch Egg. Then she sees something through the open doorway: the She's on her feet in a flash.
M	MURIEL (CONT'D)	Get off! Get off it, you dirty thieving bastards! Several terrified faces turn. One little girl starts to cry. Everyone is staring at Muriel.
M	MURIEL (CONT'D)	I didn't see. They were playing. I'm sorry. I'm sorry The corridors are full of people patiently waiting their Reaching the top of the staircase, Jean takes it all in. In the office.
F	GRAHAM	But I've filled out that form. I've given it to you. Many times.
M	MR CHIDAMBRAM	There is a process. You are making an enquiry. For each enquiry a form must be filled in.
F	GRAHAM	But it's the same enquiry I make every day.
M	MR CHIDAMBRAM	And therefore the same form you must fill in. Graham glances towards the doorway, catches sight of Jean.
F	GRAHAM	Mrs Ainslie... .?
F	JEAN	I don't know how you can bear this country. What do you see that I don't?
F	GRAHAM	Unutterable beauty. Everywhere. In the light, the colours, the smiles, the people who see life as a privilege not a right, and so teach me something every day. The waiter brings their tea.
F	JEAN	Is this milk pasteurized?
M	WAITER	Yes madam.
F	JEAN	But that's not true, is it? You're just lying to me right now
F	GRAHAM	It'll be fine. The waiter goes.
M	GRAHAM (CONT'D)	It's a pleasant surprise to see you out and about.
F	JEAN	Is it? She looks at him.
F	GRAHAM	Yes. That's progress. Where were you going?
F	JEAN	To the bank. I . was going to the bank. Not that there's any reason to think something has changed. But our daughter, you see, she did promise, and one does try to remain optimistic. One has to. Otherwise
M	OTHERWISE	Graham worries she might be about to break down. He Graham is startled. He tries gently to pull back, but she
F	JEAN	Oh god. Is it possible you feel the same? She brings his hand to her mouth, kisses it.
M	JEAN (CONT'D)	The way you talk to me. Your compassion, your understanding .. the wonderful, tender consideration, it had to be more than just -
F	GRAHAM	I'm gay. She stares at him. Beat.
F	JEAN	As in ... happy? Graham says nothing. Jean lets go of his hand.
M	JEAN (CONT'D)	Yes. I see. Of course I see. The ghastly inappropriateness of it all settles on them
M	JEAN (CONT'D)	I appear to have humiliated myself. And embarrassed you.
F	GRAHAM	I'm not embarrassed. Jean smiles wanly, grateful for his lie.
F	JEAN	Like I said. This country is driving me mad. Shall we go?
F	EVELYN	Anything?
M	DOUGLAS (O.S.)	Not yet. Evelyn waits a moment.
F	EVELYN	How about now?
M	DOUGLAS (O.S.)	One second. Another pause. Oh good lord.
F	EVELYN	What?
M	DOUGLAS (O.S.)	Listen. The sound of a flowing tap. And now ... The tap stops. No drip. He appears in the doorway, triumphant.
M	DOUGLAS (CONT'D)	No drip! He walks towards her, hand in the air.
M	DOUGLAS (CONT'D)	Hi-five ! Evelyn just looks at him. She's never hi-fived anyone in After a moment Douglas puts his hand down.
M	DOUGLAS (CONT'D)	I've never done that before. It just seemed appropriate. Jean has appeared at the other side of the courtyard.
M	DOUGLAS (CONT'D)	Darling!
F	EVELYN	Mrs Ainslie, how are you? Did you have a good day? Jean doesn't answer. She's staring at Douglas. Who looks
M	DOUGLAS	Let me tell you about ours. Your husband of many a year, who has never even known which end of a hammer to use, has actually managed to - We have to get out of here. What did you say?
F	JEAN	I can't stay in this country a moment longer.
M	DOUGLAS	Why ...?
F	EVELYN	Do excuse me. She makes a tactful exit. Jean is going past Douglas into
M	DOUGLAS	I don't understand Pick a reason. Pick ten. The climate, the squalor, the poverty She goes past him into their room.
F	JEAN	. we should never have come. This whole trip is a grotesque fantasy. It's time to go home. Jean starts to pack. Irrationally, compulsively.
M	DOUGLAS	Who's paying for the tickets?
F	JEAN	Look at us. A group of self- deluding old fossils traipsing around as if it's our bloody gap year. Humiliating ourselves
M	DOUGLAS	Not us, we can't pay. And I don't see you asking our friends .. We should just face up to the truth. That we're all old, we're all past it. That's the real truth, the raw, unvarnished fact of the matter. All we're good for now is the beige bloody bungalow with the sodding panic button in the sodding corner ... She stops packing, and subsides onto the bed, crying Nobody speaks for a while. We just have to make the best of it, darling. I really think that's the best thing to do.
F	JEAN	Yes, well. When I want your opinion, I'll give it to you. Norman is sitting there, the only man in three rows of DR RAMA comes out of the consulting area.
M	DR RAMA	Mr John Smith. No response. The doctor looks at Norman, who has forgotten Mr John Smith? Norman jumps up.
M	NORMAN	That's right! Me!
M	SONNY	Come on. Pick up pick up pick up. The phone is answered at the other end. Sunaina, I must see you. I must. If I cannot hold your body against mine, I swear I will go mad. We cut to the call centre. It's not Sunaina on the phone, I yearn for you, I burn for you,
M	JAY	I think it's my sister you're burning for there, Sonny boy.
M	SONNY	Thank you, Jay. Thank you. Jay hands the phone to Sunaina.
F	SUNAINA	Hey.
M	SONNY	Private line, Sunaina. Do those words mean nothing to you?
F	SUNAINA	He took the phone. What could I do?
M	SONNY	I miss you. I miss you every moment. Come and see me. Tonight.
F	SUNAINA	I cannot tonight. It is my parents 25th wedding anniversary. Tell your mother that.
M	SONNY	Come after. Come late
M	SUNANINA	You'll be asleep.
M	SONNY	I'll be waiting.
M	SUNANINA	You'll be asleep. But i can wake you in that special way...
M	SONNY	You will sneak in?
F	SUNAINA	I'm not ashamed.
M	SONNY	Neither am I. Absolutely not. There is no shame. You do not have to sneak. All the same, if you did want to be very quiet, and not let anyone see you, it couldn't hurt.
M	NORMAN	I'm worried there's no lead in my pencil.
M	DR RAMA	OK. I don't know what that means.
M	NORMAN	No snap in my celery.
M	DR RAMA	I'm still not quite with you.
M	NORMAN	I plan to party hearty tonight, but I can't guarantee that my love gun will fire.
M	DR RAMA	Mr Smith -
M	NORMAN	Will the lance dance, and the trouser lion roar?
M	DR RAMA	What is your problem?
M	NORMAN	I don't know if I can still have sex.
M	DR RAMA	Ah.
M	NORMAN	I'm not a young man anymore, doctor. And I'm a little bit scared. Truth be told, I'm a lot scared.
M	DR RAMA	How long since you've been with a woman?
M	NORMAN	What's today?
M	DR RAMA	Monday.
M	NORMAN	Six years.
M	DR RAMA	I've got some pills that'll help. Anokhi is cleaning pots. Young Wasim sits in the corner. I wanted to tell you something... Anokhi looks up. Tell her. Tell her I was glad to come, glad she invited me. Ajit translates.
M	MURIEL (CONT'D)	Glad to meet her family. Her grandmother. Her kids. Ajit translates. Anokhi speaks.
M	AJIT	She asks if you have children?
F	MURIEL	I looked after somebody else's. Ajit translates. This one family, years I was with them. I ran the house, looked after the money, did it all, cared for them like they were my own. Ajit starts to translate. But Muriel doesn't wait.
M	MURIEL (CONT'D)	That's the mistake, see. You don't want to get like that, to start feeling part of something. One day they decided I needed some help. I was grateful, I tried to teach her. Not just the books, but how to crisp up the bacon like the gentleman preferred it, the way the little one liked to have her hair brushed. The things you only know if you care. But then they said I was no longer useful to them. Thanked me for my service. As if that's all it was. I got a flat in the end. I'm the only one in the building not a foreigner. More Indians there than here! But before I came to this place, my biggest problem was what to do with all the time I had. Because that flat's so small, I can have the whole place spotless in half an hour. And then what am I supposed to do for the rest of the day? There's silence for a bit. Then Ajit speaks.
M	AJIT	Did you want me translate that as well? Muriel smiles. It's the first time we've seen this.
F	MURIEL	Give her these. Ajit hands Anokhi what Muriel gave him: a packet of This time it's Muriel who cannot meet Anokhi's eye. Tries Over this, the sound of singing Norman is naked, and singing along lustily.
M	NORMAN	Aaaaaah, freak out! Le freak, c'est chic .. Aaaah, freak out! Feet slapping in the soapy water, he performs a nifty disco He sweeps the pile of papers off the desk, starts
F	EVELYN	I've been getting out and about as much as I can, but I feel I've hardly scratched the surface. And of course I'd love to see Udaipur. The lake you talked about.
F	GRAHAM	I'd love to take you. Perhaps - He breaks off. Douglas and Jean have come in. Jean looks Good evening.
M	81A.	An awkward moment. Graham stands.
F	GRAHAM	Good evening, Mrs Ainslie. Please allow me. He pulls a chair out for her. She shoots him a look of
F	JEAN	You're very kind. But I rather think I'll turn in early. Goodnight everyone. She goes into her room.
F	MADGE	Is this it?
M	NORMAN	This is it.
F	MADGE	You're not worried about the danger of having sex at your age? Norman shrugs.
M	NORMAN	If she dies, she dies. He leaves. Sonny sprints into the courtyard.
M	SONNY	Progress, Mrs Donnelly, Mrs Hardcastle! The wheel is turning most assuredly in our favour! He shoots up the stairs.
M	SONNY	Mr Dashwood! Everybody! Great news!
F	GRAHAM	What is it, Sonny?
M	SONNY	They are working, they are working!
F	GRAHAM	That is great news. What are working?
M	SONNY	The telephones of the Marigold Hotel.
F	GRAHAM	Well, congratulations.
M	SONNY	Thank you. I must tell everybody. I must tell my mother! He runs off. Comes back.
M	SONNY (CONT'D)	Oh wait. You have a phone call.
F	GRAHAM	It's a false alarm. There's no way they could find anything in that office. They probably just picked an address at random, just to keep me off their backs. I'm sure that's what happened. It's going to be nothing. Don't you think it's going to be nothing?
F	EVELYN	I think you should knock on the door and see.
F	GRAHAM	Yes. Yes I should. Yes. Across the street, Graham approaches a house. At a polite A woman, GAURIKA, appears. She stares at Graham.
F	GRAHAM	I'm sorry to disturb you so late. My name is Graham Dashwood. A long time ago I -
F	GAURIKA	I know who you are. Beat.
F	GRAHAM	I am afraid I don't know you.
F	GAURIKA	I am Gaurika. The wife of Manoj.
F	GRAHAM	I'm very pleased to meet you. And if you could, if you would tell him that I called around, I'd appreciate that very much, He breaks off. She's walked past him, looking to the other He turns to look at the men playing cards. Gaurika calls in A beautiful-looking man looks up. MANOJ. Graham reaches him. The two men just stand there for a From the steps of the house, Gaurika watches. Across the street, Manoj and Graham are still holding each
M	DOUGLAS	
M	DOUGLAS (CONT'D)	First time going in to London with my dad, on his commute... He'd always been so extraordinary to me, so unique. But there he was standing on the station platform, utterly indistinguishable from all the other men in suits. And then of course a few years later I was one of them... Hated my job. Hated it. Sorry, talking too much. Blame a good dinner out.
F	EVELYN	What was she thinking?
M	DOUGLAS	I beg your pardon?
F	EVELYN	His wife. Manoj's wife. She knew who Graham was. Had he told her? D'you think we'll find out tomorrow?
M	DOUGLAS	Not me, I'm heading up to the Badi Mahal Palace. Very excited, been reading all about it.
F	EVELYN	Tell me.
M	DOUGLAS	I would, if I could remember a word. Evelyn laughs. Then Douglas suddenly grabs her. And pulls Douglas and Evelyn stand for a moment, startled, holding
M	WAITER	Come, please. Nice meal, please... We've eaten, thank you... They continue on their way. Slightly further apart than Sunaina parks her bike outside the hotel, goes on in. She takes off her clothes. And climbs, naked, into bed In a different bed, in a different room, Sonny wakes up. Who couldn't be happier.
F	MADGE	A midnight booty call. How utterly marvellous.
F	SUNAINA	I'm so sorry, I'm so sorry . I don't know what your name is, but I'm incredibly sorry.
F	MADGE	Don't be. Most action I've had in weeks.
F	SUNAINA	If you could just please not Sonny bursts in.
M	SONNY	Do not worry, Mrs Hardcastle! I can explain each and every thing! Hesees Sunaina.
M	SONNY (CONT'D)	Oh my god you are naked. He turns to Madge.
M	SONNY (CONT'D)	Mrs Hardcastle, I must apologise with deep and profound sincerity -
F	SUNAINA	How could you not tell me you weren't in your room!
M	SONNY	Yes, Sunaina, to you too I must apologise with equally deep and profound sincerity. Now go. Get out. Quickly.
F	SUNAINA	I'm going. Just let me get dressed, and -
M	SONNY	No no, quicker than that. You must leave, before - MrsKapoor flings open the door.
M	MRS KAPOOR	What is going on here? Who screamed? She sees the nearly-naked Sunaina. No no no no no. No! This is a respectable hotel, not a brothel. You, get out. And Mrs Hardcastle, I expected better of you. Actually, this is exactly what I expected of you, but nevertheless -
F	SUNAINA	Mrs Kapoor, I'm Sunaina.
M	MRS KAPOOR	Since I will not be paying for your services, your name is of no interest to me. How do you know mine? Sunaina is shocked to realise that Mrs Kapoor doesn't know
M	SONNY	Because this . is my Sunaina.
M	MRS KAPOOR	The girl who my son described as not too modern.
F	MADGE	This is getting interesting. Tell me, please. Is there anyone in this building you haven't slept with?
M	SONNY	Mummyji, do not get the wrong idea. Sunaina was not here to be with Mrs Hardcastle. She was here to have sex with me! Mrs Kapoor turns to Sunaina. Who is speechless.
M	MRS KAPOOR	This is the sort of woman you are. OK. Each to her own. But do not ever try and tell me that you are suitable wife for my son. Find your clothes and go. I don't expect to see you again.
F	EVELYN	Sunaina? And now Sunaina is even more humiliated. One trader is unloading some fruit. A few guava roll off Someone picks them up for him. It's Graham, who smiles as How did it go? Norman turns, to see Graham standing above him.
M	NORMAN	I have seen the top of the mountain. And it is good. Graham nods, sits down next to him. They gaze out at the
F	GRAHAM	I saw someone yesterday, a man I hadn't seen for many years. A man I've loved all my life. Norman is a bit startled by this.
M	NORMAN	A man... .?
F	GRAHAM	Yes.
M	NORMAN	Carry on.
F	GRAHAM	I didn't know how he'd been in the meantime, didn't want to guess. I brought disgrace upon him and his family, and imagined he might hate me for it. But we talked all night. He's been happy. He's led a peaceful life, married to a woman who understood him and loved him nonetheless. But he's never forgotten me. That's what he said. I asked his forgiveness anyway. He said he had nothing to forgive me for. That instead I should forgive myself. All that time. All that time I believed I'd sentenced him to a life of shame. When I was the one in prison. But not any more. Silence for a while.
M	NORMAN	Top of the mountain.
F	GRAHAM	Yes. Norman smiles, then stands and goes on inside.
M	GRAHAM (CONT'D)	Not any more.
F	MADGE	How was the night?
M	NORMAN	Rather special. He leaves. Madge just stares after him. Then it opens its huge wings, takes off. And flies up into You're back. He doesn't turn round. Evelyn has come out to the garden.
M	EVELYN (CONT'D)	It's been rather an extraordinary night all round. First tell me your news, and then - She breaks off. Graham is dead.
M	EVELYN (V.0.)	Day 45. Of course it was inevitable. Put enough old people in the same place, it won't be too long before one of them goes... Jean, Douglas, Madge, Norman and Muriel shocked and sobered
M	EVELYN (V.0.)	We all know it'll happen, but few of us know when. Graham died of a heart attack, evidently not his first. So he had a better idea than most what was coming, he just neglected to tell us. His prerogative.
M	EVELYN (V.0.)	There was talk of sending the body home, but Manoj felt he should have a Hindu burial. At the place they had visited together. Not a holy place. Although for them perhaps it was. Graham's friends stand watching the pyre, transfixed by the
M	EVELYN (V.0.)	A body takes a long time to be consumed. Many hours for the mourners to remember their dead. The fire must be lit at dawn, and by sunset, there must be nothing left but ash.
M	EVELYN (V.0.)	Where do our souls go? is that all of us that is left behind? Perhaps the most we can ask is that when we do shuffle off, we do so knowing that we were loved Manoj pours Graham onto the water. The ashes shim r and
F	MURIEL	So there's a process, they call it pickling. I have no idea what it is, or how they do it, but whoever invented it was a smart man. But the real genius was the one who introduced an onion into the system. That I could never have thought of. Ajit looks at her, ready to translate.
M	MURIEL (CONT'D)	No, forget it. Muriel is looking out at the yard. She sees Mrs Kapoor, Mrs Kapoor sees Muriel watching her, comes over to them.
M	MRS KAPOOR	Mrs Donnelly, what are you doing here? You should not be here, talking with this one.
F	MURIEL	I'm helping her clean. If these pots get any dirtier, you'll have to serve the food with penicillin.
M	MRS KAPOOR	We have other rooms. Go to one of them instead. While this is still a hotel. She turns back to the surveyors. What's her problem? What's happening here? Ajit can't answer. But he knows a man who can. He points to Young Wasim.
M	AJIT	He can tell you.
M	EVENING	A stunning view over the city. Madge is having a drink
F	MADGE	When someone dies, you think about your own life. And in my case, there is less of it in front of me than behind. And I don't want to grow older. I don't want to be condescended to, ignored and marginalised by society. To become peripheral to the action. I don't want to be the first person let off the plane in a hostage crisis. They laugh together. And don't even see Douglas go.
M	DOUGLAS	I wondered where you'd been. Evelyn turns. Douglas is on the stairs above her.
M	DOUGLAS (CONT'D)	We're all up top, having a drink.
F	EVELYN	I went to see Gaurika. Manoj's wife. I wanted to ask her what she knew. And the answer was that she knew everything, that he'd loved another man, and always would. He told her when the marriage was arranged. They had no secrets from each other, none. Suddenly she's crying. Unable to stop.
M	EVELYN (CONT'D)	And that's right, don't you see? That must be right. Because what is the point of a marriage in which nothing is shared? Her words hang in the air. They stand there for a moment.
F	JEAN	Mrs Greenslade, might I have my husband back now? They spring apart. Douglas? She walks off back into the room. Douglas turns to Evelyn.
F	EVELYN	Yes, of course.
M	DOUGLAS	Forgive me. Evelyn goes quickly to her room, leaving him standing
M	DOUGLAS	She was upset.
F	JEAN	Spare me your explanations. D'you think I'm jealous?
M	DOUGLAS	I don't see why else you would have embarrassed me. And Evelyn.
F	JEAN	You were already doing a perfectly good job of embarrassing yourself. Can you imagine how ghastly it's been for everyone to watch you mooning around after that simpering doe- eyed ex-housewife, taking advantage of her loneliness and -
M	DOUGLAS	God, can you hear yourself? Can you? Do you have any idea what a terrible person you've become? Jean is stunned into silence.
M	DOUGLAS (CONT'D)	All you give out is this endless negativity, a refusal to see any kind of light and joy even when it's right in your face, and a desperate need to squash any sign of happiness in me or anyone else .. it's a wonder I don't fling myself at the first kind word or gesture that comes my way. But I don't. Out of some dried-out notion of loyalty and respect, neither of which I ever bloody get in return. There's a long silence.
F	JEAN	I checked my emails. This came. She hands him a piece of paper.
F	MADGE	Are you alright?
F	EVELYN	I just need some water. She drains the glass.
F	MADGE	That was a gin and tonic.
F	EVELYN	Yes. I know that now.
F	MADGE	What's happened?
M	NORMAN	Good evening, the Ainslies. Douglas and Jean are approaching them.
F	MADGE	How are you both?
F	JEAN	We're particularly well. Douglas, tell them our news. She looks to him, waits. He says nothing.
M	JEAN (CONT'D)	We're going home.
M	SONNY	And so I would ask you to loosen the strings on your purse, Mr Maruthi, and to do it most rapidly. So that Phase Two Development of the Best Exotic Marigold Hotel can begin with immediate effect. Mr Maruthi looks down, sees Muriel. She's with Anokhi, He calls down to her.
M	MR MARUTHI	Mrs Donnelly, I believe. Sonny spots the danger, tries to lead Mr Maruthi away.
M	SONNY	And now if you would please be following me to the ground floor
M	ROOMS	Mr Maruthi ignores him, calls down again.
M	MR MARUTHI	How are things at the hotel?
M	SONNY	Mr Maruthi - Better. They're going better. Sonny takes a moment to recover.
M	SONNY	You see? Profound satisfaction. Such is the inevitable result of a prolonged stay at the Marigold Hotel. And now Mr Maruthi has spotted something else. The
M	MR MARUTHI	What are those men doing?
M	SONNY	Working for me, Mr Maruthi. To create a home for the elderly so wonderful that they will simply refuse to die! Stare death in the face and say-
M	SONNY (CONT'D)	What are those men doing?
M	SONNY	Mummyji, what is going on here?
M	MRS KAPOOR	I have spoken to your brothers. They want to sell the hotel. These men are here to value the building.
M	SONNY	They are valuing the land. My brothers do not care about the building. They will knock it down.
M	MRS KAPOOR	They could just wait a month for it to fall down of its own accord.
M	SONNY	You joke, Mummyji, but inside I know you are not laughing. You do not want to see this dream destroyed. Send these people away.
M	MRS KAPOOR	No, my son. It is too late.
M	SONNY	Mummyji, please -
M	MRS KAPOOR	These figures do not support your argument.
M	SONNY	There is still time to turn things around. With a small injection of funds, we can -
M	MRS KAPOOR	Who is trusting you with that money? Eh? You, who cannot run a chai stand. Just like your father. Beat. Then Sonny speaks quietly.
M	SONNY	Do I remind you of him so much? Is that why you must be cruel to me?
M	MRS KAPOOR	You think I am cruel?
M	SONNY	You loved my father. And he loved this hotel. Two mistakes. There will not be a third. Say goodbye to all this, Sonny. And come with me to Delhi. Your life will become easier.
M	SONNY	Not easier, Mummyji. Smaller. He leaves. Mrs Kapoor comes back to the desk, fiddling with some She turns to the doorway. Muriel is there, in her chair.
M	MRS KAPOOR	Mrs Donnelly. Can I help you?
F	MURIEL	Depends. Do you know how to use a computer?
M	MRS KAPOOR	I assume you are joking.
F	MURIEL	Mrs Ainslie said she had an address where I could get some things I need. Some biscuits. She said I could get them on the line.
M	MRS KAPOOR	I wish you luck. Mrs Kapoor smiles, and leaves. Muriel watches her go, then turns to the computer.
F	JEAN	The whole thing is actually tremendously exciting. Not just getting on a plane, but getting on a plane and turning left.
M	NORMAN	Turning left?
F	JEAN	First class. And home in time for our 40th wedding anniversary. We haven't yet decided how to mark the occasion.
F	MADGE	Perhaps a minute's silence?
M	NORMAN	Two should fit us all, I think.
F	EVELYN	I'm actually going to walk. Apparently they're getting ready for a festival.
M	DOUGLAS	Perhaps you'd like one of us to accompany you.
F	MADGE	I'm happy to walk with you.
F	EVELYN	I'll be fine. Evelyn speaks to both Douglas and Jean.
M	EVELYN (CONT'D)	I'm delighted for your daughter's success. I wish you all every happiness.
F	JEAN	Thank you. Evelyn turns, and walks away. A motor-bike hurtles past them, going the other way.
M	DOUGLAS	Was that Sonny? He answers.
M	YES	Ma?
F	EVELYN	I just wanted to hear your voice. No, I'm sorry, I didn't think about the time . How are you? And Polly? The boys . how are the boys? She listens to him. She's holding back tears.
M	EVELYN (CONT'D)	Oh good, I'm glad you've been reading it. Yes. Yes, I've made some very good friends. No, I'm fine, of course I am. As much as she had wanted to speak to him, she now wants
M	EVELYN (CONT'D)	I think my money is running out, I'd better go. Goodbye for now, darling. I'll call again later. She hangs up. And stays there with her hand on the phone.
