M	CHARACTER	DIALOGUE
M	NICK	What are you talking about, a hitman? 42 CONTINUED: (2) 42
M	KURT	You know, that's not bad. I mean, we don't clean our own apartments, right? We hire someone to clean them for us.
M	DALE	Maybe you do, moneybags.
M	NICK	But where are we supposed to find a hitman?
M	DALE	That's the only problem. I have no idea.
M	KURT	I do. Meet at my place tomorrow after work. And make sure you're not followed.
M	NICK	Why would anyone follow us?
M	KURT	I don't know. People get followed.
M	DALE	What people?
M	KURT	Just meet me at my place.
M	KURT	Come in. The guy should be here pretty soon.
M	NICK	Wait. You actually found someone?!
M	KURT	It was as easy as buying a used futon. 43 CONTINUED: 43
M	DALE	Craigslist?! You found a hitman on Craigslist.
M	KURT	Yup. But they don't post it as `hitman.' That would be stupid. They use code words, like `liquidation,' `pest control,' `wet work.' Check it out. This is our guy.
M	NICK	`Skilled professional with years of experience in domestic and international wet work. Fast and discreet. No children or political figures.'
M	KURT	See? He's principled.
M	DALE	This is so dangerous. What if he's a narc?
M	NICK	Yeah, Kurt. Call him back and cancel.
M	KURT	It's too late. He's on his way.
M	DALE	What do we do if this guy gets here and he asks for so much money that we can't afford him and he gets mad and kills all of us?
M	KURT	I don't think he'd stay in business long if he killed everyone who couldn't afford him.
M	NICK	Guys! I think this is him!
M	NICK	Nice car.
M	KURT	Whoa. This guy's legit.
M	DALE	I bet that briefcase has one of those guns you have to screw together.
M	NICK	All right, let's just be professional here. We don't want to seem all giddy.
M	KURT	How's my hair?
M	NICK	It doesn't matter!
M	MAN	Is one of you Kurt?
M	DALE	Oh my God, he's like James Bond!
M	KURT	Yes, hi, I'm Kurt. Please come in.
M	MAN	Thank you. Are all three of you participating in this? 45 CONTINUED: 45
M	NICK	Yes, we are.
M	MAN	Very well. Now before we go any further, I need to know if there are any hidden recording devices in this room. I will find out if there are.
M	DALE	No, no! We definitely don't want to record this, sir.
M	MAN	Then let's get started.
M	KURT	Whoa, whoa. What's that for?
M	MAN	For the mess.
M	NICK	We don't want you to kill us!
M	DALE	Oh my God! I knew it!
M	MAN	Kill you? What are you talking about?
M	KURT	Your ad said you do wet work.
M	MAN	That's correct. I urinate on other men for money.
M	NICK/KURT	What?!
M	MAN	Why do you think my ad was in the `men seeking men' section? 45 CONTINUED: (2) 45
M	NICK	You were looking in `men seeking men'?!
M	KURT	Yeah! We're men seeking a man, aren't we?
M	NICK	You are such a moron.
M	MAN	So you're telling me I drove all the way to the Valley and no one wants to be pissed on?
M	DALE	Please don't kill us.
M	MAN	I don't kill people! Can I use your rest room? I've stored up rather a large amount of pee for this.
M	KURT	It's right through there.
M	KURT	Good thing I didn't call the guy who was offering to do `dirty work.'
M	KURT	All right, I'll take the blame for that one.
M	NICK	That's big of you.
M	KURT	I'm going to make it up to you. I figured out a much better way to find a contract killer.
M	DALE	What's that? Hello, Mr. Gamble, thank you for contacting On Star --
M	DALE	Oh, come on!
M	NICK	This is your plan?
M	ON STAR REP (V.O.)	-- my name is Gregory. How can I be of service this evening?
M	KURT	Gregory, I need you to direct me to the most dangerous bar in Los Angeles.
M	ON STAR REP (V.O.)	I'm sorry?
M	KURT	We need to find the bar with the most scumbags, lowlifes and hardcore shitheads. Can you help us out?
M	ON STAR REP (V.O.)	I'm afraid our listings are not organized by danger, sir. I do see there is a Bennigan's three blocks from your current LOCATION --
M	KURT	Okay, Gregory? That's unhelpful. While I'm sure there are plenty of shitheads there, they're not the kind of shitheads we need.
M	ON STAR REP (V.O.)	I can direct you to the neighborhood with the greatest number of car-jackings in your area. 46 CONTINUED: (2) 46
M	KURT	Now we're talking.
M	ON STAR REP (V.O.)	Very good, sir. You may wish to lock your doors.
M	NICK	So, do you like living in Bangalore?
M	GREGORY (ON STAR REP)(V.O.)	It's not bad. Humid.
M	DALE	Now, `Gregory.' Is that your real name?
M	GREGORY (V.O.)	No, sir. My real name is Atmanand.
M	KURT	Atmanand? How did you get Gregory from that?
M	GREGORY (V.O.)	`Gregory' was assigned to me by On Star.
M	NICK	Why don't they let you use your real name?
M	GREGORY (V.O.)	Many Americans find our real names off-putting.
M	KURT	Actually, I do find Atmanand a little off-putting. 48 CONTINUED: 48 You have arrived at your destination, sir.
M	DALE/NICK	Thank you, Gregory./Thanks, Gregory.
M	KURT	
M	DALE	Aren't you worried about your car?
M	KURT	Nah, Gregory's watching it.
M	NICK	You really think we're gonna find a hitman in there?
M	KURT	I think we're gonna have a hard time deciding between all the hitmen in there. Trust me, these are the lowest of the low.
M	NICK	Oh, real nice, Kurt. Way to be racist.
M	KURT	This isn't a race thing. We need a criminal and this neighborhood is where they live. I'm not saying that's because there are a lot of black people here. That's the fault of our society that discriminates and disenfranchises them. 50 CONTINUED: 50
M	DALE	You said they were the lowest of the low.
M	KURT	I was speaking socio-economically.
M	NICK	So what do we do now? Yell out `anyone here kill people for money?'
M	KURT	Let me handle this.
M	BARTENDER	Yeah?
M	KURT	Hey. How you doing? Nice place. Listen, does anyone here kill people for money?
M	NICK	Kurt!
M	BARTENDER	The fuck did you just say?
M	KURT	Don't get me wrong. This isn't about race. Our society discriminates and disenfranchises YOU --
M	DALE	Oh my God.
M	BARTENDER	I'm a small business owner. Who are you calling disenfranchised?
M	KURT	I didn't mean you in particular.
M	BARTENDER	Right. You mean all black people. 50 CONTINUED: (2) 50
M	NICK	Maybe we should go?
M	BARTENDER	You could do that. Or I could take the aluminum baseball bat I'm holding in my right hand and disenfranchise your teeth from your mouth.
M	DALE	I vote we go.
M	KURT	Okay, we're going. I'm sorry if I offended you. It was never my --
M	BARTENDER	Oh shit, please shut up.
M	KURT	Okey doke.
M	DALE	This is ridiculous. We're never gonna find someone to do this for us.
M	COCKSUCKER JONES (O.S.)	Yo!
M	COCKSUCKER JONES	I think I can help you boys.
M	DALE	Oh, we're just gonna follow him into that alley?... All right. 52 CONTINUED: 52
M	COCKSUCKER JONES	I heard you're looking for someone to take care of some business for you?
M	NICK	Yes, we are. Are you a... businessman?
M	COCKSUCKER JONES	Cocksucker Jones.
M	NICK	Excuse me?
M	COCKSUCKER JONES	That's my name.
M	DALE	Your first name is Cocksucker?
M	COCKSUCKER JONES	And my last name's Jones. You got a problem with that?
M	DALE	No, no. It's just interesting. That's the name on your birth certificate?
M	COCKSUCKER JONES	Naw, man. It's a nickname. My real name is Dean.
M	DALE	Oh! Like Dean Jones. The actor from Herbie the Love Bug.
M	KURT	I don't think he knows who Dean Jones is.
M	COCKSUCKER JONES	I know who Dean Jones is, bitch! I can't walk around here with that kind of faggy, cracker name.
M	NICK	So you chose `cocksucker'? 52 CONTINUED: (2) 52
M	COCKSUCKER JONES	That's right. Nobody fucks with a cocksucker. `Cocksucker' is the toughest name there is.
M	DALE	Not `motherfucker'?
M	COCKSUCKER JONES	I considered Motherfucker. But in the end, I thought Cocksucker Jones sounded more badass than Motherfucker Jones.
M	KURT	I agree.
M	NICK	Okay, here's the thing: we each work for a boss that we need to get rid of. Is that something you might be able to help us with?
M	COCKSUCKER JONES	It is. Assuming you've got the cheese.
M	KURT	We've got cheese. How much cheese are we talking?
M	COCKSUCKER JONES	For three hits? That's gonna run you thirty large.
M	NICK	That's a lot of cheese.
M	KURT	We don't have that much cheese.
M	DALE	Isn't there any kind of discount because we're buying three at once? Like buy two, get one free.
M	COCKSUCKER JONES	This ain't the motherfucking Cold Stone Creamery. It's thirty large or nothing.
M	NICK	There's no way we can pay that. 52 CONTINUED: (3) 52
M	COCKSUCKER JONES	Five large.
M	DALE	Wow. Good negotiating.
M	NICK	That's a lot more reasonable. And that would be for all three, Cocksucker?
M	COCKSUCKER JONES	Yeah.
M	KURT	Great. We're in.
M	COCKSUCKER JONES	Okay, meet me back here tomorrow night with the cash. I'll take care of the rest.
M	NICK	Should we bring the bills in any kind of special denominations?
M	COCKSUCKER JONES	No, just, whatever. Small bills.
M	NICK	Got it.
M	KURT	And do you want it in any particular container, like a shoebox?
M	NICK	Or a paper bag?
M	DALE	Or plastic. I read an article that plastic is actually better for the environment than paper.
M	COCKSUCKER JONES	Fuck the environment! Just put that shit in a briefcase.
M	NICK	Got it. Thanks. Come on, guys.
M	DALE	Should we deduct the cost of the briefcase?
M	COCKSUCKER JONES	What?!
M	DALE	I mean, assuming we don't get the case back... We're not getting the case back, right?
M	DALE	Well, that's like an extra eighty bucks. Only seems fair that we should take that out of your end.
M	NICK	We'll cover the briefcase, Dale.
M	DALE	Then let's get a cheap one. It doesn't have to be real leather. Are you cool with faux -- ? 53 CONTINUED: 53
M	COCKSUCKER JONES	Looks like it's all here.
M	DALE	Turns out we didn't really need the briefcase after all. Could've just used a manila envelope.
M	KURT	Shut up, Dale.
M	NICK	So, Cocksucker, how long do you think it'll be before you've... taken care of business?
M	COCKSUCKER JONES	Here's the thing. I just got out of doing a dime for some pretty ugly shit and I'm still on probation. They're watching me. So if I step out of line, I go right back inside.
M	KURT	You told us you could take care of it.
M	COCKSUCKER JONES	And I'm gonna. I'm gonna be your professional advisor. Think of me as your murder consultant.
M	NICK	We don't want a murder consultant. We want a murderer.
M	DALE	I knew we were getting ripped off!
M	KURT	Okay, look. This isn't what we talked about. 54 CONTINUED: 54 Can we just get our money back, please? Then we'll be on our way.
M	COCKSUCKER JONES	Sorry, no refunds.
M	NICK	That's five thousand dollars. You think we're just gonna walk away and let you keep that?
M	COCKSUCKER JONES	I think you're forgetting who you're talking to.
M	DALE	Whoa, whoa! We don't want any trouble.
M	COCKSUCKER JONES	Now either I give you the advice you paid for, or you can walk away with nothing. Up to you.
M	KURT	Look, the whole reason we came to you is because we don't have the experience to do it ourselves.
M	COCKSUCKER JONES	Most killers are first-timers. Look, the key to a good murder is making it look like an accident. Gas leak, brakes failing, suicide, that sort of thing. If you do it right, you won't even have to be there when it goes down.
M	NICK	That makes sense. But how would we fake three accidents?
M	COCKSUCKER JONES	You need to stalk your prey, track their movements, get to know them inside and out. Where do they go? What do they eat for breakfast? Who're they fucking?
M	DALE	You're talking about surveillance and recon.
M	COCKSUCKER JONES	But making it look like an accident won't be enough if the pigs can pin a motive on you.
M	NICK	Well, we all have obvious motives for killing our bosses.
M	COCKSUCKER JONES	So why don't you kill each other's bosses?
M	DALE	Hey, that's a good idea. Like Hitchcock's Strangers on a Train.
M	KURT	The Danny DeVito movie?
M	DALE	Yes, the famous Alfred Hitchcock/Danny DeVito movie. You're thinking of Throw Mama from the Train. But it's actually the same idea. If we kill each other's bosses there's no link to us.
M	NICK	That's pretty good. COCKSUCKER JONES That's what you're paying me for. Now ain't that worth five grand?
M	COCKSUCKER JONES	Yeah, well, too fucking bad.
M	KURT	We're outside. You ready for a little recon?
M	NICK	Yeah. I just need to get Harken to let me leave early.
M	KURT	What's the difference? He's not going to be your boss much longer.
M	NICK	If I get fired before we kill Harken, this'll all have been for nothing. I'll just be an out-of- work murderer. I'll be down in three minutes.
F	HARKEN	What in God's name...?!
M	NICK	Sorry, sir. I've been fighting this bug all day. I'll just get back to work --
F	HARKEN	No. Go home. I don't want you getting everyone else sick.
M	NICK	Oh, okay. Thank you, Mr. Harken. 56 CONTINUED: 56
F	HARKEN	Wait. Take your work with you. Have it on my desk at six AM.
F	HARKEN	Disgusting.
M	KURT	Okay, boys, as soon as Pellit makes a move, we tail him. It is on now.
M	NICK	Oh, it's on.
M	DALE	Hells yeah!
M	KURT	Ugghhhhh, I can't believe how much this sucks.
M	DALE	I don't get it. On TV, surveillance always looks so great. They've got their cups of coffee. Their sunflower seeds. They talk about their lives. And then, right when they reveal something really intimate, the perp appears and they spring into action.
M	NICK	Are we even sure he's home?
M	KURT	Let's go check it out.
M	NICK	I don't see him.
M	DALE	What are you doing?
M	KURT	We're not gonna get intel standing on his lawn. We have to go in.
M	DALE	What about fingerprints? We don't have gloves.
M	KURT	Here, do this.
M	KURT	Here we go.
M	KURT	Dale, keep an eye out. Let us know if Pellit's coming.
M	DALE	Got it. Wait, I don't know what he looks like.
M	NICK	It doesn't matter. Just tell us if anyone comes.
M	DALE	Got it.
M	KURT	Wow. This guy's a bigger douchebag than me.
M	NICK	Okay, let's split up. Look for any intel we can use on him.
M	KURT	What kind of intel?
M	NICK	I don't know. I guess we'll know it when we see it.
M	DALE	Hey, Nick? Does this count as intel?
M	NICK	Holy shit, that's a lot of blow.
M	DALE	God, this must be worth, like, ten thousand -- oh shit! 61 CONTINUED: 61
M	NICK	What the fuck?!!
M	DALE	Sorry, my sleeves were slippery!
M	NICK	We've got to get that back in the box.
M	DALE	I've got it.
M	NICK	Look out. Let me try this.
M	DALE	I guess we should've emptied the Dustbuster before we used it.
M	NICK	You think?
M	DALE	Hey look, there's a piece of cereal in here. Can't tell if that's a corn flake or a frosted flake...
M	KURT	Okay, my work upstairs is done. You guys ready to split?
M	NICK	We need to be better prepared. That was totally dangerous and a complete waste of time.
M	KURT	Not a complete waste.
M	NICK	Oh no... don't tell me...
M	DALE	You stole that from Pellit's house?
M	KURT	It's got his calendar and his contacts. This is what recon's all about.
M	DALE	Nobody said we'd be stealing.
M	KURT	Shall we pay a little visit to your boss, Nick?
M	NICK	I guess so. But let's make a stop first. What did you need to get?
M	NICK	No more sleeve gloves.
M	DALE	Nice.
M	KURT	Oh man, you should've asked me. I've got a whole box of those in my bedside table. Don't judge me.
M	NICK	Take a right up here. Harken's place is about a mile away.
M	DALE	Y'know... this is kinda, I don't know... exciting.
M	KURT	Very.
M	NICK	Yeah. I guess we're really doing this now, huh?
M	DALE	I guess so.
M	DALE	Can I have a pair?
M	NICK	You know, last time with the three of us, it got a little... messy. What if Kurt and I go in and you stay here and watch out for Harken?
M	DALE	Okay -- again, I don't know what he looks like.
M	NICK	If anyone approaches the house, assume it's him and give us a signal.
M	DALE	Fine. I'll honk the horn six times.
M	KURT	Maybe something a little more subtle?
M	DALE	Honk the horn four times?
M	NICK	How about you just honk once?
M	DALE	People honk once all the time. You'll be running in and out of the house.
M	KURT	Fine. Honk twice.
M	DALE	Okay...
M	NICK	Looks like the coast is clear.
M	KURT	Damn. Guess we'll have to break in the old-fashioned way.
M	NICK	Kurt, wait!
M	KURT	Holy shit. I broke the rock.
M	NICK	No, it's one of those hide-a-key things. Look... 74 CONTINUED: 74
M	NICK	Wow. This is not how I pictured his place.
M	KURT	For all we know, he's got a closet full of skin suits.
M	NICK	Jesus!
M	KURT	Stupid cat. Let's check upstairs.
M	DALE	`Do you believe in love after love/I can feel something inside me say/I really don't think you're strong enough now...' 77 CONTINUED: 77
M	KURT	God damn it! How many cats do they have?
M	NICK	I think that was the same one.
M	KURT	Little bastard.
M	KURT	Damn. That's Mrs. Harken? I'd like to cover her in cock yogurt.
M	NICK	You want to cover every woman in... did you say `cock yogurt'?
M	KURT	I did.
M	KURT	Ahhh!
M	NICK	If he's so scared of us, why doesn't he just leave us alone?!
M	DALE	C'mon, c'mon... yes! 79 CONTINUED: 79
F	HARKEN	Hey, schmuck.
M	DALE	Excuse me?
F	HARKEN	You want to tell me why you're littering on my street?
M	DALE	Oh, I'm sorry, that blew out the window. I wasn't littering.
F	HARKEN	I don't care if it blew out of your twat. Now, get your fucking Chevy Cavalier the hell off my block!
M	DALE	Whoa. Sir, there's no need to be hostile.
F	HARKEN	Hostile? You want to see hostile? How about I go in the house and get my --
M	DALE	Get your what?
F	HARKEN	Peanuts?
M	DALE	Huh? Oh, yeah. It was a peanut butter sandwich.
M	DALE	Oh god! What should I do?! Tell me what to do! 79 CONTINUED: (2) 79
M	DALE	What do I do with this? Should I inject you?!
M	DALE	Okay, hold on! I got this.
M	DALE	Did I do it? Did I get enough in?! I'm gonna do it again!
M	NICK	Do you see a Day Runner or an address book?
M	KURT	NO -- What the...? Dude, check this out.
M	NICK	That's Harken! Dale's killing Harken!
M	KURT	Holy shit! He's really doing it! Out where everyone can see him. 80 CONTINUED: 80
M	NICK	What the hell is he thinking?!
M	KURT	He's not stopping. He's gonna get us all caught. We've gotta get out of here.
M	NICK	What about Dale?
M	KURT	He's a psychopath. We leave him behind.
M	NICK	Right. Let's go through the back!
F	MRS. HARKEN	Oh my god! What happened?!
M	DALE	He had an allergic reaction. But I think he's coming around. Do you know him?
F	MRS. HARKEN	He's my husband.
F	MRS. HARKEN	Honey? Can you hear me?
F	HARKEN	Wha-- What did you do to me?
M	DALE	I injected you with your thing. 81 CONTINUED: 81
F	MRS. HARKEN	He saved your life, honey. Thank you so much!
M	DALE	Oh, it was nothing.
F	HARKEN	What's this? What's with the hugging?
F	MRS. HARKEN	I'm just thankful that he was here.
F	HARKEN	I'll bet you are. Do you know this guy?
F	MRS. HARKEN	No. We just --
F	HARKEN	Are you fucking him, Rhonda?
F	MRS. HARKEN	Oh, come on.
F	HARKEN	What were you doing out here, anyway? Waiting to fuck my wife?
M	DALE	I've never met your wife --
F	HARKEN	You need to get the hell out of here.
F	MRS. HARKEN	Dave, stop it. You should be thanking him. Why are you being so suspicious? 81 CONTINUED: (2) 81
F	HARKEN	Why? Because I know you sleep around on me. And I'm going to find out who it is.
F	MRS. HARKEN	You're being ridiculous.
F	HARKEN	Am I? What about Maurilio? I see the way you look at him.
F	MRS. HARKEN	I am not having sex with the gardener!
M	NICK	I can't believe that idiot Dale. You realize we're all going to jail because of him.
M	KURT	I can't go to jail. Look at these eyes. Look at this ass. They'll be all over me.
M	NICK	Yeah, me too.
M	KURT	Well...
M	NICK	What do you mean `well'? I'd get raped just as much as you.
M	KURT	No, of course you would. You're a good-looking guy.
M	NICK	You think you're more rape-able than I am. 82 CONTINUED: 82
M	KURT	I never said that --
M	DALE	Oh good. You guys are here. Did you see me out there?
M	KURT	Yeah, Dale, we saw you.
M	DALE	Pretty neat, huh?
M	NICK	No, it wasn't neat! You stabbed Harken to death in front of the whole neighborhood!
M	KURT	Not cool, man.
M	DALE	Wait, that was Harken?
M	NICK	Who'd you think you were stabbing?
M	DALE	I wasn't stabbing anybody. That was an epi-pen. He was having an allergic reaction to peanuts and I injected him.
M	NICK	So let me understand this. My boss, who we are trying to kill, was dying in front of you and you saved his life?
M	KURT	Not cool, man.
M	DALE	Wait, you were just mad at me for killing him and now you're mad at me for not killing him?! See, this is why I needed to know what these people look like! 82 CONTINUED: (2) 82
M	NICK	Hang on a sec. Maybe this recon wasn't a waste of time. Now we know Harken's deathly allergic to peanuts and Pellit has a huge stash of cocaine.
M	KURT	We could put peanuts in Harken's house and rat poison in Pellit's coke!
M	NICK	Everyone would assume that Pellit just got a batch of tainted drugs.
M	DALE	But Harken must always have that epi-pen on him.
M	KURT	I bet he doesn't wear it in the shower. We could put peanuts in his shampoo!
M	NICK	Perfect! Two fatal accidents. And we're not even there when they happen.
M	DALE	That just leaves Julia.
M	KURT	Tomorrow night, I'll surveil her and figure out how to take her down.
M	NICK	Good. I'll get some rat poison and take care of Pellit. Dale, think you can get some peanuts into Harken's shampoo?
M	DALE	I can do that.
M	KURT	All right. That just leaves us with one final thing to settle. 82 CONTINUED: (3) 82
M	NICK	What's that?
M	KURT	Dale, if Nick and I were in prison, which one of us would get raped more?
M	NICK	Hey. Have you learned anything about Julia yet?
M	KURT	Well, I've learned that Dale is a homosexual because this chick is unbelievably hot. How's it going over there?
M	NICK	I'm just waiting for Pellit to go to sleep. I wonder how Dale's doing with Harken.
M	NICK	Jesus, where does he get the energy? Oh yeah.
M	NICK	What's up, Dale? 90 CONTINUED: 90
M	DALE	Harken just left his house. I'm going in.
M	NICK	Good luck, man.
M	DALE	Thanks.
M	DALE	Ahhh!
M	NICK	Okay. Here we go.
M	DALE	Nick?
M	NICK	What?
M	DALE	I'm not sure if I can do this.
M	NICK	Where are you?
M	DALE	In Harken's bathroom. About to pour the nuts in his shampoo. But, I just... I know he's a real shithead, but he's still a person, y'know?
M	NICK	Yeah. I know.
M	DALE	What should I do? Should I do it?
M	NICK	What the fuck?!
M	DALE	What?
M	NICK	It's Harken. He's here!
M	DALE	At Pellit's?! Why?!
M	NICK	I don't know. He's knocking on his door!
M	DALE	How would Harken even know Pellit?
M	NICK	Oh my god oh my god oh my god...
M	DALE	What? What? What?!
M	NICK	He shot him. Harken shot Pellit!
M	DALE	Oh my god. Is he dead?!
M	NICK	Shhhh!
M	NICK	Fuck!
M	DALE	What's happening?
M	NICK	Harken's gone.
M	DALE	What about Pellit?
M	NICK	He's not moving. He looks dead.
M	DALE	Shit! What do we do?!
M	NICK	I've got to get out of here before someone sees me! Meet me at the bar. I'll call Kurt.
M	KURT	Okay, let's all stay calm and figure this out.
M	NICK	Calm? How can we be calm? I watched a man die an hour ago!
M	KURT	A man you were going to kill anyway.
M	NICK	Well...
M	KURT	What?
M	NICK	I don't know if I had it in me.
M	DALE	Me neither. 99 CONTINUED: 99
M	KURT	I can't believe you guys! You can't just bail on a plan like that at the last minute.
M	NICK	You think when it came down to it, you would've been able to murder Julia?
M	KURT	I don't know. I mean, afterwards, it was kind of hard to imagine killing her.
M	DALE	`Afterwards'?
M	NICK	You slept with her, didn't you?
M	DALE	Oh god. Please tell me you didn't sleep with her.
M	NICK	You are a mess.
M	KURT	I know, I know. But it's not my fault.
M	KURT (V.O.)	At first I was surveilling her just like I was supposed to...
M	KURT (V.O.)	Then she started deliberately undressing in front of the window. With the lights on. She must've known I was there.
M	KURT (V.O.)	Then she made herself a little snack. A Popsicle...
M	KURT (V.O.)	... then a banana....
M	KURT (V.O.)	... and finally a hot dog. I mean, three penis-shaped foods cannot be coincidence. And in that weird order? That's not a proper meal.
M	DALE (V.O.)	So you took that as an invitation to fuck her?
M	KURT (V.O.)	No. I took her invitation to fuck her as an invitation to fuck her. 103 CONTINUED: 103
M	NICK	There is something clinically wrong with you.
M	KURT	I know. I'm a rapscallion.
M	DALE	You're not a rapscallion. You're a whore. A filthy whore.
M	KURT	Hey. Not nice. And besides, I think I actually solved your problem, Dale. Julia just needed a good fucking. I bet she's not going to mess with you anymore.
M	NICK	Whatever. We have bigger fish to fry right now. What do we do about Harken?
M	KURT	Here's what we do. We call the cops and make an anonymous tip that Harken killed Pellit. Boom. Harken's in jail. Pellit's in hell. Julia's had the crazy fucked out of her. Our problems are solved. Boom.
M	NICK	Okay, but we should find a payphone. We don't want them tracing the call to us.
M	NICK	Come on, we'll take my car.
M	NICK	What the hell?
M	COP	Are you the owner of this vehicle?
M	NICK	Uh, yes. Is there something wrong?
M	COP	We've got an APB on a black Kia Spectra, license 4HIG208.
M	NICK	Can I ask why?
M	COP	A traffic cam caught this vehicle fleeing the scene of a crime tonight. I'm going to need you to follow us to the station.
M	KURT	Officer? This is not my car. Is it okay if I just -- ?
M	COP	All three of you, please.
M	DALE	They know everything. We're dead. I can't believe I let you guys talk me into this! 107 CONTINUED: 107
M	KURT	Oh, please. We were just being hypothetical. You're the one who pushed us to do it.
M	NICK	We can't even say anything about Harken now.
M	KURT	Why not?
M	NICK	Uh, well, Kurt, being outside the murder victim's house because I was planning to murder him probably isn't the best alibi in the world.
M	KURT	You know, I didn't actually do anything illegal, so...
M	DALE	You broke into two people's houses and stole a BlackBerry!
M	KURT	You gonna rat on me, Dale?
M	DALE	Well, since I'm the only one without a connection to the murder, yeah, maybe I will.
M	NICK	That means you'd also rat on me.
M	KURT	Not if I rat on Dale first.
M	HAGAN	Gentlemen, this way, please.
M	HAGAN	Do you want to explain why you were driving 61 in a 25 zone, a block from the victim's house two minutes after he was shot to death?
