M	CHARACTER	DIALOGUE
M	SIR THOMAS	I received a formal request for marriage today for Anne. From the Carey family. ANNE; the eldest. Dark-haired. Intelligent. The obvious leader among the children.
M	LADY ELIZABETH	But that's wonderful.
M	SIR THOMAS	I turned it down.
M	SIR THOMAS	And offered them Mary instead. MARY, the middle child. Fair-haired. Pretty. Sweet-natured.
M	SIR THOMAS	Fnne's too good for William Carey. She can do (better than a merchant's son.
M	LADY ELIZABETH	You underestimate Mary.
M	SIR THOMAS	Not true. I think she's..the kinder of the two. Quite possibly the fairer.
M	SIR THOMAS	But to get ahead in this world, you need more than fair looks and a kind heart.
M	SIR THOMAS	Bravo! Anne! Bells ring high up in the bell-tower of a country church. MARY, ten years older, and grown into a heavenly bride is in her
F	ANNE	May we come in..?
F	ANNE	Look at you..! Younger than me. More beautiful than me. Married before me. I am eclipsed. I am just the `Other Boleyn Girl.'
F	MARY	Hardly.
M	GEORGE	No, is this it? This is the end of the unholy trinity?
F	MARY	No, George. Never. I'll be married, that's all.. Apart from that - it won't change a thing. A packed country church. The PRIEST officiates in Latin. The air
M	PRIEST	Confirma hoc, Deus, quod operatus es in nobis.. The party afterwards. MUSICIANS play. The bride and groom,
M	WILLIAM	Are you happy?
F	MARY	Very.
M	WILLIAM	You don't secretly wish you'd married someone grander? With a title?
F	MARY	No. I want a husband who loves me. And who thinks it first thing every morning. And last thing at night.
M	WILLIAM	Then you've found the right man.
F	ANNE	Who is that? He was staring at me in church?
M	GEORGE	That's Henry Percy. Heir to the Duke of Northumberland. Richest landowner in England.
M	GEORGE	But don't get your hopes up. He is already betrothed.
F	ANNE	Betrothed is not married, brother George. A lot can happen before you reach the altar. he DUKE OF NORFOLK, the most powerful nobleman in the room, and
M	SIR THOMAS	Thomas..
M	NORFOLK	I think I have managed to persuade the King to come and stay with you on progress. A week-end's hunting in late summer.
M	SIR THOMAS	But that's wonderful! Thank you, thank you so much.. Did you hear that, Elizabeth?
M	LADY ELIZABETH	Yes.
M	SIR THOMAS	Finally we can present George, and with luck, get him a position at court.
M	NORFOLK	These are difficult times. I have it on good authority that the Queen no longer bleeds - yet the matter of a male heir is still not resolved. It cannot be long before the King is forced to look outside the marriage.
M	SIR THOMAS	What? And make a bastard King of England?
M	NORFOLK	A legitimized bastard. What choice does he have? Obviously, I've given it thought, and wondered which Howard girl I could put under his nose. Imagine the influence that would give us. To be blood family of the next King of England. Equally, imagine if another family were to achieve the same?
M	SIR THOMAS	What about Anne?
M	SIR THOMAS	I realise as a `Boleyn' she is not officially a `Howard', but as your sister's daughter..
M	NORFOLK	But she's your eldest, Thomas. Your first born. And your favourite. Wouldn't you prefer her to have a nice, uncomplicated, respectable marriage? Like Mary?
M	SIR THOMAS	If Anne were an uncomplicated, respectable girl like Mary, then I'd say `yes'. But she's not.
M	SIR THOMAS	She's anything but. SIR THOMAS and LADY ELIZABETH stand in a corner, watching the
M	ADY ELIZABETH	don't like it. It would cost a fortune to make our house fit for a royal visit. Money we don't have. LA king doesn't like her? Or if she sleeps with him but gives him a girl?
M	SIR THOMAS	And what if you were to look on the bright side? Just once?
M	SIR THOMAS	Risk nothing, you gain nothing.
M	LADY ELIZABETH	hen was it that people stopped thinking of ambition as a sin, and started thinking of it as a virtue?
M	SIR THOMAS	Easy for you to say. You've had power and wealth all your life.
M	LADY ELIZABETH	Until I married you, Thomas. And I was happy to give it up. ANNE knocks on the door of her father's study. She waits.
F	ANNE	You asked to see me father?
M	SIR THOMAS	Yes. Come in. MARY is in a bathroom. Being prepared by ANNE for her wedding
F	MARY	o - the King himself is coming to Hever. I'm so happy for George.
F	ANNE	Yes. But Father took me aside. It seems he has ambitions for me, too. unpleasing appearance...
F	MARY	What? What are you saying..?
F	ANNE	It's known the King has a wandering eye. Imagine...if he were to like me?
F	MARY	But...you could never be more than his mistress. And that's no substitute for a husband.
F	ANNE	But as the King's mistress the least I'd get after he finished with me would be an Earl. And if I fell pregnant? And gave him what his wife has failed to? Quite apart from the money, it'd be a Duke at least.
F	MARY	But what about your happiness? Your future?
F	ANNE	I could be a happy Duchess. MARY and ANNE enter the bedroom. A sea of candles. MARY stares
F	ANNE	Are you nervous?
F	MARY	A little.
F	ANNE	You'll tell me everything in the morning?
F	MARY	I promise.
F	ANNE	No details spared?
F	MARY	Hold me a moment?
M	MARY (cont'd)	I'm so lucky to have a man who is content with what he has.
M	MARY (cont'd)	You are, aren't you?
M	WILLIAM	I am the luckiest man in the world. Drink? You should. It will hurt less. Lie back.
M	WILLIAM (cont'd)	Thank you. The thunder of horses' hooves. A huge cloud of dust. The BOLEYN family page, (WILLIAM STAFFORD), is perched on a Pandemonium breaks out among STAFF and FAMILY MEMBERS as ANNE is being dressed by MAIDS. Hearing the commotion outside,
F	ANNE	There he is!
F	ANNE	You think he will like me?
F	MARY	Of course, sister. How could he not? The entire BOLEYN FAMILY is nervously assembled outside the
M	SIR THOMAS	Your Majesty, you are most welcome.
M	HENRY	Lady Elizabeth..
M	SIR THOMAS	May I present my son, George.
M	HENRY	Your Uncle tells me I should have you at court. Should I?
M	GEORGE	It would be a great honour, Sir.
M	SIR THOMAS	And our daughter, Anne.
M	ENRY	No one said anything of a daughter.
M	HENRY	Had we known, we might have come sooner.
F	ANNE	Your Majesty..
M	SIR THOMAS	Perhaps you'll allow Anne to show you around our modest house?
M	HENRY	A pleasure. ANNE leads the KING through the house. She is followed at a
F	ANNE	Here is the library.
M	HENRY	Charming.
F	ANNE	And through here, the observatory..
M	HENRY	Lovely..
M	HENRY	What's that?
F	ANNE	falcon, your Grace.
M	HENRY	I can see that. But what's it doing there? More to the point.. ..not just there, but in every corner in the house?
F	ANNE	I have no idea. Ask my father. Perhaps because falcons are vaguely associative with field sports - field sports with aristocracy - and in the absence of a genuine coat of arms.. ...a man with ambition will do the strangest things.
M	ENRY	That's a sharp tongue you have. I wonder what it might say about me behind my back?
F	ANNE	Oh, his Majesty has nothing to fear from me. Unless he fears an excess of compliments.
M	HENRY	Really? And what would they be..? The entire BOLEYN FAMILY is assembled, frantically changing ANNE
M	SIR THOMAS	Bravo, Anne! The King was quite smitten! Told me so himself. And has requested you sit beside him at dinner.
M	SIR THOMAS	My girl. My dear, remarkable girl. I knew you would up to the task. MUSIC is being played. Everyone is dressed in their finest, a
M	HENRY	Well played! And, may I say.. ..an excellent choice of music too!
M	HENRY	Sir Thomas, Lady Elizabeth, dear Anne. Your health. H ENRY raises his glass. Cheers and applause from the COURTIERS.
M	HENRY	..I had it from the lips of the Spanish ambassador himself. That our musicians are the envy of all Europe.
M	BRANDON	..then he was flattering you, your Grace.
M	HENRY	Our Universities and philosophers, too.
M	BRANDON	...another lie. That honour would have to go to the Germans.
M	HENRY	What of our painters, then?
M	RANDON	Years behind their Italian counterparts. The truth is far from leading the world, we're a provincial outpost, lagging far behind.
M	HENRY	What? Is no one proud to be English? Anne? What say you?
F	ANNE	I know little of such matters, but I've not heard mention of our armies. Undefeated, I believe, in a generation.
M	ENRY	Well said.
F	ANNE	Or our navy? The finest in the world. It's true.
F	ANNE	The universities in Spain and the philosophers in Germany may be strong, but are they really the equal of Oxford and Thomas More?
M	HENRY	Never!
F	ANNE	I doubt there is a country that is fairer in Government, or better protected by nature from her enemies, whose people are happier or more prosperous..
M	HENRY	She's right, by God! She's right! SIR THOMAS stops ANNE on her way upstairs.
M	SIR THOMAS	You did well tonight. Very well. Quite enough to be invited to court, I am sure of it.
M	SIR THOMAS	Now go to bed. Get a good night's sleep. Because there's still the hunt tomorrow. You must excel at that. MARY and ANNE lie together. In spoons position. ANNE is fast
M	F	inally, ANNE comes out. The KING turns..
M	HENRY	Good morning, Anne.
F	ANNE	Good morning, your Grace.
M	HENRY	ho will you be riding with?
F	ANNE	On my own your Grace.
M	HENRY	Your own..?
F	ANNE	They have invented a new saddle which allows ladies to ride on their own.
M	HENRY	ut with no man to hold onto? How will you stay on the horse?
F	ANNE	Why? The same way you hold onto yours, your Grace.
M	HENRY	We'll see.
M	HENRY	Let's away! The thunder of hooves..
M	HENRY	Hah! Up ahead, a STAG, wide-eyed, innocent, lifts it's head.. The DOGS and RIDERS roar across fields. The hounds snarl, almost
M	HENRY	Hah..! The terrified DEER bolts into safety of the forest. The barking
M	IDER	We've lost him. He's in the forest.
M	HENRY	Then we must follow. H HENRY weaves skilfully through low-hanging branches. He looks
F	ANNE	Hah! alf a mile ahead..
M	ENRY	he King of England defeated by a humble fawn.
F	ANNE	Hah!
M	COURTIER	Please, your Majesty. It's not safe.
M	T	the mud, it's hooves grasping horrifically at air.. HENRY slowly comes to, to find himself staring at a number of
M	PHYSICIAN	It's a miracle, Majesty, you have no broken bones..
M	SIR THOMAS	My daughter Anne is here. Would like to apologise.
M	ENRY	No! Get her away from me!
M	HENRY	And who are you?
F	MARY	Mary, your Grace. Anne's younger sister.
M	HENRY	You've been here all week-end?
F	MARY	Yes, your Grace.
M	HENRY	Really? How could I have overlooked you?
F	MARY	Next to Anne, it's easy to do.
M	HENRY	Nonsense. Tell me about yourself. You're married?
F	MARY	Yes, your Grace. To William Carey.
M	ENRY	From Wolsey's office?
F	MARY	Yes, your Grace.
M	HENRY	Then why haven't I seen you at court?
F	MARY	Because I have persuaded him to spend a year or two here first. We have a small manor and some land. Nothing much. But enough to start a family.
M	HENRY	A charmed life in the country? Away from it all?
F	MARY	Yes.
M	HENRY	Everything I would have wished for myself. But then my brother died. And duty called.
M	HENRY	You don't think he'll miss court? A young, ambitious man?
F	MARY	He says not, your Majesty.
F	MARY	But, if he ever changed his mind, I would always support him.
M	HENRY	Well said. Strapped and bandaged, HENRY is helped onto his horse. Beside
M	HENRY	Thank you again, Lady Elizabeth. We'll take good care of your boy.. And Thomas..
M	HENRY	You'll take care of that matter?
M	SIR THOMAS	Consider it done, your Majesty.
M	M	Y MARY and ANNE are sitting together. Presently the door opens,
M	STAFFORD	Your Father wishes to see you.
M	STAFFORD	Just Mary. An intimidating atmosphere. Dogs lie at the feet of the DUKE of
M	NORFOLK	Mary, I don't know what you said or did - but you obviously made a deep impression on the King. exchanges a look with SIR And he has requested you come to court with immediate effect.
F	ANNE	What?!? WILLIAM STAFFORD watches from the doorway as the DUKE of
M	NORFOLK	ou're to pack and leave first thing in the morning. The King himself has secured you a position in the Queen's household.
F	MARY	ut I don't want to go to court. Nor does my husband.
M	SIR THOMAS	ell her.
M	WILLIAM	The King has also offered me a position. As Gentleman of the Privy Council.
F	MARY	What?
M	SIR THOMAS	Y'hear that? Gentleman of the Privy Council! Attending to the private and personal needs of his Majesty himself! That's the inner sanctum!
F	MARY	But what about our future? Here in the country?
M	NORFOLK	Put it out of your mind. From now on your home is at court.
F	MARY	William, please! Don't you understand what this means?
F	MARY	They will separate us. Put me in different accommodation. Where the King can always...find me.
M	NORFOLK	Happily your husband understands the value of such an opportunity. For us all.
F	MARY	What about Anne? Couldn't she go instead?
M	SIR THOMAS	The way that girl behaved this week-end, she can count herself lucky she still has a home. ANNE'S FACE, outside the door: it's as if a knife had been
M	M	also running down her cheeks. She stares at her husband..
F	MARY	How could he DO this to me? My own father. What if we just refused?
M	WILLIAM	We would be cut off. He made that clear.
F	MARY	But would that be so bad?
F	MARY	Position means nothing to me. Nor wealth. We could find somewhere. A small farm. Away from everything.
M	WILLIAM	You say that now - but when you're older? And our children are grown up? This won't last long. A year. Maybe two. And at the end of that - we'll we have everything we want. It's for our FUTURE.
F	MARY	ut can't you see? Do this, and we might not HAVE a future. MARY is getting ready to leave. She turns a corner and `bang',
F	MARY	I'm so sorry..
F	ANNE	What for? You think I want the King? Or to be used and abused by him? No! You're welcome to him. I have my own plans, which don't involve becoming a rag that will one day be discarded. MARY and WILLIAM ride through London streets escorted by KATHERINE of ARAGON, (late-30's), imperious, intimidating,
M	SERVANT	Mary Carey, Ma'am.
M	QUEEN KATHERINE	Who?
M	SERVANT	The new Lady in Waiting.
M	QUEEN KATHERINE	Really? But I was not expecting anyone.
M	ERVANT	Appointed by...his Majesty the King.
M	QUEEN KATHERINE	By my husband? Really?
M	QUEEN KATHERINE	Well, then she must be some kind of gift. He must have seen in her some special talent that would please me. Tell me. What special talent is it that you have? Apart from your obvious youth and beauty? errified, MARY stammers..
F	MARY	I...I..
M	QUEEN KATHERINE	oetry, perhaps?
F	MARY	N-no..
M	QUEEN KATHERINE	Or dressmaking?
F	MARY	I..I..
M	QUEEN KATHERINE	Music! That's it! You compose? Or sing?
F	MARY	..I'm afraid not. Your Majesty.
M	QUEEN KATHERINE	Come, you're too modest. Signor Vasquez.
F	MARY	No..really..I beg you, your Majesty.
M	QUEEN KATHERINE	I command you to SING!!!
M	QUEEN KATHERINE	Bravo! A nightingale! Welcome at court! MARY walks through the packed corridors of court, her face
M	WOMAN'S VOICE	ait! Mary! Stop!
F	JANE	I know that must have been agony, but put yourself in her shoes. She knows the only reason the King has asked you here is because he desires you. For a wife that must be very difficult. She's a good woman. Trust me. J Jane Parker.
F	MARY	Mary Carey.
F	JANE	You have a brother, don't you? George?
F	MARY	Yes.
F	JANE	I've seen him a few times at court. And like him...very well. But I don't think he has noticed me.
F	MARY	I can't imagine. Should I mention you to him?
F	JANE	Would you?
F	MARY	Of course. Happily. A large dusty yard, where KNIGHTS train for combat, and practise
M	GEORGE	Not noticed her? Jane Parker? Of course I have. How could I not? She looks like a goat.
F	MARY	Well, she likes you, and asked me to give you this..to remember her by.
M	GEORGE	Ugh. Well say you haven't seen me. Or that you forgot. There is something about that woman that makes me feel...
F	MARY	And our sister? Any word?
M	GEORGE	ANNE? You know she took being upstaged by you very badly.
F	MARY	Yes, I know.
M	GEORGE	And no amount of interventions on my behalf would make her believe you hadn't done it intentionally.
F	MARY	But you KNOW I would never do anything like that.
M	GEORGE	I know.
M	GEORGE (cont'd)	Just give her time. She'll come round. MARY enters her room, and closes the door. She begins
M	HENRY (O.S.)	Please, don't be alarmed. ENRY I wanted to find somewhere we could be alone so I might say a few words to you in person.
M	HENRY	I hope your accommodation is comfortable. I realise it's no substitute for the life you had in mind in the country.. But please, give me the opportunity to try to make you happy here.. HE The moment I met you, I realised I..
M	HENRY	What are you..?
M	HENRY	I am sorry. You obviously misunderstand me. The DUKE of NORFOLK stares in disbelief at MARY. His dogs lie
M	NORFOLK	What? If all the King wanted was coition, he could fetch in a woman from the bath house. What he wants is YOU. To woo you. And be wooed in return. And could'nt you look just a little happier? There isn't a girl in the Kingdom that wouldn't wish to be in your shoes.
F	MARY	Your opinion, Uncle.
F	MARY	Mine is that it's the greatest insult of all.
M	ORFOLK	What?
F	MARY	Asking a whore to have feelings, too. An incense-filled Royal Chapel. The ARCHBISHOP is giving mass, Meanwhile, a remote country parish church. Far away. In the Royal chapel: the ARCHBISHOP solemnly performs the In the country church: The PRIEST's eyes become accustomed to
M	PRIEST	Are you there?
M	PRIEST	No one saw you?
F	ANNE	No.
M	PRIEST	You brought the money.
M	PRIEST	And the groom? Is he here?
M	RIEST	Good. Then let us begin. Back at court: the service ends. MARY lies in bed, in a room covered in flowers. She admires a
F	MARY	George? It's the middle of the night.
M	GEORGE	t's Anne.
F	MARY	hat?
M	GEORGE	he's married Henry Percy!
F	MARY	What?
M	GEORGE	In secret. Without telling anyone!
F	MARY	Oh, no...!
M	GEORGE	You don't look pleased.
F	MARY	Why would I be pleased?
M	GEORGE	It would make her the future Duchess of Northumberland. Our sister! But they'll never allow it, don't you see? He's already precontracted to Mary Talbot, and if word of the consummation gets out her reputation will be ruined..
F	MARY	...I have to tell Father. Before it's too late..
M	GEORGE	What?
M	GEORGE	Mary..! Wait! Come back! A FAMILY MEETING: ANNE and HENRY PERCY, (the HANDSOME YOUNG
M	SIR THOMAS	What were you thinking? The marriage of a senior noble is a matter of state. Something only the King can decide..
M	NORFOLK	Who knows about this?
F	ANNE	No one.
M	NORFOLK	Then that is how it shall remain. Forever.
F	ANNE	But you cannot undo what has been done before God. And consummated too.
M	NORFOLK	WHAT?
M	SIR THOMAS	There have been improper intimacies, too?
F	ANNE	I have lain with my husband. There is nothing improper about it..
M	NORFOLK	SILENCE! My God, if you were my daughter I'd thrash you within an inch of your life..
M	SIR THOMAS	The boy will return to Northumberland - where he will marry the Talbot girl. As arranged.
M	ORFOLK	As for you. You will go to France and stay there until you have learned your lesson.
F	MARY	What?
M	ORFOLK	How could you do this to your sister? You know full well her friendship with the King is at an extremely delicate stage. Any scandal or black mark against Mary's name now could be fatal.
M	NORFOLK	You will join the court of the French Queen. And stay there until your father has forgiven you. MARY paces anxiously in the corridor. Presently, ANNE emerges
F	ANNE	ou told them, didn't you? How COULD you?
F	MARY	Because you would never have got away with it. And it would have ruined your prospects forever. Believe me. I did it for your good.
F	ANNE	Really? For MY good? I'll try to remind myself of that. While I'm in exile. And you're here, in the King's bed, and unchallenged for our father's affection. That it was for MY good. Not yours.
F	MARY	ANNE, wait..! ANNE storms out. GEORGE shoots MARY a look, "I'll deal with A grand MASQUE BALL. We're in a spectacular candle-lit ballroom.
M	MASKED MAN	Why look so glum, Mary?
F	MARY	What reason have I to be happy?
M	MASKED MAN	ou have two men, the King of England and I, both fighting for your love.
F	MARY	Do I know you?
M	MASKED MAN	You know me, Mary - but not half as well as I know you. I know you better than anyone here. And love you better than anyone here, too. And if God had made ME your husband instead of William Carey, one thing I know.. I would never have let you go.
F	MARY	Wait! Who ARE you? M
M	ASKED MAN #2	Ah! Who have we here?!? M MARY My name is Kindness.
M	MASKED MAN #2	wonder, will you be kind to me?
F	MARY	What is it you desire?
M	MASKED MAN #2	our love, fair Lady.
F	MARY	You demand a great deal.
M	MASKED MAN #2	No more than I would give in return.
F	MARY	It is easy for a man to declare love from behind a mask.
M	ASKED MAN #2	ut if I remove it, you might reject me.
F	MARY	If your feelings were sincere, I would never reject you.
M	MASKED MAN #2	But you do not know who I am? I could be ugly. Or poor.
F	MARY	o matter how you looked. Or who you were.
M	MASKED MAN #2	Really? Then I shall hold you to your word. And unmask..!
F	MARY	Your Majesty..!
M	HENRY	he faints! Quick! Take her to my rooms! Call my physicians..! `Thump', the doors open, and MARY is carried into the King's
M	ENRY	Go! Leave us! Go!
F	MARY	Thank you, your Grace.
M	HENRY	`Henry', please. The first rule of this room, is to leave `Your Grace's' and `Your Majesty's' outside.
M	HENRY	Is there anything I can bring you?
F	MARY	No.
M	HENRY	Nothing to increase your comfort or well- being?
F	MARY	You might ask your servants to bring me some water.
M	HENRY	There. There ARE no servants.
F	MARY	So, this is it? This is where the King of England sleeps?
M	HENRY	And reads. And writes. And finds a few moments each day... ...for himself. You look surprised?
F	MARY	I am. I suppose it's more..
F	MARY	..simple than I imagined.
M	ENRY	There's no need for show. I am only ever here alone.
F	MARY	And yet you invite me here?
M	HENRY	Because I trust you.
F	MARY	You hardly know me.
M	HENRY	A man in my position develops an instinct. You would never lie, could never lie to me.
F	MARY	No.
M	HENRY	I also sense...that you might relish an opportunity to be yourself, too.
F	MARY	Yes.
M	HENRY	Well, here you only say what you like, do what you like. M MARY Very well.
F	MARY	I'd like an apple, please.. ..Henry.
F	MARY	Now it's your turn.
M	HENRY	What?
F	MARY	To say something, or do something you couldn't outside.
M	HENRY	There are many things I cannot admit to in public. Sadness, for example. And loneliness.
F	MARY	But when you are loved as much as you are? How can you be lonely? Do you not know what it is to be lonely in a marriage?
F	MARY	Yes. I do now.
M	ENRY	married my brother's widow because my father ordered it. As a duty. To keep the alliance with Spain. And she is a remarkable woman. And wife.
M	HENRY	But I never looked at her or longed for her the way I do you.
M	HENRY	Imagine how different it might have been. For both of us..had we been able to chose for ourselves.. HENRY and MARY, entwined in one another's arms, as the sun Several hours later:
M	TAFFORD	Good morning. S TAFFORD jumps to his feet. Waking rapidly..
M	STAFFORD	I have orders to bring you to your father.
F	MARY	Well, we'd better not keep him waiting. The DUKE of NORFOLK's dogs are eating breakfast out of bowls by
M	NORFOLK	Well..?
M	NORFOLK	Did he have you?
F	MARY	Yes.
M	NORFOLK	More than once?
M	NORFOLK	You'd better get used to talking about it. Once you sleep with the king, it's not a private matter any more.
F	MARY	Yes. More than once.
M	NORFOLK	So he was satisfied?
F	MARY	I believe so, Uncle.
M	NORFOLK	ood. This is where our work begins. It's one thing to catch the king. Quite another to keep him.
M	NORFOLK	I want you to keep her spotless, hair washed every day. She must read all the latest books and be able to venture and defend an interesting opinion. She must know her music, must be energetic and entertaining - in company and in bed. That's how he likes his women. And if ever she's in any doubt as to how to conduct herself, or what to do next - she should simply watch the Queen. That woman kept him from straying for eleven years. And the effort almost killed her. `Slap', HENRY spreads out a huge architect's drawing of a
M	HENRY	The biggest warship in the fleet. Thirty- two guns and two hundred feet long, and with your permission Thomas.. ..I'd like to name her after your daughter. The "Mary Boleyn".
M	SIR THOMAS	Majesty! I'm...I'm speechless..
M	HENRY	onsense. She's an angel. It's the least she deserves. And if there's anything else I can do for YOU, my friend..as an expression of my gratitude..let me know. S
M	SIR THOMAS	s it happens..there is one thing.
M	HENRY	Name it.
M	SIR THOMAS	ur son, George. He's of an age now..
M	HENRY	You want me to make him a match?
M	SIR THOMAS	Yes, your Majesty.
M	HENRY	Do you have anyone in mind?
M	SIR THOMAS	There is one lady, Sir..
M	HENRY	Go on..
M	SIR THOMAS	Who I fear is too high-born for us. And following the unfortunate matter between Anne and Henry Percy, I didn't want my children to overreach themselves again..
M	HENRY	verreach themselves?
M	HENRY	One is currently in the King's bed. If they are good enough for me, I suggest they're good enough for anyone else. So.. Who is it? Jane Parker..? GEORGE BOLEYN, visibly shocked and distressed, stands in front
M	EORGE	I beg you, Father. No.
M	SIR THOMAS	She's well connected, her father is cousin to the King. And there's money, too.
M	GEORGE	But must I actually...marry her?
M	SIR THOMAS	thought you had ambitions for this family. G EORGE I do.
M	SIR THOMAS	And that you wish to make a contribution yourself. Not just stand back and watch your sisters.
M	SIR THOMAS	Then my advice would be to start behaving like a man. A real man. Do I make myself clear?
M	GEORGE	Yes, Sir. MUSICIANS play. We're at GEORGE's wedding. Attended by the KING
M	SIR THOMAS	For God's sake, it's the wedding of our youngest child attended by the King of England and the greatest Lords in the Land. Would a smile be too much to ask?
