M	CHARACTER	DIALOGUE
F	BILLY	I don't care. Would you have drafted me in the first round?
M	PETER	What?
F	BILLY	After I left you ran me through your computer, right? Would you have drafted me in the first round?
M	PETER	You were a good baseball player.
F	BILLY	Would you have drafted me in the first round? PETER I'd have drafted you in the ninth round. No signing bonus. You'd have passed and gone to Stanford.
F	BILLY	Pack your suitcases.
M	PETER	Why?
F	BILLY	I just bought you from the Cleveland Indians.
F	BILLY	Good evening.
M	PETER	Good evening.
F	BILLY	I asked you to do three.
M	PETER	Yes.
F	BILLY	To evaluate three available players.
M	PETER	Yeah.
F	BILLY	And how many did you do?
M	PETER	51, I don't know why I lied just then.
F	BILLY	Talk me through the wall. PETER gets up and gives BILLY a tour of the dry erase
M	PETER	This is the American League West. This year we're going to need to win between 97 and 101 games to make the post season. Here's the number of runs we'll need to score in order to win those games and here's the number of runs we can allow.
F	BILLY	Let's make sure we're on the same page.
M	PETER	Okay.
F	BILLY	We're going to re-think baseball.
M	PETER	Yes.
F	BILLY	Look for an inefficiencies in statistics.
M	PETER	Examine the ways that runs are scored and prevented.
F	BILLY	Exploit the fact that unspectacular runs are just as valuable as 450-foot bombs.
M	PETER	Unspectacular runs are more valuable.
F	BILLY	Why? PETER/BILLY Because they cost less.
F	BILLY	We believe there's a river that hasn't been fished.
M	PETER	We know it for sure.
F	BILLY	And because players have been overlooked because they don't rise to the standards of traditional baseball thinking, we believe that in this river, there are fish...fish who-- Help me with--
M	PETER	Forget the fish. In this room is every available player at every level of professional baseball, and somewhere in that group are 25 players that everyone has else has thrown out. An island of misfit toys. In this room is a championship team that we can afford.
F	BILLY	Yes. But let me ask you this. If our theory is right--
M	PETER	Math isn't a theory. If it's right-- It's right.
F	BILLY	It sounds right.
M	PETER	It is right.
F	BILLY	If math isn't a theory-- It isn't.
F	BILLY	I'm gonna punch you in the kidneys if you don't let me finish a sentence.
M	PETER	Sorry.
F	BILLY	If this is right, why isn't everybody doing it? In fact, why isn't anybody doing it?
M	PETER	Somebody once said, "It's not what you don't know that worries me it's what you know for sure that's got me scared." In the mid-19th Century in Budapest there was an incredibly high instance of mothers dying shortly after childbirth from a disease called puerperal fever.
F	BILLY	Make this story less boring as soon as you can.
M	PETER	A doctor named Semmelweiss showed that if the attending physicians and nurses sterilized their hands before delivery, the mortality rate dropped to 1%.
F	BILLY	And he was vilified?
M	PETER	He was institutionalized. For suggesting that washing your hands before putting them inside someone else's body was a good idea. High functioning people can live under the spell of an inexplicable mental lapse when they think as a group. Why isn't anybody else doing it? Because they don't think guys who look like you are what win baseball games. They know it for sure. BILLY Alright, let's find our team.
F	BILLY	Nervous?
M	PETER	No??
F	BILLY	Huh. Interesting.
F	BILLY	Hey, Art.
M	ART	Can I talk to you a second before you get started.
F	BILLY	I got a lot to do.
M	ART	I know. Whatever it is, Billy knows it can't be as dire as his
M	ART	Who's the kid?
F	BILLY	That's Peter.
M	ART	I can't manage this team under a one-year contract.
F	BILLY	Sure you can.
M	ART	No I can't.
F	BILLY	I've got to put a team on the field, then I'll deal with your contract.
M	ART	How about you deal with the manager's contract and then put a team on the field?
F	BILLY	At the moment, if a ground ball is hit to first base, nobody's going to be there to stop it from rolling.
M	ART	I have to tell you it's not easy doing what I do under the cloud of a one-year contract.
F	BILLY	I know. I been there.
M	ART	I know you have. And a 1-year contract says the same thing to a manager as it does to a player: There's not a lot of faith there. Which is strange after a 102-win season.
F	BILLY	If you lose the last one of the season nobody gives a shit about the others.
M	ART	It's on me now?
F	BILLY	It's on me, Art! And the kid's the new assistant general manager. ART What the fuck are you about to do? BILLY doesn't answer the question, just walks into the-
M	GRADY	How did it go in Cleveland?
F	BILLY	It was cold.
M	GRADY	Let's get after our relief pitching problem.
F	BILLY	We got Chad Bradford. Right-hander.
M	GRADY	Submariner?
F	BILLY	That's the one. Technically an underhander.
M	GRADY	What's his velocity?
F	BILLY	Unimpressive.
M	ARTIE	About 85.
M	GRADY	Does he have a good breaking ball?
F	BILLY	Doesn't have one.
M	GRADY	Why do you like this guy?
F	BILLY	Well, he gets people out.
M	ARTIE	The left-hander hitters get a really good look at him.
M	GRADY	He's down there. He's down there real low, too.
F	BILLY	Let's move on.
M	GRADY	Well, we, I think, have fared better. We have some ideas for what to do about Giambi.
F	BILLY	Knock me down.
M	GRADY	We trade power for speed. A rabbit for a gorilla - We go for an overachiever. A big heart in the last year his contract. Tend to play hard. We usually get a pretty good year out of them. Make up for some of the offense we lost. Or the other option. Just a thought. We go for a high-maintenance guy. A guy that's a little difficult but talented. A guy like Milton Bradley. Well, not like Milton. Milton himself. Which do you want to talk about first?
F	BILLY	None of them. Grady looks like a man who can't take much more.
F	BILLY	You're still looking to replace him; you're just saying it another way.
M	BARRY	We got some trades here.
F	BILLY	We can't do it. What we can do is recreate his value to us in the aggregate. Giambi's on-base percentage was .477. Damon's was .324. And Olmeda's - bless his heart - was .291. Add that up and you get - He points to Peter.
M	PETER	You want me to speak?
F	BILLY	When I point at you, yes.
M	PETER	Ten-ninety-two.
F	BILLY	Divided by three -
M	PETER	Three-sixty-four.
F	BILLY	That's what we're looking for. And that's what we'll find. Three players whose average OBP is -
M	PETER	Three-sixty-four.
M	ARTIE	That doesn't come out right.
F	BILLY	You gotta carry the one.
M	ARTIE	Still don't look right.
F	BILLY	It's right. The others aren't sure what confuses them more - the
M	GRADY	Billy?
F	BILLY	Yes.
M	GRADY	Who's that?
F	BILLY	That's Peter. And that's all he's going to tell them about Peter.
M	GRADY	I don't know how to say this delicately - but does - Peter - need to be here?
F	BILLY	Yes.
M	POLONI	What's with this on base percentage obsession? Is that Bill James bullshit?
F	BILLY	You can call it Billy Beane bullshit for all I care. Billy takes a Marks-A-Lot, jots down three names on
F	BILLY	So here's who we want. One.
F	BILLY	Jason's little brother Jeremy.
M	BARRY	He never comes home from the games.
M	POLONI	Billy, if I may, he's had his problems on the field -- not to mention his problems off the field -- not to mention he's getting a little thick around the middle -- there's the stuff with the weed. He's at strip joints...
M	GRADY	This guy could start the year with an agent and end up with a parole officer for Christ's sake.
F	BILLY	His on-base percentage is all we're looking at now and he gets on base an awful lot for someone who only costs $285,000 a year.
M	GEORGE	He can't catch a ball in the outfield. I've seen him lose a ball in the moonlight. Billy puts up another name: DAVID JUSTICE.
F	BILLY	David Justice.
M	GRADY	Ten years ago he was a big name. He's going to really help our season tickets at the beginning of the year. But by June he's not going to be hitting his weight.
M	PITTARO	He's 36!
M	ARTIE	His legs are gone. He's a defensive liability. I question whether the bat speed is still there.
M	BARRY	Steinbrenner is so pissed at his decline he's willing to eat up half his contract to get rid of him.
F	BILLY	That's good.
M	HOPKINS	He's a fossil. With all due respect, bringing these three guys aboard is like putting bubble gum on a flat tire.
M	GRADY	And why do we want to be the ones to bail Justice out of his contract?
M	PETER	He gets on base.
M	GRADY	I got 37 free agents who are better than those guys.
F	BILLY	Scott Hatteberg.
M	POTE	Who?
F	BILLY	Exactly. Sounds like an Oakland A already. Yes, he's got a little damage in his elbow.
M	GRADY	Some damage? He can't throw.
F	BILLY	We're not interested in him for his arm anymore than we wanted Giambi for his.
M	GRADY	Wait, you're talkin' about Hatteberg at first?
F	BILLY	Yes. He's a career .260 hitter and the good part of his career is over.
F	BILLY	I say it's just starting.
M	PITTARO	Well, Billy, you'll like the sound of this... I hear Boston wants to cut him and no one wants to pick him up.
F	BILLY	That's good news for us. He's cheap.
M	GRADY	Let me understand this. At first base you want a guy who's been cut from half of the minor league teams in the country due to irreparable nerve damage?
F	BILLY	He can't hit and he can't field, but what can he do? Look at the piece of paper or I'm going to point at Peter. The SCOUTS consult their spreadsheets and then answer SCOUTS He can get--
F	BILLY	He can get on base.
M	POLONI	Alright, so he walks a lot.
F	BILLY	He gets on base a lot, Rocco. Do I care if it's a walk or a hit?
M	PETER	You do not.
M	POLONI	These three players, by your own admission, are defective in one way or another.
F	BILLY	Yeah.
M	GRADY	You want to replace Jason Giambi with not one but three defective players?
F	BILLY	You got it.
M	GRADY	Billy, we've all been busting our asses the last six and a half weeks to make this a better ball--
F	BILLY	Grady, it's not a discussion.
M	POTE	I think we're all losing sight of the fact that you're the general manager. You only have to answer to ownership and God.
F	BILLY	I didn't know God followed baseball.
M	POTE	I hope he does.
M	WASHINGTON	Billy, I just don't see it.
F	BILLY	That's okay, Wash. We won't be victimized by what we see anymore.
M	WASHINGTON	I understand what you're saying about their averages, but there's something you're forgetting. None of them plays first base.
F	BILLY	I haven't forgotten that, Wash. One of them is going to have to learn.
M	WASHINGTON	Learn.
F	BILLY	You're going to have to teach him.
M	WASHINGTON	Teach.
F	BILLY	Instruct.
M	WASHINGTON	Which one?
M	SCOTT	Hello? Scott?
M	SCOTT	Yes? It's Billy Beane. Oakland A's.
M	SCOTT	Yes? Can we talk?
M	SCOTT	Yes.
M	BILLY (VO)	You want to invite me in?
M	SCOTT	What?
M	BILLY (VO)	I'm outside. I can see you in the window. Honey?
F	BILLY	Thank you, ma'am.
M	WASHINGTON	Thank you, ma'am.
F	BILLY	You've played catcher your whole life?
M	SCOTT	Since I was 8. BILLY produces a baseball from his windbreaker and hands
F	BILLY	How's the elbow?
M	SCOTT	Good. Real good. It's great. I can't throw at all.
F	BILLY	Yeah, don't worry about it. You've thrown your last baseball from behind the plate. I want you at first. SCOTT is so thrown by this that all he can do is stare at
M	SCOTT	I've only ever played catcher.
F	BILLY	You're not a catcher anymore. If you were, then mine wouldn't have been the only call you got when your contract expired at midnight.
M	SCOTT	I appreciate it but--
F	BILLY	You're welcome. SCOTT
F	BILLY	You don't know how to play first base.
M	SCOTT	That's right.
F	BILLY	It's not that hard. Tell him, Wash.
M	WASHINGTON	It's incredibly hard!
F	BILLY	Anything worth doing is. Wash is gonna teach you.
M	SCOTT	Wait a minute, what about--
F	BILLY	Jason's gone, Scott. I'm taking Giambi's spot at first? What about the fans?
M	WASHINGTON	Yeah, maybe I can teach one of them.
F	BILLY	The fans don't run--
M	--GOOD ONE--	--the fans don't run my ball club.
M	SCOTT	They're gonna hate me.
M	WASHINGTON	No, they're gonna hate him.
F	BILLY	The fans love me.
M	WASHINGTON	Okay.
F	BILLY	Hello.
M	HATTEBERG'S DAUGHTER	Hi.
M	SCOTT	That's our youngest daughter.
F	BILLY	Great.
M	SCOTT	Do you have kids?
F	BILLY	--yeah, I have a daughter. This is a contract for you to play baseball with the Oakland A's. A copy's on its way to your agent. Discuss it with your wife and let us know. Thanks for the cookies, ma'am. We see ELIZABETH with tears running down her face...then You're welcome.
F	BILLY	Merry Christmas.
F	BILLY	Hi.
F	SHARON	Hi, Billy.
F	BILLY	She home?
F	SHARON	She's out, but she'll be home soon. Yeah, no, don't worry about it sweetie. Here's mom.
F	BILLY	Hey Alan.
M	ALAN	Come on in have a seat. Want some coconut water? It's really refreshing.
F	BILLY	I'm all set, thanks.
M	ALAN	What are you benching now?
F	BILLY	I don't keep count.
M	ALAN	Well, whatever it is, it's working. You look good.
M	ALAN	I haven't got to see you since the playoffs in New York. That was heartbreaking, Billy. We were rooting for you. BILLY Yep.
M	ALAN	You know what I say?
F	BILLY	Fuck `em. I'm sorry Alan, what do you say?
M	ALAN	No, I just wanted to say that a lot of teams don't get that far, and to make it that far is a really big accomplishment. So how is she?
F	SHARON	She's great. Be here in a minute. How's the team shaping up?
F	BILLY	New beginnings. Blue horizons.
M	ALAN	I read that you lost two players. Damon Ghee-ambi?
F	SHARON	Giambi. Wow, that's tough. That's really tough.
F	BILLY	And Isringhausen.
M	ALAN	Sounds tough.
F	BILLY	So where is she?
M	ALAN	I just talked to her on her cell. She's just coming up the hill, she's two minutes away.
F	BILLY	You bought her a cell phone?
F	SHARON	Yeah.
F	BILLY	At 12?
M	ALAN	Just for emergencies. I'm sorry, we should have consulted you for that
F	BILLY	It's probably a good idea.
F	SHARON	But actually I called you - The front door opens. It's Billy's daughter Casey - a pre-
F	BILLY	Let's go shopping.
F	BILLY	You want one with nylon strings, right?
F	CASEY	I like the red ones.
F	BILLY	How about this?
F	CASEY	Yeah, that's cool.
F	BILLY	Let's try it out over here. Casey.
F	CASEY	Yeah.
F	BILLY	You got good.
F	CASEY	I've just been playing a lot.
F	BILLY	That's... that's not the way most 12 year olds play.
F	CASEY	Alan thinks I should have a better teacher.
F	BILLY	Who's Alan?
F	BILLY	Oh, yeah. Mom's Alan. What's wrong with the teacher you have now?
F	CASEY	Alan thinks I should be working more on technique so I don't learn bad habits.
F	BILLY	Well, you seem to be doing just fine to me. Do you like playing?
F	CASEY	I love it.
F	BILLY	That's so great. I'm so happy for you. The most important thing in life is to find something you love and do it well. Do you like your teacher?
F	CASEY	Yeah.
F	BILLY	Okay, I'll talk to Mom and Alan. Do you like that guitar?
F	CASEY	Yes!
F	BILLY	That the one?
F	CASEY	Yeah, I think so.
F	BILLY	Let's get it. Let's get it now.
F	CASEY	Really?
F	BILLY	Merry Christmas. BILLY's at the plate, a batting helmet snug around his
M	UMPIRE	Striiike!
M	UMPIRE	Striiike! SHARON holds her head in her hands and BILLY walks back
M	ANNOUNCER V/O	...Billy Beane, who's quickly establishing a new record for breaking bats, bat racks and water coolers, was actually a much-touted first round pick of the New York Mets in 1980 but the majors have not been kind to him with only 18 plate appearances in two years and this won't doing anything to help him as... BILLY playing for the Minnesota Twins where he comes back
M	ANNOUNCER V/O	...one of two first round picks in 1980 along with Daryl Strawberry, Beane was brought up last year and sent back down after 8 at-bats so here's a second chance as Smith delivers... BILLY playing for the Minnesota Twins. He swings hard at
M	ANNOUNCER V/O	...If you're a real baseball fan with a good memory you might remember that Billy Beane was taken in the first round of the amateur draft back in 1980, separated from All-Star outfielder Daryl Strawberry by only 14 picks, so it just goes to show...
M	UMPIRE	Strike!
M	UMPIRE	Hey Billy, clean up after yourself.
M	PETER	How'd it go?
F	BILLY	How'd what go?
M	PETER	Hatteberg.
F	BILLY	He can barely hold a baseball. But he's our guy now. Billy sits.
F	BILLY	Who's that?
M	PETER	That is Kevin Youkilis. This is the guy we want more than anyone else in the world.
M	PETER	He can't run, throw or field. But he walks more than anyone in baseball except Barry Bonds. Take out intentional walks and it's more than Bonds. He's the Greek God of Walks.
M	PETER	I tried to get Shapiro to draft him last June. He said he waddled like a duck. Boston took him. Boston won't let him go yet. They're going to wait and see.
M	PETER	You all right, Billy?
M	GRADY O/S	Billy? Grady has appeared behind them at the door.
M	GRADY	Can we talk a minute?
F	BILLY	Yeah. Yeah.
M	GRADY	Your boy and I had a talk while you were in Tacoma. I didn't like much of what I heard.
F	BILLY	No?
M	GRADY	No. You got a kid in there with a Yale economics degree and a scout out here with 29 years baseball experience and you're listening to the wrong one.
F	BILLY	I don't listen to anyone, you know that.
M	GRADY	This isn't a joke.
F	BILLY	I'm not joking.
M	GRADY	This isn't how you run a ball club, with a computer. You know that. You're a baseball man. There are intangibles that only a scout can see in a player that you're not going to pick up with just numbers, with someone who doesn't play the game, who knows nothing about the game but how to feed numbers into a computer.
F	BILLY	That's what we're doing. That's exactly what we're doing.
M	GRADY	If this is what baseball is, if it's not Kirk Gibson going up to the plate on two bad legs because the manager felt in his heart that he had one swing left in that body... a computer wouldn't do that. They would have had him sitting up in the stands.
F	BILLY	A computer doesn't romanticize the sport. Leave that for the fans.
M	GRADY	Well, romance and the fans, it's called a love affair with the game and it's been going on for one hundred and fifty years.
F	BILLY	I don't want to hurt you love affair with the game. Just because we've been doing it one way for a hundred and fifty years doesn't mean we've been doing it right. You have any idea how long people thought the sun revolved around the earth? To your eyes it looks like that's what's happening.
M	GRADY	You're saying everybody's been wrong? Everybody? Beat.
M	GRADY	Are you saying everybody's been wrong?
F	BILLY	Yes. Maybe. Yes, and I've thought so my whole life. And now we're gonna see if I'm-- --we're gonna see if you're right?! This is about you and your shit? Some scouts from 20 years ago called it wrong, okay? They thought you were a ballplayer and you weren't. As you know, it happens. Don't take it out on--
F	BILLY	I'm not--taking it out on--
M	GRADY	I'm trying to help, okay, I'm saying--
F	BILLY	No, you're not saying anything to me right now. Grady, you don't have special powers. You don't have the ability to look at a guy and "just know" because you're a scout with special powers. I've watched you sit at kitchen tables for years and tell the parents of a 17 year old kid, "Trust me, when I know, I know, and when it comes to your son, I know" and you don't. We're shopping in a new store--full of complicated statistical analysis and equations and I get that it turns your world upside down but on base percentage-- our best chance to score on our budget isn't getting a 6'4" Adonis to the plate, it's getting a 5'10" washout who's already at first base. May I speak?
F	BILLY	Yes. Major League Baseball and its fans will be happy to hand you and Google Boy your heads if you keep doing what you're doing here, I don't give a shit about friendship this situation or the past. Major League Baseball thinks the way I think. You're not gonna win. And I'll give you a nickel's worth of free advice. You're making it impossible for yourself to get another job once Schott fires you after this catastrophic season you're setting us all up for and you're gonna have to explain to your wife and your kid why you're working at Dick's Sporting Goods.
F	BILLY	I'm not gonna fire you, Grady.
M	GRADY	Go fuck yourself, Billy.
F	BILLY	Well now maybe. BILLY stands there a moment. On his way out, passing
F	BILLY	Eric. You never even played high school ball, right?
F	BILLY	Grady's gone. You're the new Head Scout.
F	BILLY	Don't try to explain things to scouts. They're not programmed to get it. It's just us.
M	SPORTS REPORTER	Billy, will the fans still come out now that you've lost Giambi?
F	BILLY	I don't know, Graham. Will they listen to your insipid radio show? A poke off the bat sends Jeremy Giambi scrambling back
F	BILLY	Well, we didn't pay him for his defense.
F	BILLY	That's the way, Hatte. Pickin' Machine.
F	BILLY	None of those broke 85. They watch the second pitcher - the gentle-faced kid from
F	BILLY	Chad I have high hopes for. Bradford overthrows his first submarine hand-scraping-
F	BILLY	It just got away from him.
F	BILLY	He's still got it.
F	BILLY	It's the first day of week one. There's nothing to judge yet.
M	ART	I can judge it and so can you. First base is the moon to him.
F	BILLY	It wasn't to Giambi? He's the worst first baseman in baseball. What do you think of him, Wash?
M	WASHINGTON	The nicest way I can put it is, he lacks confidence.
F	BILLY	Work with him Wash.
M	WASHINGTON	I'll do that, Billy, but we've got Pena who can play first. And he's looking pretty good out there.
F	BILLY	I want to make it work with Hatte, Wash.
M	ART	Not to mention we already have a first baseman.
F	BILLY	A rookie first baseman. It's not the same.
M	ART	Number 11 on the Top 100 Prospects list.
F	BILLY	Lists aren't baseball.
M	ART	Catchers at first base aren't baseball. Who's idea was this? Peter's?
F	BILLY	Hatteberg will be fine, Art.
M	ART	He will be fine, you're right. Pinch hitting while Pena plays first base. LEGEND: April 1, 2002 - OPENING DAY IN THE LOCKER ROOM: Players prepare. Magnante puts on
M	MAGNANTE	Yeah... been doing it for way too long.
F	HATTEBERG	How long does it take?
M	MAGNANTE	When I first started these things? It was like a half hour process. Now I can knock these suckers out in 30 seconds, no problem. 36-year-old David Justice wanders past to a soda machine.
M	TEJADA	Is a dollar, mang.
M	JUSTICE	What?
M	TEJADA	Always been like that here.
M	JUSTICE	You're kidding me, right?
M	TEJADA	Welcome to Oakland.
M	CHAD	Excuse me, Mr. Beane.
F	BILLY	Hey Chad.
M	CHAD	I hope I'm not disturbing you.
F	BILLY	You're not, what's up?
M	CHAD	I wanted to say thanks for the opportunity.
F	BILLY	It's gonna work out well for both of us.
M	CHAD	Nobody in the major league ever took me seriously. BILLY Nobody?
M	CHAD	Just you, sir.
F	BILLY	Okay. It's a big day, you won't forget it.
M	CHAD	I'm going to pray for you and your family.
F	BILLY	Hey, great to see you. Thanks for coming out. Got a good box? You want a picture? Sure, let me step in there. Great, big smiles now. Big smiles. Know what I like about opening day? Everyone's even. Thank you. You all enjoy the game.
F	BILLY	Hey, how you guys doing. So you won? That's great. What position are you? How's your fastball? 92? Alright, should we get a pic? Billy and the Little League team pose with a giant
M	HOST #1 (FROM RADIO)	With the departure of head scout Grady Fuson and a roster that I'll describe as unusual, if not eccentric, you have to wonder what Billy Beane is thinking. BILLY catches a glance of ELIZABETH HATTEBERG taking her
F	ELIZABETH	Hi, I'm Elizabeth.
M	TARA	Hi. Tara. Which is yours?
F	ELIZABETH	Scott Hatteberg. Catcher - actually first base - actually we don't know. Yours? Mr. Beane? Tara nods.
F	ELIZABETH	He's a saint.
M	TARA	Really?
M	JOURNALIST	Are they picking up your option for next year?
M	ART	I brought it up to them during the off- season, and I still do not have my option.
M	JOURNALIST	Are you frustrated?
M	ART	I think it's fair to say that.
F	BILLY	Okay, good. I'm heading in.
M	PETER	Why?
F	BILLY	I don't watch the games.
M	PETER	Is this a joke?
F	BILLY	I don't know what you're miming.
M	PETER	I'm miming "You don't watch the games?!"
F	BILLY	This is my team. And they've taken the field. They're world class athletes who are fighting for their lives and I stand with them. Except not literally so I need you to text me what Art does.
F	BILLY	Yeah. I should have made you a bigger part of the conversation, I should have had you in the scout meetings from the first day, that way you would have understood this better and that was another mistake, I take full responsibility. What are you trying to say?
F	BILLY	It doesn't matter what moves I make if you don't play the team the way I need them played. ART You are out of your depth.
F	BILLY	Why wasn't Hatteberg at first?
M	ART	Because he can't play first.
F	BILLY	How do you know?
M	ART	Not my first baseball game.
M	ART	Scott Hatteberg can't hit.
F	BILLY	He gets on-- And his defense--
F	BILLY	Still keeps us in the plus column and we only need to be 7 over 500.
M	ART	Anything else?
F	BILLY	Yeah, I would have rather seen Chad Bradford in there at the end than Magnante.
F	BILLY	I don't care about righty/lefty.
M	ART	I do.
F	BILLY	This is about your contract?
M	ART	No, you've made it clear what you think about that. This is about you doing your job and me doing mine. Mine's being left alone to manage the beer league team you assembled for me.
F	BILLY	I didn't assemble them for you, I assembled them for me.
M	ART	No shit.
F	BILLY	I want you to go on the road with the team.
M	PETER	You don't go on the road with the team.
F	BILLY	That's why I want you to do it.
M	PETER	Why don't you?
F	BILLY	I don't want to develop personal relationships. I need to trade them, send them down and sometimes cut them. You should learn how to do that by the way.
M	PETER	The only way I'd have to cut a player is if you oh come on!
F	BILLY	Yeah, let's practice.
M	PETER	No.
F	BILLY	I'm a player, cut me from the roster.
M	PETER	No. Do it.
M	PETER	This is stupid.
F	BILLY	Man-up, Yale.
