M	CHARACTER	DIALOGUE
M	PETER	Fine. Billy, would you have a seat for a moment, I need to talk to you.
F	BILLY	I'm already sitting.
M	PETER	I was pretending you weren't sitting.
F	BILLY	But I am. Keep going.
M	PETER	This is the hardest thing there is to do in baseball.
F	BILLY	You got that from Bull Durham?
M	PETER	Yeah. Hitting a curve ball is the hardest thing there is to do in baseball but go ahead.
M	PETER	You've been a huge part of this team but decisions have to be made that are best for the team, I'm sure you can understand that.
F	BILLY	You're cutting me?
M	PETER	I'm really sorry.
F	BILLY	I just bought a house here. Well...
F	BILLY	Well? That's all you have to say? My kids just started at a new school, they made friends.
M	PETER	That's--I'd leave them in school, you don't want to take them out in the middle What the hell are you doing?
M	PETER	Are you you or the player?
F	BILLY	I'm me. You're talking about kids and schools and you should've been out of the room three minutes ago.
M	PETER	Shouldn't I tell them that they'll always be a part of the A's family?
F	BILLY	That makes me feel so good I'm thinking of burning your house down with you in it. These are professional baseball players. You just do it. "Peter, I need to let you go. Jack's office'll handle the paperwork." That's it?
F	BILLY	Would you rather get one bullet in the head or five in the chest and bleed to death?
M	PETER	Those are my only choices?
F	BILLY	Go on the road with the team.
M	DAVID	How come your boss doesn't travel with the team?
M	PETER	He doesn't like to mingle with the players.
M	DAVID	Makes us easier to cut?
M	DAVID	He's gonna make some moves if we keep losing. PETER gives a small "Yeah" shrug... How come soda costs a dollar in the clubhouse?
M	PETER	Billy likes to keep the money on the field.
M	DAVID	Soda money?
M	DAVID	Where on the field is the dollar I pay for soda? It's hard to see.
M	DAVID	Alright.
M	TV ANNOUNCER V/O	The A's begin their first road trip of the season having dropped 7 of their first 11 games at home and their schedule doesn't get any easier from here. If there's a bright spot it's rookie first baseman Carlos Pena. With the A's getting off to a miserable start/13 of their last 20/17 of their last 25/etc...
M	PASSENGER	Hey, aren't you Billy Beane?
F	BILLY	Yeah.
M	PASSENGER	Shouldn't you be at the game?
F	BILLY	Nope.
F	CASEY	Hey, Dad.
F	BILLY	Hey, honey... I'm glad to see you.
M	PETER	It's not a big enough sample yet. I want to wait until we play more games.
M	TV ANNOUNCER	And Justice hits into the 6-4-3 double play to end the game... The INDIANS trot on the field to high-five each other.
F	BILLY	Do you want strawberry or vanilla?
F	CASEY	Both.
F	BILLY	Don't tell your mother. If you could only have one ice cream for the rest of your life, which would you choose?
F	CASEY	Vanilla. Definitely vanilla.
F	BILLY	Interesting. Chocolate sauce?
F	CASEY	Yup. A beat. Then --
F	CASEY	Dad... if you could choose between the power of invisibility or flight, which would you choose?
F	BILLY	Flight. Yeah, I'd wanna fly. You?
F	CASEY	I think I'd want invisibility.
F	BILLY	Really? Why?
F	CASEY	I don't know. People wouldn't notice me as much.
F	BILLY	Why wouldn't you want people to notice you?
F	CASEY	I don't know.
F	BILLY	Well, I guess you could sneak up on people. Or eavesdrop on their conversations. You could be a spy. So how's school?
F	CASEY	My teacher's kinda mean. She doesn't like us to ask questions.
F	BILLY	What kind of teacher doesn't let you ask questions?
F	CASEY	I know, right? Mom was mad, too. She thinks maybe I should be home schooled.
F	BILLY	Wouldn't you miss your friends?
F	CASEY	Yeah. But the other kids are mean.
F	BILLY	There are always going to be bullies. Try not to let them get to you. But let me know if it's becoming a problem.
F	CASEY	Can I ask you a question? Are you still chewing tobacco?
F	BILLY	Yeah...
F	CASEY	Please stop.
F	BILLY	I know, it's terrible. Look, I promise I'll quit in November if you promise not to worry about it.
F	CASEY	Pinkie swear?
F	BILLY	Pinkie swear.
M	PETER	Theoretically, when we've played more games the numbers will become more
F	BILLY	Theoretically?
F	BILLY	Alright. Be good.
F	CASEY	Okay. Billy's Blackberry chimes. He ignores it. I feel like-- CASEY You feel like what? I don't know, did we talk enough this time?
F	CASEY	About what?
F	BILLY	Anything. Did we talk about the things you want to talk about, did we have fun? Yeah!? Okay.
F	CASEY	I love you, Dad.
F	BILLY	You're doing it right now.
F	CASEY	What?
F	BILLY	You're worrying about me.
F	CASEY	Sorry.
F	BILLY	Do I look like I'm worried?
F	CASEY	Yeah.
F	BILLY	`Cause you're getting on an airplane and those things crash all the time. Will you please stop worrying about your father? You're a kid, I can't have it.
F	CASEY	Okay. Can I worry about the airplane now though?
F	BILLY	Absolutely.
M	FLIGHT ATTENDANT	We're all set.
F	BILLY	Great.
F	BILLY	I love you. BILLY watches her go off with the attendant, feeling like 3-2. Magnante in. No! WHY IS HE IN THERE?!
F	BILLY	No no. I'm alright. Billy drives around the lot like a downhill skier with
M	ANNOUNCER	Art Howe is the only manager in baseball who has to think about pinch running his leadoff hitter. Down in the Visitors' pen, Chad sits with Mike Magnante.
M	MAGNANTE	Why do you do it?
M	CHAD	I can't not do it.
M	MAGNANTE	How do you do it? Every ball park's different.
M	CHAD	I take that into account and adjust the distance of my steps.
M	MAGNANTE	Exactly seventy-four, from the pen to the mound. You should get that looked at, man.
M	REPORTER V/O	-- after Sunday's 11-0 rout. Now, having dropped 13 of 16, the A's are a game away from being swept at home by the AL East last place Baltimore Orioles.
F	BILLY	Steve.
M	SCHOTT	Billy.
F	BILLY	You remember Peter.
M	SCHOTT	Peter. Guys, give me some idea of what's going on out there.
F	BILLY	Listen, it's a team of probabilities, and we're gonna need 162 games to tell that tale in a nascent form. It's phase one, we're evolving and we feel confident where we're heading.
F	BILLY	We're not scared.
M	SCHOTT	3 out of 17 games. 3. We're getting crucified in the press. What makes you think this is gonna turn around?
F	BILLY	Because I believe in what we're doing. I believe the numbers. I believe the record doesn't accurately reflect the team and where we're going to be at the end of the season. Peter and I feel very strongly that we need to stick to the game plan, and you can tell your partners to start booking their tickets to the playoffs.
M	SCHOTT	Billy, look, you've got guys who are nearly crippled, who couldn't get hired as an usher in a ballpark now playing on the team. Give me something I can go back to these guys with and feel like I have the confidence that you're gonna turn these things around.
F	BILLY	With all due respect you asked me to build a team with shoelaces and gum wrappers and we've done it.
M	SCHOTT	You haven't done it yet billy.
F	BILLY	And it will pay off. Stick with us. Suffer the blows. Listen, life with no money means we're gonna have to suffer a few embarrassments along the way, but we are okay in the end.
M	SCHOTT	Billy, there's a lot of money at stake here. And a lot of people with vested interest in seeing this be successful. I've given you a lot of flexibility. When are we gonna start to see a change in these results? Schott sits back at his desk.
M	SCHOTT	Give me a date, give me a time frame. Where do we expect to be mid July All Star break?
M	PETER	Our goal and our expectation by the All Star break is to be within seven games of first place.
F	BILLY	That'll keep us in the hunt.
M	PETER	And that would be this working exceptionally well.
M	SCHOTT	7 within 500. By July. And what's going to keep us from getting there?
F	BILLY	Nothing Steve.
M	SCHOTT	Nothing. We're 3 for 17 right now. You've got to be able to give me a little bit more to go back to my partners with.
F	BILLY	Listen, you hired me to do this job and that's where we're going to be.
M	SCHOTT	That's not good enough.
F	BILLY	Well, let's go buy Barry Bonds, then. This is the team we've got and this is the team we'll win with.
M	SCHOTT	Billy, put yourself in my shoes. What do you imagine is going to happen if things don't turn around?
F	BILLY	It's very clear, Steve. If I put myself in your shoes, I'd spend another 20 million on the team.
M	SCHOTT	We don't have another 20 million
F	BILLY	I'm just kidding, Steve, I'm just kidding. We've got the team.
M	SCHOTT	I gotta be honest with you, Billy, I wish you had a little more worry and a little more fear. Because things aren't going in our direction right now. 162 games Steve.
M	SCHOTT	Let's hope the next 30 are better than the last 30.
F	BILLY	I don't need to hope.
M	SCHOTT	All right fellas. Let's go try and win one. We're in May, we've got til July. LEGEND: May 23, 2002
F	BILLY	We're not gonna lose three at home to the Orioles. I want Dye in right, Justice DH-ing, Pena on the bench, Hatteberg at first and anyone but Magnante first out of the pen.
M	ART	You want Pena on the bench?
F	BILLY	That's right. So that you can play Hatteberg.
M	ART	Hatte - as opposed to the guy who's going to win Rookie of the Year.
F	BILLY	No, Hatte - as opposed to the guy who gets on base less. Pena getting voted Rookie of the Year and the A's making the playoffs are two entirely different--
M	ART	Pena's not just the best first baseman on the roster, he's the only first baseman on the roster and the most valuable member on this team.
F	BILLY	Not according to, what do you call `em, facts.
F	BILLY	Listen to me--gets on base more than Pena. 25% more.
F	BILLY	His fielding doesn't matter.
M	ART	It does matter and Pena only has one error in 70 games.
F	BILLY	Not only is that number statistically insignificant but it's also subjective. It measures what someone did against what someone else thought they were supposed to do.
M	ART	Part of the conversation? I've heard enough of the conversation and I disagree with you, plain and simple. Moreover, I strongly believe that you're in the middle of experiencing some sort of personal crisis and you seem indifferent to the fact that you're taking a whole organization down with you. I'm playing my team in a way I can explain in job interviews this winter.
F	BILLY	Hatte, not Pena.
M	ART	It's just one game.
F	BILLY	That's the point, you think?
M	ART	The point is always tomorrow's game.
F	BILLY	No, the point - as you said - is to win. I don't like sharing the cellar with Texas, do you?
M	ART	I'm doing the best I can with what I've got. I'm playing the players I've got.
F	BILLY	I'm through talking.
M	JEREMY	Yeah! He's not even aware of Billy. It's just like any other What?
F	BILLY	Getting swept by the Red Sox at home. Having Long lead off the ninth with a triple in a one-run game and not being able to score a runner from first with nobody out, is that fun?
M	JEREMY	No.
F	BILLY	Then what the fuck are you having fun for?! This is what losing sounds like. He heads out.
M	PETER V/O	...point 3-5 below the AL average field which isn't bad. Billy?
F	BILLY	Yeah?
M	PETER	Cruz -- .283, .347, .476. Stevens -- .244, .349, .560. Miner -- .272, .349, .499. Hanson -- .280, .363, .450. Baretta -- .273, .354, .497. Durazo -- .292, .395, .621. What do you think? Billy? I don't know where I am.
M	PETER	You okay? I missed my exit. Have you thought about what you might do if baseball doesn't work out? What?
F	SHARON	That was too abrupt.
F	BILLY	No. What? If baseball doesn't work out. Have you thought about what you might do? The game's only been over for three hours, I haven't had that much time to think about it.
F	SHARON	Sure. Maybe real estate.
F	BILLY	I'll be honest, if I don't make it in baseball I don't think I'm going to be able to afford much real estate.
F	BILLY	I know what you meant. SHARON It's just a slump, right? No.
F	SHARON	You're saying every scout was wrong?
F	BILLY	You're kind of saying it too.
F	BILLY	Honey...don't you think you should divorce me now while you're young? When a science experiment fails in a lab, things blow up.
F	BILLY	Get me Wade.
M	PETER	Why.
F	BILLY	Get him.
M	PETER	Why.
F	BILLY	Get him.
M	WADE V/O	Hello?
F	BILLY	Ed. Billy. I need some help on defense and I'm willing to trade Jeremy Giambi for it.
M	PETER	No, you (aren't) -
F	BILLY	Who you got?
M	WADE V/O	Let me think.
M	PETER	What are you doing? Jeremy's doing
F	BILLY	Cleaning house.
M	WADE V/O	Maybe?
F	BILLY	Maybe what?
M	WADE V/O	No. Mabry.
F	BILLY	Hang on. Mabry?
M	PETER	I don't know.
F	BILLY	Yes, you do.
M	PETER	Runs hot and cold, Billy. Impossible to know what we're going to get. He's a crap shoot. He's exactly the kind of player we're not looking for.
F	BILLY	He'll be fine, Ed.
M	WADE V/O	Why do I get the feeling you're picking my pocket?
F	BILLY	I'm not picking your pocket, you're picking mine. Giambi's name alone is worth more than Mabry.
M	WADE V/O	You realize - I do. His career is stagnant, to put it nicely. Can we say it's done in theory and start drawing up paperwork?
M	WADE V/O	Okay. But -
F	BILLY	Great. He hangs up.
M	PETER	I think he was going to say something else.
F	BILLY	Peter. Rule Number 3: When you get the answer you're looking for - hang up. That's done, and in a minute Pena's going to Detroit.
M	PETER	I don't think you want to do that.
F	BILLY	Art can't put him at first if he's playing for the Tigers and I want Hatte in the lineup tonight.
M	PETER	Maybe you should think about this. You're upset and this is - this -
F	BILLY	What am I missing?
M	PETER	It's just a very hard move to explain. People are going to think you've lost your mind.
F	BILLY	Why's that a problem Peter? Beat.
M	PETER	Don't make an emotional decision Billy.
F	SUZANNE	David Dombrowski's on 3. Billy picks up the call. Sometimes you have to shake it up. David, Peña's going on the blocks, you're my first call... because he's making the rest of the team look bad... He's going to be rookie of the year...
M	PETER	Probably an all star.
F	BILLY	He's an all star Dave... It's more like he's creating self-esteem problems for the other guys... No, I'm looking for a reliever and some cash... Ok... five minutes Dave, I'm not waiting. What's the problem?
M	PETER	Billy, Peña is an all star. If you dump him, and if Hatte doesn't work out, you know, this is the kind of decision that gets you fired.
F	BILLY	Why you worrying about my job? You worried about my job or yours? I'm worried about yours.
F	BILLY	Well you should be worrying about yours because if this thing we're doing don't work... neither of us have jobs.
M	PETER	That's probably true.
F	BILLY	In which case I'm a 44 year old guy with a high-school diploma and a daughter who I'd like to be able to put through college one day. You're 25 years old with a degree from Yale and a pretty impressive apprenticeship. I don't think we're asking the right question. I think the question we're supposed to be asking now is, do you believe in what we're doing or not? It's a problem that you think we need to explain ourselves. Don't... to anyone. I'm going to see this through, for better or for worse. Just tell me, do you project we'll win more games with Peña or Hatteberg on first?
M	PETER	It's close Billy but theoretically Hatteberg.
F	BILLY	What are we talking about then?
F	BILLY	Dave. That works. Great. There's just one more thing I need. I don't want the guys paying for soda--I want you to stock my soda machine for three years. Uh huh, uh huh, great... then that's a deal. Billy hangs up. He stares at Peter.
M	PETER	That was thoughtful.
F	BILLY	Yeah. Okay. You gotta tell Pena to pack.
M	PETER	You want me to tell Pena he's been traded?
F	BILLY	Be a man.
M	PETER	What about Jeremy? Am I telling him, too.
F	BILLY	No. I'll do that.
M	PETER	Hey, Carlos.
M	PENA	Yeah.
M	PETER	Can I get a moment with you?
M	PENA	Sure.
M	PETER	Okay, maybe we can talk over here.
M	PETER	Have a seat. They sit.
M	PETER	So, um, Carlos, you've been traded to the Tigers. This is the number of Jay Palmer, their travel secretary. He's expecting your call. He'll help you arrange travel to Detroit.
M	PENA	Is that all?
M	PETER	Yeah.
M	PENA	Cool.
F	BILLY	Mind if I have a seat.
M	ART	Please.
F	BILLY	You can't start Pena at first tonight, you'll have to start Hatteberg.
M	ART	I don't want to go 15 rounds, Billy, the line-up card is mine and that's all.
F	BILLY	The line-up card is definitely yours, I'm just saying you can't start Pena at first.
M	ART	I am starting Pena at first.
F	BILLY	I don't think so, he plays for the Detroit Tigers now. You traded Pena?!
F	BILLY	Along with German, Hiljus and Jeremy Giambi.
M	ART	You are outside your fucking mind.
F	BILLY	Jeremy, come on in.
F	BILLY	This is Ed Wade's number. You know him?
M	JEREMY	No.
F	BILLY	Phillies General Manager. Real nice guy. Give him a call - he's expecting it - say hello - then talk to Futterman about arranging a flight for you.
M	JEREMY	The what?
F	BILLY	The flight. To Philadelphia. Billy gets up and shakes his hand.
F	BILLY	It's been a real pleasure, Jeremy. I mean that. You're a great ballplayer and great guy.
F	BILLY	We're going to miss you.
F	BILLY	Adkins is gone, too.
M	ART	You're killing this team.
F	BILLY	Art? I can do this all day long.
M	ART	What are you looking at?
M	PETER	I'm not looking at anything.
M	ART	You went along with this? You agree with this bullshit? PETER A hundred percent.
M	TEJADA	Keep your head up, okay? It's part of the business. You're gonna be a great player, okay?
M	PENA	Thank you, man.
M	TEJADA	Don't let this bother you at all.
M	CHAD	Nice to meet you, brother. Take care and... God bless you, man.
M	PENA	Thank you.
M	Scott Hatteberg --	You're the best first baseman here. It's not right, Carlos.
M	PENA	Thank you, Hattie.
F	HATTEBERG	Yeah. The place quiets down as BILLY comes in. They've all Scottie H.!
M	SCOTT	Yes sir.
F	BILLY	Go out and field some grounders.
F	BILLY	Everybody, listen up. You may not look like a winning ball team. In fact, you look nothing like a winning ball team. But you are one. So play like one tonight. You'll get further instructions tomorrow.
F	BILLY	Okay.
F	BILLY	No more bunts.
M	CHAVEZ	No more bunts?
F	BILLY	A bunt is an out. You're paid to avoid outs, not make them.
M	CHAVEZ	A bunt isn't an out. It's a sacrifice.
F	BILLY	A bunt is for pitchers and weak hitters. You're not a pitcher, Chavvie, so what are you saying? Until the third out, anything can happen. After the third out, it's over. You gotta protect your outs like they're your children. Every out's precious, don't give `em away. Another thing -- you should see more pitches. We wanna get into their bullpen. Deep into their bullpen. We want to see 100 pitches by the end of the 5th inning. You wanna get your at-bats off their 10th and 11th pitcher.
M	ELLIS	You want us to walk more. How much more?
F	BILLY	Pete?
M	PETER	At least once every ten at bats.
M	ELLIS	Or...?
F	BILLY	Triple-A Sacramento's only 80 miles away. And there's no flights. Don't look at him. Here's the deal. I'm not interested in what you think you know about baseball, or what you think I don't know about it. I'm not interested in guts or heart or determination or anything else the fans or your mothers love about you. I'm interested in you getting on base. If you do that, we win. If you don't, we lose. And I hate to lose. I hate to lose more than I need to win. There's a difference.
M	PETER	Every at bat is like a hand of blackjack. Every card that's dealt, your odds completely change. For instance, every first pitch strike, your batting average goes down about 75 points.
F	BILLY	75 points.
M	PETER	75 points. Every first pitch ball, it goes up about the same amount. So you gotta lay off the first pitch. First pitch curveball or first pitch fastball?
M	PETER	First pitch period. When you swing at the first pitch you're batting .140.
F	BILLY	We want to see more pitches.
M	DYE	How many pitches?
M	PETER	Every starter, we want to see 100 pitches by the 5th inning.
M	DYE	So... 5, 6 pitches per at bat?
M	PETER	Yeah. I mean, Hatteberg drained 38 pitches.
F	BILLY	And Byrnsie, you're hackin' at everything. You're all squirrely out there. Wait for your pitch, man. This is a war of attrition. There's no clock on this thing. Wait `em out. Let them make the mistakes. And when your enemy's making mistakes -- don't interrupt them.
M	PETER	Basically, these are all your at bats. This is you versus righties, you versus lefties... and then, of course, all your count knowledge, okay? In an 0-0 count you're batting .290. In an 0-1 you average .238. In a 0-2, .159. When you're 1-0, you're batting .324. Understand what I'm saying?
M	DURHAM	Not really.
M	PETER	I know, it's a lot of math. When your first pitch is a strike, your batting average goes down about 70 points. When it's a ball, it goes up about 30. If you draw a ball on your first pitch, you're unstoppable. If you strike on the first pitch, you might as well be jumping off cliff. I'm trying to get you to lay off the first pitch.
M	DURHAM	But I'm a first pitch hitter. I like to swing at fastballs.
M	PETER	And that's the way you've been trained. But it's a habit we'd like to break you from. We're trying to design the game to your strengths. This has nothing to do with you being a great hitter -- you're a great hitter. We just want to get you on base.
M	DURHAM	But if I get my pitch, I'm gonna swing at it, no matter what the count is.
M	PETER	I'm not worried about you crushing the ball out of the park. I just want you to lay off anything that will result in a strike.
M	DURHAM	I guess I'll have to watch some film and take a look at it.
M	PETER	Absolutely. The video room is open to you any time, I'm always available.
M	PETER	-- But seriously. Make him use up all his bullets.
F	BILLY	Yeah, make him work.
F	HATTEBERG	So... Mr. Beane?
F	BILLY	Billy's fine.
F	BILLY	Nah, make it Mr. Beane.
F	HATTEBERG	Mr. Beane --
F	BILLY	I'm screwin' with you, Haddie.
F	HATTEBERG	So we just don't steal?
F	BILLY	That's right.
M	LONG	That's what I do. That's what you pay me to do.
F	BILLY	No, I pay you to get on first, not get thrown out at second.
M	LONG	I don't get thrown out much.
F	BILLY	I don't hit on 17 at the blackjack table, but if I did, the odds would be the same.
M	PETER	You've actually gotten caught 6 out of 17 tries this season.
M	LONG	I get 11 of 17. That's not bad.
F	BILLY	You just handed them an out. Protect your outs like they're your children. There's no clock on this game. Until the third out, anything can happen. Get on base and let the next guy move you up. Pass the torch, pass the torch. We're like a machine. A run making machine. What's your biggest fear? A baseball being hit in my general direction.
M	JUSTICE	That's funny. No, seriously.
M	SCOTT	Seriously.
F	BILLY	Hey, Dave. I've been thinking... I want you to --
M	JUSTICE	You gonna teach me something?
F	BILLY	Excuse me?
M	JUSTICE	I've never seen a GM talk to players.
F	BILLY	You've never seen a GM who was a player.
M	JUSTICE	Huh.
F	BILLY	Is there a problem?
M	JUSTICE	It's okay, man. I know your routine. It's a patter, it's rap, it's for effect. That's okay. But it's for them, it's not for me.
F	BILLY	You're special?
M	JUSTICE	You're paying me 7 million bucks so I guess I am a little.
F	BILLY	As a matter of fact I'm not paying you 7 million bucks, David. The Yankees are paying half your salary. That's what the New York Yankees think of you. They're paying you three and a half million dollars to play against them.
M	JUSTICE	Where are you going with this, Billy?
F	BILLY	You're almost 37, Dave. Almost as old as me. Let's be honest with each other about what we each want. I want to milk the last ounce of baseball you have left in you, and you want to stay in the show. So let's do that. I'm not paying you to be the player you used to be, I'm paying you to be the player you are now. You're smart, you know what's going on here. I need you to set an example for the younger guys. Take a leadership role.
F	BILLY	We're cool?
M	JUSTICE	We're cool.
F	BILLY	All right. Billy starts to leave, but has one last thought for him --
F	BILLY	You know -- the Yankees are coming to town. If it were me -- I'd want to take that three point five and shove it up their ass. But I'm a competitor.
M	JUSTICE	You know, I got a couple World Series rings. I think I'm a pretty good competitor, too. You want another one?
M	ANNOUNCER (VO)	Tejada taking a big lead off first, eyeing the steal--
F	BILLY	Don't do it, Migs.
F	BILLY	Thank you.
M	GREG PAPA OR RAY FOSSE (TV)	What is happening in Oakland?!! The A's have won seven in a row and 15 of their last 19. You got to hand it to Art Howe. He's managing this unorthodox team in an unorthodox way. They are not bunting. They are not stealing. They are just winning. And Art Howe is the reason.
M	PETER	Did you hear that?
F	BILLY	I heard 7 in a row. Billy clicks off the TV and it's very quiet. Billy is
F	BILLY	Can you show me righty-lefty matchups for the division and overall versus Mariners?
F	BILLY	Okay. He gets up and heads out.
F	BILLY	Voos.
M	VOOS	Billy.
F	BILLY	That smell is getting worse.
M	VOOS	I'm on it, Billy. BILLY What are we doing tonight?
M	HERNANDEZ	Splitting the plate in half.
F	BILLY	Both sides. Huddy, you gotta mix it up tonight. Trust your slider.
M	HUDSON	Yes sir.
F	BILLY	You guys stop distracting him. Chavvie -- you couldn't hit that shit with a boat paddle last night. You gotta see more pitches. Patience.
M	CHAVEZ	You got it, Billy. Hey David --
M	JUSTICE	Hey, man.
F	BILLY	Great at bats. Really. Quality.
M	JUSTICE	Thank you. ART can see BILLY through the window blinds and is a
M	ART	Come in. BILLY does. He's going to try to do this nicely.
F	BILLY	How are ya?
M	ART	Good. You knocked.
F	BILLY	I did, and I hope you take it as a show of respect.
M	ART	We'll see.
F	BILLY	You look good.
M	ART	We've won 7 in a row, what am I doing wrong now?
F	BILLY	Absolutely nothing.
M	ART	Good.
F	BILLY	But.
M	ART	Yeah.
F	BILLY	Magnante's having some head problems.
M	ART	Head problems.
F	BILLY	Yeah.
M	ART	Okay.
