M	CHARACTER	DIALOGUE
F	GRAHAM	No. That'll do for now. Thank you. He hands over some money, and Pravesh pedals away.
M	GRAHAM (CONT'D)	Excuse me. There used to be
M	SANJAY	All knocked down.
F	GRAHAM	And the people? The families?
M	SANJAY	They move. Graham nods, turns to look at the giant structure that has
F	GRAHAM	Don't grip so tightly with your right hand. Sanjay looks puzzled.
M	GRAHAM (CONT'D)	On the bat. The right is just a guide. Keep your left elbow high, play down the line of your arm, and then you'll hit through
M	THE BALL	Sanjay looks at him, squinting in the sun.
F	MURIEL	When can I go back to England?
M	AJIT	As soon as you can walk onto the plane. How does the hip feel?
F	MURIEL	They must have got lucky.
M	AJIT	It's strange. I think the more operations they perform, the luckier they get. He glances down at Muriel, who betrays no signof getting She pushes her way through the crowded market. As she tries to find her way out, she becomes aware that Evelyn tries to suppress her panic, turning from one face
F	EVELYN	I'm so sorry. I didn't realise - She backs into a kind of flatbed trolley, piled high with Oh, I'm dreadfully sorry... A man is staring at her: SURESH.
M	SURESH	Yes.
M	EVELYN (CONT'D)	I'm sorry, I'm just trying to get to this address.
M	SURESH	Yes.
F	EVELYN	Do you understand me? Can you help me find this place?
M	SURESH	Yes.
F	EVELYN	Is that yes you understand, or yes you can help me?
M	SURESH	Yes. Some of the children who have gathered laugh at this, and
F	EVELYN	Let's go with both, shall we? A boy runs off to fetch the ball. Graham half-runs, half- It's hot and he's tired, but he hasn't felt this good for
M	SANJAY	Give me the ball. I can take him. He turns cheerily to Graham.
M	SANJAY (CONT'D)	Down is where you're going, Uncle.
F	GRAHAM	Come on. Do your worst. They're both enjoying the banter, as Sanjay heads back to As Graham watches Sanjay running towards him, Sanjay seems Graham steps back, completely fails to play a stroke, and
M	SANJAY	That's what I'm talking about! I felt the need, the need for - Graham still hasn't moved.
M	SANJAY (CONT'D)	Are you alright, Uncle? Graham finds his voice at last.
F	GRAHAM	Yes. Yes, I'm fine.
M	SURESH	Yes. Suresh helps Evelyn down off the back.
F	EVELYN	Thank you.
M	SURESH	Yes.
F	EVELYN	This is it?
M	SURESH	Yes.
F	EVELYN	Then thank you. You're very kind.
M	SURESH	Yes. He rides off. Evelyn looks nervously up at the building.
M	TELEMARKETERS	Thank you for talking to us today We do appreciate your call while I have you on the phone, can I talk to you about our special offers . your call is important to us . now is there anything else I can help you with ... shouldn't take more than five minutes . your custom is valuable to us
M	TELEMARRETERS (CONT'D)	I'm afraid I'll have to refer that to my supervisor just a routine security check before we start . Thank you for talking to us today Through a glass partition, Evelyn can be seen sitting at a
M	JAY	You're sure I can't offer you something? We have English Breakfast Tea. Building Tea, as you call it.
F	EVELYN	Builder's tea. It's called builder's tea. And no, I'm fine. Thank you.
M	JAY	Tell me then. How can I help you? Beat.
F	EVELYN	I don't think you can. I'm sorry, I shouldn't have come. She stands.
F	EVELYN	I saw your advertisement in the local paper, and it specifically mentioned the ability to talk to older people. But this is not what I imagined ...
M	JAY	You came for a job?
F	EVELYN	I've wasted your time.
M	JAY	Mrs Greenslade. Everyone working here is a graduate of a good university. This is a place for ambitious people. Young people.
F	EVELYN	I see that. Good day.
M	JAY	Please. One second. Evelyn stops.
M	JAY (CONT'D)	It is really builder's tea?
F	EVELYN	Yes. We dunk biscuits into it.
M	JAY	You dunk?
F	EVELYN	It means lowering a biscuit into your tea, letting it soak in there, then trying to calculate the exact moment just before it dissolves to whip it up to the mouth, and enjoy the blissful union of biscuit and tea combined. It's more relaxing than it sounds.
M	JAY	Perhaps you can help us after all. One person watching is SUNAINA (20's). She's talking on
F	SUNAINA	We do appreciate your custom, which is very important to us. And can I draw your attention to our special - But the person at the other end has hung up. Sunaina Then the clock hits 11, and a buzzer sounds. Sunaina gets Sunaina, who is with some friends, spots him, comes over.
F	SUNAINA	I get two breaks in eight hours. Explain to me why I would want to waste one of them with you - He kisses her. She kisses him back.
M	SONNY	Leave this place. Come and work for me.
F	SUNAINA	You can't afford me.
M	SONNY	I cannot afford anything.
F	SUNAINA	Still tempting. I miss you. Am I coming round tonight?
M	SONNY	Let's meet somewhere else. I will rent a hotel room.
F	SUNAINA	Sonny, you own a hotel. It has many rooms.
M	SONNY	Some of them now occupied. With actual real guests.
F	SUNAINA	Paying guests?
M	SONNY	Why must you nitpick? It is not an attractive quality.
F	SUNAINA	It isn't? They kiss again, start to make out a bit. Then
M	JAY (O.S.)	Sunaina! They turn to see Jay who has come out of the Call Centre.
M	JAY (CONT'D)	You can let go of my sister now. Break's over.
M	SONNY	Hello Jay.
M	JAY	Sonny boy.
M	SONNY	Don't call me that. Jay smiles, holds the door open for Sunaina.
M	JAY	Let's go.
F	JEAN	Good evening, Your Honour.
F	GRAHAM	Mrs Ainslie. I hope you had a good day. What did you get up to?
F	JEAN	Well, I started in my bedroom, where I had a lovely couple of hours giving all the cockroaches names. Then after a lunch that will long have a place in my heartburn, I came out here and stared blindly at a book waiting for someone - anyone to rescue me. And how glad I am it was you.
F	GRAHAM	Why would you not go out? There's so much to see. Jean had hoped for some appreciation of her wit, and is
M	GRAHAM (CONT'D)	Open your eyes, Mrs Ainslie. All life is here, I tell you. Jean stares at him. He goes on through the archway into I could talk to the chef, if you like. Perhaps get you some grilled chicken, plain rice.
F	JEAN	I would appreciate that very much. Graham goes on in. Jean just sits there. Wishing he'd A young hotel worker, ANOKHI, brings out a tray of food to Muriel watches her, but Anokhi is deferential, won't meet
F	GRAHAM	Good evening.
F	EVELYN	Good evening. Evelyn sits at her table.
M	EVELYN (CONT'D)	I trust you had a good day?
F	GRAHAM	I'd rather hear about yours.
F	EVELYN	I got a job. My first. Ever. I'm going to be a sort of cultural advisor.
F	GRAHAM	A role I'm sure you'll perform with great distinction. He's about to inquire further, when Evelyn sees Douglas and
F	EVELYN	Perhaps if you wouldn't mind keeping that news to yourself.
F	GRAHAM	I'm flattered you shared it with me. He turns to greet the new arrivals.
M	GRAHAM (CONT'D)	Good evening, the Ainslies.
F	EVELYN	Have you had a good day?
M	DOUGLAS	Spectacular. I went to the temple you told me about. A place of meditation and peace, quite stunning.
F	JEAN	So spiritual, I bet you hardly noticed the smell of elephant dung.
M	DOUGLAS	No elephants, sadly. Still none. I thought I might see you there. Where did you get to instead?
F	JEAN	Yes, where do you get to every day?
F	GRAHAM	Well, I've just finished telling Mrs Greenslade all about it. Evelyn registers the lie, but says nothing.
F	JEAN	I'm sure she wouldn't mind hearing it again. She waits. But Graham is as elusive as he is tactful.
F	GRAHAM	I talked to the chef for you. He said it will be no problem.
F	JEAN	Did you hear that, Douglas? Plain grilled food; manna from heaven.
M	DOUGLAS	I don't have to have it too, do I don't know how to thank you. You really should see this temple.
F	EVELYN	I'd like that very much.
M	DOUGLAS	But maybe take a clothes peg for your nose. Graham starts down the stairs.
F	EVELYN	Goodnight.
F	GRAHAM	Goodnight to you. He seems about to say something else. She waits for a
M	GRAHAM (CONT'D)	Mrs Greenslade?
F	EVELYN	Evelyn.
F	GRAHAM	Can I show you something?
F	GRAHAM	I grew up here. Just a short drive away. It was a big house, and we had servants, everyone did. We knew their wives, their children. One boy, Manoj, became my friend. We played a lot of cricket together, played anything we could. And that's how it stayed for years. Until one night, he became something more. We had a few months, we had that. There was a weekend in Udaipur, we sat by a lake and watched the sun go down, and I remember thinking . I will never be this happy again. And I was right. Because quite suddenly it was over. We'd fallen asleep, and they found us. For me it was bad enough. But I already knew who I was, and I think my family had guessed. For Manoj, the disgrace was absolute; a double taboo. His father was fired, they were sent away, all of them. I don't know what I could've done, but it should've been more than nothing. I put up no fight. I let it happen. Soon afterwards I went to England, to University. I always told myself I'd come back. But I never did.
F	EVELYN	Until now.
F	GRAHAM	And now I think .. what if I am the last person on earth he wants to see? Evelyn says nothing. I don't think I can go through with it.
F	EVELYN	Do you want to see him again?
F	GRAHAM	Yes. Yes. Oh yes.
F	EVELYN	Then you must. She looks up. Anokhi is on the verandah, replacing her Then she goes to fetch Muriel's jar of pickle from the Muriel watches, then wheels herself outside, looks at the From outside, Sonny's voicecan be heard.
M	SONNY (O.S.)	And so now that we are fully operational, Mr Maruthi, it is clear that with a small injection of funds for the Phase Two Development ...
M	SONNY	.. the Best Exotic Marigold Hotel can rise like a phoenix to its previous state of glory. And when I say small injection, I mean small in the sense of medium- sized. Possibly larger.
M	MR MARUTHI	This hotel was never glorious.
M	SONNY	Just the phoenix part then.
M	MR MARUTHI	How many rooms will there be?
M	SONNY	Many.
M	MR MARUTHI	How many?
M	SONNY	A great amount. Plenty of rooms, no question. They've arrived in the courtyard.
M	SONNY (CONT'D)	I am not a details man, Mr Maruthi.
M	MR MARUTHI	Nor was your father. They see Muriel on her verandah.
M	SONNY	Mr Maruthi, I present to you one of our beloved guests. Dear Mrs Donnelly, please describe in as much detail as you desire your experience of the ambience and atmosphere of the Best Exotic Marigold Hotel.
F	MURIEL	Kill me. Kill me now. Sonny steers Mr Maruthi towards the reception, speaks
M	SONNY	The wheel is spinning. But the hamster is dead. He stops, as he sees an elegant older woman standing in the
M	SONNY (CONT'D)	Mummyji! What are you doing here?
M	MRS KAPOOR	You called. I came.
M	SONNY	I couldn't have called. The phones don't work.
M	MRS KAPOOR	That's why I came.
M	MRS KAPOOR	Who was that man out there?
M	SONNY	The contents of this desk are mine. Don't open the drawers. I must insist you don't open the drawer. Mrs Kapoor opens the drawer.
M	SONNY (CONT'D)	Tell me why you have come.
M	MRS KAPOOR	Do I need a reason to visit my favourite son?
M	SONNY	No. He is in his mansion in Delhi.
M	MRS KAPOOR	My second favourite.
M	SONNY	He went to Kerala to make his fortune.
M	MRS KAPOOR	But make it, he did.
M	SONNY	As I will make mine. I have a dream, Mummyji. A most brilliant one: to out-source old age. And not just for the British. There are many other countries where they don't like old people too.
M	MRS KAPOOR	Your brothers own a third of the hotel each, they are entitled to a third of the profits.
M	SONNY	Success does not happen overnight, Mummyji. This is blue sky thinking, and it requires long-term strategy and patience.
M	MRS KAPOOR	How is your girlfriend?
M	SONNY	I look forward to you meeting her.
M	MRS KAPOOR	And I look forward to you meeting the woman you will marry. She is from a good family in Delhi.
M	SONNY	I can marry as I choose, Mummyji. I need no permission.
M	MRS KAPOOR	I presume it is your girlfriend who teaches you such nonsense. One reason not to marry her.
M	SONNY	What if I love her?
M	MRS KAPOOR	An even better reason. Now send Young Wasim to the car for my luggage.
M	SONNY	He cannot carry, he has a dicky back ... wait, your luggage? How long are you staying?
M	MRS KAPOOR	As long as it takes. Jean is looking out of her bathroom window, down into the She sees Graham come out of his room. She turns back to
F	MURIEL	You won't get the dirt out like that. Anokhi just smiles at her radiantly. I worked in service for years, looked after a lovely house. I kept it spotless. You need a bit more pressure on that brush. Graham walks past, on his way out.
F	GRAHAM	She won't speak English. She's what used to be called an Untouchable. An outcast, born below society. To a good Hindu, even her shadow is polluted. He greets Anokhi in Hindi, and heads for the door.
F	MURIEL	Where d'you go every day? Is it a woman? Nip round there for a curry and a bit of afters?
F	GRAHAM	I don't think so. I'm gay. Although nowadays more in theory than practice. Good day. He leaves. A moment later, Jean comes rushing out.
F	JEAN	Good morning. Muriel says nothing.
M	JEAN (CONT'D)	Lovely day. Still nothing from Muriel.
M	JEAN (CONT'D)	Lovely. Lovely. She turns and goes back in. Muriel thinks for a while, then turns to Anokhi.
F	MURIEL	Long old life, isn't it? Madge is being shown around by an elderly secretary, MR
M	MR DRARUNA	The Viceroy Club was opened by the great Lord Kitchener himself, and many of the fixtures have remained unchanged since then.
F	MADGE	Yes, I see that. Perhaps you could tell me a little about the clientele? Any maharajahs? Wealthy widowed land-owners?
M	MR DHARUNA	It is not the policy of this club to divulge details of our members. They go past a very handsome older Indian man. Who Good morning, Your Excellency.
F	MADGE	Where do I sign up?
M	MR DHARUNA	The admission fee is 120,000 rupees, and thereafter 15,000 rupees each month.
F	MADGE	I wonder if I might get a little discount. Owing to my status.
M	MR DHARUNA	Your status, madam?
F	MADGE	Yes. One was rather hoping to fly under the radar, but one is a member of the Royal Family.
M	MR DHARUNA	Which member, madam?
F	MADGE	I'm Princess Margaret. It is most surely an honour to meet you. And may I say how well you look. Especially taking into account that you died nine years ago. Your real name please, madam. And 120,000 rupees.
F	GRAHAM	Good morning.
M	MR CHIDAMBRAM	Good morning, Sir. Did I not say that we will contact you when there is information regarding your inquiry?
F	GRAHAM	Yes, you did say that. You did.
M	MR CHIDAMBRAM	While it is most pleasant to see you, your presence does not actually accelerate our investigation.
F	GRAHAM	I'll try not to come in tomorrow.
M	MR CHIDAMBRAM	I expect I will see you then.
F	EVELYN	.You ring in the morning. Let's assume the person answering will be a woman. She will have had her breakfast. Tea or coffee. Semi-skimmed milk, always. If she's under 50 she'll be contemplating yet another diet, over 50 she'll have more or less given up, and be eating toast. The radio may be playing, or more likely daytime TV. A chat show, or a programme with a moderator speaking to a panel of young women whose boyfriends have all slept with their mothers. The girlfriends' mothers, I mean, not their own. Although Anyway, then the boyfriends usually come out, and everybody fights. Sunaina is in the audience. She calls out.
F	SUNAINA	I'm not surprised people hang up on us. Laughter.
F	EVELYN	That's the point. When the phone rings and it's this robot nobody wants a machine, but it's almost worse when it's a person behaving like one. All these sales cliches just strung together. 'Your call is important to us'. Is it? Well then sound like it.
F	SUNAINA	'Your custom is valuable'.
F	EVELYN	Right. That one. Don't ever say that.
F	SUNAINA	'Service is our middle name'.
F	EVELYN	Yes, when your middle name is
F	SUNAINA	Shantanu.
F	EVELYN	Which is beautiful. You people are young, vibrant, real. I'm sure the typical housewife would enjoy talking to each and every one of you.
F	SUNAINA	Her morning sounds like fun. What are you doing here? Beat.
F	EVELYN	I suppose I'm not typical anymore. Is that the sort of thing?
F	MADGE	Excuse me. Would there be any wealthy single men in tonight?
M	BARMAN	There is one. Madge puts some money into his breast pocket.
F	MADGE	Perhaps you could seat me next to him?
M	BARMAN	This way, madam. He leads her along across the terrace. Madge follows, The barman reaches an ornate suite of furniture. There's
M	BARMAN (CONT'D)	His Royal Highness Prince Michael of Kent. The man rises from his chair and turns. And Madge is left There's a pause. Then Madge reaches into the barman's
F	MADGE	I'll have that back, thank you very much.
F	GRAHAM	Good evening. Muriel nods at him, and he goes on into his room.
F	JEAN	You know where he goes. I know you know. But you won't tell me. Muriel says nothing.
M	JEAN (CONT'D)	I can get Hobnobs out here, you know. I know a way. As many as you want. Milk or plain. Long pause.
F	MURIEL	Public Records Office.
F	JEAN	Thank you. Young couples sit on the steps in the evening heat, boys Sonny and Sunaina are watching the swimmers.
M	SONNY	My father used to bring me to this well to swim. He said the water was better, and so were the people we would meet. He would have liked you so much. Sunaina smiles at this.
M	SONNY (CONT'D)	My mother doesn't want us to be married.
F	SUNAINA	She hasn't met me yet.
M	SONNY	Sunaina absorbs this.
M	SONNY (CONT'D)	She knows you are not from Delhi. That you have no family money, and work in a call centre. You are a part of a new India she cannot welcome.
F	SUNAINA	Isn't this where you tell her what you want?
M	SONNY	That conversation will be easier when the hotel is a success.
M	SUNANINA	Do you love me?
M	SONNY	I have found a new investor. I am most optimistic that he will enable us to move forward with Phase Two of the Marigold Hotel
M	SUNANINA	Shouldn't you finish Phase One first?
M	SONNY	In business, if you stand still, you move backwards. No, I have that wrong. If you stand still, you are overtaken by people going the other way. Wait -
F	SUNAINA	You didn't answer the question. Do you love me?
M	SONNY	My feelings for you cannot be reduced to a single word.
F	SUNAINA	It's a nice word, Sonny. And people like hearing it.
M	SONNY	Sunaina, please. My mother is wrong. It is you who are too good for me.
M	SUNANINA	You say that a lot. You shouldn't I'll start to believe you. They watch the boys in the water.
M	NORMAN	I still think you're cramping my style.
F	MADGE	Please. You have no style to cramp. 58A.
M	NORMAN	That lady at the bar keeps looking at me.
F	MADGE	As one would something in a museum.
M	NORMAN	Why must you mock? I just want to feel young again, to be needed as much as I need, if only for one night, one wonderful night. Tell me you don't know how that feels. Silence for a bit.
F	MADGE	Give me a minute. Then join us. She gets up, heads towards the bar. Where she sits a
M	MADGE (CONT'D)	Rejected again. Many years ago, that man over there gave me the most extraordinary night of my life. He may seem coarse and uncouth, but that only disguises a tenderness and an exquisite sensitivity to a woman's needs Norman arrives at the bar.
M	NORMAN	Those drinks not ready yet? Madge turns to Carol.
F	MADGE	They say patience is passion tamed. Carol smiles.
M	MADGE (CONT'D)	I'm Madge.
F	CAROL	Carol.
F	MADGE	And this . is Norman.
F	CAROL	How do you do?
M	NORMAN	Carol? As in Christmas? Madge winces.
F	CAROL	I suppose.
M	NORMAN	Great. Silence.
F	MADGE	So what brings you to Jaipur, Carol?
M	NORMAN	Yes, Carol. What brings you to Jaipur?
F	CAROL	I run a small boutique travel agency. But I've actually lived here all my life. My father worked in the Foreign Office. Another silence.
M	NORMAN	You're very fit.
F	CAROL	I beg your pardon?
F	MADGE	Oh god.
M	NORMAN	I mean you look like you keep yourself in shape. Physically.
F	CAROL	Well, I did join a gym last year. It cost a fortune, and I didn't get any fitter. Apparently you have to actually go. Madge laughs. Norman doesn't. Then realizes that it was a
M	CAROL (CONT'D)	And so what do you do, Norman?
M	NORMAN	Me?
F	CAROL	Yes.
M	NORMAN	Oh. I'm
F	MADGE	Norman's in business.
F	CAROL	Really?
M	NORMAN	Yes.
F	CAROL	What business? You tell her.
F	MADGE	Import-Export.
M	NORMAN	Although these days there's rather more Ex- than Im-, if you see what I mean.
F	CAROL	I'm afraid I don't. Madge gets up.
F	MADGE	I have to splash some water on my face. Please God I drown in it. She heads for the bathroom. Norman and Carol share another silence.
F	CAROL	Well look, it's been lovely chatting.
M	NORMAN	No it hasn't.
F	CAROL	No. It hasn't. But I really
M	NORMAN	Carol? She was about to go, stops.
M	NORMAN (CONT'D)	Can we drop all this pretence? And start again? I'm not charming. I'm not good at repartee. And I'm not a plutocrat with the sexual capacity of a rutting rhino. My name is Norman. And I'm lonely.
F	CAROL	My name is Carol. So am I.
M	EVELYN (V.0.)	Day 22. Like Darwin's finches, we are slowly adapting to our environment. And when one does adapt, my god, the riches that are available. Madge looks across the bar. And is startled to see Norman Madge walks slowly out of the bar, and into the night.
M	EVELYN (V.0.)	There is no past that we can bring back by longing for it
F	EVELYN	. only a present that builds and creates itself as the past withdraws ...
F	EVELYN	And India, like so many things in life, like life itself I suppose, is about what you bring to it.
F	MURIEL	Where's this? Where are we?
M	AJIT	Janta Colony Kachi Basti.
F	MURIEL	What happened to my usual route?
M	AJIT	Anokhi has invited you to her home.
F	MURIEL	You didn't tell me.
M	AJIT	You'd have said no.
F	JEAN	Will you check in at the bank? Douglas emerges from the bathroom.
M	DOUGLAS	I checked yesterday. And the day before. As requested. Will you be staying in again?
F	JEAN	Why do you ask that every morning?
M	DOUGLAS	Because I hope for a different answer. Because I think you'll be hurt if I don't. And because it's not healthy for you to spend all day and every day in the confines of the hotel. He goes back into the bathroom. Jean changes the subject.
F	JEAN	I didn't sleep a wink. The tap in there never stops dripping.
M	DOUGLAS (O.S.)	I talked to Young Wasim about it.
F	JEAN	What did he say? No idea. It was in Hindi. Douglas comes out of the bathroom, holding the tap.
M	DOUGLAS (CONT'D)	I thought I might get it fixed myself. 63A.
M	DOUGLAS	No time like the present. Actually I say that, but I enjoyed yesterday, and I'm optimistic about tomorrow too.
F	JEAN	I wish I could say the same.
M	DOUGLAS	So do I. He goes. Jean sits for a while, looking utterly disconsolate and
M	NORMAN	Your Madgesty.
F	MADGE	I gather the night went well.
M	NORMAN	Would you like to hear about it?
F	MADGE	Not in the least.
M	NORMAN	Good. Because you're going to. Two drinks, some sexually charged Douglas comes out, carrying a tap. And heads out of the
M	DOUGLAS	Morning. Lovely day.
F	MADGE	Good morning. They watch him leave.
M	NORMAN	Two drinks, some sexually charged banter, and we were heading back to her place. Bidding the rickshaw farewell, I walked her to the door. And there, my young friend, I leaned forward, and I kissed her. Beat.
F	MADGE	And?
M	NORMAN	And what?
F	MADGE	Is that all? You didn't seal the deal?
M	NORMAN	We have a date next week.
F	MADGE	What is wrong with you?
M	NORMAN	I wanted to prolong the anticipation. To spend some time with the knowledge that soon I'm going to eat, drink, and laugh with someone, hold her to me, kiss her softly. Then go back to her place and get my end away.
F	EVELYN	Bow much for this, please Kitna
M	AKRAM	One thousand rupees Ek hazaar
F	EVELYN	Thank you. She reaches for her wallet. Then Douglas speaks from
M	DOUGLAS	No no, forgive me. That's not how it works.
M	65A.	Evelyn turns, happy to see him.
F	EVELYN	Good morning.
M	DOUGLAS	And to you. Sorry to butt in, but you don't ask him how much he wants, you just tell him how much you'll pay. She'll give you two hundred. Absolutely no more, final offer.
M	AKRAM	One thousand rupees.
M	DOUGLAS	Pity. Now walk away. Walk away.
M	DOUGLAS	I know what I'm doing. Evelyn complies, and they turn and walk away.
F	EVELYN	Yes. The thing is, you see, I did actually want to buy that. To brighten up my room.
M	DOUGLAS	He'll come after us.
F	EVELYN	Do you think so?
M	DOUGLAS	Absolutely. This is how the game is played. Just keep on walking. They push through the crowds.
M	DOUGLAS (CONT'D)	He's playing it cool, but he'll come. They keep walking.
M	DOUGLAS (CONT'D)	He's playing it very cool. They keep walking. Then Douglas stops. Evelyn looks at
M	DOUGLAS (CONT'D)	He's not coming. Moments later. They're back at Akram's stall. Evelyn
F	EVELYN	Eight hundred and fifty, nine hundred, nine hundred and fifty, one thousand. She turns to Douglas, smiles.
M	EVELYN (CONT'D)	You'll get him next time. Then she notices something.
M	EVELYN (CONT'D)	Why are you carrying a tap? Then stands. Opposite - squashed together as if posing for a photograph - A long pause. Then Muriel turns to Ajit.
F	MURIEL	How soon can I leave?
M	DOUGLAS	You see what I think, and of course I'm no expert, is that the valve seat has eroded, so we'll need the washer changed and a new seat re-ground. Douglas glances back at Evelyn. Who betrays not the Jamshed studies the tap.
M	JAMSHED	The gland nut has come away from the spindle.
M	DOUGLAS	Well of course, it could be that too. Can you fix it?
M	JAMSHED	Not cheaply. Not cheaply. Most expensively indeed. Jamshed takes the tap to a workstation at the back, starts
M	DOUGLAS	I was in a tuk-tuk the other day, didn't seem to be taking the usual route back to the hotel. It turned out that the driver had decided to take me to another hotel, that he was sure I would prefer. And of course one wants to believe that he genuinely had my welfare at heart, and that it wasn't run bg his brother-in-law.
