M	CHARACTER	DIALOGUE
M	BUS H	Just a boy, that's all. 7 Bush rips down an old faded sign at the road and posts a 7 The Model-T comes to a shaky stop. A MAN climbs out, sees
M	HORTON	Mornin', sir.
F	BUSH	Hard life if you can't read..
M	HORTON	Pardon? I'm uh, Reverend Gus Horton, sir, how you doing? Bush stops his swing and turns and stares coldly at Horton.
F	BUSH	
M	HORTON	Uh, well, Mr. Wiley Starke has passed on, sir. His funeral is tomorrow and I thought you might want to know since.. What got him?
M	HORTON	Just got old, sir.
F	BUSH	Yeah, well.. Bush returns to chopping wood. Feeling awkward, Horton hesitates, starts for his car, stops.
M	HORTON	Mr. Starke told me that you and him ran away from home when you were 6 years old. Is that true?
F	BUSH	I talked him into it. Bush doesn't turn, just keeps chopping.
M	HORTON	Well.. anyway.. I.. alright.. Horton shrugs, get in his car, and leaves.
F	BUSH	Well hell.. Mule sees Bush and grunts anxiously as he rises. Bush tries to think through the fever. He stumbles back to
F	BUSH	Always thought you'd go first.. White as cotton, Bush stares into the lamp that is running Back from the brink of death, Bush emerges into the blinding
F	BUSH	Ahh, don't look so disappointed.
F	BUSH	You better not. Mule looks back, sees an apple in Bush's hand, and stops.
F	BUSH	And coffee when we get there. Mule comes to a wearied stop, breathing hard. Bush climbs off
M	HORTON	Buddy? But as he turns he sees Bush silently looking around.
M	HORTON	Oh! Hello.. Horton comes to Bush but Bush ignores him and keeps
M	HORTON	What can I do for you, sir? Suddenly BUDDY and KATHRYN ROBINSON (20's) enter from the Bush is transfixed by the loving moment.
F	BUSH	I can wait. Buddy and Kathryn see Horton and double-take Bush. Buddy nods
M	HORTON	It's alright, have a seat. Bush sits down uneasily in a pew. Horton sits down in the pew
M	HORTON	What's on your mind, sir?
F	BUSH	Bout time for me to get low.
M	HORTON	Get what?
F	BUSH	Down to business Bush reaches into his overalls and puts a balled-up wad of
F	BUSH	Need a funeral. Horton looks up from the money.
M	HORTON	For who?
F	BUSH	Me. Buddy peers around from the vestibule, listening, curious as
M	HORTON	For you? You want to buy a funeral for you?
F	BUSH	Am I not talking right?
M	HORTON	No, yes, I'm sorry. Are you sick sir?
F	BUSH	Everybody dies.
M	HORTON	True, but..
F	BUSH	I don't take care of my bones it won't get done, will it?
M	HORTON	All right, I see. Well the church can help you get your affairs in order, arrange a service.. Horton glances at the strange wad of money again.
F	BUSH	What would you say?
M	HORTON	About what?
M	BUS H	Me.
M	HORTON	A eulogy? I.. don't know. What do you want me to say?
F	BUSH	Say what you'd say right now to my face.
M	HORTON	Well. I uh, I don't know much about you, Mr. Bush. I mean, I've heard stories but..
F	BUSH	What stories? Bush leans in and stares into Horton. It feels like Buddy peeks in again, this time Kathryn peeks too.
M	HORTON	Just stories.. .you know, people talking.
F	BUSH	What kind of stories? Say one.
M	HORTON	Sir.. my mother used to say that gossip is the devil's radio.. .not that she didn't play that radio at full volume now and then, bless her heart, but.. .what matters when you come to the end of your life is that you're ready for the next one. Have you made peace with God, sir?
M	BUS H	I paid. Horton has no idea what Bush means. He looks at the money,
M	HORTON	Well.. you can't buy forgiveness, Mr. Bush. It's free. But you do have to ask for it.
F	BUSH	Nothing in this world is free, preacher. Bush abruptly grabs his money and starts out. His hand bangs Buddy stares wild-eyed at the big wad of money then drops Bush storms past Buddy, Kathryn and the baby like a hot wind.
M	HORTON	That was, uh, different.
F	KATHRYN	I heard such awful things about him when I was a kid.
M	HORTON	My mother probably told you some of them. Kathryn goes back into the church with Horton who is cooing Bush is holding a big tin cup of coffee for Mule who is Tom (the kid who threw the rock) comes from behind the diner Bush looks up and stares at him.
F	BONNIE	What are you doing, son? Now Tom is scared to death that Bush is going to tell on him.
F	BONNIE	Empty those cans in your daddy's truck and get back in here. Now. Finally Bush drops his gaze and lets Tom off the hook.
M	GARY	Look at that. A mule drinking coffee!
M	CARL	Finally found somebody that likes Bonnie's coffee. As they move past, they see Bush standing there..
M	WORKER	Ya'll better hush, that's old Bush. Carl eyes him. Gary and the others throw curious glances as
M	CARL	Hey.. I'm talking to you.. Carl picks up a handful of gravel, tosses some over
M	CARL	We know about you. You stay out of this diner. There's women and children here and we don't want you around them. Bush stands to mount up, never turning around.
M	CARL	You better hear me. I see you here again, I'll.. Hey! Hey! Hearing the hollering, Tom looks up from the pick-up. But the rock misses Bush and hits Mule, startling him. Old
M	CARL	Shit.. Carl moves up to try and calm him.. .as Bush tries to ease Mule down the cart hitch grinds a As Carl steps up, Bush yanks the BRAKE HANDLE off the cart Carl falls like a bag of bones. He looks up and sees Bush
M	TOM	Daddy! Wild with fear, Bonnie and Tom run toward Bush.
F	BONNIE	Stop it!! Get away! Gary, the Worker burst from the diner but see the brake Bush comes to himself, sees everyone staring, sees Carl in Buddy races up, sees Mule bleeding, and eyes Bush as he grabs I'll kill him! Bonnie shushes him softly as Carl moans in pain.
M	BUDDY	Frank? There was a fight. It was..
M	FRANK	.let me guess. Hmm. Carl?
M	BUDDY	Well yeah but this time it was with that old man Bush.
M	FRANK	Old man? Is there a body?
M	BUDDY	No, the old man did the beating. Never seen anything like it.
M	FRANK	Social event of the year and I missed it. Frank lowers the paper so just his eyes appear. He has no
M	FRANK	Read the paper today? Something strange is happening in the world right now.
M	BUDDY	What?
M	FRANK	People are dying in bunches. Everywhere. But here. He puts the paper down and studies his socks.
M	FRANK	I wonder what the odds are of a funeral home going broke? I mean you have a business everybody on earth needs, you can't make that work, it's got to be you right? And yet.. I don't know.. what do you do when people won't die?
M	BUDDY	Well..
M	FRANK	Onethingabout Chicago, people knowhowto die; they drown, get runover,shot, whatever it takes.
M	BUDDY	We get it done down here, we're just not in a hurry about it.
M	FRANK	It's them or us. Frank sighs and stares forlornly out at a casket. I might know someone who is looking for a funeral. Frank's eyes crawl over to him.
M	FRANK	How much did he have?
M	BUDDY	It was all wadded up.
M	FRANK	Ooo, hermit money. That's good. Buddy sees Bush's signs.
M	BUDDY	There it is..
M	BUDDY	What are you doing?
M	FRANK	You've been wanting a shot at sales..
M	BUDDY	But..
M	FRANK	As of right now, you're on commission. Remember; foot in the door, establish trust, and drop the hammer. Buddy hesitates, crawls out, and eyes the shack.
M	BUDDY	I'd feel better if you'd go too.
M	FRANK	No doubt but if you don't do this by yourself, you won't know if you're any good. And you'll never be any good if you don't know you are. Go get him!
M	BUDDY	Hello? Nothing. He shoots a look back to the hearse - miles away, Buddy spins and discovers Bush standing on the ground behind
F	BUSH	Want to see in my house, do you? BOOM! Bush blows away several windowpanes and re-aims at
F	BUSH	How's it look? Buddy closes his eyes, his last words are for his wife..
M	BUDDY	Oh, Katie.. It makes Bush peek out from behind the barrel.
M	BUS H	You was at the church with your wife and baby. Buddy opens his eyes and can't believe he is still alive.
M	BUDDY	Yes, sir.
F	BUSH	What the hell you doing here?
M	BUDDY	I can't remember.
F	BUSH	What? They stand there while Buddy thinks..
M	BUDDY	Oh yeah, I heard.. you wanted a funeral.
F	BUSH	Funeral?
F	BUSH	Yes sir. I work at uh.. I work at.. .Quinn Funeral Home. I thought I could help you. Bush glances at his blown out window: 'Damn'. He lowers his
M	BUS H	You like rabbit?
M	BUDDY	What? Bush goes inside. Buddy looks desperately back at the hearse but can't see
F	BUSH	Sit down. There is only chair at the table so Buddy dumps the glass off Bush is at the stove tending to a iron skillet of rabbit
F	BUSH	It's how you put things together, see? Some things go, some things never will. Indians said that everything spoke to them. That's how they made medicine and knew what to eat. Things talked to them clear as we talk. You believe that?
M	BUDDY	I.. I don't know, sir.
F	BUSH	If you don't listen you won't hear nothing. Bush puts the big skillet on the table and sits down.
M	BUDDY	Did you make this furniture, sir? Never seen any like it. Can't even tell what's holding it up.
F	BUSH	Magic. Buddy looks up. Bush is dead serious. The word lingers.
M	BUDDY	Alright. Well. Sir, if you do want to plan for a funeral service, which I hope will be a long long time away, we'd treat you with respect and offer a good..
F	BUSH	What'd everybody say about what happened in town?
M	BUDDY	I don't..
F	BUSH	That crazy old son of a bitch tried to beat a man to death for no reason? That it? Buddy is caught off guard by Bush's lucid candor and finds
M	BUDDY	There's two sides to every story. As Bush puts some rabbit on Buddy's old yellowed plate..
F	BUSH	People say that. But they don't mean it. They think what they think and they don't want to know anything else.
M	BUDDY	Yes, sir, but I think people are so scared of what they don't know that they make things up to feel better about it.
F	BUSH	Like life after dying. Heaven. I hope that part's true, don't you? But I don't think we know the actual truth about much of anything. I know I don't. I'm just guessing most of the time. Bush gives Buddy a closer look and motions for him to try the
M	BUDDY	Lord, that's good..
M	BUS H	You boys been coming out here to throw rocks through my window for 20-30 years.
M	BUDDY	I never..
F	BUSH	Ya'll know lots of stories about me? Yes, sir, I guess, but..
F	BUSH	Tell one.
M	BUDDY	I'd rather not. Bush eases forward, his eyes slit. The old Bush is back.
F	BUSH	I rather you did.
M	BUDDY	Well. When I was kid I heard you killed some men in a fist fight.
F	BUSH	Is that all? Bush leans back stone-faced. In the silence, Buddy looks over again at the wondrous
M	BUS H	What's your name again?
M	BUDDY	Buddy Robinson, sir.
M	BUS H	Well, if I need you -- I know where you are. It sounds almost like a threat. It shorts Buddy out. He stops
M	FRANK (O.S.)	Oh yes Ma'am, I do respect your wishes but you see..
M	FRANK	.state law requires.. No ma'am, we can't bury him under the house.. There is a loud KNOCK at the door. Buddy goes to get it.
M	FRANK (O.S.)	Well just for argument's sake, Ma'am, how would we get the casket under the house? No casket? Would you like to come in, sir? Bush stares suspiciously into the room then back at Buddy.
M	FRANK (O.S.)	But you have to have a container of some kind, Ma'am for decency and uh, sanitation. Bush enters the Funeral Home. As Buddy starts to close the
F	BUSH	Leave it.
M	FRANK	Yes, Ma'am, but there's lots of natural things that aren't decent. He did what?! Good God. No, Ma'am, I didn't know that about your husband. Well, yeah now I understand why you want him under the house but still.. The phone goes dead. FRANK sighs as Bush walks in.
M	BUDDY	Frank Quinn, Mr. Bush. Frank takes a quick swallow from his cup to fortify himself,
M	FRANK	Come in, come in, pleasure. Coffee? As Bush shakes Frank's hand, he stares into him, taking
F	BUSH	You from anywhere?
M	FRANK	A little bit of everywhere, I guess. Get him a chair, Buddy! Buddy stands behind the waiting chair. Bush scrapes up a different chair. Frank goes behind the Bush reaches into his coat and pulls out the wad of hermit
M	FRANK	How can we help you, sir? Bush gives Buddy a look, then looks back at Frank who
F	BUSH	I'm after a funeral.
M	FRANK	Boy, are you in luck. Follow me.
M	FRANK	Solid pecan, steel handles.. Bush eyes it, repulsed.
M	BUDDY	Mr. Bush is an amazing carpenter.
F	BUSH	Forget the box. What else?
M	FRANK	Whatever you want, flowers..
F	BUSH	No.
M	FRANK	Burial plot..
F	BUSH	Got it.
M	FRANK	A service?
F	BUSH	Party.
M	FRANK	A what?
F	BUSH	A party.
M	BUDDY	What kind of party?
F	BUSH	Funeral party. Stumped for once in his life, Frank looks at Buddy. Then
M	FRANK	We can do that.
F	BUSH	And I want to be there. Frank goes behind his desk. Buddy and Bush start to sit..
M	FRANK	You will be, I guarantee it.
F	BUSH	I want to be there now.
M	BUDDY	You want to be at your funeral.. party.. alive? But.. it's not a funeral if you're not, you know, deceased..
M	FRANK	Hold on now, it's a detail, we can look at it.
M	BUDDY	Pretty big detail. Frank cuts Buddy a look then smiles at Bush.
M	FRANK	So you'd like to have a funeral party while you're alive so you can go?
F	BUSH	Yes or no?
M	FRANK	Yes. Buddy is lost.
M	FRANK	Buddy, get some paper. We need to make of list of who Mr. Bush wants to invite.. As Buddy starts to get up.
F	BUSH	Sit down. Buddy sits right down.
F	BUSH	I want everybody to come who's got a story to tell about me.
M	FRANK	Say again.
M	BUDDY	That probably covers 4 counties.. Bush shoots him a look. Frank shoots him a look. Buddy thinks
F	BUSH	Then I want 4 counties worth of people at the party.
M	FRANK	Well, sir, the thing is, how would you get people to come and tell stories about you that I'm guessing might get them, you know.. shot? Bush scoops up the ball of money and heads out. Now all Frank
M	FRANK	You know what, you go ahead, don't worry about it, we'll think of something. A couple of ideas just came to me.
M	BUDDY	Like what? Frank sees Mattie and flicks his hair back nervously and
F	MATTIE	Felix?! Feigning deafness, Bush walks on. Sensing something, Kathryn
F	MATTIE	Felix! Say hello to me! Frank, eyes wide with surprise, mouths, "Felix?".
F	BUSH	Hey Mattie. Buddy comes out, surprised to see Mattie and Bush together.
F	BUSH	Heard you moved off.
F	MATTIE	I've been back a while. Well.
F	MATTIE	How are you?
F	BUSH	You look like you always did. He abruptly rips himself away and is gone.
M	FRANK	How would she know him?
M	KATHRYN (O.S.)	It's none of our business.
M	FRANK	So? We got to know. Kathryn shakes her head and goes back outside. FRANK has
M	FRANK	See the size of that thing?
M	BUDDY	What?
M	FRANK	What do you mean, what? Goddamn ball of money! He wants a party with pink balloons on his ears, we're gonna give it to him.
M	BUDDY	But..
M	FRANK	I sold 26 of the ugliest cars ever made one December, in Chicago, with wind blowing so hard up my ass I was farting snow flakes in July so don't tell me we can't do this.
M	BUDDY	But..
M	FRANK	That's the last "but" I want to hear out of you. You're a salesman now, sell!
M	FRANK	She called him Felix.
F	MATTIE	A thousand years ago he was the most interesting man I'd ever met.
F	KATHRYN	Get out of here.
F	MATTIE	He was. And I don't mean just the way he looked.
F	KATHRYN	I hope not.
F	MATTIE	Oh no, listen, he was beautiful.
F	KATHRYN	Are you serious? Most people are just laid out nice and simple, you know? You always know what they're thinking and where you are with them. But he was this.. big old cave that went deeper and deeper. You'd never get to the end of him.
F	KATHRYN	Good Lord, you had a crush on him!
F	MATTIE	All the girls did. I know he's something wild that crawls out of the hills once in a while and gets into trouble now but there's still nobody like him.
M	FRANK	We have a plan. All we need is a little bit of your time.
F	BUSH	What for?
M	BUDDY	Seeing it is better than hearing about it. Bush looks at the hearse, back at Buddy and Frank.
F	BUSH	How much is it gonna cost? Did you say anything about money? I didn't say anything about money. If we can't get you what you want you don't owe us anything. Buddy is lost in serious thought. Frank is preoccupied about the deal and driving too fast.
F	BUSH	It moves, don't it? This is nothing.
F	BUSH	Fancy car for the dead.
M	FRANK	Didn't buy it for them.
M	BUDDY	We say that funerals are "For the Living" but we forget what that means sometimes, I guess. I was thinking about your funeral party before I went to sleep last night and I think I understand it a little now. When I was a kid, my folks where killed in a bad car wreck and the people at the funeral home... they did the impossible as far as I was concerned. I don't know what I would've done without them. And I remember wishing that my mother and daddy were there to see how beautiful they made everything. Frank is hearing this for the first time and is shocked. Bush
M	FRANK	Where's he going? I wish you wouldn't do that yet. Bush gives him the hairy eyeball then speaks to Mr.
F	BUSH	Don't leave me naked.
M	FRANK	Mr. Bush, you can get all the hairs cut you want after we take your picture, I'll pay for it. Mr. Tollerude doesn't know whether to cut or not.
F	BUSH	Why you want my picture made?
M	BUDDY	That's what we're trying to tell you. We're gonna run an ad in some papers about your party and put up posters of you.
F	BUSH	And you want me to look like this?
M	FRANK	Yes.
F	BUSH	Why?
M	FRANK	Why?
M	BUDDY	It's how people recognize you, sir.
M	FRANK	And you want as many people to come as possible so..
F	BUSH	So a crazy old nutter draws more.
M	FRANK	Basically. Don't you think?
F	BUSH	Do you ever say what you mean? Bush rips the bib off as Tollerude whooshes him to the floor. Buddy snickers. When the Photographer gets back to the
M	FRANK	Take it. I'd go see that. Buddy and Frank are in the mirror too, staring at him. Damn. You look pretty good.. Bush suddenly gets up and nods at Frank.
F	BUSH	He's paying. As Bush blows out the door, Mr. Tollerude leans against the Buddy is staring at him with honest disbelief.
M	FRANK	Son of a bitch, it's almost worth it. What do you think?
M	BUDDY	I wouldn't know you, sir.
F	BUSH	Maybe the Devil won't either. Might work out. Where's the shoes?
M	FRANK	Well, normally people don't wear shoes in a casket so.. .what are you, about a 10D?
M	FRANK	Pretty optimistic taking a change of clothes to the grave. How you set for underwear?
M	BUSH (O.S.)	Don't wear none.
M	FRANK	One question too many.
M	FRANK	I don't mean to be nosey but uh.. how do you know Mattie?
F	BUSH	She's a peach. Frank and Buddy cut Bush a look. He looks ahead.
F	BUSH	We had a go. Frank nearly drives off the road.
M	HORTON	"The Lord loves a cheerful giver.."
F	MATTIE	Oh please.. you think the Lord's taking sides in a poker game in a funeral home? Horton shrugs and points to the divine evidence.
M	FRANK	If He is, the Divine's cheating.
M	RAY	Exactly.
M	FRANK	Don't agree with me Ray, it makes me doubt myself. Ray sighs and studies his perfectly cut nails.
M	RAY	I would have turned down your loan if you were my own dear mother, Frank.
M	FRANK	You made my point and don't even know it.
F	MATTIE	Jesus, would you two stop it! You're worse than two old women.. Ray shrugs, sweetly blase. Frank tries to rein in his temper What were you doing with that old bastard in town today, anyway?
M	RAY	Oh yes. Buying him clothes, getting him a haircut..on credit. Frank shoots him a look.
M	HORTON	Took out ads in a bunch of papers too, something about a party?
M	FRANK	God, I love small towns.
F	MATTIE	Who are you talking about?
M	RAY	That hermit, what's his name..
M	FRANK	"Felix" Bush.
F	MATTIE	You're giving him a party?
M	FRANK	A funeral party.
F	MATTIE	Whatever you're drinking is not being good to you at all.
M	CARL	What the hell is a funeral party?
M	FRANK	Hey, the man wants to be at his own funeral. What can I say? I'd like to be at my funeral so I could tell my ex-wife to kiss my..
F	MATTIE	What makes you think she'd show up for you?
M	FRANK	Because, Dear, vultures are constitutionally unable to ignore the dead. Mattie grins which delights Frank, no end.
M	HORTON	It's that big wad of money of his you're after. There is a crack in Ray's disinterest that he tries to hide.
M	RAY	What money is that?
F	MATTIE	Felix has money? Everyone is looking at Frank but he shuffles the cards.
M	HORTON	He came to see me, wanting a funeral, had a big old greasy ball of money. Talked like he thought he could buy his way to heaven with it. How much has he got? Maybe he can. Hearing that Bush wants or needs a real funeral Mattie is
F	MATTIE	Is he sick, Gus? Horton shrugs. Frank notes the concern and doesn't like it.
M	CARL	I'll tell you one damn thing, ain't nobody gonna go to a funeral for that son of a bitch. Mattie gives Carl a look
M	HORTON	Language..
M	FRANK	They might. He's inviting everyone who has a story about him to come. You could tell about him kicking your ass, Carl. Carl looks at Frank as if he wants to cold cock him.
M	RAY	Old man is going to ride the Weird Train right into the ground, isn't he?
M	FRANK	Wouldn't you like to know what everybody says about you behind your back, Ray? Yeah, probably not.
M	HORTON	I already know way more about people than I need to.
F	MATTIE	Or want to.
M	HORTON	Amen.
M	FRANK	Let's play some cards.
M	RAY	Oh for God's sake, face it Frank, you're broke. This is not about cards. It's a declaration meant to
M	RAY	Please. I've won that 4 times already.
M	FRANK	It's who has it last that counts.
M	CARL	Say what you want but if there hadn't been anybody there the other day he would've killed me. And I guarantee you it wouldn't have been his first time. It sounds true and everyone is quiet except Mattie.
F	MATTIE	Everybody knows you started it. Don't look at me like that. I remember when you were born. You were the sweetest little boy. What is wrong with you? Momentarily shamed, Carl's face softens and we can see a
M	CARL	I made a mistake. But there's a line.. and he crossed it.. and everybody knows that too. Ya'll go on and have a party with the devil for his money but I'll dance on his grave someday. Carl snatches his few dollars up and heads out.
M	HORTON	it comes to Carl but he's got a point. You don't know what Bush is doing. What if he just wants to get everybody in one place so he can turn his shotgun on them?
F	MATTIE	He wouldn't..
M	HORTON	I looked in his eyes. The truth is nobody knows what he's capable of. Maybe even he doesn't know. She looks into him. Frank starts to deal the cards.
M	RAY	Go ahead and lay your watch down, Frank. But I am going to keep it this time, alright, on principle.
M	FRANK	I got an idea. Let's try something different. The cards in your sock? Leave'em there. Everyone freezes. Ray shakes his head.
M	RAY	What are you trying to pull now?
M	FRANK	You really think you're that good that nobody sees?
M	RAY	Sees what?
M	FRANK	You cheat at everything you do. Even at the bank, you loan people just enough to get'em deeper in so you can foreclose on them.
M	RAY	You are a pathetic man. And a goddamn..
M	FRANK	Am I? Then stand up and roll down your socks. Stand up or I'll stand you up. Ray looks around the table and suddenly realizes that he is He walks out, trying to find his old confident rhythm and
M	FRANK	I'll walk you home.
F	MATTIE	No. Thank you. You sure? You're not going to play anymore, are you?
F	MATTIE	Oh, I don't know. Thank you for inviting me though.
M	FRANK	I'm sorry about the..we don't always fight, okay, we do, but he's had that coming for..
F	MATTIE	It's not that. I just..(trails off)
M	FRANK	You came because you don't know what to do with yourself. I slept on the same side of the bed my whole life, right? But after my wife left me, I switched sides, just like that, and never been able to go back.
F	MATTIE	When someone you love is gone, you can pour everything, even a lifetime of things into the place where they were but it's still always empty. He sees that her thoughts are not with him at all but a
F	MATTIE	'Night. He stares after her, wishing that she could see him the way
F	KATHRYN	I didn't hear him wake up.
M	BUDDY	He didn't. Everything's all right, hon.
M	BUDDY	I'm glad you don't know how quick it can change. She gently kisses his arm and the baby's head. Buddy looks at
F	MATTIE	Good Lord. Have you completely lost your mind? Straighten up for heaven's sake before somebody throws a net over you! But she smiles in spite of herself, glances around to see if
M	ANNOUNCER	Friends, we have a treat for you today on WCGM. Our special guest is going to tell us about an event that everyone is talking about. And here he is, Mr. Felix Bush, the mysterious hermit of Caleb County! How are you today, sir?
F	BUSH	I am. Bush is surprised by the sound of his own voice.
M	ANNOUNCER	So tell us, sir, exactly how did you come up with the idea of having a funeral party before you die?
F	BUSH	I dreamed it.
M	ANNOUNCER	Really?
F	BUSH	Why would I make that up? Two seconds of dead air as the announcer finds his feet.
M	ANNOUNCER	Okay. Now I have to say that you don't look quite like you do on the posters.
F	BUSH	I got pruned.
M	ANNOUNCER	Well, you're a bit of a local legend, sir. I was a little nervous about our interview. I've heard some pretty wild stories..
F	BUSH	Like what?
M	ANNOUNCER	Well uh, just.. from what I understand, you want everyone who has a story about you to come and tell it. Is that right?
F	BUSH	You come and tell yours.
M	ANNOUNCER	Thank you. Now how long have you been living out there by yourself?
M	BUSH (O.S.)	40 some years. 40 years with nobody to talk to?
M	BUSH (O.S.)	First 38 are the hardest. Mattie grins.
M	ANNOUNCER	But why would you do that, Mr. Bush, shut yourself off like that? Frank isn't happy with this but Buddy wants to hear.
F	BUSH	Come to the funeral and maybe you'll find out.
M	ANNOUNCER	You heard it here on WCGM, folks, find out the answer to the mystery February 16..
F	BUSH	One more thing, boy. FRANK and Buddy tense. What's this?
M	BUSH (O.S.)	Gonna be a drawing. What kind of drawing, sir?
