M	CHARACTER	DIALOGUE
M	PRIEST	Not yet. With a HORRIBLE SCREECH the Familiars attack, LAUNCHING at Priest CHARGES into the frenzy. A juggernaut. His movements When the dust clears, Priest stands alone... and he is holding Now we can do this easy -- He tosses the BUTCHER KNIFE, it sticks in the ground a
M	PRIEST (CONTID)	Or we can do this HARD -- Priest flings another BLADE. This one PLANTS in the leg of
M	PRIEST (CONT'D)	Where is she? You're too late, Priest -- He points to the horizon, the last rays of daylight
M	CRYPT FAMILIAR	We hear a LOW RUMBLE from inside the crypts. Priest looks at
M	PRIEST	They get your gun arm?
M	HICKS	Why?
M	PRIEST	You're gonna need it.
M	MULTIPLE SHOTS OF	SLABS on each sarcophagus sliding open. SHAPES roiling in
M	BLACK SHAPES	BURST from the crypt doorways SCREECHING as they fly into the WHOOSH! One of the figures SWOOPS low, touching to the Insect clicking claws. Black eyes. Fangs. More creature than human. The vampire cackles, sounds like dried paper, its voice a
M	LEAD VAMPIRE	What are you doing here,. Priest... haven't you already done enough?
M	PRIEST	We don't want a fight. We're just looking for the girl. The vampire sneers and as it speaks the following -- one
M	LEAD VAMPIRE	Look at us -- Living in ruin, forced to feed off the blood of animals. We once scoured 'this land. We were warriors...we were Gods!
M	PRIEST	You were murderers.
M	LEAD VAMPIRE	We were what nature made us. I recommend you leave immediately...You are not welcome here. ONE BLACK FIGURE still flies above. Like a vulture, it
M	PRIEST	We're not going anywhere until you tell us where she is.
M	LEAD VAMPIRE	Then you aren't going anywhere,. If there was a tumbleweed in the vicinity this is when it would
M	PRIEST	,,Yea though r walk through the Valley Of The Shadow Of Death x will fear no Evil -- " The vampires laugh. Fangs glinting.
M	LEAD VAMPIRE	--'Your words mean nothing to us, Priest. And now we see the book's actually hollow on the inside, Forgive me. in one quick motion Priest scoops a handful, snapping his
M	THE CROSSES	And then all hell breaks loose. The Nightshade Vampires hiss. Bearing their fangs like WHOOSH! A vampire swoops towards him, fangs bared, claws Leaps at the creature just in time, driving it to the ground. He turns to Hicks.
M	FOCUS.	And with that he's gone, rolling across the ground like a
M	HICKS	Dazed, watches as the vampire's body erupts with death
M	HICKS	Jesus. Another VAMPIRE careens towards him. Coming in low, crawling He twirls the gun, flipping it into his holster.
M	THE LEAD VAMPIRE	Perched atop his crypt like a gargoyle, raging at Priest and
M	HICKS (CONT'D)	Should we go after him?
M	PRIEST	No need. He'll the at first light. Priest goes to the Familiars still lying on the ground.
M	10 PRIEST (CONT'D)	No more masters. Just you and me. He raises a knife, pressing it to the Familiar's skin.
M	FAMILIAR	-- The metal beast! She's in the metal beast!
M	PRIEST	Make 'sense. The smoke. Look for the smoke --
M	SHARP CLAWS	Suddenly RIP across Priest's back! It's the Lead Vampire,
M	THE VAMPIRE	Throws Priest into a crypt, SMASHING him through the wall,
M	PRIEST	Emerges through the hole, exhausted, the LEAD VAMPIRE'S HEAD in He tosses the head and it rolls to Hicks' feet, fangs flashing The two are silent, grimly going about their task -- It's
M	PRIEST	How's your arm?
M	HICKS	Lucky I guess. The blade didn't go that deep. Don't know what got into those Familiars to attack like that. They're usually harmless. Priest finds a KNIPE clutched in a dead Familiar's hand,
M	PRIEST	Usually. A BEAT as they listen to the popping of the fire. A tension
M	HICKS	You did this on purpose, didn't you? You knew we wouldn't. be out before sundown. You wanted this to happen.
M	PRIEST	You don't have the stomach for it --head back to Haibridge right now. Hicks glares at Priest.
M	HICKS	The stomach I got. I was in the Rangers two years. Even fought in the Boondock Uprising...I saw some crazy things. I just ain't never seen anything like this.
M	PRIEST	Killing a vampire isn't like killing a man. They come at'you like an animal. Tooth for tooth.
M	'PRIEST (CON'Y'' D)	Claw for claw -- Blood, skin, bones. 6 They take all of it. If you let `em. Hicks studies Priest, in the firelight he looks tired. Old
M	HICKS	it comes easy to you... don't it?
M	PRIEST	What?
M	HICKS	Killin'.
M	PRIEST	it just comes. Easy's got nothing to do with it. He pokes at the fire, it CRACKLES, feeding off the bodies.
M	PRIEST (CONT' D)	I take no pleasure in it. Killing. I know I've done more than my share -- Whatever they do to me I have it coming. You think they took her because of you... don't you? Priest stands. Cracks his neck.
M	PRIEST	Give me your gun.
M	HICKS	What?
M	PRIEST	Give me your gun.
M	HICKS	Why? You gonna shoot me now? Priest's stare is piercing. A pause then Hicks pulls his six
M	PRIEST	Don't anticipate the trajectory of your target. Know it. He stomps his foot into the fire, launching a GLOWING COAL OF
M	HICKS	You're teaching me to shoot?
M	PRIEST	I'm teaching you to kill vampires. No more wild shots --
M	HICKS	My ass I In case you didn't notice I was pretty damn good out there! And I sure as hell didn't see you doin' much when I had that blade buried in my arm. Must've been too busy "focusing". Priest hands the gun back to Hicks.
M	PRIEST	There's always-two points. A and B. Know the points and you'll know your target.
M	HICKS	Ain't nothin' but a bunch of bullshit.
M	PRIEST	I see ten crypts ...but only eight vampires. We find the missing, we'll find-Lucy.' What's the next nearest town?
M	HICKS	Jericho. It's clear across the Plains. Gonna be a rough ride.
M	PRIEST	Then you better get a good night's sleep. This bunch was easy, their bloodlines watered down by man. Whoever took Lucy was a whole different breed. He tosses another body on the fire, tiny sparks floating into We hear the Banshee call of a STEAM WHISTLE, sharp and shrill
M	A STEAM LOCOMOTIVE	Bearing down like death itself, teeth of the behemoth's grill We only see 12im from behind. PALE ARMS reach from within the coffins, fingers touching the
M	FAMILIAR	A man came on board at the last stop. Says he has something for you. The Figure nods. We-FOLLOW as he continues to the back of
M	SNAKE OIL SALESMAN	You told me tQ come to you if I had any information. I have some. Silently, the Figure sits down across from him.
M	SNAKE OIL SALESMAN (CONT'D)	But before I tell you...and I hate to bring this, up -- there is the small matter regarding compensation.
M	SNAKE OIL SALESMAN (CONT'D)	Now your group's been REAL good for business so, of course, I'm willing to cut you a deal The Figure suddenly. LUNGES, grabbing the salesman by the
M	BLACK HAT	I can SMELL the blood racing through your veins... Smells like dinner. The salesman starts to shake. A-After you snatched that girl outside Haibridge...two nights later -- a Priest s-showed up.
M	BLACK HAT	A Priest?
M	SNAKE OIL SALESMAN	He was meetin' with the local sheriff. A real shitkicker -- Booted me out of town before I could make a single sell. A pause..,.and then the Figure laughs. The salesman not sure
M	SNAKE OIL SALESMAN (CONT'D)	W-What's so funny? The Figure BURIES his teeth in the man's neck, taking a deep, THE CAMERA CONTINUES TO FOLLOW as the Figure walks to the
F	LUCY	Lying on the floor, her face streaked with tears. Vestiges
F	LUCY	I won't tell anyone if you let me out...I promise. 10 I won't even go to the police.
M	BLACK HAT	You're in here for your own protection...If I let you out of this car you'll be torn apart a piece at a time. He walks to her, face still hidden in shadow. She starts to
F	LUCY	My uncle's a Priestl one of the best. Hooll corns after youl The Figure laughs. Bending down to her level --
M	BLACK HAT	I'm absolutely counting on it. And now we get our first look at her captor. A cross tattoo The mark of the Priest. WE WATCH as the sun crests the horizon and rises quickly
M	THE PLAINS	They sit parked on a bluff, the emptiness making Hick's eyes
M	HICKS	Walkin' Pete talked about this place -- said it. used to be really somethin'. Everythin' growin' green as a goddamn dollar bill. 'Course we had to go and screw it up by poisonin' everythin' -- nothin' pretty survives this world ...nothin' decent anyways. Just wish I could'a seen it. Priest pulls out a canteen of water, takes a sip. Hands it
M	PRIEST	How's your arm?
M	HICKS	Sore. Cut's still open. As Hicks hands the canteen back, Priest suddenly grabs his arm
M	PRIEST	You're a halfbreed. A BEAT as Hicks looks to the ground, when he speaks, it's in
M	HICKS	My grandmother... she was raped. Nobody knows -- It's recessive in my family. No bloodthirst. No light sensitivity. I'm not proud... but it's a part of me. Ain't nothin' I can do. I woulda told you...just didn't want you treatin' me no different. It hangs there. the'silence stretching like a rope,then A. Priest inspects a TIRE TREAD in the sand, a cluster of C. Hicks pulls a TORN PIECE OF CLOTHING (LUCY'SDRESS?)
M	A TIN STRUCTURE	Must be a mirage. Hicks blinks, can't believe his eyes. It
M	HICKS	Gotta be a desert rat. They park their bikes about twenty feet from the rickety
M	HICKS (CONT'D)	Let me do the talkin'. The sun has a way of cookin' these people's brains so they ain't quite right - BANG! A rifle shot kicks up dust at Hicks' feet.
M	VOICE (0.3.)	Hold it right there, mistert Hicks freezes. A BEAT as. the front of the shack shows only a doorway hidden
M	OLD MAN	Take another step and you'll be meetin' the Lord directly.
M	HICKS	Easy now old timer. I'm a sheriff. The old man snorts, spitting a thick stream of tobacco,. it
M	OLD MAN	Ain't no law out here but my own. Calm and cool, Priest shifts in his seat, drawing his gaze.
M	THE MAN'S EYES WIDEN	Seeing Priest clearly now for the first time.
M	OLD MAN (CONT'D)	Praise The Lord. Total attitude adjustment. He lowers the Rifle and smiles --
M	OLD MAN	Cleaned the place up a bit. Been years since I had any kind of company 'sides jackrabbits but I knew you was comity' -- Dreams don't lie.' Ignoring Hicks, the old man pours BLACK TEA into a rusty can, Most people don't remember what you folk done -- Don' t WANT to remember. But I do. I know what you can do. You are God's mighty sword fused into flesh. One of the chosen.. Touched by His very ha nd so peace could finally come to this cur sed land. Hicks snorts.
M	HICKS	Sounds like a bunch of religious mumbo jumbo to me. The old man stares fixedly at Priest.
M	OLD MAN	Now you tell the Clergy this here is an authentic miracle, I want it registered. It's mine.
M	PRIEST	Miracle?
M	OLD MAN	The Angels. Never seen so many loot souls, breaks my heart just to think of it. This ain't no place for nothin' divine. The man's fevered belief unsettles Priest, he's unsure how to
M	PRIEST	You saw angels?
M	OLD MAN	Sure as chit.
M	PRIEST	How many?
M	OLD MAN	Don't know, too many to count. Hundreds. Thousands. Some nights the sky was so thick you couldn't see the stars. His eyes suddenly light up, remembering something. Here! Look at this -- He goes to a shelf, it's been turned into a MAKESHIFT SHRINE -- He pulls out a GLASS JAR containing SOMETHING MISSHAPEN
M	HICKS	What is it?
M	OLD MAN	It's their spoor! They'd be flyin' above and this stuff would drop from the sky like manna.
M	HICKS	That's angel shit?
M	OLD MAN	Scooped it up myself. You wanna hold it? Hicks backs away, shaking his head.
M	OLD MAN (CONT'D)	Suit yourself. Priest still doesn't know what to make of the man but he
M	PRIEST	These angels...di.d you ever see them during the day?
M	OLD MAN	No, I reckon'. that's when they'd go back home for some shut eye -- Gettin' the world ready for the rapture takes a lot of work. Praise God.
M	PRIEST	Home?
M	OLD MAN	The castle - .:,He:points out the window, far away, atop a craggy peak sits
M	OLD MAN (CONT'D)	Beautiful place. Wonder of the world. I used to watch `em every night, takin' to the sky in all of God's glory, I never would disturb `em though. God's children like their privacy. He winks, smiling that crazy smile. Priest considers the
M	OLD MAN	Wait! I want you to have somethin' before you go He presses a HOMEMADE CROSS into Priest's hand. It's a real
M	OLD MAN (CONT' D)	Remember, a man comes into this world with one thing. His soul. He's lucky if he's still got it when he leaves. Priest pockets the cross, REVVING his cycle and with a final Lucy smiles sweetly, taking the tray.
F	LUCY	Thank you. The Familiar turns to leave. WHAPI Lucy SLAMS the tray over his head and he collapses to She makes a run for it. But the Familiar manages to grab her Two more FAMILIARS run in and grab her arms, wrestling her to Priest and Hicks stand, surveying the ancient ruin. Hicks Yep. Truly a wonder of the world...good thing we listened to the fossil. Don't know how we'd find Lucy without him.
M	PRIEST	Vampires sometimes use abandoned structures as a perch. Watch for booby traps. And with that he enters the--
M	HICKS	Why we listen' to that crackpot? Crazy fucker's so blinded by faith he's batahit. That's called a zealot in my. book. I'm startin' to think you might be one yourself. You ever think bout that? Priest doesn't respond, squinting his eyes.
M	HICKS	This is bullshit. Lucy's been gone five days'-- every stupid minute we waste here is a minute more she gets farther-away.
M	PRIEST	Stay here. If anything comes up the steps that isn't me -- Shoot it. Before Hicks can reply,.Priest heads down the stairs, darkness
M	HICKS	Great.
M	DOWN THE STAIRS	The air seems thicker here, the darkness claustrophobic.
M	A CATACOMB	Actually more a cave. Miles and miles. Twisting, jagged and He brushes aside the refuse, uncovering a . bunch' of SMALL
M	It's quiet.	Priest moves through the darkness, footsteps not even a Stepping back, he sees they form an image-of some kind. Hard He leafs through the garbage, pulling out a piece of BROKEN A SHADOW brushes past the light, moving so fast it barely Hicks angles the broken glass under the light, reflecting a 1L0Z.J.PIf .! i Primitive but very creepy. We linger on the image, the Priest walks into an ANIMAL PEN of sorts, a hay-like
M	TWO BODIES	splayed across the ground like rag dolls. He crouches to
M	WHAM!	SOMETHING. barrels into him with superhuman force! Whatever it is, it's fast. Quickly countering for every move Priest locks his arms around the shape's arms, SLAb24=G it o A BEAT as they stand staring at each other, unsure what to Time seems to stop for these two. Their whole dark history
F	PRIESTESS	How did you find me? Priest doesn't reply. She narrows her eyes, suspicious.
M	PRIESTESS (CONT'D)	Did the Clergy send you?
M	PRIEST	No. Why would they? She nods towards the bodies, we now see tb=1re.-VAMPIRZ-
F	PRIESTESS	I've been busy.
M	HICKS	Shit. He wipes the blood on his pants, not noticing as a A LARGE
F	PRIESTESS	If you didn't come for me...why are you here?
M	PRIEST	I should be asking you the same question. The bestial smell stings their nostrils, smells good.
F	PRIESTESS	There's another one around here somewhere.
M	PRIEST	Where?
F	PRIESTESS	I don't know...but it's not like the others. They're interrupted by the sound of GUNFIRE echoing off the
M	PRIEST	Hicks. He starts down the tunnel. The Priestess quickly following. SOMETHING is lurking. A hulking shadow, sounds like a rabid
M	PRIEST	It's too big to fit down here. That's why you're still alive.
M	HICKS	What the hell is that thing?I
M	HICKS	I'm not stupid. Vampires don't look like that.
M	PRIESTESS (0.8.)	They used to. The Priestess steps out from behind Priest. Startling Hicks.
M	HICKS	Who the hell are you?! (7, She doesn't even bother to respond,.just shooting a look as
M	UP THE STEPS	Charging into battle. Priest BURSTS from the stairway
M	THE VAMPIRE	A fearsome creature -- much more terrifying than the The beast opens its mouth and lets loose with a SCREAM, its
M	THE PRIESTS	Split up. The Priestess LEAPING to the stone wall and
M	THE VAMPIRE	With a screech, goes for the Priestess. Crawling up the wall,
M	THE PRIESTESS	Lets go of the wall, PLUMMETING straight towards the vampire,
M	PRIEST	Leaps from below, darting up the rock, taking advantage of
F	PRIESTESS	Should we lead it into open air? More room to. maneuver.
M	PRIEST	Better to keep it contained. The vampire's lathered into an animal frenzy now, wailing and
F	PRIESTESS	Or not. They race outside. WHOOSH!. Great leathery wings unfold from its back as it
M	PRIEST	Darts behind a boulder just in time. The creature's talons
M	THROWING CROSSES	CUTTING through the air, sparkling in the moonlight, They BOUNCE harmlessly off the creature's wings, knifing back THE CREATURE HOWLS! Blazing straight for him.
M	THE PRIESTESS	Quickly scoops up TWO LARGE ROCKS -- HURTLING them towards
M	RY „NG GOES BLACK	Silence. Then -- The sound of a heartbeat. The juncture between instants. A fissure.
M	EVERYTHING GOES BI CK	A BRIGHT FLASH again -- and now Priest is using the frozen A BRIGHT FLASH again -- and now Priest is ON the behemoth, he And WHAM1 we fuse back into real time as the creature CRASHES
F	PRIESTESS	Not bad. Suddenly the CREATURE'S BODY erupts into ablistering death
M	BAMI	A single bullet. pierces its heart and the body collapses with
M	HICKS	Point A...meet point fuckin' B. He smiles, twirling his six shooters back into their holsters. He raises his hand, comparing it to the beast's talon.
M	ATOP THE CASTLE WALL	Priest and the Priestess stare out at the Wasteland,
M	PRIEST	This was a Pureblood.
F	PRIESTESS	we both know that's impossible -- They haven't existed for a millennium. What's going on here?
M	PRIEST	.I don't know. A BEAT filled with awkward silence -- when the Priestess
F	PRIESTESS	Sector Seven was the only place I could find work. Waste Management. Nobody else would hire me. %No applicable skills.&
M	PRIEST	I heard that one too.
F	PRIESTESS	A week ago, a family camping out on the Perimeter approached me --.Told me vampires were terrorizing their village and that the government wouldn't do anything about it.
M	PRIEST	Did you go to The Clergy?
F	PRIESTESS	They wouldn't see me, By the time I got to the village it was completely razed. Nothing left. Women. Children. All dead ...they didn't even bother to feed. I've been on their trail ever since...could be the same group who took your niece.
M	PRIEST	Could be. The Priestess glances towards Hicks.
F	PRIESTESS	Does the lawman know what you'll do if you find her?
M	PRIEST	He knows.
F	PRIESTESS	He'll try to stop you.
M	PRIEST	He won't be able to. She pauses a moment, regarding him.
F	PRIESTESS	You know, some nights I still dream we're back on the frontlines ... I wake up, I'm sweating... my muscles all clenched like I'm ready for something -- But I don't know what.
M	PRIEST	Me too.
F	PRIESTESS	Nights like that ...I don't go back to sleep. But on other nights ...the good nights I dream about other things.
M	PRIEST	..Like what?
F	PRIESTESS	You. Priest stares at her, not sure what to say. Lucky for him,
M	HICKS	- Hey.you guys better get a look at thisl The warriors lock eyes, knowing something's been started -- They head down the stone steps. Hicks is lifting up one of the creature's wings. There's
F	PRIESTESS	it must be a birthmark of some kind.
M	HICKS	That ain't no birthmark -- it's a brand. The Priestess studies the mark, something about it making her
F	PRIESTESS	There's something else you need to see...
F	PRIESTESS	I found this just before I was attacked -
M	AN UNDERGROUND CHAMBER	Huge. Cavernous. Our group appearing as tiny shapes set
M	PRIEST	It's a tomb. Big enough for an army.
M	HICKS	Guess they're not as endangered as everyone thought. 0 But where'd they go?. We hear a LOUD SHRIEK - and a MASSIVE SWARM OF BATS sweep
M	PRIEST	Only one way to find out...
M	HICKS	Are Priests allowed to, you know...have relations?
F	PRIESTESS	We take a vow of celibacy at inception. Hicks can't be sure -- did she just look at Priest when she
M	HICKS	Look...I was uh, wondering --. how did he do that little stunt back there?
F	PRIESTESS	All Priests can do it.
M	HICKS	Including you? She nods.
M	HICKS (CONT'D)	So what's the trick?
F	PRIESTESS	No trick. You just have to remember.
M	HICKS	Remember... what?
F	PRIESTESS	Time is relative. Priest snaps up his hand, cutting off their conversation,
M	HUGE CHAMBER	Not like the cave, this is more earthen. Like the inside of a
M	A GIANT SHADOW	Looms before him, we_don't see what it is.
M	PRIEST	You said the next nearest town was Jericho.
M	HICKS	Yeah.
M	PRIEST	Then we better go see.
M	HICKS	. See what?
F	PRIESTESS	-- What they left of it. PUSH IN ON HICKS -- knots of rope tightening in his But she's not there. He SCREECHES, dropping the-food as he runs to a HOLE ripped in
M	RAILROAD TRACKS	CLACK past at a furious speed, inches from his head! The
M	LUCY (0.S.)	Hey... The Familiar turns -- Lucy's perched inside one of the JOISTS KRACKI- She lets loose with a well-placed KICK, snapping his
M	OHB SLIPS	Catching herself just in time. Her eyelids practically Taking a deep breath, she manages to hoist herself through She makes the sign of the cross, closes her eyes and JUMPS The plain's a shifting veil of sand, parting to reveal a As quickly as it opened the veil closes again, shifting to In the distance we can make out a cluster of structures as
M	PRIEST	We separate. Go through each building, see what we find.
M	HICKS	I'll start with the sheriff.
F	PRIESTESS	Be careful. Just because it's daylight doesn't mean it's safe. Hicks nods, tightening the twin BANDOLEERS across his chest. DUST BLOWN IN FROM THE STORM COVERS EVERYTHING, broken
M	HICKS	'Damn. He shakes his head, heading towards the holding area as -- if the jail was a disaster zone, this place is just plain
M	MUSIC SUDDENLY BURSTS FROM THE PIANO	The plinking keys playing by themselves, activated by It's obvious a FAMILY lived here, children's clothes and
M	HICKS	There ain't nobody left. Nobody. Too many mouths to feed.
M	HICKS	Where's Priest? But the Priestess's already focused on something else, gazing
M	PRIEST	On the ground KNEELING. Head down, engaging in some kind of THE CAMERA FOLLOWS as they slowly approach, wondering what Before Priest are THREE LARGE WOODEN CROSSES, A NAKED BODY ON Immediately the Priestess drops beside Priest, joining him --
M	FACES	They're Priests. A brief moment as the tip of the cigar glows, a puff of smoke She digs her nails into the earth but it's no use as the chain We see the cheroot on the ground. Spent. The only evidence B. The corpses now wrapped in white cloth, carefully placed C. Flames engulfing the bodies, a twisty column of smoke
M	HICKS	Don't make no sense. What were they doin' out here?
F	PRIESTESS	The same thing as us. Someone's drawing us out.
M	HICKS	Who? The Priests just stare into the fire, not having any idea.
M	HICKS (CONT'D)	I imagine you'll have to go back to the Cities, inform the Clergy. A sudden silence.
M	PRIEST	We're not going back. The Priestess looks at him, he speaks for her as well but
F	PRIESTESS	We'll burn for this.
M	PRIEST	We already are. Something in the flames catches the Priestess's eye, in the
M	HICKS	It's a railroad spike. My pop used to work boxcars before they shut down -- Why the hell would anyone wanna swallow that? A beat as Priest puts it together.
M	PRIEST	He wanted us to find it. It's a clue.
F	PRIESTESS	Where's the closest track?
M	HICKS	The Dunkirk Line. It starts all the way in the backcountry, bought the ore from the deep mines. There were about five stops along the route. I think. He draws several Xs along the line. His hand coming to a
M	HICKS (CONT'D)	Looks like Jericho was, the last town it glances before'. heading around the Linwood
M	PRIEST	Where? He draws one final X at the end of the line. Looks up.
M	HICKS	So there it is. The Priestess narrows her eyes.
F	PRIESTESS	They must have been picking up different factions along the way. Moving during the day, feeding at night.
M	HICKS	But headin' to the Cities is suicide. The sun will kill `em -- there's nowhere to hide. Priest gazes at the map, deeply troubled.
M	PRIEST	They won't have to.
M	THE CAMERA	Overtakes the train. Snaking along the rail at an incredible And it is only now that we see exactly what Priest means. A BLACK COWBOY HAT coolly tilted down, exposing .a cheroot
M	DARK FIGEMH	A fine catch yes? She'd be dead if not for me...swallowed by the wasteland. We see Lucy on the floor at the Figure's feet, his pale hand From the shadows, Black Hat steps forward, looking down at
M	BLACK HAT	What do you want for her? And now her captor lifts his hat -- revealing paper-thin
M	RUNE	You know what r want. Black Hat's eyes flick upwards, glinting in the. candlelight.
M	BLACK HAT	Don't. go too far, Rune.
M	RUNE	He comes for her still.
M	BLACK HAT	Of course he does.
M	RUNE	Let me have him.
M	BLACK HAT	No. Rune smiles,'revealing an impressive set of vampire fangs.
M	RUNE'	I'm sure she'll fetch a nice price out In the zone -- they don't care what condition their meat's in...as long as it's easy to chew. Black Hat eyes him.
M	BLACK HAT	Don't get involved in this.
M	RUNE	I was involved long before you showed up. I've been waiting years for a chance at him...and now that he's here I find x have to ask a Prime permission... Like a snake, a finger of the claw emerges from the folds of
M	RUNE (CONT'D)	My how things have changed. Ever so slightly, the metal finger SQUEEZES Lucy's throat,
M	RUNE (CONT'D)	I never cared about your war. Never got Involved. Us halfbreeds. We were exiles -- rejected by both humans and vampires. All we wanted was a quiet place. But he wiped out my whole tribe. Maybe it's time to return the favor. The metal finger wraps TIGHTEtR, Lucy gasps, the "tension
M	BLACK HAT	Fine. He's Yours. As if on command, the finger retreats back into the jacket,
M	RUNE	And -- she's yours. He laughs, sounds like a death rattle, dropping the cigar to
M	BLACK HAT	Annoyed, picks up the still burning cigar, squeezing it in
