M	CHARACTER	DIALOGUE
M	1870. THE ARIZONA TERRITORY.	We descend past DARK CLOUDS. Violent FLASHES ripple within. Thunder blends with DRUMS as we reach a BOX CANYON... Whirling around the fire -- war paint -- masks and headdresses -- beautiful BABY in her arms as we FOLLOW THEM INTO -- A TEEPEE. The simple melody of the woman's song as she lays the baby on a blanket, gently swaddling it, LOVE in her eyes. But. The wind starts to HOWL. QRAJ. And then... a BURST OF LIGHT through the opening of the teepee -- intense ULTRAVIOLET: FWHOOOOOOOOOOOOOOOSHHss!!! superior force -- PLUCKED savagely into the light, GONE -- as we
M	FLEEING PEOPLE.	Impossibly, the objects are STEEL MACHINES. BELLY VENTS snap open and DRILL CONES drop out -- jagged teeth CHURN TO LIFE -- C--() ... .-4�_ s A N D A A PINK TONGUE LICKS HIM. The man STARTS AWAKE -- to find a MONGREL DOG over him. Mangy. But sweet. COUGHING, the man stumbles up. How'd he get here? And where the hell i.: here? And -- OWWW. A GASH in his side... .. part of the wound oddly SEARED. He winces. Trying to solve this painful puzzle. Something GLINTS on his wrist: A STEEL BRACELET. No clasp to pull it off. He touches the surface -- TSSS -- SHIT -- It's HOT! And there's a BLACK STETSON on the ground. The Man grabs it to shield his eyes... but STOFS: A WORN PHOTOGRAPH in the inner brim. A WOMAN. Young, beautiful. SMILING. The Man stares: does he KNOW this woman? is this even HIS hat? THE CLAIBORNE BROTHERS -- WES, MOSE and LUKE. Dusty and tough. Wes gallops right up to our Man, gives him the once over --
M	WES CLAIBORNE	Howdy. We're riding towards Absolution. You know how far west we are? The Man's got NO IDEA what he's talking about.
M	LUKE CLAIBORNE	Maybe he's a dummy. Wes hops off his horse, right in The Man's face now --
M	WES CLAIBORNE	There a reason you don't wanna answer my question, friend? And now, Mose nods to the BRACELET on The Man's wrist --
M	MOSE CLAIBORNE	Wes, he's got iron on his wrist... and he's been shot.
M	LUKE CLAIBORNE	Bet he's a chain jumper. Luke spurs his horse behind him -- The Man's SURROUNDED.
M	LUKE	If he escaped, there'll be a bounty. Let's bring him with us. Wes nods as he slides a SAWED-OFF DOUBLE-BARREL from his back
M	WES CLAIBORNE	Not your lucky day, Stranger -- turn round and start walking. But The Man doesn't move. The Claibornes share glances. Wes
M	WES CLAIBORNE (CONT'D)	Dead or alive, no difference. I said
M	WALK OR--	THE MAN MOVES, A MECHANISM OF BRUTAL VIOLENCE -- YANKS the rifle forward as BLAMI -- shot goes WILD -- suddenly the gun's in THE Luke's horse -- GRABBING Luke's ankle -- suddenly Luke's FLAT on
M	LUKE CLAIBORNE	-- P-please, God -- d-don't -- -- The Man PULLS the trigger but CLICK! The rifle's EMPTY. Luke's RELIEF is short as The Man SLAMS the gun-butt down, knocking him out cold. And ALL of this took about ten seconds. This man is a cold-blooded KILLER. But somehow... he didn't seem to KNOW that. CONFUSION. Drops the rifle, looks down at on the breeze -- flattens against The Stranger's foot. He picks it up, BLOODY FINGERPRINTS on what we now see is a TELEGRAM --
M	THE MAN IN BLACK	Absolution... With a HYA! The Man sends two horses GALLOPING, mounts the third, wincing at that gash in his side. Starts to trot off... sees the dog following... Get outta here. Leave me alone. But the dog keeps following. Like they're FRIENDS now. The man VALLEY below... and a SPECK within it that is: dehydrated, the wound DRAINING him. His eyes fall on the first building he sees... A CHURCH.
M	THE MAN IN BLACK	Stay. The dog sits by the door as The Man enters -- EMPTY -- he's uncorks it with his teeth -- drinks -- pours some on the wound -- then A PISTOL COCKS behind him -- Meet MEACHAM, town preacher, a tough, wash-foot Baptist:
M	MEACHAM	Palms to heaven, Friend. The Man freezes. Turns up his hands.
M	THE MAN IN BLACK	Been shot.
M	MEACHAM	Only two kinds of men get shot -- criminals and victims. Which one're you?
M	THE MAN IN BLACK	don't know. Meacham hears the HONESTY in his voice. Knows a lost soul when he sees one. Lowers his gun, softening...
M	MEACHAM	Got a name, son?
M	THE MAN IN BLACK	Don't know that either.
M	MEACHAM	What do you know?
M	THE MAN IN BLACK	... English.
M	MEACHAM	Odd wound. Looks... cauterized. Means somethin' burned it half closed. The Man just stares. News to him. And now, as Meacham leans
M	MEACHAM (CONT'D)	Nice trick. That some kinds... magnet? The Man looks at him -- "What the hell is a 'magnet'?!?" Meacham shrugs it off, readies the needle -- Try'n hold still. He pokes the hot needle through the wound -- The Man winces slightly, but bears the pain.
M	MEACHAM (CONT'D)	Where'd you ride in from?
M	THE MAN IN BLACK	West. Woke up in the desert. Looking up at the sun like I'd been dropped outta the sky.
M	MEACHAM	Seems I remember a story about that happening once... fella by the name of Lucifer. How 'bout I just call you "Luke," for short. But TheMan's distracted by his REFLECTION in a cracked mirror: That blood yours or somebody else's?
M	THE MAN IN BLACK	Three men rode up. Drew on me. My hands... moved on their own. Anything else you wanna confess to while you got my attention? And The Man senses somehow that, ygg, there is... but:
M	THE MAN IN BLACK	Everything that happened before I woke up... It's gone.
M	MEACHAM	Well. Too bad. Can't absolve you for your sins if you don't recall 'em. That bein' said... Meacham looks up, eyes twinkling. This is not a fire n' brimstone preacher. This is a guy who GETS IT --
M	MEACHAM (CONT'D)	I seen bad men do good things and good men do bad things. Whether you end up in heaven or hell... it's not God's plan... it's yours. You just got to remember what it was. The Man considers. Darkly --
M	THE MAN IN BLACK	What if I don't want to remember? Then you're probl'y goin' to hell. On cue -- SMASH!!! The stained glass window EXPLODES as a MOLOTOV COCKTAIL hurtles into the church. FIRE spreads around confessional and uses them to STAMP OUT the fire --
M	MEACHAM (CONT'D)	Dammit -- it's Dolarhyde's men! WHOOPS and HOLLERS and GUNSHOTS outside! The Man whirls to see A DOZEN MEN ON HORSEBACK, marauding through town -- HiS NAME ON IT! The gang rides down Main Street, HOOTING -- Percy cocks another Molotov, aiming for the SALOON -- But one of his men, half-Apache NAT COLORADO, shouts:
M	NAT COLORADO	Percy! N2t the saloon!
M	PERCY	Why the goddamn hell not?!
M	NAT COLORADO	Cause your dady said so. Something LOADED in the way he emphasizes "daddy." Percy GLARES -- strange RESENTMENT between them. With a growl, Percy GALLOPS blankets as he moves past The Man --
M	MEACHAM	You wanna help or are you just gonna stand there and burn?!
M	MEACHAM	All right, folks -- don't panic! Get inside and you'll be fine... C'mon... Meacham tosses The Man one of the blankets, nods across the street to the GENERAL STORE which is just STARTING to burn --
M	MEACHAM (CONT'D)	Put it out before it gets goin'! ON THE MAN, not sure how he suddenly became the damn fire brigade, but HUSTLING across the street to -- WHIPS open the blanket, beats at the flames advancing toward the LICORICE. Two FULL JARS of CANDY in his hands. OOPS:
M	KID	Just tryin' to save the candy. You one of my Pa's hired guns? Before he can answer, HOOFBEATS behind them -- and here's PERCY.
M	PERCY	Who the hell're yam? Whatever the opposite of Love At First Sight is, THIS is it:
M	THE MAN	Nobody.
M	PERCY	Nobody is right. You think you can just collect your fifty dollars and ride off? You signed up for the wrong side, boy. The kid's scared. The Man ISN'T, despite the gun in his face:
M	PERCY (CONT'D)	Tell you what. You get down on your knees and kiss my boot. The Man's eyes narrow -- You do that and I'll let you run back to wherever the hell you came from so you can tell whoever you see... Absolution belongs -tg..th-e- 1Dolar es.
M	THE MAN	You want me to kiss your boot? Percy extends his boot just INCHES from The Man's face:
M	PERCY	Tongue's just fine if you're feelin' amorous. Don't hold ba -- THWIP! The Man YANKS Percy's boot off his foot in one quick move and KWHAM!!!1 WINGS IT RIGHT INTO PERCY'S FACE! Percy FLIES off the HORSE -- The Man grabbing his rifle -- the
M	THE MAN	Kiss this, you sonofa -- -- Nat Colorado gallops around the corner, SHOTGUN RAISED.
M	PERCY	Goddamnit, Nat -- SHOOT HIM!!! -- but The Man yanks Percy up by his collar, using him as a SHIELD between himself and Colorado. Eerily calm --
M	THE MAN	Wherever you came from? Go back. Colorado knows he's dealing with a PROFESSIONAL. MORE GANG MEMBERS ride up, surprised -- a dirty outlaw, GREAVEY, barks:
M	GREAVEY	Sheriff's right behind us, Nat!
M	PERCY	You goddamned shitheels! Don't you even THINK about leavin' me!!!! Colorado -- DECISION -- doesn't take long -- glares at The Man --
M	NAT COLORADO	Be seeing you.
M	THE MAN	Look forward to it. With that, Nat spurs his horse -- YA! The others follow him as he RIDES HARD out of town. Percy growls at The Man --
M	PERCY	You are a dead man. You hear me? So help me God I will kill you my-- DM! The Man's SMASHES Percy's skull with the gun, knocking him
M	KID	FA! He caught Percy Dolarhyde! SHERIFF KYLE TAGGART rears up on his horse. Tall, dark and
M	SHERIFF TAGGART	Emmett -- you all right? The Kid (now EMMETT) strides towards his father excitedly: a-f lap jack- then-stared-down-Nat-Colorado- like-he-wasn't-even-scared!!!! Taggart turns to The Man now, cautious, but grateful --
M	SHERIFF TAGGART	Pardon my boy, mister. He can be excitable. Kyle Taggart. The Man shakes Taggart's hand. A beat. Then --
M	THE MAN IN BLACK	. Luke.
M	SHERIFF TAGGART	Well I'm in your debt, Luke. Tune of fifty dollars, actually. Our advert? The telegram? The Man NODS -- Oh, RIGHT.
M	SHERIFF TAGGART (CONT'D)	Could use a man like you in case any of 'em come back...
M	THE MAN IN BLACK	-- I'm just passing through.
M	SHERIFF TAGGART	Fair enough. You don't mind spending the night, bank opens in the morning... I'll get you your money then. Saloon's got rooms. You just tell Maria I sent you. The Man tips his hat, nods to Emmett (still STARSTRUCK), turns
M	SHERIFF TAGGART (CONT'D)	You here with the prospector woman? The Man stops. Intrigued. Turns back --
M	THE MAN IN BLACK	woman?
M	SHERIFF TAGGART	Yup. Real looker. Came into town yesterday with that there dog. She a friend of yours? ON THE MAN. His first real LEAD.
M	THE MAN IN BLACK	Maybe. And as The Man heads off, we HOLD ON TAGGART, his spidey-sense tingling that all is not RIGHT with this...
M	DEPUTY WADE	Somethin' wrong, Kyle?
M	SHERIFF TAGGART	What's that French sayin' where you swear you seen someone before?
M	DEPUTY WADE	Don't speak French.
M	SHERIFF TAGGART	No... you sure's hell don't.
M	RANCH HAND #1	Should take it easy there, Pal --
M	RANCH HAND #2	Mr. Dolarhyde don't like it when we drink on the job.
M	ROY CLANTON	I don't give a damn what he don't like -- gotta sit here and babysit a damn herd of cattle. Dolarhyde ain't gonna do squat. Gotta see a man about a buffalo... He lets out a big BURP and stumbles off behind a ridge. More FRAME. Its PLAINTIVE MOO blending into all the others:
M	RANCH HAND #1	You hear that?
M	RANCH HAND #2	Hear what? ANOTHER COW zips up from the herd behind them. And ANOTHER. ROY CLANTON -- comes RUNNING back up the hill, pulling up his he's 300 roly-poly pounds of ANXIOUS CASTILIAN JEALOUSY:
M	DOC	-- I know you are, don't lie to me!
F	MARIA	How many times do we have to do this, Arturo? J. love you.
M	DOC	Really? Do you?!? I found this in our bed! And I don't k3 Vg. a watch, Maria. I can't AfjQrd a watch because y insisted we buy this saloon! She looks at him SQUARELY -- yes, some SECRET withheld. As The
F	MARIA	We have customers. And MOVES off. Doc stomps toward the exit -- sees EMMETT at the Emmett RUNS OUT. The Man sits beside an old cuss named ATTICUS.
M	ATTICUS	That mutt makes a move for my steak, I'll drill him down.
F	MARIA	Shut up, Atticus. This is the man who took out Percy Dolarhyde. Atticus grumbles and goes back to eating, but not before sweeping his duster aside to show the GUN in his holster. Maria
M	THE MAN IN BLACK	I'm looking for a woman. She gestures to the WHORES --
F	MARIA	What kind?
M	THE MAN IN BLACK	This kind. He removes the PHOTO from inside his hat. The one of the WOMAN.
F	MARIA	Never seen her before. But she is beautiful. Here's to you finding her, Senor. ON THE MAN. Not exactly sure he WANTS to. But they CLINK glasses, knock 'em back. Maria pours him another: You have any idea what kind of mess you just stepped into?
M	THE MAN IN BLACK	No. But I figured I'd be safe in here seein' as how that boy I tossed off his horse didn't wanna burn your saloon. Maria's eyes go down. Somehow GUILTY. But then:
F	MARIA	It's not the boy you should worry about. It's his papa.
M	DOLARHYDE	Name's Woodrow Dolarhyde. I'm what you might call, the Tall Hog at the trough. His face comes INTO light: 50's, tailored finery, patent leather
M	DOLARHYDE (CONT'D)	You're Roy, right? Clanton, is it? Been working for me two weeks now, and I haven't had the pleasure. Our POV belongs to ROY CLANTON, the ranch hand from the cow
M	CLANTON	Mr. Dolarhyde, I... I swear I didn't -- a VIOLENT "SSST" from Dolarhyde JOSTLES the horses -- STRETCHING Roy tight enough to SNAP -- he SCREAMS --
M	DOLARHYDE	Best not to interrupt me, Roy, makes the horses skittish. You partial to history? Here's a primer,
M	LISTEN CLOSE:	He pulls out a WHIP, gripping it by its STERLING SILVER HANDLE.
M	DOLARHYDE (CONT'D)	Following the War Of Northern Aggression -- what some ironically refer to as the "Civil" War -- came a prodigious nation- wide market for beef. Cowtowns sprang up all along these prairies, Roy; populated by enterprising young drovers -- among 'em, my daddy, Jeremiah Dolarhyde. Sold six of his gold teeth and a sword gifted to him by Robert E. Lee for twenty of the scrawniest Longhorns you ever saw -- then turned 'em into the fattest herd West of the Chisholm Trail. Watched him work this lash, driving those steer til his fingers bled... but what good's a whip without a herd, Roy? And slowly, torturously, SWEEPS the whip tip in the dirt...
M	ROY CLANTON	Mr. Dolarhyde, Sir, you gotta believe me -- I went to take a piss and and -- saw a light in the sky -- blue -- and when I ran back the cows and fellas were gone!
M	DOLARHYDE	The sky. Opened up. And took my cows. Incoming HOOFBEATS -- Dolarhyde looks up to see COLORADO and the A WOMAN emerges from the servant's quarters. APACHE. 50's. A relationship we don't understand yet as Dolar strides up --
M	DOLARHYDE (CONT'D)	Where's Percy?
M	NAT COLORADO	Jail. Sheriff locked him up. Dolar darkens. Unsheathes a KNIFE. Looks down at Roy:
M	DOLARHYDE	When're these people gonna lgarn? He STABS the knife down... SLICING the rope tethered to Roy's Dolar SLAPS the horse's rump, to which Roy's UPPER TORSO is
M	DOLARHYDE	Everyone saddle up. Got us a sheriff to kill. As he MOVES OFF, Dolarhyde's eyes go to the Apache Woman. Something passes between them. She seems CONCERNED.
M	NAT COLORADO	Wasn't the sheriff, got him caught. It was a stranger. That STOPS Dolarhyde. He turns back, face dark:
M	DOLARHYDE	... What stranger?
M	NAT COLORADO	Usually a man gives off a scent. Where he's been. What he's done. He didn't have one. Deputy Wade pours himself a cup from a TIN POT OF COFFEE:
M	DEPUTY CHARLIE WADE	Percy wouldn't've come in shooting without his daddy's say-so, Kyle. You best get ready for a war 'cause that's what's comin'.
M	SHERIFF TAGGART	Tomorrow we ride the little shit up Phoenix way, turn him over. Dolarhyde's got a beef, he can take it up with the 6th cavalry. Taggart's on his feet, grabs his JACKET off the door --
M	SHERIFF TAGGART (CONT'D)	Goddamn tired of this... fatass rancher scaring good people off their lan-- He STOPS. Something catches his eye on the posting board.
M	SHERIFF TAGGART (CONT'D)	Sonofabitch. WHAT DOES HE SEE? Before we get a chance to KNOW --
M	THE MAN IN BLACK	Another.
F	MARIA	You drink like a man who wants to forget.
M	THE MAN IN BLACK	Other way round. The dog WHINES AGAIN for the steak. Atticus SLAMS down his silverware. Draws his GUN --
M	ATTICUS	You got three seconds to get your dog outta here or I blow his balls off.
M	THE MAN IN BLACK	Not my dog.
M	ATTICUS	Q=... two... -- and just before "three"... CA-CLICK. Atticus FREEZES, because there's a RIFLE BARREL at the back of h,iS head now:
M	VOICE (O.S.)	Give you odds you don't get to 'three.' RACK TO FIND the person holding the rifle is A WOMAN. Beautiful. EXOTIC. Dressed in leather. Meet ELLA SWENSON. ON THE MAN IN BLACK. Can't help himself. immediate and undeniable CHEMISTRY. But she pays him no mind -- makes a PSST
M	ATTICUS	I was just havin' some fun, Miss --
F	ELLA	Give- him, the steak. Atticus HESITATES, angry at the humiliation. Ella PRESSES THE
M	ELLA (CONT'D)	Now say you're sorry.
M	ATTICUS	I'm-- sorry.
F	ELLA	His name's 'Happy.' HappyBARES HIS TEETH. INCHES from Atticus' face
M	ATTICUS	I'm sorry... 'Happy.'
F	ELLA	Alright then. You're right. That was fun. -- Atticus scrambles back to his feet and OUT the door, as Ella What're you doing with my dog?
M	THE MAN IN BLACK	I was hoping you could tell me.
F	ELLA	The hell're you talking ab--? WRIST BRACELET. Surprise and REVELATION: Where... did you get that? Before he can answer, SHERIFF TAGGART enters, along with DEPUTY WADE (carrying a SHOTGUN), and 5 other deputies. They move
M	SHERIFF TAGGART	Hey there, "Luke." Mind following me down to the office so we can have us a chat...? What for?
M	SHERIFF TAGGART	All due respect, I'm the law, mister. That's what for. The men LOCK EYES:
M	THE MAN IN BLACK	Tell you what, Sheriff. How about you keep the fifty dollars you owe me and I just walk outta here like we. never met?
M	SHERIFF TAGGART	Because we did meet. ON ELLA. For reasons we're not sure of, the idea of The Man leaving ALARMS her. All the Gunslingers' hands are POISED by holsters. The Man stays preternaturally COOL:
M	THE MAN IN BLACK	L can't be accountable for what happens if they draw on me.
M	SHERIFF TAGGART	And what's gonna happen?
M	THE MAN IN BLACK	Best you don't find out.
M	SHERIFF TAGGART	Now why'd you have to go and say that? Taggart gives a nod and the men start to CONVERGE --
M	THE MAN IN BLACK	Don't. But Charlie makes a MOVE and The Man SLAMS his head into a pole THROAT -- SLAMS the third into a bench -- The FOURTH straight down on the Faro table -- TAGGART levels his REPEATER -- but The Man just GRABS the barrel
M	THE MAN IN BLACK (CONT'D)	I told you, I don't wanna hurt anyb-- CRACK! The butt of a PISTOL WHIPS the side of his SKULL! The Man DROPS as we REVEAL who just knocked his ass OUT: ELLA! Taggart draws a gun and pins The Man, whipping out that piece of paper he pulled from his office...
M	SHERIFF TAGGART	Yup -- looks just like him.
M	SHERIFF TAGGART (CONT'D)	"Jake Lonergan. Scourge a' The Territories. Wanted Dead or Alive." And The Man... now forever known as JAKE... stares WOOZILY into WOMAN... her image goes BLURRY... then mil{: 1.) A tilted, handmade trail sign: "SAGUARO PASS." 2.) We're in a CABIN somewhere. BLINDING ULTRAVIOLET LIGHT EXPLODES INTO THE CABIN, against which a DEMONIC SILHOUETTE appears -- it looks like an INDIAN IN FULL-FEATHER HEADDRESS -- 3.) A WOMAN'S FACE -- THE WOMAN FROM JAKE'S PHOTOGRAPH -- she looks at us and SCREAMS -- 4.) Now we're someplace VERY DARK -- a cave? As some kind of TERRIFYING OCULAR PROBE lowers right in front of our eyes -- 5.) Now we're RUNNING through the cave -- ESCAPE -- BREATHING HARD -- a LIGHT at the end of the tunnel -- BLINDING SUN hits us as we emerge -- our eyes ADJUST to see: 6.) A STRANGE ROCK FORMATION on the rim of a canyon -- like a
M	PERCY	You're a dead. Jake sits up. Woozy. Blinking back to reality. My daddy's comin' for me, Boy. You're gonna end up another dead shitheel under his spurs. I am gonna watch you suffer for a long, long -- Jake moves LIGHTNING QUICK -- reaching through the bars,
M	JAKE	Shut up. Jake sits back on his cot, rubbing his still-throbbing head. with a real sense of PURPOSE:
F	ELLA	I need to see Lonergan. It's important.
M	DEPUTY WADE	'Fraid not, Miss -- we're preppin' him for transport. And pushes PAST her, into the office with the men. HOLD on Ella
M	SHERIFF TAGGART	What happened to him? Man walked into a bar. Taggart shakes his head as Charlie and a deputy unlock Percy's cell, CUFF HIM, drag him out. Taggart points to Jake:
M	SHERIFF TAGGART	Step back against the wall there. Move and I shoot you dead.
M	JAKE	You should've let me go.
M	SHERIFF TAGGART	Yeah, I should've shot you in your knee. You put down six of my deputies.
M	JAKE	Six was all you had.
M	SHERIFF TAGGART	Hell, they're gonna love you in Phoenix.
M	JAKE	Yeah? What's in Phoenix?
M	SHERIFF TAGGART	What you got comin', Jake Lonergan. Taggart reaches into his shirt, pulls out a pair of GLASSES.
M	SHERIFF TAGGART (CONT'D)	Aggravated banditry, 17 counts, Forgery, Blackmail, Hijacking, injurious use of a cattle prod, Arson, Incitement of Whorehouse Riot, and Trespassing with intent to deflower. You're also leader of a gang of outlaws includin' Creek Johnson and Bull McCade, which makes you accessory to every law they broke too.
M	JAKE	That it?
M	SHERIFF TAGGART	Saved the best for last... 'Murder.' That LANDS on Jake. Wondering if this is TRUE. Evenly --
M	JAKE	It say who I killed?
M	SHERIFF TAGGART	Prostitute outta Mojave, name of Alice Wills. Taggart rises, removes Jake's BLACK STETSON from a hook on the
M	SHERIFF TAGGART (CONT'D)	If I were a bettin' man, I'd say this would be Ms. Wills, would it not? Jake just stares, CONFUSED. SHAKEN.
M	SHERIFF TAGGART (CONT'D)	They found her dead in a cabin round Saguaro Pass, twenty miles west of here. With that, a CLUE falls into place: SAGUARO PASS.
M	SHERIFF TAGGART (CONT'D)	Deed was in your name. He slips the photo back in the brim, tosses the hat to Jake:
M	SHERIFF TAGGART (CONT'D)	Dead hooker with a hole in her chest, in your cabin, plus your sterling reputation equals guilty as goddamned sin. And you're gonna hang for it. At gunpoint, Taggart PUSHES Jake out the door -- an incoming WIND. Across the valley, a massive BLACK CLOUD
M	GREAVEY	blue light... Clanton said he saw blue light before the cows disappeared...
M	DOLARHYDE	Just a storm.
M	COLORADO	No storm I've ever seen... I say we wait 'til it passes. But Dolar isn't listening. THROUGH HIS BINOCULARS: he sees
M	DOLARHYDE	No time, they put him in an iron coach. With a HYA! he's OFF, the others FOLLOWING with reluctant looks -- still SPOOKED by that incoming STORM:
M	DEPUTY WADE	Gimme your wrist. Jake holds out his hands. Wade unlocks one wrist, freeing a
M	JAKE	What're you --?
M	CHARLIE	Best way to make a man stay put: chain him to his enemy. You lovebirds have a nice trip now. SLAM: the door CLOSES and LOCKS. Jake SIGHS and tries to sit back, but it's hard tethered to Percy's slumped form. Shit. Then QWW -- something starts to STING and he looks down:
M	EMMETT	You sure he's a bad guy, Pa? He did give Percy a lickin'.
M	SHERIFF TAGGART	He's bad enough.
M	EMMETT	. can I come with you?
M	SHERIFF TAGGART	Too dangerous.
M	EMMETT	Dangerous to drive a damn coach? Why can't Charlie just take him?
M	SHERIFF TAGGART	Because it's my job, Emmett. That's what these people pay me to do. And your mother would kill me if I brought you. Emmett looks off, half sad, half angry --
M	EMMETT	Good thing she's already dead then. And turns without a goodbye. Taggart watches him leave, wishing he could connect. Takes the reins and looks up -- REACTS: THAT MASSIVE. FRIGHTENING CLOUD IN THE SKY -- roiling faster toward town. The scary BLUE FLASHES within grow more INTENSE. Jake turns to see ELLA, pushed up against the coach window:
M	ELLA (CONT'D)	Tell me where you got that bracelet...
M	JAKE	Maybe you should'a asked before you knocked me out..
F	ELLA	Please... I need to know. Just tell me where you got it.
M	JAKE	Y dOli' .xBmbgX - - I don' t remember my name or where I've been or any of the things they said I done, so leave me the hell alone. And sits back as the coach starts to MOVE, leaving Ella in the cover the coach in a protective ring. Wade sees something incoming from the NORTH: Taggart looks up: Dolarhyde's gang racing down the mountain -- He unslings his SHOTGUN as his men ready their weapons -- ON DOLARHYDE'S GANG, riding hard, guns ready too -- This is about to get UGLY. BUT... from the OTHER end of town, the WIND picks up -- As the massive storm cloud seems shockingly to have STORED AT A H -- its EYE churning, ROARING and... TWO BOLTS OF BLUE LIGHTNING CRACK DOWN FROM IT! Happy starts BARKING MADLY. Ella
F	ELLA	NonoNO -- GET TO YOUR CELLARS! EVERYONE
M	UNDERGROUND NAT!	But her cries are LOST as -- RRRRRRRR!!!!! The stagecoach UPENDS, FLIPPING SIDEWAYS as the animals try to break free -- Taggart and his men are THROWN -- Inside, Jake and Percy TUMBLE end-over-end -- SLAMMING into THE 1Q8k=O ENGULFS THE TOWN! THE CONCUSSIVE BLAST BUCKLES
M	MEACHAM	Jesus God!! STRANGE STEEL RINGS fire from the speeders and mushroom out -- Yeah-these are HIGH-TECH LASSOS: of DOLARYHYDE' S. Screaming, just gone. THIS IS A...Qlp lam. EMMETT -- stunned -- as SHERIFF TAGGART runs for him -- Emmett runs into his dad's embrace --
M	EMMETT SHERIFF TAGGART	What's happening?! -- Stay _by-mvside! A_LIVERY_STABLE -- the HORSES stamp in their stalls as Taggart tears the door open and rushes Emmett inside; as he's about to follow... am c1:t lU 01 If -- a STEEL CABLE fires from the collar, SNAPS TAUT as it connects to a speeder and WHOOSH! Taggart's RIPPED off his With a "C'MON!!!" she rushes him through the FRENZIED CROWD -- -- but WHOOSH! A METAL COLLAR CLAMPS AROUND WADE AND YANKS HIM Percy RELENTS. Offers up his hand. Jake grabs all of Percy's against the wall, FORCING Percy's hand out of the cuff -- and THROUGH THE CROWD -- DOLARHYDE hears his son SCREAM. SEES the
