M	CHARACTER	DIALOGUE
M	BRENNAMAN V/O	... nobody on, two and two to Saenz - who none of them hits - as he settles back in
M	BRENNAMAN V/O	- Rivera looks in for the sign, he has it, the pitch, Saenz swings and -
M	STEVE LYONS V/O	- a ground out to second, Thom, is not what the A's were looking for from Saenz - down by two in the ninth -
M	BRENNAMAN V/O	Eric Byrnes has emerged from the dugout to bat for Menechino -
M	BRENNAMAN V/O	- the A's are down to their last strike and this Yankee crowd is on its feet - Rivera squints for the sign, he has it, delivers and - Again, at the crucial moment, he cuts the radio. Waits
M	BRENNAMAN V/O	It is bedlam in New York. The Yankees - down two games to none - have come back to win three, and the Division Series.
M	STEVE LYONS V/O	This is an exceptional feat not only for New York, Thom, but for Oakland - though not the kind you can be proud of: Only once before has a team lost a Division Series after winning the first two games -
F	BILLY	It's okay, Joe, you can leave it on. It's no big deal.
M	SECURITY GUARD	No, it's okay, I don't need to watch it.
F	BILLY	How's Meg?
M	SECURITY GUARD	She's good, thanks.
F	BILLY	And the boys?
M	SECURITY GUARD	They're good. Everybody's good.
F	BILLY	That's good. The security guard waits for the baseball to sail through
F	BILLY	Night.
M	SECURITY GUARD	Night, Billy. It was a great season.
M	TARA V/O	They had three times your payroll, Billy.
F	BILLY	Yeah...
M	TARA V/O	You're not watching them celebrate, right? Car's off. Billy sits in the dark on his phone.
F	BILLY	No. That would be, uh--
M	TARA V/O	Pointless? Self-destructive? Masochistic?
F	BILLY	Are you asking me to pick one?
M	TARA V/O	What you should be doing is thinking about what an amazing job you did and how great you are.
F	BILLY	I'll be honest, right this minute I'm not thinking about either of those things. You take a team with that payroll to the playoffs? You take the Yankees to a fifth game? I'm not even sure the better team won.
F	BILLY	They were down two-love and then beat us three in a row. Trust me, the better team won.
M	CALLER V/O	--while embarrassing the entire city and making a mockery of their fans. I'm sick of this.
M	TARA V/O	Let's go away.
F	BILLY	That sounds good.
M	TARA V/O	Someplace they don't have a baseball team.
F	BILLY	How about Oakland?
M	TARA V/O	Okay, here are the rules for tonight. You can do anything you want but you can't give any quotes to the press, go on the internet or hurt my car, we have a deal? Yeah.
M	TARA V/O	They had three times your payroll, Billy. From the radio we've been hearing shards of "--an
F	BILLY	Yeah.
M	TARA V/O	How about Hawaii? I'll make a reservation someplace. The place with the turtles. Great. I'm on my way.
F	BILLY	Is it Boston? You're talking to Boston? What are they offering? What does it matter to you?
F	BILLY	What?! I mean -- what does it matter since whatever it is you can't afford it.
F	BILLY	You don't know that.
M	BORAS V/O	I don't? You need to hurry.
F	BILLY	I don't know that -- since I don't know what they're offering. What did she say?
M	TARA	She said we had to hurry up.
F	BILLY	Scott? Scott?
F	BILLY	What did they offer?
M	BORAS V/O	They offered seven and a quarter.
F	BILLY	Just to be clear -- they offered seven and a quarter.
M	BORAS V/O	Yes. As opposed to you said seven and a quarter and they're thinking about it. No, they offered seven and a quarter and I'm thinking about it. And you're thinking -- what.
F	BILLY	I'm thinking I don't want to lose Damon, but I don't pay my whole infield seven million dollars.
M	TARA	We're losing Damon?
M	BORAS V/O	For seven and a half, Billy, you can keep Johnny Damon and we can be done thinking. I have to go, my plane is boarding. Wait, don't hang up. Don't hang up --
M	TSA OFFICER 1	Is that phone still on?
F	BILLY	What's the difference?
M	TSA OFFICER 1	Faradie. Can his phone be on?
M	TSA OFFICER 2	Sir, you need to turn your phone off.
F	BILLY	It's already through. Billy grabs his phone from the other side.
F	BILLY	Seven point five?
M	BORAS V/O	Seven point five.
F	BILLY	I'll talk to Steve. BORAS V/O Talk to Steve.
M	TARA	Try to relax.
F	BILLY	A small emergency is starting to develop.
M	TARA	Try. Try to relax.
F	BILLY	You look fantastic today. Hello?
F	BILLY	Arn. Billy. We gotta talk about Giambi.
M	TARA	Wait, we're losing Giambi, too?
M	ARN V/O	I can't talk about that now. I can't talk about anything now.
F	BILLY	We can talk now. We're talking now.
M	ARN V/O	We can't talk now. I'm at a family thing. I'll call you Monday.
F	BILLY	Who are you talking to -- the Yankees?
M	ARN V/O	I'm talking to everybody. But not today. I'm not in today. I'm hanging up.
F	BILLY	Don't hang up. He hung up.
M	TARA	You found Giambi. Billy dials another number --
M	TARA	A thousand dollars says you don't get on the plane.
M	SECRETARY V/O	Arn Tellem's office.
F	BILLY	Denise. Billy. These guys are auctioning off my team one player at a time. He's not in today, Billy.
F	BILLY	I know, I just want to send him flowers.
M	SECRETARY V/O	Flowers?
M	TARA	Flowers?
F	BILLY	Where would I send them?
M	SECRETARY V/O	To who? To Arn.
M	SECRETARY V/O	You want to send him flowers? You're not going to be anywhere near Hawaii.
F	BILLY	To where he is now, yes.
M	SECRETARY V/O	Beth Israel Temple, Beverly Hills.
M	TARA	The airport is as close as you got. Thank you, Tara.
M	SECRETARY V/O	Denise.
M	TARA	I'm Tara. I know. I need a day. TARA One day. I'll fly out tomorrow.
M	TARA	It's gonna be more than one day. We're losing Isringhausen too?
F	BILLY	Only if my luck stays exactly the same.
M	TARA	It's like the bell rang but you're still getting hit in the head. Just in case.
F	BILLY	I'm sorry. Have fun out there.
M	TARA	I'm picking up a guy at the breakfast buffet.
F	BILLY	A left-handed reliever if you can.
F	BILLY	How much longer you think?
M	GUEST	What?
F	BILLY	Nah, it's okay.
F	BILLY	Arn, I don't wanna lose him.
F	BILLY	I don't wanna lose him.
M	ARN	This is my nephew's Bar Mitzvah.
F	BILLY	He did well with his Torah portion I thought.
M	ARN	Thank you.
F	BILLY	What did they offer?
M	ARN	He's not staying in Oakland, Billy.
F	BILLY	What did the Yankees offer him?
M	ARN	It's New York; you've got to give a player a reason not to play there.
F	BILLY	What did they offer?
M	ARN	17 million.
F	BILLY	No way.
M	ARN	Yeah.
F	BILLY	I don't pay my whole infield 17 million dollars.
M	ARN	I know, I know...
F	BILLY	For how long?
M	ARN	17 a year for seven years.
F	BILLY	A hundred and twenty million dollars?
M	ARN	Hundred and nineteen. You gotta get Steve to let you spend some money.
F	BILLY	That's pretty good advice, I should do that.
M	ARN	Steve doesn't get it. This isn't a charity raffle.
F	BILLY	Arn. I get it, he gets it, Jason gets it and you certainly get it. I'll talk to him.
M	ARN	And you're losing Isringhausen, too.
F	BILLY	Ya think?
M	ARN	I've gotta get back.
F	BILLY	Hey mazel tov, Arn.
M	ARN	Thank you. Good luck.
M	KID	Are you Billy Beane?
F	BILLY	Yes.
M	KID	That was a pretty serious choke.
F	BILLY	Are you from around here?
M	KID	Yeah.
F	BILLY	You a Dodger fan?
M	KID	Yeah.
F	BILLY	Here, drink a lot of this.
F	BILLY	We're losing Damon and Giambi. We can't survive losing Damon and Giambi.
M	SCHOTT	Isringhausen's gone, too, don't you think?
F	BILLY	I can win without a closer. I can't without power.
M	SCHOTT	So negotiate with them.
F	BILLY	I have. They want more.
M	SCHOTT	So offer them a little more.
F	BILLY	I have. They want more than a little more.
M	SCHOTT	Like what. What'll it cost - say - to keep Giambi? BILLY
M	SCHOTT	17 for how many (years) -
F	BILLY	One.
M	SCHOTT	For one year? Billy nods. Steve smiles. And Billy knows what it
M	SCHOTT	I have confidence you'll find a way to make it work without them.
F	BILLY	I can't.
M	SCHOTT	Sure you can.
M	SCHOTT	Billy. What are we? The Taj Mahal? We're a small-market team. Obviously, we can't afford Giambi at such a (price) -
F	BILLY	Fine. He's gone. But I might - for a bit more than last year - be able to keep Damon in (Oakland) - I need more money, Steve.
M	SCHOTT	Billy...
F	BILLY	I can't compete against a hundred and twenty million dollar payroll with a forty million dollar payroll.
M	SCHOTT	We just won 102 games with a forty million dollar payroll.
F	BILLY	With Giambi and Damon. We wouldn't have without them. Silence. Then -
F	BILLY	You can't ask me to be okay with losing. That's too much to ask a professional athlete. SCHOTT
F	BILLY	It's too much, Steve!
M	SCHOTT	You're not a professional athlete! You're a professional GM. We're a small market team. You're a small market GM. And I'm asking you to be okay with not spending money I don't have. And I'm asking you to take a breath and shake off the loss. And then I'm asking you to get back in a room with your people and figure out how you're going to replace these guys with the money I do have. Got it? SCHOTT can go from milquetoast to ruthless in a blink and
F	BILLY	Scott. Billy.
M	BORAS V/O	What was that beep?
F	BILLY	It's just my phone, it's about to die, but this'll be quick - listen - I'm losing my favorite prospects, but I got you the seven point five.
M	BORAS V/O	That's great. I'll get right back to
F	BILLY	No. No, you won't. I got it for you and we're done. Damon stays in Oakland.
M	BORAS V/O	Billy - I have to talk to Johnny - obviously. It's my fiduciary (duty) -
F	BILLY	Whose number is that - seven point five. Mine?
M	BORAS V/O	No, it's mine - It's yours. So make your call, but don't play me, Scott. We have a deal. I won't be a stalking horse. The word stays in the - dictionary.
F	BILLY	Sorry, hon. I'm gonna need another day.
M	TARA (V.O.)	Take your time, do your thing. There are a lot of cute guys here.
F	BILLY	You've got my suitcase?
M	TARA (V.O.)	No, the airline sent it to Prague. Why? Well, we left out of Oakland, honey... and I think the baggage handlers knew it was yours.
F	BILLY	Okay.
F	BILLY	I gotta take this. Wish you weren't insane. Miss you. She hangs up. Billy hangs up and switches to his cell --
F	BILLY	Yeah. Billy. Scott. I just got off the phone with Dan.
F	BILLY	No, you didn't. Yeah, I was surprised he even called me. Because he had said --
F	BILLY	No, I have Johnny for seven-point-five or he's not playing anywhere, because that's the deal -- Boston just upped it to seven-seven-five.
M	BORAS (V.O.)	You there?
F	BILLY	We had a deal. We have a deal. If it's eight million.
F	BILLY	Why am I the ugliest girl at the dance, Scott? Why do I get the feeling I'm always gonna be a quarter million short? I'm just doing my job for my client. That's all I'm doing.
F	BILLY	No, you played me. And you're playing me now. Congratulations, asshole. You win. Billy hangs up on him.
M	GRADY	Alright, guys... we had a great year. We won 102 games and we only came a buck short in New York. Now the bad news... we've got three big holes to fill. Let's start with who we like for Giambi. We'll go around the room. Who you like, Matty?
M	KEOUGH	I like Geronimo. Guy's an athlete. This guy is big, fast and talented.
M	GEORGE	Six foot four.
M	PITTARO	Top of my list.
M	POTE	Clean cut, good face.
M	ARTIE	Good jaw. He's the real deal.
M	GEORGE	Five tools, good lookin'.
F	BILLY	Can he hit?
M	KEOUGH	He's a tools guy.
F	BILLY	Can he hit?
M	KEOUGH	He's got a great swing. Natural swing.
F	BILLY	So you're saying he can't hit.
M	KEOUGH	He can hit.
M	BARRY	The ball explodes off his bat.
M	ARTIE	It's exciting. When he hits it sounds like he's droppin' a firecracker at his feet.
M	PITTARO	Down in the pisser you can hear that sound.
M	BARRY	Sounds like Mays, Mantle, Aaron...
F	BILLY	That's not what I asked. I asked can he hit.
M	KEOUGH	He's a good hitter.
F	BILLY	If he's a good hitter, why doesn't he hit good?
M	KEOUGH	He needs a little work. He'll be able to hit. He could be a great hitter.
F	BILLY	Right... we put him up against big league competition and suddenly he'll be able to hit. Grady moves on --
M	GRADY	Artie, who do we like?
M	ARTIE	I like Perez. He swings like a man.
M	KEOUGH	He swings like a man who swings at too much. There's some work needs to be done. I admit it. He needs to be reworked a little. But he's noticeable.
M	GRADY	He's notable?
M	ARTIE	No, he's noticeable. You notice him.
M	KEOGH	He's got an ugly girlfriend.
M	BARRY	What's that mean?
M	KEOGH	Ugly girlfriend means no confidence.
M	BARRY	Alright. That's true.
M	PITTARO	I agree with Art. I like the way he walks into a room. Kid's so confident his dick gets there two minutes before he does.
M	GEORGE	Passes the eye candy test. He's got the looks, he's ready to play the part. He just needs some playing time.
M	KEOUGH	I'm just saying, his girlfriend's a 6.
M	BARRY	Billy, if you want to talk about another Giambi, this guy could be it. Enough. Billy raises a book above the table, drops it
M	GRADY	Is that a suggestion, Billy?
F	BILLY	Guys, stop. You're talking like this is business as usual. It's not.
M	GRADY	We're trying to solve the problem.
F	BILLY	Not like this. You're not even looking at the problem.
M	GRADY	We not only have a very clear understanding of the problem we now face, but everyone in this room has faced similar problems countless times before.
F	BILLY	Good. What's the problem?
M	GRADY	The problem is that we've lost 3 key players that we now have to replace.
F	BILLY	Uh-uh. What's the problem? The problem is the same as it always is; we've got to put a team together with what we've got. Uh-uh. What's the problem?
M	BARRY	We've got 38 home runs to replace, 120 rbi's, 47 doubles...
F	BILLY	Okay, stop. The problem we're trying to solve is that this is an unfair game. There are rich teams, poor teams, 50 feet of crap and then there's us. And now we've been gutted. We're organ donors to the rich. The Red Sox took our kidneys and the Yankees took our heart. And now I'm listening to the same old shit about having a good body and being a tools guy like you're looking for Fabio. Is there another first baseman like Giambi? Is there? Everyone mumbles "no."
F	BILLY	Then stop looking for one because what we'll surely wind up with is the McNuggets version of Giambi.
M	GRADY	Look, we're gonna find 25 guys, put `em through player development, teach `em how to play Oakland A baseball. This is no time to push the panic button. This is the way we've been doing it for 150 years. Let us do our job. If we try to play like the Yankees in here, we're not going to be able to play with them out there.
M	GRADY	That's fortune cookie wisdom.
F	BILLY	No, it's just regular wisdom.
M	POTE	Who's Fabio?
M	GRADY	Okay, Billy. Clearly you have something on your mind.
F	BILLY	Bill James.
M	ARTIE	You're not serious?
M	PITTARO	We're not playing fantasy baseball, Billy.
M	BARRY	Those aren't new ideas, they disproved that years ago.
M	GRADY	Bill James was a night security guard at the Stokely Van Camp Pork and Beans Factory.
F	BILLY	He thinks differently than anyone in baseball.
M	GRADY	He's not in baseball. He's in pork and beans.
F	BILLY	Don't attack the man, attack the argument.
M	PITTARO	I think he just won the argument.
F	BILLY	What if we've been wrong this whole time about what ingredients manufacture a win? What if this whole time we thought it was the chicken that made the chicken soup taste good when really it was the onions that made the chicken soup taste good? Onions are a lot cheaper than chicken, you see what I'm saying?
M	POTE	I don't have the first idea what you're saying.
F	BILLY	We gotta start over. We gotta rethink this thing. We gotta look where others aren't looking.
M	GRADY	With all due respect, we've been doing this for a long time.
F	BILLY	That doesn't mean you're doing it right. Do you watch nature docs? You know what happens to the runt of the litter? He dies. I'm open to any solution, as long as it's not what the other guys are doing. Now, I'm going to Cleveland to poach an outfielder named Brandon Garcia --
M	TBD SCOUT	Hold on -- You're going to Cleveland for a double-A guy?
M	GRADY	Billy, I've seen Garcia. He's got a bad body. It's not a pretty sight.
M	PITTARO	Kid wears a large pair of underwear.
M	KEOGH	That is a big boy.
M	GRADY	He's not just big, but kind of doughy. A fleshy kind of body.
F	BILLY	Oh, you mean like Babe Ruth. He's no Babe Ruth.
M	PITTARO	When he walks, Billy, his thighs stick together. There's enough friction there to start a bonfire.
M	KEOGH	If you saw him, I'm telling you, you wouldn't want to go to Cleveland.
M	BARRY	Billy, can I make a suggestion? If you could get Ricardo Rincon... he'd be worth the trip to Cleveland. That would solve our left handed reliever problem.
F	BILLY	Really? Yeah.
F	BILLY	I should get Rincon?
M	SCOUTS (UNISON)	Definitely.
F	BILLY	Okay. I'll also come back with Joe DiMaggio and Ty Cobb. And who would like a Fabergé egg? Guys, you aren't hearing me -- in what universe can we afford Rincon? I'm asking you guys to look at this game differently than you've ever looked at it before. I'm going to Cleveland. And when I come back, I want you to tell me something I don't already know. I want to question everything. We've got to rethink this game. As he exits --
F	BILLY	And Grady? Nobody cares about a 102 win season.
M	KEOUGH	What's a Fabergé egg? BILLY, tanned and glistening with sweat, looks over to
M	SABATINI	This is the guy.
M	MARTINEZ	He's got a great path. I love the extension in his swing and the backspin he creates.
M	SABATINI	That's some amazing power right there, huh?
M	MARTINEZ	Good approach, great balance. How's he compare to the others around the country?
M	SABATINI	He's number one. Let's just hope he's still there when we pick.
M	MARTINEZ	This guy'll go in the first round.
M	SABATINI	Billy. I'm Sabatini, Area Scout, New York Mets. Can we get a couple minutes of your time, find out more about you?
F	BILLY	Of course.
M	SABATINI	I'd like to introduce you to Tom Martinez.
M	MARTINEZ	Very impressive performance today. In my job as the national cross-checker for the New York Mets, I see the top 200 players in the United States. It's been a while since I've seen a five tools guy, the complete package. Your throwing ability, your fielding skills... Ed told me you had power but I had no idea it was of the light tower variety. I hope you're as interested in professional baseball as we are in acquiring you in the upcoming draft. Well, sir, I'd need to talk it out with my parents, decide if baseball is something I want to do full time. I have a scholarship to play football at Stanford.
M	MARTINEZ	Well, Billy, we're certainly looking forward to meeting your folks and talking to them as well. And we believe in college, but that's something you can do in the winter months. You need to know the sky's the limit with your ability. You could be a superstar before you've even graduated. But to get to that level, you need to work with our people. Pro-ball is where you need to be to develop the skills God gave you.
M	ASSISTANT	Mr. Beane? Mark's ready to see you now.
M	SHAPIRO	So Billy, what are you looking for?
F	BILLY	50 million in additional payroll.
M	SHAPIRO	Try Giambi.
F	BILLY	Ouch. 120 million.
F	BILLY	I should've been a hitter.
M	SHAPIRO	Where's Steve in all this?
F	BILLY	Supportive. Excited about rebuilding the team.
M	SHAPIRO	Bonds is available.
F	BILLY	Yeah, how do I afford the rest of the field?
M	SHAPIRO	So what are you looking for? I want to help out.
F	BILLY	I guess you've touched the bottom of the sports industry when your opponent is I need a lefty reliever and I want Ricardo Rincon.
M	SHAPIRO	Not going to happen.
F	BILLY	Not even a discussion?
M	SHAPIRO	Come on Billy, even if you could afford him we're not about to let him go.
F	BILLY	Why's that? You've got the Venezuelan kid in North Carolina you're bringing up.
M	SHAPIRO	We dished him to Detroit. Keep up.
F	BILLY	Well there goes my other idea.
M	SHAPIRO	What else you thinking Billy?
F	BILLY	You have any outfielders I should be looking at?
M	SHAPIRO	To replace Damon?
F	BILLY	Yeah.
M	SHAPIRO	That's a tough one Billy.
F	BILLY	Yeah. Who do you got?
M	SHAPIRO	The guys you might be able to afford? Hollins, Garcia... Coste.
F	BILLY	Tell me about Garcia.
M	SHAPIRO	To replace Damon?! Is he healthy?
M	SHAPIRO	He had a back thing, some minor surgery, but he's okay. Petey?
M	PETEY	He'll be good by Spring Training.
F	BILLY	He'll do. I can give you Guthrie for him if you kick in some cash.
M	SHAPIRO	Mark Guthrie? Shapiro looks around the room at the guys who don't
M	SHAPIRO	How much are you thinking?
M	SHAPIRO	Sorry about that. So... Garcia is going to be a no. What else are you thinking about?
F	BILLY	Let's make it work, I'll go straight up with you, Garcia for Guthrie, no kicker.
M	SHAPIRO	Sorry Billy, who else you interested in?
F	BILLY	Hey.
M	PETER	Hi.
F	BILLY	Who are you?
M	PETER	My name is Peter Brand. What do you do?
M	PETER	I'm special assistant to Mark Shapiro.
F	BILLY	So what do you do? Hey, mind your own business. What do you do?
M	PETER	Mostly player evaluation right now. Why does Mark listen to you?
M	PETER	Actually he rarely does.
F	BILLY	He just did.
M	PETER	I don't think he was really listening to me in there per se.
F	BILLY	Really?
M	PETER	Yeah, I think he was listening to Bruce.
F	BILLY	Who are you?
M	PETER	Peter Brand.
F	BILLY	I don't give a rat's ass about your name.
F	BILLY	What happened in there?
M	PETER	I'm not sure what you're asking me.
F	BILLY	What did you tell Butch?
M	PETER	Huh? Oh Bruce? I told him I like Garcia. BILLY Why? Probably for the same reasons you do.
F	BILLY	Meaning what?
M	PETER	He's undervalued. You were smart to go after him. BILLY What makes him undervalued?
F	BILLY	Come on.
F	BILLY	Where you from Peter?
M	PETER	Maryland.
F	BILLY	Where did you go to school?
M	PETER	Yale.
F	BILLY	I hate Yale.
M	PETER	Why?
F	BILLY	Kid from Yale once blocked a trade I was trying to make. What'd you study?
M	PETER	Economics.
F	BILLY	What are you doing in baseball?
M	PETER	I love baseball.
F	BILLY	I'm just curious. Why were you so cagey in there?
M	PETER	I work for a different team.
F	BILLY	I know, but I'm the first person in baseball who's ever talked to you this long. Right? Why is Garcia undervalued?
M	PETER	Okay, truthfully, it might not be so easy to explain.
F	BILLY	Really? Why's that Peter?
M	PETER	We might not see the game the same way.
F	BILLY	Oh really? What do you mean by that?
M	PETER	You've spent your life in baseball and I don't have a very traditional view of the game.
F	BILLY	Hey Pete, just say it. I'm not about to beat you up. Say what you've always wanted to say to a GM.
M	PETER	Baseball thinking is medieval. It's stuck in the Dark Ages. I have a more scientific view of the game.
F	BILLY	Keep going, Peter.
M	PETER	There is an epidemic failure within the game to understand what's really happening. And it leads people who run major league teams to misjudge their players and mismanage their teams. They're still asking the wrong questions. People who run baseball teams still think in terms of buying players. Sorry to say that.
F	BILLY	Peter, don't apologize for what you believe.
M	PETER	The goal shouldn't be to buy players, what you want to buy is wins. To buy wins, you buy runs. You're trying to replace Johnny Damon. The Red Sox look at Johnny Damon and they see a star worth seven point five million a year. When I look at Johnny Damon, I see an imperfect understanding of where runs come from.
M	PETER V/O	His batting average is ignorable. What matters is his on base percentage-
M	PETER V/O	- which in 2001 was .324. That's 10 points lower than league average, and 17 points lower than Garcia's.
M	PETER V/O	True, he stole some bases. But attempted steals in general have to succeed 70% of the time before they even start to contribute to run totals. In 2001 he cost you runs. DAMON's tagged out at second. He's got a good glove. He's a decent leadoff hitter. He steals bases. But he's not worth the seven point five million Boston is paying him. You're lucky to have him off your payroll, it opens all kinds of interesting possibilities.
F	BILLY	You read Bill James, Pete?
M	PETER	Yes. These ideas and this approach to the game aren't all new. In fact, some of them have been around for two decades. If this approach has been around for so long, why isn't anybody in baseball doing them?
M	PETER	That's a much more difficult question than how to win baseball games. Once you begin to pull at that string, your understanding of the world might begin to unravel.
M	MOTHER	Billy? They're here. Billy... Good to see you again. Obviously you're a very special player. We'd like to compliment you on your high school career, and we're looking forward to you being a part of the Mets family. Jongewaard sits at the kitchen table, speaking more to
M	JONGEWAARD	There's good -- and there's premium. Your son is premium. He has it all -- power, speed, the arm. The Look -- and I'm never wrong about that. Which is why this is a premium number. He sets a contract on the table. Clipped to its top-
M	MOTHER	Billy's been offered a scholarship to Stanford.
M	JONGEWAARD	I know. And that's a great accomplishment. I'm sure you're very proud of him.
M	MOTHER	So he can accept that, go there, and then - Jongewaard is already shaking his head no.
M	JONGEWAARD	I understand how important college is. I do. But what I can't do is burn a second first-round draft pick on someone who can't play for four years -- no matter how good he is. Four years is ample time for someone to get hurt. It happens all the time. So, no. I'm sorry. It has to be one or the other. To postpone four years is four years he could be in big leagues. The sooner he gets there the sooner he can reap the benefits.
M	JONGEWAARD	We're going to give him a different kind of education. This won't be his life's career, it'll be his first career. He's going to be a young guy in the business world when his baseball career is done. He'll still have his whole life ahead of him.
M	FATHER	It's your decision, Billy. Whatever you decide is fine with us.
M	PETER	Hello? It's Billy Beane.
M	PETER	What time is it?
