M	CHARACTER	DIALOGUE
F	CHET	I messed up, too. I'm a dude who slept with his best friend's ex- girlfriend, and destroyed his parents' marriage, and sat on the sidelines watching his downward spiral. I'm a shitty human being. But I'm glad you know that now, because you can accept me for who I am.
M	WILL	I do. I accept you. Because you accept me.
F	CHET	Woah! You still got a bomb on you.
M	WILL	You're right. Let's take care of that. But you owe me a hug.
M	WILL	It's all gravy from here.
M	DWAYNE	This who I think it is? Can't you hear the ticking in the background?
M	DWAYNE	You know, you're a pretty funny guy. Thanks. I'm happy to entertain a complete psychopath. DWAYNE Now wait a second, you're the murderer. What's that supposed to mean?
M	DWAYNE	One of those cops who wrecked his car chasing you...he ain't breathing no more. Will goes white, covers the phone and whispers to Chet -
M	WILL	We killed a cop.
F	CHET	You were driving! I'm just an accomplice! WILL They're gonna hunt us down and kill us. Cops don't take this shit lightly.
F	CHET	I bet he had like eight kids. We have to find them and support his family forever.
M	WILL (O.S.)	What's so fucking funny!?
M	DWAYNE	I'm just messin' with you. You didn't kill anyone. How'd a moron like you manage to rob a bank? Jesus! Can we just get this over with? Where do you want the money?
M	DWAYNE	There's a boarded up gas station out on Commerce Avenue, past the highway. Be there in 30 minutes. I'll be there in ten.
M	DWAYNE	Then you'll be standing around with your dick in one hand, and my money in the other.
M	DWAYNE	Yo, Juicy, wrangle your boy. Money's on its way.
M	DWAYNE	I remember the summer after my mother passed was the first year they had the Monopoly game at McDonald's. I musta come here three times a day trying to collect all the game pieces. Packed on 20 pounds, got acne from all the grease. The Major said I was the fattest, ugliest 13-year-old he ever laid eyes on. But I didn't care, I just wanted to win the money and get the fuck out of there. So, one night, I followed this skinny register kid home, jumped him. I kept whaling on him, asking him where they were hiding the Park Place piece. The million dollar prize. But he didn't know shit. A year later, The Major won the lotto. I asked him for a Sega Genesis. He bought me one of those paddles with the ball attached.
M	DWAYNE	I'm not ashamed to admit that I've gone through some dark times since then. Depression. Addiction to a variety of shit, which I won't go into. I know you must think that's pretty silly, especially since you manage to get through the day and you don't got shit going on as compared to me. But that's just the way it is. That's life.
M	JAY	You know, I've been pretty low, too... if you ever want to talk about that kinda stuff.
M	DWAYNE	No. I don't. My whole point I was trying to make before you interrupted me was that that shit is all in the past. 'Cause I did it. I finally pulled it off.
M	JAY	We pulled it off, Dwayne. The two us. We're a good team.
M	DWAYNE	Are we? Would you do anything to protect me, my money, my empire?
M	JAY	Yeah, sure... I mean, like what kinda stuff are we talking about?
M	DWAYNE	Would you push the button?
M	JAY	Why would you want me to do that?
M	DWAYNE	It's just a question, Jay. Would you? If I asked you?
M	DWAYNE (CONT'D)	I mean, it's no different than those watermelons.
M	JAY	Watermelons aren't alive.
M	DWAYNE	Yeah, they are. Not the ones you blew up, though.
M	JAY	No one gets hurt...right, Dwayne?
M	DWAYNE	Oh, yeah. I forgot about that part.
M	DWAYNE	Anyway, he hasn't even made the drop yet. I'm gonna go take a shit. Stay away from the bathroom. Someone could get hurt.
M	WILL	Where are the other guys?
M	VAUGHN	I'm the only guy. You got it?
M	VAUGHN	What the fuck did you do...rob a bank?
M	WILL	Yes.
M	WILL	Now where's the code?
M	VAUGHN	I don't have any code.
M	WILL	Listen, man, I just want the code.
M	VAUGHN	I don't know what the fuck you're talking about.
M	WILL	The code for the fucking bomb!
M	VAUGHN	What kind of stupid motherfucker wears a bomb to a drop?
M	WILL	Your boss put this on me.
M	VAUGHN	I am my boss.
M	WILL	Then give me the code!
M	VAUGHN	Motherfucker, I don't know no goddamn code. Whoever told you I did, lied to you. Now step the fuck off, or I'll shoot you in the face so you don't explode and mess up my boots.
M	WILL	If you don't have the code, I want that money back.
M	VAUGHN	The only way you're getting this money back is if you kill me.
M	WILL	You don't know what I've gone through for that money!
M	VAUGHN	Do I look sympathetic? Now step the fuck aside.
M	JUICY	Vaughn, look out!
M	WILL	Let's go!
M	Will's mind is racing.	
M	WILL	What the fuck was that?
F	CHET	They tried to screw us. You're a liability. They were just gonna let you blow up.
M	WILL	Not with the money they won't.
M	DWAYNE	Never comes out this nice when I do it myself. You might wanna take some more off the top, though. I wanna look real professional when I go down to the morgue to identify the body.
M	DWAYNE	You drop the money yet?
M	WILL	No! I've still got the money! And I cracked your friend's face open!
M	DWAYNE (O.S.)	Why the fuck would you do that!?
M	WILL	You lied! You said I'd get the code!
M	DWAYNE	I gave him the code. He told me he committed it to memory. He was probably just embarrassed that he forgot it. I'll call him up and - You didn't give him shit! I want the code now or you'll never see this money!
M	DWAYNE	Hold on there, big man. You got a bomb on you. I got a cell phone that detonates it. You're not exactly negotiating from a position of leverage.
M	WILL (O.S.)	I'm holding the money. I blow up, and it blows up. Who has the leverage now? Go ahead and push the button, you idiot.
F	CHET	Don't tell him to push the button! Pull over! Pull over!
M	DWAYNE	Why don't you watch what the fuck you say! I own you! I tell you to rob a bank, and you rob a bank. I tell you to give me the money, and you give me the goddamn money and hope I show you some mercy.
M	WILL (O.S.)	I'm tired of this bullshit. I'm already dead, right? So fuck you. At least I'll die rich. I can't say the same for you.
M	DWAYNE	That piece of shit hung up on me!
F	CHET	Get me out of this car!
F	CHET	That was colossally stupid!
M	WILL	It was a negotiation tactic. He'll call back and I won't answer. Then he'll call back and I will answer, and he'll realize the only way he gets the money is if he gives me the code.
F	CHET	Sure! That seems like a perfectly logical pattern of thought! I bet that's exactly what he'll do!
M	DWAYNE	Does this guy know who the fuck I am!?
M	JAY	Dwayne...you never told me you weren't going to give him the code.
M	DWAYNE	We're not amateurs. He was a loose end. I let him live, someday I woulda been walking out of my mansion and... bam! FBI, CIA, NSA, all converging on my front lawn, 'cause a loose end turned state's evidence and they got what they need to put me away.
M	DWAYNE	Fuck it, Jay. I'll just kill The Major myself.
M	JAY	Don't do it.
M	DWAYNE	You know what they say about a tree falling in the forest? Maybe the same thing applies to blowing up some motherfucker across town. Maybe it doesn't even make a sound.
M	DWAYNE	Boom.
M	FEMALE VOICE (O.S.)	Hello...who is this...hello...?
M	DWAYNE	Who did I just call, Jay? 'Cause she sounded cute for a bomb.
M	JAY	Gina Kim. My seventh grade crush. Or whoever lives in Gina Kim's house now.
M	DWAYNE	Where's the number for the bomb?
M	JAY	In my head. I switched it out of your phone while you were taking a shit. You're out of control, Dwayne.
M	DWAYNE	I'm in perfect control!
M	JAY	Stop it! DWAYNE You asshole...I make you my partner and you pull this shit... JAY I'm tired of you pushing me around all the time! What kinda partner does that!? DWAYNE Fuck you...I'm gonna piss blood, aren't I?
M	JAY	That's what it said on the internet. Dwayne's phone rings in his pocket. DWAYNE Go on. Get it out for me. I can barely move. Jay pulls the cell from Dwayne's pocket...opens it and puts DWAYNE Glad you came to your senses. INTERCUT WITH:
M	VAUGHN	Who the fuck do you think you're talking to!? I honestly don't know.
M	VAUGHN	Let me give you a hint: your boy just jumped me, tossed my bitch like a rag doll and split with the cash.
M	DWAYNE	That guy's not my boy. He's a dick. I'm sorry for all the, uh, confusion.
M	VAUGHN (O.S.)	Confusion? The only motherfucker that's confused is you. Apparently, you think you can fuck me and survive the day.
M	DWAYNE	I wasn't fucking you, I was fucking him. You gotta understand, you're like a pawn in a much larger game I'm playing here. Did you just call me a pawn, you stupid fuck!?
M	DWAYNE	I didn't mean it like that. I'm just juggling a whole lot of shit.
M	VAUGHN (O.S.)	I want my money. Right now.
M	DWAYNE	That may not be possible. I just want to put this out there, to keep you in the loop...but I may need to bump the hit.
M	VAUGHN	This isn't a reservation at Sizzler! You don't "bump" it! I want you to bring me my money right now, to where I am standing in this shit hole town, bleeding from the motherfucking face!
M	DWAYNE (O.S.)	I don't exactly have the money...give me some time and -
M	VAUGHN	The deal's off! You just became the hit!
M	JUICY	He lives with his daddy. You already got the address.
M	DWAYNE	That's it. The assassin's gonna kill me now. I'm gonna die. Game fucking over.
M	JAY	We can still get him the money. Try the pizza guy back.
M	DWAYNE	Why? So he can fuck around again, and I wind up dead, anyway? No. I'd rather just sit here. I want to die right here on this couch.
M	JAY	No. We're gonna get that money. Just like we planned. All we gotta do is get the leverage back.
M	DWAYNE	How do we do that? Pizza boy's obviously got some kinda death wish.
M	JAY	We take the girl. The one he went to see. Then he won't try shit.
M	DWAYNE	That's actually...that's a great fucking idea, Jay. It's the best idea anyone's had all day.
M	JAY	I was just trying to figure out how you would do it, Dwayne.
M	DWAYNE	Ok. Then let's do it right. We leave nothing to chance. Because if we go to prison for this, I won't be able to watch out for you.
M	JAY	Ok, Dwayne.
M	DWAYNE	You should probably bring the flamethrower, buddy. There's gonna be some evidence to dispose of.
F	CHET	It's been half an hour.
M	WILL	He'll call.
F	CHET	In another 30 minutes I'm calling the bomb squad.
F	CHET	These guys obviously aren't watching you anymore.
M	WILL	You know, even if they get the bomb squad here in time, and they can somehow get this thing off me, we still gotta answer for the robbery.
F	CHET	I'll take the heat with you, Will.
M	WILL	Nah. I'll tell them I forced you into it. That you didn't have a choice.
F	CHET	Thanks, man. WILL That's it? You're not gonna think about it a little longer? After all we went through...tear down the relationship, rebuild it...you're gonna let me go to prison alone? CHET You offered. WILL It was a test. Your grade: F minus. You know what the "F" is for? CHET To fuck myself? WILL You passed that test. Failed the important one. As the guys continue to argue - SUPER COUNTDOWN: 1 hour, 28 minutes... Kate walks down a hallway, turns into an office. Two figures
M	DWAYNE (O.S.)	Why don't you just slide the phone under the door, so I don't have to kick it open and see you with your panties down.
M	DWAYNE	What's the quietest way out of the building? 'Cause I might get excited in a confrontation, and you might wind up shot in the face.
F	MAJOR	Dwayne?
M	VAUGHN (O.S.)	Just stay where you are, old man.
M	VAUGHN	I'm looking for your son.
F	MAJOR	Even if I knew where he was, I wouldn't tell you nothing.
M	VAUGHN	Don't be stupid.
F	MAJOR	You know, I saved a black man's life in the shit. So if I took yours I'd be even.
M	VAUGHN	I see where your son gets his common sense.
M	VAUGHN (CONT'D)	But you might want to readjust your attitude, because I ain't fucking around. I want Dwayne. I don't know why you'd want to protect him, the motherfucker hired me to kill you.
M	VAUGHN	Just tell me where he is!
F	MAJOR	You think I'm scared of death? There's a whole generation of gooks that think I'm the grim reaper.
F	MAJOR	I'll ride you all the way to hell! I know exactly how to get there!
M	VAUGHN	What now, old man!? You can't kill me! None of y'all can kill me!
F	MAJOR	Go on and -
M	VAUGHN	Motherfucker has lost his mind...
F	CHET	Look at the upshot, while you're behind bars you can finally finish your degree. If I was there, too, it would just be a distraction.
M	WILL	Great idea, Chet. Thanks a lot. I'll just sit here and figure out a fucking major.
M	WILL	Hey, it's them.
M	WILL	You ready to talk now?
M	DWAYNE	Yeah, I'm ready to talk. I want my money. Meet me back at the radio tower in 50 minutes.
M	WILL (O.S.)	I've barely got an hour left!
M	DWAYNE	That's the point. I want you on a short leash.
M	WILL (O.S.)	Fuck that. Give me the code first. Then you can have your money. You'll just have to trust me when I say that I don't want it.
M	DWAYNE	Yeah, I'm sure. You just wanna go back to your fantastic life. Your great job. And that blonde bitch with the sexy voice. What the fuck is that supposed to mean? It means that girl you paid a visit to today is sitting in the back of my van right now. And it ain't exactly consensual.
M	WILL	Fuck you! You crossed a line!
M	DWAYNE	There are no lines! There's just me and you and 100 thousand dollars. Once we get that shit in order, you can have her back, and your life, too. So you're gonna show up where I say, when I say. Alone. And if you try anything stupid, the two of you will be delivering pizzas to Saint Peter.
M	WILL	Let me talk to her.
M	DWAYNE	You got ten seconds.
F	KATE	Will...?
M	WILL (O.S.)	Kate, I'm so sorry.
F	KATE	It's okay...I'm fine...I'm just really -
M	DWAYNE	She's just really gonna die if you fuck this up.
M	WILL	Fuck!
F	CHET	What happened?
M	WILL	They have Kate. What the fuck does that mean!?
M	WILL	They took her, man. They must have followed us to her office.
F	CHET	Damn it! You had to go see her!
M	WILL	I'm sorry. I messed up...I finally messed up worse than I could have possibly imagined.
F	CHET	We gotta get her back, Will. These guys are crazy.
M	WILL	We still got the money. As long as we have that, she's alive. Come on.
M	WILL	I'm here!
M	DWAYNE	How much time you got left?
M	WILL	Ten minutes.
M	DWAYNE	Damn. Maybe we should just wait around for the money shot.
M	DWAYNE	That the money?
M	WILL	Maybe. Where's the girl?
M	DWAYNE	In the van. Maybe.
M	WILL	Get her out here. You're wasting time.
F	KATE	Will, are you there?
M	WILL	I'm here. It's gonna be okay.
M	DWAYNE	This is a fucking tearjerker.
M	WILL	Just let her come over here.
M	DWAYNE	I will. But you should know, my associate over there is packing a flamethrower.
M	JAY	Just do what we say. Don't mess around or anything.
M	DWAYNE	Unless either of you can outrun a 25- foot flame. Or a bullet.
M	WILL	Get back.
M	DWAYNE	I gave you the girl. Now give me the money.
M	WILL	How about we get the code out of the way first, since this bomb happens to be ticking so close to all of us.
M	DWAYNE	Fair enough.
M	DWAYNE	You ready to be a free man?
M	WILL	Just give it to me!
M	DWAYNE	
M	DWAYNE	It's so fucking pretty, ain't it?
M	JAY	Yeah. It's awesome.
M	DWAYNE	Okay, you can get out of here now.
M	WILL	I actually have this sneaking suspicion that once we turn around, you're gonna put a bullet in both of our backs - and this is just a guess - burn our bodies.
M	DWAYNE	They say great minds think alike. And in this case, so do we.
M	WILL	I figured as much. That's why I got a gun pointed at you, too. I got a sniper in the bushes locked on you right now.
M	DWAYNE	Do I look that dumb?
M	WILL	I can't tell, you're wearing a mask.
M	JAY	Hey...on your forehead.
M	DWAYNE	Son of a bitch. Well played.
M	WILL	We're gonna walk out of here now. If you shoot, my sniper shoots. I can't guarantee he'll get both of you. But he'll definitely get you.
M	As Will turns away -	
M	VAUGHN (O.S.)	Hold the fuck up.
M	VAUGHN	Wasn't expecting to see you here.
M	DWAYNE	It's all good. We got your money.
M	VAUGHN	Nice mask, Dwayne. Now throw the money over here.
M	DWAYNE	Hold up. You don't have to do this. I just paid you.
M	VAUGHN	I've been hit with a pipe, shot with a pen, and wasted my whole motherfucking day...all because of you and this job.
M	DWAYNE	I don't know what you're talking about. Just take the money.
M	VAUGHN	I will. And then I'm gonna tie up the two loose ends in the gorilla masks.
M	DWAYNE	I'm not a loose end!
M	VAUGHN	You're a fucking idiot. You are as loose as ends get.
M	VAUGHN	What the -
F	KATE	Chet!? What are you doing here!?
F	CHET	Not now. We gotta take off. Where's Will?
M	WILL	I got the money. Let's get the fuck out of here.
M	DWAYNE	No!!
M	JAY	Dwayne! Help!
M	DWAYNE	Goddamn it, Jay!
M	DWAYNE	Stop, drop and roll!
M	JAY	You came back for me...you said you never would.
M	DWAYNE	You didn't hesitate back there, Jay. You did good.
M	DWAYNE	I'm gonna go put a bullet in that motherfucker and get our money. Think you can get outta here?
M	JAY	Yeah. Go get him.
F	KATE	Uh...I just got kidnapped.
F	CHET	Yeah, that was totally Will's fault. In case you want to factor that in while you're mulling over the whole relationship thing.
M	WILL	I'm very sorry about the kidnapping. This is me, taking responsibility for it. Growing up. Like a viable life partner.
F	CHET	This man has spied on you in the nude before!
M	WILL	What? No, I didn't.
F	CHET	He's lying. He's trying to build a relationship on a foundation of lies. And it won't stand.
F	KATE	I just got kidnapped! Can we talk about that!?
M	WILL	Oh, shit. One of those dudes is definitely not dead!
F	CHET	Hurry up! He's already on us!
M	DWAYNE	I own this town.
F	KATE	What the hell was that?
M	WILL	That was the bomb I carried around all day. I reactivated it and put it in the back of his van. I guess his time was up.
F	CHET	"His time was up?" Were you thinking that up the whole day?
M	WILL	I was prepared, yes. I can't help it if I'm the kind of guy who thinks about the future.
F	CHET	He's not that kind of guy. He doesn't think about the future. Ever.
F	KATE	What exactly happened since I saw you this afternoon?
M	WILL	Primarily, we robbed a bank.
F	KATE	What!? So you're, like, fugitives? What do we do now?
F	CHET	Yeah, Will. What does the future hold?
M	WILL	Nothing good if we stay in town and they pin this on us. Kate, I think you should put in for that vacation time. Right now. If anyone gives you a problem, tell them to fuck off. There's 100 grand in that trash bag by your feet. A third of it's yours.
F	KATE	Will, that's -
F	CHET	Fucked up. Why does she get a share?
M	WILL	Why do you get a share?
M	WILL	Airport's 30 minutes away. Pick a destination. This time it's not a practice run.
M	DWAYNE	Dad?
M	DWAYNE	Dad, are you -
F	MAJOR	Dwayne...
M	DWAYNE	What happened to you?
F	MAJOR	Some guy...said you hired him to kill me.
M	DWAYNE	Dad, I...I'd never...
F	MAJOR	Look at you...lip quivering like you're getting fucked...be a man.
M	DWAYNE	I am a man! I killed you, didn't I? Now I'm gonna use your money to open a tanning salon where they let you fuck the chicks.
F	MAJOR	You mean...like those whorehouses...in 'Nam...I used to tell you about?
M	DWAYNE	Those were great bedtime stories.
F	MAJOR	Medics are late...probably a couple lazy spicks...you tell 'em I said so...all right, son?
M	DWAYNE	Sure thing, pop.
F	MAJOR	Hell of thing...I think I may...actually respect you now.
M	DWAYNE	Get up, you pussy! Come on, soldier!
F	CHET	Fucking nine dollars to use the internet.
M	WILL	And?
F	CHET	Police think it was that black guy. They found some kind of map in his car. And I'm sure racial profiling played a part.
M	WILL	But nothing about us?
F	CHET	Nope. Guess it's time to head back.
M	WILL	I was thinking we'd stick around a little a longer.
F	CHET	Why? So you have more time to delude my sister?
M	WILL	Yes. And it'd be easier if you gave us five fucking minutes alone.
F	CHET	You really think she's into you?
M	WILL	I kissed her last night. No tongue. Then you walked in.
F	CHET	You're gonna go fuck my sister now, aren't you?
M	WILL	I'll be thinking of you the whole time.
F	CHET	At the very least...be a considerate lover. Give pleasure, before taking pleasure.
M	WILL	I think I'm reading you. And I will try my best.
M	WILL	You're Riggs! You always have been!
M	WILL	I lied and told your brother I kissed you. I thought it would make this easier.
F	KATE	Here's an idea: pretend you have a bomb strapped to your chest. Tick, TICK -
F	KATE	Is Chet watching us?
M	WILL	Probably. We should go inside. I promised him I'd satisfy you.
M	BLACK	
M	DWAYNE	GRAND OPENING SPECTACULARRR!
M	DWAYNE	Here at Major Tan, our specially trained technicians are hard at work developing new technologies that harness the power of the sun, to ensure a cutting-edge tanning experience.
M	DWAYNE	How's it looking?
M	JAY	It's our most advanced tanning bed yet!
M	DWAYNE	Hey, don't just take this scientist's word for it. The proof...
M	DWAYNE	...is in the tan.
M	DWAYNE	But Major Tan isn't just about looking good. It's also about feeling good.
M	RANDOM GUY	That "Deluxe Tan" was fantastic!
M	DWAYNE	So come on down to Major Tan...where we're proud to be a family business.
M	END COMMERCIAL.	
