M	CHARACTER	DIALOGUE
M	BLACK HAT	And as for you uy dear...You're more trouble than I anticipated. Must be your uncle's blood in you. A shame he'll never see what you'll become. I would've loved to see his face. The VAMPIRE TRAIN chugging along on its dark course, heading �Our'crew hellbent on stopping `em. The two locked on a fated
M	Twilight.	Hicks and the two Priests ride past tumbleweed drifts, the
M	HICKS	Beggar's Pass...it ain't gonna be easy. As if on cue the last rays of the sun wink out behind the Headlight crossbeams leading the way, their cycles navigate Priest lies close by, asleep.
M	HICKS	If we push it hard we'll gain two days on 'em. Should be enough to get us a jump.
F	PRIESTESS	We'need more than a jump. We need a miracle.
M	HICKS	That's the funny thing about time -- He dips his hand in the water and raises it, letting the It's always runin' right through my fingers.
F	PRIESTESS	You should try harder, sheriff. She cups her hand in the water, bringing it to her lips for a
M	HICKS	You ever regret it? Bein' a Priest?
F	PRIESTESS	No.
M	HICKS	What about a husband, children...A family?
F	PRIESTESS	I've had a family -- just not the kind you're familiar with. Hicks glances at Priest.
M	HICKS	What? You mean Mr. Laffs over there?
F	PRIESTESS	He's not so bad once you get to know him. A beat, Hick's expression becoming serious.
M	HICKS	He's going to kill her, isn't he? If. she's turned.
F	PRIESTESS	Yes.
M	HICKS	There's things that can be done. She doesn't have to die.
F	PRIESTESS	She's his bloodline... and he's a Priest. It's the only way. Hicks tosses the rest of his food into the fire, troubled, further... for now.
M	HICKS	And how many of you Priests are left now? A long moment before she speaks.
F	PRIESTESS	Two. Hicks doesn't know what to Say-,,
M	HICKS	.I'm sorry.,
F	PRIESTESS	Yes. She nods, though in affirmation of what Hicks's isn't sure. A GROUP OF PRIESTS (OUR TWO amongst them) move silently
M	THOUSANDS OF HONEYCOMBS	stretching endlessly, rising high above in a cone. THOUSANDS OUR PRIEST, motions with his hand to the others, giving
F	PRIESTESS	They know we're here. From under the earth A HAND SHOOTS UP, grabbing onto a
M	PRIEST	Retreat!
M	FEARSOME PRIEST	Battles like a tiger, grappling with TWo VAMPIRES, their claws
M	FEARSOME SUDDENLY STOPS	A BLACK TOP HAT lying on the ground catching his eye, must be The Priestess races by, shooting him a we don't have time What do you think -- Am I a "Dapper Dan"? She glares, running ahead to join the group. Fearsome just
M	FEARSOME PRIEST (CONT'D)	Guess not. From within the hive comes a MIGHTY SHRIEK -- and now At the last second -- He's pulled back by a clutch of SCREECHING HUNGRY CLAWS. The
F	PRIESTESS	Why would the Clergy forbid us from seeing each other?
M	PRIEST	Maybe they were scared of what we could do.
F	PRIESTESS	Or what we would do. We both know there's something inside the Order that's off. Even if we don't know what it is.
M	PRIEST	With or without the Clergy...we're still Priests. And we're the only ones who can stop that train.
F	PRIESTESS	If we survive this we need to expose them for what they are. We won' t survive this. She puts down her tools, staring fixedly at him.
F	PRIESTESS	You scared to die?_
M	PRIEST	No.
F	PRIESTESS	I believed in Heaven my whole life. Believed everything we were taught -- And now...when it's finally my time...no more faith. They took it away from me. Priest gazes at her, trying his best to be comforting.
M	PRIEST	Whatever happens. .. Wherever it is we go. We'll go together. At that.exact moment something inside Priest shifts just a
M	PRIEST (CONT'D)	What in greater than God but more evil than the Devil? The poor have it, the rich need it -- and if you eat it...you'lldie.
F	PRIESTESS	What?
M	PRIEST	It's a riddle. The Priestess thinks about it.
M	PRIESTESS.	Nothing. That's the answer. Nothing is greater than God. Nothing is more evil than the devil. The poor have nothing, the rich need nothing. And if you eat nothing... you'll die. It's said that warriors can become close friends only when they What you said before...about those nights when you were dreaming of me --
F	PRIESTESS	The good nights.
M	PRIEST	Yes. The good nights. Do you think maybe tonight...
F	PRIESTESS	Could be one of those nights? She smiles. And then Priest does the most amazing thing. . .he smiles back. And it is here, together in this place, where they feel like The last two. As our trio forges onward and upward, the trail more
M	The final climb.	Yawning crevices, the wind moaning as it whistles between the Carefully they ride across DEVIL'S BRIDGE, a finger of stone, The Priestess is in front leading the charge, closely Something's wrong.
M	HICKS	I- ee itl Hicks points, reaching the top of the mountain.
M	IN THE DISTANCE	A long black line snakes along the rail, puffs of heavy smoke They're ahead of it. Barely. In his excitement, Hicks thunders ahead, starting the descent But he's gone.
M	PRIEST	I know you're there. A slight sound, the mist whipping into a pool as if something
M	A GROUP OF ROCKS	Tumble down the cliff. Again Priest abruptly turns
M	PRIEST (CONT'D)	Show yourself. A BEAT as he stands in the ether, waiting. Then -- onen. ieadjna straight-for pi=. Just in time -- he DIVES, the claw BITING into a rock behind
M	RU11TE (O. S. )	I've waited a long time for this Priest.
M	PRIEST	This isn't the time to settle old scores, Rune.
M	RUNE (0. S. )	I disagree... This is the perfer, time. WOOSH! Like lightning, the claw LASHES out, appearing from. You've lost a step Priest...I never came this close before.
M	PRIEST	I'm older now. We can almost bear Rune smile.
M	RUNE (0.8.)	Not me. And now THE CHAIN comes from a different direction, WRAPPING Yelling, Priest GRABS the chain, PULLING with everything he's Rune leaps away, landing ontop a boulder.
M	RUNE (CONT'D)	You can't outrun the past, Priest... the things you did.
M	PRIEST	It was a war, Rune.
M	RUNE	It still is He launches at Priest, duster fluttering like wings. The two
M	THE PRIESTESS	Appears from within the mist, already in mid-leap, she lands ough h2 mist a single CLICKING sound. Rune looks over, sees --
M	HICKS	Six-shooter pointed right at him. A beat as the two sides stare at each other in standoff. The Another time, Priest. He skitters up the rock face, disappearing into the mist.
M	HAM!	Hicks fires a single shot, the echo ringing through the canyon.
M	RUNE'S BODY	Drops from the fog, hitting the ground with a thud. Dead.
M	HICKS	Tell me you won't kill her. Priest doesn't reply. Tell me...or I'll shoot you where you stand.
M	PRIEST	Finally showing your true colors. A beat. The Priestess looks at Hicks.
F	PRIESTESS	What's he talking about?
M	PRIEST	He's a halfbreed. Hicks cocks the gun.
M	HICKS	Don't turn this into somethin' it's not.
M	PRIEST	You've been itching to do this since Nightshade.
M	HICKS	She's your kin, goddamit!
M	PRIEST	if she's turned...she's nobody's kin.
M	HICKS	Things can be done. Things to lessen the thirst. She can have a normal life, she doesn't have to die. Priest nods grimly.
M	PRIEST	It's our way.
M	HICKS	And what is that? Some special Priest code of honor? You don't get it. Your "way' -- It's over!
M	PRIEST	Shoot me and it won't matter if you find Lucy. You won't stop that train -- and you won't save her. The Priestess steps between them, looks at Hicks. He's right. We need to be together on this... it's the only shot we have. Hicks thinks about it, knows she's right. A tense beat then
M	HICKS	This ain't done. He lowers his gun and walks away. The two warriors stand together, the Priestess gazing at Without a word, he heads back to his cycle. He GUNS the throttle and his bike BLAZES forward, wheels
M	The assault begins.	Our trio finishes their descent, BLASTING onto the
M	SALT FLATS	wheels kicking up sheets of sand and grit, spattering their You think they see us? As if in response the locomotive belches a thick cloud of
M	VR0000000000MI	SIX BLACK MOTORCYCLES (the same ones who kidnapped Lucy) fly
M	PRIEST	Make sure you get on that train, I'll catch up. 'Before they can respond, he banks his cycle to the left.
M	THE VAMPIRE RIDERS	Take the bait, going for Priest. They gun their cycles, With a SNAP he lashes it at Priest, the chain catching in his
M	PRIEST	is thrown! His beloved bike FLIPPING across the desert in
M	TWO RIDERS	Throwing a STEEL CHAIN to the other, pulling the line taut, At the last second, DUCKS, grabbing onto. the chain, swinging He lands back on the ground in a crouch, the steel chain And he gets it.
M	THE OTHER FOUR RIDERS	Circle Priest, surrounding him, the ROAR of their engines
M	PRIEST	Snaps the chain above his head, bullwhip style, LASHING out. With a SNARL the fallen riders LAUNCH at Priest. These
M	A BRUTAL FIGHT	Spinning, twisting, kicking, gnashing. Bodies locked in deep
M	PRIEST	Rips the BLAST HELMETS off his two attackers. With a Priest CRUNCHES a vampire in the ribs, knocking the creature Eyes brimming with renewed fury, Priest picks up the cycle,
F	PRIESTESS	You ready? Hicks nods, maneuvering to the side of his bike and jumping
M	PRIESTESS (CONTIB)	I'm going for the engine. Find Lucy. Before he does. Hicks nods, knowing this'll probably be the last time he sees And with that, she throttles forward, disappearing.
M	THE TRAIN CAR DOOR	Who knows what horrors lie behind it? He pops a WAD OF
M	HICKS	My.tuxn now, Priest. BAMI He kicks the door in Sunlight bursts into the darkened chamber, but only reaching The only thing we can make out is a LARGE CAGE, what's inside Hicks covers his nose from the bestial smell, the cage taking A long moment...and then the steady breathing begins again. A long line of tiny SLATS open up, RIFLE BARRELS quickly
M	PRIEST	Seemingly from out of nowhere, motors up to the train car IT'S BLACK HAT. He looks down at Priest, bowing with a
M	BLACK HAT	"And the third day He shall rise again. Priest can't believe it, seeing his long dead comrade, his
M	PRIEST	.How? Black Hat smiles, baring hi fangs.
M	BLACK HAT	Oh ye of little faith. The understanding hits Priest immediately, crashing over him
M	PRIEST	.They turned you.
M	BLACK HAT	No, Priest...I turned them. He smiles wider as we CROSSCUT TO: Shit. Gritting his teeth, he walks between the rows, quiet as WHAM! The train CATCHES the rail and the car shakes, He stops. Holding his breath...but Nothing happens. A quick Hail Mary (the man becoming more of a convert with He doesn't notice as behind hi a PX rises from one of
M	BLACK HAT	Lost souls abandoned by divinity. No belief, no voice to guide them through the wilderness. Sound familiar? Priest doesn't reply, warily eyeing him.
M	BLACK HAT (CONT'D)	Lack of faith. That's what I found in my new brethren And so it was I discovered my true calling -- To teach. To lead.
M	PRIEST	By murdering innocents?
M	BLACK HAT	By drawing a once great race back to their"nature. By helping them discover' the mastery within themselves. By putting them in touch with a higher power.
M	PRIEST	who?
M	BLACK HAT	Me. Something in the distance catches Priest's eye, a BLACK SPEC
M	PRIEST	So this is how you go about it? One by one killing every last remaining Priest?
M	BLACK HAT	It was the only way. The Cities are defenseless now...no one left to stop us from entering our Eden. But I was kind -- I gave every last one the choice I never had. Now it's your turn. Almost imperceptibly the two make a shift in their postures,
M	BLACK HAT (CONT'D)	it's better to be with your enemies than to be alone, Priest. Humanity had its chance. It's time to make way for new blood. Priest lowers his head, when he raises it, his reply comes
M	PRIEST	Yours.
M	WE HEAR A HUM	Molecules and electrons bursting from their orbits, the roar And before anyone knows it, they're already mid-fight. The Then as combustibly fast as it started -- the tableau drops.
M	BLACK HAT	They taught us God created man in His image. . .but they lied. Man created God in a image -- And so, like man, God is weak. Corrupt. Merciless. He wipes away a streak of blood from his cheek.
M	BLACK HAT (CONT'D)	Who do you fight for, Priest? The Order's collapsed. The Church nothing but a line of decrepit, ruined old men. Charlatans. How do you think I'm getting into the cities? Priest's face drops.
M	PRIEST	I don't believe you.
M	BLACK HAT	Your faith has failed you Priest. Join me. Join me and have the best of both worlds --Walk in the sun. Stalk in the night. Why pray to a God when you can BE one?
M	PRIEST	With ferocious instinct, he launches forward, feet digging The two bodies COLLIDE w th Mic impact. Rolling across the The warriors rise, locked in a furious coil.as WHOOSHI train As they hit the final car, Priest flies across the roof Black Hat calmly approaches, his foot dangerously close to
M	BLACK HAT	Your problem is you keep looking to God for-your power -- But I know the real truth. You've been praying to an empty sky. And now he SWIPES his foot across the roof, knocking off
M	BLACK HAT (CONT' D)	But you know that now.
M	MASSIVE PISTONS	Pump up and down furiously, moving so fast they blur, turning She reaches into her pack and lugs out a CROWBAR, pulling up The machine chews it up like candy. A VAMPIRE hangs upside down from the ceiling, blocking the Hicks SPITS a wad of ATOMIC CRAW at the creature. It
M	HICKS LOOKS BEHIND HIM	DOZENS OF VAMPIRES ARE NOW AWAKE. Sitting up in their
M	HICKS	Shit. With a WAIL, the vampires quickly scramble from their coffins,
M	A	He wedges a knife in the door-handle, bashing it with his He's trapped.
M	Priest is still alive. Barely.	He hangs in tatters, desperately clinging to the Then there's a horrible SCREECH.
M	HICKS TURNS	The WILD-EYED FAMILIAR charges, attacking from behind, having Hicks spins, slamming his attacker in the nose with a palm
M	HIS EYES SEARCH THE CAR	It's bare. Absolutely nothing in here. A single candle
M	HICKS	'Dam. He site on the floor, breathing hard, knowing this is as far Gradually another sound becomes audible. Hicks listens, A HUNCHED FIGURE sits...its back to him. Hidden'in shadow. He can hardly believe it
M	HICKS (CONT'D)	Lucy? it is. That's when he sees something. Glinting in the darkness, Something sharp. Howling across the wasteland, the train now racing even There is none. She looks up ahead. Smudged like a greasestain, looms large across the horizon, She squints up to the sky, analyzing the sun, making a quick
M	HICKS	Lucy, my name is Sheriff Hicks...I'm here to take you home. No response. She seems almost catatonic. He reaches into
M	HICKS (CONT'D)	I'm here with your uncle. That gets her attention, she looks at Hicks -- And she looks
M	WHAP!1	The car door outside finally starts to give freely, metal
M	A TALON	Reaches through the opening, long bony fingers swiping at ANOTHER ARM breaks through the small window, clawing at the
M	HICKS (CONT'D)	Stay behind me. I'll hold `em off as long as I can BLAMI BL.AM! Hicks FIRES, bullets peppering the creatures as
M	ONE VAMPIRE	Manages to scramble through, it charges at Hicks, fangs The sky above already starting to cloud black as -- He turns to look back at Lucy. But she's gone.
M	HICKS	Lucy? WHAM! A WOODEN. PLANK slams him over the head, knocking the
M	HICKS (CONT'D)	Lucy, wait She doesn't, jabbing at him with the broken plank, he dodges Lucy, don't do this! The girl's just too fast. She keeps pushing him backwards
M	A FIST	PUNCHES through a BOARDED UP HOLE in the floor (the one Hicks takes advantage of the distraction and SLUGS Lucy, He dives for his gun, scooping it up and leveling it at the
M	IT'S PRIEST	He sticks his head through the opening, having been drawn by
M	PRIEST	Give her to me! Hurry! Hicks thinks about it, unsure.
M	PRIEST (CONT'D)	-- They'11.get through the door any second! Give her to mei Screeching, ANOTHER VAMPIRE makes it through the opening, Hicks BLASTS away but there's too many of them, they keep
M	A VAMPIRE	Jabs its head through the hole, teeth chattering-- but the On his back, Hicks worms his way down,. following Priest.as
M	HICKS	We should jump!
M	PRIEST	Not until we stop the trains But now Hicks isn't even looking at him, his attention caught Too late. t Towers above as the train approaches, so close the smell of But that's when something catches Hicks' eye...up ahead on Someone stands. awaiting the train.
M	ON PRIEST	Horrified, realizing what she's going to do...and powerless
M	PRIEST	What happens next happens fast: Priest GRABS Hicks, folding his body around both he and Lucy, The sound of a heartbeat.A threshold. A zone of transition. She doesn't move. A BRIGHT FLASH -- one by one the train cars SLAM into each MMMM gQES BLACK A BRIGHT FLASH -- and now Priest is falling through the air, his And WHAM! we FUSE back into real time as train cars CRASH We move through the swirling sand until we find --
M	PRIEST	He stands, bruised and bloody, staring at the sky. Watching. Led by the Purebloods, HUNDREDS OF VAMPIRES fly out from Then in one horrible instant -- They TURN as if guided by an unseen hand, flying towards the They're gonna make it. The creatures arctowards the metropolis,the city within Priest studies the sky and all at once...he knows.
M	PRIEST	No, they're not.
M	THE SUN	PUNCHES through the teeming mass. A few rays at first, but then more and more,-cracking through Hicks' eyes, widen, witnessing an amazing eight as the Hicks and Priest stand, surrounded by the epic destruction,
M	HICKS	You knew they wouldn't make it. A long time before Priest answers.
M	PRIEST	She knew. He turns to THE ENGINE -- its grinning teeth grill CAVED IN
M	THE PRIESTESS	Lies before it. Somehow not a scratch on her...But Priest kneels beside her, taking her hand. Trying to be Do you want me to? Priest lowers his head. The following having been spoken by
M	PRIEST	"You shall wash me and I shall be made whiter than snow. Glory be to the Father and to the Son and to the Holy Spirit...
M	PRIEST (CONT'D)	-- As it was in the beginning, is now and ever shall be. World without end." Amen. A FIGURE escapes through the dust, lurching towards the
M	PRIEST	sees him but chooses to stay with the Priestess, brushing the
F	PRIESTESS	I wish we could've had more time.
M	PRIEST	.Me too. She reaches up, placing her hand on his chest.
F	PRIESTESS	Wherever it is we go -- we go together, right? She smiles weakly... but Priest can see she's scared.
M	HICKS	When you're finished -- You know where to find me. A tense beat then Priest GUNS the engine. Hicks and Lucy watching as he blazes The soaring, ethereal tones carrying us through the forest of
M	Shadows and light.	A cabal of MONSIGNORS stand shrouded in white robes, awaiting He suddenly stops, his expression dropping as
M	PRIEST	Slowly makes his way down the aisle, bruised and bloodied,
M	ORELAS	Ecces Agnes Dei, ecces qui tollit peccata mundi. Everyone turns to see the massive chamber doors BURSTING
M	PRIEST ENTERS THE CHAMBER	A true force of nature now, coming like the Fourth Horseman. Steps from the shadows. Deep wounds line his face, the cross
M	BLACK HAT	I'm afraid you're too late, Priest.
M	THE MONSIGNORS	Shed their robes, revealing fresh BITE MARKS on their necks.
M	ORELAS	And why shouldn't we live forever? We're God's very voice. His vessel!
M	PRIEST	Stands shell shocked, the level of betrayal staggering.
M	BLACK HAT ATTACKS	SLAMMING.into him, the two warriors going at it in a brutal
M	PRIEST	Sends him sailing through the air, Black Hat crashing into a
M	THE MONSIGNORS SHRIEK	Bodies contorting in grotesque shapes as they BECOME.
M	BLACK HAT	With them I can start anew! You can't stop it -- Must be God's will. He flies across the room, BARRELING into Priest with
M	BLACK HAT (CONT'D)	"I looked and beheld a pale horse and His name that sat on him was Death" -- Priest coughs up blood. Black Hat smiles, wrapping a hand
M	BLACK HAT (CONT'D)	"And all hell followed with him." He raises his head back, ready to sink his teeth. Priest too Prom a b= --
M	THE GIANT GOLD CROSS	Breaks from the wall with a GROAN, PLUMMETING towards them.
M	PRIEST	WRENCHES himself from,Black Hat's grip, tumbling. across the WHAPI The cross S LM onto Black Hat, pulverizing hi ! Chunks of glass and stone rain down around Priest, the Priest presses against the door, it SPLINTERS all around him, it stops. Forgive me. He collapses, making the sign of the cross.
M	KOEPPEN	Am I next? Priest approaches -- Koeppen closing his eyes, ready for the But Priest only lifts the man's head, studying his neck. And without a single word -- Priest just walks away. People don't run! God is here for youl He wants you to STOPI Stop and ask yourself a question And the people DO stop, looking to him, the panic leaving Ask yourselves -- Where am I going? At this, Priest turns, the question catching him as well. He has no answer.
M	The windmill.	Its rusty blades scrape along, the metal catching the first AARON PACE is already up, working on rebuilding his house.
M	ON THE HORIZON	A cycle. Two black specs riding it. Hicks and Lucy. But eventually -- for her father...she manages it.
M	HICKS	Leans against the backwall watching. Lucy glances his
M	AARON	I can't thank you enough for what you've done, sheriff.
M	HICKS	Just make sure she keeps on the tea. It's a special brew -- lessens the bloodthirst...something my granddad taught me. Aaron nods hopefully, squeezing his. daughter's hand. Hicks stands on the porch, enjoying the breeze as he pops a A MOVEMENT out in the darkness catches his attention.
M	A FIGURE	Stands astride a motorcycle, shadowed in the moonlight. Hicks approaches, the wind kicking up, whistling through the
M	HICKS	It doesn't have to be like this. Priest just stands, staring. Hick's hand curls around the revolver.
M	THEN	He steps from the bike, advancing towards Hicks. Priest keeps coming, the wind blowing harder as he Hicks stands his ground, cocking his gun.
M	HICKS (CONT'D)	D= I t- -make dQ this.
M	PRIEST	Stares into his eyes and -- Something passes between them something so strong and Hicks FIRES! But Priest is pone. Hicks looks around -- There's no sign of him, not even the bike. He RACES back to the cabin... Sitting peacefully on the bed together, just as he left them.
M	AARON	All done. We heard you fire your gun. is everything OK? A beat -- then Hicks nods.
M	HICKS	Nothing to worry about, just a coyote. Aaron smiles, happy enough to be with Lucy.
M	AARON	Well ...we're all God's creatures. Hicks turns, ready to leave, but something on the table Don't forget your cross -- It's beautiful. A flicker of a smile crosses Hick's face, realizing. I think it's for you...and Lucy. Priest streaks into the night, bathed in moonlight, He disappears into the emptiness.
M	The vampire train.	A car lies half-buried in the sand, mangled cage within.
M	A BLACK CLAW	Emerges from inside, clamping onto metal, something dragging It's a PUREBLOOD. With a SCREECH it takes to the night sky, massive black wings
