M	CHARACTER	DIALOGUE
M	DOLARHYDE	Colorado! Nat Colorado RACES IN as Dolar draws his .45 -- BANG! -- shatters the coach lock -- they PULL Percy out: As Dolar runs for his horse, Percy sees a PISTOL left on the Doc LEAPS after her but her collar's LASSO CABLE whips out, ON JAKE. He SEES this -- and suddenly, to HIS surprise as much coiling up around his arm -- WHAT? HOW? -- as it becomes... HATCHET in a stump -- rips it out and HAMMERS the lock to bits:
F	ELLA	Everyone inside! GO GO GO!! Ushering Emmett and TOWNSFOLK underground, PULLS the door SHUT -- it! He looks down at the blaster: "Hell y ." Another speeder circles around -- KABOOM! The blaster's And all... is... STILL. As our CAMERA RISES to reveal... HALF THE BUILDINGS HAVE BEEN From the rubble, SURVIVORS EMERGE: EMMETT and ELLA from the cellar with inhabitants. DOLARHYDE. DOC. Al in SHOCK:
M	DOC	Maria -- oh God-- they t-took her-- What just...? MOANS, WAILS... desperate cries as people search for loved ones. to size, reverting back into a BRACELET. He's stunned. So are
M	DOLARHYDE	Who the hell're ?
M	NAT COLORADO	He's the one who caged Percy. Dolarhyde starts MOVING toward Jake -- wild killer eyes --
M	DOLARHYDE	Whatwere__tho_se__thinae?
M	JAKE	-- why're you asking m&?! Dolarhyde GRIPS Jake's arm -- THE BRACELET:
M	DOLARHYDE	This! Where'd you get this?! It was shooting the same light beams they were --
M	JAKE	Let go of my wrist.
M	DOLARHYDE	-- I'm not lettin' go of nothin' til you tell me what the he-- KA-LLLANG!! Suddenly that CHURCH BELL comes HURTLING out of the church wreckage, PLOWS through debris. People scatter. And out of the church stumbles... AN ALIEN. 8 FT. TALL. Standing upright, limbs inverted -- limbs that DRAG, wounded, as people SCREAM and RUN and Jake and ELLA, hang iust hurled it. The alien lets out a DEATH RATTLE DIRT. Holy SHIT. Ella's adrenaline dynamo starts to die down, replaced now by SHOCK. And for what seems like the first time, FEAR. She EXHALES a crazy breath, stumbles back... as slowly... people converge around the corpse:
M	EMMETT	Is it... dead? Jake KICKS the alien. It doesn't move. Happy BARKS --
M	DOLARHYDE	. The hell j,,a it? A demon. They all turn to see MEACHAM. TERRIFIED.
M	MEACHAM (CONT'D)	Revelations 16:14: "For there are spirits of demons, showing signs." Escaped from hell itself.
M	EMMETT	Lookit its wrist! It's got one'a those bracelet things too! Indeed, there on the creature's wrist is an IDENTICAL BRACELET. ON JAKE. Mind tumbling. He meets eyes with ELLA. Her face as EAGER as his to understand this and now... BEEP. BEEP. BEEP. What's that SOUND? Everyone looks at each other. Colorado bends closer to the corpse... SCARED...
M	NAT COLORADO	I think... it's comin' from somewhere inside it. People look at each other: WHAT NOW? Trying to control the near- more BRAVADO than actual courage:
M	DOLARHYDE	Only one way to find out. We need to cut it open. You're a doctor. Got a bone saw? DOC snaps out of his stupor, looks up, FREAKED --
M	DOC	. Are you... serious?
M	DOLARHYDE	Wake u Those things took your wife --
M	DOLARHYDE	Well this one here's our only chance of findin' where they went. That LANDS on all of them. A long beat. Doc looks down at the thing, ORANGE GOO dribbling around the AXE in its head...
M	DOLLARHYDE	So you got a bone saw or don't you? -- Doc WHIPS a SHOTGUN from under the bar:
M	DOC	Stay outside. You're not welcome in here! Dolar brings up his COLT -- so does COLORADO --
M	DOLARRYDE	I own more of this town than any man in it so I'll go wherever the hell I damn please. And for the record? You ain't welcome in my country, Mexican. Ella steps between them, BAD ASS --
F	ELLA	Whatever troubles you had don't mean a damn thing against the ones we got now. We wanna see our way through 'em, your guns better start pointing in the same direction, Goddammit. Doc and Dolar never take eyes off each other. or their GUNS. Meacham slips on a pair of GLASSES, studying eerie veins and Looks at Meacham, AFRAID --
M	DOC	If it 'mss a demon, and I cut it open... am I going to burn for it? Meacham hesitates a beat, then CROSSES the air in front of Doc --
M	MEACHAM	That should cover ya. ON DOC. Little relief. BROW SWEATING, he brings the spinning blade down toward the disgusting ALIEN -- VRRRRZZ -- HESITATES --
M	DOC	Excuse me. B GH! He PUKES on the ground.
M	EMMETT	Jesus, Doc!!! Doc wipes his mouth with a handkerchief, slightly DEFIANT --
M	DOC	This is not normal. I'm entitled to vomit. We should XU be vomiting.
M	DOLARHYDE	Just cut, Lardass. Doc GLARES... with a still-shakitig hand, gets back to business --
M	DOC	Senor? A hand? You too, maricon. The men all grip the chest plate and PULL -- A DISGUSTING CRACK.
M	EMMETT	Damn! Smells like a dead dog's ass.
M	MEACHAM	Emmett.
M	EMMETT	Sorry, Father. Doc covers his face with his handkerchief as he explores...
M	DOC	Chet wall's partially collapsed... no familiar organs of any kind...
M	DOLARHYDE	'course they're not familiar. Just look at this th-- SUDDENLY THE ALIEN'S ARM LASHES OUT -- claws SNAP OPEN and PIN from his neck -- but the second Doc withdraws his hands from the
M	DOC	Spinal reflex. And GRINS at Dolar's pain. But Meacham NOTICES something around
M	MEACHAM	Something on your neck. Hold still. Meacham sweeps a little off Dolar's neck, rubs it between thumb
M	MEACHAM (CONT'D)	I'll be damned... gold. They check the creature's hand talons: GOLD FLAKES underneath 'em, and Lots of it. Colorado checks its taloned feet:
M	NAT COLORADO	Down here too. This much ore... could only have come from a digging in a mine. That LANDS on everyone. but most especially ELLA. Who looks up to see Jake READING her in this moment.
M	EMMETT	In the ALIEN'S EYE is a SMALL FLASHING LIGHT. On/Off/On/Off in time with that BEEP BEEP BEEP.
M	DOC	Gimme my scalpel. In MACRO CU, DOC CUTS INTO THE EYE, WET SQUISHY SOUNDS as he dripping with juice. Clamped to the nerve is a METALLIC ORB:
M	DOLARHYDE	Where'd it go? The hell'd you do?
M	DOC	Nothing, just pulled it off -- He reconnects it to the optic nerve, the hologram REAPPEARS: Only works when it's touching the creature. Colorado moves closer... rainbow light flickering across his face...
M	NAT COLORADO	I think... it's a compass. Look: No matter how you move it, it points in the same direction.
M	EMMETT	Compasses point north. That's west.
M	MEACHAM	West's where 141 came from. ON JAKE. Another puzzle piece falling into place.
M	EMMETT	If you're right, what's it pointing to?
F	ELLA	The rest of 'em. Be my guess.
M	DOLARHYDE	Then that's where I'm goin'. He SNAPS his PISTOL open, loading bullets:
M	DOLARHYDE (CONT'D)	One of my ranchers said my herd disappeared into the sky. 'Til about ten minutes ago, I figured him for a liar. Nobody takes my cattle.
M	MEACHAM	Your b was taken too. A FLASH of something from Dolarhyde -- could that be EMOTION? But just as fast, it's GONE. Almost a THROWAWAY:
M	DOLARHYDE	I noticed.
M	NAT COLORADO	What if they're already dead?
M	EMMETT	They're not dead.
F	ELLA	Kid's right. If all they wanted was to kill us, they would've.
M	DOLARHYDE	Looked to me like... they were ropin' people. Means they need 'em for something. Whatever it is, we can either stand here guessin'... or go find out. His eyes flash to Nat: "C'mon." And they EXIT. Everyone looks at each other, working up the courage to face what they know
M	DOC	If she's alive -- if there's even a
M	MEACHAM	Lord hates a coward... but our bullets were useless against those things. Other than his wrist gizmo, we're outgunned and outnumbered. As one by one, they turn... to JAKE. Who until this point has been mostly SILENT. Observing. But now -- he's gone from enemy to potential savior in a heartbeat.
M	JAKE	Whoa, I got nothing to do with this --
F	ELLA	You got everything to do with it. If you can remember where you got that thing --
M	JAKE	I remember you all wantin' me on the end of a damned rope. Whatever's happenin' here's got nothin' to do with me.
F	ELLA	You sure. about that? He LOOKS at her. No, he isn't. But he sure as hell won't stay to debate it -- turns to go --
M	EMMETT	Mr. Lonergan? Sir? The EMOTION in the boy's voice STOPS Jake at the door.
M	EMMETT (CONT'D)	My mother died last year. My Paw... he's all I got. And despite a fleeting moment of SYMPATHY, Jake darkens --
M	JAKE	Kid, I'm the last man you want anywhere near you, your Pa... or anyone else in this goddamned town. OUT the door. Everyone trades looks, then Ella FOLLOWS:
F	ELLA	That's it? You're just gonna run away?
M	JAKE	No, Sister. I'm walking away.
F	ELLA	Well s w. As he keeps on walking, Ella picks up a ROCK, wings it at the
M	JAKE ELLA	SONOVA-- -- I told you to gyp. Ella strides forward, picking up another rock on the move --
M	JAKE	What's your damn problem?!
F	ELLA	You're comin' with us.
M	JAKE	I'm not coming anywhere. And you throw that rock I swear I'll-- WHAM! The rock glances off his shoulder --
F	ELLA	If you're walkin' away from here, what the hell're you walking tsQ? That PENETRATES as Jake realizes he doesn't really KNOW. And that's the last thing he's gonna admit --
M	JAKE	What the hell are you walkin' to, Lady? 'Cause if I heard right, it sounds like suicide to me. -- now it's her turn to pause. Cryptically:
F	ELLA	I... just wanna help these people.
M	JAKE	Bullshit. You wanna help yourself. Saw your face light up the minute you knew that thing might lead you to gold. And the fact that he's BUSTED her gets Ella's hackles up --
F	ELLA	It's not gold I want, you dumb sonofabitch, it's what it'll buy me.
M	JAKE	And what's that?
F	ELLA	Remange. Whatever that means, it's a deep, painful LONGING in her. She stares at him, DEAD ON: And lookin' at you? I'd bet a silver dollar... its what you want, too. With that, Ella turns and STRIDES OFF as we HOLD ON JAKE, face Was the Devil come to Absolution... come to drag our town down to hell... SERIES OF SHOTS - AS DUSK TAI .t $. TQ .NIGItT: Though BURNING EMBERS, Emmett helps a LITTLE GIRL pull her half- but our town's not just a buncha buildings, Brothers and Sisters -- Nossir. Our town is fie. Good, God- fearing souls. Pure and hopeful. And the devil can't never take that away... Ella and Doc tend to WOUNDED PEOPLE in a triage area as... Meacham finds his overturned PULPIT. Determination in his eyes, sermon/call-to-arms -- every survivor GATHERED AROUND:
M	MEACHAM (CONT'D)	In times of darkness, God asks that we come together so we may stand and fight. So we're goin' after our kin. Any of you aren't able or prepared, no shame in it. Head up to Fort Huachuca, join up with the garrison there and pray... Rest of us ride out at sun-up to recover that which we have lost. SUNRISE: Pistol chambers SPINNNN -- rifles are COCKED --
M	MEACHAM (V.0.) (CONT'D)	Thy will be done, Lord, and there's an amen behind it. Lo and behold, most of the town survivors are just too damn scared. They form an EXODUS LINE, heading off toward the fort. CORPSE onto the back of a WAGON. Some of them trade glances --
M	DOLARHYDE	Somebody got something to say? His withering GLARE keeps them from speaking up. Doc and Meacham climb onto the wagon: Sure we need to bring that thing along? Doc nods as he TWISTS the forceps in the Alien's eye, the COMPASS HOLOGRAM flickering to life before them:
M	DOC	If this arrow points me back to Maria? Yeah -- J'm sure. Emmett appears leading a PONY, a BOW and quiver of ARROWS slung around his back:
M	MEACHAM	Can't come, Emmett, too dangerous.
M	EMMETT	I can protect myself -- shoot, I'm the only master bowman in my archery club. Won the county tournament by shootin' a flipped nickel at 50 paces.
M	MEACHAM	Somethin' tells me these things don't carry nickels, son. Answers's no.
M	EMMETT	You want me to ride off with the chickenshits, then double back, be happy to. But let's just skip that part and get to it, Padre. And that's the truth. Meacham sighs, no choice... finally:
M	MEACHAM	Go fill your canteen, dammit. He SLAPS the reins and the wagon rides off. Emmett GRINS and mounts the pony, then sees... JAKE riding past. ANGRY EYES from
F	ELLA	C'mon, Happy. But HAPPY remains, torn between them, tail wagging and looking up at Jake as if to say: PLEASE COME?
M	JAKE	Oh shut up. Suppressing GUILT, he rides on toward the hills -- as Dolarhyde
M	DOLARHYDE	I was ridin' into town to kill you for what you done to my son. You owe me your life, Boy. Ride with us, we'll call it square. His hand rests on his nickel-plated .38. Eyes gleaming cruelly.
M	JAKE	You that fast? -- WHOOSH: Jake's hand is already UP with his own PISTOL, having drawn before Dolarhyde can finish his sentence:
M	JAKE	Now you owe me y.Q= life. We're square. In a DAZZLING TWIRL, Jake slaps it back in his holster. Point made, he RIDES ON. Dolarhyde, burning mad at having been out-
M	DOLARHYDE	Follow him. Soon as he's got his back turned... kill him. Shit. Colorado hesitates. Dolar GLARES: "Do it." Finally Colorado NODS acquiescence, moves off... JAKE -- on the OUTSKIRTS of town now -- riding past Meacham and Doc on the WAGON:
M	MEACHAM	Figure out which way you're headed yet?
M	JAKE	West. Saguaro Pass.
M	MEACHAM	That's not what I meant. The inference LANDS on Jake. But he's in no mood. GALLOPS off. A man running from his demons, or maybe toward them... through plains and pasturage... until he sees the tilted ROAD SIGN: Part of a ROOF, lying broken on the ground. Pieces of a STONE Jake takes it in, HAUNTED. Something CRUNCHES under his boot -- MEMORY FLASECUT! FRESH FLOWERS in a woman's hand... THE W B&
M	THE WOMAN	You shouldn't have. She turns, drops the flowers into the vase as we see she's talking to JAKE.
M	JAKE	Got you somethin' else. CLINK -- He drops a LEATHER POUCH on the table next to the vase.
M	THE WOMAN	Where'd you get this?
M	JAKE	Where do you think? The woman looks to the pouch -- Picks up one of the coins.
M	THE WOMAN	Your boys '11 come after you. ON JAKE. Dark. But DETERMINED:
M	JAKE	Let 'em come. She turns to him, their eyes HOLD... and they KISS. Soft. But then -- a THUNDERCRACK turns their attention to the window: A STORM CLOUD on the horizon. Same kind that consumed the town. The cabin starts to VIBRATE like a tuning fork. The pouch slides off the table... THE GOLD COINS SPILL OUT and -- REELING. What is this memory? Who the hell is the woman? Something GLINTS in the far wall where the chimney used to be:
M	ONE OF THE GOLD COINS	EMBEDDED in the wood. Jake pulls it out of the wall, a thousand MEMORY FLASHCUT! The spilled coins start SLIDING across the floor all by themselves, as if magnetically drawn to THE CHIMNEY -- WHOOSH! -- SUCKED right up into it by some VACUUM FORCE!
M	THE WOMAN	What's happening?!!! She manages to GRAB a doorknob and DANGLES UPWARD, CHOKING as -- A DEMONIC SILHOUETTE drops in front of them! JESUS!! Jake draws his pistol and FIRES! The demon SHRIEKS IN RAGE as SPIKED PLUMES fan out from its huge, elongated skull... making it look like a SILHOUETTED It QIA�1.-L 2 A T EI! R HEADDRESS! Its HIDEOUS FACE comes into the light -- AN AIJIE -- as it raises its arm, wearing a WRIST BRACELET that reshapes into a JAKE DIVES AWAY but a searing pulse RIPS A WICKED GASH in his side (now we know how he woke up with it in the desert) --
M	JAKE	Alice! As he RUSHES to her, her collar UNLOCKS... and FLIES AT JAKE, As he STUMBLES back -- GASPING -- touching his neck --
M	JAKE (CONT'D)	"Alice"... Whoever she was to him, he feels sledgehammered with GRIEF. All he knows is, it was THEM. The creatures killed her. And this revelation... well, it galvanizes him with RAGE. Rage that gives him NEW PURPOSE... then-- flying, they go hurling THROUGH THE WALL -- LANDING HARD on the other side -- aaballs-out. messy. close-quarter death match -- Jake -- EYES POPPING -- SEES THE GUN just out of reach -- fingers GRASP for it -- seconds before he PASSES OUT He GRABS the gun and swings it back -- BLAMMII!Colorado ROLLS aside as the WALL where his head just was BLOWSOPEN--and Jake's ON HIM, PISTOL WHIPPING HIM MERCILESSLYuntilheSPINS the gun back around and POINTS IT between Colorado's eyes: ON JAKE -- quaking with rage -- he wants to kill this guy so bad eye in the back of the wagon. Greavey, Dolar's ranch hand, heels up to ELLA. COCKY SWAGGER:
M	GREAVEY	So... what's a pretty lady like y--
F	ELLA	-- you finish that sentence, I shoot you in your beef whistle. Doc, sipping from his canteen, does a SPIT TAKE. Ella's eyes
M	GREAVEY	Ma'am. And rides past her, taking us to EMMETT and DOLARHYDE:
M	DOLARHYDE	Tell me somethin', Kid... why didn't your father just take my money? What money?
M	UOLARHY DE	offered him a thousand dollars to leave town. He could's taken you outta harm's way, relocated... found you a new momma. And this just BURNS Emmett. A beat; then:
M	EMMETT	Is it true Percy's momma died givin' birth to him, Mister Dolarhyde? Something FLASHES in Dolarhyde. But he's contained:
M	DOLARHYDE	Yeah.
M	EMMETT	Then maybe you should use that thousand dollars to buy yourself a new wife. Emmett HOLDS his look against Dolarhyde's. Brave and UNFLINCHING. Doc can't help but grin at the kid's moxie... but it's short-lived as his face suddenly falls:
M	DOC	Madre Dios... And we PAN AROUND, dropping over his shoulder to see what he's reacting to -- AN ENORMOUS CRATER. ACRES WIDE... TWENTY FEET DEEP. Even Dolarhyde looks nervous now:
M	DOLARYHYDE	What the... hell is it?
M	MEACHAM	It was Winfield's Landing. They turn to see Meacham, brushing the DUST off a WOODEN SIGN: Holds it UP. " Winfield's Landing... Population 133." ON GREAVEY AND THE MEN. Shit. He doesn't mean...?
M	GREAVEY	You tryin' to tell me those... things pulled the whole damn town into the sky? And suddenly a weird CRACK shakes the canyon -- like the SOUND BARRIER BREAKING -- everyone's look goes UP where: SWIRLING, DARK CLOUDS LOOM. The same clouds that dropped the tornado on Absolution. And that appeared in Jake's MEMORIES at the cabin. But this time, something's SHOT OUT from them --
M	MEACHAM	That can't be good. The plummeting object HITS a distant dune, kicking up a SAND
M	DOLARHYDE	Scatter. -- everyone runs their horses aside as the object BOUNCES over They STARE. Finally Dolarhyde kicks his horse forward slowly... It's an OVAL CAPSULE OF BLUE GOO, the outer layer some kind of TRANSLUCENT COCOON. Suspended within the murky Jell-o is a GE, DEC SHAPE. Motionless. UH-OH. The others draw guns too, converging around it in equal SHOCK
M	DOC	Should we... open it?
M	DOLARHYDE	Should we open it? Hell NO we shouldn--
M	EMMETT	-- oops -- -- and now we find Emmett's already POKING it with a stick, a the goo spreads across the desert floor, thinning out. FACE-TO-FACE with the object inside, lying there on the ground: Motionless. DEAD, in fact. A METAL TUBE jammed in its mouth, connected to a VALVE in the now-flaccid bubble's outer shell.
M	GREAVEY	Boss... it's one'a yours. Dolarhyde's eyes NARROW. Emmett looks at Doc, SCARED:
M	EMMETT	Is-- is this what happened to my Pa? Doc dismounts. Moves to the cow's mouth and PULLS OUT THAT TUBE
M	DOC	This was stuck down its throat... to help it breathe. That means they wanted to keep it alive, Emmett. I'm sure your father is fine. But Doc's eyes aren't sure. Meacham looks back to the sky:
M	MEACHAM	Why'd they dump it?
F	ELLA	Whatever they needed from it, they must've got. Gonna get dark soon, need to keep moving. She does. The others FOLLOW in a chilled daze. The last is
M	EMMETT	Ho-ly shit. BOOM UP to reveal a SURREAL SIGHT in the valley below: AGAMBLING RIVERBOAT. Nose buried in the sand, paddlewheels facing the sky, as if it'd been dropped from the clouds into the desert. Just like that cow. Off their LOOKS --
M	DOC	"Colorado Queen." The river's two hundred miles from here. But Ella doesn't seem as impressed as the rest of them. In fact, her attention is drawn BEHIND them, to something coming up
F	ELLA	Son of a bitch. IT'S JAKE ON HORSEBACK. Followed by another horse, with COLORADO in the saddle. Wrists tied but ALIVE. As Jake rides the ground with a THUD as Jake levels Dolarhyde with HARD EYES:
M	JAKE	Your man got it in his head that he was s'posed to kill me. I'm holding onto his ear 'til he says sorry. As Colorado stumbles to his feet angrily, humiliated, Dolar up at Jake, half-angry, half-EMBARRASSED --
M	DOLARHYDE	Why'd you let him live? Jake's hard-as-nails. DRIVEN now --
M	JAKE	Gonna need him. He rides past Dolar to Ella. Stops. Says, simply:
M	JAKE (CONT'D)	Nice boat. What's that smell?
F	ELLA	That'd be me. He realizes her shirt's caked in the BLUE GOO from the cow.
M	JAKE	Why're you blue? Cause I missed ya. Their look HOLDS. A MOMENT. Something REAL between them.
M	DOLARHYDE	We better keep movin'. A THUNDERCRACK. On the horizon, sheets of RAIN.
M	JAKE	Storm's comin'. I say we dig in here til it passes. How's that sound, Nat? Nat BURNS. Dolar feels his AUTHORITY being undermined:
M	DOLARHYDE	Storm or no storm, I say we keep movin'. Colorado finally turns to Uolarhyde. DEFIANT:
M	NAT COLORADO	Too hard tracking anything in the rain. Dolarhyde GLARES at Colorado, who GLARES BACK: his loyalty now WE TILT TO THE ALIEN'S HAND. Poking out. Motionless. HOLD on it, longer than we're comfortable. window's SMASHED... as if something just TOOK everyone. Dolar sits by a FIRE made from furniture parts, drinking from a
M	DOLARHYDE	You okay?
M	COLORADO	Yeah. Dolar pours some whiskey on a BANDANA, leans towards Colorado --
M	DOLARHYDE COLORADO	Lemme clean it for you or it'll get -- -- I'm fine. Dolarhyde backs away. Colorado GLARES.
M	DOLARHYDE	Say it.
M	COLORADO	Is Percy worth dyin' for? Dolar's eyes flash. A mixture of anger and PAIN. Then --
M	DOLARHYDE	He's my son. I take care of my kin, Nat. ON COLORADO as that lands. Clearly, there's something here... a bond that seems to go deeper than just boss and employee. But WHAT? Finally Nat just gets up and LEAVES. Dolar watches him go, takes a healthy SWIG. Hears a WHIMPER. ON DOLARHYDE. The kid's naked emotion AFFECTING him, but the Hey. Kid. Emmett looks up, SNIFFLES. Dolar tosses him the WHISKEY FLASK:
M	DOLARHYDE (CONT'D)	Take a drink and shut p. He gets up, walks off. Leaving the kid with the flask. As Emmett looks at it confusedly, stuffs it in his POCKET --
M	DOC	We brought enough water.
M	MEACHAM	Not for drinkin', it's for blessin'. Doc nods: ah. Turns to go... STOPS. Turns back. Intense eyes:
M	DOC	Padre... Maria came to see you in confession every Sunday. It seemed... she had a lot to talk about. Was she having an affair? Meacham removes his spectacles. Looks at Doc --
M	MEACHAM	You know I can't say. And Doc DOES know. But there's a quiet DESPERATION here --
M	DOC	The last thing I said to her... I... Please. If I'm wrong about my wife... I don't want to die angry. Meacham sees the PAIN in his friend's eyes.
M	MEACHAM	You can ask Maria if she was cheatin' on you once we get her back. 'Til then? Don't die. And OFF DOC, thunder CRACKS -- Upper body NAKED in the moonlight. We catch only a FLASH of this, and for a moment it's PURE HOTNESS... . until she turns and something ELSE is revealed: criss- crossed LASH MARKS on her back. She turns away and starts to SPLASH herself with water, erasing
M	JAKE	You missed a spot.
F	ELLA	The hell,-re- you doing here?
M	JAKE	Mindin' my own business. Then you decided to take a shower.
F	ELLA	Why didn't you say anything?
M	JAKE	Givin' you privacy. She throws her shirt on, but her skin's wet and the shirt glues to her, celebrating her shape in a way that can't be ignored.
F	ELLA	. she's pretty. Who was she? Jake's quiet. DARK. Intense emotion, intensely suppressed:
M	JAKE	only thing I know's her name was Alice... And she's dead. Ella looks up at him. INTO him --
F	ELLA	Maybe you loved her. Jake shakes his head, sort of mumble/chuckles in RESISTANCE:
M	JAKE	All you women are the same -- Always wanna make it about Goddamn "love." Trust me, Lonergan. I'm not the same. There is a force -- a strength about this woman -- that he connects with. But remains, true to character, ALOOF:
M	JAKE	Don't matter. She takes a step closer. Soft. Intimate.
F	ELLA	So what dj= matter? Jake just looks at her. Then, lifts the cheroot to his lips,
M	JAKE	What matters is I find the thing that killed her. And make it pay. And now, he leans forward with a focused LOOK... holds up his Where'd you see this before? A beat. Ella -- somehow CONTAINED -- opens her mouth to lie. -- and don't lie to me. You wouldn't've asked me if you didn't recognize it. Ella tightens. PAIN in her eyes. And Jake REALIZES: Those things... they the ones who put those marks on your back? She swallows: a mixture of SHAME that he's found her out... and ANGER at what was done to her.
F	ELLA	They took my people. Destroyed where I'm from.
M	JAKE	Where's that?
F	ELLA	North of here. Been trackin' 'em ever since, town to town. Best I figure, they're hidin' in a mine. Jake CONSIDERS all this. Softens a little:
M	JAKE	Maybe if you'd told me the truth instead of throwin' rocks at me --
F	ELLA	-- what, you would've stuck around? Bullshit. I couldn't've turned you away from what you had to do, any more than I could've stopped these people from going after their kin. Truth ain't worth a damn, Jake... and we're gonna need all the guns we can get. Their look HOLDS... until Jake SMIRKS. Likes her style:
M	JAKE	So that's the only reason you wanted me to come with you? Cause of my gun? There's a pause... then Ella SMIRKS back:
F	ELLA	No, not your gun. What you do with it. Among the many things these two ate feeling -- both separately and together -- the one that pops right now is ATTRACTION. Confusing as it is for him. The pregnant moment LINGERS... Until Happy suddenly starts to GROWWWWL, sensing something conference -- whispers that sound a lot like MUTINY --
M	GREAVEY	What the hell're we doin' here? We should be ridin' in the opposite direction of those things --
M	COBBETT	We do that, the old man's likely to shoot us himself. Only way outta this is -- And suddenly. Greavey SNIFFS the air, FROWNS:
