M	CHARACTER	DIALOGUE
M	NICK	I... was drag racing. I am a drag racer. There's no law against that, is there?
M	HAGAN	Actually there is.
M	SAMSON	You were drag racing in a Kia Spectra?
M	NICK	I don't win a lot.
M	HAGAN	Here's what I don't understand. You're at the crime scene. An hour later when we find your car, you just happen to be hanging out with this guy... ... a registered sex offender --
M	KURT	Tsk tsk.
M	HAGAN	... and this guy... ... whose employee ID says he works for Pellit Chemicals, the victim's company. 110 CONTINUED: 110
M	KURT	Wait. My boss was murdered?! Bobby Pellit?!
M	DALE	You want me to get you a Kleenex?
M	KURT	I can't believe this. What were you doing near his house?!
M	NICK	Where were you during the murder?
M	KURT	I was making love.
M	DALE	`Making love.'
M	KURT	Let me ask you something, Detective. Let's say one of us knew who the shooter was and was willing to hand you that perp on a platter. Would he be entitled to some sort of immunity for that information?
M	HAGAN	No. But he would be entitled to some sort of jail time. Because if he knew who the shooter was and didn't tell us, that would be obstruction of justice.
M	KURT	Well, then I'm glad we have no idea who the shooter is, right, guys? 110 CONTINUED: (2) 110
M	SAMSON	If you expect us to believe this is all just a big coincidence, we're going to be here for a long time.
M	DALE	Okay wait!
M	DALE	Saying that we'll be here for a long time implies that we can't leave. Does that mean we're under arrest?
M	HAGAN	No. We just brought you in for questioning.
M	DALE	So, you don't have evidence constituting probable cause to arrest us?
M	SAMSON	Not yet.
M	DALE	Well then, we're free to go?
M	HAGAN	Technically.
M	DALE	Come on, guys. 111 CONTINUED: 111
M	NICK	Nice work. Where'd that come from?
M	DALE	`Law & Order.'
M	KURT	We really showed those guys.
M	NICK	`We'? You were gonna turn us in!
M	KURT	For, like, a second.
M	SAMSON (O.S.)	Stop!
M	SAMSON	For speeding and running a red light. Don't get too comfortable out there, boys. Our forensics team is sweeping Pellit's house for fingerprints and DNA. And they don't miss much. 114 CONTINUED: 114
M	KURT	We are so fucked.
M	NICK	Maybe it's time to lawyer up.
M	DALE	I don't have money for a lawyer. I gave all my money to Cocksucker Jones!
M	KURT	Hey, that's right! I forgot all about Cocksucker. Why don't we ask him what to do?
M	NICK	We did pay him five thousand dollars to be our murder consultant.
M	DALE	Actually, it was five thousand forty with the briefcase.
M	COCKSUCKER JONES	Oh damn, look who's back. How did it go with the Strangers on a Train shit?
M	KURT	Not great. We need your help.
M	NICK	One of our intended victims killed another of our intended victims.
M	COCKSUCKER JONES	Shut the fuck up! What kind of evil geniuses are you? 115 CONTINUED: 115
M	DALE	We don't even know why it happened. But the cops brought us in as suspects. What do we do now?
M	COCKSUCKER JONES	First things first. I'm gonna need another five thousand dollars.
M	KURT	What? No way. You said the last five thousand would cover this!
M	COCKSUCKER JONES	Okay, fine. Pay for my drink.
M	DALE	Not the best negotiator, is he?
M	COCKSUCKER JONES	Let me ask you this -- the guy who killed the other guy you were planning on killing, are the police after him too?
M	NICK	No. They don't suspect him.
M	COCKSUCKER JONES	All right, so you're gonna need to encourage him to turn himself in, by say, kidnapping his wife and mailing him her earlobe or something.
M	DALE	That's horrible.
M	COCKSUCKER JONES	Naw, the earlobe's vestigial. All right, how about you trick him into confessing what he did while you wear a wire?
M	KURT	A wire. That's good. 115 CONTINUED: (2) 115
M	NICK	Is that how the cops caught you when you murdered someone?
M	COCKSUCKER JONES	What the hell are you talking about? I never murdered anyone.
M	NICK	What?
M	COCKSUCKER JONES	Who told you I killed somebody?
M	KURT	You did. You said you served a `dime' for `some pretty ugly shit.'
M	COCKSUCKER JONES	It was ugly.
M	DALE	What was it?
M	COCKSUCKER JONES	You ever see the movie Snow Falling on Cedars?
M	NICK/KURT	No. Yes.
M	COCKSUCKER JONES	I got caught with a video camera making a bootleg copy of that movie.
M	NICK	You did ten years for video piracy?
M	COCKSUCKER JONES	Hey, that's a federal offense. They take that shit serious. I also made the mistake of representing myself at trial. May have insulted a few of the jurors. 115 CONTINUED: (3) 115
M	KURT	Hold on. You're telling me we've been taking murder advice from someone whose biggest crime was taping an Ethan Hawke movie?!
M	COCKSUCKER JONES	So you do know it.
M	DALE	If you're not a murderer, why do you carry that gun on your belt?
M	COCKSUCKER JONES	Gun?
M	COCKSUCKER JONES	This is a motherfucking iPhone.
M	NICK	I feel like such a moron.
M	COCKSUCKER JONES	Well, you are a moron. You don't walk into a bar and hand a guy five thousand dollars just because he's black.
M	KURT	Come on, guys. Let's get out of here.
M	COCKSUCKER JONES	Trust me on the wire thing, though. Worked for Donnie Brasco. Bootlegged that movie too. 117 CONTINUED: 117
M	HAGAN	You got something for us?
M	CRIME TECH	We didn't find any foreign prints in the house, but we did get a DNA match for one of your suspects, Kurt Gamble.
M	SAMSON	Where was it?
M	CRIME TECH	Pellit's upstairs bathroom. His toothbrush. It had traces of Gamble's fecal matter.
M	HAGAN	That sick bastard.
M	CRIME TECH	That's not all. We found feces on Pellit's hairbrush, face soap, floss and razor.
M	SAMSON	Razor?!
M	CRIME TECH	The handle. Not the blade. This Gamble guy put just about everything in that bathroom up his ass.
M	HAGAN	All I care about is that it puts him inside the house. That's enough for a warrant for him and his drag racing, sex offender friends. I'll call the DA. 119 CONTINUED: 119
M	KURT	Okay, looks quiet. Is the tape recorder ready?
M	DALE	Fresh batteries, fresh six-hour tape, voice activated. One of us needs to tape it to our chest.
M	KURT	I'll do it. I'm the only one without hair on my chest.
M	NICK	That's `cause you shave it.
M	KURT	I don't shave it. I wax it.
M	DALE	So what do we do now? Wait for Harken to come home and ambush him?
M	NICK	I have a better idea. Let's be in the house when he walks in. He'll be so mad, he'll be more likely to confess.
M	KURT	Right. We'll sit there in the dark till he comes in, and then switch on a lamp. That'll freak him out.
M	DALE	Hey, we should find an office chair so one of us can dramatically spin around and face Harken.
M	NICK	I'll be in the chair. 119 CONTINUED: (2) 119
M	KURT	Why do you get to be the guy in the chair?
M	NICK	He's my boss.
M	DALE	We could try and find more than one office chair so the three of us can spin around at the same time.
M	KURT	That doesn't sound intimidating. That sounds like a musical number.
M	DALE	I guess you're right. I'll turn on the lamp.
M	KURT	So I'm just supposed to stand there like an idiot?
M	NICK	You're recording it all. You're the most important member of the team.
M	KURT	Don't patronize me, Nick.
M	PARTYGOERS	Surprise! 121 CONTINUED: 121
F	MRS. HARKEN	Who are you?
M	NICK	Uh... hi... sorry we're late. I'm Nick. I work with your husband AND -- Aren't you the young man who helped Dave on the street the other day?
M	DALE	Uh, yes. How's he doing?
F	MRS. HARKEN	He's fine. Thanks to you. Did I invite you to this?
M	GUEST #1	His car just turned the corner!
M	GUEST #2	Someone get the lights!
M	KURT	Hi, we didn't formally meet. I'm Kurt.
F	MRS. HARKEN	Hi.
M	KURT	Nick didn't tell me that his boss was married to a model.
F	MRS. HARKEN	I'm not a model.
M	KURT	When did you quit? 121 CONTINUED: (2) 121
M	PARTYGOERS	Surprise!
F	MRS. HARKEN	Were you surprised?
F	HARKEN	Oh, yeah.
F	MRS. HARKEN	Look, everyone's here.
F	HARKEN	Almost everyone.
F	MRS. HARKEN	Who are you talking about?
F	HARKEN	I think you know. I need to put my stuff away. I'll be right back.
M	NICK	He's going off alone. This is our chance.
M	DALE	You guys ready?
M	KURT	So fucking ready.
M	NICK	Okay, stay close. 122 CONTINUED: 122
M	KURT	Gotcha.
F	HARKEN	What the hell are you doing here? You come to stab me a few more times, you lunatic? And my wife invited you? Are you fucking her too?
M	NICK	We know what you did, Harken.
F	HARKEN	What does that mean?
M	NICK	We were there. We saw you kill him.
F	HARKEN	So what is this? A shakedown? You think you can blackmail me because you saw me kill my wife's lover?
M	DALE	Say his name.
F	HARKEN	What?
M	DALE	The guy you killed. What was his name?
F	HARKEN	Trust me, Pellit's name doesn't matter anymore.
M	NICK	There it is! Let's go, guys --
F	HARKEN	Yeah, I killed Pellit --
M	NICK	Hang on. Hold that thought, because I want to get my friend, KURT --
F	HARKEN	I walked right up to his door and I shot him in his fucking chest, and I'll tell you something: I liked it. So if you think I'm a pussy who won't do the same exact thing to some half-assed blackmailer, guess again.
M	NICK	You know who really thinks you're a pussy is my friend Kurt. Let me go grab him and you can tell him exactly what you just --
F	HARKEN	You're pathetic, Waters. You come into my home, on my goddam birthday and try and pull this shit? Well, guess what? You're a dead man. You... ... you, and your friend Kurt, whoever the fuck he is. Dead. Men.
M	DALE	We didn't know it was your birthday.
M	NICK	What are you doing? What's in that?
F	HARKEN	My gun. Just give me a second.
M	NICK	We had him! We had the whole thing. What happened to Kurt?
M	KURT	Oh, hey.
M	NICK	`Hey'?! Where were you?!
M	KURT	Uh, I had to go to the bathroom. Bad salmon puff. Are we ready to record Harken?
M	NICK	You're too late, Kurt! He confessed the whole damn thing!
M	DALE	More than once! Then he told us we were dead men! He's getting his gun right now!
M	KURT	Oh, man, I'm so sorry. I fucked up. 124 CONTINUED: 124
M	NICK	Yeah, you --
M	NICK	You dick!
M	KURT	Look, I wasn't thinking. She's so hot and I'm so weak. I'm a weak, weak man. I admit it.
M	KURT (V.O.)	In here? But all those people are right outside.
M	MRS. HARKEN (V.O.)	I know. That makes it even hotter.
M	MRS. HARKEN (V.O.)	Your balls are so smooth. I wax them.
M	DALE	Is there anything you don't wax? 126 CONTINUED: 126
M	NICK	Ugh. Turn it off, Dale! Oh yeah... oh shit!
M	MRS. HARKEN (V.O.)	Whoops. That was fast...
M	KURT	Yeah, Dale, turn that off!
M	KURT (O.S.)	Holy shit! They must have found my DNA. Turn around! Get us out of here!
M	KURT	Okay, it's clear that none of us can go home again. Probably ever.
M	DALE	What?!
M	KURT	I'm sure they have cops at all our places. I think our best bet is to get out of the country.
M	NICK	Where are we going to go?
M	KURT	Mexico?
M	DALE	Everyone flees to Mexico. That's the first place they'll look.
M	KURT	You're right. What about Asia? We could become kick boxers.
M	NICK	What the fuck are you talking about?
M	KURT	What if our entire lives have been leading up to this moment? What if we were destined from the very beginning to become Asian kick boxers?
M	NICK	What if I was destined to smack you right in the face?
M	KURT	That seems like a lesser destiny.
M	DALE	Hello?
M	INTERCUT WITH:	
F	JULIA	Hello, lover.
M	DALE	Oh God. Look, Julia, I can't talk right now --
F	JULIA	No worries, baby. I actually meant to call your home phone. You know, to tell Stacy about us.
M	DALE	No! Wait!
F	JULIA	I think I've waited long enough. I'm tired of you playing with my emotions.
M	DALE	I'm not playing. I'm going to do it. I swear!
F	JULIA	This Friday. At the office.
M	DALE	Fine!
F	JULIA	Wait. What are you going to do to me?
M	DALE	I'm going to... have sex with you.
F	JULIA	Details! And be explicit.
M	DALE	Right now? You want me to say it?
M	KURT	Oh, shit. We've got company. 133 CONTINUED: 133
M	NICK	It's Harken! Lose him!
M	KURT	Lose him? Sure, Nick. His 500 horsepower is no match for my 150.
F	JULIA	Say it!
M	DALE	I'm gonna put my penis in your pussy!
F	JULIA	Oh, come on, Casanova. You can do better than that.
M	DALE	I'm gonna make you feel good. With my tongue... and my fingers. And whatnot.
M	NICK	Jesus Christ, this guy's nuts!
F	JULIA	You going to slap me with your cock, Dale?
M	DALE	Yes! Yes! I'm going to beat your face with my cock!
F	JULIA	More!
M	DALE	I'm gonna put my balls in your hair! I'm gonna spit on your arms!
F	JULIA	See you Friday, you dirty bird.
M	DALE	Nice job `fucking the crazy out of her,' Kurt!
M	KURT	Maybe I should've spit on her arms.
M	ON STAR REP (V.O.)	Good evening, Mr. Gamble.
M	KURT	What the hell?
M	ON STAR REP (V.O.)	This is Gregory, your On Star rep. Our on-board sensors report that you have a damaged tail light.
M	KURT	Yeah, thanks, Gregory, we know. We're being chased by a crazy man and he just smashed into us!
M	ON STAR REP (V.O.)	Oh dear. I will alert the local police authorities and direct them to your location.
M	NICK	No, wait! Don't call the police! They're already after us.
M	DALE	They think we murdered someone.
M	NICK	Why are you slowing down?!
M	KURT	I'm not! The engine died!
M	ON STAR REP (V.O.)	I have remotely disabled your engine.
M	KURT	Why would you do that, Gregory?!
M	ON STAR REP (V.O.)	It's a standard On Star safety protocol when we believe a driver has committed a crime.
M	KURT	I pay nineteen bucks a month for this fucking service!
M	ON STAR REP (V.O.)	Please stay with your vehicle. The police should arrive shortly.
M	DALE	I thought you were our friend, Gregory!
M	NICK	He's not stopping!
M	KURT	Oh, shit!
M	DALE	Shit, shit, shit...
M	KURT	I'm guessing you don't want to EXCHANGE INSURANCE information -- ?
F	HARKEN	Out of the car. All of you.
M	NICK	Look, Mr. Harken --
F	HARKEN	Shut the fuck up! I've got six bullets in here. So if I want to, I can shoot each of you twice, just like I did that bastard, Pellit. But if I do that, I'll have to spend the rest of my life running from the law or rotting in jail.
M	DALE	So, you're not gonna shoot us?
F	HARKEN	No. I have a better idea.
F	HARKEN	Unnnnhhhh!
M	NICK	What the -- ?!
F	HARKEN	Catch. 134 CONTINUED: (2) 134
F	HARKEN	Now I can tell the cops that when I discovered you three killed Pellit, you tried to kill me to shut me up.
M	KURT	That's crazy!
F	HARKEN	Is it? Because I don't see a shred of evidence proving that I killed Pellit. It's like I've always told you, Nick. Life is a marathon and you can't win a marathon without putting a few Band-Aids on your nipples.
M	ON STAR REP (V.O.)	Did I mention that this conversation is being recorded?
F	HARKEN	Who said that?
M	KURT	That's Gregory, our On Star rep. My name is Atmanand!
F	HARKEN	You can't -- this isn't -- 134 CONTINUED: (3) 134
M	NICK	I think this is gonna work out okay for us.
M	KURT	I told you.
M	DALE	Should we stop him?
M	KURT	Probably.
M	NICK	I've got this. This is for you, Gam Gam.
F	HARKEN	Get the fuck off me!
M	KURT	Hey, Harken, one last thing?
F	HARKEN	What?!
M	KURT	Your wife gives great head. 135 CONTINUED: 135
F	MARGIE	Oh, hey, Kurt. Come in.
M	KURT	Thanks, Margie. I just wanted to congratulate you on taking over Bobby's job.
F	MARGIE	Thank you. Terrible what happened to him.
M	KURT	Yeah. Tough month for the Pellit family. Anyway, if there's anything I can do to help out before the baby gets here, please let me know.
F	MARGIE	What baby?
M	KURT	Your baby.
F	MARGIE	I'm not pregnant.
M	KURT	Yeah, right. Look at that big belly.
F	MARGIE	I'm aware that I have a weight problem, Kurt. It just happens to manifest itself in my lower abdomen.
M	KURT	I... oh, my God. I'm really sorry, Margie --
F	MARGIE	Kurt, I know you were a favorite of Jack's. He was willing to overlook your inappropriate behavior with female clients and service people. But you should be aware, I'm not Jack. And I have very little tolerance for the mistreatment of women. So consider this your first strike.
M	KURT	How was I supposed to know you were just fat --
F	MARGIE	Strike two.
F	JULIA	Thank God it's Friday, right, Dale?
M	DALE	Yeah.
F	JULIA	Let's drill this patient and then you can drill me. Could we do it on top of the patient? I like the element of danger.
F	JULIA	You continue to surprise me, you weird little man.
F	JULIA	You like that? This getting you hot?
M	DALE	Oh, yeah.
F	JULIA	`I wish I was Dale's weenie so I could have sex with Julia.'
F	JULIA	What the hell?!
M	KENNY	Sorry, Dale. I couldn't keep it together anymore --
F	JULIA	What is this?
M	DALE	Julia, meet my old high school friend, Kenny.
M	KENNY	How do you do?
M	DALE	Kenny will do just about anything for fifty bucks and that's why I hired him to help me frame you. Your days of sexually assaulting me and your patients are over.
F	JULIA	Seriously? This is all you've got? Your word against mine? I'm a highly respected professional and you're two losers.
M	DALE	Three losers.
F	JULIA	You little bastard --
M	DALE	Shut up, Julia. Now, my fiancee and I are going to take a very expensive two week vacation which you're going to pay for. And then I'm going to come back to a rape- free workplace. Because if you so much as look at my ass, I'll have yours locked up.
M	KENNY	I don't suppose you could take a look at this molar --
F	JULIA	OUT! GET OUT!
M	CARTER	You wanted to see me, Mr. Waters? 139 CONTINUED: 139
M	NICK	Hi, Carter. Just wanted to check if you had a chance to finish those regional sales projections yet?
M	CARTER	Oh, I think I may need another day.
M	NICK	Okay. I was hoping to give them to the marketing guys today, but I can hold them off. In the future, it'd be great if you could tell me if you're going to miss a deadline.
M	CARTER	Sure. No problem, Mr. Waters.
M	NICK	Thanks, buddy.
M	NICK	It's good to be the boss.
