M	CHARACTER	DIALOGUE
F	BILLY	He's 37 and he's got three blown saves in two weeks. Everytime he winds up he's thinking he's about to throw the last pitch of his life. So he grips it a little hard.
M	ART	I appreciate this.
F	BILLY	Sure.
M	ART	But I know my bullpen.
F	BILLY	Yes you do. Yes you absolutely do. No question about it. Except not really.
M	ART	Yeah?
F	BILLY	If we have a lead late in the game and they have runners on base, I'd rather not see Magnante out of the bullpen.
M	ART	I'll make that decision when the time comes.
F	BILLY	That's what you should do. Baseball's a game of situations and you should make the decision when the time comes. Except you should make it now.
F	BILLY	Don't bring Magnante out if we've gotta hold a late lead with runners on. He's 37, he's scared shitless of being the guy who blows this winning streak.
M	ART	You think a lot of yourself, don't you?
F	BILLY	I......think the regular amount of myself. Magnante on the other hand, he doesn't think very much of himself at all, and when he tightens up we've got ourselves an adventure. So I'd like to see Chad Bradford out of the pen tonight when we're in, let's say, just to make it easier for you, any situation. Righty/lefty, two outs, no outs, the umpires have decided we're going to finish the game by playing darts, whatever. Bradford's the first guy out of the pen. Okay?
M	ART	I could've coached you up, you know.
F	BILLY	I don't think so.
M	ART	You think you went as far as you could have? Yeah, that's what I meant. Play Bradford.
M	ANNOUNCER (FROM TV)	Magnante has quickly let two on base for Lee Stevens who's the go ahead run for the Indians in a game that Oakland appeared to have put away. And then - BILLY sits calmly...waits for it...and-- That ball is deep....way back...three run homer for Lee Stevens to put Cleveland ahead in the ninth inning... BILLY can hear 40,000 people booing their lungs out. He
M	UMPIRE	You can't be in there, Billy.
M	UMPIRE	Billy? Just nod a little bit--not too much--like I'm assuring you you didn't just make a calamitous vocational decision.
M	UMPIRE	Players and coaches only, Billy.
F	BILLY	Remember that in about four seconds-- BILLY sees one of the nearby TV cameras pivot over to
F	BILLY	--yeah there it is. We're the lead story on Sports Center now so let me be brief. First of all, that was an awfully costly fuck-you, wouldn't you say?
F	BILLY	Second of all, genius, those boos? They're for you. Drink up.
M	UMPIRE	Come on, Billy.
F	BILLY	Get me this game back.
M	ANNOUNCER (FROM RADIO)	...after giving up the lead on a three run homer off Magnante, the A's came right back to win it in the bottom of the ninth with another three run homer by Miguel Tejada. And the A's have won eight in a row!
M	VOOS	You want one, Billy?
F	BILLY	I'm good, Voos. Thanks.
F	BILLY	Suzanne, get Shapiro on the phone.
M	PETER	Are you thinking Rincon?
F	BILLY	Yeah, he's lost faith for the season. I think he's gonna dump him.
M	PETER	Hardcore.
F	SUZANNE	Shapiro on two.
F	BILLY	Mark. Billy. Let's be honest. A premiere setup man is not going to get you any closer to the playoffs.
M	SHAPIRO V/O	Are you referring to Rincon?
F	BILLY	He's a luxury you can't afford.
M	SHAPIRO V/O	And you can? There's half a million on his contract and at least one other suitor.
F	BILLY	By at least one, you mean one? Who is it?
M	SHAPIRO V/O	I'd rather not say. San Francisco.
F	BILLY	I'll call you back.
M	PETER	What do you think we can get for Magnante?
F	BILLY	Nothing. What's left on Venafro's contract?
M	PETER	Two-seventy-five.
F	BILLY	Suzanne -- get me Sabean. If we can get San Francisco interested in Venafro, Shapiro's only got one buyer for Rincon.
M	PETER	Us.
F	SUZANNE	On three.
F	BILLY	Sabes. Billy. You like Venafro. I can let you have him for almost nothing.
M	SABEAN V/O	Why would you do that, Billy?
F	BILLY	Because I'm amazing.
M	SABEAN V/O	Uh-huh.
F	BILLY	All I want is a couple of bucks and a sweetener. Throw in, say...
M	PETER	Anderson.
F	BILLY	Anderson.
M	SABEAN V/O	I like Anderson.
F	BILLY	No, you don't. I don't even like him. I don't know why I'm doing this -- but let's do it anyway. Venafro for Michaelson?
M	PETER	Anderson.
F	BILLY	Anderson. See, I don't even know his name.
M	SABEAN V/O	I'll think (about) --
F	BILLY	Think about it and call me back.
F	BILLY	Get Shapiro back on.
F	SUZANNE	Two! BILLY
M	SHAPIRO V/O	You can't afford him, Billy.
F	BILLY	You sure about that? I get the impression the market for Rincon is softening. I could be wrong. Call whoever's interested and make sure they're still interested. And call me back.
F	BILLY	What about the Mets for Venafro?
M	PETER	You just offered him to the Giants.
F	BILLY	Suzanne -- Steve Phillips! Get me Steve Phillips.
F	BILLY	Between Bonds, Nen, Kent and Snow, they're never gonna do it.
M	PETER	Totally agree.
F	BILLY	We just need them to cool on Rincon.
F	SUZANNE	Phillips on two.
F	BILLY	Steve-O. Billy. I hear you're looking for a left-handed reliever. What do you think of Venafro? I can make it quick and easy for you.
M	PHILLIPS V/O	What's the angle?
F	BILLY	No angle.
M	PHILLIPS V/O	Who am I getting fleeced for?
F	BILLY	Hang on a second.
M	PETER	Bennett maybe?
F	BILLY	How old?
M	PETER	Twenty-six.
F	BILLY	Twenty-six and in Double-A? Forget it.
M	PETER	Duncan? No. Cerda? No. Furbush?
F	BILLY	Furbush? No.
M	PETER	Eckerton? Eckerton. Eckerton, that's the guy. Billy punches the phone off hold.
F	BILLY	Eckerton.
M	PHILLIPS V/O	Eckerton? I like Eckerton.
F	BILLY	You don't even know who Eckerton is. The phone on Pete's desk rings. Peter answers a second
M	PETER	Hello?
M	PHILLIPS V/O	Is Venafro hurt?
M	PETER	Oh, hi.
F	BILLY	No, he's not hurt. He's fine. This is just a situation for us.
M	PETER	It's Steve.
M	PHILLIPS V/O	Last couple of times out, he got hammered. BILLY I'm on with Steve. Not his fault. We misused him.
M	PETER	Steve Schott.
F	BILLY	Tell him to hold. Look. Steve. Here's the deal. I'm being straight with you. I'm getting Rincon. It's a done deal. It's done.
M	PHILLIPS V/O	I heard the Giants --
F	BILLY	No, the Giants want Venafro. And I told them they can have him for Michaelson... -- but I'd rather deal with you. Because you can give me Eckerton and two hundred and twenty-five thousand cash and the Giants can't. Billy's look to Peter says, Doesn't hurt to ask. As they
M	PETER	Yes, I understand it's impolite to keep you holding.
M	PHILLIPS V/O	I'll think about it.
F	BILLY	Of course. Think. But whoever calls me back first gets Venafro. He hangs up. Looks for the blinking light that belongs He hung up.
F	BILLY	If you could have the power of flight or invisibility, which would you choose?
M	PETER	What?
F	BILLY	Invisibility or flight? Invisibility.
F	BILLY	That's what Casey said. Why?
M	PETER	You'd have total access. Besides, everyone else would choose flight.
F	BILLY	Why isn't anybody calling? The phone rings.
F	SUZANNE	Shapiro's on two.
F	BILLY	Great. Lemme talk to my owner. Call you right back. Get Steve.
M	PETER	Phillips or Schott?
F	BILLY	Why would I call Phillips back? Schott. Tell him I'm on the other line.
M	PETER	Right. Peter dials. Billy can't sit.
M	PETER	Mr. Schott, it's Peter Brand. Sorry I left you on hold. Billy asked me to call you back. He's on another line.
F	BILLY	Tell him we need two hundred and twenty- five grand for Rincon. Billy says he needs two hundred and twenty-five thousand dollars for Ricardo Rincon. Please? Yes, I added the please. No. Billy thinks intensely. Finally --
F	BILLY	Tell him I'll pay it, but when I sell him next year for twice that, I keep the money.
M	PETER	Billy says he'll pay for Rincon himself, sell him next year, and keep the profit.
M	PETER	Okay. Thank you. He says he'll pay for Rincon. High five.
F	BILLY	Great! Shit. What are we forgetting? Get me Shapiro!
F	BILLY	Wait, never mind! Mark. Yeah, it's Billy. Here's the deal. I don't want Rincon pitching against me tonight. Tell him to change his clothes. I got you the money and I accept your gratitude. It's done. He hangs up. Fist bump.
F	BILLY	We gotta let someone go. It's Mags. It's gotta be Mags.
M	PETER	I call not it.
F	BILLY	Art. Billy. The good news is Ricardo Rincon's heading over to the clubhouse. The bad news is you got to tell Mags he threw his last pitch for the Oakland A's last night.
M	ART V/O	No. What do you mean, no.
M	ART V/O	No, as in no. I'm not doing it. You do it. You did it, so you do it. Art hangs up. Billy slams the speakerphone.
M	PETER	It's not the phone's fault. Suzanne, we're gonna need a new speakerphone.
F	BILLY	We gotta catch Mags before Rincon comes over.
M	MAGNANTE	Hey, Billy. I know I've been struggling lately. But we're coming into the home stretch, and I promise I'm gonna turn it -- I need you to stop getting dressed. Magnante isn't sure he heard right, but the silence tells
M	MAGNANTE	Traded?
F	BILLY	I'm sorry for the crap news. I know it hurts. Mike. I can't have 26 guys in the clubhouse. Magnante nods.
M	MAGNANTE	Alright.
F	BILLY	Thanks. Billy gets up to leave. As he exits, he sees Peter enter
F	BILLY	Hey, Ricardo.
M	RINCON	Hola, senor.
F	BILLY	Hola. Hey, I know this must seem a bit sudden, but the Oakland A's have been trying to get you for a long time. You're gonna love it here. The guys are fun.
M	PETER	Muy divertido.
M	RINCON	I pitch tonight?
F	BILLY	I don't know if you're gonna pitch tonight. But you're on our team tonight.
M	RINCON	I no wanna pitch tonight.
F	BILLY	Right. So... where you from?
M	RINCON	Veracruz, Mexico.
F	BILLY	Well, you're a lot closer to home. Why don't you hang out there for five menudos and we'll get you a uniform and everything. Hey guys, clear the room, huh? Say hi to Ricardo Rincon. As the other players file out and say hello... Tara and me were thinking --
F	CASEY	Dad... Tara and I --
M	TARA	She is correct.
F	BILLY	Tara and I were thinking about going to Point Reyes to the beach.
F	CASEY	That'd be fun.
M	TARA	Me go, too?
F	BILLY	And I'll work on my grammar.
F	CASEY	Dad... are you going to lose your job?
F	BILLY	What? Where did you hear that, honey?
F	CASEY	The internet.
F	BILLY	No, I'm not going to lose my job. Don't go on the internet or watch TV or read the papers or talk to people.
F	CASEY	I'm not talking to people, I'm just reading stuff.
F	BILLY	Don't worry. You don't believe me? Ask Tara.
M	TARA	He's not (losing his job). Your dad is a brilliant man. He's the best GM in baseball.
F	CASEY	But say that you did -- just saying -- would you have to move away?
F	BILLY	No, honey. Absolutely not. And even if I did, I'm not going anywhere. I told you not to worry about me. People say a lot of crazy things and they don't always know what they're talking about. It's just gossip. Like gossipers at school.
M	TARA	You can't always believe what you read. Sometimes you need to scratch underneath the surface and find who the authority is.
F	BILLY	And once you do find out who the authorities are, ignore them at all costs.
M	TARA	You can always ask your dad.
F	BILLY	Everything's fine, honey. I'm not going anywhere. The only way I would lose my job is if someone was to give me a better one. Don't worry about me, okay? Dad knows what he's doing.
F	CASEY	Pinkie swear?
F	BILLY	Pinkie swear. AL West GB WP Seattle --- .610 Anaheim 2.0 .593 Oakland 4.5 .571 Texas 21.5 .427 The A's begin this road trip on a 10 game winning streak, picking up two games on the Mariners and the Angels, and it should be noted this is their longest winning streak in six years heading into--
M	PETER	This is a chart of what you should and shouldn't be swinging at. These circles represent different pitches. Red is hit, blue is out, yellow's missed or foul, green is chased, white taken. This is you versus Conway. What do you see?
F	HATTEBERG	I'm chasing a lot of high and outside.
M	PETER	The red is where most hits happen. That's where you want to be swinging. You don't want to be swinging at the junk at the top of the strike zone. We'd rather take those strikes, `cause you're not going to hit `em out of the park. And you're good about that, patient. Right now you're averaging about 4 pitches per at-bat.
F	HATTEBERG	4 per bat?
M	PETER	Yeah, and that's great. One of the reasons why we love you. You're draining a pitcher's pitches. Now, guys like Bonds and Jason Giambi average a little over 5. That's top tier. Does this chart make sense to you?
F	HATTEBERG	Yeah. I'll get on base more if I lay off anything high. This is awesome. So you have a breakdown of this from every game?
M	PETER	Every game. Your instincts are in the right place. This isn't something they teach you in little league. This is something fundamental we're looking for -- how to wear out a pitcher's arm. If you're about to face Conway and wondering what you should and shouldn't swing at, come in here and watch how you're tending. You can click on any one of these pitches and watch it happen. Pretty great, right?
F	HATTEBERG	Show me some of the stuff I'm chasing up high... TIME LAPSE of hundreds of at bats registering and
M	PETER	Everybody thinks the first pitch is what's most important, but it's not. It's the first two out of three pitches that matter the most. The difference between 1-2 and 2-1 is the difference between a scrub and an All Star.
F	BILLY	So you're saying if we can get our guys to lay off the first pitch it'll put us in the driver's seat?
M	PETER	Any sort of extra discipline in the first three pitches will help us.
F	BILLY	That's a problem right there. Terrance jogging to first. Mr. Justice. That's what we pay you for. Chad Bradford, you deceptive son of a bitch, I love you. He's a pain in the ass, but that Giambi gets on base.
M	PETER	Hatteberg once had 18 walks in 30 at bats.
F	BILLY	My whole career I only had eighteen walks.
M	PETER	Actually... 11.
F	BILLY	Shut up.
F	BILLY	Migs, let's make a deal. I'll pay you fifty bucks for every away fastball you hit to opposite field, but you've gotta pay me fifty for every one of those you pull.
F	BILLY	Hey, T. Did your car get egged?
M	LONG	Yeah.
F	BILLY	I think I just got an e-mail from the culprit. He said he was tired of paying good money just to watch you jogging around the bases. What the hell does that have to do with anything?
F	BILLY	I don't know, man. Don't worry about it.
M	LONG	Who brings eggs to the ballpark anyway?!
F	BILLY	Man, you're not fooling anyone but yourself out there. You're falling further and further behind. In your mind, what's the problem? Mecir mumbles something.
F	BILLY	I can't understand you with your hand over your mouth.
M	MECIR	Sorry, Billy. It's just, the smell...
F	BILLY	Right? It's that. And it's growing.
M	MECIR	I'm gonna grab a shower.
F	BILLY	Yup.
F	BILLY	Hey, Scottie. What's on your mind?
F	HATTEBERG	I feel like I'm hurting the team. At first base I'm making a lot of errors. I'm gonna cost us a hundred runs.
F	BILLY	16.5 actually. But as a hitter, you will create 70 runs. 70 runs wins us an awful lot of ball games. I can live with that. Can you live with that?
F	HATTEBERG	I appreciate that, but I know you're just pulling those numbers out of your ass.
F	BILLY	I'm pulling them out of Pete's, actually. And another thing. When a guy reaches first base, be social.
F	HATTEBERG	Social?
F	BILLY	Like a greeter at the Gap. A guy steps into your office, chat him up. You're well read, you went to college. Have some fun out there. Relax.
F	HATTEBERG	Yes sir.
F	BILLY	Scottie, you deserve to be here.
F	BILLY	More information. TIME LAPSE PHOTOGRAPHY of all of the changes to the board
F	HATTEBERG	What are you guys getting up to tonight?
M	TWINS PLAYER #1	Bed by ten o'clock. Game time.
F	HATTEBERG	I don't buy it.
M	TWINS PLAYER #1	I'm sore, man. Beat up. Day in, day out.
F	HATTEBERG	Where d'you guys go next?
M	TWINS PLAYER #1	Houston.
F	HATTEBERG	Houston? You ever get up to Boundary Waters up there in Minnesota? It's beautiful. I went on a trip up there. Fishing trip. Caught some walleye.
M	TWINS PLAYER #1	That's good fishing.
F	HATTEBERG	"Mankevich" is polish?
M	TWINS PLAYER #2	Yes, sir.
F	HATTEBERG	Where'd you go to school?
M	TWINS PLAYER #3	University of Arizona.
F	HATTEBERG	What are you guys getting up to tonight? See what the city's about -- San Francisco. What are you up to?
F	HATTEBERG	I don't know. Depends on if we beat you today. Probably celebrating. So my GM says I gotta be more social. What was your name?
M	TWINS PLAYER #3	Jaqcue.
F	HATTEBERG	I'm Scott. How are you doing, Scott?
F	HATTEBERG	Pretty good. You got kids?
M	TWINS PLAYER #3	Yeah...
M	REPORTER	Oakland's offense has exploded, scoring 40 runs in their last four games and extending their streak to 17 in a row which is an American League record going back to 1954 and just three shy of the Oakland --- .619 Anaheim 4.0 .591 Seattle 4.5 .586
M	REPORTER	Who would have thought in April I'd be saying this: The A's won their 18th game in a row, that's two-shy of tying, three- shy of beating the American League record- AL West GB WP Oakland --- .633 Anaheim 3.5 .609 Seattle 7.0 .583 This is something special now and far be it for me to jinx it by saying how many consecutive games the A's have won-- Well you said it not me. Tickets are torn and purses searched as record breaking None of the Oakland fans in their cars down there have forgotten the A's inglorious history-making choke in Game 5 of the ALDS last October and tonight--
M	JUSTICE	Hey, listen up fellas... bring it up real quick. We got some older guys on this team, we got some younger guys on this team. What we got right now is a chance for everyone to make history. I don't want to get sappy and corny, but this is what we play for. We've been playin' real good for 19. Let's get 20. We get 20, they can't take that away from us until they do it themselves. Guys that are starting tonight, keep playing like you've been playing. Guys not starting, be ready. Huddie, you got the ball -- shove it up their ass tonight. Let's play some ball! Let's go! LEGEND:
M	September 4, 2002	Kansas City Royals at Oakland A's
M	REPORTER #2 V/O	--one game shy of 20 consecutive wins, they have a shot at redemption. How rare is it to win 20 games in a row? This rare: No American League team has ever done it.
F	BILLY	Don't tell me the score, Peter.
M	SHARON V/O	It's me, Billy.
F	BILLY	How you doin', leggy.
M	SHARON V/O	Nope.
F	BILLY	Sharon?
M	SHARON V/O	You hangin' in there?
F	BILLY	Yeah. There's silence...
F	BILLY	Hello? Sharon? "Go into real estate". What a stupid thing to say. BILLY didn't even realize until that moment how much he
F	BILLY	I appreciate that, thanks.
M	SHARON V/O	Good luck. Casey wants to talk to you.
M	CASEY V/O	Are you on your way to the stadium?
F	BILLY	No, I'm on my way to Visalia to see our minor league team. Dad - turn around. You have to see the game.
F	BILLY	No, I don't.
F	CASEY	Turn around.
F	BILLY	I'll talk to you later, sweetheart. I love you. He hangs up, drives a little longer...letting what Casey Shhhit.
M	ANNOUNCER V/O	Tim Hudson is carving through this Royals line-up and at the end of three, it's the A's 11 and Kansas City nothing. Oh God. Ohhhh God. Then TUCKER of the Royals doubles to left field. Justice Reaction shot CLOSE-UPS: Justice, Tejada, Tucker on 2nd,
M	ANNOUNCER V/O	Kansas City's scored five and Oakland's lead is down to six as Art Howe comes out
M	ANNOUNCER V/O	He'll go with the submariner, Chad Bradford.
M	CHAD	One, two, three, four - I know what it is to be in need and to have plenty. I am content. I can do all things through Christ who gives me
F	BILLY	Okay Chad, let's see it. CHAD's submariner pitch to the next batter, DEE BROWN, Some FANS have to cover their eyes. There's a pitcher Rincon throws a controversial strike out. The Royals ALICEA of the Royals singles to left and Pellow scores.
M	ART	Hattie. Grab a bat.
M	ART	Let's go.
M	VOICE OF GOD	Pinch hitting for Eric Byrnes--Scott Hatteberg. SCOTT lets the first pitch go by.
M	UMPIRE	Ball! He hears the crowd ERUPT outside. His Blackberry buzzes: Billy is trying to make a fast unnoticed exit. After
F	ELIZABETH	Mr. Beane? I'm Elizabeth Hatteberg. We met at my house last Christmas.
F	BILLY	Sure.
F	ELIZABETH	Thank you.
F	BILLY	Thank me? Thank you. Whatever you put in those Christmas cookies, keep-- ELIZABETH starts to cry--
F	BILLY	Whoa. It's okay.
F	ELIZABETH	I'm sorry.
F	BILLY	It's alright.
F	ELIZABETH	You don't know what it's like to have everyone think you're a failure.
F	BILLY	Well...You never thought that, and that's
F	ELIZABETH	I did. And he knows I did.
F	BILLY	Yeah he does know you did.
F	ELIZABETH	He's talked to you?
F	BILLY	No. I just know. That's all over now. Your husband just took a Jason Grimsley two-seam fastball and parked it in the upper deck in left field for a pinch-hit walk-off home run in a record breaking game. Go tell him about it. ELIZABETH looks at him a moment...and then starts crying
F	BILLY	No it's okay now, just go.
F	BILLY	Gilligan.
M	PETER	Congratulations.
F	BILLY	Aw, man. I spend the season trying to reduce it to numbers and we won on romance. Suddenly it's the Natural with Hatteberg. Scott Hatteberg. To twenty.
M	TARA	To twenty. You should've seen Elizabeth's face when it went right over.
F	BILLY	She showed up afterwards.
M	TARA	What did she say?
F	BILLY	I was a big moment for them. You know everyone wrote him off?
M	TARA	You didn't. You found him and you put that together.
F	BILLY	I know. It was beautiful. But you know... it's not gonna mean a thing.
F	BILLY	Here's the thing -- we changed the game. We got this year, maybe next, then they're gonna catch on. This is our moment. I want to go the distance. I wanna shove it up the Yankees' ass. Not just the Yankees, but... these guys deserve it.
M	TARA	You deserve it. Honey, 20 games. It's a record.
F	BILLY	That's right, it's just a record. It gets buried in some book. Come on, tell me who won 19? I don't even know. It's 4th place at the Olympics. Any other team wins the World Series this year... great. We're still in the record books. But if we win, we've changed the game. We've put it on its head and shoved it up their ass. If we don't, they're gonna erase us. Minnesota Twins at Oakland A's The camera pans down the huge scoreboard. It's
M	JOE MORGAN V/O	The flaw in the A's thinking, and this comes from the top of their organization-- is their failure to comprehend you have to manufacture runs in the post season.
M	JOE MORGAN V/O	You have to steal. You have to bunt. You have to sacrifice. You have to trust in small ball, not Billy Ball.
M	JOE MORGAN V/O	They think they've devised a science to win games. They think it resides in a computer. They thumb their nose at fundamentals. At tradition. At Baseball.
M	JOE MORGAN V/O	They're bean counters in Oakland. That's bean with an "e" at the end. They're card counters at the blackjack table who forget the house always wins.
M	ALDERSON V/O	This is weird, Billy.
M	ALDERSON	It's like a politician quitting a campaign to become a staffer. Do you even know what a scout does?
F	BILLY	I've been scouted since I was 15.
M	ALDERSON	And you're ready to say, "I'm not a baseball player"?
F	BILLY	I'm not a baseball player. Ready to do this? Pete nods. Billy calls out --
F	BILLY	Suzanne? Get Schott on. You ever been to Boston? The speakerphone rings. Billy answers.
F	BILLY	We need to talk about the Red Sox. So I heard. John Henry reached out to you?
F	BILLY	Yes. But I haven't spoken with him yet. That's what he said.
F	BILLY	I want your blessing before I do. Well, how am I supposed to react to all of this? You're under contract, Billy. You extended.
F	BILLY	I know that, Steve, but I'd like to talk to them. I want to see what they have to say. You're asking me to let them talk to you?
F	BILLY	Yes. With your permission. Well, I can't do that unless I know Peter is in place as my GM.
F	BILLY	Pete? I'm not letting you take him with you, and I have no idea if he's willing to stay if you aren't here. How do I even know I can come to terms with him, given the extremely disadvantaged bargaining position you're putting me in?
F	BILLY	Well, I think you'll agree this is a great opportunity for him. I can't believe he's not going to make a deal. Peter is frozen. Neither Steve nor Billy are acting like If you want out of your contract, I want their whole team and a lot of cash. We've invested in you.
F	BILLY	I haven't asked to get out of my contract, Steve, I just asked if I could talk to them. And I said I won't give you permission unless I know I have Peter! You can't leave me with a vacant front office.
F	BILLY	Then talk to Peter. I will. Silence. All right. You know what? I've made it a point never to stand in the way of a man wanting to make more money. They made the call, the genie's out of the bottle. I had faith in your judgement when I named you GM; that's why I did it and I have faith in it now. Good luck, Billy.
M	PETER	Well, I didn't see that coming.
F	BILLY	I think you should think about staying. You're one of the architects of this thing, it belongs as much to you as it does to me.
M	PETER	Okay... okay...
F	BILLY	How you doing Pete?
M	PETER	I'm a little overwhelmed right now. I think I need to process what's happening.
F	BILLY	Why don't you take the day off. Billy Beane!
M	HENRY	Due respect to the Coliseum, but this is a ball park.
F	BILLY	Yes it is. It is. You ever play here? No.
M	JOHN	That's a shame. Let's walk the field.
M	JOHN	Hey, I'm sorry I kept you waiting but believe it or not there was snow on 84. The second week in October. The car turns on to Yawkee Way and it's 53 degrees and this. How can there be an entirely different weather system here than there is three miles from here? Is that global warming or a sign that there's no such thing?
F	BILLY	I don't know.
M	JOHN	What's that Billy Joel song? Oh the snow it was falling from Stockbridge to Boston. And the hilltops seemed something because of that frosting.
F	BILLY	I think that's James Taylor and I'm certain those aren't the words.
