M	CHARACTER	DIALOGUE
M	JAKE (CONT'D)	I remember seeing a tower... made of stone... on the rim of a canyon... Upon hearing that, Grey Wolf suddenly speaks in animated gestures, pointing North. Colorado REACTS:
F	ELLA	What? What's he sayin'?!? Colorado turns to Jake, a flicker of HOPE:
M	COLORADO	That rock you're talkin' about... he- knows where it is.
M	SHERIFF TAGGART	You... all right...? DRIFTING over to see MARIA. Gravity PULLING her hair downward. . Fantastic. You? Absolution is here... a hundred others from the now-cratered town of Winfield's Landing, feet embedded in the ORANGE RESIN. the wall -- what looks like a HUGE, COILING SNAKE: -- but what comes around the corner is a LONG METAL TENTACLE: A SCANNING MECHANISM on its tip shoots out a blue triangular beam -- itemizing specimens -- SELECTING ONE: SHERIFF TAGGART. Mechanized TALONS open up -- Taggart SCREAMS as he's PLUCKED from the ceiling like an apple from a TREE: ANOTHER METAL TENTACLE slithers in and GRABS WADE -- swinging our men across the cavern where we reveal... . the tentacles are attached to a TERRIFYING ALIEN MACHINE. Taggart and Wade are PINNED DOWN on what looks like an operating An OCULAR PROBE looms _Q.Xpr. them, This is the image _ e.'_A_beM1_ seeing! This is what haRpened to him before he escaRe ! WORKER-BEE ALIENS adjusts the device over their eyes -- INSTANT and LIMP despite their fight and -- FLASHFLASHTLASHI The probe has ERASED THEIR MINDS. Catatonic stares. Now the machine arms slip the men into separate TRANSLUCENT CAPSULES. METAL BREATHING TUBES are implanted down their throats as the capsules begin to fill with a THICK, BLUE LIQUID. This is the same blue goo -- a protective gel -- that housed the COW in that jettisoned cocoon in the desert. More Worker Bees load the cocoons into TRANSPORT SHUTTLECRAFTS. HORSES... all going through a similar cocooning process. All of this is overseen by THE SLAVER, who stalks up a ramp behind the cocoons. The craft HUMS to life, undergear retracting as it ROARS OFF down the tunnel...
M	NAT COLORADO	This is Kiowa land, their sister tribe. As they near the bluff, Jake sees the STONE TOWER. Dismounts:
M	JAKE	That's it. As they near the bluff, they hear the growing sound of that MACHINERY. Everyone dips low, peering over to see... What looks a whole lot like a CAVALRY FORT in the canyon below, amid a network of trenches and underground tunnels. Except this fortress is made of some kind of ALIEN ALLOY, glowing impossibly DRILLING MACHINES are chewing deep into the earth, mining for ALIENS move in and out, working, as if from an ant hive.
M	DOC	Holy Jesus. Like a damn fort. Grey Wolf looks to his men, GRAVE, CRESTFALLEN as he realizes:
M	GREY WOLF (SUBTITLE)	The Kiowa... they were taken too. Suddenly, the ROOF of the steel structure blossoms open like a CHROME LOTUS... and WHOOSH! The SHUTTLE TRANSPORT flies out of the canyon, RISING into the dawn sky...
F	ELLA	Transports. Way they get people and gold back and forth to the ship.
M	DOC	Place is crawling with those things. We'll never even get close. Grey Wolf SPEAKS --
M	NAT COLORADO	He says there's a back way in... The Twin Rivers run underneath this whole canyon. Limestone tunnels up by the falls, couple miles East. Lead right down there. Jake looks to the SKY. DARK. DETERMINED.
M	JAKE	The Slaver... he's up in that big cloud? Ella nods, HARD. Off their SHARED DETERMINATION, our SCORE rises. A DRUM CADENCE that suggests a MISSION starting to form:
M	DOC	Just so I got this straight... three of those things just kicked the shit out of and now you two're gonna ride right into that fort, try to hijack one'a those-- He pauses on the word --
F	ELLA	"Transports."
M	DOC	-- ride it up to that space boat --
F	ELLA	Spaceshp.
M	DOC	Then bring it down here and get everybody off alive? That's your big plan? Jake and Ella share a LOOK. Simply:
M	JAKE	Yup.
M	DOC	And just how do you figure on getting in there in the first place?
M	JAKE	Poke a hornet's nest... they swarm at'cha.
F	ELLA	You gotta draw 'em out. Buy us a distraction. A long beat of incredulous, do-you-believe-this-shit STARES:
M	DOC	You want us to storm that fort? Against those things? With less than fifty men? It's suicide.
M	EMMETT	It ain't, it's been done! I read at school how Ethan Allen and his Green Mountain Boys took Fort Ticonderoga, they weren't but a small garrison and they were outgunned --
F	ELLA	We need all of you to make a stand. Together. It's the only way.
M	NAT COLORADO	Make a stand with what? Jake turns to the WAGON they rode from Jake's gang camp -- the
M	JAKE	This. An impossible mission. Sure death. Yet for the first time... they have an ADVANTAGE. Emmett cuts the moment with a BIG GRIN:
M	EMMETT	Hell, yeah. Let's squish some bugs. Grey Wolf CHUCKLES, murmurs. Jake looks to Nat for translation:
M	JAKE	Somethin' funny?
M	NAT COLORADO	Yeah... that you whites finally know what it feels like to face extinction. Now that we're on the same side, he says we can all die together. They're with us. The LOOK holds between them --
M	JAKE	Guess that means you're not waitin' for your dad to come back. Colorado's face CLOUDS. Years of ANGER and RESENTMENT:
M	NAT COLORADO	Been Woodrow Dolarhyde's son my whole life... first time he ever copped to it was to save his own ass. He's not comin' back. And as Colorado TURNS away, the PERCUSSION finds another GEAR -- Pieces of CLOTH are RIPPED, stuffed inside the WHISKEY BOTTLES. Emmett works with Apaches and their KIDS, roping WOOD together WAR PAINT is applied to faces in DARK STREAKS... Jake slips on his coat. Sees Emmett lead a horse to mount up with his BOW and ARROW QUIVER:
M	JAKE	Not you, Kid.
M	EMMETT	Aw, hell, we been through this. Ya can't stop me. Jake draws his gun, SPINS it in his palm, aims at Emmett's FOOT:
M	JAKE	I can shoot you in the foot.
M	EMMETT	Bu111i11SHIT. Jake SIGHS -- bluff called. Holsters the gun and takes a knee... but just when we think this is gonna be a tender moment, he GRABS Emmett by the collar, pulls him CLOSE:
M	JAKE	You told me your daddy's all you got left. Want me to save his ass? Then park yours right there on the ground, you little shit. Got me? Emmett's nailed. ANGRY, but knows he's gotta stay.
M	EMMETT	Yeah. I gotcha. Jake releases him. Happy moves to Ella but she TSKS:
F	ELLA	Stay with the kid, Happy. The dog WHINES but complies, moving next to Emmett. Jake climbs
M	JAKE	I'll get your father back. Bastard still owes me fifty dollars. The hint of a SMIRK... long enough for Emmett to SMIRK BACK. Ella, Doc, and Colorado mount »p too, along with a 10-MAN APACHE
M	JAKE (CONT'D)	You'll be ready? Grey Wolf NODS. Some part of the PLAN we have yet to learn. And now Jake starts to trot off, Ella beside him. This plays just between the two of them:
F	ELLA	That's a nice thing... what you said to the boy. I didn't know better, I'd say you got yourself a sweet side. She smiles. But Jake turns to her -- deadly serious:
M	JAKE	There's nothin' sweet about me. I told that kid what he needed to hear so he wouldn't get in my damn way. All I care about is killin' that thing. And Ella reacts to the DARKNESS in his voice. Shakes her head:
F	ELLA	I don't believe that.
M	JAKE	Well believe it. I was playing a part. Just like you were. He CRACKS the reins, riding ahead. HOLD ON ELLA... who finally Dolarhyde ENTERS. A menacing figure with a blade in the
M	THE WOMAN (SUBTITLE)	What are you doing? Without response, he levels the axe and SLAMS it down on the FLOORBOARDS. Wood chips SPRAY until a GASH is opened. Dolar out... COLD. He picks them up -- looks at the woman: Need it to save Nat. And now her worry becomes FEAR; English now:
M	THE WOMAN	Is he okay?
M	DOLARHYDE	He's gonna be. A storm of mixed emotions in his eyes. That stoic Dolarhyde veneer starts to CRACK... just a hint... as the woman MOVES to him... and TOUCHES his face. And he lets her. WHOA. We realize: this woman is COLORADO'S
M	DOLARHYDE (CONT'D)	I won't let anything happen to him, Jenny. Come back to me. With that, he's GONE with the gold. Leaving her full of DREAD. Jake, Ella, Doc, Colorado and the Apaches cross slippery rocks and push through the water... creeps along in a column. TENSE. Jake glances at Colorado:
M	JAKE	You and Percy're brothers, huh?
M	NAT COLORADO	... half.
M	JAKE	So... your momma and Dolarhyde---
M	NAT COLORADO	We friends now? Last I checked, you shot my ear off.
M	JAKE	Want it back? Colorado GRUMBLES, pushes ahead of Jake... its LIVING MEMBERS -- roughly 30 -- tend wounds and get ready to move on. One of them looks up... .. and sees an INCOMING RIDER on the horizon: BRONC and HUNT look up. Draws their GUNS. So does the rest of
M	HUNT	One of them fellas Jake was ridin' with! Dolarhyde rides into camp, REARING in front of 30 guns
M	BRONC	The hell you want?
M	DOLARHYDE	It's about what you want. He reaches into his pocket and tosses Bronc a GOLD COIN:
M	DOLARHYDE (CONT'D)	Lonergan stole your gold. That's a taste of what I got -- more'n you've ever seen. It's all yours if you help me get my boy back. The men trade LOOKS. Bronc eyes the coin. Alight with greed:
M	BRONC	Who's got your boy?
M	DOLARHYDE	Well, there's the rub. I got two. Off that -- Doc cracks off a piece. POCKETS it. Shrugs:
M	DOC	In case we live through this. They SNEAK on down the narrow shaft til they're funneled into...
M	THE WATER GROTTO	Where our TOWNSPEOPLE were hanging. Now, GONE. Around the corner, the sound of ENGINES POWERING UP... A TRANSPORT. A dozen WORKER-BEE ALIENS try to corral the HORSES from the pen -- cruelly jabbing the animals with ALIEN CATTLE
M	JAKE	We're never gonna get close to that ship. Silently. a DRIPPING. GLISTENING SHAPE rises un from the WATER behind them. Swaying like a COBRA ready to strike: Our people TURN... the TUBE ALIEN snatches one of the Apaches, SWALLOWING HIM in its thorny snout! The indian SCREAMS --
M	JAKE	Lights a WHISKEY MOLOTOV, hurls it at the CREATURE: BOOM! It KEENS, BURNING, SPITTING OUT the Apache. ALERTED, the dozen aliens by the transport SWARM at our heroes!
M	NAT COLORADO	C g_that shuttle. Colorado readies his TOMAHAWK -- Jake meets his eyes:
M	JAKE	Knew there was a good reason I didn't kill you.
M	NAT COLORADO	Just thinkin' the same thing. The men trade FATEFUL LOOKS... then the Indians HURL MOLOTOVS at the charging horde: KAAA-BOOM! Aliens TWIST and SCREAM -- The Apaches STRIKE FEARLESSLY -- but the aliens quickly RECOVER and SHAKE THEM OFF, tearing most of them to SHREDS. The horses BREAK FREE and crash madly through the cavern -- And this is the DISTRACTION Jake and Ella need to make their run, for the transport -- up the loading ramp:
F	ELLA	Jake - -
M	JAKE.	She slaps open an ENGINEERING HATCH, drops down a LADDER. He graphics. She slides into a SEAT --
F	ELLA	Strap in. dammit!!!
M	JAKE	Into what?!? Ella JAMS a lever forward and the shuttle RISES. JAKE grabs WEBBING that must be some type of SEATBELT, feeling the sensation of ELLQU as: As a HORSE streaks by, Colorado grabs a hunk of mane, LEAPS ON --
M	LET'S GO!!!	DOC comes RUNNING frantically: Colorado PULLS Doc up onto the horse's bare back -- no easy task horses and GALLOP HARD down the tunnel -- Two aliens jump on MANTA-SPEEDERS in pursuit! Jake has NEVER moved this fast, BARELY avoiding walls as Ella
F	ELLA	Hold on. She cranks back and the ship PITCHES upward -- The craft keeps spiralling UP UP toward... THE OMINOUS CLOUD. As we come closer, an IMPOSSIBLY BLUE GLOW blinds us:
M	THE ALIEN SCOUT	-SHIP. ENORMOUS AND THREATENING, like a BLACK METAL CLAW. Cloud banks encircle the ship as if it were the eye ON ELLA. Like ice down her spine... as we drift back to JAKE.
M	JAKE	Sheee-it. SWINGING CLOSED to trap them! But at the LAST SECOND, the horse SLIPS THROUGH the narrow
M	DOC	They're gaining on us!
M	NAT COLORADO	That's the point! And just when it looks like Doc and Colorado are GONERS... BOOM! An EXPLOSION rocks the canyon as something HURTLES DOWN from above -- WHISKEY MOLOTOVS fired from the handmade CATAPULTS. BOOM! BOOM! Aliens are VAPORIZED, SHRIEKING! A cloudburst of FLAMING ARROWS brightens the sky as 20 APACHES RISE UP along the canyon rims: A AMBUSH! An ASSEMBLY LINE OF SQUAWS works like a drill team, soaking WHISKEY RAGS and wrapping arrows. Among them, EMMETT and HAPPY! The kid pocks an arrow like a damn EXPERT -- IGNITES it -- lets it FLY -- WHOOSH! It SKEWERS a speeder pilot who BURSTS INTO Caught OFF-GUARD with NO WM TO TURN AROUND as from the OPPOSITE END of the canyon, a BELLOWING WAR WHOOP: The Apache leader spurs his horse onward, leading men toward the He's on the UPPER LEVEL of a TWO-TIER COMMAND CENTER. A DOZEN
M	ELLA JAKE	-- Dammit --- -- what--? -- she's CLIMBING back up the ladder, he FOLLOWS:
F	ELLA	Engines are warming up -- got eight minutes til the ship leaves, and about one til automated retrieval --
M	JAKE	-- autojamated what --? The first EXPLOSIVE BOLT shoots off. Ella jams her SHOTGUN into a sheath on her back, presses herself flat:
F	ELLA	Hug the wall. Jake does that beside her as the next bolt PINGS out --
M	ELLA (CONT'D)	When they come at us, aim for their heads. Only way to kill 'em for sure. He looks at his bracelet, adrenaline SURGING -- it ACTIVATES:
M	JAKE	I'll aim just fine. THE LAST BOLT FIRES and the airlock door SHOOTS OFF:
M	JAKE (CONT'D)	SonofaBITCH! The manipulator arms SCOOP UP COCOONS, pulling them DOWN the
M	C'MON!	She JUMPS through the airlock -- Jake has no time to think: And JUMPS after her -- growing SMALLER in what we now reveal is a MASSIVE HANGAR where: AUTOMATED -ARMS PLANT RECENT ARRIVALS INTO A VERITABLE FOREST of Jake picks himself up, looking around the massive hangar in AWE. -- she PULLS HIM into an alcove as a machine arm SWINGS like the machine in the underground cave. As they CROUCH:
M	ELLA (CONT'D)	We can't let that thing see us or they'll know we're here. She turns -- hits buttons on a console -- a door SLIDES UP
M	ELLA (CONT'D)	This'll take us to the bridge -- But Jake doesn't follow. STARES at her --
M	JAKE	Slaver's up there--?
F	ELLA	I sure as hell hope not.
M	JAKE	Then I'm not goin' with you. And now she HARDENS --
F	ELLA	You got any idea how big this ship is? No ray you'll ever find him alone. Be like findin' a needle in a-- -- SLAM!! Jake interrupts her by aiming at the LASER SCANNER
M	JAKE	I ain't gonna find him. He's gonna find me.
F	ELLA	Thanks for the head start. She turns and RUNS. Jake moves to that scanner eye on the
M	JAKE	Alright, you sonofabitch... come and get me. THE SLAVER fills with RAGE. And RECOGNITION. Aliens begin grabbing WEAPONS but The Slaver SHRIEKS for them to STOP. We don't need to speak alien to understand: "He's mine. " A STEEL BARRICADE SLAMS DOWN BEHIND HIM. WHAM! Another in front -- WHAM! He's TRAPPED, shut off from the passageways... ON JAKE. Understanding... his call is bging answe Okay. And starts walking to the elevator... as a SCREAM takes us to:
M	DOC	I need more bandages now!/ You: lint and splint that leg! We're losing ranks ! ! ! And then, out of nowhere... the BANG BANG BANG of 30 pistols fills the air as -- DOLARHYDE RIDES IN WITH JAKE'S GANG! A renewed SURGE of energy as cowboys join Indians to fortify their ranks:
M	NAT COLORADO	You came back!
M	DOLARHYDE	Told you: I take care of my kin. Colorado knows that's as close to "I love you" as he'll ever get. But the UPSWING is short-lived as: A speeder WHIZZES past, dropping a METALLIC BUNDLE. It splits open right in front of the fort's STEEL GATES -- pieces hydraulically ASSEMBLING THEMSELVES in seconds, becoming: THE MOTHERFUCKING SUPERGUN_OF DEATH. TWO LETHAL BARRELS spin to life, firing STRANGE STEEL BALL BEARINGS in every direction. CLAW HOOKS snap out of the balls, EMBEDDING in soldiers! One A RED SPRING-LOADED PIN depresses in the ball's center: KA-BOOM! The RED PIN starts to depress -- pOC LUNGES, JAMS HIS FINGER exploding, but if he pulls his finger out... HE DIES TOO. slows to a STOP. The door cycles open and -- -- the STRANGEST THING happens. DESERT SAND billows in a gust His eyes WIDEN. Trying to make SENSE of what he sees: Remember all those BUILDINGS that were pulled up into the tornado when Absolution was attacked? And that CRATER they found that used to be "Winfield's Landing"? It-'-s all-HE in a junkwle hangar. Building pieces. False front facades. Debris piled on top of each other, TILTED AND TWISTED AT FUNHOUSE ANGLES. And the desert sand that was sucked up along with it all. A GLOWING REACTOR casts hellish light on the dormant wreckage. fragments of a HORSE CORRAL. A CREAKING SALOON SIGN swings like a pendulum, CLANKS EERILY. A STEAM PIPE EXPLODES STEAM. Jake WHIRLS -- and like demons... Jake and Ella LOCK EYES. She's terrified, but staying STRONG.
M	JAKE	Drop the woman. We both know this ain't about her. But The Slaver only presses his blaster HARDER into Ella's neck.
M	JAKE (CONT'D)	She says you're as bad as they come. Jake curls back the fingers on both hands, CRACKING knuckles:
M	JAKE (CONT'D)	Well, you ugly sonofabitch... they say the same about me. A pipe SPEWS STEAM -- UNNERVINGLY LOUD. Then STOPS.
M	JAKE (CONT'D)	Could'a had your boys kill me five times over, instead you rolled out the red carpet... so let's get it over with. The Slaver HISSES ANGRILY at the challenge. PUSHES Ella roughly Vow ' O right the a ter of the "town" junkpile. THE SLAVER -- his hand at his side, twitching. JAKE -- his hand is still. Everyone DRAWS! But Jake's INSANELY FAST as he drops to a knee the captor with a SHOT to the temple -- Jake GRABS and PULLS Ella to safety behind a SHREDDED STORE walls -- Ella spots an ALIEN lunging around a corner: Jake WHIRLS, SLAM!!! The creature FLIES off its feet.
M	JAKE	Stay down. Ella does, and here come the rest of the aliens as Jake GUNS The REACTOR is hit in the crossfire and the ship RESPONDS with a turbine HOWL. Corpses litter the floor... all except for The Slaver. A trail of FLUORESCENT BLOOD leads around the corner... Jake WHIRLS to Ella -- her leg wounded -- -- you alright? In PAIN, she snatches one of those SMART DISCS off a dead alien:
F	ELLA	Reactor's hit. if I don't get this ship on the ground soon, we're all dead... Get me over to that turbolift. He slings an arm around her shoulder and LIFTS her, helping her to the elevator --
M	ELLA (CONT'D)	Put me inside. He does. She sees his eyes go back to The Slaver's BLOOD TRAIL:
M	ELLA (CONT'D)	I can manage the rest without you. Go do what you came up here to do. He looks at her. At the blood. At the unstable REACTOR. And Jake Lonergan makes a CHOICE:
M	JAKE	Goddamnit. -- he gets INTO THE ELEVATOR with her. She SLAMS the control
M	JAKE (CONT'D)	Stop smiling. -- KATHWAM! An EXPLOSION throws them off their horses. Colorado picks up his father and they start RUNNING LOW under Doc's finger is still STUCK in that ALIEN GRENADE, clamped to the bleeding Apache's shoulder:
M	DOL.ARHYDE (CONT'D)	The hell iz that? Grey Wolf MOANS in pain. Doc SHOUTS to Dolar:
M	DOC	Tell him to hold still! If I have this thing figured right, long as t keep my finger under the red pin we won't blow up! What's he saying?:
M	DOLARHYDE (SUBTITLE)	He says we're all gonna die.
M	COLORADO	We need to pull it out of his shoulder!
M	DOLARHYDE	I'm not pullin' anything! He's the damn doctor! Dolarhyde gets an IDEA. HARDENS. Looks Doc right in the eye:
M	DOLARHYDE	Alright, listen -- you slide your finger from under that pin, I'll slip mine in and hold it in place. Then you pull it out and I'll throw it. Doc NODS fearfully. Dolar carefully SLIPS his finger under the grenade itself, nods "ready" to pull it out. Grey Wolf braces
M	DOC	On three... One... t --
M	DOLARHYDE	-- Wait. Everyone LURCHES from the tension interrupt:
M	DOLARHYDE (CONT'D)	Tell your wife we're clear.
M	DOC	What?
M	DOLARHYDE	-- your wife. Maria. We had an arrangement. I left your saloon alone and she paid me off. ON DOC. Reeling, now REALLY confused --
M	DOC	We're broke. Paid you off with what?
M	DOLARHYDE	She stole from the people in your morgue. Gold teeth, trinkets, pocket watches -- It LANDS on Doc: that's why he fond the watch under their bed.
M	DOC	I thought she was cheating!
M	DOLARHYDE	Just robbin' corpses.
M	DOC	Thank God! Wait. You hate me. Why're you telling me this? With GENUINE REMORSE:
M	DOLARHYDE	May not get another chance -- -- and I still hate ya. A MOMENT. Forgiveness and atonement.
M	DOC AND DOLARHYDE	One... two... three! And Doc RIPS the grenade from Grey Wolf's shoulder -- he HOWLS, Dolarhyde looks at Colorado:
M	DOLARHYDE	Tell your mother I love her. With that, he CHARGES into the swirling chaos -- but BOOM! Colorado's FORCED BACK by an explosion -- through Dolarhyde HURLS the grenade -- BOOM!!! IT DETONATES IN A But his sacrifice 7M S THE TIDE! THE EXPLOSION BLOWS THE back in DISORDER -- and Ella mans a console, getting to work --
F	ELLA	We're going down fast. She calls up telemetry on a HOLO-WINDOW: EARTH TERRAIN -- The BATTLEFIELD. Sets coordinates, vectoring the ship that way: QQT. Wounded, and very PISSED OFF. Jake says to Ella:
M	JAKE	No matter what. Jake and The Slaver HURTLE into each other, TUMBLE off a catwalk, CRASHING into conduits and GUNKY WATER below. MARKINGS on Jake's BRACELET -- the symbols LIGHT UP in an UNLOCK The Slaver TOSSES IT into the gunky water. Draws his LASER WHIP Jake SCREAMS in agony as The Slaver WHIPS HIM MERCILESSLY -- A MONSTROUS SHADOW spreads over the battlefield. Everyone looks Fall back!!! NOW!! NOW!! Jake FLAILS, REACHING for something BELOW FRAME... finally GRABS and looks down to see --
M	JAKE	Go to hell. CLIMBING a ladder back to the upper deck -- But find themselves SMASHING into the ENORMOUS HULL of the ship as_it crashe _down!
F	ELLA	I lied.
M	JAKE	... I know.
F	ELLA	No, I heard what you said when I was layin' there... JAKE. Taken aback. LAID BARE. As she says:
M	ELLA (CONT'D)	You are a good man. At least... to me. The ground GROWS BIGGER out the window. Her HAND reaches over comes... EMMETT, HAPPY, and DOC, with GREY WOLF's arm slung over his shoulder. Among other faces, White and Apache... all of them From an OPENING in the Scout Ship, the sound of THUNDERING HUNDREDS OF PEOPLE emerge, dazed -- their minds slowly WAKING UP. White and Kiowa-Apache ABDUCTEES. DOC RUSHES IN, searching faces -- no -- no -- no -- n-- tears runs down her cheek. He EMBRACES her madly, kissing every inch of her face as... EMMETT pushes through the crowd, sees SHERIFF TAGGART --
M	PAW!!!! PAW!!!!	The kid GRABS his father and holds him for dear life, as Taggart It's me -- it's Emmett. And somewhere in there, RECOGNITION comes to the Sheriff's eyes... Emmett SMILES and throws his arms around his father Families, lovers, friends... reunited.
M	COLORADO	Moving through the FALLEN BODIES toward the lifeless form of
M	A VOICE (O.S.)	Nat? Colorado turns -- it's PERCY. Confused. Like waking from a dream. Sees his father on the ground...
M	PERCY	What... happened? And all Colorado can say is...
M	NAT COLORADO	He's dead. That HANGS there. Percy blinks. And then --
M	PERCY	Who's gettin' the ranch? ON COLORADO. At first, words that don't compute. Then PURE BLIND RAGE takes hold and his FISTS FLY, PUNCHING PERCY: Colorado WHIRLS -- DOLARHYDE IS STAGGERING TO HIS FEET, ALIVE!
M	DOLARHYDE (CONT'D)	No one's gettin' my ranch. Stunned, Colorado GRINS. Percy spits blood, points accusingly --
M	PERCY	Paw, he-- Dolarhyde SMACKS Percy across the face: OW!!! What'd you do that for?
M	UOLARHYUE	For being an ungrateful little bastard. Now shake your brother's hand and thank him for saving your ass, cause it's more than you ever would'a done bjM. Chastened, Percy glowers at Colorado. Grudgingly reaches out a hand. So does Nat. As they SHAKE --
M	DOLARHYDE (CONT'D)	That's better.
M	JAKE	Staggers through the crowd. And sees ELLA. Thgy did it. But
M	JAKE	. what is it?
F	ELLA	We didn't get all of 'em. Some ran oft. That LANDS on Jake, as he too looks toward the endless horizon. We RISE UP over the sea of bodies and the CRASHED SHIP, until Jake and Ella are just two small figures in the crowd... We PICK UP EMMETT running through the hustle and bustle with two
M	EMMETT	-- what? What'd I dQ?
M	SHERIFF TAGGART EMMETT	Get outta the road before you're run down! If your (overlapping) momma saw y-- -- "saw me playin' in the street she'd roll over in her grave and shoot lightnin' bolts outta her eyes," I know, I know! He runs off. Taggart SMIRKS:
M	SHERIFF TAGGART	Kid's got a mouth on him.
M	DEPUTY WADE	Well, Kyle, considering he saved your life, guess you'll just have to grin'n bear it. Dolar moves up to Taggart, tough as ever. The men HOLD looks:
M	SHERIFF TAGGART	Woodrow.
M	DOLARHYDE	Kyle. Percy STEWS about something. Dolar WHACKS him upside the head:
M	DOLARHYDE (CONT'D)	Go_ _on. Grudgingly, Percy hands Taggart a SHEAF OF PAPER --
M	SHERIFF TAGGART	What's this?
M	DOLARHYDE	Claims to the land 50 miles west of here. I've signed it over to the township of Absolution. Considering I'm a businessman, I figure expansion's in both our interests. Needs the Sheriff's signature to be official.
M	SHERIFF TAGGART	Fifty miles west of here is where the goldmine is, Woodrow. That so. With surprise, Taggart studies the paper. SMILES:
M	SHERIFF TAGGART	What's this about twenty percent going to the Apaches? Dolarhyde glances at Colorado. A moment. But the hardened rancher maintains his rock-solid facade:
M	DOLARHYDE	Figure the only way not to piss 'em off is to buy 'em.
M	SHERIFF TAGGART	Since when'd you worry about pissin' anyone off?
M	DOLARHYDE	Just sign it, Goddamnit. With a grin, Taggart gestures for Deputy Wade to turn around and
M	SHERIFF TAGGART	I'd say you were being generous, Woodrow, but I know you'd just be insulted.
M	DOLARHYDE	Damn right. Dolar gives his hat a TIP, then mounts up to go -- and we RISE
M	DOC MARIA	SHH! The workers will hear us!!! Let them hear! As they TUMBLE back onto the bed, Doc LURCHES. Reaches under his back to find... a GOLD POCKETWATCH.
M	DOC	What is this?
