M	CHARACTER	DIALOGUE
M	HICKS (CONT'D)	Since the beginning -- the two have been locked forever in combat... The vampires were quicker, stronger and had the gift of flight. Quick glimpses of a bloody, brutal battle. Men screaming.
M	WHOOSH!	With a HOWL, we see A MAN plucked off the ground, his body
M	HICKS (CONT'D)	But man had the sun. THE CAMERA TILTS DOWN to find another GROUP OF MEN -- more
M	HXCKS (V.0.) (CONT'D)	And so it went like this over many years. As man and vampire both evolved -- the wars became bloodier. From afar, we see GIANT STACKS OF CORPSES as hydraulic Stands at the base of one of the mammoth pyres. Even from
M	HICKS (V.0.) (CONT'D)	Then came THE PRIESTS -- The Man turns and we see his face is shadowed by a large
M	HICKS (V.0.) (CONT'D)	-- Specially trained warriors in the art of vampire combat. They single-handedly turned the tide for the humans. Quick glimpses of a GROUP OF PRIESTS battling a FURY OF
M	HICKS (V.0.) (CONT'D)	Over time the vampire threat faded. The once fierce race now fatally diminished. A shadow of what they once. were. Through heavy smoke, we see a pile of VAMPIRE CORPSES, a
M	HICKS (V.0.) (CONT'D)	The remaining vampires were put Into camps and -- by decree of the High Clergy the Priests disbanded. The former warriors to be integrated as members of regular society. We see a WAX SEAL pressed onto an ancient parchment. The
M	HICKS (V.0.) (CONT'D)	The human race thrived in relative quiet. The vampire menace quickly forgotten for other, more modern threats. And the few surviving Priests faded Into quiet obscurity. The chamber is closed. We see an encrusted key turning in a
M	.s.	Our story begins with the rusty SCRAPE of a windmill... He smiles, waving to her. His wife. Aaron sits surrounded, a lattice work of vines covering the
M	SHANNON (O.S.)	Supper's on! He smiles, studying a. stunning RUBY RED FLOWER, separate from
M	THE KITCHEN	SHANNON PACE carries a bowl filled with a steaming green
M	SHANNON (CONT'D)	You been spending an awful lot of time behind that door. Makes a woman suspicious.
M	AARON	Special project. It's taking a little more time than I thought.
F	SHANNON	Nothing special about milkweed. Unless you like a thorn in the finger.
M	I AARON	It's not Milkweed. Not this year.
F	SHANNON	What is it?
M	AARON	You'll see. His eyes skate to her face moving in for the kiss -- but he's Yuck. Pershing-stew again. Their DAUGHTER (13). Already a heartbreaker. This girl is I can't do it anymore. This outpost. Being all cooped up like this. I'm going
M	AARON	Honey...we know this hasn't been easy for you -- In two years someone else'll study the soil and this'll be their outpost. But for right now -- this is my job. I don't know what it's like to have a best friend. To have any friends. I want to have a crush. I want secrets. I want a life. Shannon looks at her husband. She knew this day would come.
F	SHANNON	Aaron. She's thirteen -- She should be with children her own age. Aaron lets out a breath.
M	AARON	Okay. Next year, we'll figure out a way to get you to a school close by. In town.
M	AARON	N year -- that's still plenty of time for you to have a "crush". Lucy deflates, knowing this is as good as it's going to get
M	AARON (CONT'D)	Tomorrow I'm heading in town to file. You come with, help your old man out, get a change of scenery. OK? Now c'mon, stew's getting cold. Bow your heads and say grace. The family clasps hands. Whatever their differences, there's
F	LUCY	Dear Lord we thank you for what we are about to receive. Blessing us with your gifts... She.speaks with her eyes clenched shut, words spoken
M	LUCY (CONT'D)	We thank you for the earth and the sky and for your bounty through Christ our Lord -- She.stops, opening her eyes -- staring at the plates and They're RATTLING.
M	LU C Y (CONT'D)	Daddy?
M	AA RON	Shh. He cocks his ear, heading a low rumble. Although he's never heard the sound before...he knows it can' Trying to remain calm, Aaron goes to the window.
M	OUT THE WINDOW	Framed by a BLOOD MOON hanging over the horizon, a DOZEN BLACK The Jesus figurine falls off the table, SHATTERING to the Aaron looks at Shannon, an expression on his face she hasn't What's going on? Aaron doesn't answer, Shannon helping him position pre-cut
M	AARON	Get by me. Shannon-and Lucy crouch at his feet. It's quiet. The RIDERS step from their machines. We don't get a look at The power goes out, everything going black. Daddy? We hear the Riders crawling over the outside of the house. Finally, the gun clicks empty and we're plunged back into Aaron is still standing, the house in shambles around him.
M	SHANNON!	From outside we hear the cycles revving.
F	SHANNON	Her body lying in the dirt, head lurching at an obscene' ere' g UNCT_URE MABKS in hem neck. Crying, he cradles his, wife. Feverishly looking around for He keeps screaming but it's no use -- as the-motorcycles fade They've taken her. The CAMERA TILTS to the MOON hanging above the plain. it
M	A STEAM WHISTLE BLOWS	Quitting time. Hundreds of WORKERS trail listlessly from a
M	A TATTOOED FIGURE	moves through the crowd, people stepping out of his way. We don't get a good look at him. Just FLASHES -- Eyes like nail guns. Tendons clenching over muscle. As he walks,people whisper. He hears all of it. The Figure suddenly stops. He cocks his bald head -- Their LEADER holds her close, BUTCHER KNIFE at her
M	LEADER	Go ahead ...scream. Scream for daddy. He hears a noise, looks up and sees a SILHOUETTE standing at Looks like daddy's already here. Well, then. Come on daddy...make it better. The Figure steps into a pool of white light, giving us our A LAL RGE AK CROSS TATTOO shadows most of his-- a e. Across The Mark Of The Priest. A Priest! Well, lookie here.. We got us a real life war-hero boysl Heard you guys were real baddasses. The Workers all pull out large knives.
M	LEADER (CONT'D)	Guess we'll find out. They move in on Priest, chemicals burning in their blood, Priest folds his hands into the prayer position. What's he gonna do. . .BLESS us to death? Pries is holding their knives. Before they can react, he throws the knives into their feet. Scared, the leader clutches the girl, pressing against the
M	LEADER	This ain't the war no more. You got no right meddlin'. You don't belong here -- You ain't one of us. And with that he RAISES the blade to the girl's throat -- WHOOSHI A sudden RUSH OF AIR. The leader looks at the So is his hand. Priest holds the severed limb, its fingers still clutching
M	THE GIRL	Gawks at Priest, possibly more frightened of him than the He turns to her, wanting to comfort her but not knowing how -- He moves on.
M	INSIDE THE BOOTH	FATHER KOEPPEN, body skinny and ravaged. The old man pours
M	FIGURE'	Bless me Father for I have sinned...again. The voice is like gravel from the bottom of a deep well.
M	KOEPPEN	I caught the ambulance picking up what was left of the factory boys...figured it was your handywork. The Shape leans forward, we see it is Priest.
M	PRIEST	This time there was a little girl.
M	KOEPPEN	if this keeps occurring it'll be .impossible to keep it from the Clergy. You'll get us both excommunicated. Priest gazes into the vestibule, his voice almost a whisper.
M	PRIEST	I want to see the other Priests.
M	KOEPPEN	You know you can't. The Clergy forbids it.
M	PRIEST	Why?
M	KOEPPEN	They have their reasons. Priest flicks his eyes over Koeppen as if he could see
M	PRIEST	And their reasons for building more and
M	KOEPPEN	Since when is. industriousness a sin? Did Jesus not teach us to be productive? As your appointed counselor take my advice, . .Relax -- Take up a hobby, pick a
M	PRIEST	You're my friend.
M	KOEPPEN	I'm a wicked old man who'd sell his parish for a pint of whiskey. Priest seems to deflate, his hard shell cracking.
M	PRIEST	I don't know what's happening to me. (7, Questions. Doubts. I'm not sure what it is. Koeppen slides the vestibule open so they are now face to face.
M	KOEPPEN	The devil comes in many shapes. Do yourself a favor, keep your head down. Be smart. And most of all remember your oath... He hands Priest a set of ROSARY BEADS.
M	KOEPPEN (CONT'D)	"To go against the Church is to go against God". This statement has always been the boilerplate of Priest's The elevator arrives and they step inside. Did it hurt? The lift grinds to a stop. The mother quickly pulls her son And only now does Priest answer. Yes. The lift door clatters shut. He goes to the lone decoration in his apartment -- He takes the picture off the wall, studying it. The image From the streets below, the sound of a GUNSHOT.
M	PRIEST	Who is it?
M	MESSENGER (0. S.)	Messenger. Priest opens the door. A MESSENGER holds up a PUNCH CARD.
M	MESSENGER (CONY ' D)	I gota Priority Punch. Originated in the wasteland. Priest takes the card, the man writing up a receipt. L-Lucy's gone. They t-took her. I tried to stop 'em. I knowouu're..."retired". But can you find her? Find her before --. They killed Shannon. The screen goes blank. Priest shuts his eyes, making the sign of the cross. At the Cities center, a municipal of baroque BASILICAS AND
M	PRIEST	Thank you for meeting with me on such short notice, Monsignors. Even the Monsignors are uneasy'around Priest. Their leader,
M	MONSIGNOR ORELAS	Father Koeppen notified us of the situation. Our prayers are with your family.
M	PRIEST	I come before you because I would like my authority to be reinstated.
M	MONSIGNOR ORELAS	On what grounds? Priest is taken aback.
M	PRIEST	She's my blood, Monsignor.
M	MONSIGNOR ORELAS	The proper authorities are handling the situation. I'm sure they'll.do a fine job.
M	PRIEST	The proper authorities?
M	MONSIGNOR ORELAS	All occurrences of vampire. disobedience and felonies are strictly a Federal matter now. You Priests did too good a job. The vampire population is classified as endangered. They're protected.
M	PRIEST	But Monsignor...they are the enemy.
M	MONSIGNOR ORELAS	Were.the enemy. The war ended a long time ago.
M	PRIEST	Not so long that we should forget what they are capable of.
M	MONSIGNOR ORELAS	You would do well to remember the words of our Savior: Turn the other cheek. Embrace your enemies. It is not our place to interfere --- or yours. Priest looks up, obviously in great turmoil.
M	PRIEST-	I can be of.great service to the investigation. I -can 0 The tribunal shifts uncomfortably, intimidated by Priest.
M	MONSIGNOR ORELAS	You forget yourself, Priest... It has been brought to our attention that you have engaged in a number of transgressions. Tell me...do you feel yourself to be above God?
M	PRIEST	No, Monsignor.
M	MONSIGNOR ORELAS	Engaging in any kind of practice is sacrilege -- You bring shame upon our house. Priest turns the full force of his gaze on him.
M	PRIEST	"Let your light shine before men, that they may see your good works and glorify your Father which is in Heaven" -- The Monsignor POUNDS the table.
M	MONSIGNOR ORELAS	You dare quote scripture to met Questioning the . authority. of the Clergy is forbidden1 If you engage in another transgression.you will be stripped from the Order and excommunicated immediately. Do I make myself clear?
M	PRIEST	Yes, sir.'
M	MONSIGNOR ORELAS	I said do I make myself clear,. Father.
M	PRIEST	Yes, Monsignor.
M	MONSIGNOR ORELAS	You're a soldier. God's soldier-- Act like one. Remember your vow: "To go against the Church is to go against God". The officers start to lead Priest and Koeppen out the chamber,
M	MONSIGNOR ORELAS (CONT'D)	-- Eather..Kam, please stay behind for a moment, a .we have something we need to discuss.
M	KOEPPEN	I knew I'd find you here. He sits, pouring himself another drink, toasting the poor
M	KOEPPEN (CONT'D)	How many nights in this very spot? You with your endless questions on the nature of suffering-Me with none of the answers. Priest doesn't even acknowledge him, lost in his thoughts.
M	KOEPPEN (CONT'D)	Well, now I'm the one with a question. This one's a riddle. What is greater than God-but more evil than the Devil? The poor have it, the rich need it -- and if you eat it...you'll die. Priest looks, up, his eyes cold.
M	PRIEST	Why won't they listen to me? A beat. Koeppen takes another drink.
M	KOEPPEN	Okay. I'm going to.give you one more riddle and if you listen close - you might just hear an answer to your question.
M	KOEPPEN (CONT'D)	How can a man who spent his whole life searching for devils miss the ones staring him in the face? From behind, a CLICKING sound. Priest turns to find an OFFICER standing, LASER-GUIDED The Church feels it's better to keep you under its care...at least until this trouble with your niece blows over..
M	PRIEST	You know I can't do that.
M	KOEPPEN	That's what I figured.
M	TEN TROOPERS IN FULL RIOT GEAR STORM IN	
M	PRIEST	Why? "To go against the Church is to go against God'. Priest looks around the room -- FAMILIES AND HOMELESS huddle There's only one thing left for him to do.
M	PRIEST	Then ...I go against God. In an eyeblink -- Priest strips the gun from the nearby officer, CRACKING it He breaks, from his father.'' knee, slowly moving towards the
M	PRIEST	Folds his hands into the prayer position.
M	SILENCE	The: troopers look around confused -- their guns have
M	ON A NEARBY TABLE	A neat pile of shotguns sit, every FIRED BULLET collected
M	THE LITTLE BOY	is somehow back with his father, the two safely holding Priest is gone.
M	KOEPPE4	Looks at his fancy whiskey bottle, inside now floats Priest's
M	KOEPPEN	Heaven help us. He takes a swig.
M	AT THE ALTAR	Priest kneels, eyes clenched shut in prayer. A large
M	PRIEST	oh my God...I am sorry for. having offended you. it was never my intention to do so... His words continue OVER
M	PRIEST (O.S.)	I want so much to firmly resolve with the help of your grace to sin no more and to .avoid the near occasions of sin. But I can't.
M	BLACK MOTORCYCLE	if this thing were a horse it'd be the ultimate stallion-- He races onto the street.
M	PRIEST (O.S.)	All I can do is ask for forgiveness for what is yet to come... The cycle knifes through the city. Expertly working his way
M	PRIEST (O.S.)	I now know the devil lives within me. The sins coming all too easy... Still on his bike, Priest's foot touches the ground, blocking And all too frequently. Priest REVS his bike, gunning out the doors. UNCONSCIOUS
M	VROOMI	Priest's cycle streaks across the salt flats. It's glorious. He crouches, examining,a fresh TIRE TREAD. He stares, taking in Then he steps inside the cabin --
M	BEHIND HIM	Quietly, A COWBOY HAT and a SHOTGUN BARREL emerge from a hole
M	COWBOY HAT	Alright, now -- Not another step.
M	HICKS	Thought you'd come back for a souvenir, hub? You gotta be the dumbest bloodsucker I ever come across. Priest steps into a pool of moonlight, illuminating his face.
M	PRIEST	If I was a vampire you'd be dead already. The cross tattoo, a striking image. Hicks stares, pushing
M	HICKS	I'll be dammed. He casually spits some ATOMIC CHAW, hitting the floorboards TOWNSPEOPLE gather around a SNAKE-OIL SALESMAN, the man
M	SNAKE OIL SALESMAN	Do I ask for three dollars?' Do I ask for two dollars? No folks! ONE dollar! One piece of tin and protection is yours!
M	PRIEST AND HICKS	Pull up in front of the Jail. Hicks eyes the salesman,
M	HICKS	•Scuse me a minute, He heads towards the crowd, the salesman continuing his pitch.
M	SNAKE OIL SALESMAN	Vampires are a deadly lot! YOU could be next I I seen a Blackblood bite a man like a gingersnap! The only sure way to be safe is a bag of DR. TOMLIN' S WONDER
M	POWDERT	If you care about your loved ones then you MUST have this amazing elixir in your homes tonight -- WHOOSH! A KNIFE slices through the air, spears the sack and
M	HICKS	You best get in that van and clear on out, mister.
M	SNAKE OIL SALESMAN	For what reasons? I'm a legitimate business man. Hicks PULLS his SIX-SHOOTER, cocks it.
M	HICKS	I got six right here.
M	SNAKE OIL SALESMAN	Sheriff, I am shocked you can be.so cavalier with the safety of your HAM! A bullet blows out the van's headlight.
M	HICKS	That's one. KAPOW! The windshield cracks like a spiderweb.
M	HICKS (CONT'D)	Two. Immediately, the salesman quickly packs up his wares, Hicks pulls the knife from the wall, holds the bag up to the Now you all listen up. This bag ain't good fornothin' but linin' that man's pockets with your hard earned money. Much shuffling amongst the people -- they trust in their
M	CROCKER	You don't know'that. You're just a kid.
M	HICKS	I seen enough two-bit hustlers and carry barkers. He ain't no better.
M	CROCKER	But what if he's right? Hicks tosses the sack to Crocker.
M	HICKS	Take a look. Ain't nothin' but sand, flour and maybe 'a little garlic.. Oldest trick in the Now I don't blame you for bein' afraid. But those vampires headed clear .on out and they ain't comin' back.
M	WOMAN	And what about the girl? Hicks pauses. This is not easily said.
M	HICKS	I filed a report with the Cities last night. I'm sure they're Join' all they can. The townspeople mutter amongst themselves. Hicks looks over
M	HICKS	I've already had one of the boys send for your brother. We got him put up at Paddy's place. Priest gazes out . the; window. A group of TOWNSPEOPLE are
M	HICKS (CONT' D)	You're gonna have to excuse the attention.. We don't get strangers `round here too much -- "Specially no Priest. 'Course we ain't never had no vampire attack in.these parts before. But then you're just here to perform the service, right? Priest doesn't reply, staring at a yellowed wanted poster.
M	HICKS (CONT'D)	Never much of a believer myself. I figure I got one bullet to shoot. I'm gonna shoot it my way... not how some BOOK tells me to. But I do hear things...it true what they may about you folks? You can fold time? At that, Priest turns, looking at Hicks. Before he can
M	AARON	comes through, looking older than the last time we saw him.
M	AARON	You came. Overcome, he wraps his arms around his brother, embracing.
M	SHANNON'S COFFIN	Lies in a freshly dug hole. Priest sprinkles dirt across.the Aaron watches,. silently. A GROUP OF TOWNSPEOPLE encircle the
M	HICKS	Stands apart from the others, hat in his hands. His eyes
M	PADDY	Jackrabbit Stew. Never served no man of the cloth before. Hope you like it spicy, Father! He stands over both of them, eager for a response. Priest
M	PRIEST	.Delicious
M	PADDY	`Course it isl it was me Ma's recipe. As Paddy jubilantly walks away, Priest puts the bowl on the
M	AARON	How come you never came round more? You know you were always welcome.
M	PRIEST	I know.
M	AARON	After the war was over we figured you'd stay with us. Shannon was real fond of you. Lucy too. She was always asking about you. Uncomfortable with the conversation, Priest pulls out a map,
M	PRIEST	The pack headed in this direction. There's a reservation up that way so that's where I'll start.
M	AARON	if anyone finds out you're doing this -- You're my brother. Aaron nods. This is enough,
M	PRIEST (CONT' D)	I'll find her.
M	AARON	And you' 11 bring her back to me. Something in Priest's face darkens. He doesn't answer, not With a jingle, the door opens revealing Priest. The clerk
M	CLERK	Good afternoon, sir! How may I be of service?
M	PRIEST	I need bullets.
M	CLERK	How many?
M	PRIEST	How many do you have? The clerk laughs... then realizes he's serious.
M	CLERK	No offense, Father. You got a permit, right?
M	PRIEST	I have this. He pulls out a sack of coins, it hits the counter with a The clerk smiles wider..
M	AARON	Maybe if I knew how to use these she'd still be alive.
M	PRIEST	Sometimes things just happen. Fault's got nothing to do with it.
M	AARON	Funny. I'm the one who used to say that. You were the one who always said everything was God's will. Priest takes the bullet from him.
M	PRIEST	I'm not so sure anymore. There's a KNOCK at the door. Aaron opens it slightly. It's
M	HICKS	Aaron.
M	AARON	Sheriff.
M	HICKS	You mind if I have a word-with your brother? An awkward BEAT as the two stare at each other. Both knowing
M	PRIEST (0.S.	It's alright. Let him in. Eyeing Priest, Aaron lets the Sheriff in, shutting the door
M	HICKS	I'm sure you're well aware of the Vampire Protection Act.
M	HICKS (CONT'D)	it strictly states it is forbidden for anyone to hunt vampires anymore.
M	C	Priest doesn't say anything, he just keeps working.
M	HICKS (CONT'D)	These days, things go through proper channels. Paperwork drawn up. investigators called in. Procedures followed. 'Course we both know after a week, girls taken by vampires either and up dead or worse -- turned. I'm sure you also wouldn't be surprised to know my office's'been contacted. I'm supposed to arrest you on sight. He pulls a SHINY OBJECT from his pocket, puts it on the table
M	HICKS (CONT'D)	On the other hand -- if I go after Lucy there'll be a warrant on mybead too...and that'll put us in the same briar patch.
M	O	Priest looks at the object -- It's Hicks' sheriff's badae.
M	HICKS (CONT'D)	We leave at sun up. Priest turns. A moment as each man studies the other.
M	PRIEST	Why?
M	HICKS	We're the only chance she's got. Priest picks a bullet from the table, a carefully notched
M	PHHHHTTI	Hick's knife FLIES across the room, PINNING the bullet to the
M	PRIEST	How you with a gun?
M	HICKS	Better than I am with a knife. Priest considers this.
M	PRIEST	I'll be there. Nothing more needing to be said, Hicks turns to walk out,
M	HICKS	What's with all the bullets anyway? I thought Priests don't use firearms.
M	PRIEST	We don't. They're for you. Hicks nods, realizing Priest was ahead of him the whole time.
M	PRIEST	Our Father who art in Heaven, hallowed be thy name. Thy Kingdom come Thy will be done on earth as it is in heaven... As he continues THE CAMERA slowly moves OUT THE WINDOW and
M	PRIEST (O.S.) (CONT'D)	Forgive us our trespasses as we forgive those that trespass against us and lead us not into temptation but deliver us from evil. We see the TOWNSPEOPLE: lock their doors, bolting the
M	PRIEST (O.S.) (CONT'D)	For thine is the kingdom and the power and the glory, forever and ever. Amen. And now the camera stops on a LARGE SHADOWY FIGURE perched on a The only thing we can see of it is a DUSTER illuminated by
M	AARON	You never talked much about the war but I know you saw things. Bad things.
M	PRIEST	Yes.
M	AARON	What'd you do...to make yourself unsee `em? To make it stop playing in your head?
M	PRIEST	I prayed.
M	AARON	Did it help? Priest doesn't answer, the question hanging overhead, a dark
M	AARON (CONT'D)	I never used to be much on faith. You But then Lucy was born. .and as soon as I saw her I knew. I Just knew -�- There's no way something so perfect came from me. She was a gift. From God. You find her. Whatever it takes. Find Lucy. Priest nods, his brother's eyes burning into him. Hearing the
M	HICKS	Didn't mean to be late -- My deputies are a little green about keepin' the peace all by their lonesome. Needed a pep talk. Figure I'll ride point. I know my way `round the Wasteland better than just `bout anyone. ' Without so much as a word, Priest climbs on his cycle and Real charmer, your brother.
M	AARON	That's just his way. Don't pay it no mind. You just bring back my baby. Hicks nods. Then he REVS the throttle, speeding after Priest. A. THUNDERING past Strange ROCK FORMATIONS, bizarre shadows B. A group of WANDERING MONKS, holy men carrying offerings to C.- We.see a PHOTO OF LUCY now stuck to Hicks' windscreen.
M	HICKS	The Nightshade Reservation.. Ain't nothin' but red-outs and rejects. They're a fallen tribe.
M	PRIEST	Either way. We have two hours to get in and out.
M	HICKS	What happens in two hours?
M	PRIEST	Sundown. Hicks looks up at the sky. The sun tilting towards the
M	HICKS	This is how most of the reservations are these days. We see faces peering out from wooden slats. Gaunt,: lifeless
M	PRIEST	Familiars are illegal.
M	HICKS	Nobody really enforces it. most come from the fringes. Drifters. They're creepy as all hell -- but harmless. They turn off their bikes and dismout. Hicks stepping A MALE FAMILIAR stands with a butcher knife over a basin. His voice a hissing rasp.
M	FAMILIAR	Good afternoon, Sheriff... Father. What brings you to Nightshade?
M	HICKS	We're looking for a Vamp Pack. They woulda' came through here a couple nights ago.
M	FAMILIAR	Nobody comes through Nightshade. That's the way we like it. Nice and quiet.
M	HICKS	Then you won't mind if we have a look around? The Familiar picks up another chicken. Raises the butcher
M	FAMILIAR	Not at all. CHOPI The head clatters to the ground.
M	PRIEST	We're not going to find anything out here...We have to get into the crypts. Not supposed: to do that without a warrant -- BAMI -- Priest kicks the door in. The Crypt Familiar cowers-in the corner, shielding his eyes
M	CRYPT FAMILIAR	Got Got You must got Master will be angry! Nicks is grimacing from the stench. He looks at Priest, not
M	PRIEST	Where's the girl?
M	CRYPT FAMILIAR	PLEEASE please got
M	PRIEST	No? Maybe your Master will know.
M	CRYPT FAMILIAR	NOt NOI THE MASTER CANNOT BE DISTURBEDI Priest rests his hand against the. atone slab covering.the
M	PRIEST	Wh re is she? Please. Please don't hurtmy Master.
M	PRIEST	Your.Master'll be dead. He shoves the slab more, the light rays hanging just outside And now The Familiar begins to laugh, a horrible rattling
M	CRYPT FAMILIAR	No, i don't think so. Hearing a noise, Hicks turns, witnessing a horrible sight
M	THE NIGHTSHADE FAMILIARS	About ten of them. Real Night Of The Living Dead stuff. Before Hicks can react --
M	A FAMILIAR	Attacks, BUTCHER BLADE raised. CHOP! the blade buries itself
M	HICKS	Lets loose with a mean roundhouse. Plugging him in the
M	FAMILIAR	The blade lodges in his skull and he drops like a sack.
M	A BUZZSAW BLADE	knifes through the air heading straight for him. He DUCKS,
M	HICKS	Pulls off his COWBOY HAT. Activating a release. With a A BEAT as the Familiar stands, mouth agape. Then with a wet
M	PRIEST	Leaps in front. Blocking his way.
