M	CHARACTER	DIALOGUE
M	PAT (CONT'D)	I mean, I'm sorry. How'd that happen?
F	TIFFANY	Does it really matter?
F	VERONICA	Baby, how's it going?
M	RONNIE	Great, great.
F	VERONICA	Everyone having fun? We're gonna go on a tour now. We're gonna go on a tour now. Let's go see the house.
M	RONNIE	Come on, let's go for the tour. I've, I've been planning this forever. I love our house. I love our house. I'm really excited about it. Tiffany looks back over her shoulder at Pat, intensely.
M	RONNIE	Come on.
F	VERONICA	Guess what it is.
M	PAT	Oh, it's a television.
F	TIFFANY	It's a computer screen.
M	RONNIE	Nope.
F	VERONICA	Just keep going, keep going, keep going.
M	PAT	It's a brick oven, it's a brick oven.
F	TIFFANY	It's a light. It's a...
F	VERONICA	Ooh, ooh, warmer, warmer, warmer.
F	TIFFANY	...it's a drawer at a morgue where they pull out dead bodies and shoot them with formaldehyde.
F	VERONICA	Don't think so hard, don't think so hard.
M	PAT	Where would the dead body...where would the body go, though? `Cause the outside of the-- It's a joke!
F	VERONICA	It's a...fireplace.
F	TIFFANY	In the middle of the wall?
F	VERONICA	We have a port in every room. Gimme an iPod. Who, who doesn't have an iPod?
M	PAT	Well, I don't have an iPod. I don't even have a phone. They won't let me make any calls. They think I'm gonna call Nikki.
M	RONNIE	Don't worry about it. Don't focus on that.
M	PAT	I would call Nikki.
M	RONNIE	I'm actually gonna give you one of my iPods. I have an old one.
F	VERONICA	Gimme your iPod.
M	VERONICA (CONT'D)	Give it to me. Thank you, baby, thank you.
F	TIFFANY	Of all the rooms there are iPod ports in, I'm happy you brought us into the bathroom.
F	VERONICA	Look, look, look.
M	VERONICA (CONT'D)	I can play music for the baby in any room.
M	PAT	Can you play "Ride the Lightning" by Metallica?
M	RONNIE	Pat was a history sub at the high school, Tiffany. Ask him about any president, he knows 'em all.
M	PAT	Here's a fun fact. You know where the term "OK" comes from?
F	VERONICA	No. No, I don't.
M	RONNIE	Where?
M	PAT	Well, Martin Van Buren, the eighth president of the United States of America, is from Kinderhook, New York...
F	VERONICA	Oh.
M	PAT	...and he was part of a club, a men's club, called Old Kinderhook. And if you were cool, you were in the club, they'd say, "That guy's OK." `Cause he was in the Old Kinderhooks.
M	RONNIE	Really?
M	PAT	Yeah. Pretty cool, right?
M	RONNIE	That's interesting.
F	VERONICA	You know, Tiffany's been doing this dance thing for years and she's real good at it. She's gonna be competing at the Ben Franklin Hotel.
M	PAT	Oh, really? My wife loves dance. Nikki loves dance.
F	TIFFANY	Why do you have to talk about me like that?
F	VERONICA	I'm just bragging about you. Can't I brag about my little sister?
F	TIFFANY	Don't talk about me in the third person.
F	VERONICA	Please, gimme a break.
F	TIFFANY	I'm right here.
F	VERONICA	Just be nice. Just be nice.
M	PAT	Wow, wow, wow. Fascinating.
F	TIFFANY	Sorry. I don't wanna be mean.
F	VERONICA	I know. I know, I know. What meds are you on?
M	PAT	Me? None. I used to be on Lithium and Seroquel and Abilify, but I don't take them anymore, no. They make me foggy and they also make me bloated.
F	TIFFANY	Yeah, I was on Xanax and Effexor, but I agree, I wasn't as sharp, so I stopped.
M	PAT	You ever take Klonopin?
F	TIFFANY	Klonopin? (Chuckling) Yeah.
M	PAT	Right?
F	TIFFANY	Jesus.
M	PAT	It's like, "What? What day is it?" How about Trazodone?
F	TIFFANY	Trazodone!
M	PAT	Oh, it flattens you out. I mean, you are done. It takes the light right out of your eyes.
F	TIFFANY	God, I bet it does.
M	TIFFANY (CONT'D)	I'm tired. I wanna go.
F	VERONICA	No. No, no, no, no. We haven't, we haven't even finished the salad yet, or the duck. I made the Fire and Ice cake.
F	TIFFANY	I said I'm tired. (to Pat) Are you gonna walk me home or what?
M	PAT	You mean me?
F	TIFFANY	Yeah, you. Are you gonna walk me home?
M	PAT	You have poor social skills. You have a problem.
F	TIFFANY	I have a problem? You say more inappropriate things than appropriate things. You scare people.
M	PAT	I tell the truth. But you're mean.
F	TIFFANY	What? I'm not telling the truth? Veronica and Ronnie are very uncomfortable.
M	RONNIE	Um, maybe I should drive them home separately?
F	VERONICA	You can drive them both home. Now.
F	TIFFANY	Stop talking about me in third person.
F	VERONICA	You can take Tiffany home first.
F	TIFFANY	You love it when I have problems. You love it, Von, because then you can be the good one. Just say it.
F	VERONICA	No...
M	VERONICA (CONT'D)	...I don't. I don't. I just wanted to have a nice, I just wanted to have a nice dinner.
F	TIFFANY	Oh, God.
F	VERONICA	What is your problem?!
F	TIFFANY	Nothing's my problem! I'm fine. I'm tired and I wanna go. (to Pat) Come on, are you ready? Pat stands.
F	VERONICA	You really, you really wanna go right now?
F	TIFFANY	Yes, I really wanna go! It's been great.
M	RONNIE	Okay, guys, the baby is sleeping!
F	TIFFANY	Sorry. I don't wanna wake up the baby. Bye.
M	RONNIE	Sorry, man.
F	TIFFANY	This is me.
M	TIFFANY (CONT'D)	Listen, I haven't dated since before my marriage so I don't really remember how this works.
M	PAT	How what works?
F	TIFFANY	I saw the way you were looking at me, Pat. You felt it, I felt it, don't lie. We're not liars like they are. I live in the addition around back, which is completely separate from my parents' house, so there's no chance of them walking in on us. I hate the fact that you wore a football jersey to dinner because I hate football, but you can fuck me if you turn the lights off, okay?
M	PAT	How old are you?
F	TIFFANY	Old enough to have a marriage end and not wind up in a mental hospital.
M	PAT	Look, I had a really good time tonight and I think you're really pretty, but I'm married, okay?
F	TIFFANY	You're married? So am I.
M	PAT	No, that's confusing. He's dead.
M	PAT (CONT'D)	Wait, what?
M	PAT (CONT'D)	What's happening?
M	PAT (CONT'D)	Oh, my God. Hey.
F	DOLORES	Are you okay? Ronnie called. Hey, is that make-up on your shirt?
M	PAT	I don't know, Mom.
M	PAT SR.	What happened over there?
M	PAT	When am I gonna get a phone?
M	PAT SR.	You'll get a phone in due time. (to Dolores) What happened?
F	DOLORES	Pat! LED ZEPPELIN CONTINUES alternately quiet and LOUD. Mom! I can't find my wedding video. Mom, wake up. What is it? Where's my wedding video? Led Zeppelin continues.
M	PAT SR.	It's after three o'clock! What are you doing?
M	PAT	I looked in here, but this is all your sewing shit up here, for your sewing and everything. Did you put it up here?
F	DOLORES	What about in your father's study? Don't go in my study.
M	PAT	Dad, not now!
M	PAT	Would you put it in here? It makes no sense for you to put it in here. PAT SR. Patty, what are you doing?
M	PAT	He's got all his Eagles videos and not one video of my wedding!
M	PAT (CONT'D)	Is it here? I mean....?
M	PAT SR.	Patty!
F	DOLORES	It's probably in the attic.
M	PAT SR.	Are you going in my study?
M	PAT	It feels to me like you wanna hide my wedding video.
F	DOLORES	Please stop yelling!
M	PAT	I'm not yelling, Mom, I'm just frustrated because I should have my fucking wedding video!
F	DOLORES	Pat! Pat! I looked over there! I already looked all over there!
F	DOLORES	Calm down, Pat. I'm not calming down! I don't give a fuck who hears, I'm not calming down! Anybody can wake up! I'm not ashamed of it! I'm not ashamed of it! Let the whole neighborhood wake up! I...
F	DOLORES	Pat! Stop it! ...don't care! Stop it! Stop it! Stop it! No, Mom!
M	PAT SR.	What's going on?
M	PAT SR. (CONT'D)	What?
M	PAT	I want it! It-... Hey!
M	PAT	It's my wedding! It's my wedding video! Pat! Stop it! Stop it! Stop it! I can't watch my wedding video, but I CAN hear the fucking song in my head, goddamn it! He grabs his head, to stop hearing the wedding song. Mom? What the fuck you doing?! You...
M	PAT	Mom?
M	PAT SR.	...hit your mother?!
M	PAT	No, no, no, no, no! Stop it!
M	PAT	Get off me, Dad!
F	DOLORES	Stop hitting him! Stop hitting him!
M	PAT SR.	I'm not hitting him! He's hitting me! I'm sorry! I'm sorry! I'm sorry!
M	OFFICER KEOGH	Police!
M	OFFICER KEOGH (CONT'D)	Open the door, please. Open up. Mister Solatano, I got a lot of calls. People in the neighborhood are scared. I gotta come in. NEIGHBORS clamour behind him.
M	OFFICER KEOGH (CONT'D)	How are we doing in here, huh?
M	OFFICER KEOGH	There are a lot of reports from your neighbors, we got a lot of phone calls.
M	PAT	Nikki is being manipulated and controlled. You have to talk to her.
M	OFFICER KEOGH	Hey, sit down.
M	PAT SR.	Sit down.
M	PAT SR. (CONT'D)	You gotta stop with these crazy theories. He's a cop. What are you doing?
F	DOLORES	It's a medication problem, but he's fine now.
M	OFFICER KEOGH	Oh yeah? He's fine now? You wanna send him back to Baltimore? We know all about the explosion at the psychiatrist's office.
F	DOLORES	What?
M	PAT	What explosion? No. Cliff is lying, that's not true. He's not allowed to talk about that.
F	DOLORES	Jesus Christ, who's that?
M	PAT SR.	Keep an eye on him.
F	RICKY	Is this a bipolar episode?
M	PAT SR.	Get outta here, you little fuckin' idiot! Get outta here!
F	RICKY	Someone, help me! Help me!
M	PAT	You can't tell Nikki about this, Officer.
M	OFFICER KEOGH	Look, I gotta make out a report.
M	PAT	No, no! No!
M	OFFICER KEOGH	She can see it by law.
F	DOLORES	Hey!
M	OFFICER KEOGH	Sit down.
M	PAT	No, no, no, listen, sir.
M	RICKYY	He's chasing me! This guy's chasing me! Help me!
M	OFFICER KEOGH	Sit down!
M	PAT	I'm sorry. I could just write you a letter and you could just let me have five minutes, explaining how much better I'm doing.
M	OFFICER KEOGH	There's a court order against you -- five hundred feet. Listen to me! ...and I'll take that fucking camera and I'm gonna break it over your fuckin' head, then I'm gonna come back and interview you about what it's like to get that fuckin' camera broken over your head! You wa--, what are you laughing about? I'm sorry. I'm sorry.
M	RICKY'S MOTHER ROSALIE	I'm sorry.
M	PAT SR.	Okay.
M	PAT SR. (CONT'D)	Go back to sleep. The party's over. Show's over.
M	PAT	...this is not a reflection of where I'm at. You can't...please, you can't tell her any of this You can't tell Nikki about this.
M	OFFICER KEOGH	You need to pipe down.
M	PAT SR.	Everything all right?
F	DOLORES	Who was at the door?
M	PAT	Who was that, Dad?
M	PAT SR.	It was that kid with the camera.
M	OFFICER KEOGH	Good luck. I gotta write this up.
M	PAT	Come on, don't write it up! I don't want her to see this! PAT SR. It's okay, everything is okay. We're fine, thank you, we appreciate it. Thank you. The family stands together in silence. Hey! What the hell?
F	TIFFANY	What happened to your face?
M	PAT	Weight lifting accident.
F	TIFFANY	That sounds like bullshit. Why'd you run by my house? Did our little conversation get you upset last night?
M	PAT	Hey, this is my route, okay? Just back off.
F	TIFFANY	This is my neighborhood. You just ran by my house.
M	PAT	I like to run by myself, okay?
F	TIFFANY	Me too.
M	PAT	Hey, I like to run alone! Will you stop?
F	TIFFANY	What?
M	PAT	Okay? I'm running here!
F	TIFFANY	Me too!
M	PAT	Well then, why don't you run somewhere else? There's a fucking ton of roads to run in! What are you trying to do?
F	TIFFANY	I like this road. This is my neighborhood. Oh, come on, please!
F	TIFFANY	Calm down, crazy.
M	TIFFANY (CONT'D)	Hey!
M	PAT	What the fuck?! I'm married!
F	TIFFANY	So am I!
M	PAT	What the fuck are you doing? Your husband's dead!
F	TIFFANY	Where is your wife?
M	PAT	You're crazy!
F	TIFFANY	I'm not the one that just got out of that hospital in Baltimore.
M	PAT	I'm not the big slut! I'm sorry. I'm sorry. I'm sorry.
F	TIFFANY	I was a big slut, but I'm not anymore. There's always gonna be a part of me that's sloppy and dirty, but I like that, with all the other parts of myself. Can you say the same about yourself, fucker?! Can you forgive? Are you any good at that?
F	DR. PATEL	You seemed to have trouble last night.
M	PAT	Let me just set the record straight about last night. Hurting my mother was a mistake and I hate myself for it, and I hate my illness and I want to control it. My father, on the other hand, had no trouble slapping the shit out of me last night, which I did not return `cause I could've killed him and I didn't. He's sixty-five years old. You don't think I could've beat the shit out of him? I mean....
F	DR. PATEL	He was scared for your mother and you hurt him as well.
M	PAT	Yes, last night was a mess. Okay? And I think he probably just tried to do his best.
F	DR. PATEL	Pat, you have to have a strategy. I told you earlier. You need to recognize these feelings coming to you, otherwise you will be sent back to Baltimore. So when you get these feelings, you need to get to a quieter place, and be at peace with yourself, however you can.
M	PAT	Yeah, but that's easier said than done.
F	DR. PATEL	You have to do it. You have no choice. Excelsior.
M	PAT	Yeah, Excelsior. Listen, I have a letter I want you to give Nikki, okay?
F	DR. PATEL	No.
M	PAT	Why? Because you have a restraining order. What good are you, man?
F	DR. PATEL	Why did you have this overwhelming urgency to see your wedding video last night?
M	PAT	Oh, I don't know, because I'm married and I haven't seen my wife in eight and a half months?
F	DR. PATEL	Maybe you think that Nikki's not around and Tiffany's an attractive girl and if you get drawn towards Tiffany, you will spoil your chances of getting Nikki back to you?
M	PAT	Not bad, Doctor Jones. But I don't think I'm gonna blow it with Nikki because Tiffany's a slut.
F	DR. PATEL	Why is she a slut?
M	PAT	After the dinner at Ronnie's, she said, quote, "We can go to the back house and you can fuck me as long as we turn the lights out." Unquote. And she still wears her wedding ring. So she's a loyal, married-to-a-dead-guy slut.
F	DR. PATEL	Maybe she just needs a friend and she thought if she offers you sex, it will be easier for you to become friends with her.
M	PAT	She said she's not a whore anymore, but she likes that part of herself along with all the other parts of herself and can I say the same?
F	DR. PATEL	Can you?
M	PAT	Is that....? You're asking me, you're really asking me that question?
F	DR. PATEL	Yes.
M	PAT	With all my crazy sad shit? What, are you fucking nuts?
F	DR. PATEL	Pat, the silver lining thing is yours. I'm just giving back your words to you. This "crazy sad shit," as you call it, made you a happier, calmer person with a beautiful positive philosophy of going outdoors, working out, and reading books.
M	PAT	No, not the books.
F	DR. PATEL	You said Nikki's friends with Ronnie, Veronica and Tiffany. So if you become friends with Tiffany, Nikki will think that you're a kind, generous, large-hearted person, who helps people in need, who is basically thriving. So if you help Tiffany, it will be good for you.
M	CHILD (O.C.)	Trick or treat!
F	TIFFANY	Hey!
M	PAT	How do you know when I run?
F	TIFFANY	I wanted to clarify something. I just want us to be friends. Did you hear what I said? Why are you giving me such a hard time?
M	PAT	No, I'm not giving you a hard time.
F	TIFFANY	I don't know how to act with you when you do this shit. You wanna have dinner at this diner?
F	TIFFANY	Pick me up at seven thirty.
M	PAT	Happy Halloween.
F	TIFFANY	Hi.
M	WAITRESS	Here you go.
F	TIFFANY	Thank you.
M	PAT	I'm gonna have a bowl of your Raisin Bran.
F	TIFFANY	Tea.
M	WAITRESS	Be right back.
M	PAT	You look nice.
F	TIFFANY	Thanks.
M	WAITRESS	Raisin Bran. Milk.
F	TIFFANY	Thank you.
M	PAT	You want to share this?
F	TIFFANY	Why did you order Raisin Bran?
M	PAT	Why did you order tea? Because you ordered Raisin Bran.
M	PAT	I ordered Raisin Bran because I didn't want there to be any mistaking this for a date. It can still be a date if you order Raisin Bran.
M	PAT	It's not a date. So how's your thing going -- your dancing thing?
F	TIFFANY	It's good. How's your restraining order?
M	PAT	I wouldn't actually call the restraining order "my thing," but getting back with Nikki is, and I've been doing pretty well. Except for a minor incident at the doctor's office.
F	TIFFANY	And the so-called incident with the weights.
M	PAT	Yeah. That was a thing with my parents. I wish I could just explain it all in a letter to Nikki because it was minor and I could just explain it and let her know that I'm actually not out of control and that I'm actually doing really well.
F	TIFFANY	I can get a letter to Nikki. I see her sometimes with my sister.
M	PAT	It would be so amazing if you could get a letter to Nikki from me.
F	TIFFANY	I'd have to hide it from Veronica. She's not into breaking the law, which this letter would definitely be doing.
M	PAT	But you would do it?
F	TIFFANY	I'd have to be careful. I'm already on thin ice with my family, you should hear how I lost my job.
M	PAT	How did you lose your job?
F	TIFFANY	By...having sex with everybody in the office.
M	PAT	Everybody?
F	TIFFANY	I was very depressed after Tommy died. It was a lot of people.
M	PAT	We don't have to talk about it.
F	TIFFANY	Thanks.
M	PAT	How many were there?
F	TIFFANY	Eleven.
M	PAT	Wow.
F	TIFFANY	I know.
M	PAT	I'm not gonna talk about it anymore.
F	TIFFANY	Okay.
M	PAT	Can I ask you one more question? Were there any women?
F	TIFFANY	Yes.
M	PAT	Really?
F	TIFFANY	Yes.
M	PAT	What was that like?
F	TIFFANY	Hot.
M	PAT	Jesus Christ. Was it like...older women, a sexy teacher who wants to
F	TIFFANY	Made me sit on her lap and do things? Yeah.
M	PAT	What? You sat on her lap?
F	TIFFANY	Mm-hmm.
M	PAT	She told you what to do?
F	TIFFANY	Mm-hmm.
M	PAT	Oh...my God. Nikki hated when I talked like this. Made me feel like such a pervert. Maybe we should change the subject.
F	TIFFANY	I don't mind it.
M	PAT	You don't, do you.
F	TIFFANY	No. But then people were getting into fights in the parking lot at work, and in the bathroom...and the boss called me in to his office and tried to pin it all on me. So I accused him of harassment and then they fired me, sent me home and put me on some meds.
M	PAT	I get it. The song that was playing when my wife...was in the shower with the history teacher...
F	TIFFANY	I heard about that.
M	PAT	...it was my wedding song and when I hear it, I go kinda crazy. Sometimes I hear it when it's not even playing.
F	TIFFANY	Wow.
M	PAT	Yeah. So they put me on medication, which I feel ashamed of.
F	TIFFANY	Yeah.
M	PAT	So I know.
F	TIFFANY	You do.
M	PAT	I just gotta get a strategy, you know?
F	TIFFANY	Me too.
M	PAT	We'd better get back to the letter.
F	TIFFANY	Yeah, let's get back to the letter.
M	PAT	What if you told Nikki when Veronica was in the bathroom?
F	TIFFANY	Yes. Yes, that could work. I love that.
M	PAT	Oh, my God, I'm gonna go home and write the letter right now.
F	TIFFANY	Can I at least finish my tea?
M	PAT	Wait, what?
F	TIFFANY	My tea. Can I finish it?
M	PAT	Wait a minute. Did Veronica tell Nikki about our dinner? Why would she do that? Was it a test?
F	TIFFANY	I kinda got that feeling, yeah.
M	PAT	Goddamn it. I knew it. It was a test. How did I do? I think I did pretty well.
F	TIFFANY	Yeah, she said you were cool, basically.
M	PAT	"Basically"? Was I some percentage not cool?
F	TIFFANY	No, she said you were cool, but you know.
M	PAT	No, I don't know.
F	TIFFANY	Sort of how you are. It's fine, relax.
M	PAT	What do you mean? How am I? What does that mean?
F	TIFFANY	Sort of like me.
M	PAT	"Sort of like you"? I hope to God she didn't tell Nikki that.
F	TIFFANY	Why?
M	PAT	Because, it's just not right, lumping you and I together, I mean, it's just wrong. And Nikki wouldn't like that. Especially after all the shit you just told me.
F	TIFFANY	You think that I'm crazier than you. Because, well, we're different, I
F	TIFFANY	Oh, my God. Ugh. You're killing me. You know what? Forget I offered to help you. Forget the entire fucking idea. `Cause that must have been fucking crazy because I am so much crazier than you.
M	PAT	Keep your voice down.
F	TIFFANY	I'm just the crazy slut with a dead husband!
M	TIFFANY (CONT'D)	Forget it!
M	PAT	Shut the fuck up.
F	TIFFANY	Fuck you!
M	TIFFANY (CONT'D)	You shut the fuck up!
M	PAT	Tiffany! Hey! Tiffany! DINERS (scattered applause and cheers)
M	WAITRESS	Slow down, Raisin Bran. PEDESTRIANS (low and indistinct chatter - continues under
M	PAT	Hey, come on. Look, I don't think you're crazy, all right?
F	TIFFANY	Yes, you do.
M	PAT	No, I don't.
F	TIFFANY	You told your therapist that you were in a superior mental illness category, didn't you?
M	PAT	What? Hey, calm down! Hey--
F	TIFFANY	Just leave me alone!
M	PAT	Can I just explain myself, please? I didn't want Nikki to think that I was associated with that kind of sexual behavior because I've never done anything like that, okay?
F	TIFFANY	You may not have experienced the shit that I did. But you loved hearing about it, didn't you? You are afraid to be alive, you're afraid to live. You're a hypocrite. You're a conformist. You're a liar. I opened up to you and you judged me. You are an asshole. You are an asshole!
M	TIFFANY (CONT'D)	Get off of me! (yelling) Get off! You're harassing me!
M	PAT	Hey, hey! He's harassing me!
M	PAT	Shut up!
F	TIFFANY	Get off! Take it easy. Dude, relax.
M	PAT	Bro, get off of me. He's harassing me!!
M	PAT	Hey, hey, stop, stop. Stop, all right? Hey, get off of me! Shut up, shut up.
M	PAT (CONT'D)	Stop it. Hey, hey, hey, get off me!
M	OFFICER KEOGH	What are you doing? Come on. What are you doing? What are you doing to these kids?
M	OFFICER KEOGH (CONT'D)	Are you being a punk on Halloween with these kids? You wanna go back to Baltimore? Is that what you wanna do?
M	PAT	I didn't, I didn't, I didn't-- TIFFANY WATCHES IN THE CROWD OF HALLOWEEN TEENS. Softens.
F	TIFFANY	It's the kids! [Walks to Pat and Officer Keogh]. He didn't do anything, it was all the kids. Officer Keogh turns to push the crowd back.
M	OFFICER KEOGH	Let's go, clear out, nothing going on here.
F	TIFFANY	You gonna go your whole life scared of that song? It's just a song. Don't make it a monster. She leans close to Pat's downcast face. There's no song playing. There's no song. Breathe, count backwards from ten. That's it. Pat breathes, listens to her. Calms himself. Song stops.
M	TIFFANY (CONT'D)	That's it. There you go. I'm sorry. I'm sorry.
M	PAT	I'm sorry.
F	TIFFANY	I took it too far.
M	PAT	I'm sorry.
M	OFFICER KEOGH	Hey, is he messing with you?
F	TIFFANY	No, no. No, this was just a joke. This is a joke I started.
M	OFFICER KEOGH	There's a restraining order on this guy.
F	TIFFANY	I know, I have a stupid sense of humor.
M	OFFICER KEOGH	That's not a good thing to do.
F	TIFFANY	Well, I'm fucked up. What can I tell you? I'm sorry.
M	OFFICER KEOGH	You're Tommy's widow, right?
F	TIFFANY	Yes, I'm Tommy's crazy whore widow, minus the whore thing for the most part.
M	OFFICER KEOGH	You're a funny girl. You wanna get a drink sometime? What'd I say?
M	PAT	She doesn't, she doesn't do that anymore.
M	PAT	I'm sorry about what I said in the diner.
F	TIFFANY	I know. I know you didn't mean it.
M	PAT	I didn't mean it at all.
F	TIFFANY	I know, you say shit you don't mean all the time.
M	PAT	All the time.
F	TIFFANY	I'll still give your letter to Nikki, don't worry. TIFFANY WALKS THE DRIVEWAY TOWARD HER GARAGE. Pat watches her
M	PAT	Wow. I really appreciate that, Tiffany. I know you do.
M	PAT	You do? Yeah, sure.
M	PAT	I'll see you tomorrow? With the letter?
M	RANDY	I'll bet I know what happened if only one is missing. Either Dolores or Pat needed an envelope and one of `em took it. That's the only answer.
M	PAT SR.	No, no, no.
M	PAT SR. (CONT'D)	Dolores, somebody was in my study. Who took one of my envelopes? Somebody took an envelope.
F	DOLORES	Maybe we should call the FBI.
M	PAT SR.	Don't make fun. This is serious. What FBI? Come on, let's take a look. I'll show you what this is. I'm gonna just explain to you something. I mean, you know what I'm doing, honey. This everything, like this. I got this, it all corresponds.
M	PAT	Dad, I borrowed one of your envelopes. I hope that's not a No, it's not okay. It's not okay. You gotta ask.
F	DOLORES	"Do not go in my study or I will eat you!"
M	PAT SR.	It's not funny, it's not funny. What's everybody making a joke out of this for?
M	RANDY	Dolores, you are so beautiful! Stop that! Hey, hey, hey, stop, stop, stop! Listen, a lot of envelopes go in and out of my office every day after games with a lot of cash in `em. So show some respect for what I do.
M	PAT	Yeah, I know. I saw two-seven-four. I just wanted to tell you the number.
M	PAT SR.	Thank you.
M	PAT	But the envelope was empty. I'm sorry, you were sleeping. I didn't want to wake you, but I needed an envelope.
M	PAT SR.	You didn't want to wake me? (to Dolores and Randy) He didn't want to wake me. He doesn't have a problem complaining about Ernest fucking Hemingway. He doesn't have a problem asking for his wedding
F	DOLORES	Be nice. It's game day! I'm makin' crabby snacks and homemades.
M	PAT	Yeah, come on, Dad, be nice. Come on, she's making crabby snacks and homemades. Come on, Dad!
M	PAT SR.	What are you so up about?
F	DOLORES	He's very happy.
M	PAT	I'm happy.
M	PAT SR.	No, you're so up, up, up, up.
M	PAT	Isn't that a good thing?
M	PAT SR.	You're just up, up, up. I don't know what that is. Are you taking the proper dosage of your medication?
M	PAT	Am I taking the right dose? Of course I am.
M	PAT SR.	Okay. Taking a little bit too many or something?
M	PAT	No, if I was taking that, I'd be on the floor, Dad.
M	PAT SR.	Just stay with us. Stay for the game. Spend some family time.
M	PAT	Dad, I can't. Look, I'm ready to go.
M	PAT SR.	Spend family time.
M	PAT	Wait, you mean OCD, superstitious time?
M	RANDY	Come on, your dad needs a winner. Help him out.
M	PAT SR.	Come on.
M	PAT	I can't.
M	PAT SR.	It's the Seahawks. Put on the jersey and stay, please. Please. It's important, please.
F	DOLORES	What are you up to, Pat?
M	PAT	Nothing, come on. What's in the envelope?
M	PAT SR.	Yeah, what are you doing? What's in that envelope?
M	PAT	Guys, I'm beating the song! I'm on the scoreboard! I'm playing down field! I feel great!
M	PAT	Tiffany!
