M	CHARACTER	DIALOGUE
M	MAN (O.S.)	No... please... There's no way...
M	MAN (O.S.) (CONT'D)	Nothing... can defeat... A SHADOW FALLS across the sand. Then a second. One looks
M	MAN (O.S.) (CONT'D)	Gojira.
M	MAN (O.S.) (CONT'D)	Ooooh, Gojira! You the best! Me love you long time!
M	SECOND MAN (O.S.)	C'mon Jensen, you in or not?
M	JENSEN	And get cheated again?
M	POOCH	The Pooch don't cheat. The Pooch may lie, the Pooch may steal--
M	JENSEN	--the Pooch may refer to himself in the third person--
M	POOCH	--but the Pooch will not cheat.
M	JENSEN	The Pooch can rest easy, I was referring to Cougar. It's Liar's Poker, Jensen, how in the hell is the man gonna cheat you at Liar's Poker?
M	ROQUE	Cards. The four take them. Lick the back, slap them to their
M	JENSEN	Got a feeling about this one, Roque.
M	ROQUE	Your mama had that feeling too.
M	ROQUE (CONT'D)	Raise you.
M	POOCH	That the one with the hollow points?
M	ROQUE	Yup.
M	POOCH	Oh, shit, I'm definitely in then. JENSEN This even me up?
M	ROQUE	Exactly how many knives do you have, anyway?
M	POOCH	Cougar - your bet.
M	VOICE (O.S.)	Hey, losers!
M	WHIP PAN to	Clay. Mid-30's. Their leader, and you gotta be a bad-
M	CLAY	It's time...
M	CLAY	Authenticate and backtrace.
M	POOCH	Send us out to the middle of nowhere to "wait for instructions"...
M	JENSEN	We're good, this baby came out of the Kandahar Spook Station, controller's codename is Max. ROQUE This is an Agency gig? We don't get to pick what needs to be done. Quaeda-wannabe name of Fadhil is running a terrorist assembly line out around the Khyber Pass--
M	JENSEN	I'm shocked. Shocked, I say.
M	CLAY	We find it, we paint it for a laser targeted bomb. No muss, no fuss.
M	ROQUE	For that we had to put on a blindfold and turn around three times?
M	POOCH	You'd rather take on fifty mujas with AK's?
M	ROQUE	I got eyes on Fadhil.
M	CLAY	Paint it.
M	POOCH	Call me Michelangelo.
M	JENSEN	Dropkick, this is Pinball, confirmed eyes on, target is designated.
M	RADIO VOICE (O.S.)	Roger, target acquired, exfil chopper is enroute. ETA to fireworks is eight minutes.
M	JENSEN	Roger, we'll break out the earplugs. So who wants to get a game? We got eight minutes-
M	COUGAR	Boss?
M	CLAY	Call it in.
M	JENSEN	Dropkick, children are at target site, repeat, we have eyes on children at target site - advise.
M	RADIO VOICE (O.S.)	Hold the line... Acknowledged, maintain position.
M	ROQUE	Maintain position? Colonel-
M	JENSEN	Dropkick, we strongly recommend cancellation of payload delivery-
M	RADIO VOICE (O.S.)	Abort order can only come from MISSION CONTROLLER-
M	CLAY	Mission Controller is Agency, Codename Max, repeat, Codename Max, so get him on the horn and-
M	RADIO VOICE (O.S.)	Already have, Pinball, your orders stand. Prep for exfil.
M	CLAY	Cougar? Dropkick, this is Pinball, targeting equipment has suffered system failure, am calling an abort.
M	MAX (O.S.)	Well, that was stupid.
M	CLAY	Who is this? This is a secure MILITARY NETWORK-- Very stupid, Colonel... Franklin... Clay.
M	CLAY	Max? There are children on site-
M	MAX (O.S.)	And you think I didn't know that? Not the sharpest of knives in the drawer, are you? We locked coordinates the moment you painted; delivery will occur on schedule. Max out.
M	CLAY	Shit! Jensen, call the General at the Firebase, get him to abort-
M	JENSEN	Can't, they're jamming us-
M	ROQUE	Then contact the plane directly-
M	JENSEN	Negative, we're screwed! There's nothing we can do...
M	CLAY	There's something we can do.
M	ROQUE	Five against a fortress, and we've got maybe six minutes before an airstrike sets the world on fire.
M	CLAY	So?
M	ROQUE	So, I'll drive.
M	POOCH	I guess we're going with the fifty mujas with AK's option after all!
M	CLAY	Pooch and Jensen, get a truck for the kids, the rest of us will be out in five-
M	ROQUE	-airstrike's in four and change-
M	CLAY	-out in four. On me!
M	CLAY	Get 'em out.
M	SOMETHING HORRIFIC	...shooooot meeee...
M	CLAY	You're American?
M	SOMETHING HORRIFIC	...Max sent you...
M	CLAY	How do you know that name? SOMETHING HORRIFIC ...was IA Field Ops hunting rogue agents... Max caught me...
M	CLAY	Max is rogue?
M	SOMETHING HORRIFIC	You're off-mission aren't you?
M	SOMETHING HORRIFIC (CONT'D)	What's the mission? CLAY Fadhil.
M	SOMETHING HORRIFIC	Max doesn't care about Fadhil... He's cleaning up the mess. You're his mop. I'm the mission.... Kill me...
M	CLAY	I can get you out-
M	SOMETHING HORRIFIC	Already dead... Kill ME-
M	SOMETHING HORRIFIC (CONT'D)	Thaaaank...
M	COUGAR	Mercy.
M	COUGAR (CONT'D)	Run.
M	POOCH	Jesus, you stop for coffee in there?
M	ROQUE	What kind of blast radius we looking at? Jensen, calculating on the computer tablet. Shows an
M	ROQUE (CONT'D)	DRIVE. MUCH. FASTER.
M	JENSEN	I think we're in the clear-
M	POOCH	Uh, Coug?
M	JENSEN	Yeah, that was great, wasn't it? My favorite part was when we were completely on fire. What was yours?
M	POOCH	Exfil incoming. How are we gonna explain the kids, Colonel?
M	POOCH (CONT'D)	Colonel? The kids. What do we tell 'em?
M	CLAY	Lieutenant, you're to evac these civvies to the Firebase immediately-
M	BLACKHAWK PILOT	Negative, our orders are to transport a five-man team only.
M	CLAY	You really want to leave twenty three kids in the desert to die?
M	BLACKHAWK PILOT	Not enough room for them and you...
M	CLAY	Then it's them. Clay nods. A beat. The Pilot pulls the stick back and
M	POOCH	Cute little buggers. Hope they can make it to our court-martial.
M	ROQUE	Relax, Pooch, we're not going to be court-martialed - if anything, we're going to die of thirst wandering the desert, right Colonel?
M	CLAY	Jensen, see if you can cut into that Blackhawk's chatter--I want to know if he rats us out.
M	POOCH	So, how we getting back? Hitchhike? Magic carpet? I say magic carpet...
M	ROQUE	Guess they hustled up some air support after all - that's a Pakistani MiG up there...
M	JENSEN	Guys... This is bad...
M	MIG PILOT (O.S.)	Max, Cobra One. Bandit locked, twelve o'clock low... Their eyes go wide with understanding....
M	MAX (O.S.)	Understood, Cobra One. Kill Bandit. Fox One.
M	POOCH	Auto-rotate, go with it, you can still put her down if you-
M	MAX (O.S.)	And again.
M	CLAY	NO!
M	MIG PILOT (O.S.)	...Fox Two. The SECOND MISSILE from the MiG SLAMS INTO THE BLACKHAWK FENNEL What are you talking about "MAX?"
M	CLAY	He set up the Operation-
M	FENNEL	There was no operation! You were never radioed orders!
M	CLAY	I talked to him!
M	FENNEL	You kill a friendly Afghan warlord, probably lose us the support of half the tribes in the region, and your alibi is "MAX?" Wait - are you saying you're Max?
M	CLAY	What?
M	FENNEL	Colonel, Max is an Agency code for a rogue agent or operation-
M	CLAY	What are you talking-
M	LARGE MAN (O.S.)	There is no specific Max.
M	WADE	"Max" is catch-all for exactly what you've been accused of. Terminology's been around since the 50's.
M	CLAY	We didn't kill those kids, Wade. Wade studies him. Finally:
M	WADE	I believe you.
M	FENNEL	Stay here. We'll be back.
M	POOCH	Wade left his suitcase.
M	ROQUE	Ah, shit...
M	CLAY	Jensen?
M	JENSEN	I'm not good with bombs, man-
M	CLAY	I don't care--Roque, Pooch, get those bars off!
M	JENSEN	Oh, shit. Oh, shit...
M	CLAY	Time?
M	JENSEN	It's a remote detonator--enough for them to get clear, maybe ten MORE SECONDS-
M	CLAY	CAN YOU-
M	JENSEN	I told you, I'm not good with bombs! How are those bars coming?
M	POOCH	Hurry...
M	ROQUE	Shut up.
M	POOCH	Hurry...
M	ROQUE	Shut up...
M	ROQUE	You lost again.
M	CLAY	We lost again.
M	ROQUE	You placed the bet.
M	CLAY	You gave me the money.
M	ROQUE	Well, that was stupid of me, wasn't it?
M	ROQUE (CONT'D)	That makes, what, three in a row?
M	CLAY	Four. ROQUE You know where you're messing up? You're putting all our money on the dogs with the best odds.
M	CLAY	Yeah, I've just gone crazy with that approach.
M	ROQUE	Never play a longshot, you're never gonna win. We're at a dogtrack at 10 a.m. - could this get any more sleazy?
M	CLAY	Maybe if we were drinking.
M	ROQUE	You're not drinking?
M	CLAY	We'll stay two more days, try to get some of the cash back.
M	ROQUE	Then what?
M	CLAY	Miami. Jai-Alai.
M	ROQUE	I can't take much more of this.
M	CLAY	We're on the run. It occasionally INVOLVES RUNNING-
M	ROQUE	I'm serious. Grinding out lunch money on five dollar sports bets, wincing everytime some overly Aqua- netted cow stares at my face for more than two seconds- I'm at the point where I'm thinking we ought to try to reach out to the Company...
M	CLAY	All we did was say the word "Max" and they blew up a building. CIA even gets a whiff of where we're at, they'll call in an airstrike. Until we figure out how we can take Max down and get clear, we lay low.
M	ROQUE	Due respect, you're nobody's Colonel anymore.
M	CLAY	Anytime you want to move along you go right ahead-
M	ROQUE	Like the others? Least I still talk to them. You pushed them away. "Max this, Max that" - we never even saw the guy, Clay-
M	CLAY	We heard his voice. Guy with a voice is a guy with a throat. And if he's got a throat...
M	ROQUE	We're hiding out in the parking lot of a goddamn McDonald's--You actually think we're in any position to take on some shadowy CIA super- spook? ROQUE-
M	ROQUE	No, it's a stellar plan - we can use this as our base of ops! Pooch can run the motor pool out of the ball pit and Jensen can set up communications by the slide!
M	CLAY	Go. Roque FIRES UP THE ENGINE as the COPS get out of the
M	ROQUE	I was there too. I remember. But he won. We lost. Maybe it's time for a new game.
M	PARTICULARLY OFFENSIVE GUY	Yabba Dabba Doo...
F	AISHA	Men.
M	AISHA (CONT'D)	How's the steak?
M	CLAY	Meaty.
M	CLAY (CONT'D)	Want a bite?
F	AISHA	I don't eat red meat.
M	CLAY	Why not?
F	AISHA	Slows me down.
M	CLAY	Okay.
F	AISHA	You got nice arms.
M	CLAY	I know you?
F	AISHA	Relax, slugger... I like arms. That's all.
M	CLAY	Do I not look relaxed?
F	AISHA	No. Think we can change that?
F	AISHA	Wow, it's everything a girl could dream of. Got a bathroom?
M	CLAY	No, I specifically requested the only hotel room in the world that doesn't have a bathroom. AISHA You lookin' to turn a "yes" into a "no" here?
F	AISHA	So what brings you to Florida?
M	CLAY	Convention. Convention for what?
M	CLAY	...Air conditioners.
F	AISHA	They have whole conventions devoted to air conditioners?
M	CLAY	You'd be surprised.
F	AISHA	Bet I would. Where were we?
M	CLAY	You were about to tell me how much you enjoy spending time at the dog track... Aisha smiles, tracing her fingers down his stomach...
F	AISHA	Saw me there did you?
M	CLAY	Uh-huh...
F	AISHA	Didn't see me at the McDonald's though... I have a proposition for you...
M	AISHA (CONT'D)	Just hear me out. I don't want to hurt you.
M	CLAY	You're not going to.
F	AISHA	Yes, I am.
M	AISHA (CONT'D)	Room's on fire.
M	CLAY	Noticed. What do you want?
F	AISHA	Your life. Back.
M	CLAY	You want to clarify that?
F	AISHA	Max. I can help you.
M	CLAY	I'm listening.
M	CLAY	How'd you find me?
F	AISHA	It's not too tough if you know where to look. You guys aren't exactly subtle.
M	CLAY	How'd you know I was alive?
F	AISHA	Counted the number of teeth found in the safehouse debris in Karachi. Not nearly enough for five men.
M	CLAY	Who else knows?
F	AISHA	That you're alive? Just me. CLAY So what's to stop me from putting a bullet in your head?
F	AISHA	You want Max and I can tell you how to get him.
M	CLAY	Max is up to something big, isn't he? Agency wouldn't have sent you otherwise.
F	AISHA	Nice try, but I'm working alone here. If I wasn't, I wouldn't need your help. Ready for the important part?
M	AISHA (CONT'D)	There is a plane.
M	CLAY	Okay.
F	AISHA	This plane contains a truck. CLAY Okay.
F	AISHA	This truck contains a cargo.
M	CLAY	Right.
F	AISHA	This cargo is very important.
M	CLAY	Is this a riddle?
F	AISHA	This cargo belongs to Max. You steal the cargo, Max comes looking for it, you grab Max.
M	CLAY	What a brilliant plan, and oh, so simple too. What's the cargo? Right. So you want me to steal some super secret cargo known only to you and the bad guy, and I'm supposed to do this because you know the name Max and look good in a pair of jeans? Sorry, sister.
F	AISHA	Hey! You really think I look good in these jeans?
M	CLAY	Bye...
F	AISHA	Cargo's heroin. Max uses it to fund his off the books ops. And it comes straight from the poppy fields of the late Jamal al-Fadhil. Oh... does that name mean something to you?
M	AISHA (CONT'D)	He used you to kill Fadhil and take over his operation, that's right. What did you think you were doing there in the first place? Fighting for truth and justice?
M	CLAY	How do I know I can trust you?
F	AISHA	Check my background. I'm an ex- Company hitter. First job was a junior field officer in Shanghai. You can Google it under Shanghai Hilton Decapitation.
M	CLAY	I mostly Google porn. Then?
F	AISHA	Two Chinese and an Italian arms dealer in Bangkok. With my hands.
M	CLAY	Show-off. Then?
F	AISHA	Then I stopped auditioning for you. This is a check for ten grand-
M	CLAY	We're not mercenaries.
F	AISHA	Operational capital, that's all. You've been waiting three years for a shot at this guy. You're not gonna get another. You want Max, this is it. He takes it. She hands him some papers along with it.
M	AISHA (CONT'D)	Intel on the shipment. You check it out, you check me out, you decide - are you in or not?
M	SHORT SCIENTIST	You know we cannot do this... We cannot do what you ask...
M	MAX	Tell me - is this a moral issue or a financial issue?
M	FAT SCIENTIST	A moral issue.
M	MAX	Really? You object morally to this deal?
M	FAT SCIENTIST	Yes. I'm sorry. Please leave... Okay, here's what I'm hearing. I'm hearing "No." I'm hearing "Leave," and I'm hearing "I'm sorry." Is that what I'm hearing?
M	FAT SCIENTIST	Please... you must leave...
M	MAX	Right. Okay, so that is what I'm hearing. Now, I want you to listen. Listen carefully because I want you to hear this. Wade?
M	MAX (CONT'D)	What the hell was that?
M	WADE	You gave me the nod.
M	MAX	A "hit him in the face" nod, not a "throw him out the window" nod.
M	WADE	I thought that's what you wanted.
M	MAX	At most--at most that was a "break his fingers" nod. I mean Jesus, Wade, the man was scientific genius. Granted his weight signaled that he had certain impulse control issues, but that's no reason to throw his fat ass out a fifty story window.
M	WADE	Sorry... MAX I think I speak for everyone here when I say that your actions were excessive and, yes, more than just a little wasteful...
M	MAX (CONT'D)	...then again, it seemed to have had the desired effect - toss Short Round out next.
M	SHORT SCIENTIST	Wait!
M	SHORT SCIENTIST (CONT'D)	We have a different moral perspective than our late colleague.
M	MAX	The hell you say. I need one to test and one to use.
M	SHORT SCIENTEST	One to test?
M	MAX	Of course one to test - you think I trust you?
M	SHORT SCIENTIST	We will need much money.
M	MAX	You will have much money.
M	MAX	Call our people at Goliath, tell them we'll have a special package arriving on the 17th.
M	ROQUE (O.S.)	So this is what your girl came up with, huh?
M	CLAY	Better than a ball pit...
M	ROQUE	You sure you're thinking clear on this? I know you. When you slip, it's always cause of a woman.
M	CLAY	Name one time that- ROQUE Carla.
M	CLAY	Carla wasn't the problem, Carla's husband was the problem-
M	ROQUE	Carla's husband wasn't the one who SHOT YOU-
M	CLAY	Okay. Yes. She shot me. But only in the leg.
M	ROQUE	What about Emma?
M	CLAY	Emma doesn't count, we never slept together.
M	ROQUE	Because she put a bomb in your car.
M	CLAY	I admit, that took some of the romance out of the relationship.
M	ROQUE	And now this chick, first time you meet her, burns down our hotel. Also, she kills people for a living. These are not good signs...
M	CLAY	I'm clear, Roque.
M	ROQUE	You better be. Or we're done.
M	POOCH	Damn. We missed you too.
M	POOCH (CONT'D)	So what's this I hear about Clay gettin' us killed over a girl?
M	AISHA (O.S.)	Been a long time since anyone called me a girl.
M	POOCH	Jesus, Lady! Ten outta ten for stealth and shit, but next time could you just knock?
M	ROQUE	How long you been back there?
F	AISHA	Long enough. She put a bomb in your car?
M	CLAY	She was volatile. Aisha, meet Pooch, Roque, and Cougar.
F	AISHA	Really? You can't hang out with anyone just named "Phil"?
M	JENSEN	Hail, hail, the gang's all here! Colonel. Roque. Pooch. Silent Bob. Hottie. I'm gonna need a moment alone with the boys if you don't mind, but I'd like to reserve the right to awkwardly hit on you later?
F	AISHA	I'd expect no less. Have fun...
M	CLAY	What do you have on her?
M	JENSEN	Besides a pants-busting crush? Her intel checks out. The cargo will be arriving here in two days.
M	ROQUE	Wow, I completely trust her now.
M	CLAY	What else?
M	JENSEN	Grew up in Afghanistan, Mom was a local, Dad was white devil... oh, and CIA's got a kill order out on her. As does Hamas, Sien Fein, MOSAAD-- pretty much everyone with the exception of PETA wants this chick amscrayed.
M	POOCH	Why?
M	JENSEN	Last CIA email flagged with her name says she was digging for information about a special project... "Codename: MAX". A moment as this sinks in.
M	POOCH	They want to wet her cause she's lookin' into Max. That sounds familiar...
M	ROQUE	Could those files-
M	JENSEN	-have been planted for us to find? CIA timestamp, digital watermark... Someone would've had to go to a lot of trouble, and I mean a lot, to fool me.
M	CLAY	I say we go with her. Pooch?
M	POOCH	I'm in.
M	CLAY	Jensen?
M	JENSEN	Hell yeah. Cougs?
M	ROQUE	For now.
M	JENSEN	Hot damn! Back with the Colonel, doing another bid for God and COUNTRY-
M	ROQUE	Country turned her back on us, and God can screw. This one's for us.
M	CLAY	And anyone who calls me "Colonel" better be ready to take a beating or an order. We ain't soldiers anymore.
M	POOCH	So what's the plan, my civilian brothers?
M	CLAY	Sleep. We start tomorrow.
M	JENSEN	Start where?
M	CLAY	We're going bird hunting.
M	MAX (V.O.)	It used to be so simple. A post 9/11 world...
M	MAX (V.O.) (CONT'D)	As a country we spoke with one voice, moved with one purpose. We had a wicked boner for doing the right thing, and now look at us!
M	MAX	90 percent of the globe is tooling up to whack us and we're too busy losing our nerve to notice. It's Us versus Them and right now my money would be on them...
M	MAX (V.O.) (CONT'D)	Wasn't it Thomas Jefferson who once said the tree of freedom must be watered with etcetera, etcetera? We need to wake people up, Wade. We need to hit them in the face, angry up the blood, give them their balls back. We TRACK WITH our lead monkey up to something very un- We need to give them a ten megaton reality check. Boom Boom Boom Boom...
M	MAX (CONT'D)	I think it's safe to say it works!
M	MAX (CONT'D)	Jeez, talk about hard to impress...
M	WADE	The Company's with you on this?
M	MAX	Kinda... Sorta...
M	MAX (CONT'D)	You know the drill, they don't like to know how the sausages get made. What do you care? WADE I don't. Just want to make sure everyone gets paid.
M	MAX	The money's coming from our Afghanistan operation. And what the Company doesn't know won't hurt them.
M	WADE	Unless they're within the blast radius.
M	MAX	We're gonna saving our country, Wade. The United States of America will benefit greatly from what we're doing.
M	WADE	I was born in Quebec.
M	MAX	Jesus, fine - we're saving North America, does that make you happy? Just get it done.
M	RADIO TRANSMISSION (V.O.)	Base One, this is Cavalier 415. Sector eight perimeter clear, proceeding to sector nine...
M	JENSEN	Roger that Cav 415, we have a report of a civilian vehicle breakdown on U.S. 70, sector nine, grid four. Please assist as required.
M	DRIVER	Army of one, my ass. Goddamn Triple A service... Need a hand, buddy?
M	POOCH	Appreciate it.
M	SOLDIER 1	AAOW! Something just bit me!
M	SOLDIER 1 (CONT'D)	Is this...?
M	CLAY	Go.
M	CLAY (CONT'D)	Make the call.
M	JENSEN	Base One, this is Cavalier 415! We have been in a collision with a civilian vehicle! Carvey's dead an' Freeman's hurt bad! He's messed up his neck! He can't move! Oh god, it's horrible! We need medevac immediate! HE'S GOT KIDS, BASE ONE, HE'S GOT KIDS!
M	BASE ONE (O.S.)	Roger, Cavalier 415! We're scrambling a chopper, hang in there! Jensen, all smiles, looks up at Clay.
M	JENSEN	Robert De Niro who?
M	POOCH	Sleeping like babies.
M	ROQUE	What about their ride?
M	CLAY	Flip it. TIGHT SHOTS of the air ram attached to the undercarriage
M	POOCH	What do you think's up with that "don't call me Colonel" stuff?
M	JENSEN	Classic loss of identity. Clay defined himself by his place in the military structure. It was his way of measuring the good he did in the world. Without it, he's just another loser like the rest of us. You know there's a website where you can download MP3's of donkeys farting? How cool is that?
M	BASE ONE (O.S.)	Cavalier 415 this is Medevac Delta. Be advised, we are airborne and in- bound to your position!
M	CLAY	All right, everyone get into character...
M	JENSEN	Lot of work to bum a ride.
M	ROQUE	Shut up, Jensen.
M	JENSEN	You shut up, Roque. You're dead, I'm the spinal injury - Spinal injury can talk, dead can't.
M	ROQUE	Stop talking or I'll break your neck for real.
M	JENSEN	Seriously, you have to get more into your role! Dead guy! No talking! Dead guy!
M	CLAY	Here we go...
M	PILOT	Base One, this is Medevac Delta. We have visual on Cavalier 415.
M	EMT	Alright buddy, we're gonna get you patched up in no time...
M	JENSEN	Y-you ever treat anyone who'd been gut shot...
M	EMT	Sure, in Iraq. What a mess...
M	JENSEN	Means you know what's coming to you if try to play hero. Now, lose the radio mic, Bones.
M	PILOT ONE	What are they jawing about out there? We're burning fuel--
M	POOCH	You heard of car-jacked? You've just been chopper-jacked, my man.
M	PILOT ONE	You're robbing the US Army?
M	POOCH	When he says it out loud, it does sound kinda ridiculous...
M	CLAY	Where's my wild goose?
M	JENSEN	We're all set here. Ready to take a giant step for... well, for guys who steal stuff, I guess.
M	CLAY	Hit it.
M	JENSEN	Beautiful. Let 'em chase that. Medevac Delta, this is Base One. What's your situation, over?
M	POOCH	Time to move.
M	DRUGGED SOLDIER	...Well, shit.
M	POOCH	...no, what you want is a gas turbine generator running a force- fed rectifier unit, hook it up to the fuel tank...
M	JENSEN	So, you grew up in the Hindu Kush, huh? That must've been rough.
F	AISHA	Uh-huh...
M	JENSEN	Got any hobbies?
F	AISHA	When I was a girl, I collected human ears. I had over three dozen pairs when a feral dog came into our camp one night and took them. The dog was good eating, though. A beat.
M	JENSEN	I'm gonna go somewhere else now.
F	AISHA	Are small arms gonna be a problem?
M	POOCH	It's taken care of - we lined the hull with half inch steel plate.
M	ROQUE	Which brings us to our next question...
M	ROQUE (CONT'D)	What's your angle in this?
M	CLAY	Roque...
F	AISHA	I'm giving you a chance to get even. That's all you need to know.
M	ROQUE	I'm gonna shoot her, Clay.
M	CLAY	No, you're not.
M	ROQUE	Yes, I am.
M	CLAY	No.
M	ROQUE	Right now.
M	CLAY	See?
M	ROQUE	She's coming with us. And if anything feels like a set-up, I put a bullet in her skull. Sound fair?
F	AISHA	Oh, completely. Now, if you'll excuse me, it's time for prayers.
M	ROQUE	You're Muslim?
F	AISHA	You know, you are a sharp one--and don't let any of these other boys tell you different.
M	ROQUE	I don't like this.
M	CLAY	I picked up on that.
M	POOCH	I'm with Roque, man. Agency thinks we're dead. We show up alive and kickin', start waving our dicks around in public, they're gonna make it their business to bury us. They'll call us terrorists, all KINDSA SHIT-
M	CLAY	What do you think we are now? Best case scenario, this gets us face to face with Max- ROQUE What if it doesn't? What if we never get face to face with him. Are you gonna be able to live with that? Ever?
M	POOCH	Hell, let's just say it out loud... We do this, we're declaring war on the Central Intelligence Agency.
M	COUGAR	They started it.
M	FENNEL	As of this moment, the truck is designated an extraterritorial zone of immunity. Under no circumstances whatsoever are you or your men to allow the package to leave the truck before it's secure in the compound - to do so would be considered an act of treason and punishable as such.
M	LIDDY	Understood and acknowledged, sir. As the package is loaded into the MONSTER ARMORED RIG...
M	WADE	Ten men ride with the package and another ten ride chase.
M	WADE (CONT'D)	Let's go.
M	CLAY	Are we wired?
M	JENSEN	Like Belushi. Target is westbound. Heading for the bridge...
M	CLAY (O.S.)	Take em'.
M	SWAT DRIVER	Shit, I'm losing it!
M	WADE	Form a defensive perimeter around the truck!
M	FENNEL	They're out of their minds, there's no way off this bridge...
M	WADE	Masks on! Secure the package!
M	SWAT GUY	Where are they? I can't see them-
M	FENNEL	Code RED! We are under attack! Need Chopper Support right now!
M	CONTROL (V.O.)	Acknowledged, EVAC is enroute!
M	WADE	Cavalry's here!
M	WADE (CONT'D)	Move! Point cover! Go, go!
M	CHOPPER PILOT (V.O.)	This is Chopper Support--we are inbound your position, ETA five minutes! Hang in there! As a HORRIFIED LOOK OF REALIZATION crosses Wade's face
M	FENNEL	What the hell? It's welded shut!
M	SWAT GUY	The windows too! We're sealed in! We hear the FAINT YELLING of Fennel and the Swat Guys in
M	FENNEL	We're down, okay! You go the second the ramp lowers! Hit them hard, three round bursts, center mass!
F	AISHA	Open the valve.
M	FENNEL	These guys are about to get the surprise of their lives... What the hell they trying to do, drown us?
M	SOLDIER 1	Sir, that smell! It's- gasoline!
M	FENNEL	Eat the ground, or they blow your head off!
M	CLAY	I don't think so.
M	FENNEL	First and only warning, Clay!
M	CLAY	Gasoline. Muzzle flash. Think about it. AS THAT SINKS IN -- Fennel looks like his puppy just died.
M	CLAY (CONT'D)	Things'll kill you.
M	CLAY (CONT'D)	Good boys. Now, let's see what kind of cargo you got in there.
M	FENNEL	Clay, no bullshit - you open that box and we all die. Clay steps up to him. Near nose to nose.
M	CLAY	I'm already dead, remember?
M	Clay turns back to	
