M	CHARACTER	DIALOGUE
M	LEVIN	Good girl . . . good girl, Pava.
M	KITCHEN MAID	Agafia Mishaylovna says dinner's like to spoil.
M	LEVIN	. . . her father's colour.
M	VASILI	Worth coming home for, Konstantin Dmitrich!
M	LEVIN	I stayed too long in Moscow.
M	LEVIN	. . . She's a beauty. That's twelve cows sired by Berkut!
M	AGAFIA	So one of you is doing what the good Lord made you for. PRINCE OBLONSKY'S HOUSE, MOSCOW HOUSE, SAME TIME-- DAY Prince Stepan Oblonsky-- Stiva to his friends--is 34 and liked by every-
M	MATVEY	What should I do with this?
M	OBLONSKY	Where did you find it?
M	MATVEY	In your hat. Your Excellency.
M	OBLONSKY	Yes . . . I picked it up somewhere for Daria Alexandrovna and the children. TIME--DAY Dolly picks up the youngest, Vasya, to kiss him and hands him to the
F	DOLLY	Bonjour, Lili; bonjour, Masha; bonjour, Grisha; bonjour, Tanya. DAY TIME--DAY OBLONSKY My Tanruchoshka! Mind my cigar.
M	OBLONSKY (CONT'D)	Be good today. I'm off.
M	mlle. roland	Read the chapter carefully. I'll come back to test you on it . . . Read it twice. 400 MILES NORTH OF MOSCOW TIME--DAY FLASH BACK-- SHORT
F	ANNA	Tsk, oh . . . Stiva!
F	ANNA	. . . and Dolly found a note from the governess. KARENIN Well . . . ?
F	ANNA	Stiva wants me to come to Moscow . . . to persuade Dolly to forgive him.
M	KARENIN	I'm to be deprived of my wife so that adul- tery may be forgiven? I can't excuse him just because he's your brother.
F	ANNA	It's for Dolly's sake too.
M	KARENIN	I have four committees today . . .
M	KARENIN (CONT'D)	Good, good!--I have the world waiting for me, there's never time to look at your exercises! LUKICH Sergei Alexeyich is doing very well, Your Excellency.
F	ANNA	Tsk-tsk, who put this shirt on you? Never mind. I'll come and hear you read.
M	KARENIN	Tomorrow, perhaps. Thank you, Lukich-- perhaps tomorrow.
F	ANNA	Alexei, do you think nine years of mar- riage and children should count for nothing against a . . . an infatuation?
M	KARENIN	No. Very well. But sin has a price, you may be sure of that. HOUSE--DAY OBLONSKY Dolly . . . please think of the children . . .
F	DOLLY	You think of the children! Their lives are ruined now! TIME--DAY
M	OBLONSKY	Oh, Dolly . . . I beg you . . .
M	MATVEY	Telegram. Should I send up the barber?
M	OBLONSKY	No, just the razor. MATVEY Don't worry, sir, things will shape them- selves, you'll see.
M	OBLONSKY	My sister Anna's coming tomorrow. We're saved.
M	DOORKEEPER	Some man came without an appointment, Your Excellency . . . waiting outside.
M	OBLONSKY	Levin! Where did you disappear?
M	LEVIN	I'm very anxious to see you. I need your advice. OBLONSKY Well, then, come into my room.
M	OBLONSKY (CONT'D)	This is my oldest friend, Konstantin Dmit- rich Levin! Someone send word I'll be a few minutes late.
M	OBLONSKY	I've been hard at it. Sit down.
M	LEVIN	Hard at what exactly?
M	OBLONSKY	Why, we're overwhelmed with work!
M	LEVIN	Oh--paperwork.
M	OBLONSKY	Paperwork is the soul of Russia. Farming is only the stomach. When am I going to come and shoot some snipe? Oh, but look at you, in Western clothes you told me you'd never wear again. Some- thing's up.
M	LEVIN	Yes. I'm in love. I've come back to propose. Have you guessed who she is?
M	OBLONSKY	I have a suspicion. Why didn't you propose when you were here?
M	LEVIN	I decided it was impossible. Kitty is of the heavens, an angel, and I am of the earth-- but then I thought and thought, and . . . there's no life for me without her! . . . Do I have a chance?
M	OBLONSKY	Of course you do. The Shcherbatskys are giving a soiree this evening. Get there early before the crowd. If I may suggest . . .
M	LEVIN	Anything! What?
M	OBLONSKY	New boots.
M	LEVIN	Right. Anything else? OBLONSKY We'd better have dinner together.
M	OBLONSKY	No--five-thirty at l'Angleterre--I owe them more than the Hermitage, so it wouldn't be fair to withdraw my custom. Boots, and a coat. And a proper hat. NIGHT
M	OBLONSKY	It's so unfair. You marry for love, you're a good husband. Children arrive. Years depart. And all of a sudden your wife is tired, her hair is thin, her body . . . while you yourself still have your . . . vigour . . . and you find yourself distracted by a pretty woman . . .
M	LEVIN	Forgive me, but I find that incomprehen- sible . . . As though I'd leave this restaurant and steal a roll from a baker's shop.
M	OBLONSKY	Well, you know, a freshly baked roll . . .
M	LEVIN	But I'm talking about love, and you're talk- ing about . . . your appetite.
M	OBLONSKY	Easily confused. Now look, do you know Count Vronsky?
M	LEVIN	Who? No. Why? OBLONSKY He's your rival. He turned up from St. Petersburg after you left.
M	LEVIN	Who is he?
M	OBLONSKY	You don't have to worry about him. He's one of those rich, good-looking cavalry offi- cers who've got nothing to do but make love to pretty women . . .
M	OBLONSKY (CONT'D)	Cabbage soup?
M	ELDERLY WAITER	Potage aux choux a la Russe, as the gentle- man ordered.
M	LEVIN	It's what I wanted.
M	LEVIN (CONT'D)	Understand that for me, tonight is a ques- tion of life and death. OBLONSKY Oh, Kostya! Kitty would be mad to refuse you. And Dolly is on your side, you know. She says her sister Kitty was always meant to be your wife and will be.
M	LEVIN	Dolly said that? I've always thought your Dolly's a gem.
M	OBLONSKY	Oh, she is, she is . . . I loved her to distraction.
M	SEROZHA	But why? ANNA Because that's where Aunt Dolly lives.
M	SEROZHA	But why?
F	ANNA	I told you, Serozha. She's not well. I must go to see her.
M	SEROZHA	But why?
F	ANNA	Now, don't make Mama cry. I'll be back before you know, and bring you a present.
M	SEROZHA	Don't want a present. I want you to stay.
F	ANNA	Oh . . . my little Kutik . . .
M	SEROZHA	What present?
F	ANNA	That's better.
F	ANNA	It's the first time I've left my little boy.
M	COUNTESS VRONSKY	So you are leaving your son and I am return- ing to mine. I am Countess Vronsky.
M	countess vronsky (cont'd)	I've been in St. Petersburg for the christen- ing of a granddaughter--my elder son mar- ried Princess Chirkov. You're a charming creature. Why don't I know you? ANNA I've never been in Moscow society, really.
M	COUNTESS VRONSKY	But you know my name?
F	ANNA	I've heard you mentioned . . .
M	COUNTESS VRONSKY	Talked about, you mean. Ah, love!
F	ANNA	Was it love?
M	COUNTESS VRONSKY	Always. My sons are ashamed of me. But I'd rather end up wishing I hadn't than end up wishing I had--wouldn't you?
F	ANNA	I . . . I don't know . . .
M	LEVIN	I'll come back.
F	KITTY	Konstantin!
M	LEVIN	I'm too early.
F	KITTY	No! Come up! SAME TIME--NIGHT
F	KITTY	Look at me! I'm receiving for Papa and Maman who are late to dress. It's my first reception.
M	LEVIN	Princess Ekaterina! Delighted, delighted!
F	KITTY	I'm so pleased you were able to be with us, Konstantin Dmitrich!
M	LEVIN	Kitty . . . you look . . . you look--
F	KITTY	Stiva told us you were back. How long are you staying?
M	LEVIN	I don't know. It depends on you.
F	KITTY	On me? He has got ahead of himself. Doors are flung open and the hosts, Prince and
M	LEVIN	What I mean to say--I came with only one purpose--I want to--will you be my wife?
M	LEVIN (CONT'D)	I'm sorry--sorry--wrong moment--but will you?
F	KITTY	I can't. I'm sorry.
M	LEVIN	Yes. It was impossible.
M	BURISOV	Burisov. Are you the brother of Nikolai Levin? LEVIN Yes.
M	BURISOV	He's in Moscow, he's staying at the Unicorn in Khitrovka.
M	LEVIN	How do you know?
M	BURISOV	It's the sort of thing I know.
M	LEVIN	Count Vronsky?
F	VRONSKY	Yes.
M	VRONSKY (CONT'D)	Princess Kitty . . . It's been so long, and yet it seems like yesterday. KITTY It was yesterday!
M	LEVIN	It's Kostya. NIKOLAI God, look at him! You look like a capitalist! What do you want?
M	LEVIN	Nothing. I came to see you. NIGHT
M	LEVIN	Good evening, miss . . . madame . . .
M	NIKOLAI	Don't talk to her like that. It frightens her. You sound like a magistrate. More vodka for my brother, quick about it.
M	LEVIN	I don't want anything.
M	NIKOLAI	I'm all right. Who told you where to find me?
M	LEVIN	A colonel in the Third Department. They're watching you.
M	NIKOLAI	Good. They must think I'm dangerous. What have you got to smile about?
M	LEVIN	Nothing.
M	NIKOLAI	That's right. The day is coming. I gave up my birthright for it. You're on the wrong side of history. Not because privilege is immoral but because it's irrational.
M	MASHA	He is sick.
M	NIKOLAI	Let go or I'll beat your lights out. I took Mary Nikolova from a brothel but I consider her my wife. If her presence offends you you're free to leave. Are you married?
M	LEVIN	No.
M	NIKOLAI	Why not? Are you waiting to fall in love?
M	LEVIN	No.
M	NIKOLAI	Good. Romantic love will be the last illu- sion of the old order. You should marry one of your peasants.
M	LEVIN	Yes. I damn well should!
M	NIKOLAI	The brotherhood of man.
M	LEVIN	Nikolai, you have to see a doctor. Then come and stay with me at Pokrovskoe till you get your health back. NIKOLAI With my wife?
M	LEVIN	If you . . . or go abroad to a spa. I'll send you more if that's what you . . .
M	LEVIN (CONT'D)	What about the brotherhood of brothers?
M	STATIONMASTER	The private coach will stop opposite the carpet. VRONSKY Hello, what's this?
M	GUARDS OFFICER	Austrian royalty on their honeymoon. I've got them for four days.
F	VRONSKY	Bad luck. What do they like? Art?
M	GUARDS OFFICER	Food.
F	VRONSKY	Here's the train. TIME--DAY
M	STATIONMASTER	I'll see to it.
M	MAJOR DOMO	Second carriage, Your Excellency. I'll see to the Countess's luggage and bring it on to the house. ANNA I'll come back.
F	ANNA	You don't look ashamed.
M	OBLONSKY	I am, I really am. VRONSKY Yes, of course. Oblonsky's sister . . . Karenina.
M	COUNTESS	Charmante, don't you think? Wait for me in the carriage. I'll take Tosca.
F	VRONSKY	. . . You stayed longer in St. Petersburg.
M	COUNTESS VRONSKY	Long enough for you to start a little love affair, I hear.
F	VRONSKY	I can't think what you're referring to, Maman.
F	ANNA	There, Countess, you have found your son and I have found my brother.
M	COUNTESS VRONSKY	Madame Karenin has a son, too. It's the first time they have been apart, so she frets about him.
F	VRONSKY	Excuse me for not recognizing you before.
M	COUNTESS VRONSKY	We passed the time telling each other about our sons.
F	ANNA	Yes, I've been hearing all about you.
F	VRONSKY	That must have been very boring for you.
F	ANNA	Au revoir, Countess.
M	COUNTESS VRONSKY	Au revoir, my dear. Let me kiss your pretty face. Countess Vronsky does so. Anna turns to offer her hand to Vronsky. As
F	VRONSKY	Keep your people inside until this has been cleared up.
M	OBLONSKY	. . . the sole support of a large family, they say. ANNA Can't anything be done for them?
F	VRONSKY	Wait for me, Maman.
M	COUNTESS VRONSKY	I've you to thank for that.
M	OBLONSKY	What a good fellow . . .
F	ANNA	Have you known Count Vronsky long?
M	OBLONSKY	Did you like him? He's in love with Kitty.
F	ANNA	Oh . . . But we should be discussing you and Dolly. She scolds him like a naughty boy.
M	ANNA (CONT'D)	What have you got to say for yourself?
M	OBLONSKY	I've said it all--on my knees--in tears . . . Now I need you to say it. I'm going to the office, so you'll have Dolly to yourself.
F	ANNA	Don't be home late. MOSCOW--DAY
F	DOLLY	Kitty's coming by to see you. She's all grown-up, and a bit frightened of you--the belle of St. Petersburg society!
F	ANNA	Is that who I am?
M	ANNA (CONT'D)	Dolly, I'm sorry from the bottom of my heart. DOLLY I don't know what to do.
F	ANNA	I know, I know.
F	DOLLY	I can't bear to be with him. And he doesn't care, he's got what he wants.
F	ANNA	What he wants is you. He loves you, Dolly. You and the children are everything to him.
F	DOLLY	Are we? And there is room for a governess?
F	ANNA	That was shameful, disgraceful. But it was not love. It was the animal in man, not the soul. Stiva's remorse is from the soul.
F	DOLLY	What about me? Does his remorse make it easier for me?--
F	ANNA	I know you are suffering. But, Dolly, you must tell me . . . is there enough love left in your heart . . . enough to forgive him?
F	DOLLY	When I think of them together, I can't for- give him, no! ANNA My poor lamb. So you'd rather accept your fate . . .
F	DOLLY	My fate? But I haven't done anything! It's him WHO'S--
F	ANNA	Do you love him, Dolly?
M	ANNA (CONT'D)	You love him, and he loves you, but you can't forgive, so your lives must continue like this for ever, with both of you wretched. ANNA Grisha, don't pull so hard, you're getting it all in a tangle--and look for another G for GRIGORI-- --here, darling, you can wear it till you go TO BED--
M	ANNA (CONT'D)	Well, that's the end of that.
F	KITTY	Will you stay for the Bobrishchev's ball, Anna?
F	ANNA	Oh . . . I always feel dull at a ball.
F	KITTY	How can you ever be dull?
M	KITTY (CONT'D)	Stiva! Tell Anna she must come to the ball.
M	OBLONSKY	Of course she must. He cocks an eye at Anna: how did it go with Dolly? Anna moves her head:
F	ANNA	. . . and God go with you.
M	OBLONSKY	You can introduce me to your new governess.
M	TANYA	She's old! She's a hundred!
F	ANNA	I know why you want me to come. You want everyone to be there because you're sure it's going to be your night.
F	KITTY	How did you know?
F	ANNA	I know everything.
M	ANNA (CONT'D)	Oh, to be your age again . . . surrounded by that blue mist, like mist on the mountains that clears slowly to reveal the terrifying, beautiful valley you must enter to become grown-up . . . I was eighteen too, when I got married . . . TIME--NIGHT
M	SERVANT	. . . no, Your Excellency . . . He's just gone up. . . . The Princess retired early . . . Is there a message?
F	VRONSKY	No.
M	LEVIN	Will you go to confession? God will forgive you.
M	SERAFINA	And you also, master. He is watching.
M	LEVIN	God forgive us then, for committing the act of love. SERAFINA He is merciful.
M	LEVIN	"Not according to my deserts, O Lord, but according to thy mercy"--that's a fine prayer. But I'm full of doubt. Sometimes I even doubt that God exists.
M	SERAFINA	How can there be anything if God didn't make it?
M	LEVIN	I don't know. One day science will tell us.
M	SERAFINA	That's sinful talk if the priest heard you.
M	LEVIN	Well, I won't go to confession.
M	SERAFINA	Your father built the church. You're con- fessed a while yet.
M	SERAFINA (CONT'D)	Will you bring me something from Moscow?
M	LEVIN	What would you like? SERAFINA Soap, the kind wrapped in paper to look pretty, and smelling like for a proper lady.
M	YOUTH	Kitty! May I have a waltz?
F	KITTY	You may, Boris. I'll save you the third just because it's your first ball.
M	YOUTH	You're my first conquest. KORSUNSKY It's a relaxation to dance with you, Princess. But back to work! Where do you want to be taken?
F	KITTY	There.
M	KORSUNSKY	So that your ankles may be seen.
F	KITTY	How are you, Stiva?
M	OBLONSKY	Thanks to Anna, I am a happy man. Would you like to dance?
F	KITTY	No, ask Anna. ANNA No . . . I don't . . .
M	ANNA (CONT'D)	Come on then.
M	PRINCE SHCHERBATSKY	. . . this vile, idiotic matchmaking of yours . . .
M	PRINCESS SHCHERBATSKY	For goodness' sake, what have I done?
M	PRINCE SHCHERBATSKY	Levin is a thousand times better than this Petersburg fop. If he had royal blood my daughter wouldn't need him!
F	KITTY	Is anything the matter? VRONSKY No. You look . . . as lovely as ever, Princess Kitty.
F	KITTY	Don't ask me, Maman!
M	COUNTESS NORDSTON	He'll dance the mazurka with Kitty, you'll see. I call the mazurka the now-or-never.
M	AUSTRIAN PRINCESS	. . . we were shut up in the train for an hour! Anna steals a sidelong glance towards Vronsky but he is no longer there.
F	VRONSKY	Dance with me.
F	ANNA	I am not used to being spoken to like that by a man I met once at a railway station.
F	VRONSKY	I dare say, but if I'm not to dance with you, I'm getting out of this operetta and going home.
F	ANNA	Then, for Kitty's sake. Countess Nordston finds Kitty sitting alone. Korsunsky announces the
M	COUNTESS NORDSTON	You're not dancing the mazurka? I won't have it.
M	countess nordston (cont'd)	I'm engaged by General Glub--I give him to you. THE MAZURKA . . .
M	KORSUNSKY	. . . the lady chooses a lady and a gentleman . . . !
M	KORSUNSKY (CONT'D)	. . . and the lady chooses a lady and a gentleman . . . ! Anna looks smilingly around the dancing circle and sees Kitty staring
M	GUARD	Bologoye! Fifteen minutes.
F	VRONSKY	Can I be of service to you?
F	ANNA	I didn't know you were . . . Why are you leaving? VRONSKY You know why. I have to be where you are. I can't not.
F	ANNA	This is wrong. If you're a good man, forget everything that happened, as I will.
F	VRONSKY	I'll never forget a single thing about you, not a word, not a gesture--
F	ANNA	That's enough!
F	VRONSKY	Take the luggage home.
F	ANNA	Is Serozha all right? KARENIN Oh, is that all I get? Yes, he's quite well.
F	VRONSKY	Did you have a good night?
F	ANNA	Yes, quite comfortable. Count Vronsky.
M	KARENIN	I have to get back to the Committee . . . Well--were you a success?
F	ANNA	I? Oh--Dolly and Stiva . . . yes, I think so . . . DAY TIME--DAY
F	VRONSKY	I'll announce myself.
M	PETRITSKY	Vronsky! The master himself. Baroness, coffee from the new coffeepot for Count Vronsky.
M	PETRITSKY (CONT'D)	I hope you are pleased by this ornament to your quarters.
M	BARONESS	I'll be off home if I'm in the way. VRONSKY You're at home where you are, Baroness.
M	BARONESS	Ah!--Pierre, you never say such pretty things to me. We were just discussing my husband. He won't divorce me, you see. And do you know why?
F	VRONSKY	No.
M	BARONESS	Because he likes eating off my family silver.
F	VRONSKY	Ah.
M	BARONESS	I want to bring an action. Just because I'm supposed to be unfaithful, I don't see why I have to eat off Pierre's crockery. Look at it.
F	VRONSKY	It's my crockery.
M	PETRITSKY	How was Moscow?
F	VRONSKY	Provincial. NIGHT
M	SEROZHA	You've stopped.
M	SEROZHA (CONT'D)	Thank you for my present.
F	ANNA	Sssh . . . NIGHT
M	KARENIN	Time for bed!
F	ANNA	I'm writing to Dolly . . . and to Kitty.
M	KARENIN	You are . . . good.
M	KARENIN	What are they saying in Moscow about the new Statute?
F	ANNA	What new Statute?
M	KARENIN	The new Statute I carried in Council.
F	ANNA	No one mentioned it.
M	KARENIN	Ah. Really?
M	KARENIN (CONT'D)	Here it made quite a sensation. MOSCOW--DAY
M	FAMILY DOCTOR	Forgive me, Princess, but I must . . .
M	PRINCE SHCHERBATSKY	Am I the only one who knows what's wrong with her?
M	PRINCESS SHCHERBATSKY	Oh, thank God, doctor--my friends say you're the only one who can save her!
M	CELEBRITY DOCTOR	Possibly, Princess, possibly! At your service, Your Excellencies. Where is the patient?
M	CELEBRITY DOCTOR	Come, come, Princess, we are not backward people--I handle naked bodies every day. Deep breath now . . .
M	PRINCE SHCHERBATSKY	By God. I'll challenge the scoundrel!
M	FAMILY DOCTOR	It's the modern way . . .
M	PRINCESS SHCHERBATSKY	You're not a doctor!
M	FAMILY DOCTOR	Her symptoms . . . loss of appetite, fast PULSE--
M	PRINCE SHCHERBATSKY	Well, whose pulse wouldn't be fast if some brute of a-- CELEBRITY DOCTOR Nervous palpitations. We must treat the nerves. A tubercular cavity is suspected, too soon to tell. Soden water every two hours. I must see her again tomorrow. Prince! Princess!
M	PRINCE SHCHERBATSKY	Don't you fret, my little Kate! You'll wake up one fine morning and say to yourself--"I feel well and happy and I'll go out for a walk with Papa!"
M	BETSY	I want to give a small dinner before the opera. Is there anyone you would like me to ask?
F	ANNA	Yes . . . Yes, the Metropolitan Bishop of St. Petersburg. HOUSE--NIGHT KARENIN Countess Lydia tells me you haven't been to one of her evenings since you returned.
F	ANNA	The last one was to meet a missionary, the one before was for a lecture on the union of the Greek and Roman churches. I'm sorry--I know you're fond of her. Come on, or we'll be late.
M	DEMIN	Here's the thing, Vronsky. A posting has come up and there's a promotion in it for you.
F	VRONSKY	Thank you, sir.
M	DEMIN	The garrison in Tashkent. VRONSKY Tashkent? But . . . I would like to stay in Peter, sir, if you don't mind.
M	DEMIN	I don't mind. But your mother . . .
M	BETSY	You didn't come to my dinner.
F	VRONSKY	I had to see my Commanding Officer. BETSY "She" didn't come either.
M	LYDIA	. . . work never ceases for great men.
M	Your husband is a saint and we must all	cherish him for Russia's sake. I hope you can come on afterwards--Father Kristof's report on the Chinese mission will be with lantern slides.
F	ANNA	I'm expected at the Tverskoys.
M	LYDIA	No doubt, but I'm sure Princess Betsy can wait for you, my dear.
F	ANNA	Yes. In fact, I think I won't go to Betsy's.
M	BETSY	You're caught.
F	VRONSKY	I'm afraid I am becoming ridiculous. HOUSE--DAY
M	LISA MERKALOVA	Now, there's a phenomenon, look-- Anna's shadow has arrived before Anna!
M	ANNA'S FRIEND	I'm Anna's friend . . . but this making-up- one's-mind-to-it in public is not polite to a distinguished man like Karenin.
M	PRINCESS MYAGKAYA	In my opinion Karenin is a fool, and Anna is the best of us. LISA MERKALOVA And we all love you for your contrary opin- ions, Princess.
M	BETSY	Alexei . . . You look desperate. That's not attractive.
F	VRONSKY	I'm losing hope.
M	BETSY	Hope of what? Persuading a virtuous woman to break her marriage vows?
F	VRONSKY	And how is Tuskevich?
M	BETSY	That's not attractive either. Besides, I was never virtuous.
F	VRONSKY	No--you're right. She won't come. I'm going home.
F	VRONSKY	Turn round! HOUSE--NIGHT
M	VOICES	Wasn't Nilsson glorious? One sees that she has studied Kaulbach, of course . . .
M	There's something Louis Quinze about	Tuskevich . . . as if he came with the furniture . . .
M	BETSY	He's gone. But you're just in time for the surprise. Anna turns at once to the window near her, puts her face up against the
M	vronsky (O.C.)	May I have the honour of bringing you an ice?
M	VRONSKY (CONT'D)	Ices are being served.
F	ANNA	I would prefer to try a cigarette. VRONSKY Courage!
F	ANNA	Thank you.
M	ANNA (CONT'D)	I'll try another one sometime.
F	VRONSKY	When?
M	VRONSKY (CONT'D)	Where?
F	ANNA	Just as I was thinking your manners have improved since Moscow. You behaved badly, very badly.
F	VRONSKY	And who was responsible for that?
F	ANNA	Give me a cup of tea. Betsy obediently gets up to fill a cup from the samovar. Vronsky follows
M	BETSY	How nice--Alexei Aleksandrevich has arrived.
M	LISA MERKALOVA	I'm not sure my nerves can stand another Alexei at this moment.
M	PRINCESS MYAGKAYA	So the Schuzburgs asked us to dinner. The sauce was said to have cost a thousand rou- bles, and it was ghastly. We had to ask them back. I gave them a sauce that cost eighty- five kopeks and it was a triumph.
F	VRONSKY	Were you glad to see me or not? ANNA This must stop. You make me feel as if I were guilty of something.
F	VRONSKY	What do you want me to do?
F	ANNA	I want you to go to Moscow and beg Kitty to forgive you.
F	VRONSKY	No, that's not what you want. Moscow? I can do better than that. Tonight I refused a posting to Tashkent. I can change my mind, and you'll never see me again.
F	ANNA	If you have any thought for me, you will give me back my peace.
F	VRONSKY	I have no peace to give. There can be no peace for us--only misery or the greatest happiness. You are my whole life now.
M	BETSY	Your husband is impossible!-- his opinions are all wrong but he talks so brilliantly he wins every argument. ANNA What?
M	KARENIN	I called to take you home.
F	ANNA	No, I'm staying. Send the carriage back for me.
M	KARENIN	Of course.
F	VRONSKY	Do you want me to go to Tashkent? TIME--NIGHT TIME--NIGHT
F	VRONSKY	So I'll go to Tashkent.
F	ANNA	No. I don't want you to go. TIME--NIGHT HOUSE--NIGHT
F	ANNA	Waiting up? How unlike you!
M	KARENIN	Yes, I stayed up to talk to you.
F	ANNA	What about? It's late. Where's Annushka?
M	KARENIN	I sent her off.
F	ANNA	Well, if you want to talk, but we should go to bed. KARENIN I have to warn you about something. Warn me? It's really rather late . . .
M	KARENIN	I wish to warn you that you may inadver- tently, by indiscretion and carelessness, give the world occasion to talk about you.
F	ANNA	I am not a committee. Please say what you want to tell me.
M	KARENIN	You and Count Vronsky attracted attention tonight.
F	ANNA	You don't like it when I don't talk to people, and you don't like it when I do.
M	KARENIN	I didn't notice anything, myself. But I saw that everyone else noticed. I consider jeal- ousy to be insulting to you and degrading to me. I have no right to inquire into your feelings. They concern only your conscience. But I'm your husband and I love you. It's my duty to remind you that we are bound together by God, and this bond can only be broken by a crime against God. ANNA I have nothing to say to you, and I'm tired.
M	KARENIN	And you have a son. TIME--NIGHT
M	KARENIN	Forgive me. If I am wrong, I ask your pardon.
F	ANNA	I don't know what you're talking about, and it's really too late for this. Excuse me, please.
F	ANNA	Too late. CLOSE-- SEX AS BEFORE
F	ANNA	Oh God forgive me. It's the end of everything--I've got nothing left now, only you. Remember that.
F	VRONSKY	Anna . . . Anna . . . how can I not remem- ber? You're my happiness. ANNA Happiness! You murdered my happiness.
M	ANNA (CONT'D)	Murderer. Murderer. Go on. Go on. Go on.
M	ANNA (CONT'D)	Yes. Go on. Go on. Go on.
M	LEVIN	I thought that had been done.
M	VASILI	I gave the order. What can you do with these people? LATER
M	OBLONSKY	Ah--potage aux choux a la Russe!
M	OBLONSKY (CONT'D)	Agafia!--if you opened up in Moscow, l'Angleterre would go out of business.
M	LEVIN	Of Babylon? No.
M	OBLONSKY	You're right, what do you care? You love the country--you've got it. You love agricultur- ing, and, Lord knows, you've got it. You love shooting--you've got it. You've got every- thing you want!
M	LEVIN	All right, go on, then. Have you stopped stealing bread rolls? OBLONSKY Ballet girl, oriental type. How can I help it?
M	LEVIN	So, nothing new to tell me. How is--how are the Shcherbatskys?
M	OBLONSKY	You mean Kitty.
M	LEVIN	I . . . Is she engaged now?
M	OBLONSKY	No. Vronsky went back to St. Petersburg.
