CHARACTER	DIALOGUE
GIRL	Now that the war's over, our soldiers get to come home, yes?
TEACHER	Some of them. Some will be stationed on the rim planets as Peace Enforcers.
BOY	I don't understand. Why were the Independents even fighting us? Why wouldn't they look to be more civilized?
TEACHER	That's a good question. Does anybody want to open on that?
GIRL	I hear they're cannibals.
ANOTHER BOY	That's only Reavers.
ANOTHER GIRL	Reavers aren't real.
ANOTHER BOY	Full well they are. They attack settlers from space, they kill them and wear their skins and rape them for hours and hours --
TEACHER	It's true that there are... dangers on the outer planets. So let's follow up on Borodin's question. With all the social and medical advancements we can bring to the Independents, why would they fight so hard against us?
RIVER	We meddle.
TEACHER	River? RIVER is a dark, intense little girl, writing with one hand
RIVER	People don't like to be meddled with. We tell them what to do, what to think, don't run don't walk we're in their homes and in their heads and we haven't the right. We're meddlesome.
TEACHER	River, we're not telling people what to think. We're just trying to show them how. She violently PLUNGES the stylus into the girl's forehead
2ND TECHNICIAN	She's dreaming.
FIRST TECHNICIAN	Nightmare?
2ND TECHNICIAN	Off the charts. Scary monsters.
DOCTOR MATHIAS	Let's amp it up. Delcium, eight- drop. DOCTOR MATHIAS is not instantly likable -- nor gradually, for Behind him stands a GOVERNMENT INSPECTOR, observing. And The Inspector is in shadow, but his uniform indicates substantial rank, as does the eagle-crested baton See, most of our best work is done when they're asleep. We can monitor and direct their subconscious, implant suggestions... River starts convulsing, mewing in misery. The Inspector It's a little startling to see, but the results are spectacular. Especially in this case. River Tam is our star pupil. The Inspector steps into the light. He is rigid, cold,
SIMON	I've heard that.
DOCTOR MATHIAS	She's a genius. Her mental capacity is extraordinary, even with the side-effects.
SIMON	Tell me about them.
DOCTOR MATHIAS	Well, obviously, she's unstable... the neural stripping gives them heightened cognitive reception, but it also destabilizes their own reality matrix. It manifests as borderline schizophrenia... which at this point is the price for being truly psychic.
SIMON	What use do we have for a psychic if she's insane?
DOCTOR MATHIAS	I don't have to tell you the security potential of someone who can read minds. And she has lucid periods -- we hope to improve upon the... I'm sorry, Sir, I have to ask if there's some reason for this inspection. Am I making you nervous?
DOCTOR MATHIAS	Key members of Parliament have personally observed this subject. I was told their support for the project was unanimous. The demonstration of her power --
SIMON	How is she physically?
DOCTOR MATHIAS	Like nothing we've seen. All our subjects are conditioned for combat, but River... she's a creature of extraordinary grace.
SIMON	Yes. She always did love to dance. He drops to one knee, slamming his baton to the floor. As the top pops off like a bouncing betty (the grenade), River. Wake up. Please, it's Simon. River. It's your brother. Wake up... She begins to stir as a noise moves him to the door, looking River is suddenly next to him. He jumps a little.
RIVER	Simon. A beat, as they face each other, Simon fighting emotion. They know you've come.
SIMON	We can't make it to the surface from inside. Simon turns suddenly as he hears footsteps, people heading at 4wo SIMON Find a -- But River has, impossibly, scampered up over some lab ANGLE: THE SHIP is floating over the grass of rolling hills,
SIMON	Get on! He is standing by the window -- and the Security Agent is
THE OPERATIVE (O.S.)	Stop. The action freezes. Lovely. Lovely. Backtrack. The action REVERSES, taking us back to the moment of Simon f t o Stop. There is a motionless beat, River frozen in that crouch, and
THE OPERATIVE	Biograph. Simon Tam. As Simon's history files down in print and pictures -- Remarkable children. Doctor Mathias storms in, two security men (not the ones from
DOCTOR MATHIAS	Excuse me! No one is allowed in the records room without my express permission.
THE OPERATIVE	Enter the doctor. Forgive me. I prefer to see the event alone, without bias. Mathias looks at the hologram -- realizes which one it is.
DOCTOR MATHIAS	I need to see your clearance.
THE OPERATIVE	You're right to insist. I know you've had security issues here. He places his hand on a screen as he says it. Mathias looks
DOCTOR MATHIAS	Apologies. An Operative of the Parliament will of course have full cooperation. I'm not sure what... I see no listing of rank, or name.
THE OPERATIVE	I have neither. Like this facility, I don't exist. The Parliament calls me in when... when they wish they didn't have to. Let's talk about the Tams.
DOCTOR MATHIAS	I assume you've scanned the status logs...
THE OPERATIVE	River was your greatest success. A prodigy -- A phenomenon. Until her brother walked in eight months ago and took her from you.
DOCTOR MATHIAS	It's not quite so simple.
THE OPERATIVE	I'm very aware of that.
DOCTOR MATHIAS	He came in with full creds. He beat the ap-scan, the retinal... There was no way I could --
THE OPERATIVE	No, no. Of course. The boy spent his fortune developing the contacts to infiltrate this place.
DOCTOR MATHIAS	Gave up a brilliant future in. medicine as well, you've probably read. Turned his back on his whole life. Madness.
THE OPERATIVE	Madness, no. Something a good deal more dangerous. Have you looked at this scan carefully? At his face? Mathias looks uncertain. It's love, in point of fact. He loved his sister and he knew she was in pain. So he took her somewhere safe.
DOCTOR MATHIAS	Why are you here?
THE OPERATIVE	I'm here because the situation is even less simple than you think. Do you know what your sin is, Doctor?
DOCTOR MATHIAS	I. I would be very careful about what you -- It's pride. He touches the computer screen and the hologramic image jumps
DOCTOR MATHIAS	Key members of Parliament have personally observed this subject. I was told their support --
THE OPERATIVE	Key members of Parliament. Key. The minds behind every diplomatic, military and covert operation in the galaxy, and you put them in a room with a psychic.
DOCTOR MATHIAS	She was... she read cards, nothing more.
THE OPERATIVE	It's come to our attention that River became much more unstable, more... disturbed, after you showed her off to Parliament. Did she see something very terrible in those cards?
DOCTOR MATHIAS	Whatever... secrets she might have accidentally gleaned... it's probable she doesn't even know she knows them. That they're buried beneath --
THE OPERATIVE	But they are in her. Her mind is unquiet. It's the will of the Parliament that I kill her. And the brother. Because of your sin.
THE OPERATIVE	You know, in certain older civilized cultures, when men failed as entirely as you have, they would throw themselves on their swords.
DOCTOR MATHIAS	Well, unfortunately I forgot to bring a sword to -- The air rings crisply as the Operative pulls out his sword.
THE OPERATIVE	The Parliament has no further interest in psychics. They represent a threat to the harmony and stability of our Alliance.
DOCTOR MATHIAS	I would put that down right now if I were you.
THE OPERATIVE	Would you be killed in your sleep, like an ailing pet? Whatever your failings, I believe you deserve better than that. The agents move. He slices the throat of the one behind him Mathias bolts but the Operative pins him to the wall. He Young miss, I'll need all the logs- on behavioral modification triggers. We'll have to reach out to River Tam, and help her to come back to us. No matter how far out Simon has taken her, we can -- He's almost startled when the Doctor's body drops into frame, This is a good death. There's no shame in this, in a man's death. A man who's done fine works. We're making a better world. All of them, better worlds. Mathias is dead. The Operative pulls the sword out as the Young miss, I need you to get to work now. I think I may have a long way to travel. She goes. He approaches River, very close, staring... Where are you hiding,,little girl? The noise is sucked suddenly out of the room as we black out. becomes the name painted on the side of a spaceship, with The bridge is small: two pilot seats on either side, and a
MAL	What was that? He's addressing the pilot, WASH. Flight gear and a hawaiian
WASH	Whoah! Did you see that -- The ship bucks --
MAL	Was that the primary buffer panel? It did seem to resemble --
MAL	Did the Primary Buffer Panel just fall off my gorramn ship for no apparent reason? Another buck --
WASH	Looks like.
MAL	I thought Kaylee checked our entry couplings! I have a very clear memory of it --
WASH	Yeah well if she doesn't give us some extra flow from the engine room to offset the burnthrough this landing is gonna get pretty interesting.
MAL	Define "Interesting".
WASH	"Oh god, oh god, we're all gonna die?"
MAL	This is the Captain. There's a little problem with our entry sequence; we may experience slight turbulence and then explode. Can you shave the vector --
WASH	I'm doing it! It's not enough. Kaylee!
MAL	Just get us on the ground!
WASH	That part'll happen, pretty definitely.
JAYNE	we're gonna explode? I don't wanna explode.
MAL	Jayne, how many weapons you plan on bringing? You only got the two arms...
JAYNE	I just get excitable as to choice, like to have my options open.
MAL	I don't plan on any shooting taking place during this job.
JAYNE	Well, what you plan and what takes place ain't ever exactly been similar.
MAL	No grenades. No grenades. First Mate ZOE enters from the lower level. Her mode of
ZOE	Are we crashing again?
MAL	Talk to your husband. Is the mule prepped?
ZOE	Good to go, sir. Just loading her up. Are those grenades?
JAYNE	Cap'n doesn't want 'em.
ZOE	We're robbing the place. We're not occupying it. All that plays in the background as we lead Mal into the:
MAL	Kaylee! He enters:
MAL	Kaylee, what in the sphincter of hell are you playing at? The hall leads to the rust-brown chaos that is the engine We got the Primary Buffer
KAYLEE	Everything's shiny, Cap'n. Not to fret.
MAL	You told me -- You told me the entry couplings would hold for another week! That was six months ago, cap'n.
MAL	My ship don't crash. If she crashes, you crashed her. Steam and electricity shoot at him, backing him up. Doctor. Guess I need to get innocked 'fore we hit planetside. Simon nods, the ship jolting again. Bit of a rockety ride. Nothing to worry about.
SIMON	I'm not worried.
MAL	Fear is nothing to be ashamed of, Doc.
SIMON	This isn't fear. This is anger. Well, it's kinda hard to tell the one from t'other, face like yours.
SIMON	I imagine if it were fear, my eyes would be wider.
MAL	I'll look for that next time.
SIMON	You're not taking her.
MAL	No no, that's not a thing I'm interested in talking over with --
SIMON	She's not going with you. That's final.
MAL	I hear the words "that's final" come out of your mouth ever again, they truly will be. This is my boat. Y'all are guests on it. He heads down a side corridor that has steps leading down to:
SIMON	Guests? I earn my passage, Captain --
MAL	And it's time your little sister learned from your fine example.
SIMON	I've earned my passage treating bullet holes, knife wounds, laser burns...
MAL	Some of our jobs are trickier than others --
SIMON	And you want to put my sister in the middle of that.
MAL	Didn't say 'want'. Said 'will'. It's one job, Doc. She'll be fine. The passenger dorm has a time-worn warmth that most of the
SIMON	She's a seventeen year old girl. A mentally traumatized sevente--
MAL	She's a reader. Sees into the truth of things; might see trouble before it's coming. Which is of use to me.
SIMON	And that's your guiding star, isn't it? What's of use. Honestly, doctor, I think we may really crash this time anyway. Simon jabs the inoculation needle into Mal's arm.
SIMON	Do you understand what I've gone through to keep River away from the Alliance?
MAL	I do, and it's a fact me and mine have been courteous enough to keep to our own selves.
SIMON	Are you threatening to --
MAL	I got one purpose here: keep this boat in the air. I take the jobs I get -- which is less and less, case you ain't been keeping track. He starts away, Simon still keeping pace. Every year since the war the Alliance pushes just a little further out towards the rim. Makes it a chore for naughty men like us to slip about -- and keeping you two on board means working twice as hard to avoid the law. Means turning down a score of honest jobs.
MAL	So here is us, on the raggedy edge. Don't push me and I won't push you. Simon starts up the stairs as Mal calls to him: Things get gritty I will keep her from the fray, but she's coming. Best you get her ready. As Mal walks on, we tilt up to see the Mule, a four-man Zoe, is Wash gonna straighten this boat out before we get flattened?
ZOE	Like a downy feather, sir. Nobody flies like my mister. The camera picks up Simon's feet as they enter foreground on
SIMON	River... She's lying on her side, looking straight at us. A loose
RIVER	I know. We're going for a ride.
SIMON	Now, River, you stay behind the others. If there's fighting you drop to the floor or run away. It's okay to leave them to die. River puts on a huge pair of goggles, looks at her brother.
RIVER	I'm the brains of the operation.
ZOE	We should hit town right during Sunday worship. Won't be any crowds.
MAL	If Fanty and Mingo are right about the payroll, this could look to be a sunny day for us. Captain, I'll ask you one last time...
MAL	Doctor, I'm taking your sister under my protection here. If anything happens to her, anything at all, I swear to you I will get very choked up. Honestly. There could be tears. He peels out, leaves Simon fuming. Kaylee sidles up to him...
KAYLEE	Don't mind the Captain none, Simon. I know he'll look out for her.
SIMON	It's amazing. I bring River all the way out to the raggedy edge of the 'verse so she can hide from the Alliance by robbing banks.
KAYLEE	It's just a little Trading Station. They'll be back 'fore you can spit. Not that you spit... Kaylee watches him go, a tad forlorn.
JAYNE	What are we hoping to find here that equals the worth of a turd?
MAL	Alliance payroll. There's peace enforcing squads stationed all about this quadrant. Can't use credits out here -- they got to pay their boys in cashy money. Which once a month rests here.
ZOE	Something about stealing from the Alliance just warms a body like whiskey in winter.
JAYNE	Shiny. Let's be badguys. Mal turns back to River.
MAL	You ready to go to work, darlin'?
RIVER	There's no pattern to the pebbles here, they're completely random. I tried to count them but you drove too fast. Hummingbird.
MAL	Right. Great. Let's go. The door slams open, Mal and Jayne stride in, Zoe following There's maybe fifteen people in the place: store workers,
MAL	Hands and knees and heads bowed down! Everybody, now! Two men who appear to be farm folk rush Mal and the others. The other tries to tackle Jayne, which is not necessarily a Y'all wanna be looking very intently at your own belly buttons. I see a head start to rise, violence is gonna ensue. The guy who rushed Mal complies along with everyone else.
JAYNE	Looks like this is the place. He looks up at Mal, who motions for Zoe to open the front
MAL	You've probably guessed we mean to be thieving here, but what we are after is not yours. So let's have no undue fussing. As he is speaking, Jayne is scrambling to the back office,
JAYNE	She's locked up. River suddenly looks around, perturbed. CLOSE ON: a young tough. River looks up at Zoe, alarmed, and silently points to the
ZOE	You know what the definition of a hero is? It's someone who gets other people killed. You can look it up later. He drops his weapon, slides it across the floor.
TRADE AGENT	This is just a crop moon, don't think you'll find what you --
MAL	The old man punches in the code. What opens is a tiny wall
ZOE	At last. We can retire and give up this life of crime. Mal reaches in, pulls a lever and the floor opens, a six foot
MAL	Is there a fed down there? Be truthful. Y'all are Browncoats, hey? Fought for independence?
MAL	War's long done. We're all just folk now. Listen up! We are coming down to empty that vault! The voice of a young Alliance GUARD comes up from below.
GUARD (O.S.)	You have to give me your authorization password! Jayne impatiently fires a burst of machine-gun fire down into Okay... Mal looks at Zoe and they head down into:
SON	Repeater.
WOMAN	Did sound summat like gunblast... Maybe you aught run tell Lawman... She turns and right by her, in the shadows, is a man.
JAYNE	What the hell is up? You all right? What's goin' on? He holds her, as she whispers, wide-eyed...
RIVER	Reavers.
MAL	Leg's good, it'll bleed plenty and we avoid any necessary organs...
GUARD	I was thinking more of a graze..
MAL	Well you don't want it to look like you just gave up...
MAL	Every heist, he's gotta start yelling my name --
JAYNE	Mal! Reavers! The girl's pitchin' a fit. They're here or they're comin' soon. He is already loading up with bags as Mal thinks quickly.
MAL	Get on the mule. Does that open from the inside?
GUARD	Whah -ah- yes...
MAL	You get everyone upstairs in there and you seal it. Long as you got air you don't open up, you understand?
GUARD	I -- Buh I -- Mal is in his face, dark and huge:
MAL	Zoe take the wheel --
JAYNE	You see 'em? Anybody see 'em? 1J -- and jump on themselves, Mal scanning the area as he hands
YOUNG MAN	Take me with you!
MAL	Get in the vault with the others --
YOUNG MAN	I can't stay here! Please!
MAL	It's too many. Drive, Zoe. A Reaver craft ROARS over their heads. It's nearly the size
MAL	Drive! Zoe's face is set with unhappy determination as she floors As the mule shoots past the last building, we see a skiff We see the church as the first ship and an even larger one
JAYNE	How come they ain't blowing us out of the air?
MAL	They wanna run us down. The up- close kill. River is squashed down on her back, being very small.
RIVER	They want us alive when they eat us.
JAYNE	Boy, sure would be nice if we had some grenades, don'tchya think? Mal says nothing, keeps firing.
ZOE	Wash, baby can you hear me?
WASH	We're moments from air. You got somebody behind you? We intercut Wash and Zoe at this point:
ZOE	Reavers.
ZOE	We're not gonna reach you in time.
WASH	Just keep moving, honey. We're coming to you. Jayne goes flying off the back of the Mule, Mal just grabbing
MAL	Grab on! Jayne grabs the Mule, legs dangling, pulled out between the
JAYNE	I won't get et! You shoot me if they take me! Mal steadies himself and takes aim, seemingly at Jayne -- Well don't shoot me first! Mal fires. Again. Steadies himself for one more...
V0V	The mule surges forward as Jayne drags on the ground. Mal Rutting pigs! Where's -- And River is holding out his weapon before he can ask for it.
WASH	Get some distance on 'em. You come to the flats, I want you to swing round. Gonna try a Barn Swallow.
WASH	J Simon! Open the loading dock! Okay, baby, we've talked this through...
ZOE	Talkin' ain't doin'. She throws the wheel and the mule comes hard about, Don't slow down!
ANGLE: THE SKIFF	As it heads for the mule -- As it heads for the skiff -- and Serenity swoops down out of
SIMON	River?
RIVER	I swallowed a bug. Kaylee runs in to see how everyone is. She goes to Simon.
KAYLEE	Are you okay?
MAL	Is he okay? A bloodied Reaver POPS into frame from under the skiff-top. We all here? What's going on? Hello? r./ ZOE No casualties. Anybody following?
WASH	Nice flying, baby, and that's a negative. Clean getaway -- Out of atmo in six minutes.
MAL	Set course for Beaumonde. First thing, I want these bod -- Simon suddenly punches him in the face, causing Mal to
SIMON	You stupid, selfish, son of a whore ---
MAL	I'm a hair's breadth from riddling you with holes, Doctor --
SIMON	"One simple job! She'll be fine!"
MAL	She IS fine! Except for bein' still crazy, she's the picture of health!
ZOE	Wasn't for River, we'd probably be left there. She felt 'em coming.
SIMON	Never again. You understand me?
MAL	Seems I remember a talk about you giving orders on my boat.
SIMON	Well sleep easy 'cause we're off your boat. Just as soon as River gets her share of the "bounty".
KAYLEE	Well let's not do anything hasty...
MAL	No, shiny! I'm sick a' carrying tourists anyhow. We'll be on Beaumonde in ten hours time, you can pick up your earnings and be on your merry. Meantime you do your job. Patch up my crew. A beat.
RIVER	He didn't lie down. They never lie down. She is looking at the Reaver. Everyone does, for a moment.
ZOE	No, I think things'll glide a deal smoother for us without River and Simon on board... but how long do you think they'll last?
MAL	Doc made his call. They's as babes in a basket when we took 'em in; we sheltered 'em plenty. Man has to cut loose, learn to stand on his own.
ZOE	Like that man back in town? They stop by Mal Is room.
MAL	I had to shoot him. What the Reavers woulda done to him before they killed him...
ZOE	I know. That was a piece a' mercy. But before that, him begging us to bring him along... vo,
MAL	We couldn't take the weight. Woulda slowed us down.
ZOE	You know that for certain
MAL	Mule won't run with five. I shoulda dumped the girl? Or you? Or Jayne? Well, Jayne...
ZOE	Coulda tossed the payload.
MAL	And go to Fanty and Mingo with air in our mitts, tell 'em "here's your share"? They'd set the dogs on us in the space of a twitch, and there we are back in mortal peril. We get a job, we gotta vo make good. Washenters from the bridge.
ZOE	Sir, I don't disagree on any particular point, it's just... in the time of war, we woulda never left a man stranded.
MAL	Maybe that's why we lost. She's not happy with the reply. Mal climbs down to his room The place resembles a submarine cabin, with charts and Mal moves a bunch of papers off his bunk and a picture slides
INARA	Kaylee, are you ever gonna put that capture down?
KAYLEE (0.5.)	We gotta have records of everything. A bona fide Companion entertained clients on this very ship! In this very bed! The picture pans over to the bed -- which River is bending For one sweet second, we was almost classy.
INARA	4 You promised to help me pack. Honest, Inara, why do you have to leave? Inara shoots an uncertain look at the camera -- and the
JAYNE (V.0.)	I do not get it. How's a guy get so wrong?
JAYNE	Ain't logical. Cuttin' on his own face, rapin' and murdering -- I mean, I'll kill a man in a fair fight... or if I think he's gonna start a fair fight, or if he bothers me, or if there's a woman, or I'm gettin' paid -- mostly only when I'm gettin' paid. But these Reavers... last ten years they just show up like the boageyman from stories. Eating people alive? Where does that get fun? He dumps the body in, she starts the doors closing.
KAYLEE	Shepherd Book said they was men that reached the edge of space., saw a vasty nothingness and just went bibbledy over it.
JAYNE	Hell, I been to the edge. Just looked like more space.
KAYLEE	I don't know. People get awful lonely in the black. Like to get addlepated ourselves, we stay on this boat much longer. Captain'll drive us all off, one by one.
JAYNE	You're just in a whinge cuz that prissy doc is finally disembarking. Me I says good riddance. He never belonged here, and his sister's no saner than one of them Reavers.
KAYLEE	That ain't even so! River's a dear heart and a boon to this crew! You just don't like her 'cause she can read your mind and everything you think is mean.
JAYNE	Well, there is that.
KAYLEE	Her and Simon could have a place here. Now they're leaving us. Just like Shepherd Book. She looks up toward one of the shuttles. Just like Inara...
A WOMAN'S VOICE (V.0.)	They love you.
SHEYDRA	The girls. They've learned more from you these last months than the rest of us could show them in two years.
INARA	They're very sweet. But they're not Companions. You've no hope for them? Junk the lot, start anew?
INARA	On Sihnon we started training at twelve. Years of discipline and preparation before the physical act of pleasure was even mentioned. Most of these girls --
SHEYDRA	They're all of good family, the highest academic standards --
INARA	Control. Was the first lesson. And the last and these worlds are not like the Central Planets. There is barbarism dressed up in the most civil weeds. Men of the highest rank who don't know the difference between a Companion and a common whore. It's unsafe.
SHEYDRA	All the more reason the girls look to you. You came out here alone, before the Alliance ever thought to establish a House this remote. You've seen so much. You're a figure of great romance to them. 4d INARA Great romance has nothing to do with being a Companion, Sheydra. You should know better.
SHEYDRA	I'm not the one who had a torrid affair with a pirate. Inara nearly spills her drink.
INARA	A who? With a what? It's the talk of the House. The girls all trade stories in the dorms at night.
INARA	I didn't... have a pirate...
SHEYDRA	In one of the stories you make love in a burning temple. I think that's my favorite. This is unbearable. Captain Reynolds is no pirate; he's a petty thief. And he never laid a finger on me. All he ever did was rent me a shuttle and be very annoying. A year on his shuttle and he never laid a finger on you. No wonder you left. I left because -- go away. We're no longer friends. You're a stranger to me now.
SHEYDRA	104 I do love to watch you boil. Don't worry. The stories will fade. And your Captain Reynolds has probably gotten himself blown up by this time.
INARA	Yes. That would be just like him.
KAYLEE	Don't talk to the barkers -- only the captains. You look the captain in the eye, know who you're dealing with.
40 SIMON	• I wish there was... Since he doesn't know what to say, she rattles on:
