CHARACTER	DIALOGUE
BISHOP	Huh. His eyes dart to an image of his DINING ROOM. It looks like Son of a bitch... Come on, Steve. We need you.
BISHOP	Whiskey. Neat. Lots of it. Bishop fumbles in his pocket, brings out a thick wad of cash.
BARTENDER	That's too much. Bishop grabs the shot, down it. Pushes the empty shot and
BISHOP	I'm not going anywhere.
AN HOUR LATER	Another shot is put down on the bar, empty. Bishop wipes
FEMALE NEWS ANCHOR	...Intelligence services can listen to our calls. But what about the rest of the world?
FEMALE NEWS ANCHOR (CONT'D)	Well, today the answer seems to be 'No" as outrage over the assassination of the Turkish envoy Bahar Miryem has forced the US to reverse its position, now saying that it will not make it support of Turkey's EU bid contingent on its cooperation in the security agreement. Miryem had always advocated for Turkish autonomy from Bartender hits a remote, annoyed. Channel changes to a 70's
BISHOP	...More. WHAM! WHAM! Bishop takes the punches, no defense. Face
EX CON	Dude, you don't want any more, give us that money. Bishop shakes his head. WHAM! WHAM! Two more hits to the
BISHOP	Look, I'll give you my money, but you have to promise me you won't spend it all on lipstick and tampons. Ex Con #2 pulls a gun, puts it to Bishop's head.
EX CON #2	You wanna die right here, motherfucker? Bishop raises his eyes to the man. Not so drunk after all.
BISHOP	...Thank you. Steve...? Where are you, baby? Suddenly LIGHTS wash across the space. Bishop glances out: Steve watches Bishop signing, closing the door and moving ON BISHOP, tacking up pages, photographs, financials. We
STEVE	Hello? Bishop? He enters the study, sees the WALL, the night's work. In the
BISHOP (O.S.)	There you are. Bishop is leaning in from outside. Nods to Steve.
STEVE	So who is he?
BISHOP	...US Government. NSA. Very well protected.
STEVE	What happened to you?
BISHOP	You should see the other guy. Bishop TOSSES Steve an object, goes back outside. Steve
STEVE	What's that?
BISHOP	This... is liquid Semtex with a built in combustible. Very volatile. Nice and shiny once it dries. But don't... scratch it. Bishop takes a knife, scratches the surface of the coin-sized
STEVE	So that's how we take him out?
BISHOP	No. That's just to focus the mind.
STEVE	You makes bombs to focus your mind.
BISHOP	What do you do? This one's different. They want it fast, and they don't want it to look like an accident. Someone wants to send a message.
STEVE	Like with my father.
BISHOP	Yes. Like that.
STEVE	Didn't think that was your style. First time for everything. Steve looks at Bishop. BOOM! Outside the explosion
STEVE	Jesus... Bishop puts a hand out.
BISHOP	There's something I haven't told you.
STEVE	What?
BISHOP	...I broke a rule. I brought you in without asking. So this hit, is a test. Of us, of our arrangement. If that man is breathing three days from now... then they'll need to make an example of us. Do you understand? Steve ... nods. Takes Bishop's hand who pulls him up.
STEVE	So what you're saying is you and I are stuck with each other.
BISHOP	I'm sorry.
STEVE	...For what?
BISHOP	For getting you into this --
STEVE	I knew what I was doing. Bishop considers, nods.
BISHOP	Get packed. Bishop steps back, lets Steve take the first look. Bishop
STEVE	...I count six... no seven at the main door. P.O.V. THROUGH THE TELESCOPE: The front entrance of the NSA
STEVE (CONT'D)	Jesus they've got US Marines in there. Two at the door, one... maybe another two out of sight. Bishop considers Steve, locked to the telescope, the sharp
BISHOP (O.S.)	Fifth floor, corner office. P.O.V. THROUGH THE TELESCOPE: Steve finds Dean, at his desk,
STEVE	... Alright, got him. He's at his desk. We could take the shot right from here.
BISHOP	Glass is three inches thick... Steve moves his hand to turn on the laser Bishop used before
BISHOP (CONT'D)	And has laser sensors. Steve laughs, suddenly walks away from the telescope. Bishop
STEVE	Alright, fine. What are we doing here? Who is this guy? P.O.V. THROUGH THE TELESCOPE: Dean shouts into the phone,
BISHOP	Starting to get it?
STEVE	Yeah, I'm getting that this isn't a job. It's just a really complicated... suicide. Bishop smiles. Steve moves off, restless.
STEVE	You know, you can front sonofabitch all you want, Bishop. You're scared, too. You don't really know how we're going to pull it off, do you? You ever think there's some things that just can't be done?
BISHOP	Everyone has a death --
STEVE	Really? Because, this guy? I look at this guy, I don't see his death. I see my death. And I don't particularly like the view. Bishop notes the lights going back on in Dean's office,
STEVE (CONT'D)	And you know, as much as I like the quality time, unless you can read lips, I don't exactly see what we're doing here... Steve glances at Bishop's pad where he's transcribing words:
STEVE (CONT'D)	You read lips. Bishop glances at Steve, puts his eye back to the camera. You any good with computers?
STEVE	Everybody out. I'm serious. Get the fuck off my property. A moment, then people start to flee. Only Louise, drink in
LOUISE	Steve, baby...? Steve levels the gun at her.
STEVE	You, too. Steve's hands fly. The images are pieced together, enlarged, Did you get it?
STEVE	It's the US Attorney's office in New York. He's running. He's trying to get out. Steve, trying to read Bishop's face, ZOOMING in.
STEVE (CONT'D)	Do you think we're hitting him because of what he's done, or because he's trying to get away with what he's done?
BISHOP (O.S.)	Does it make a difference?
STEVE	...No, I don't suppose it does. A beat. The two men, far separated.
BISHOP (O.S.)	Do the angles. Find us a shot. Security's going to have the actual street locked down. But there's a residential street, perpendicular.
STEVE (V.O.)	High-end people. They'll put up with a sweep, but they're not going to allow an agent to spend the day. They reach an address. Bishop puts on a hat, some
STEVE	Besides, the angle isn't right, too flat. Except when they hit the stairs. It'll spread the group vertically. It's... the shot. Steve and Bishop work in quiet efficient silence. Each opens Back in the living room, Bishop adds the last piece to the
DEAN (O.S.)	Look, I don't care. Find her, I need to talk to her right now...
STEVE	You ever worry about the right and wrong of it all? I'm not talking about God, just... Whatever you feel here. BISHOP'S P.O.V. THROUGH THE SCOPE: The US Attorney building.
BISHOP	It's a little late for --
STEVE	Come on. You're telling me you've never done anything just because it was the right thing to do, even if it didn't make any sense? You never took a chance like that? Bishop pulls his eye away from the scope a touch.
BISHOP	Once I did...
STEVE	How'd that work out for you? Beat. Then suddenly Bishop's view is obscured by a large
BISHOP	We have a problem... Bishop moves the scope, precisely looking for alternatives.
STEVE	There's no shot. What do we do? There's no shot. A moment more, and then Bishop MOVES. We travel with him, to
STEVE (CONT'D)	Bishop...? And Bishop's out.
BISHOP	On your four. You see him? Coming up, a MAN in a jogging suit stretches, touches his ear Steve and Bishop come abreast of him. WHAM! Steve pushes
BISHOP (CONT'D)	No. You're the shooter.
STEVE	When?
BISHOP	You'll know when. WITH THEM, MOVING, taking the corner onto the main street in Hey... Listen, I need you to go out of town for a few days. No, I know, but you have to trust me. Just go -- no, don't tell me where. Just go, okay. Okay? Yes, I'll call you soon, I gotta go... Bishop nods to Steve who heads up the stairs towards the A needle hits a record's surface. "Pleased to meet you, hope ON DEAN. Suddenly frozen. His handlers unsure what's going
DEAN	...Bishop? Bishop does NOTHING. Security reads Dean's fear, closes on
ACROSS THE STEPS	Bishop, for the moment forgotten by the security who have As he slams the shifter into REVERSE men line up in front,
BISHOP	Get in. Security are standing up, opening up, as Steve DIVES forward.
STEVE	Thanks.
BISHOP	Behind you. Steve has half a second to puzzle this one as the Driver Bishop raises the divider, steps on the gas. He notices a hand-held automatic weapon secured to the dash, IN THE REARVIEW: Bishop watches a pursuit car T-BONED by a Over his initial surprise, the Driver's trained, and good.
BISHOP	Get in front.
STEVE	Working on that...
BISHOP	Now! Bishop HAULS UP the E-Brake, putting the Limo into a SPIN. Bishop and Steve recover, roll out of the now exposed rear of
STEVE	We have got to go! Steve's pointing at the rear exit. It looks far away.
STEVE (CONT'D)	You go for it, I'll cover you. Bishop takes in the exit, the gun in Steve's hand...
BISHOP	I'm sorry I brought you into this.
STEVE	Not now, Bishop, we have to --
BISHOP	It was... It was the only thing I knew how to teach you. Steve looks at him oddly, moved. Then...
STEVE	Don't worry about it, Bishop. I brought myself into this. Bishop considers this, nods. And he's UP AND FIRING towards
BISHOP	Go! ON STEVE. Clear shot at Bishop. A micro-second hesitation, Behind them, SWAT and COPS give chase. UP AHEAD, a van skids to a halt, SWAT pouring out. Bishop TWO COP cars close from outside. Bishop raises his weapon, The SOUND of a cop, distant outside, CHAMBERING a round into Both men DIVE to the ground, roll even as they switch to
WITH THE COPS	Firing. Bullets find exposed legs and arms, men stumble back
STEVE AND BISHOP	Almost at the same exact moment, the men switch their aim
BISHOP	...Why?
STEVE	You don't know? Tense beat. Glimpsed through shattered windows, SWAT
STEVE (CONT'D)	Cover me. And with that Steve is RUNNING towards the outside... ... BEHIND STEVE, Bishop steps out, gun in each hand. Clean ON BISHOP. Angry like we've never seen him. Cold. Furious. Helicopters clatter above, bullets plink into dishware and
US ATTORNEY	...Something is wrong in this country. But today because of the actions of a few cowardly men, we may never know the true face of -- A voice announces boarding, drowning out the TV. Bishop WHAM! Bishop hits Steve with the fridge door, knocks the gun Bishop reels back against the wall as Steve picks up the gun
STEVE	You know, when they came to me... I said "Are you sure?" Bishop?" But They're right, aren't they?
STEVE	...You don't really like the work anymore. Bishop's voice comes from the darkness near the barn.
BISHOP	Maybe not. BLAM! BLAM! Steve SHOOTS as Bishop MOVES, finds cover.
STEVE	Yeah. That's... what did you call it? That's a prerequisite. Besides, I guess I had other reasons.
BISHOP	If it matters, today we killed the man who ordered the hit on your father.
STEVE	Yeah, but not the man who actually killed him. Steve advances, clearing the side of the barn, LINES his
BISHOP	Why'd you kill those other people?
STEVE	You really going moral high ground on me? Seriously? You might want to check your soapbox there, partner. BLAM! Steve fires just as Bishop SLIDES back, into the barn But that's the difference between us, isn't it? You're all alone, but you still... like people. You wish they liked you. Whereas I have people everywhere... and all I ever want, is to be alone. Steve hears BANGING coming from the barn.
STEVE (CONT'D)	There's no weapons in there, Bishop! I've... what did you teach me? I've controlled the situation. One hundred percent. BOOM! The barn door blast outwards as Bishop's vintage Steve squints and BOOOOOM! The propane tank ERUPTS in flame. When he rises, the interior of the car is an inferno. The Steve. Bleeding, bruised, victorious. INSIDE. Pictures bubble and peel before turning black in the Steve moves to his computer and punches in the password. Needle comes down, touches the record, the sweet sound of
BISHOP'S VOICE	...Steve, if you hear this, then it means you found the right moment to play the record. Good for you. It also means you had to scratch the needle across the surface of the record. Steve's eyes LOCK on the record player, the needle scratching Sorry it has to end this way. Steve's eyes dart to the portrait of Bishop. Its cold eyes
BISHOP (V.O.)	Every man has a death that's right for them. Every one. ... where a form, a heat shadow, has burnt into the charred
BISHOP (V.O.) (CONT'D)	A death so right that when it arrives, those who knew him will say "Yes, this is right..." The detective leans the body forward, and the shadow
BISHOP (V.O.)	"...This was always going to happen this way." Bishop gets out. Shaved, healthy, clean. He climbs onto the Freedom, laid out before him. He stares at it, wanting,
