CHARACTER	DIALOGUE
ROBIN	We have lost them. I'll lame this mare if I ask her to go any farther. gently extracts the shaft from his horse. Aslan opens watches, curious.
POV	the scope we see the movement on the hill behind
TO SCENE	
ASLAN	Here they come. Look. puts the device to his eye...
POV	soldiers are close!
TO SCENE	reacts in shock. Prepares to defend himself. Then ROBIN Is this Arab magic? ASLAN No. Arab science. replaces the tube in his pouch. ASLAN How did your uneducated kind ever take Jerusalem? ROBIN God knows!
ROBIN	We can lose them in the forest. DUNCAN Sherwood is haunted, Master. ROBIN Either we take our chances with the ghosts, or become ghosts ourselves. remounts. They race into the trees. Gisborne's men
ROBIN	They're not following.
GISBORNE	Come on, damn you! There are only three of them. SOLDIER It's not the men we fear, sir. HOWLING and RATTLING of bones. Aslan draws his
DUNCAN	Banshees. They say they fly in your mouth and suck you dry of blood before you can scream. wraps his scarf over his mouth. ROBIN Be quiet! Listen. GUSTS the trees in angry waves. Emits deathly ASLAN Allah protect us from the evil spirits. clings to his back. Robin points.
ROBIN	Behind you! slashes out, futilely. No, there! And there! flails. Robin cracks up.
ASLAN	Cease your mad laughing. I can feel them. reaches into the branches. Pulls out a string of
ROBIN	Here are your ghosts, Duncan. A child's toy put to good use. You scare easily, my painted Saladin. laughter is broken by a piercing YELL. A red- bushes are instantly alive. Shaggy, wild-eyed men,
WILL SCARLET	Ring around the rosie! ROBIN Aslan! makes no move to intervene. woodsmen eye the bizarre stranger, keeping their
WILL SCARLET	Atishoo, Atishoo. We all fall down. Beg for mercy, rich man.
ROBIN	I beg of no man. Which of you scum has guts enough to face me man to man? Yeah, bollocks, mate.
JOHN LITTLE	What are ya, m'old cock? ROBIN Er... Robin... pauses, checking the faces of the angry peasants.
ROBIN	...Hood. Robin Hood. Who are you? JOHN LITTLE John Little. Bestman o' the woods.
ROBIN	Bestman? You lead this rabble? WILL SCARLET We waste time. Tax him. ROBIN Tax? For what? WILL SCARLET For passage through Sherwood. ROBIN I will pay no tax. Besides, I have nothing but my cloak and my sword. WILL SCARLET A man who travels with two servants and claims he's without money, is either a fool or a liar. Robin, Little shakes him like a doll. Something
WILL SCARLET	And this one is a liar. Ahah! Gold! men cheer. John snatches the medallion back from ROBIN That is sacred to me. JOHN LITTLE Sacred to us too, mush. This here'll feed us for a bloomin' month. draws his sword. ROBIN You will have to fight me for it. JOHN LITTLE I'd love to, mate. grins hugely. A boy pushes his way through the throng.
WULF	Wait, father! I know him.
ROBIN	This man is your father? Tell him how I saved your hide from the Sheriff's soldiers. That deserves some gratitude, I believe. reaches for the medallion. John pulls it away.
JOHN LITTLE	Naw ya don't, laddie. WILL SCARLET You must be Robin of Locksley. The blackguard who abandoned us to Nottingham's plundering.
WULF	Be careful, Father. He fights like a demon. He walloped six o' Sheriff's men? JOHN LITTLE Is that so? grin. Licking his lips in anticipation, he ROBIN Aslan! WILL SCARLET Oh dear! The little rich boy is lost for words. Thanks for the taxes, Locksley. JOHN LITTLE And for the laughs. woodsmen find this hysterical. They disappear into
ROBIN	Son of an Arab whore! Once again your assistance was invaluable.
ASLAN	You seemed more in danger of losing your pride than your life. DUNCAN I recognized some of the voices. Many were from your father's farms. ASLAN Your avenging army, my friend. ROBIN That rabble?
ASLAN	All they need is a leader.
ROBIN	They have a leader. A very large one. ASLAN Defeat him and they will follow you. ROBIN Allah has taken your brains. DUNCAN I hear the voice of a spoiled child, Master Robin. I suggest you cease your brave talk of revenge and flee to the north. ROBIN You, too? You expect me to fight that behemoth? DUNCAN Your father would expect you to act like a man. large tree trunk spans a swift-flowing river. The ROBIN This is my bridge. No one crosses without paying tax. JOHN LITTLE Just bugger off, mate, huh? ROBIN If you wish to cross, it will cost you a gold medallion.
JOHN LITTLE	Ain't I hurt you a bloody nuff for one day? WILL SCARLET If he's in a hurry to end his mortal misery, help him.
ROBIN	You don't have the courage to face me again, John Little? Or should I call you 'Little John'? grabs a hefty, gnarled staff. Strides to the JOHN LITTLE Alright, m'old cock. You wanna nuther good wallopin'? confidence melting, Robin glances back at Duncan giant is off-balance. Robin follows up. Lands a staffs lock. It's strength against strength. scrambles back onto the bridge. John waits,
JOHN LITTLE	Lil' wet behind the ears, mate?
WILL SCARLET	Don't fool with him. Get him! comes at him again, pummeling. Wood splinters from
JOHN LITTLE	Swimmin' time again, ol' chum. coup de grace. Lands heavily. Robin teeters. JOHN LITTLE Bloomin' shame. 'E were a brave 'un. Robin arcs up out of the water. His hands clamp
JOHN LITTLE	Help! Cain't bloody swim. submerges again. Robin pulls his head above water. Do you yield? Do you yield? JOHN LITTLE Yes! ROBIN Good. Now put your feet down. struggles, then his feet hit bottom... The water JOHN LITTLE I'll be buggered.
ROBIN	Pay me the tax. tense pause while all wait for Little's reaction.
JOHN LITTLE	Robin Hood, ya got balls o' solid rock. hands Robin back the medallion. Chuckling loudly, he BONFIRE CRACKLES. The woodsmen drink, eat, argue, and
LITTLE JOHN	Mead. Made it m'self. ROBIN A fine brew, Little John. spits black objects from his mouth. Dead bees. John LITTLE JOHN Real honey. takes the jug back. Sneezes royally, spewing all over
ASLAN	With regrets, I decline. LITTLE JOHN An Englishman's mead not bleedin' good enough for ya?
ASLAN	On the contrary. I thank you, but my faith prevents me from partaking in such enjoyments.
LITTLE JOHN	Your bloody loss, mate. swigs. Passes the jug on to Duncan, who drinks LITTLE JOHN What is it, boy? Speak up!
WULF	I wanna thankee, Lord Locksley. I owes ya m'life.
ROBIN	You owe me nothing, Wulf. I am glad I chanced by in time to help. LITTLE JOHN C'mon, lad, drink! 'Twill put hair on your bloomin' chest. tries the brew. The impact is instant. He turns
ROBIN	Tell me about your men, John. points to a short fellow with the build of a tree LITTLE JOHN This stumpy one 'ere's David o' Doncaster. We calls 'im Bull.
ROBIN	How do you come by the name, Bull? BULL 'Cuz o' my size, Sire. ROBIN Because you are short?
BULL	Nay. 'Cuz I be so long.
ROBIN	No, Bull. Save it for the ladies. laughter. Robin turns to the next man at the
ROBIN	Your name, friend? man's bald pate blushes scarlet as he tries to LITTLE JOHN That be Hal Brownwell, but the lads call i'm Hal Hiccup. others make hiccup and belching sounds, and crack up
ROBIN	Hold! Hal, you have the face and hands of a farmer. I wager you are a strong and honest man, and I'd be glad to have you at my side in a fight. The next man who makes light of you will have to answer to me. is murmuring around the group, but no one elects How is it there are so many of you in hiding? LITTLE JOHN We're outlaws. Got prices on our 'eads, every man jack. Blasted Sheriff says we owes 'im taxes. ROBIN How do you fare?
LITTLE JOHN	We get by, I reckon. ROBIN While the Sheriff steals your land and your families starve?
LITTLE JOHN	What in bloody blazes'd ya have us do? ROBIN Your ghosts will only keep his men at bay so long, my friend. Soon the Sheriff will hunt you down and hang you. You must fight back. LITTLE JOHN We show as much as a toe outside the forest, they'll slaughter us like bleedin' sheep.
ROBIN	We must organize. Win by guile. LITTLE JOHN 'We'? Ya lookin' to join us, matie?
ROBIN	No. To lead you. WILL SCARLET Ha! I would never be led by the son of a Druid. ROBIN There are many here who knew my father to be a kind and generous man. I doubt that in their hearts they believe him capable of such a horror. of agreement from around the fire. Robin turns
ROBIN	What is your name, friend? WILL SCARLET Count me not a friend, Locksley.
LITTLE JOHN	Stuff a flippin' cork in it, Will. The man's our guest. gets up. Angrily pushes his way out of the group.
LITTLE JOHN	That there's Will Scarlet. Pay 'im no 'eed. 'E's full o' piss and wind.
ROBIN	He is right to distrust me. I am a rich man's son. I have done no honest labor. But today I am as poor as any of you. Nottingham has stolen all that I own. And when I killed Gisborne's men, I, too, became an outlaw. LITTLE JOHN Ya're full o'bloody wind an' all, mate. This 'ere load o' rubbish agin the Sheriff's bloomin' army? Ya must be bloody jokin'. ROBIN We can win. And I believe we will.
LITTLE JOHN	Ya're a daft bugger, Robin Hood, but ya're a brave 'un, I'll give ya that. Drink up, laddie, cuz tomorrow ya mayn't be so lucky! Tomorrow I shall best ya an' crack that blasted noble head in two. loudly, he throws back his head for a long ASLAN I have led you wrong. This is no army. These men live like dogs.
ROBIN	English dogs. They can learn. ASLAN Learn what? To build kennels? sullenly stalks away. Robin shakes his head. Aslan
ROBIN	Too much mead, old friend. What day is it? DUNCAN Sunday, I believe.
ROBIN	Good. Do they still give alms to the poor at the mass? DUNCAN They do. These days the need for mercy is greater than ever. ROBIN Then I must ask you a favor. taps his way through the crowd. Past the piercing GUARD Hey, you! keeps going. A hand clasps his shoulder. Spins
GUARD	Do I know you? gazes into space, trying to look blind. The Guard
GUARD	My God, you stink! ROBIN Pardon my blindness, sir. I'm always falling down.
GUARD	Yeech! Get away from me. BISHOP We beseech thy blessing, Lord, on all your people, but most especially on our noble Lord Nottingham. Grant him the wisdom to guide and protect our glorious city. and Gisborne sit piously among the congrega- BISHOP Grant him also the strength to bring to justice the lawless men who threaten its safety. Help him to stamp out the curse of the dread Druids who would seize from us our children, even as wolves steal the lambs from their mothers. rear of the church. Standing crushed together, the sermon ends. As the nobles file out, the poor are
VARIOUS	1. Alms! 2. Have mercy, milady. 3. Pity, fine sir. 4. For my baby. 5. Etc. rich drop a few mites, sparking a mad scramble. ROBIN Alms for a blind man. For one who cannot see your beauty.
MARIAN	This is dangerous.
ROBIN	So you care for my safety? MARIAN No, for mine. I do not wish to be seen with an outlaw. ROBIN Under the Sheriff's law, that's a badge of pride. MARIAN He's put a price on your head.
ROBIN	How much?
MARIAN	A hundred gold pieces.
ROBIN	Is that all? I have not annoyed him enough. Soon he will offer ten thousand.
MARIAN	For ten thousand I would turn you in myself. Nottingham is mounting an army. ROBIN How do you know? He has rounded up every blacksmith in the county. He has them holed up in the castle making swords and armor. ROBIN What is he planning? MARIAN I don't know, but there's no limit to the man's ambitions. Go!
ROBIN	If you need me, I will be with the woodsmen. Send for me as 'Robin Hood.' MARIAN Robin! Do something for me. ROBIN What? MARIAN Take a bath. ROBIN Care to join me? a grin, he slips into the crowd as Nottingham
NOTTINGHAM	You shine like the sun, my lady. raises her hand, as he did the girl's in the castle. NOTTINGHAM You have been meeting with young Robin of Locksley. My cousin tells me the knave deprived you of some horses.
MARIAN	Yes. A most disagreeable experience. NOTTINGHAM I deeply regret it, and I promise you he will be brought to justice. For subjecting you to such treatment, I will hang him from the walls with his own entrails. gleam of insanity. Robin watches from a distance.
MARIAN	I would like to see that, my lord. Sheriff places his hand possessively on her shoulder.
NOTTINGHAM	My dear, a woman of your refinement is not safe living alone. If you would consent to bring your household within the city walls, I could give your needs my most personal attention.
MARIAN	I thank you, Lord Nottingham, from the heart, but for now I prefer to stay in my family's ancestral home. My cousin, King Richard, will be deeply moved to hear of your concern for my welfare. NOTTINGHAM Alas, the King has many enemies both abroad and at home. I fear for his safe return. MARIAN Fear not, my dear Sheriff. He will return. When he does, he will wish to reward his faithful subjects.
BEGGAR	Alms, my lord. makes to shove the man aside. With a swift
ROBIN	A hundred crowns, Sheriff? You insult me. starts to struggle. Robin draws blood.
ROBIN	Remember young Robin of Locksley, Sheriff? Meet Robin Hood. Your nemesis. Your avenging angel. NOTTINGHAM If you kill me, you will hang.
ROBIN	If I kill you, I will hang happy. NOTTINGHAM What do you want?
ROBIN	I want to give you a chance. A chance you do not deserve. A chance to right your wrongs. NOTTINGHAM I'm listening. ROBIN From this day forward you will cease to tax my people. You will renounce the charges against my father, and you will return his lands to me. NOTTINGHAM Why should I? ROBIN Because for every harm you do, I swear by God I shall visit on you threefold in return. NOTTINGHAM Empty words. ROBIN I am here with a blade at your throat. As long as I live, you will always know that I could be here again. YELL from across the church. Gisborne has spotted them. ROBIN Your answer? NOTTINGHAM Never, fool. ROBIN Then it will begin.. yells orders. Robin hurls Nottingham against spots the danger. She fakes being tripped and MARIAN Please excuse my clumsiness. charges for the city gate. As he passes, he kicks gather around as Robin dismounts, admiring the horse.
ROBIN	A personal loan from the Sheriff.
ASLAN	You should not have left without me, Englishman.
ROBIN	How so? You have not raised a finger to protect me. ASLAN Before I had a choice. ROBIN It was my choice to do this alone.
ASLAN	A foolish risk. If you had been killed, I would be cursed for eternity for failing to fulfil my pledge. ROBIN Aslan, if I didn't know better, I would swear you were worried about me. Sheriff maniacally spits out orders to Gisborne.
NOTTINGHAM	Starve them out. Slaughter their livestock. I want to see Locksley's own people fighting each other to bring him to us.
GISBORNE	I swear he will not live to see the next full moon. SQUEALING HOG is loaded onto a wagon. SOLDIERS round
FARMER	Go' bless ya, sir. Leave us the sow. She's with young 'uns. The next litter'll feed us through the winter.
SOLDIER	You've heard of Robin Hood? FARMER Yes, sir. Soldier brutally kicks the old man to the ground.
SOLDIER	Then pray he is brought to us before winter. trail of refugees. Women and children carry their runs to greet his mother and siblings. A contingent WILL SCARLET You brought this misery on us, Locksley. We can barely feed ourselves. LITTLE JOHN Sheriff hasn't left us a bloody pot to piss in. ROBIN Then we shall take from him and his rich friends.
WILL SCARLET	Brave talk, Locksley. I say we take the rich boy in. of general agreement.
ROBIN	Will, do you think the Sheriff will give everything back after I am gone? WILL SCARLET He will give us the reward, and our pardons.
ROBIN	Alright, Will. You can take me in on one condition. You must fight me. You may use the Sheriff's horse and arm yourself as you please. I will fight on foot. Unarmed. WILL SCARLET Unarmed?
ROBIN	If you lose, you will accept me as your leader. If you win, you may take me in. Dead or alive. WILL SCARLET Dead, Locksley. tighten a girth. Will confidently jokes with his
ASLAN	This man has true purpose. He means to kill you.
DUNCAN	And you have given him the means. WULF Will is ruthless, Robin. Guard your back.
ROBIN	I am grateful for your concern, friends, but I have to prove to them it is possible to overcome unequal odds. I am ready, Will. bends, as if checking the horse's legs. Secretly in, Will flings the sand in Robin's eyes. Robin sword slashes. Reacting to the sound, Robin rolls leaps to his feet and yells at the top of his
ROBIN	Come on, you little piss pot. Do your worst! grabs a spear from a bystander. Robin stands his
ROBIN	The horse is smarter than you are, Will. of the men laugh. Will is incensed. Robin ducks
ROBIN	Here, Will! You aim like a girl, Will! stabs wildly, more and more frustrated. Laughter Will strains and tries to kick Robin away. snatches the spear and raises it over his fallen
ROBIN	Thank the Lord you are not endowed like Bull. LITTLE JOHN Bollocks, Will. Jus' bugger off, eh? Will relents. With a defiant glance, he
LITTLE JOHN	Ya got us by the short and curlies, Robin Hood. Now let's hear what ya got to bleedin' say. scans the faces. He has their attention.
ROBIN	Nottingham has taken from us everything we own. Now we are going to start taking from him.
LITTLE JOHN	'Ow in bloody blazes are we gonna do that?
ROBIN	We are going to tax him. The forest is a mosaic of green, gold, orange,
ASLAN	Here they come.
ROBIN	How many?
ASLAN	Two wagons. Twenty escort.
ROBIN	Twenty? They usually have five. grabs the telescope.
POV	phalanx of mounted soldiers, a cart loaded with TO SCENE ROBIN This is no ordinary convoy. calls up from below, where a ragged group of woods-
BULL	'ow many?
ROBIN	Er, about ten. Why scare them? They can't count anyway. ASLAN And they call me the barbarian. ROBIN Let's go. they run down the hill, keeping low. WHISTLE in. The Friar yells and drops his jug. A mounted soldiers charge them. The woodsmen run into arrows fly. More soldiers fall. The others spin ON ROADWAY and Aslan swing down from the trees onto the tax John leaps onto the beer cart, sending the Friar races back to the road... the wagons are gone. climbs onto the tax wagon's roof. Angry shouts
ROBIN	Surrender your weapons. I give you my word you shall go free. answer, a swordblade jabs up through the roof, near
ROBIN	Ah, I feared as much. signals to Aslan, who steers the tax wagon into the bowmen scramble out. What they see stops them dead. An axe pounds into the lock of a strongbox. The
LITTLE JOHN	I'll be buggered.
ROBIN	This treasure had a purpose. We must find out what. turns at the sound of a brawl from the Friar's cart.
ROBIN	Get off him. He's a man of the cloth. drags the men off. The Friar clambers to his feet. FRIAR The Lord's blessing on you, kind sir. These sinners were attempting to steal these libations destined for the monks of St. Catherine's. indicates his cargo of barrels. ROBIN It appears to me, Reverend Friar, that many of the libations have found their way into your own esteemed person. him, the Friar mounts the cart.
FRIAR	A thousand pardons, sir, but duty beckons. I must hasten on.
ROBIN	A moment, my reverend friend. You travel with poor company when you travel with Nottingham's soldiers.
BULL	Aye, tax him. sparks a chorus of comments.
ROBIN	My men are thirsty and have much to celebrate.
FRIAR	Lord bless me, sir, are these your men? I had mistook them for common thieves. Kindly step aside. ROBIN Surely the Lord has the charity to spare a few barrels to good Christian men. Friar relents, loosening his grip on the reins.
FRIAR	Well, sir, if you wish them to share in the good Lord's brew... reaching under the seat, he pulls out a club.
FRIAR	... you must best me for it. staggers. The Friar whips up the horse. Dazed, FRIAR Giddyup, nag! Friar's horse, as obese as his driver, slowly raises
ROBIN	You leave when I say. to his feet, the Friar glances skyward.
FRIAR	Protect me, Lord. sweeps his foot, knocking Robin's legs out from under
FRIAR	Yield! bounces on Robin's stomach. Robin can barely breathe. FRIAR Confess that Friar Tuck is a better, holier, and braver man than thou art, knave.
ROBIN	Never! Whoomf!
FRIAR	Yield, I say! Yield to Friar Tuck. Robin bites the Friar's leg. Tuck howls. ROBIN Yield yourself! dives onto the Friar and hammers his head into the ROBIN Yield to Robin Hood. holds up a hand in surrender. Robin eases off.
FRIAR	Thank you, Lord, for teaching me humility. ROBIN Well, Friar Tuck. We have need of an honest man of God, to minister to these men and their families. What do you say?
FRIAR	I'd rather roast in hell. punches Robin in the gut.
TUCK	into the traces, pulls the beer cart. Sweating
ROBIN	Giddyup, Friar. ROBIN What do you say now, Tuck? Here are the meek of the earth. surveys the hopeful, hungry faces. The little FRIAR The Lord moves in mysterious ways. I accept. ROBIN You will not regret it.
FRIAR	Aye, but you may. blazing fire. Deer carcasses roast. Tuck's barrels
ROBIN	Buy yourself a new son, Stephen.
FARMER	Thankee, Robin. John and Bull approach. John indicates the two LITTLE JOHN Cain't get a bleedin' squeak outa 'em, Rob. BULL They'd be spittin' it out good if they'd knowed anythin'. LITTLE JOHN Reckon the Cap'n knows summat, Rob, but stubborn ol' cocker 'e is. ASLAN Perhaps it is time for some heathen persuasion.
OF SOLDIERS	up at Robin defiantly.
CAPTAIN	Spare your breath. I know nothing.
ROBIN	I believe you. But this Arab here, he's got it into his barbarian brain that you know a whole lot more than nothing. And when he gets like this, he's very hard to reason with. a hair-raising war cry, Aslan leaps INTO VIEW. ROBIN I strongly advise you to talk. He hasn't eaten in weeks.
CAPTAIN	What does he want? ROBIN You.
CAPTAIN	For Godsakes, get him off me! ROBIN No, Aslan... not this one, Aslan. ... How about this other one?... Fatter, yes... more meat. other soldier, who definitely has more flesh on the
LITTLE JOHN	No, Robin, no! They be God-fearin' men.
ROBIN	I cannot stop him, John. Besides, if they will not tell what they know, then they must pay the price. LITTLE JOHN Kill 'em aye, but not like this. 'Tain't Christian. SCREAMS from behind the wagon where Aslan demented Arab slowly reappears. Blood drips from his CAPTAIN What does he say?
ROBIN	Well, roughly, he says that he doesn't care for the way your friend tastes, and he wants you.
CAPTAIN	No, God, no! I'll talk. Just keep him away. Keep him away!
WAGON	holds the other prisoner, muffling the man's mouth walls shake with Little John's laughter. LITTLE JOHN Sure changed the color of 'is britches, didn't 'e? ROBIN Thanks to our cannibal friend. repeats his wildman act, munching on a chunk of LITTLE JOHN Gonna laugh my bloody balls off. BULL Why'd the Sheriff be sendin' gold north o' the border? ROBIN To hire mercenaries. The Celts are savage tribesmen, trained to kill from birth. LITTLE JOHN Aye, the Romans built a bleedin' great wall to keep 'em out. BULL What does 'e want wi 'em? ROBIN Since he also has every Smith in the country working in his castle, we can assume he is planning a little war. LITTLE JOHN Agin' who?
ASLAN	England. Smoke. Sweat. The Sheriff inspects his weapon DOOR CRASHES open behind him. FOOTSTEPS. Paying no GISBORNE We were ambushed. In Sherwood Forest. tests the sword against an anvil.
NOTTINGHAM	Spanish steel, cousin. So much stronger than our native blades. Any losses?
GISBORNE	All the men are gone. NOTTINGHAM Yet again you are the sole survivor, cousin? Interesting. And the gold? GISBORNE Well, it er... disappeared. Sheriff looks at Gisborne for the first time.
NOTTINGHAM	Robin Hood? GISBORNE They were woodsmen, dressed in green. NOTTINGHAM Robin Hood. places a hand reassuringly on his cousin's shoulder.
NOTTINGHAM	Cousin, we must be strong. We cannot allow this outlaw to make fools of us. warning, he drives the blade into Gisborne's NOTTINGHAM And I cannot allow a lieutenant to fail me. It is indeed fine steel. small procession. Tuck drives his cart, Bull the tax
FRIAR	God bless you, sir.
VILLAGER	An' Go' bless Robin 'Ood, friar. They says as 'ow none o' the Sheriff's cronies dare go within miles o' Sherwood for fear o' havin' their pockets pinched. FRIAR Ah, the good Lord giveth and the good Lord taketh away. OLD WOMAN Unless Robin Hood takes it first! The procession passes two of the Sheriff's
FRIAR	Good morrow, brothers. sparkling with sunlight. Bursts, as Robin dives MARIAN How dare you!
ROBIN	Good morning, Lady Marian. response, she starts pelting him with stones.
MARIAN	You send men to drag me from my home in the middle of the night, like some slave girl? Is this the way the famous Robin Hood treats a lady?
ROBIN	Ah well... er, let me finish this bath you wished me to take. Then I'll explain. MARIAN I demand an explanation right now!
ROBIN	If you will be patient, I could spare your propriety by... MARIAN I will decide when my propriety is compromised.
ROBIN	As you wish. wades bare-ass naked out of the water towards her. MARIAN How dare you expose yourself to me?! slugs him. Robin stumbles backwards into the water. BULL The big 'un did the same to me. arrow flies into a bull's-eye, crudely marked on a LITTLE JOHN Right m'lad. Let's see how close you can git to that bugger. takes aim. His arrow slices clear through his LITTLE JOHN Take a gander at this 'un, mates. Never seen nuthin' like it in my bloomin' life. MARIAN This better be damned important. leads her into a hut. Inside is a trove of cap- ROBIN Nottingham robs the poor. We rob Nottingham and give back to the poor.
