CHARACTER	DIALOGUE
FANNY	'Bout time, ya gurt lug. wrenches the longbow from his back, fumbles for an FANNY We be too late. scaffold is impregnable. Celts and their Chieftain executioner encircles Wulf's neck with the noose. hand tightens the noose... Another grasps an arrow. Chieftain stands, impassive. close on a bowstring... the fuse-cord burns. executioner falls. Little John celebrates... but figure leaps onto the platform... the wounded soldier dangles, strangling. His hands wrench at the burning fuse-cord reaches the barrel. Tuck hurls the Chieftain smites at Robin... his blow is blocked... The GUNPOWDER in the barrel EXPLODES. Spewing the smoke... Robin's sword slashes through Wulf's HAL Here... By God... Let's fight 'em! WOODSMAN Hal! What happened to your stutter?
HAL	It's gg... ggg... g..oh crap! guard attacks, Hal fells him.
HAL	Take that, ya mug. stutter this time! The woodsmen join battle with the Chieftain cudgels his Celt attacker across the head.
CHIEFTAIN	Impostor! You dishonor the clan. retreats, fending off the Chieftain's shattering
PARAPET	and Fanny peer down as the smoke clears. They watch
LITTLE JOHN	Fight fair... aims. Grits his teeth... picks off the Celt with a LITTLE JOHN ...Or don't fight at all.
SCENE	leaps and swings from gallows to gallows, kicking battles the Sheriff. A reprise of his own fight and the Chieftain are locked in mortal combat. Greybeard Baron spots Little John and Fanny on the
GREYBEARD BARON	Up there! No mercy, shoot them! on the opposite parapet fire. Bolts ricochet
SCENE	evades the charging Chieftain. Drop-kicks a Sheriff rears his horse... hooves flail.. knocking WILL SCARLET Pain or death, you butcher? Sheriff's men drag Will off before he can choke him.
NOTTINGHAM	Here's another message to Robin Hood, written in your blood. drives his sword repeatedly, insanely, into Will's WILL SCARLET It's over, fool. You can kill my body, but you cannot kill our spirit. finally drops... Nottingham heads for the castle. REDHEAD BARON It's Hood! Get him! Chieftain knocks Aslan down. Aslan loses his sword.
CHIEFTAIN	I am iron. I am rock. I am your death. spots one of John's arrows protruding from a dead
ASLAN	You talk too much! leaps... rams the arrow through the Chieftain's
ASLAN	Englishmen! I am not one of you, yet I fight for you. Against a tyrant. Join me now. Join Robin Hood. onlookers are inspired. Grabbing weapons from fallen runs through the castle gate. Angry peasants NOTTINGHAM Lower the portcullis! Now! guard winds down the giant gate. Nottingham hurls him NOTTINGHAM Too slow, fool! hacks at the ropes. The gate slices down like a
ROBIN	Friends! We must raise the gate. bolts fly. Little John ducks and weaves, while
LITTLE JOHN	Come on, ya ckicken-'earted buggers. Ya milksops, ya bleedin' pansies. can't shoot fast enough. As they descend on him, he LITTLE JOHN Excuse me, m 'old cock. Ya mind if I borrow this? backed up against a battlement, outnumbered five to and the others try in vain to lift the portcullis. Sheriff marches through, issuing orders.
NOTTINGHAM	Seal the entrance. Guard it with your lives. ... Bring the bishop to my chapel. by flickering candles, Marian sits before a
NOTTINGHAM	Come! It is time for the union. guards roughly haul Marian to her feet. She is Christian, now blasphemously transformed to the
BISHOP	They are rebelling. We must escape.
NOTTINGHAM	Marry us. When I am declared king, that rabble will not dare go against us. BISHOP Is is madness to delay. screams and slashes her talons across the
MORTIANNA	Face them, or face me. leaps onto Tuck's cart.
ROBIN	Light all the barrels, Tuck. snaps the reins, steering the rumbling cart across
ROBIN	Jump! jumps. Robin steers the wagon at the gate. At the of the smoke, Robin rides the old nag like a charger. is chased into the kitchens by a vengeful soldier. and the others battle against huge odds. More ASLAN For Allah!... For Jehovah! For brotherhood!... For justice! door SLAMS back. Robin bursts through. Alone, against corridors, searching. Soldiers and armed servants ROBIN Where is she? Where is Lady Marian? man refuses to speak. Robin looks up the corridor, Ah! There is my answer. hurls the man aside... The armed guards charge him. a flaming torch, Tuck runs down the dark passage-
FRIAR	My son, there is a holy war being waged outside. Release all these wretches and God shall surely find you a place in heaven. JAILER I'd rather go to hell! Tuck takes the lethal cudgel full in the chest. fearful, the Bishop rushes through the service.
BISHOP	...your bodies to be bound in immortal wedlock. Do you, Marian Dubois, take... chapel DOORS SHATTER inward. backs in, bloodied, fencing with four remaining ROBIN Marian, run! It's me, Robin. Run! remains immobile. Mortianna moves to her side.
ROBIN	I warned you, I would find you no matter what.
NOTTINGHAM	No companions? No army? You rush to your death for the sake of a woman. Lust has turned you into a fool... Recognize this, Locksley? raises his sword to reveal its handle. A crucifix
NOTTINGHAM	Appropriate I should use it to kill you with, don't you think? lunges. A savage, accomplished swordsman, with fire picks himself up from the floor. The jailer is FRIAR The Lord helps those who help themselves. he pulls open his robes, revealing chest armor
FRIAR	Give my regards to the devil. KEG ERUPTS, blowing the jailer through a wall. is in deep trouble, but undaunted. LITTLE JOHN Ya gutless bloody sissies. attacks his assailants from the rear. The tide
LITTLE JOHN	Wulf! I told ya to keep outa the fightin'.
WULF	Sorry, Father. Couldn't help myself.
LITTLE JOHN	Well, ya'll get a bloody good wallopin' if we get 'ome... For now, let's see how well I taught ya. sends an attacker plummeting off the parapet.
HAL	No! Fight on. Fight! sees a familiar pair of holy sandals marching towards
FRIAR	Sinners, beware! God's avengers are at hand. Hal manages a weak smile.
HAL	Go' bless ya, Tuck. FRIAR Repent, heathen! man spins to strike back... freezes... grinning... chef raises his knife. Fanny appeals to the whole FANNY Listen! Outside, your countrymen rise against the Sheriff. Is there one man or woman here who does not hate him? Who has not suffered at his hand? Turn that on the Sheriff and his bullies. deadly pause. A woman cook dumps the giant wedding slashes maniacally. Robin is cornered,
NOTTINGHAM	You should have stayed away, Locksley. Fools like you never learn. blow slices Robin's arm. His sword flies from his
ASLAN	Ali akbar! FRIAR Amen! MORTIANNA Agh... the painted one! glances over... a split-second opportunity!... swords in each hand, Aslan attacks the other Bishop makes his escape. Tuck blocks his path.
FRIAR	So! You sold your soul to the devil? No, I swear it, in God's name. FRIAR Blasphemer! You accuse innocent men of Druid worship while you practice the black arts yourself. Bishop surreptitiously draws a dagger from his robes.
ROBIN	Watch out! spins... too late. Screeching, Mortianna drives uses Robin's distraction to regain his sword. Bishop, concealed dagger in hand, approaches Tuck.
BISHOP	I am sure you would not strike a man of the cloth. FRIAR Think again! an eyeblink's pause, Tuck punches the Bishop so hauls Marian against the battlements. Peers
ASLAN	What you fear is not below. charges at her with the bloody spear. She screams talons groping at his face, Aslan strains to the raised, Nottingham has Robin backed against the NOTTINGHAM What can your puny God do for you now? blade comes whirring down... clang! It's blocked.
ROBIN	This is for my father. grabs Marian, pulling her back. Carefully lifts
MARIAN	Let me go! Who are you?
ROBIN	I'm your sworn protector. Any way I see fit. emerges from the castle. Draped over his shoulder, leaps to her feet, yelling. Slips and tumbles back. MARIAN Robin? Oh God, is that you? stumbles out of the fountain... and storms at him, MARIAN How dare you?! grins at the crowd.
ROBIN	I think she's feeling better. looks about her... the chaotic aftermath of John arrives, his huge arms enfolding Wulf and LITTLE JOHN We done it, mate. We clobbered the buggers.
FANNY	Are you 'urt? ROBIN It will mend. spots a group kneeling beside the fallen body of
ROBIN	Aslan, my friend.
ASLAN	I'm going home the easy way, Robin. FRIAR You die on me, you son of satan, and I swear I'll bury you as a Christian in St. Catherine's Cathedral with a thousand monks chanting prayers for your miserable soul. You hear me?
ASLAN	I have no strength, Brother Tuck. FRIAR A fine friend you are! By the grace of Allah and Jehovah we have won the day, and you want to give up the ghost. I'll pickle your remains in mead, lay you in your grave with a pig for a companion, and mark it with a cross as big as this castle. ASLAN Please! It hurts when I laugh. FRIAR See. There's life in the heathen dog yet. ROBIN Here, Tuck. Look after him. You deserve each other. stands, Marian joins him. Around them cheering CROWD Robin Hood! Robin Hood! VOICE ECHOES from the vaulted roof. A wedding is in By the power vested in me by God's holy church, I now pronounce you husband and wife. is performing the ceremony before the happy couple.
FRIAR	You may kiss the bride. husband draws back the bride's veil. Robin and
FRIAR	Hurry. We waste good celebration time. break the embrace, turn to the congregation and KING RICHARD May I kiss the bride? ROBIN Who would dare refuse his king's request?
KING RICHARD	You look radiant, cousin.
ROBIN	We are deeply honored by Your Majesty's presence. KING RICHARD It is I who am honored, Lord Locksley. Thanks to you I still have a throne. continue down the aisle, past the smiling congre-
ASLAN	My friend, a word of advice... Ride her better than your horse. laughs. BELLS PEAL. Robin and Marian step out into the
