CHARACTER	DIALOGUE
You dated me and you broke my heart but	after you I met the right guy. I've been married thirty-seven years, have four kids, eight grandkids and a ninth on the way. now fully turns in her direction, totally clueless. Did we. ever...? looks at her hard but still doesn't remember her. decade? You took me to Shea Stadium. liked you. Sandra. ..Cook. We did. We saw The Beatles together. How the hell have you been? What happened to you? going out, I went back to school, got my doctorate in marine biology, went around the world a few times, met the man of my dreams at Oxford, married him, we lived in London for 25 years. I wrote and taught, we raised 3 sons and a daughter. I've just finished my ninth book and now I'm training for my first marathon. Now, I must confess, I actually remember the very last thing you ever said to me. You walked me to my door, I was tearful and you looked at me with those puppy dog eyes and said, "Honey, I just don't know how to be a boyfriend." Now, tell me, what have you been up to since 1964? Harry's face, we HEAR the SOUND of a SIREN BLARING. minutes of severe chest pain, nausea, shortness of breath, blood pressure's gotta be 170 over 100. Give me the nitrate, I didn't take viagra. Plug me in to the EKG, I need an aspirin, I'm taking 2 beta blockers, blood thinner, Lipitor, Procardia and if I were you, I'd be pounding my chest. Ow!
Mr. Langer, your diagnosis although	fascinating, was entirely incorrect.
Your realize a severe anxiety attack can	masquerade as a heart attack. I'm not taking pills for. every week, I suggest you do whatever it takes to decompress. Try something with me, okay? Close your eyes...now give yourself a visual image of something that gives you a feeling of peace and serenity. hear the SOUND OF LAPPING WATER, SEA GULLS. . . . see, feel, taste... ..miles of soft beach.. . as Harry keeps listing things, Camera MOVES IN ON HIM as AMERA CONTINUES DOWN to street level. Couples walk by, downstairs. So great to see you. hi and tell you I'm sorry if I ever did anything to you that wasn't on the up and up or... know what you've done to yourself but you look absolutely radiant. have something to do with it. HARRY,
My husband, hold on, he really wants to	meet you. Danny... Solid Citizen of a Guy joins Marin, loosened tie, I've heard so much about you... Mom does, she always says she made you up. make it, does he?
He basically dies at the end of the	second act, but it's very funny.
Was hopin' she'd give me a	reprieve, but... is stumped by this little visit. Harry heads toward the HARRY Really good. Up to her old tricks. Italian, remodeling her apartment in the city. would that go over? Only one way to find out, except she's out of town right now. her birthday. But she'll be back next week... Elevator arrives. Harry salutes his goodbye and steps HARRY I knew you'd be here. Erica.
You mean we're not bumping into	each other..? You came here to see me? I'm aware it was a bold move, one of those impulses that grabs you,' but...so far, we're okay; right? takes off his coat and scarf, hangs them on a hook.
You want a glass of wine or	something? hello. is sure where to go. Cheek? Lips? He lands on her know each other we should go to Paris for our birthdays, well, we still know each other..". heard from you in six months. HARRY about you. There's a lot I have to say. First thing is... I'm not mad at you anymore. anymore either. the way to France and everything. And... Happy Birthday. Thank you.
And congratulations on your amazing	success... maybe I'd hear from you when it opened. Where've you been? afternoon, I had another "episode... dying and the doctor in the ER said I needed to decompress. So I did. I walked out of there and changed my life, sold most of my businesses, packed my bags and moved to an island in the Caribbean. time? In the Caribbean? HARRY (V.O. occurred to me that wasting away on an island in the Caribbean wasn't going to remotely cure what was ailing me. sits straight up into CAMERA. pilgrimage...into my past. ENTERS THE CLOSET, reaches onto a top shelf ,and starts and visited all the women I've dated... blows dust off of the books. got so screwed up. reels backwards from one Hefty Mama. soul.
My losing streak finally ended when	I got one to open up to me. a HOSPITAL ROOM, an Older Woman on life support, scrawls
Hearing what they had to say was no	picnic. an Upper West Side COFFEE SHOP, Harry pas coffee Then I listened harder. WALKS down THE STREET with a ANOTHER WOMAN in her was, I was actually giving closure to generations of women. the corner, the Woman hugs Harry goodbye. give, no matter what I did. . .
When you hear the same story about	yourself over and over, your life begins to make sense and the future becomes your only salvation.
It took me six months to find them	all. I visited 18 different states but I came the furthest to see you. HAND lands on his shoulder and he HEARS: looks up and sees handsome young Julian in a beret.
Me either.	stands. The two Men hug, then Julian squeezes in next I was so engrossed in your story. I guess I should've seen your play, then I would've Jknown how this ended. you doing over here, man? in January... wonderful. that's somethin'... in the city, this woman is impossible to buy for... But I think I finally found the right gift. puts what can only be a RING BOX on the table between kisses her. Harry watches, dying. I'll open it later... rises, reaches for his coat. two celebrate... brought us together tonight. lights a cigarette. smoke? will kill you anyway... can not hold her liquor. puts his arm around her, pulls her close.
Me too.	Guys exchange looks. is where I'd write, 'an awkward moment' . I'd be dead. laughs. Waiter drops the check on the table. Harry takes it. party. At least let me buy you dinner on your birthday... What time does that say? I have no idea... Wait,' I have my. . . Me too... each take out EACH OTHER'S GLASSES and put them on.
You think you look so handsome in	mine? for those? hands Erica her glasses. She hesitates. He snaps, Once again...closure. New York. What do they do around here for fun? Want to dance? gestures for Julian to have the first dance. Julian - THE TABLE At the end of the day, I'm nothin' but a sap, a stupid old sap, standing on a bridge in Paris, crying my eyes out. stops, looks at the mighty city surrounding him. Beauty's Look who gets to be the girl. wipes his eyes on his coat sleeve as SNOW begins to fall. Anything else... . turns and sees Erica standing by a Cab with its motor ERICA He said when he saw me with you, he knew I was still in love with you. What do you have to say about that? made. you, have always felt for you, was something I didn't understand, like a language I didn't speak... It scared me so I did what I do. I snuck away. Turns out the heart attack was easy to get over. You were somethin' else. And when I went to see all those women, I found out I was never really present for any of them. And something inside me at some point, had just...shut off. That's when I think my heart gave out and you saved me. I finally get what it's all about. I'm 63 years old and I am in love for the first time in my life. And that's what I came here to say. only got another 30-40 years in me. Tops. But how 'bout we figure out a way to make this work. Barge drifts back under the bridge, La Vie En Rose piping half. Maitre'D snaps to attention and leads Harry, Erica,
