CHARACTER	DIALOGUE
TO	Mal walks out into the cargo bay, Inara following, over:
SIMON	We'll get off. River and I'll get off at Haven and find some --
KAYLEE	Nobody's saying that.
WASH	Nobody besides Jayne is saying that.
INARA	Mal. I got no answers for you, Inara. I got no rudder. Wind blows 40 northerly, I go north. That's who I am. Maybe that ain't a man to lead but they have to follow so you wanna tear me down do it inside your own mind.
INARA	I'm not trying to tear you down --
MAL	But you fog things up. You always have -- you spin me about. I wish like hell you was elsewhere.
INARA	I was. No trouble now, little crazy person... we're going for a nice
I	shuttle ride -- He opens the door and she is on him in an instant, whip blow
MAL	The other way! Find her and-do not engage! Everyone piles out the other way. Simon remains, to look in ANGLE: SIMON'S POV: There is Jayne, not moving -- and River He starts, then waits as she opens the door. It's gonna be oka -- She elbows his throat viciously. He drops to his knees,
ZOE	She's sealed off the bridge. I do not like her there.
KAYLEE	Cap'n! She tosses him a bolt remover. He starts pulling a bolt out
MAL	Check the shuttles. She coulda 40 snuck in. He pops the panel off and starts wriggling in among the wires. He enters to find River frantically punching up coordinates
MAL	The government's man, he says you're a danger to us. Not worth helping. Is he right? Are you anything but a weapon? I've staked my crew's life on the a - person-,-- - actual and whole, and if I'm wrong you'd best shoot me now. Or we could talk more...
RIVER	Miranda. WIt's a planet. Matches the one from her dream.
KAYLEE	How can it be there's a whole planet called Miranda and none of us knowed that?
MAL	Because there isn't one. It's a blackrock. Uninhabitable. Terraforming didn't hold, or somesuch. Few settlers died.
RIVER	I had to show them. I didn't know if you were going to make me sleep.
SIMON	You could've asked...
KAYLEE	Wait a tick, yeah! Some ten years back, before the war. There was call for workers to settle on Miranda, my daddy talked about going. I should've recalled...
WASH	But there's nothing about it on the Cortex -- History, Astronomy... it's not in there.
MAL	Half of writing history is hiding the truth. There's something on this rock the Alliance doesn't want known.
INARA	That's right at the edge of the Burnham Quadrant, right? Furthest planet out. It's not that far from here... Whoah, no, no --
ZOE	That's a bad notion --
WASH	Honey...
ZOE	I got it, baby.
WASH	Show them the bad... She hits some commands on the screen, pulls back to reveal a
ZOE	This is us, see? And here's Miranda. All along here, this dead space in between, that's Reaver territory.
WASH	They just float out there, sending out raiding parties --
ZOE	Maybe a hundred ships. And more every year. You go through that you're signing up to be a banquet.
WASH	I'm on board with the run and hide scenario -- and we are just about... He looks at his monitors, looks ahead... I s It is a world of fire. Every building burns, some blown right apart. Bodies litter Kaylee heads for the burning church.
KAYLEE	Shepherd? Shepherd Book! She stops, looking at the ground by the steeple. There is
4 MAL	Get the Doc. He moves to the Shepherd, grabs his searching hand. Shepherd... Don't move.
BOOK	Won't go far...
MAL	Shouldn't've been you. I'm so sorry, it was... they should've hit us. They should've hit me.
BOOK	That crossed my mind. I shot him down --
MAL	I seen.
BOOK	I killed the ship... that killed us. Not... very Christian of me.
MAL	You did what's right.
BOOK	Coming from you, that means... almost nothing... HNAAH! Ah, I'm long gone...
MAL	Doc'll bring you round. I look to be bored by many more sermons 'fore you slip -- don't move --
BOOK	Can't... order me around, boy. I'm not one of your crew.
MAL	Yes you are. Book coughs up blood, grabbing Mal. Urgent, almost angry.
BOOK	You... it's on you now... all this death, this shit... you have to find a course. This can't mean nothing. River... you have to...
MAL	Come on, keep it up -- Book grabs Mal's face, talks as though replying to something:
BOOK	I don't care what you believe! Just... believe it. Whatever you have to... His breathing becomes laboured. Hitched. Jayne and Simon run up,Simon slowing down -- going to the them as Jayne looks around him, Mal still fixed on Book.
JAYNE	How come they ain't waiting? They know'd we was coming, how come they only sent one?
MO	Zoe realizes the answer, turns to Wash.
ZOE	Get on the Cortex. Wave the Sanchez brothers, Li Shen -- anyone whose ever sheltered us after a heist. Tell them to get out. Get out now.
Silence.	Every Cortex screen is on, each looking at a different place. Mal stands alone amidst the screens, saying nothing. After
THE OPERATIVE	V0 I'm sorry. But I cannot let you hide and I cannot let you run. Things become... extreme. And we wish for another way.
MAL	Don't talk at me like a righteous man. You are a killer of children.
THE OPERATIVE	When God wanted Pharaoh to release His people from bondage -- you know the story? He didn't ask. He sent his plagues down upon Egypt. That's me, Captain. The path to peace is paved with corpses. It's always been so.
MAL	So me and mine got to lie down and
R--BETTER-	world?
THE OPERATIVE	I'm not going to live there. How could you think -- there's no place for me there, any more than 40 there is for you. Malcolm, I'm a monster. What I do is evil, I've no illusions about it. But it must be done.
MAL	Why? Do you know why?
THE OPERATIVE	It's not my place to ask.
MAL	You will never see River Tam. I'm telling you this.
THE OPERATIVE	Maybe not. But you'll keep her close now, and when I blow Serenity out of the air, this will be ended. You're so terribly out of your depth, Captain. Your old boat can't take the pressure.
MAL	She ain't buckled yet. And the 40 only reason you're talking such a lot is you can't get a fix on us.
THE OPERATIVE	Yes, your scrambler's code is too old for our seekers. You love that, yes? The small triumph over modernity. You really are the noble savage.
MAL	Nobody -- ever -- calls me noble.
THE OPERATIVE	But that's what's going to kill you, Malcolm. Nobility. It confuses your text, which is self-interest. And sin.
MAL	Only- many-I-know-who still --bel i-eved- in sin just died by your hand.
THE OPERATIVE	What do you believe in?
MAL	Not a solitary thing.
THE OPERATIVE	If that were true, you'd be nothing more than a Reaver. Something changes in Mal's expression. But then, maybe you're not that far from -- Mal flicks a switch and every screen goes dark.
MAL	Get these bodies together.
ZOE	We got time for gravedigging?
MAL	Zoe, you and Simon are gonna rope V0 'em together. Five or six of 'em. I want them laid out on the nose of our ship.
SIMON	Are you insane?
KAYLEE	What do you mean, the bodies...
MAL	Kaylee, I need you to muck the reactor core, just enough to leave a trail and make it read like we're flying without containment, not enough to fry us.
KAYLEE	These people are our friends --
MAL	Kaylee, you got a day's work to do and two hours to do it. Jayne, you and Wash hoist up that cannon mount. Goes right on top.
MOO	Piece or two of the other ship, stick it on. Any place you can tear hull without inner breach, do that too. And we're gonna need paint. We're gonna need red paint.
INARA	Sir. Do you really mean to turn our home into an abomination so we can make a suicidal attempt at passing through Reaver space?
MAL	I mean to live. I mean for us to live. The Alliance won't have that, so we go where they won't follow.
JAYNE	V0 God's balls, there's no way we're going out there! And everybody (save River) is talking at once:
SIMON	What's the point of living if you sink to the level of a savage -- Please, we should talk this over --
JAYNE	I ain't takin' orders from a man has lost his brainstem -- , -Mal pule-s-his- in his face, steps back, hand on his.
MAL	This is how it works. Anybody doesn't wanna fly with me anymore, this is your port of harbour. There's a lot of fine ways to die. I'm not waiting for the Alliance to choose mine. He walks through the group, toward the smashed cockpit of the I mean to confound those killers, and take my shot at getting to Miranda, maybe finding out what all I'm dying for. That's my theme now. So I hear a word out of any of you that ain't helping me out or taking your leave I will fucking shoot you. He grabs a body -- drops it at Zoe's feet as he heads toward Get to work. We arm past them to the windows of the bridge, looking in at �Mo
INARA	Mal. He looks up: she's in the corner looking through that trunk
MAL	Didn't see you.
I NARA	I figured that.
MAL	Anything of use in there?
INARA	Maybe. She puts it down and crosses to the bed. He sits by her.
MAL	You don't have to stay in the shuttle, you know. There's empty rooms, if you wanna sleep awhile.
INARA	You think anyone's set to sleep? Simon's portioning out overdoses of morphine, just in case.
MAL	Cheerful fellow. Did you really miss this place?
INARA	Sometimes... Not so much right now. A beat. He doesn't look at her when he asks:
MAL	Why did you leave? Site does lo9}E-at-- t -m-
INARA	Why didn't you ask me not to? Dissatisfied, Mal rises.
MAL	I, uh, I'd better go check on the VW crew. See how the inevitable mutiny is coming along. They both want to say more. They don't. He goes. The black sky is filled with what must be ninety ships in a They all wait, tensed up, as they approach the armada...
THE OPERATIVE	Define "disappeared". The Ensign just looks uncomfortable.
ZOE	Every reading I'm getting says normal. Oceans, land masses... no tectonic instability or radiation.
WASH	Yeah, but no power, either.
MAL	Nothing at all?
WASH	Wait. Something. Might be a beacon, but it's awful weak.
MAL	Find it.
V0 MAL	Gravity's Earthnorm.
ZOE	02 levels check, pressure... if there's anything wrong the scanner isn't reading it. Mal pulls off his helmet. Breathes, looking around him.
MAL	Well something sure as hell ain't right... WIDER ANGLE: They're in a CITY. Gleaming metal, spread out
JAYNE	
ZOE	We flew over at least a dozen cities just as big. Why didn't we hear about this?
MAL	Beacon's up ahead.
ZOE	Ho. She moves rapidly, gun out, to: Face-down on the ground, clothes tattered. She examines it No entry wound, fractures...
MAL	Poison? Got another one! ANGLE: JAYNE is by a downed hovercraft. Inside are three
JAYNE	They's all just sittin'. Didn't crash... ANGLE: RIVER is quietly becoming more and more upset.
JAYNE (O.S.)	Couple more here... 0 0 orpse _of_aman is pressed up against the glass wall right behind her. Mouth
SIMON	Kaylee... Come this way. Come here. Don't -- But she looks --
KAYLEE	GAAAAaaoh God -- -- and steps back, horrified, as the others approach.
JAYNE	How come they're preserved?
MAL	Place must've gone hermetic when the power blew. Sealed 'em.
KAYLEE	What're they doing? What's everybody doing?
SIMON	There's no discoloration, nobody's doubled over or showing signs of pain...
MAL	There's gasses that kill painless, right?
INARA	But they didn't fall down. None of them. They just lay down.
SIMON	More than anything, it looks like starvation.
MAL	Anybody want to bet there's plenty of food around?
INARA	They just lay down... They notice River now, in the middle of the street, keening. As she speaks we see, as she sees, FLASHES: bodies. In
RIVER	, make them stop, they're everywhere, every city every house every room, they're all inside me, I can hear them all and they're saying nothing! GET UP! PLEASE, GET THEM UP! , please God make me a stone... She's starting to damage my calm.
ZOE	Jayne --
JAYNE	She's right! Everybody's dead! This whole world is dead for no reason!
WASH	Let's get to the beacon. A hologram squawks to life amidst them all. First we see ,two
CARON	-- just a few of the images we've recorded, and you can see it isn't.. it isn't what we thought. There's been no war here, and no terraforming event. The environment is stable. It's the Pax, the G-32 Paxilon Hydroclorate that we added to the air processors. It's... .well it works... it was supposed to calm the population, weed out aggression. Make a peaceful... it worked. The people here stopped fighting. And then they stopped everything else. They stopped going to work, stopped breeding... talking... eating... There's thirty million people here and they all just let themselves die. They didn't even kill themselves. They just... most starved. When they stopped working the power grids, there were overloads, fires -- people burned to death sitting in their V0 chairs. Just sitting. There is a loud bang somewhere behind her -- she starts, I have to be quick. There was no one working the receptors when we landed, so we hit pretty hard. We can't leave. We can't take any of the local transports because... The bang again. There are people... they're not people... about a tenth of a percent of the population had the opposite reaction to the Pax. Their aggressor response increased... beyond madness. They've become... they've killed most of us... not just killed, they've done... things. Reavers... they made them...
CARON	I won't live to report this, and we haven't got power to... people have to know... We meant it for the best... to make people safer... to... God! She whirls, grabs a gun and fires -- then aims the gun at her She screams continuously as the Reaver tops her, biting at Turn it off. Wash does, nobody saying anything. Mal walks outside.
MAL	I seen so much death... I been on fields carpeted with bodies, friends and enemies -- I seen men and women blown to messes no further from me than you.
INARA	Mal...
MAL	But every single one of those people died on their feet. Fighting. Or, hell, running away -- doing summat to get through. This is...
INARA	Mal, I need your help with this. I need you to help me, because I can't -- He looks at her, folds her into his arms. Brings her face to
SIMON	River...
RIVER	I'm all right. She looks at him, wet eyes full of clarity. I'm all right.
V0	Wash pulls the recording cylinder out of the console.
MAL	This report is maybe twelve years old. Parliament buried it, and it stayed buried til River dug it up. This is what they feared she knew. And they were right to fear, 'cause there's a universe of folk that are gonna know it too. They're gonna see it. Somebody has to speak for these people. He pauses. Everyone waits. You all got on this boat for different reasons, but you all V0 come to the same place. So now I'm asking more of you than I have before. Maybe all. 'Cause as sure as I know anything I know this: They will try again. Maybe on another world, maybe on this very ground, swept clean. A year from now, ten, they'll swing back to the belief that they can make people... better. And I do not hold to that. So no more running. I aim to misbehave. There is a beat as he eyes them all.
JAYNE	My grandma always told me: if you can't do something smart, do something right. By way of emphasis he loudly cocks his big-ass rifle. Mal
MAL	That the same grandma told you 4 there was an evil dwarf spirit living in your well? She was a fun grandma.
SIMON	Do we have a plan?
MAL	Mr Universe. We haven't the equipment to broadwave this code, but he can put it on every screen for thirty worlds. He's pretty damn close, too.
RIVER	Based on our orbital trajectories, he reached optimum proximity just before our sunset. If we make a direct run within the hour we're only 67,332 miles out. At full burn we'd reach him inside of three- hours . She doesn't notice the reactions to her sudden clarity --
WASH	Still got the Reavers, and probably the Alliance between us and him.
ZOE	It's a fair bet the Alliance knows about Mr Universe. They're gonna see this coming.
MAL	No. He takes a long moment, his jaw tightening imperceptibly. They're not gonna see this coming. CLOSE ON: One of Serenity's jet engines, as it FIRES up.
MR UNIVERSE	It's no problem! Bring it on bring it on bring it on! From here to the eyes and ears of the 'verse, that's my motto, or it might be if I start having a motto.
MAL (ON SCREEN)	We won't be long.
MR UNIVERSE	You're gonna get caught in the ion cloud, it'll play merry hob with your radar, but pretty pretty lights and a few miles after you'll be right in my orbit. You'll let us know if anyone else comes at you? DROP BACK WIDE to see: The Operative and ten soldiers are in
MR UNIVERSE	You'll be the first. CLOSE ON: the Operative's sword, as he unsheathes it. Serenity drifts through the armada -- and suddenly another He swings the cannon round and fires at the ship pacing them.
HELMSMAN	I'm reading activity in the cloud.
THE OPERATIVE	Lock and fire on my command. You should have let me see her. We should have done this as men. Not with fire...
HELMSMAN	Sir! ,Wd
THE OPERATIVE	Vessel in range, lock on... Bastard's not even changing course...
THE OPERATIVE	That's not good... Sir?
THE OPERATIVE	Target the Reavers! Target the Reavers! Target everyone! Somebody FIRE!
MAL	We're too close for them to arm --
ZOE	This is gonna be very tight -- Hey look, we're upside down. V0 Zoe and Mal shoot a look at Jayne.
WASH	I am a leaf on the wind, watch how I soar. She nearly makes it all the way through the alliance fleet
MAL	Chickens come home to roost... They are suddenly JOLTED by a glancing blow from another The hell -- It's okay! I am a leaf on the wind!
MAL	What does that mean?
4 WASH	We're fried! I got no control!
MAL	Where's the back up? Where's the back up? He and Wash are frantically flipping buttons -- the ship
ZOE	Back up reads at 20%.. Can you get us down?
WASH	I'm gonna have to glide her in!
ZOE	Will that work?
WASH	140 Long as that landing strip is made of fluffy pillows...
MAL	Everybody to the upper decks! Strap yourselves to something!
WASH	I am a leaf on the wind. Watch -- A massive harpoon CRASHES through the windshield and impales
WASH!	She moves to him -- Wash baby baby no, come on, you gotta move you gotta move baby VW please -- Mal rips her away and to the floor as another projectile
JAYNE	Go! The entire crew piles out, all heavily bedecked with weapons.
MAL	Head inside!
MAL	Come on. Jayne, rearguard. Zoe slows, looking around her.
ZOE	Sir. This is a good hold point_
MAL	We all stay together --
ZOE	No. They have to come through here; they'll bottleneck and we can thin 'em out. We get pushed ,oO back there's the blast doors.
KAYLEE	I can rig 'em so they won't re- open once they close.
MAL	Then shut 'em and hide til -- done. This is the place. We'll buy you the time.
JAYNE	Move those crates back there for cover -- and make sure they ain't filled with anything goes boom.
KAYLEE	Wait, Wash -- where's Wash? Nobody (but River) realized he wasn't there. Zoe is dead calm. He ain't comin'. Everybody takes that in, Kaylee's eyes welling up.
JAYNE	Move the gorram crates! Come on! We hear savage SCREAMS from the hanger -- they're
ANGLE: HIS POV	Reavers rush toward them. He turns to Jayne.
MAL	Tell me you brought 'em this time... Jayne smiles grimly, tosses Mal a grenade as he pops his own It explodes in their midst, smoke and man-parts flying about. Explodes, raining a bunch of equipment -- and part of a In the black room, the door nearly buckles from the
MAL	Zoe... are you here? She looks up at him.
ZOE	Do the job, sir.
MAL	You hold. Hold till I'm back. He takes off -- passes Inara, the two of them holding a look
JAYNE	Captain's right. Can't be thinking on revenge if we're gonna get through this.
ZOE	You really think any of us are gonna get through this? He looks back at their army: A companion, a doctor, a
JAYNE	I might... ANGLE: MR UNIVERSE is lying dead, eyes open, half draped on
V0	Mal comes close. Nothing. He starts to move away again and
LOVEBOT	Mal. Mal stops. Guy killed me, Mal. He killed me with a sword. How weird is that? I got... a short span here... they destroyed my equipment but I have a back-up unit... bottom of the complex, right over the generator. Hard to get to. I know they missed it. They can't stop the signal, Mal. They can never stop the signal. Okay this is painful. On many levels. I'm not --
A0	She turns back, powering down. Recording over.
RIVER	I can't shut them up...
SIMON	It's okay... -
RIVER	They're all made up of rage. I can't... A BANG as a body slams against the door.
SIMON	Just stay low. I'm right here. Jayne moves past them to Zoe, takes position by her.
JAYNE	She picked a sweet bung of a time to go helpless on us.
ZOE	Jayne and I take the first wave. Nobody shoots less they get past our fire. Simon moves to Kaylee, who is shaky as hell. The bangs on
KAYLEE	Oh, I didn't plan on going out like this. I think we did right, but...
SIMON	I never planned... anything. I just wanted to keep River safe. Spent so much time on Serenity trying to find us a home I never realized I already had. She looks at him with soft surprise. My one true regret in all this is never being with you.
KAYLEE	With me? You mean to say, as, sex? I mean to say. Kaylee snaps her cartridge home with way more precision than
KAYLEE	Hell with this. I'm gonna live. Simon looks at her a moment, then turns his attention to the Inara come up into frame with the contents of the oilcloth:
MAL	Guy killed me, Mal.
MAL	Hard to get to. That's a fact.
lw�	The door is pried partially open -- enough for one Reaver to Zoe stands up and shoots him in the head. He arcs back hard
JAYNE	Zoe... Gorramnit... But she is in a trance, and we see beneath the calm, to the But Jayne totes an automatic, sprays killing fire on the lot, ZOE! Get yer ass back in the line! vo� She looks up, almost confused -- and one of Jayne's targets Inara pulls up a fresh arrow, shaking only slightly.
MAL	Shot me in the back. I haven't... made you angry, have I? I s
THE OPERATIVE	There's a lot of innocent people in the air being killed right now.
MAL	You have no idea how true that is. There's no wise-ass attitude in him now. They stand, facing I know the secret now. The truth that burned up River Tam's brain and set you after her. And the rest of the 'verse is gonna know it too. 'Cause they need to.
THE OPERATIVE	You really believe that?
MAL	I do.
THE OPERATIVE	You willing to die for that belief? I am. The Operative raises his gun -- but Mal is the quickdraw Of course, that ain't exactly plan He drops out his cartridge and slams another in.
SIMON	Spine's intact --
ZOE	Just gimme a bandage. Simon pulls a spraycan from his bag, sprays the wound with a There are a few gun shots (as well as nail-balls and blades)
JAYNE	Oh, now you're likin' guns, huh? Cheaters! He takes a hit in the shoulder, grimaces and keeps firing.
ZOE	Everybody fall back! Fall back! Everyone stumbles or is dragged into the inner corridor. Jayne! Grenade!
JAYNE	Very last one... He tosses it through the hole. Zoe doesn't even flinch from
ZOE	They're gonna get in --
KAYLEE	Can close it... from outside...
ZOE	No one's coming back from that... She tries to stand, fails. How much ammo do we have?
JAYNE	We got three full cartridges and my swingin' cod. That's all. Inara is by the elevator, pounding for it to come.---
INARA	Lift isn't moving...
ZOE	When they come, try to plug the hole with 'em... Kaylee cries out and Simon moves to her.
KAYLEE	I'm starting to lose some feeling here... I think there's something in them darts they throwed at me.
SIMON	Lie still. I'm gonna give you something to counteract the -- He stands, looking around him. His bag is over by Zoe. My bag. and SHKOWW!, the bullet takes him in the belly -- everything
INARA	Keep pressure here...
SIMON	My bag. Need... adrenaline... and a shot of calaphar for Kaylee... I can't... River...? She is by his side, takes his hand. She has a kind of River... I'm sorry...
RIVER	No. No. The lights go out. Everyone looks about them. Jayne fires
SIMON	I hate to... leave...
RIVER	You won't. You take care of me, Simon. You've always taken care of me. She stands as the emergency lights come on, giving her face My turn. She's running so fast, nobody has time to react til she DIVES ANGLE: THE BLAST DOORS, as they shut with a shuddering RLUNG. Mal looks at the Operative a moment -- and the sword slides
THE OPERATIVE	You know what your sin is, Malcolm?
MAL	Aw hell, I'm a fan of all seven. He headbutts the Operative viciously, then punches him so But right now... He pulls the sword out, grimacing. Holds it over the vao I'm gonna have to go with Wrath. He stabs down at his foe's face -- but the Operative rolls
JAYNE	You suppose he got through? Think Mal got the word out?
ZOE	He got through. I know he got through.
THE OPERATIVE	I'm sorry. The Operative spins him and DIGS his bunched fingers right You should know there's no shame in this. You've done remarkable things. But you're fighting a war you've already lost. He lunges -- and Mal twists gracefully out of the way,
MAL	Iwo Well, I'm known for that. The Operative drops the blade, mouth open, stumbling back, Mal spins him, grabbing both his arms and working his own Mal drops him sitting against the railing, picks up his Piece a shrapnel tore up that nerve cluster my first tour. Had it moved. He squats down, looks the Operative in the face. Sorry 'bout the throat. Expect you'd wanna say your famous last MW words now. Just one trouble. He reaches over the railing, pulls the back of the I ain't gonna kill you. He moves to the console, starts prepping it. Hell, I'm gonna grant your greatest wish. He inserts the cylinder, turns it slightly. It hums to life. I'm gonna show you a world without sin. He hits "send all". The cylinder lights up and the broadcast
CARON (V.0.)	These are some of the first sites we scouted on Miranda. There is no one living on this planet. There is no one... Mal hits the controls and a ramp extends towards the other River. She is bloodied, but not killed. She's as she was in the She slams backwards into a wall opposite the blast doors --
ZOE	Sir?
140 MAL	It's done. Report? Zoe looks at the badly wounded Simon, is about to give a Behind it, grappling hooks chained to a huge tractor pull the
SOLDIER	Drop your weapons! Drop 'em now!
