CHARACTER	DIALOGUE
WILL	No - not him. Suddenly, OUT OF THE FOG, THE APES APPEAR. PEOPLE are STUNNED as chimps, gorillas, orangutans VAULT OVER Helicopters BUZZ around like flies - SHARPSHOOTERS unable to Blocked off by CHP, all traffic stopped. Caesar and his apes race forward. Tell them to hold their fire until they get past the traffic! WILL SEES below that soon Caesar and the apes will reach a Then HE SEES the FOUR SQUAD CARS slowly approaching from the
ON THE BRIDGE	Caesar looks ahead - realizes that he's at the end of the Ahead is empty roadway. And the slowly approaching squad He looks up at the helicopters, rifles at the ready. He sees the FOG, swirling in and out of the SUSPENSION Caesar SIGNALS TO MAURICE. Maurice glances over the bridge railing. The Bay churns and Caesar BARKS at Maurice, who then climbs over the railing, The remaining apes follow. Orangutans and apes descend below the bridge deck.
BELOW THE BRIDGE	Maurice finds bars and support beams. He and the below-deck
ABOVE BRIDGE	Apes shimmying up cables appear out of the fog, arriving at They keep moving.
ON THE BRIDGE	The FOUR PATROL CARS stop, creating a barricade. The They FIRE at the apes above them, but it's tough going - the Then a heavy patch of fog rolls in, engulfing the middle part
OFFICER	They're all around us! Apes swing above them, scamper by them. Movement - WHOOSH - DODGE - nervous - crouches low. He edges backwards, hopeful That's when he SEES CAESAR, CLEAR AND OUT OF THE FOG, He SHOOTS, BARELY MISSING. The bullet RICOCHETS off the main ROCKET, climbing behind Caesar, looks down - SEES DODGE Then, using all his strength, ROCKET PULLS CAESAR BACK UP TO
BAM!	Rocket's hit in the back! He and Caesar make eye contact as ROCKET FALLS OFF THE Caesar SCREAMS, looks down at Dodge, who aims again. The GORILLAS ARE IN MOTION. LEAD BY BUCK, THEY CHARGE TOWARD
THE BARRICADE.	Like a freight train of menacing power. Helicopters FIRE, MEN at the barricade SHOOT as they try to A gorilla falls... but they keep on coming. Their sheer numbers and power are unstoppable.
BELOW THE BRIDGE	Koba hangs back. He's away from the action, but the battle He creeps along toward the North end of the bridge.
AERIAL VIEW	As the fog lifts for a moment, WE SEE APES SWINGING ON
APES SCAMPERING BELOW.	Vanquishing the humans.
DODGE.	Terrified but refusing to run, Dodge fires, reloads, fires again, his face red with the tension of what's to come. Below, the victorious ape army finishes off the battle of the Will's helicopter has set down. He and Stewart stand near an
OFFICER #1	We can't gas the forest! The slightest wind would take it over to Tiburon. Well it'll take us months to find them in there.
OFFICER #3	Not to mention rounding them all up. Will approaches the group.
WILL	I know where they are. The Officers look at him. Who the hell is this guy?
HUFFS	This man owns one of the chimps. The so-called "leader". Says he can reason him out.
WILL	His name is Caesar. I think he'll listen to me. If he comes out, the other apes will follow. Sounds pretty far-fetched.
OFFICER #1	You think you know where to find this monkey? Will starts to correct him - lets it go.
WILL	I do. I used to bring him here. The Officers look at each other.
OFFICER #1	We don't have a lot of options. Let's give it a try.
WILL	But you have to promise me - if I can get them out, you'll take them peacefully. Tranquilize them, cage them. No killing. Beat.
HUFFS	Whatever it takes. She's terrified, trying to mask it.
WILL	You think this is a bad idea?
STEWART	Definitely. He thought so.
STEWART (CONT'D)	He's never going to agree to come out with you.
WILL	I know. Got to try, right? I owe him that much. Will kisses her. Heads off down the path. Then he pauses, Think he'll forgive me?
STEWART	What? Will waves it off - never mind. Stewart watches him walk down the trail... and disappear into CRACKLING of BRANCHES. More BLACK, swinging through the trees. Is it Caesar? He knows this place. Up ahead is the GROVE OF TREES with the
HUFFS	Follow me. Stewart double-takes, sees the ARMY HEAD OFF IN WILL'S
STEWART	Hang on a second... Where are they going? Looks are exchanged. Someone grabs Stewart, who struggles
WILL	Caesar! ... He keeps walking, almost there. A DARK FIGURE DROPS DOWN IN Will takes a step back, fear crawling up the back of his You. Koba stands up tall. Eyes Will. He takes his time - like he's enjoying every second of
CAESAR	Humans coming.
WILL	No. I'm alone. Will pauses - there's so much he wants to say.
WILL (CONT'D)	I owe you an apology.
CAESAR	Will want Caesar dead.
WILL	I thought you had killed a man. But I should have known better. Caesar's face is unreadable. Will can't tell what he's
WILL (CONT'D)	I want you to know that all of this is my fault. My responsibility. Can you forgive me? BIRDS TAKE SUDDEN FLIGHT. Caesar's eyes shift to the path. Wait - no -
CAESAR	Will leave.
WILL	I won't -
CAESAR	Will leave now.
WILL	No. I'm staying with you. Caesar pushes him. Will staggers backwards, falls down. Huffs and his men are taken by surprise. SHOTS are fired, Will tries to speak. He looks up at Caesar. All is quiet. The forest is vast, dark, green. Impenetrable.
TAXI DRIVER	Where to, my man? It's the Taxi Driver with the mustache - THE SAME ONE THAT
HUNSIKER	SFO. International terminal.
TAXI DRIVER	You got it. The Driver COUGHS as he pulls away. Light sweat on his It's teeming with TRAVELERS. Holding on to the bannister,
NEWSCASTER VOICE #1 (O.S.)	As the ape search continues, a virulent flu strain has exploded in and around San Francisco, sending shock waves and panic throughout the community.
NEWSCASTER VOICE #2	Authorities suspect the origin of the deadly virus might be Gen-Sys Laboratories - the same private company from which several laboratory chimpanzees escaped earlier this week - We're still fifty yards away from the trees, but we can see
APART FROM THE OTHERS... KOBA.	All of them have eyes in varying shades of GREEN.
NEWSCASTER VOICE #3	As the death toll rapidly rises, Hospitals are desperately trying to meet the growing demand... Caesar sits alone, staring straight at us. Although isolated in the western region of the country, the numbers are catastrophic and quickly rising... Push in on CAESAR'S FACE.
NEWSCASTER VOICE #5	Efforts to quarantine appear to have failed. The strain has been spotted as far away as Singapore and Australia... Casualties have reached apocalyptic levels. Authorities urge you to stay inside your homes... For those of you who can hear me, I say... God's speed and so long to you all. The NEWSCASTER'S VOICE is replaced by the WHITE NOISE OF A
