CHARACTER	DIALOGUE
JACOBS	Too sick to return my calls? You know it was a funny thing, but I was watching the news and they started talking about a seven-year- old chimpanzee that went nuts - and all of a sudden, there you were on the TV. A seven year old chimp, raised since birth. The cafeteria gets a little awkward as Jacobs raises his
WILL	He's the son of chimp 4. And he's smart. Off-the-charts smart. Because of the 112. The genetic therapy was passed in utero - from the mother to the son. Without a single negative side-effect.
JACOBS	Aside from biting off a man's finger.
WILL	He was protecting my father. The same way his mother was protecting him.
JACOBS	We've had this conversation already. We knew the 112 was making the apes smart - I tried the 112 on my father. A conversation stopper. Jacobs is stunned. That's the I had a sample vial.
JACOBS	You're out of your mind. Like a chess player, Will lets the unasked question sit
WILL	Don't you want to know if it worked? Jacobs can't resist...
JACOBS	Did it?
WILL	It was miraculous. Unquestionable adult neurogenesis - development of fresh nerve tissue. It brought my father back. But Jacobs is confused.
JACOBS	You told me he was failing.
WILL	It's just like with the mice. Alzheimer's is a progressive disease, you need to keep it at bay â¢ - you need boosters. Will can see Jacobs turning this over in his mind - the
JACOBS	Why have you waited so long to tell me this?
WILL	I couldn't risk losing him.
JACOBS	'Him'?
WILL	Caesar.
JACOBS	The ape? Jacobs looks at his old friend, wondering about his sanity.
WILL	We've discovered a safe treatment. It's the payday you've been waiting for. I'll recreate the primate version of 112 for you. But only under one condition. It takes Jacobs a moment before he gets outraged.
JACOBS	You're giving me conditions? I could have you arrested for what you've done.
WILL	But you won't - you need me to build the drug. Here's what I need: I want you to get Caesar back. How the hell can I do that?
WILL	However they do things in your part of the world. Get attorneys into it. Write checks. Slip cash into the right pockets. Make it happen. Caesar tries the GATE/DOOR to the outside. LOCKED. He THE ORANGUTAN HOUSE - which is empty. The APES are visible inside. CAESAR GETS HIS FIRST GOOD LOOK. They haven't noticed him yet. Caesar looks around, finds THIRTY PAIRS OF APE EYES ON HIM. He spots a BALL across the way. Moves to it - the eyes Eyes on Caesar, Rocket discards the ball like a piece of Rocket bares his teeth, raises his arms. Caesar struggles to get away, accidentally SLAPPING Rocket OUTRAGED, Rocket SLAMS his hand on Caesar's chest and starts He opens his mouth wide, moving sharp teeth toward Caesar's Caesar rolls over to look up... as Rocket topples onto him. It's a small room furnished with meagre medical equipment. Caesar opens his eyes. Takes a moment to get his bearings.
VOICE	Caesar. Stewart stands over him. The light shines'behind her head.
STEWART	Do you remember me? I'm Dr. Stewart. She hands him a cup of water with a straw.
STEWART (CONT'D)	Drink. Caesar doesn't want the water. He signs. She clearly
STEWART (CONT'D)	I don't understand. Caesar's desperate. He opens his mouth, makes a LONG, LOW
STEWART (CONT-D)	Can you show me? Show me what you need. Caesar pulls at the restraints.
STEWART (CONT'D)	I can't take those off. Caesar sags with defeat, overcome with DESPAIR.
STEWART (CONT'D)	I'm sorry this has happened, Caesar. So sorry. Stewart stares at him. Moved at the complexity of his
STEWART (CONT'D)	I'm here once a week. I'll do my best to look after you.
STEWART (O.S.)	What were you thinking?
DODGE	oh, hey Doc.
STEWART	That chimp needs protection. Dodge's face falls.
STEWART (CONT'D)	You could've gotten him killed. I told Rodney not to open his cage.
STEWART	Can't you see how sensitive he is? How intelligent?
DODGE	Yeah, no, he's a real smart dresser.
STEWART	I want him moved to the orangutan house. He'll be safe there until we re-introduce him to the group.
DODGE	I'm sorry, since when do volunteer animal doctors make the rules around here?
STEWART	Please. Just do it.
DODGE	Whatever you say, doc. Dodge returns to stacking the chow.
DODGE (CONT'D)	You're the one with the college education.
VIRUS TECHNICIAN	Dr. Rodman - I think there's been a mistake. Will's been waiting for this observation - he's surprised it
VIRUS TECHNICIAN (CONT'D)	I've double-checked the replication rate of the 113 - and it's enormously fast compared to the
WILL	That's why we're using it. We need the drug quickly.
VIRUS TECHNICIAN	But... isn't it risky? I mean, at this rate of propagation, we greatly increase the possibility of mutations that are out of our control. It's a highly unstable -
WILL	I appreciate your concern - but it's going to be fine. We plan on taking precautions. The Technician pauses, not entirely satisfied. But Will's
STEWART	Sorry to drop in on you like this. The clinic at the zoo gave me your address but they didn't have a phone number - Don't worry about it. You want to come in?
WILL	Can I - you want a cup of coffee or something?
STEWART	No - thanks. I just wanted to let you know that I've seen Caesar. Seen Caesar?
WILL	How?
STEWART	I volunteer once a week at The Ranch.
WILL	Is he alright? She hesitates, wanting to be honest but not alarming.
STEWART	Yeah. He had a rough start, but things should get smoother from now on... In the other room, Walter and his Aide become visible. Will
WILL	That's my dad. He's not doing too well.
STEWART	Oh. Sorry. Anyway, Caesar's going to be okay. I'm looking after him.
WILL	Thank you... I appreciate that. Awkward beat.
STEWART	Well. If you give me your number I'll let you know from time to time how things are going -
WILL	Let's grab a drink. Takes her by surprise. Maybe takes him by surprise too.
STEWART	Love to. ROCK AND ROLL MUSIC. Dodge and Rodney drive up in a truck, Caesar watches as Dodge offers a beer can to a chimpanzee.
DODGE	Want a beer? The chimp reaches but Dodge pulls it away. Here's a little taste of beer... He unzips his fly and PISSES INTO THE CHIMP'S FEEDING TROUGH. Caesar watches as Dodge opens all the chimpanzee house cages Rodney moves to the orangutan house. CAESAR PAYS CLOSE
DODGE & RODNEY	Move it! Let's go! Dodge and Rodney herd the apes from their cages, brandishing On his way out, an orangutan, MAURICE - WISE COUNTENANCE, Caesar maneuvers to get a better view. His heart skips a beat. He moves to the bars, barely able to
WILL	There you are! I heard what happened. Home now. Caesar home. He tugs Will away from Dodge.
WILL	I'm going to get you out of here, but not today. I'm working on it. Caesar's face falls.
WILL (CONT'D)	Soon. I promise. Will notices Dodge's ELECTRIC CATTLE PROD. Home. Still a question, a flicker of hope.
WILL	Not yet. I can't yet. Caesar realizes: Will's going to leave him here.
WILL (CONT'D)	Wait a second - Caesar, where are you going? â¢ Caesar doesn't respond, doesn't turn, just keeps walking.
DODGE	No place like home, huh monkey boy?
WILL	Caesar - come back here! He watches Caesar's retreating back, Dodge trotting alongside BAM! WILL DECKS HIM WITH A FIST TO THE FACE. Dodge hits the
WILL	You son of a bitch. Dodge scrabbles to his feet, wipes the blood from his nose.
DODGE	That was not a smart thing to do. Dodge is clearly much tougher, stronger than Will, but Will's
WILL	If I find out Caesar's been hurt, if he's mistreated in any way, I swear I'll have you brought up on charges. Dodge looks towards Landon's house, restrains himself.
DODGE	That wild-eyed chimp isn't yours any more. He's mine now. The truth of the statement is worse than any punch.
DODGE (CONT'D)	And you're on private property. Now get the hell out of here.
WILL	Forget jail. I'll come back and kill you.
STEWART (O.S.)	Morning Caesar.
STEWART	How's your arm? Mind if I take a look? Stewart rummages in her MEDICAL BAG. CAESAR WATCHES AS SHE
STEWART (CONT'D)	Looking good... Caesar makes eye contact with Dodge over Stewart's shoulder.
STEWART (CONT'D)	I'm taking him out. Thought I'd cheer him up, show him the horses.
DODGE	No way. As she walks to Dodge, CAESAR GLANCES INTO HER MEDICAL BAG.
STEWART	What are you going to do? Use a cattle prod on me?
DODGE	If you're into that kind of thing.
STEWART	I'm safer with him than I am with you.
DODGE	Answer's no. Stewart turns to Caesar, who's retreated onto a bed of straw.
STEWART	I can't take you. Maybe another time. Caesar pauses, sensing something. He looks over his
WILL	Which one of you wants chocolate... Chimpanzees stare back at him, giving him nothing.
WILL (CONT'D)	"Koba." He peers inside. Koba stares back, EYES MURKY AND SMALL Then he puts out his hand again.
VOICE (O.S.)	Nanotherapy, beta version: Male Test Subject Number eleven. All of this avidly taken in by Koba's dark eyes. Koba's eyes are on him as he brings the mask toward the Boy, he's a calm one, isn't he? Will tilts the nozzle, releasing a BLAST OF AEROSOL MIST INTO Because his hand is still bandaged, he's having a hard time
STEWART	You actually punched him?
WILL	I did. She thinks it's funny.
STEWART	I've been wanting to do that since the day I met him.
WILL	I don't advise it. My hand's killing me.
STEWART	Here. Let me help you out. She begins feeding him the Chinese food. He puts down his
WILL	I'm going to get him out of there.
STEWART	I know you are.
WILL	And I'm going to get my dad back too. Buck's visible in his cage, asleep on a bed of straw. Caesar There's a GRUNT and a WHIRL OF BLACK FURRY MOVEMENT. Caesar Before he can finish, Buck bursts past him... The gorilla feels his feet on the grass, savoring every step. Back and forth, GORILLA WIND SPRINTS of freedom. He makes his way to the ape houses.
MAURICE	Happy gorilla. Caesar's shocked.
MAURICE (CONT'D)	Surprise.
CAESAR	Signing orangutan.
MAURICE	Maurice circus orangutan.
CAESAR	More ape sign?
MAURICE	No. Maurice alone. They HEAR DODGE'S WHEELBARROW APPROACH.
CAESAR	Careful. Stupid human no like smart ape. Dodge begins shoveling primate chow into the troughs. Rocket gets to his feet, sees CAESAR STANDING IN THE COMMON Rocket GRUNTS and sprints after him - through the chimpanzee Buck raises his arms and SLAMS them down with a MIGHTY ROAR; The chimpanzees, awake now, watch to see what will happen.
LOCKS HIM IN.	Then Caesar walks upright around the cages once more, making All routine. Everyone's guard is down.
WILL	Hold him steady! Evans tightens the straps on Koba's flailing arm.
WILL (CONT'D)	You okay Evans?
EVANS	Yeah. I'm good.
WILL	You can't put larger blocks on top of smaller ones. Move the stack from here to here. You've got to take the blocks off and stack them again, like this. Will turns the puzzle back around. Let's see you try. Koba puts out a palm - asking for an M&M.;
WILL (CONT'D)	I'll give you an M&M; if you can get the blocks to the other side - but don't do it the way you did last time. Koba thinks, then ROTATES THE PUZZLE AGAIN - THIS TIME You know what I want. You're just not going to give it to me. Koba puts out a palm. There's A LOOK IN HIS EYE, MALEVOLENT,
WILL (V.0.) (CONT'D)	What do you think of Koba?
FRANKLIN	You wanna know if I think the 113's making him nuts.
WILL	I know he's smart. But there's something else, something worrisome. He challenges me. Taunts me. Will looks toward us, toward the bars.
WILL (CONT'D)	I don't want to try it on... .I don't want to start human trials if there's any chance of danger.
FRANKLIN	What you're seeing has nothing to do with the 113, Doc. The apes're just like us - they're complex. Some are loyal, some are selfish, some have a good sense of humor. And some are born rotten. Koba moves into frame. We've been watching from his point of Now we look over his shoulder, where the sharp planes of his
FRANKLIN (CONT'D)	This one's a bad apple, that's all. A chill runs down Will's spine. Early day today, Evans?
EVANS	Actually I'm not feeling too good.
GUARD	You know what: Whiskey, lemon, honey and a cup of hot water. Never fails.
EVANS	Thanks - I'm on it. Evans drives off. She watches CAESAR walking across the bridge. Caesar moves Stewart's relieved - and a little surprised - to see Caesar
RODNEY	Still won't eat, won't come out.
DODGE	I can fix that. Dodge drags the hose to Rocket's cage.
DODGE (CONT'D)	Get that monkey ass out of there! At that moment Rocket's CAGE DOOR OPENS. He hands the cookie bag to Rocket. CHIMPS EMERGE, bewildered. Rocket stands with the cookie bag, unsure what to do. Caesar Now Rocket understands. He gives a cookie to the nearest immediately line up. Discomfort's gone - now it's one big Caesar watches, satisfied, as the apes feast together. Maurice climbs up next to Caesar.
MAURICE	Why cookie Rocket?
CAESAR	Need strong. All apes strong.
MAURICE	No understand. Caesar grabs a small twig off the tree and BREAKS IT.
CAESAR	Gorilla. He breaks another twig.
CAESAR (CONT'D)	Orangutan. He breaks another.
CAESAR (CONT'D)	Chimpanzee. He grabs a bunch of twigs and holds them together - now they Apes. He takes a sip, heads down the hall to his father's room.
WILL	Someone's sleeping late today - Will opens the door - and FREEZES IN HIS TRACKS.
WILL (CONT'D)	Dad?
RODNEY	Sorry - can't get him to come out. He won't budge.
WILL	He knows I'm here?
RODNEY	I told him. Will brushes by Rodney, heads for the cages.
RODNEY (CONT'D)	Hey - you are not allowed back
THERE -	Will ignores him, keeps going. Will runs up to the cage.
WILL	Caesar - please! I've got something to tell you - It's about Walter. WE FIND CAESAR deep out of sight in the orangutan cage. He' s Will waits. Caesar's not coming out. NASA has temporarily lost communication with the Icarus.
NEWSCASTER	Captain Taylor and his crew are navigating the ship around the dark side of Mars. Communication is expected to be reestablished -
WILL	I was too late. She puts the photo down, cuddles against him.
STEWART	You tried. You worked really hard. Walter knew that.
WILL	Wasn't good enough though, was it. ANGLE ON THE PHOTOGRAPH. It shows a younger Walter and his
FRANKLIN	Just checking in. You didn't show up at work today.
FRANKLIN (O.S.)	Hope you're feeling better - let me know if you need anything. REVEAL EVANS, LYING IN BED, DEAD - a streak of brown dried
MAURICE	Where go?
CAESAR	Find Mother. As he passes the chimpanzee house HE HEARS A CHIMPANZEE CALL Caesar hesitates. Rocket CALLS OUT LOUDER. Caesar gets right up against the bars of Rocket's cage, takes
UNMISTAKABLY GREEN.	Reeling, Caesar tries to make sense of this. And then he Caesar opens Rocket's'cage. The chimp emerges, ready for Swinging from tree to tree, they make their way down the WILL'S WAKENED by the NOISE. What is that? It's coming from outside. REVEAL STEWART asleep next to Will. He gets out of bed, He stands there, looking down at Will and Stewart. Caesar emerges from Will's room and makes his way down the Rocket follows. Now they have a clear view of the cramped cages, DARKENED Caesar approaches the cage... FINDS HIMSELF FACE TO FACE WITH He's nearly reached the last of the cages, and the
NO CONNECTION.	Caesar reaches the last cage, where A YOUNG CHIMP, sick, Caesar turns away, crestfallen. He YELLS for ROCKET, and the two of them take off. The LAB Then Koba LEAPS FOR HIM. They look at each other, lay low. But Rocket's too fast - in a moment he's out of sight. Except for CORNELIA - she's wide awake. Staring at him. CLICK. It locks into place. There's a CLANKING as the OUTSIDE GATE OPENS. Caesar freezes. Dodge enters with the wheelbarrow of Primate Chow and the He hasn't seen Caesar yet.
DODGE	Rise and shine, assholes. The chimps wake. One by one they notice Caesar, standing in What the hell - You sly son of a bitch. How'd you do that? Dodge is careful, slow, as he picks up the shovel and holds He circles around the common area toward Cornelia's cage.
DODGE (CONT'D)	We're gonna go slow here, alright? You're gonna go back in your cage, you're not going to give me no trouble. The apes - chimps, orangutans, the gorilla - are silent, Cornelia stands, watching. Caesar doesn't take his eyes off Dodge, but his expression is Dodge reaches Cornelia's cage. He VIOLENTLY BANGS THE SHOVEL
DODGE (CONT'D)	Back! Caesar reacts, a snarl curling his lips. Now he starts moving forward, trying to back Caesar toward
DODGE (CONT'D)	We're going to have you fixed, Einstein, that's for damn sure... But first we're going to figure out how you pulled this off...
DODGE (CONT'D)	Go on. Get in that cage. Caesar stops, refusing to go any farther.
DODGE (CONT'D)	I said get! But Caesar doesn't move. Dodge pokes the shovel at him, then SLAMS it to the cement He edges closer to Caesar, grip tightening around the shovel
DODGE (CONT'D)	Get in that cage, you damn dirty ape!
CAESAR	No! Dodge is thunderstruck - nearly loses his balance. Maurice, Rocket, Buck, and all the apes stare, dumbfounded, And then... they go nuts.
SCREAMING. YELLING. JUMPING UP AND DOWN.	He rushes Dodge, wrestling the shovel from his hands. Dodge staggers back. Caesar SLAMS the shovel in his stomach. Caesar drags Dodge to Rocket's cage and opens the door. They gather around Caesar, who holds up STEWART'S SCISSORS He moves to Maurice, who offers up his hand. Caesar slices
JACOBS (O.S.)	Will? Hello? Will pick up the goddamned phone!
WILL	Hello?
JACOBS	The animal handler - Franklin - was killed last night. In the primate house.
WILL	Franklin's dead?
JACOBS	Something very powerful broke his neck. Snapped it in two.
WILL	Could it have been one of our chimps?
JACOBS	All our apes are accounted for - â¢ secured in their cages. But here's the kicker: One of our security guards swears he chased a chimpanzee off the grounds last night. Will - with growing dread - looks out the window at Caesar's Where in the hell did that chimp come from?!
MR. LANDON	The Ranch. Landon speaking. Hey Stewart. Caesar? Dodge fed them breakfast about half an hour ago... He holds up a PAIR OF BINOCULARS, looks toward the atrium and Let me call you back... He HEARS THE BACK KITCHEN DOOR OPEN. RUSTLING NOISES in the
MR. LANDON (CONT'D)	Hey Dodge - Stewart just called - WE FOLLOW HIM out of the living-room, into the...
MR. LANDON	She said that - Landon goes pale. ROCKET AND TWO OTHER CHIMPANZEES ARE
IN THE DISTANCE	Rodney's visible, being dragged, SCREAMING. No one's answering. In the distance they can HEAR the PHONE RINGING at the ranch Will thinks a moment, gets out of the car.
WILL	You go get help.
STEWART	Not a way in the world. I'm coming with you.
STEWART	Oh my God... I'm calling 911.. Will picks up Landon's BINOCULARS, moves to the front window. .CAESAR. CLEARLY THE ALPHA MALE. Clearly in control.
WILL	Caesar. Will lowers the binoculars as Stewart rushes in. She's
STEWART	It's going to take them at least half an hour to get here. He begins rummaging in drawers, in cabinets. There's an He has an idea. Under the sink he finds what he's looking for: RAT POISON.
STEWART (CONT'D)	What are you doing?
WILL	I'm going to kill him. Caesar?
WILL	He's dangerous.
STEWART	You're wrong - he can't have been the one who killed that man -
WILL	There is no other explanation. A BLACK SHADOW passes by the window. Then another. Stewart They're surrounded. She SCREAMS. Will barricades the back door with a table.
GLASS SHATTERS.	Will and Stewart run to the front room, just as the door Caesar! I need to talk to you! Dodge, Rodney and Landon watch as Will and Stewart are pushed
WILL (CONT'D)	Caesar!
DODGE	Welcome to the mad house.
STEWART	I called Animal Control - they'll be here soon -
WILL	I just want to talk to you!
DODGE	Well this'll be interesting because your freak'll talk back.
RODNEY	Dodge thinks he spoke to him.
DODGE	He did! He said the word "no" - right to my face.
WILL	What do you mean?
DODGE	He can talk.
STEWART	That's impossible.
DODGE	Then he must have a voicebox in his ass, because I heard him! Caesar walks up. Will steels himself, feels in his pocket - the POISONED
WILL	Caesar - people are coming. People with guns. You've got to make the apes go back in their cages. Apes no belong in cage. Human put apes in cage. Will's heart sinks as he sees that Caesar is intransigent. Never again. Will takes a moment, DIGS DEEP TO MAKE HIMSELF DO WHAT MUST Finally he brings the POISONED COOKIE from his pocket, holds
WILL	I brought this for you. Caesar eyes the cookie but doesn't take it. Don't you want it? Never. They look at each other. Two creatures once so close, but
WILL	You went to the lab last night. I know it was you. Caesar doesn't deny it. How could you kill that man, Caesar? Once you kill you can't it back - that man's gone forever. It gives him pause. Caesar no kill.
WILL	But... Caesar no kill! Caesar SLAPS the COOKIE from Will's hand.
WILL	Don't walk away. We need to talk.
WILL (CONT'D)	Don't - ! Where'd he get that wristband, Caesar? That's Koba's band... Did Koba get out of his cage?? Yelling after Caesar.
WILL (CONT'D)	Caesar wait! But Caesar's not waiting. No. At the sound of Caesar's voice, the apes rise tall.
CAESAR (CONT'D)	C...Cage! The humans' jaws drop, petrified.
VOICE	They could be spread out all over the County by now. Will and Stewart - released from the cages - speak to OFFICER
WILL	No - they'll stick together. They're following one ape. You kill him, you stop them all.
HUFFS	There's a leader? Ask him - he raised him. All eyes to Will.
WILL	His name is Caesar. If I can reason with him, I know I can put an end to this.
HUFFS	Reason with him? Huffs thinks he's nuts. He turns, starts toward his squad
WILL	You don't understand - this chimp is smart - he'll listen to me
HUFF	Get on the horn with every agency you can think of! We've got to track down these monkeys before they do major damage! The Junior Officer - GRANGER - heads for his car. Dodge
DODGE	You need me riding with you. I've got experience with these animals. I can point out the one you want.
OFFICER	If you think of anything else, this is where I can be reached - A RUMBLING SOUND from behind. They turn to see a RANCH APE ARMY heading their way. The apes STAMPEDE past them and SWARM INTO THE LAB.
OFFICER	We have a situation at Gen-Sys Laboratory! Approximately two dozen apes, gorillas, I don't know what the hell they are - AUDIBLE CHAOS from inside the lab. YELLING, SCREAMING,
WILL	The lab.
HUFFS	You know anything about this?
WILL	That's where I work. EMPLOYEES SCATTER - running for the exits. Some duck behind Caesar and Buck walk through the lab, eyeing the destruction. A moment later, LAB DOORS FLY OPEN.
OFFICER #1	Here they come!
OFFICER #2	There's more of them! Those are my chimps... They duck as the apes run by - some of them right up and over BAM! BAM! BAM! as the chimp's hit and leapfrog over the squad The apes stampede across the parking lot, where several use Out of the quiet there's the PADDING SOUND OF FOOTSTEPS ON
BROKEN GLASS.	Jacobs freezes. KOBA APPEARS from around a doorway. He and Jacobs look at Then Koba calmly walks past him. Once outside Koba GALLOPS OFF. Jacobs can see him through
HOFFS	Any idea where they're headed? Will sees Dodge joining SHARPSHOOTERS in another helicopter
WILL	No.
HOFFS	They were seen heading north from the lab - let's start with that. KIDS EVERYWHERE - slides, seesaws, climbing structures.
GIRL	Monkey! OVER HER SHOULDER WE SEE A CHIMPANZEE HEADING OUR WAY. Then
WAY DOWN THE SLOPE.	suddenly the Little Girl's not so sure. Mommy? The Girl's surrounded now by moving apes --- the Mother can't
MOTHER	April! Suddenly Caesar doubles back from the lead. He scoops her up Then he continues herding the apes forward. He knows where SIRENS APPROACH. Squad cars give chase.
HUFFS	You see them?
WILL	No, I can't see -
STEWART	Oh my god. Seated next to Will, she draws him to her window. FAR BELOW: She realizes something.
STEWART (CONT'D)	I know where they're going. FAMILIES. Hot dog stands and ice cream vendors. A moment later, Caesar and his apes RUMBLE IN. Chaos. Released balloons float lazily upward.
WILL	He's going to release the apes. Looking to his left, Will sees a sniper try to get shots off - The apes are too interspersed with fleeing PATRONS.
WRANGLER	What the hell am I supposed to do when they get here?! An APE WRANGLER screams into a wall phone at the Ape Suddenly the phone is ripped from wall. The Wrangler cowers, Rocket rattles the door, bares his teeth. Caesar's apes are waiting for them. By now, ALL THE ANIMALS ARE GOING CRAZY. Above, the sky is full of helicopters now -- some Police, some
DODGE	That's him! The one with the white on his shoulder! A SNIPER takes aim at Caesar - the BULLET RICOCHETS OFF THE He climbs into a waiting taxi. He looks like hell.
TAXI DRIVER	Where to, my man?
JACOBS	24 Marigold.
TAXI DRIVER	Want me to turn down the air? Whatever. SNIPER FIRE RINGS OUT from helicopters above - an APE FALLS. SHE LOOKS ILL. But Cornelia digs deep and picks up her Caesar continues on. Below, the BLACK LOCUST that is the pack of apes has grown Up ahead, the GOLDEN GATE BRIDGE COMES INTO VIEW - majestic, And Will realizes the moment he sees it.
WILL	They're going to Muir Woods. I'm sure of it. He doesn't want to hurt anyone - he's just trying to get the apes out of the City! Shut down the Golden Gate Bridge!
WILL	No - let them through! The apes arrive at the shadow of the great bridge - a Caesar rushes to Cornelia's side. By the time he reaches FLASHBACK of Cornelia, sniffing the cookie. Will yelling Caesar - devastated, the rage building in his face. Caesar struggles to his feet with Cornelia in his arms - he's Maurice takes Cornelia from Caesar's arms as Buck and Rocket Koba hangs back, watching, fascinated, as Maurice lays Is he hurt?
