CHARACTER	DIALOGUE
BISHOP (V.O.)	Every man has a death that's right for him. Every one. REVERSE to find a wall of photographs, charts, official
BISHOP (V.O.) (CONT'D)	For every man, there's a way to leave this earth which is so right for them, it's almost as if they carry it with them. MOVING over the wall. MORE PHOTOGRAPHS. The Mark escorted
BISHOP (V.O.) (CONT'D)	When the right death overtakes a man, there will be grief in those who knew him, but there will also be a sense of inevitability. Because they will know, that of course... CLOSE ON BISHOP. Statue-like, except his eyes which dart
BISHOP (V.O.)	...Of course, this was always going to happen this way. WHOMP! The SOUND OF THE RACE floods in as the cars blow by, BISHOP'S P.O.V.: Two cars TANGLE in a corner, SPIN to a We STAY with Bishop as he SWIMS HARD, powerfully, not tiring. The Mark pushes the man back, ignoring him, hurrying on. At Behind the Mark, a locker door opens and closes. Like a The room is empty.
GROCER	'Evening, Arthur. Got your weekly right here. The man hoists two bags of groceries onto the counter.
BISHOP	Hey, Sophie. I got something for you, wanna see? The girl smiles, puts down the book and comes over. Bishop The girl sees it, smiles... a little disappointed.
BISHOP (CONT'D)	I'm just kidding. Bishop reaches into his jacket, pulls out the next Sophie BEAMS, takes it. A quick hug and she's back to her
GROCER	What do you say, honey?
SOPHIE	Thank you, Bishop.
BISHOP	You're very welcome. And she's back into the book. Bishop smiles, a little sad.
GROCER	See you next week, Arthur. Bishop's Cobra drives past the MAIN HOUSE, a large craftsman, One photo in particular: The Mark, busy on the phone as a Bishop stares down at the picture, consumed by fire, Bishop jumps off the treadmill, immediately takes his pulse, ON HIS PLATE. His food is a meal we might expect an
MALE NEWS ANCHOR	...here's a guy at the top of his game. And yes there were questions about the money: Where did it all go. Were some of his friends less than friendly to the US? But in the end, it's not the feds who catch up with him --
FEMALE NEWS ANCHOR	It's that age old adage that boys will be boys. These dangerous hobbies come with the risk of accidents like this -- Bishops punches off the tv, heads for the door. It's open! Bishop pushes the door open, steps into... THE VIEW. Over all the city, thousands of lights twinkle.
WOMAN'S VOICE	I'll just be a minute. We catch a GLIMPSE of the WOMAN. A towel over her hair,
BISHOP	I'm sorry I was away so long this time. I had some complications... He turns. She's emerged from the bedroom. 30's. Long dark
WOMAN	You don't have to apologize. I'm just glad you're here now. Are you hungry? She starts to move by him, his hand catches her arm and she
WOMAN (CONT'D)	I'm sorry. I just... miss you. I never thought I was going to be a "woman who waits." But I do. I wait for you. He nods. She breaks off, pours red wine in a glass.
WOMAN (CONT'D)	Were you in Europe? Africa? Was there another woman?
BISHOP	No.
WOMAN	Liar. It's alright. I don't mind. I... I made something for you. She picks up a remote, fire up a large flatscreen TV. Hits a
WOMAN ON CAMERA	Hey, you. Just got back from the weekend at the lake with Julianne and Barry and their kids. Their oldest is five. You'd like him. Everybody spoke about you, of course. We should go up there sometime, just the two of us... ON THE TV: She reaches towards the camera and the image
WOMAN ON CAMERA (CONT'D)	I, just got back from seeing the most boring opening at the Pierre Grochet gallery. And of course everyone's asking where you are and of course I made your apologies, but what I was thinking... ON THE TV: She winks at the camera, happily drunk. Raises Why weren't you here to take me home and make love to me...? She blows a kiss. Closes her eyes...
BISHOP	I'm not a man who... It wouldn't be good for you, if I was around all the time.
WOMAN	I know. I know. She moves to him and they are kissing fierce. Bishop grabs the woman who LAUGHS in ecstacy. He reverses
WOMAN'S VOICE	Stay for breakfast? He turns. She's standing in the doorway, tying a robe around
BISHOP	Do I ever?
WOMAN	No. But there's a first time for everything. Bishop goes to the DVD player, slots out the DVD they watched
BISHOP	Thank you. This was a good one. See you next time.
WOMAN	Bishop... You all right? He turns, studies her. This is new ground. He nods and ... a BLACK BENTLEY sits parked in front of the house. A MAN
MAN	Yes, I just got here. No, not yet. He turns, REACTS as Bishop is there, CLOSE, barely sweating. Hold on, I got him. The man holds his cell phone out for Bishop. A beat, Bishop
MCKENNA (O.S.)	Arthur? Jesus Christ, Arthur, is that you?
BISHOP	...How are you, Harry?
MCKENNA (O.S.)	Oh you know, I'm God Damn perfect. I'm redecorating my fucking office and I wanted your advice on the god forsaken curtains is how I am. This is... this is something, Arthur. I need to see you, for old time's sake.
SECURITY	Sorry, gotta do this... Patient, Bishop puts his arms out as the man searches him. A tapping gets Bishop's attention. The corner office is Harry comes out from behind his desk, points Bishop to a big
BISHOP	I like the new digs. McKenna LAUGHS, like a grunt. Fiddles with his hearing aid,
MCKENNA	Has it really been that long? Jesus. You know how they say youth is lost on the young? They're right. If I had my nineteen year old body back, I wouldn't be here, I'll tell you that. I'd be out there, making it my personal life mission to bang every stewardess who ever dared put on one of those whatchamacallit skirts.
BISHOP	Times have changed, Harry. They don't wear skirts anymore. McKenna eyeballs Bishop, shakes his head. He goes to the
MCKENNA	You know what all that is? That's their money, getting moved, exchanged. Made clean and neat and proper for Uncle Sam. And I have always been extremely careful. McKenna goes to his desk, tosses legal papers on the table
MCKENNA (CONT'D)	You know what that is? That's a God damn subpoena from the Justice Department. We get a new face in the white house, all of a sudden they want to look at my records. They got accountants want to go through MY BOOKS. Are you kidding me? I got the left hand coming after me for what I did for the right hand. Bishop looks over the papers, nods.
MCKENNA (CONT'D)	So I call them up. I say "hey, you guys gotta get your own house in order..."
BISHOP	And...
MCKENNA	And? And that's the point! Nothing. I tell them they have a problem here and instead of dealing with it I get silence, zippo, fuck- all. What are they, twelve?
BISHOP	...I don't see how I can --
MCKENNA	That's bullshit, Arthur. Your father -- they still talk about the guy like he walked on water. You, they'll listen to. You --
BISHOP	I'm not a part of that. McKenna stares out the window at the street below, nervous.
MCKENNA	You remember that fishing trip we all took, back in the day. You were, what? About eight, right? You fell out of the boat... couldn't swim a stroke. City kid. You're in the water, splashing around.
MCKENNA (CONT'D)	You got these big eyes like saucers, like you're sure you're gonna drown. Splashing... swallowing water... just STARING at your father and he's not making a move. Remember? Just looking down at you like... Suddenly it's gotten less funny.
MCKENNA (CONT'D)	I finally had to grab you by the hair, pull you back into the boat. You're shivering like hell and he -- your dad -- gives one of those laughs. Those big laughs everyone loved him for. Anyway, the whole time you're in the water, you didn't cry out. Not once. You were a tough sonofabitch, even then.
BISHOP	That was a long time ago, Harry. McKenna turns from the window, takes in all his monitors,
MCKENNA	Well, I'm in the water this time, Arthur. You think it's easy for me to ask? It cuts like hell. But that's what I'm doing. Bishop eyes the barely open doorway into a small room off the A long beat. Bishop... nods. The tension seems to DRAIN
MCKENNA (CONT'D)	...Thank you. Thank you. THROUGH THE GLASS WALL OF THE OFFICE. Bishop's eyes track as Even as Steve nods to one of his father's security and pushes
MCKENNA (CONT'D)	And here's the prodigal son, arrived to bilk me for ransom. Steve, this is Arthur Bishop. Steve shakes Bishop's hand. Strong. Observant.
STEVE	Hey. Nice to meet you. You work for my father?
MCKENNA	No, quite the opposite. Arthur's doing me a little favor.
STEVE	So you're a criminal?
MCKENNA	That's enough.
STEVE	Relax, relax. I'm kidding. A last beat between Steve and Bishop, then Steve lets it go, I need you to make a donation to Louise's charity. She's mounting some kind of fundraiser and she wants to make sure we do our part.
MCKENNA	What's it for?
STEVE	I have no idea. And don't pretend you care, either. Write the check, go to the party, smile when the
ORPHANS-SLASH-HOMELESS-WIDOWS THANK	you and call you a great and generous man. You ever think of having kids, Arthur?
BISHOP	Nope. Wearily, McKenna brings out his checkbook.
MCKENNA	Wise man. How much?
STEVE	Thirty thousand. You know, I can't tell what you're thinking, Mr. Bishop. Usually, I'm very good with that, with people. Sort of like a bullshit detector I developed. But you're very... hard to read.
BISHOP	Sorry.
STEVE	Don't be. So what are you thinking?
BISHOP	I was thinking that a son, should be more grateful to his father. I agree. I agree. I often wonder why I'm not. McKenna tears the check out, hands it to Steve.
MCKENNA	There. Now go away.
STEVE	Thank you, dad. Are we going to see you at the house any time soon?
MCKENNA	Yeah, this is just a few more days. We got this... situation. Steve hears the dark in his father's tone, tracks it.
STEVE	Anything I can do?
MCKENNA	You? Yeah, you can earn some money. Get married. No, it's going to be okay now. Arthur's helping me out. Steve glances between the two men. Ego slightly bruised.
STEVE	Well it's good to meet you Mr. Bishop. My father seems to trust you, which is... unusual. Bishop and McKenna watch as he hits the atrium, hands Louise
MCKENNA	We will take from our children for a lifetime what we would not suffer from another man for an instant. Explain that to me. Okay. Okay, call me when you hear something.
BISHOP	You take care of yourself, Harry.
MCKENNA	Well, that's your job now, isn't it?
ART DEALER	Arthur. Glad you're here. Right this way. As they move across the space Bishop catches sight of a This way. Bishop follows the Dealer into another area where they
ART DEALER (CONT'D)	Zak is almost finished. It will make a wonderful addition to your collection. Bishop looks at the canvas. Nods. Glances back to where the
ART DEALER (CONT'D)	Do you want to meet him?
BISHOP	...No.
WOMAN'S VOICE	Good evening, Mr. Bishop. How can I help you?
BISHOP	Yes. I'd like to speak to Dean. There's a brief pause on the phone, then.
WOMAN'S VOICE	...Mr. Dean is not available right now. Can I take a message?
BISHOP	No. Just tell him I called. Bishop hangs up, stares at the phone.
BISHOP (CONT'D)	Hello, Don. They make you drive all the way out here this evening?
DON	That's the job. The man gestures to the open barn door, the classic cars.
DON (CONT'D)	You find tires for that old FleetMaster? No, not yet. Maybe when I do, we'll take it out for a spin. Say hello to the wife for me.
DON	Will do. Good night, Arthur. The man heads back towards his truck. Bishop tears away the Almost instantly, his phone rings and he answers. Silence. We should all be so lucky. Click. The phone goes dead. Almost at the same time, the
DEAN (O.S.)	Bishop. I heard you called. Hey, you get the stuff I sent you?
BISHOP	That's what I called about. I know him. I think there might be a
DEAN (O.S.)	Hold on a second. A long pause. Just air on the line. Bishop stares at his
DEAN (O.S.) (CONT'D)	No, it's been decided. This one's a go. You take care of yourself, Bishop. The line goes dead. Bishop stares at the phone for a second,
MCKENNA'S VOICE	Hello?
BISHOP'S VOICE	They want to talk. I'm picking you up in an hour.
BISHOP'S VOICE	Send your people home. I don't want anyone I don't know near you today. I'm serious.
MCKENNA'S VOICE	...Thank you, Arthur.
BISHOP	I'm sorry. My bad. The guy at the counter shrugs, turns for a mop. Bishop Bishop picks up the torch, SPARKS IT.
SECURITY #2	Hey, you okay?
SECURITY #1	Actually, call central. I'm not -- And with that, he's suddenly up and MOVING towards the Except for Harry, alone, silhouetted at one of his large
MCKENNA	You ever wonder what the last day of your life will feel like, Arthur?
BISHOP	You keep standing next to that window, maybe you'll be able to tell me. McKenna looks over, smiles weary. He looks exhausted. He
MCKENNA	This turns out alright, I'm going to send you a dozen Thai hookers and a case of Cuban Esplandidos. You can return the hookers if you want, but the cigars... I don't smoke.
MCKENNA	You will, my friend. For these, you will.
BISHOP	Why the change of security?
MCKENNA	...What? Beat. Bishop SLAPS the STOP button. Elevator jerks to a
MCKENNA (CONT'D)	Arthur...? McKenna looks at the effort, sighs. Lets Bishop help him
BISHOP	Come on...
BISHOP	What the hell...? McKenna moves in, pushes Bishop aside.
MCKENNA	This isn't good, Arthur...
BISHOP	Listen to me. Stay here. I'm going to check it out.
MCKENNA	Bishop, those men are armed...
BISHOP	Harry, relax. I know what I'm doing. And Bishop slips out the door, shutting it behind him.
BISHOP'S VOICE	Harry! It's a trap! RUN!!! The door flies opens and Bishop LURCHES IN, gun raised. Bishop comes rushing up the stairs. His shirt stained with
BISHOP	Come on! If we can get to the roof I can hold them off! Come on! McKenna GULPS AIR, staggers on... FEET come into his view. He looks up, sees Bishop standing
MCKENNA	...You. Bishop nods. McKenna CACKLES which turns into a scream as You bastard. You... Sonofabitch. You didn't have the balls... The balls to AARRRGHHHH! He CONVULSES. Tears stream down his face. His body HEAVING, ON BISHOP. We know it's in there. But it doesn't show.
MCKENNA (CONT'D)	Oh God. Oh, Jesus Christ help me.
ARRGHHHH!!! ARRRRGHHHHHH!!!!	Please... Please... Please... McKenna stops struggling, stares up at Bishop. Tears
MCKENNA (CONT'D)	Please, Arthur, put me out of my misery. Your father... Bishop checks his watch again, doesn't meet McKenna's eyes.
MCKENNA (CONT'D)	Please. I'm scared. I'm really god damn scared... Suddenly Bishop MOVES. Lightening fast, wrapping up Bishop releases, stands, stares down. For the first time, Bishop stands at the back. His eyes scan over the
PRIEST	His good works comfort all of us, even in his going. We commit his remains to your earth, oh Father, and we pray you vouchsafe him eternal life and that you bring comfort to those who have been left behind. His only son, Steve, who is himself devoted to -- The Priest falters as Steve rises, moves away from the event.
PRIEST (CONT'D)	...Glory be to the Father, and to the Son, and to the Holy Ghost... Bishop watches the dirt hit the coffin. Then looks over as
BISHOP	My condolences. Yeah, Harry was a popular guy. Good to see so many of his friends here. Touching. Bishop considers, tracks the attendees who pass by a suited
STEVE (CONT'D)	Best grief money can buy. Give me a ride home? Bishop nods to the head limo where Louise is waving
BISHOP	Looks like you have one.
STEVE	Yeah, all of that. Empty limos. Fake guests. All so that the papers print what an important and respected man Harry was. Steve takes in the one or two guests, already counting their
STEVE (CONT'D)	Well, I hope it's what Harry would have wanted. But it's not for me. Beat. Bishop nods.
STEVE	You know, what I don't get is you. Harry didn't have any friends.
BISHOP	Your dad worked with my father a long time ago.
STEVE	So?
BISHOP	So, just paying my respects.
STEVE	So your old man was into all that? Yeah, he was into all that.
STEVE	Well, that is refreshingly honest, Mr. Bishop. What about you? Bishop doesn't answer, steers the car up a manicured drive. Steve takes the whole thing in, nods, somehow pleased.
STEVE	Why is it so comforting, when people surpass even our lowest expectations? Come on in, meet the crowd.
BISHOP	No, thanks. I've got to --
STEVE	Please. A favor to me. None of these people even remembered what today was. Bishop nods. They move into the scene. People recognize
STEVE (CONT'D)	Do you believe in fate, Mr. Bishop?
BISHOP	Why? A basketball hoop has been set up near the pool. Young men
STEVE	I think maybe we're all doomed to become our fathers. I'll probably die spoiled, corrupt, lonely and alone. Runs in the blood. What would that make you?
BISHOP	You're still young. You can do pretty much whatever you please. AT THE HOT TUB, two girls kiss each other, filmed in DV by an
STEVE	You think so? Just chuck all this and go help the children in South America, something like that?
BISHOP	Maybe.
STEVE	Well look at you, Mr. Bishop. You're a dreamer. Steve heads inside. A beat, Bishop follows. Well? Do you want to...?
STEVE	No, in fact I'm pretty sure that's illegal in this state. Come on, this way. Steve leaves the Beauties disappointed, moves up some stairs. Two bump fists with Steve. One fronts cool at Bishop, fakes On the floor, paintings of Harry McKenna, discarded.
STEVE	You know, I went up there. To where my father died.
BISHOP	Oh?
STEVE	Hell of a place to die. Lonely... Bishop comes abreast of Steve, also looks down. Removed from
BISHOP	That all yours?
STEVE	If the body is weak, the mind can't be strong. Bishop nods, impressed. Something about this young man.
MALE VOICE (O.S.)	Steve! Steve, man. It's Louise. At the door, a FRIEND of Steve's is held back by security.
FRIEND	She's up in the bungalow. I think she might really do it this time. My girlfriend thinks that my father's death is a good time to kill herself. She thinks I'm not showing the appropriate human reaction.
BISHOP	I'll let myself out.
STEVE	No, please. You've seen this much. Aren't you interested? I am. Off Bishop...
LOUISE	Who's he?
STEVE	A friend. Would have thought you'd have started by now.
LOUISE	This isn't about me. It's about you. You need to watch. Steve crouches down, pours himself a shot from her whiskey
STEVE	Okay. I'm here. I'm watching.
LOUISE	You don't believe I'll do it.
STEVE	No, I know you, Louise. You'll do just about anything if it'll get you enough attention.
LOUISE	You think you can hide behind that cool attitude. Like nothing matters to you. But I know you. You care. You feel.
STEVE	Do I? Louise blinks, scared a little. But she pushes the fear Blood runs... stains the water rose.
STEVE (CONT'D)	...Wow.
LOUISE	How long will it take? Mr. Bishop? Bishop rises, looks down at her in the tub.
BISHOP	How much do you weigh?
LOUISE	A hundred and ten. His eyes take in her body, the flow from her wrists...
BISHOP	You're a hundred and twenty-five. It'll take an hour and a half, maybe two. When you get cold... then you'll know you're close. Steve takes in Bishop in this moment, nods. Glances at the
LOUISE	He'll stop it. He thinks he's above it all. But he's not. No one is. Bishop nods. Not clear if he's agreeing or observing. Steve! Steve! I know you feel this. I know you'll stop me. If you don't care anything about your life, why should I? Steve looks to Bishop. He checks his watch. 10:30.
LOUISE	I'm getting cold. Please. I'm frightened. I'm scared, Steve. Bishop looks at Steve who just keeps staring outwards.
STEVE	You can help her if you want. The sounds of water, splashing. Louise arrives on the patio,
LOUISE	You're a bastard.
STEVE	You know what the kick of it is, Louise? If you actually had the stones, then there's be something for us. But in 30 seconds when you run down that path and all of those people go crazy saving your life... Well, then we'll be done. I know. Catch-22. Life's not fair. What happened to you?
STEVE	Maybe nothing. Maybe you never really knew me. A beat. Louise, looking between the two men. She SWAYS on
LOUISE	You're a bastard, too. Both of you. Like looking in some dark mirror.
STEVE	Go on, Louise. You'll do fine. The world's gonna love you. Louise steps away, turns, stumbling down the path into the
BISHOP	Would you have let her do it?
STEVE	We'll never know, will we? Steve rises, heads up a small path.
BISHOP	You didn't answer my question.
STEVE	Everybody dies.
BISHOP	Sure. But it's a whole other world when you're personally involved. There's a very big tab that has to be picked up.
STEVE	Such as? Bishop stops, looks down at the action far below them.
BISHOP	Governments, cops, the military... we give young men a licence and send them into it blind, thinking it'll all be okay. Because someone told them they had permission. But when you cross over that line, you do it alone. Most people, they stay that way from then on. Alone.
STEVE	Everybody can kill. You take a mother, protecting her child...
BISHOP	Sure. But that's instinct. What I'm talking about is up here... Knowledge of foresight. Intention. A person who knows that the only way to truly be free of man's laws, is to break his highest one. Beat. It sits there, between them.
STEVE	Why are you telling me all this?
BISHOP	Why did you want me to see that little stunt with your girlfriend? Bishop stares down the hill at the commotion. Ants swarming.
BISHOP (CONT'D)	These aren't your people, are they? You don't have "people." Your life is crowded, but you're alone. Steve unconsciously nods, then:
STEVE	You know, you're right. You grow up spoiled, rich, like me... Only thing you really learn to recognize in people is when someone wants something from you. What do you want, Mr. Bishop? What are you doing here? Bishop considers Steve, thrown. Then...
BISHOP	Thanks for the tour. It's been interesting.
STEVE	Yes, it has. Bishop turns, heads back down towards the estate. Steve
WOMAN ON TV	Hey, you. Jesus, what a night. We went to opening of Fernando's new restaurant and Betty was there wearing -- well, whatever we call those things she wears... ON THE STACK OF DVDs. There must be twenty of them.
WOMAN ON TV (CONT'D)	I miss you. Everybody says hi, of course. But with me... it's like I feel you there with me, even when you're not. ON THE TV: She pulls her shirt off over her head, faces the
WOMAN ON TV (CONT'D)	I feel the way you touch me... Bishop rises, blows out of the room. BISHOP'S P.O.V.: Laughter, smiles, hands touching, hands
FEMALE DOCTOR	Quite a collection you have here. Military?
BISHOP	Something like that.
FEMALE DOCTOR	Does this hurt? Bishop smiles, recognizing the nature of the touch.
BISHOP	Yes, a little. The doctor lets her hands rest just a fraction too long, then
FEMALE DOCTOR	Any next of kin, anybody we can notify? How about an acquaintance?
BISHOP	Am I going to die? No, not today. Bishop reaches for his shirt, slips it on.
FEMALE DOCTOR (CONT'D)	You damaged your deltoid muscle. But that doesn't explain the anxiety attack.
FEMALE DOCTOR (CONT'D)	Any unusual stress recently? Something at work? I'm prescribing Cataflam for the pain and Paxil for the stress and I'm going to give you my card. If you have any other episodes... or if you need anything else, don't hesitate to give me a call. She holds out her card. He looks at her, lets her stay that
FEMALE DOCTOR (CONT'D)	You can pay at the desk. The Doc demonstrates the precise hold, the pressure points BANG! BANG! BANG! POUNDING on his front door. Bishop's
STEVE	Mr. Bishop! Arthur! Please, I need to speak with you. The front door opens. Bishop, fronting sleepy. Steve is
BISHOP	What time is it?
STEVE	I wanna show you something. Please. It'll be... It'll be interesting.
BISHOP	Gonna tell me what the big surprise is?
STEVE	I'd rather show you. I know, melodramatic. But I think it'll be worth it to you. Bishop TENSES, almost imperceptible as Steve pilots the car Steve opens his case, starts tossing down PHOTOGRAPHS: Maybe it's time you start talking.
STEVE	You know what that says? My dad didn't die of a heart attack. I mean, he was dying of a heart attack, but that's not what killed him. The blood flow to his brain was cut off, his brain died before his body. Somebody killed him. On Bishop, considering Steve.
BISHOP	What do the police think? The police? They don't want to hear about this. I mean, they'll look into it. But they don't very much like the idea that they totally missed this one and it'd be just easier for everyone if I would shut the hell up.
BISHOP	...What do you want?
STEVE	They killed him. Here, on the roof of his own building. His own security all around. Why here? Why even kill him, if he was already dying?
BISHOP	You tell me.
STEVE	To make a point. That no one's safe. That they can get to anyone, whenever they want to.
BISHOP	So what am I doing here? Bishop, supremely alert, listening. Tracking shadows...
STEVE	I got my black belt in Karate when I was nineteen. I've studied Judo since I was six.
BISHOP	I'm impressed.
STEVE	No, you're not. Most people are, but you're not. If I came at you right now, I'd wind up dead as my father, wouldn't I? Bishop doesn't answer. Steve breaks away, looks down at the
STEVE (CONT'D)	Same as if I tried to exact justice for my father. These men, what this is... It's something you know about, isn't it? Something you could teach me.
BISHOP	I didn't get the impression you even liked Harry very much. Steve SURGES forward. Real anger, intensity boiling over.
STEVE	You really going to stand there and judge how much I loved my father? What the hell do you know about it? Bishop, hearing this. A nerve touched.
STEVE (CONT'D)	Besides, this isn't just about Harry. Harry's dead, may he rest in peace. But this is about me. They came here and they killed my father. They did that to me.
BISHOP	You want revenge. Steve doesn't answer. A long moment between them. Steve
STEVE	You know the word "Nemesis"? It's not actually a word. It's a name. She was one of the Greek goddesses. Of anger. Retribution against any mortal who became too proud. The executor of divine justice. It's a beautiful idea, don't you think? Justice.
