CHARACTER	DIALOGUE
ANOTHER SOLDIER	Do we engage? Do we engage? Mal and the others tense up. River turns slowly to face the
SOLDIER (O.S.)	Targets are acquired! Do we have a kill order? Do we have an order? The camera moves to the right and we see another such stone, The third is Hoban Washburne. Wash. The camera continues moving right, but the next stone houses She moves away from the stone as Mal does likewise. They're She stands at the stones a moment, then holds the taper to WIDE ON the group, as the fireworks go off over their heads. Close on Mal as he watches it go... A beat, and River's head appears from the crawlspace above,
MAL	If you're here to tell me we ain't finished... then we will be real quick. The Operative stands just under the canopy of the nose of the
THE OPERATIVE	Do you know what an uproar you've caused? Protests, riots -- cries for a recall of the entire Parliament. We've seen the broadwaves.
THE OPERATIVE	You must be pleased.
MAL	'Verse wakes up a spell. Won't be long 'fore she rolls right over and falls back asleep. Taint my worry.
THE OPERATIVE	I can't guarantee they won't come after you. The Parliament. They have a hundred men like me and they are not forgiving.
MAL	That don't bode especially well for you... giving the order to let us go, patching up our hurt...
THE OPERATIVE	I told them the Tams were no longer a threat -- damage done. They might listen, but... I think they know I'm no longer their man.
W MAL	They take you down, I don't expect to grieve overmuch. Like to kill you myself, I see you again.
THE OPERATIVE	You won't. There is... .nothing left to see. Mal looks at him a moment, then picks up his gear to head "Serenity". You lost everything in that battle. Everything you had, everything you were... how did you go on? Mal hits the button to close the inner doors, steps inside as You still standing there when the engine starts, you never will figure it out. The Operative watches the door shut. A moment, and he goes.
MAL	What a whiner...
ZOE	Sir, we have a green light. Inspection's pos and we're clear for upthrust.
MAL	Think she'll hold together?
ZOE	She's tore up plenty. But she'll fly true.
VW	A beat between them before:
MAL	Make sure everything's secure. Could be bumpy.
ZOE	Always is. She takes off and Mal heads up the stairs.
MAL	We're taking her out. Should be about a day's ride to get you back to your girls.
INARA	Right.
MAL	You ready to get off this heap and back to a civilized life?
INARA	I, uh... I don't know. He looks at her, a smile in his eyes.
MAL	Good answer. He turns and heads into the bridge.
MAL	You gonna ride shotgun, help me fly? V0 River is in the copilot's seat, looking intently at the
RIVER	That's the plan.
MAL	Think you can work out how to get her in the -- She is flipping switches without even looking, as the ship
MAL	Okay, clearly some aptitude for the... but it ain't all buttons A0 and charts, . You know what the first rule of flying is? Well, I suppose you do, since you already know what I'm about to say.
RIVER	I do. But I like to hear you say it. He looks out at the rain on his windows, at his screens,
MAL	Love. You can learn all the math in the 'verse, but you take a boat in the air you don't love, she'll shake you off just as sure as the turning of worlds. Love keeps her in the air when she oughta fall down, tells you she's hurting 'fore she keens. Makes her a home. River also looks out at the sky.
RIVER	Storm's getting worse.
MAL	We'll pass through it soon enough. There is a spark and a piece of paneling pops off, whips at What was that?
