CHARACTER	DIALOGUE
SCOTT BRUMBERG	Great show, Ram. Ya turned it out. As always.
SCOTT BRUMBERG (CONT'D)	Sorry. I was sure the gate'd be bigger.
FAN #1	Yo, Ram. Think you could...?
FAN #1 (CONT'D)	I was there.
FAN #2	My first match ever was you versus Davey Diamond at the Spectrum.
FAN #2 (CONT'D)	You were awesome.
KID'S VOICE (O.S.)	Ram!
ANOTHER KID'S VOICE (O.S.)	Raaam!
RANDY	Oh, my... look out!
RANDY (CONT'D)	Suplex!
RANDY (CONT'D)	Tombstone piledriver! Catch you maniacs later...
RANDY	C'mon, Len. Don't be such a fuckin' ballbreaker.
LEN THE MANAGER	You'll get in when I get my rent.
RANDY	You know I'm good for it.
LEN THE MANAGER	Sure. You're good for it every time this happens.
RANDY	Can I at least park in back?
LEN THE MANAGER	Twenty bucks.
RANDY	Thanks, Meg.
RANDY	Hey, Wayne.
WAYNE	Do we not know how to knock?
WAYNE (CONT'D)	Let's try that again.
WAYNE (CONT'D)	Come in! Oh, hi, Randy! What can I do for you?
RANDY	Do you have any extra shifts you could throw my way?
WAYNE	What's the matter, they raise the price of tights?
WAYNE (CONT'D)	Let's see what we got.
RANDY	Pretty much anything weekday...
GREGG	I'm tellin' ya, bro, it's identical to the German.
RANDY	I tried Mexican sus once. Gave me bitch tits.
GREGG	Years ago, right? Mexican's way better now.
RANDY	I don't want this.
GREGG	Bro, it's the same.
RANDY	I want my German.
GREGG	I don't have any.
RANDY	Yeah?
GREGG	What are you doing?
GREGG (CONT'D)	That's my own stash. That's my last one.
RANDY	Danke schoen.
SPOTTER	Push it out----you got this!
RANDY	How ya doin', Glor?
FRONT-DESK WOMAN	Hey, babe. Four's open.
RANDY	Don't leave it in too long. All those pieces broke off last time.
KOREAN LADY	Okay, okay, no problem.
NICK VOLPE	Listen up, only saying it once. Vic Storm, you're up first against D- Day. Second, Shawn McPride and Funkmaster Garry B. Slick. Third, Frankie Cirillo and Rob Dynamo versus J.T. Anvil and The Ultimate Freak. Fourth, Teddy Brewski and Lex Lethal. Intermission. Fifth, Samoan Savages versus the Disco Brothers. Sixth, the Irish Warrior and Vyper. Seventh, "Sandman" Steve Sambuca versus Hollywood. Last but not least, for the strap, Kid Loco versus Randy The Ram. Got it? Good.
RANDY	Right there, you post me. Hard. I show color.
RANDY (CONT'D)	You post me again. Again. You're fuckin' whalin' on my ass.
LEX LETHAL (O.S.)	Ram.
LEX LETHAL (CONT'D)	There's some chick out here looking for you.
RANDY	Who?
LEX LETHAL	Some chick.
RANDY	Ring rat?
LEX LETHAL	I don't think so.
RANDY	What's up, kiddo?
RANDY (CONT'D)	Long time no see.
RANDY (CONT'D)	Whatcha doing here? Here to root on your old man?
RANDY (CONT'D)	That's okay----as long as you're not rooting against me!
STEPHANIE	Is there someplace we can talk?
RANDY	I'm on in a sec.
STEPHANIE	It won't take much of your time.
RANDY	What's up?
STEPHANIE	I'm here because...
STEPHANIE (CONT'D)	I came to make amends.
RANDY	Amends?
STEPHANIE	I'm supposed to talk to people I've hurt.
RANDY	Ohh... 12-stepper.
STEPHANIE	AA.
RANDY	Good for you. That's great.
STEPHANIE	Thank you. I'm sure you mean that.
RANDY	I do. So's that it?
STEPHANIE	I need to apologize.
RANDY	For what?
STEPHANIE	For anything I've done or said over the years. All the anger at you.
RANDY	Okay...
STEPHANIE	Like the last time I saw you... I'm sorry for what I said.
RANDY	Don't worry about it.
STEPHANIE	Do you even know what I said?
RANDY	Sure.
STEPHANIE	What did I say?
RANDY	It was about your mom. And me. Like, how I was bad.
STEPHANIE	You have no idea.
MAN'S VOICE (O.S.)	Raa-am!
MEATHEAD #1	Whassup, yo? Randy The Ram!
MEATHEAD #2	We gonna see some action tonight?
RANDY	Tonight's forecast calls for severe butt-whoopin's with a 100 percent chance of pain.
MEATHEAD #1	Could we get a picture?
RANDY	No problemo.
MEATHEAD #1	Think you could...?
STEPHANIE	No problemo.
MEATHEAD #1	Thanks a lot, yo. Kick some ass out there.
RANDY	You know it, broski!
RANDY (CONT'D)	What?
STEPHANIE	Same shit.
RANDY	They're fans.
STEPHANIE	Same old shit.
RANDY	I hafta. It's work.
STEPHANIE	I'm in the middle of saying something important and you drop it for the fucking wrestling.
RANDY	I didn't ask them to come over.
STEPHANIE	It's like I'm 10 all over again.
RANDY	Are we almost done with this?
STEPHANIE	This what?
RANDY	This ATTACK.
STEPHANIE	Yeah. We're done.
KID LOCO	Look at this loser! How pathetic.
RANDY	Let's go home.
TRIO	Ram Jam! Ram Jam! Ram Jam!...
WHOLE CROWD (O.S.)	RAM JAM! RAM JAM! RAM JAM!...
MEDIC	Ram, man, you popped that crowd.
NICK VOLPE (O.S.)	Yo, Ram. Got a sec?
RANDY	For you, needledick? Always.
NICK VOLPE	Do you realize what's coming up? May 6th...
NICK VOLPE (CONT'D)	20th anniversary of you and Ayatollah at the Garden.
RANDY	Holy shit...
NICK VOLPE	I know. Time fuckin' flies.
RANDY	Whatcha thinkin'?
NICK VOLPE	Two words: Re. Match.
NICK VOLPE (CONT'D)	I'm doing a big Fanfest thing down in South Carolina that weekend. I wanna main-event it with you two.
RANDY	Yeah?
NICK VOLPE	Ram-Ayatollah II. 20th anniversary. Hundreds, thousands of screaming fans watching you two make history for the second time.
RANDY	Think Bob'd get back in there? He's pretty retired.
NICK VOLPE	For this? I bet he'd be willing to dust off the old turban.
BIG CHRIS	Whassup, Ram? How ya been?
RANDY	Yo, Big Chris.
BIG CHRIS	Hey, can you get me any more of that IGF-1?
RANDY	What do I look like, some fuckin' two-bit street dealer?
BIG CHRIS	C'mon, hook a brother up. You get the family discount.
RANDY	Swing by the mansion. Any day this week.
BIG CHRIS	You da man, Ram!
RANDY	Thanks, hon.
RANDY (CONT'D)	Cassidy around?
BARTENDER	I think she's VIP-in'.
WOMAN'S VOICE (O.S.)	Trust me, babe. You're gonna be happy.
DUDE #1 (O.S.)	We said the other one.
DUDE #2 (O.S.)	The redhead. With the belly chain.
CASSIDY	Sorry, guys, she's on break. Well, I'm sorry, but we don't want you.
DUDE #3	How old are you, anyway?
BACHELOR	You're, like, my mom's age.
CASSIDY	There's nothing like experience. I've done things your little fiancee's never dreamed of...
DUDE #2	Yeah, like graduate in 1985.
RANDY	Apologize to this lady.
DUDE #3	Who the hell are you?
RANDY	You speak to her with respect.
CASSIDY	I got this. It's okay.
RANDY	No, it's not okay. This is definitely not okay.
RANDY (CONT'D)	I guarantee this woman's 50 times hotter than whatever goombah skank you're about to marry. You hear what he just called Gina?!
DUDE #1	That's my fuckin' sister!
DUDE #2 DUDE #1	Jesus!! What the FUCK!!
CASSIDY	Thanks a lot. That was 200 bucks just walked out.
RANDY	I was just trying to help.
CASSIDY	Did I ask for help? Did I need help?
CASSIDY (CONT'D)	Then don't fuckin' help.
RANDY	You're right. I'm sorry. I'm sorry.
CASSIDY	That's okay.
CASSIDY (CONT'D)	Good to see ya, man.
RANDY	We're talking one of the historic matches in history. 20,000 people. Another million and a half watching at home on pay-per-view.
RANDY (CONT'D)	We were going back and forth, just killin' each other for a half hour. Any wrestling fan, they know all about it.
CASSIDY	Million and a half? Shit.
RANDY	Yeah, it was big. So a rematch... History all over again.
RANDY (CONT'D)	Goddamn you are smokin'.
RANDY (CONT'D)	Who knows. I put on a good show...
RANDY (CONT'D)	Could be the thing that gets me back on top.
CASSIDY	You never know who's in that crowd.
CASSIDY (CONT'D)	Jesus.
CASSIDY (CONT'D)	You're bleeding.
RANDY	Got cut tonight.
CASSIDY	You okay?
RANDY	Ah, it's nothing.
CASSIDY	And they say wrestling's fake.
RANDY	How's this for fake? What's that from?
RANDY	1986. Denver Coliseum. Billy Bob Banjo hit me with his two-by-four. Loose nail tore the bicep open.
CASSIDY	Ow. Fuck.
RANDY	I got even better. 1988. Orlando Arena. Mr. Magnificent tossed me out of the ring. Landed on my shoulder, clavicle snapped in half.
CASSIDY	Doesn't it hurt?
RANDY	Not when they're going crazy for you...
CASSIDY	"He was pierced for our transgressions, He was crushed for our iniquities. The punishment that brought us peace was upon Him, and by His wounds we were healed."
RANDY	What's that?
CASSIDY	It's from "Passion of the Christ". You never seen it? Dude, you gotta. It's amazing.
CASSIDY (CONT'D)	It's, like, so inspiring. They throw everything at Him. Whips, arrows, rocks... Just beat the living fuck out of Him for the whole two hours. And He just takes it.
RANDY	Huh. I'll have to check it out.
CASSIDY	The sacrificial Ram...
CASSIDY (CONT'D)	Ah, shit.
CLUB D.J. (O.S.)	And now, please welcome to the Cheetah's stage...
CLUB D.J. (O.S.) (CONT'D)	...the lovely Cassidy!
RANDY	What do I owe?
CASSIDY	Just gimme for three.
CASSIDY (CONT'D)	You'll wait `til I'm done?
LEX LETHAL	Thanks for the lift, bro.
RANDY	No prob. You're right on the way.
RANDY (CONT'D)	So how big's this place?
LEX LETHAL	Nice. Two, two-fifty... You been there. The Ricky Whipsaw memorial benefit.
RANDY	That place?
LEX LETHAL	Should get a good gate. DiFusco says he's gotten like 20 calls last two days alone.
RANDY	God bless hardcore...
RANDY	Whatcha think?
LEX LETHAL	Cookie trays were better.
LEX LETHAL (CONT'D)	Hell, yeah.
RANDY	Let's see if they got extension cords.
ANNOUNCER	Ladies and gentlemen...
ANNOUNCER (O.S.)	From Elizabeth, New Jersey, weighing in at 218 pounds... The former WWF superstar and wrestling legend... The one, the only... Randy "The Ram" Robinnnnsonnnnn!
AC/DC	If you want blood, You got it!/ If you want blood, You got it!
AC/DC (CONT'D)	Blood on the streets, Blood on the rocks/ Blood in the gutter, Every last drop/ If you want blood, you got it!!
ANNOUNCER	And his opponent: From Hampton, Virginia, weighing in at 295 pounds...
ANNOUNCER (CONT'D)	Hellbilly Cannibaaaal!
HELLBILLY CANNIBAL	Is there a doctor?
JERRY DIFUSCO	Randy. You okay?
JERRY DIFUSCO (CONT'D)	Call 911.
JERRY DIFUSCO (CONT'D)	Let's get him up.
LEX LETHAL	Put him down.
JERRY DIFUSCO	Get back, get back, get back.
LEX LETHAL	You're okay, buddy. Hang on.
LEX LETHAL	Stay with us, bro. Help's coming.
MAN'S VOICE (O.S.)	Mr. Ramovic.
RANDY	Call me Randy.
RANDY (CONT'D)	So how we lookin', doc?
DR. TARACHANDANI	A lot better than before the bypass.
RANDY	Great. So I'm all good.
DR. TARACHANDANI	Your heart... You're going to have to start taking much better care of it.
RANDY	Like...
DR. TARACHANDANI	For starters, you must take your medication every day.
RANDY	I could handle that.
DR. TARACHANDANI	No smoking. And no cocaine.
RANDY	I don't do coke.
DR. TARACHANDANI	It's all over your blood work.
RANDY	Maybe once in a while.
DR. TARACHANDANI	Well, it has to be never.
DR. TARACHANDANI (CONT'D)	As for exercise, it's still okay, as long as it's moderate.
RANDY	So, like, wrestling...
DR. TARACHANDANI	Not a good idea.
RANDY	What if I do it moderate? I could hold back on certain moves. There's always ways to fake----
DR. TARACHANDANI	Mr. Ramovic...
RANDY	Randy.
DR. TARACHANDANI	Randy, a man with your heart should not be flying around a ring crashing into people.
RANDY	With all due respect, Dr... ...Trachanani, I'd like a second opinion on that.
DR. TARACHANDANI	Of course. But I promise you, any doctor I showed your file would say the same thing.
DR. TARACHANDANI (CONT'D)	You almost died. The next time, you won't be so lucky.
RANDY	I want a second opinion.
DR. TARACHANDANI	Your heart's been through a lot. Even before the heart attack, it was significantly----
RANDY	I want a second opinion. I WANT A SECOND OPINION.
ADMISSIONS-DESK WOMAN	This is your copy.
ADMISSIONS-DESK WOMAN (CONT'D)	This was left for you. REST UP, FEEL BETTER. ----JERRY DIFUSCO PS... IF YOUR UP BY THE 23RD, I GOT SOMETHING IN YONKERS
ADMISSIONS-DESK WOMAN (CONT'D)	You have somebody picking you up?
RANDY	Yeah.
WOMAN'S VOICE (O.S.)	Robin Ramovic?
PHARMACIST	Robin Ramovic?
PHARMACIST (CONT'D)	Is that you?
LEN THE MANAGER	You alright?
RANDY	Yeah.
LEN THE MANAGER	Welcome home.
RANDY	Yo, Adam!
RANDY (CONT'D)	Wanna play Nintendo?
ADAM	What's that square?
RANDY	What square?
ADAM	That you're hitting me with.
RANDY	It's a folding chair.
ADAM	That's a chair?
RANDY	Yes, it's a chair.
ADAM	This is old.
RANDY	1988 ain't old.
ADAM	That was, like, 50 years before I was born.
RANDY	Shut up and fight. Ad-aam!
ADAM	Coming!
RANDY	Ready?
RANDY	One more?
ADAM	I gotta go.
RANDY	Don't you wanna get even? I whipped your butt.
ADAM	That's okay.
CASSIDY	Hey, sweetie. You're back soon.
RANDY	Ah, I was just in the neighborhood.
RANDY (CONT'D)	Hey, feel like maybe grabbing a burger?
CASSIDY	I'm working.
RANDY	How `bout later, then?
CASSIDY	You okay?
RANDY	Can we talk for a sec?
CASSIDY	Sure. What's up?
RANDY	Someplace more quiet.
CASSIDY	Randy, I can't leave with a customer.
RANDY	I had a heart attack.
CASSIDY	Shit. When?
RANDY	I needed to talk to somebody.
CASSIDY	You can't talk here?
RANDY	Just a couple minutes.
CASSIDY	Randy, I don't do that.
RANDY	Please.
CASSIDY	Where are you parked?
RANDY	In back.
CASSIDY	Go to your car. I'll meet you out there in 15 minutes.
RANDY	Thanks. I appreciate it.
CASSIDY	That's okay.
CASSIDY (CONT'D)	I'm sorry. That's fucked up, dude.
CASSIDY (CONT'D)	When was it?
RANDY	Last week.
CASSIDY	You okay?
RANDY	Yeah, yeah. Feelin' much better.
CASSIDY	Good, good. What happened?
RANDY	It was while I was wrestling. I collapsed in the ring.
CASSIDY	Oh, man. That's terrible.
RANDY	Yeah, it was pretty fucked up.
RANDY (CONT'D)	Tell ya, though, it was a big hit with the fans. Promoter told me everybody was hanging around wondering if I was okay, they wound up buying up all of his T-shirts and shit. Whole merch table got cleaned out.
CASSIDY	That's funny.
RANDY	Doctor says I can't wrestle no more.
CASSIDY	Damn. What are you gonna do?
RANDY	I don't know. I don't know what to do. If I can't wrestle...
CASSIDY	It just happened. You don't have to figure everything out this second. Give yourself some time.
RANDY	Time's all I got. I just sit there all day...
CASSIDY	You really shouldn't be alone right now.
RANDY	That's why I came to see you.
CASSIDY	Randy...
CASSIDY (CONT'D)	I feel bad what happened. But you and me... I can't go there.
CASSIDY (CONT'D)	You should be with family now. You have a daughter, right? Where is she?
RANDY	We don't really get along too good.
CASSIDY	It doesn't matter. You need her.
RANDY	She don't need me.
CASSIDY	Everybody needs a father. Trust me.
CASSIDY (CONT'D)	I'm sorry. I gotta get back in.
CASSIDY (CONT'D)	You take care of yourself. You gonna be okay?
RANDY	I'm Randy The Ram. I've taken bigger bumps than this.
CASSIDY	I'm sure.
RANDY	Maybe I'll give my daughter a call.
CASSIDY	You should.
RANDY	Why the fuck not? I'm her father. A person only gets one father in this life.
CASSIDY	Exactly.
RANDY	Unless you're adopted.
CASSIDY	You're gonna be just fine.
RANDY	Definitely.
STEPHANIE'S VOICE	This is Stephanie, you know what to do.
RANDY	Hey... Is Stephanie home?
THE WOMAN	Who can I say it is?
RANDY	Her father.
RANDY (CONT'D)	Where you going? Stephanie!
STEPHANIE	What do you want?
RANDY	Can we talk?
STEPHANIE	Now's really not a good time.
RANDY	Wait! Where ya going?
RANDY (CONT'D)	You in school? That's great.
RANDY (CONT'D)	What school? What school?
STEPHANIE	Middlesex County Community.
RANDY	Middlesex? That's kind of a hike. Where's your car? You taking the bus? Lemme give you a lift.
STEPHANIE	That's okay.
RANDY	It's no problem. Really. I'm parked right by.
RANDY (CONT'D)	You're walking pretty fast there. You running late? I could help you with that. Give you a ride.
RANDY (CONT'D)	New Jersey Transit sucks!
RANDY (O.S.) (CONT'D)	The buses smell like piss!
STEPHANIE	Left at the second stop sign.
RANDY	Yes, ma'am!
STEPHANIE	You gonna talk?
RANDY	There's something I wanted to tell you.
STEPHANIE	Okay...
RANDY	I had a heart attack. Last week.
RANDY (CONT'D)	I wanna try to fix things.
STEPHANIE	You are such an asshole.
RANDY	Why?
STEPHANIE	Now you wanna fix things. Now that suddenly you're all scared and alone from your heart attack.
RANDY	What? No. It's not like----
STEPHANIE	This is so fuckin' you. You only come around when you need something from somebody, when they can do something for you. Selfish fuck. Good. Be alone.
RANDY	What are you doing?
RANDY (CONT'D)	Stephanie!
SCOTT BRUMBERG (O.S.)	Didn't think I'd see you here.
RANDY	Why not?
SCOTT BRUMBERG	Heard you collapsed at the DiFusco show. Sounded pretty scary.
SCOTT BRUMBERG (CONT'D)	What?
RANDY	Sold the shit outta that one.
SCOTT BRUMBERG	No way!
RANDY	I gotta give credit. DiFusco came up with the idea. We're setting up an angle for a grudge match.
SCOTT BRUMBERG	Wow... Dude, you are good.
SCOTT BRUMBERG (CONT'D)	I was sure I'd have to cancel the minivan.
RANDY	What minivan?
SCOTT BRUMBERG	The one I rented for Fanfest.
SCOTT BRUMBERG (CONT'D)	Me and a whole gang's driving down. Terry C., Caggiano, Fatback... I am so fuckin' psyched. You see the flyer?
SCOTT BRUMBERG (CONT'D)	Volpe gave me an assload to pass out.
SCOTT BRUMBERG (CONT'D)	That is gonna be epic.
NICK VOLPE PRODUCTIONS PRESENTS	"LEGENDS OF THE RING" FANFEST N A 20TH ANNIVERSARY REMATCH OF THEIR LEGENDERY EPIC DDIE RUCKUS, THE MORTICIAN, DEAN "THE DREAM" GIGUNDA,
RANDY	Looks great.
SCOTT BRUMBERG	Should get a pretty good crowd today.
RANDY	I'll start loosening up.
FAN	Thanks.
RANDY	You got it, broski.
SCOTT BRUMBERG (O.S.)	Sorry, man.
SCOTT BRUMBERG (CONT'D)	I was sure the turnout'd be bigger.
CASSIDY	Would you like a lapdance, sweetie?
CUSTOMER	That's okay.
CASSIDY	Would you like a lapdance?
GUY #1	Not right now.
GUY #2	I'm good. Hey.
CASSIDY	Hey. How ya feeling?
RANDY	Better. Good.
CASSIDY	How'd it go with your daughter?
RANDY	Good. Fine.
CASSIDY	Yeah?
CASSIDY (CONT'D)	You sure?
RANDY	Not too good, actually. She tore me a new asshole.
CASSIDY	Shit. That sucks.
CASSIDY (CONT'D)	It's tough. You can't give up. You gotta keep trying.
RANDY	I was thinking about maybe getting her a present.
CASSIDY	That's a great idea! What's she into?
RANDY	I'm not sure.
CASSIDY	How old is she?
RANDY	
CASSIDY	What kind of music does she like?
RANDY	I don't know.
CASSIDY	Is she into books? Cooking?
CASSIDY (CONT'D)	How could you not know? She's your daughter.
RANDY	I'm a shitty fuckin' father.
CASSIDY	She's 22? Okay... You should get her some clothes, some kinda clothes... All girls like that.
RANDY	That could work.
CASSIDY	I know the perfect place. This kick- ass little vintage shop in Westfield.
RANDY	Yeah?
CASSIDY	Saturday's the best time to go. That's when they get the new stuff in, all these boxes full of great shit.
RANDY	Okay. Cool.
CASSIDY	I'll write it down.
CASSIDY (CONT'D)	I'm pretty sure it's on 28.
RANDY	Good tip. Thanks.
CASSIDY	You got it.
RANDY	I'm gonna grab a drink at the bar.
RANDY (CONT'D)	That was fast.
CASSIDY	Listen...
CASSIDY (CONT'D)	How `bout I meet you there Saturday? Help you out.
RANDY	Yeah? I'm actually gonna be running around right in that area anyway, so it's not really a pain.
RANDY	All right. Thanks.
CASSIDY	No problem. You got it.
WAYNE (O.S.)	Yeah?
RANDY	Hey, Wayne. Got a sec?
WAYNE	Not really. What?
RANDY	I was wondering if you had something more steady. Full-time.
WAYNE	Only thing I got right now's got weekends.
RANDY	That works.
WAYNE	Isn't that when you sit on other dudes' faces?
RANDY	What is it?
WAYNE	Deli counter.
RANDY	So, like, working with customers?
WAYNE	All day long, hot horny housewives begging for your meat. And prepared salads.
RANDY	That's the only thing you got?
WAYNE	At the moment. You interested?
CASSIDY (O.S.)	Hey.
RANDY	Hey.
RANDY (CONT'D)	I almost didn't recognize you. You look all... clean.
CASSIDY	"Clean"?
RANDY	Like classy.
CASSIDY	Gee, thanks.
RANDY	Nah, nah, I don't mean that bad. I like it. It's like in "Grease", where she turns into the hot rock `n' roll chick at the end. Except backwards.
CASSIDY	Oh-kaay...
RANDY	So, uh... Should I call you Cassidy or Pam?
CASSIDY	Pam. But don't get used to it.
RANDY	This is awesome... We are gonna find something great!
CASSIDY	Do you know her size?
RANDY	She's kinda skinny, a little shorter than you.
CASSIDY	Could you see her in this?
RANDY	Maybe. Not really. I'm not sure.
CASSIDY	What about this?
CASSIDY (CONT'D)	So like, what is she? Goth? Punk? Hippie? Preppy? Stoner?
RANDY	Not really...
RANDY (CONT'D)	Hey, Pam?
CASSIDY	Yeah?
RANDY	Thank you very much.
CASSIDY	You're welcome.
RANDY	I think she might be a lesbian.
RANDY (CONT'D)	Does that help?
RANDY	Ah, maybe she's just a friend.
RANDY (CONT'D)	What's that? The green.
CASSIDY	This?
RANDY	It's perfect.
CASSIDY	I agree.
RANDY	Thanks again.
CASSIDY	You found it.
RANDY	I never woulda known about this place.
CASSIDY	Okay, I'll give you that.
CASSIDY (CONT'D)	Look, I...
RANDY	Man, I worked up a pretty good thirst in there. What say we grab a beer?
CASSIDY	I gotta get going.
RANDY	One beer! We gotta re-hydrate!
CASSIDY	I really can't. I got a kid at home.
RANDY	You have a kid?
RANDY (CONT'D)	I had no idea.
RANDY (CONT'D)	Boy or girl?
CASSIDY	Boy. Daniel.
RANDY	How old?
CASSIDY	Nine.
RANDY	Wow... I had no friggin' idea.
CASSIDY	It's not something I usually tell customers. Not exactly a turn-on.
RANDY	Wait.
RANDY (CONT'D)	Now both our kids got something.
RANDY (CONT'D)	You're gonna turn this down, too? Man, you're rough!
CASSIDY	That's very nice of you. Thank you.
RANDY	Tell him to take good care of that. $300 bucks on eBay.
CASSIDY	Really?
RANDY	Nah.
CASSIDY	One beer.
RANDY	He's a good-lookin' kid.
CASSIDY	I think so.
RANDY	I see where he gets it from.
CASSIDY	He sure doesn't get it from his douchebag father.
RANDY	What's that?
CASSIDY	Just this condo thing, down by Trenton.
RANDY	You moving there?
CASSIDY	Working on it. It's a great area. Way cheaper. And the schools are awesome.
RANDY	What about Cheetah's?
CASSIDY	I'm done. I'm quitting.
RANDY	Oh. Okay...
RANDY (CONT'D)	Hell, yeah.
RANDY (CONT'D)	C'mon. Let's dance.
CASSIDY	Where?
RANDY	Right here.
CASSIDY	This isn't a dance place.
RANDY	Who cares? Fuckin' Def Lep!
CASSIDY	I've danced to this plenty.
RANDY	Fine. Then I'm dancing for you.
CASSIDY	Is this a lapdance I'm getting?
RANDY	Just sit back and enjoy.
RANDY (CONT'D)	The lapdancer has become the lapdanced.
CASSIDY	I think we can get you a shift.
RANDY	Take a bottle, shake it up/ Break the bubble, break it u-up... Pour some sugar on me! In the name of love!
CASSIDY AND RANDY	Pour some sugar on me! C'mon fire me up! Pour your sugar on me! I can't get enough... I'm hot, sticky sweet/ From my head to my feet yeah...
RANDY	They don't make `em like they used to.
CASSIDY	Fuckin' eighties, man. Best shit ever.
RANDY	Def Lep, Gunners...
CASSIDY	The Crüe...
RANDY	Then that Cobain pussy had to come around and ruin it all.
CASSIDY	Like there's something wrong with having a good time.
RANDY	Fuckin' mopey douchebag. "Ooh, look at me! I wear flannel! I'm all depressed!"
CASSIDY	"I'm from Seattle! I like rain!"
RANDY	Nineties fuckin' sucked.
CASSIDY	No shit...
CASSIDY (CONT'D)	No contact with the customers.
RANDY	You're right. My bad.
CASSIDY	Shit.
RANDY	What's up?
CASSIDY	I totally didn't realize the time.
RANDY	We just got here.
CASSIDY	I should get home.
RANDY	C'mon. You said one beer!
CASSIDY	Good night.
WAYNE (O.S.)	Here ya go.
RANDY	I thought it was gonna say Randy.
WAYNE	Guess they got it off your W-4.
RANDY	Do I really even need to wear one?
WAYNE	Are you gonna be interacting with our valued Shop-Rite customers?
RANDY	Yeah, but I----
WAYNE	Then yes.
RANDY	Could they maybe re-do it?
WAYNE	Just wear the fucking thing.
RANDY	Seventeen.
WOMAN	The Hudson Acres, are they all on sale or just the regular?
WOMAN (CONT'D)	It's a little unclear.
WOMAN (CONT'D)	I'd prefer the maple-glazed, but if it's full price...
RANDY	Hang on, let me...
RANDY (CONT'D)	Wayne, please come to the deli counter.
RANDY (CONT'D)	It'll just be a minute.
WOMAN	Which in your opinion is the best smoked ham?
RANDY	I guess it depends what you like.
WOMAN	I tried the Apple Valley Farms once, and it was very salty. Do you find that?
RANDY	Forty-six.
WORKOUT WOMAN	Could I get a half-pound of the pesto pasta salad?
RANDY	Sure.
RANDY (CONT'D)	Pesto change-o.
RANDY (CONT'D)	Wow. I am good.
RANDY (CONT'D)	Can I get you anything else?
YOUNG WOMAN	Nope. That's it.
RANDY	You have yourself a nice day.
YOUNG WOMAN	I will. You, too.
RANDY	O-57.
RANDY (CONT'D)	Bingo! What's my prize?
RANDY	Anything in the case, sweetheart.
HOUSEWIFE	A pound of chopped liver and a half a pound of egg salad.
RANDY	I think that can be arranged...
STEPHANIE	What are you, stalking me?
RANDY	Do stalkers bring presents?
STEPHANIE	Sometimes.
RANDY	Well, I ain't a stalker. But...
RANDY (CONT'D)	Open it.
RANDY (CONT'D)	The "S" is for "Stephanie".
STEPHANIE	Oh. Okay.
RANDY	I got it just for you.
STEPHANIE	I see that. What's it for?
RANDY	No reason. Just because. Do you like it?
STEPHANIE	I do. It's... shiny.
RANDY	I was looking in this store and saw it, and I just said, "That is it." So what are you doing now?
STEPHANIE	What am I doing?
RANDY	Got any time? I was thinking we could swing by our old favorite spot.
STEPHANIE	We have an old favorite spot?
RANDY	You'll remember when you see. Whaddaya say?
STEPHANIE	Now's not the best time. I've got some things to do.
RANDY	What kinda things?
STEPHANIE	Stuff.
RANDY	You ain't got stuff! C'mon, give an old man a break.
RANDY	You really don't remember?
STEPHANIE	No.
RANDY	Guess you were pretty young.
RANDY (CONT'D)	There used to be this funhouse. The Monster Motel...
RANDY (CONT'D)	They had this cheesy-ass skeleton that popped out of a coffin. You'd get so scared, you'd cry. Then you'd beg to go in again.
STEPHANIE	Always was a glutton for punishment.
RANDY	You'd hop on my foot and wrap your arms around my leg. I'd have to walk you the whole way through like that.
STEPHANIE	I totally don't remember.
RANDY	I do.
RANDY	I accept your apology.
RANDY (CONT'D)	Not like that. I just mean... You made amends. I free you.
RANDY (CONT'D)	Anything you've ever done or said or thought, I forgive. You've done nothing wrong to me. And anything I've ever done... I'm sorry. Truly.
STEPHANIE	Thank you.
RANDY	I was young. My career was booming. All those lights, the fans, the crazy shit on the road... I wasn't thinking about my kid. Or my wife.
