CHARACTER	DIALOGUE
BISHOP	Justice? A beat. Bishop shakes his head, turns, starts to walk back Fine. Fine. In case you haven't noticed, I now have a couple of million dollars to spend on this, so I will find them myself and I'll deal with them myself and if I wind up dead trying, you can bury me right next to dear old dad --
BISHOP	Jesus, stop your whining. SLAP! No one's ever spoken to Steve that way. He STARES. A
BISHOP (CONT'D)	Corner of sixth and Grand. Tomorrow morning. 7:00 am. Don't be late.
STEVE	I won't. Beat. Bishop nods, starts to leave, turns back...
BISHOP	And Steve... no more surprises like this, okay? Steve nods. Bishop goes. On Steve, watching as the elevator
BISHOP	Stay focused. This is a test. Bishop moves down the rows, pulling drapes away as he does.
BISHOP (CONT'D)	You want to know about killing, look around. Steve does, a little creeped out, but keeping it cool.
BISHOP (CONT'D)	The act of killing, is an end in itself. Any other motive keeps it from being pure.
STEVE	The psychopath has no motive.
BISHOP	No, he's driven, compelled, by his sickness. He's as much the victim as those he kills. More drapes fall. Dead eyes stare up at them.
BISHOP (CONT'D)	But when you make your own law, you're responsible to no one else but yourself. Maybe you're free...
STEVE	I understand.
BISHOP	Do you? This isn't some idea anymore. This is the real thing. You still with me?
STEVE	I am. Another drape falls. A beautiful woman. No signs of injury.
BISHOP	Ever heard the term "Mechanic" used outside of its normal meaning?
STEVE	My father used it. A dealer... a guy who works the tables. Bishops smiles, shakes his head.
STEVE (CONT'D)	Or a... killer. A hit man. Bishop just stares. Steve shakes his head, looks away from
BISHOP	What are you thinking?
STEVE	I had you pegged as... a security consultant. Maybe ex-military. Someone who... protects people.
BISHOP	Maybe I do.
STEVE	Or maybe you just get paid to kill people. Bishop nods his head yes.
STEVE (CONT'D)	So why let me in? I mean, I know what I want. What do you get out of it?
BISHOP	...Times are changing. Security is better trained, more lethal. Sometimes I could use a partner.
STEVE	Bullshit. Bishop nods, smiles. He moves away from the tables, leaves
BISHOP	In this... there isn't room for those who are outside of it. There's too much isolation. Friendships can't work. Eventually everyone expects you to account. The isolation... becomes a liability. You stand out. Standing out... isn't good. Steve smiles, shakes his head.
STEVE	You need a... friend?
BISHOP	An associate. I'm offering to teach you something that most people can't be taught.
STEVE	Because you think I'm a natural.
BISHOP	That remains to be seen. But you're alone in there, aren't you? That's... the prerequisite. Steve continues to stare at the bodies. Bishops starts
BISHOP (CONT'D)	Think it over.
STEVE	Bishop... When I find the men who murdered my father. You help me to kill them.
BISHOP	You may never find them.
STEVE	You didn't answer my question. A beat. Bishop nods.
STEVE	I'm still at 130.
BISHOP	Too fast.
STEVE	I know. I'm working on it. Bishop nods, picks up the rifle, sights. BLAM! 1,000 yards
BISHOP	You were still over 100.
STEVE	What am I supposed to do?
BISHOP	There are no perfect situations. You fought me at 100%, so you were winning. But in doing so, you gave up your shooting option. It's all about choices. Always. Bishop starts to leave.
STEVE	Bishop... What's your 100% look like? Bishop smiles. ... who has to PEEL away, off the highway, onto the smooth LOOMING AHEAD: An existing accident. A beer truck jack- Steve SWERVES his car, too fast, it goes into a SPIN... CLIPS BISHOP'S CAR slides to a stop. Bishop gets out, tracks:
STEVE	Come on up, man. The view is beautiful. Bishop takes in the situation, the small crowd gathering...
BISHOP	You lost control.
STEVE	You think? Steve puts out his beer. A hesitation, then Bishop clinks
STEVE (CONT'D)	You ever think about just... going? Leaving. Never turning back?
BISHOP	...Sometimes.
STEVE	Why don't you?
BISHOP	I have... responsibilities. I have a cat. A beat. Steve LAUGHS loud. Bishop laughs. Maybe the first
STEVE	You know, looking at these, a person might think maybe there's a screw or two loose up there... Steve catches sight of a manila envelope in front of his Is this what I think it is? Don't be so eager. Open it. PLANS, diagrams. Pictures. They're of an outdoor area.
STEVE	Who's the Mark?
BISHOP	...I am.
BISHOP (V.O.)	It's not good enough to simply follow your Mark and attack him. Most of these people know they're targets. They'll be watching for you. ... A moment, then Steve enters the frame, tracking Bishop. You need to understand the location, control the situation. You're looking for escapes, security, police presence... Bishop passes two COPS, squeezes between two parked produce
OWNER	Interest you in anything? Bishop takes in the man, eyes check polished reflective
BISHOP	That's a beauty. You know your instruments...
BISHOP (V.O.)	Most of all, you need to answer this question: "How does this man die here today?" Bishop passes a butcher cutting into a slab of meat. Steve
BISHOP (V.O.) (CONT'D)	Everybody, everyday, has a way to die. You have to find it.
SALESMAN	They don't make that anymore. That's a classic. I can let you have it for three hundred... CRASH! The one truck SLAMS into the second, the vice closed, Bishop, at the last minute pulled back by Steve who's holding
BISHOP	...Good. Very good.
STEVE	Good? That's all you got? How about God damn perfect, man?
BISHOP	Don't get cocky.
STEVE	Broad daylight. A thousand witnesses. Man takes a wrong step. Excuse me if I take a moment to appreciate myself. Because that was poetry. You just can't bring yourself to be impressed, can you? Bishops considers, notices that the Luna Cromwell doll has
STEVE (CONT'D)	What's that? You're what? Oh, you are impressed? No, come on, you don't have to say that. Really, I'm fine with -- You what? You've never seen someone better? Wow.
BISHOP	All right. You did very well.
STEVE	Damn straight I did. And now, in celebration of me, I'm taking you to a restaurant where the waitresses... what? Something about Bishop's serious gaze has stopped Steve.
STEVE (CONT'D)	...Bishop?
BISHOP	There's a man behind me. Look up once, then look away. Don't look back. Steve glances up. We realize we're right in front of the You got him?
STEVE	Yeah. Look...
BISHOP	You did good here. Really good. But this was just a game. That man... is your graduation.
STEVE	Who is he?
BISHOP	He owns the watch store.
STEVE	I know. I meant... what did he do? Bishop comes close, FOCUSED.
BISHOP	I've taught you how to kill without anyone knowing there was a murder. I've taught you to be invisible. But that's strategy, not killing. The real test... it's the actual killing, isn't it?
STEVE	Bishop...
BISHOP	Do you want this? Be very sure. Because you can walk away.
STEVE	No. I'm ready. Bishop studies him... nods. Turns to go.
STEVE (CONT'D)	Bishop... We're right here, where you wanted us to wind up. You knew where I'd hit you, didn't you?
BISHOP	...School's out. Bishop leaves. Steve watches him go. Stuck. Helpless. He
BISHOP	Who do you think that is, Luna? He takes a card out of his wallet, studies it. It's from the He returns to his desk, sits. A tiny noise from the hall. A
TRACKING ACROSS THE ROOM	To the front HALLWAY. Steve stands in the hallway, It's open!
WOMAN'S VOICE	I'll just be a minute. A GLIMPSE of the woman in her bedroom, topless in front of a
BISHOP	It's for a friend. Bishop awkwardly sets the doll down near the front door,
BISHOP (CONT'D)	I'm sorry I was away so long this time. I had some complications --
WOMAN'S VOICE	Don't be. He turns. She's emerged from the bedroom, adjusting the
WOMAN	You know who I saw yesterday? Bradley Fliescher. He and Ginny have this little cottage up the coast they hardly use. I was thinking, maybe next week you and I should go. Approaching, handing him a wine.
WOMAN (CONT'D)	You and me, the whole weekend. What would we... do? She approaches him, sexy. Touches him, intimate. He stares
WOMAN (CONT'D)	Of course why do we need that? We have each other right here.
IN THE LIVING ROOM	The owner pauses, enjoying the crescendo of the music. Eyes ... Steve is standing in the doorway to the living room, the The Owner leaps at him with the rack. Steve is BARELY able ... Blood pools on Steve's shirt. Steve and the Owner both Do you know what I dreamed? I dreamed you and I had a child... Bishops turns from the screen, walks away. Beat, she
WOMAN	I know, it's crazy. I don't want to pin you down. I know you need your freedom. I just... sometimes I miss you so much... He's staring at her, oddly.
WOMAN (CONT'D)	What? A beat. His eyes move down to her sofa where another man's
WOMAN (CONT'D)	I'm sorry. Really, I am. I just... You didn't give me any warning this time. I'm sorry, Bishop. It won't happen again. It's okay. Really. It's okay. Steve comes out of nowhere, HITS the man in the head with a Steve rises... and the Man is on him, kicking him. Steve, Steve SCREAMS, surges up with the man... smashing him THROUGH The two men... eye to eye. Fierce, deadly. Steve SQUEEZING ...Finally, the man weakening. In his face... a dull Who... are... you? Steve doesn't answer, just keeps PRESSING. And finally...
WOMAN	Hey, Bishop. You okay? He stares into his wine. Raises the glass to drink. His
BISHOP	Do you remember, what you wanted to be, when you were a little girl? She hears it, it wounds her. Looks down. I'm sorry, I didn't mean... I was thinking of me. She looks up, clear eyes. She's tough.
WOMAN	No, it's okay. I wanted to be a Marine Biologist. I used to watch those Jaques Cousteau movies and just... dream.
BISHOP	What happened? I was beautiful. He hears the simple truth of it, nods, respectful. He rises
WOMAN (CONT'D)	Don't worry about it this time. On the house. A beat. Then he slides the money under the box as before.
BISHOP	We all gotta make a living. He leaves, grabbing the doll as he goes. She watches him go,
SOPHIE	Thank you, thank you! Bishop! Mom!
MOM!	She takes off back into the living quarters of the house.
BISHOP	I saw that in a... I'm sorry, I probably should have asked. A small beat that says "Yes, you should have."
GROCER	Don't worry about it, Bishop. You have a good night.
STEVE (O.S.)	...Can I ask you a question? STEVE sits on his sofa in the dark, head lowered.
BISHOP	Go ahead.
STEVE	Are you surprised to see me? Beat. Steve reaches over, turns on a table lamp as he looks
STEVE (CONT'D)	Guy owns a watch-store, yet keeps a million dollar apartment. Supposedly sits on his ass all day, yet takes stairs double-time. It was sitting there, right in front of my face, wasn't it? Bishop doesn't respond.
STEVE (CONT'D)	Was that the man who killed my father?
BISHOP	There's a code, to what we do. It may not be rational, but it matters. The man's name was Harry Xiao. He was a Mechanic. Last year a US Representative died in a fire... along with his wife and two children.
BISHOP (CONT'D)	A few months ago, a CEO vacationing in Costa Rica was found dead with his wife. Because the woman was tortured, the authorities believed it was drug related.
STEVE	Bishop! --
BISHOP	Civilian casualties are very effective at hiding intent, but there's a line ---
STEVE	I don't give a damn about that! You haven't answer my question: Did he kill my father? Bishop doesn't react, then...
BISHOP	You should put that behind you now. Steve nods, swallowing emotion. Bishop starts to move and
STEVE	I could have died today!
BISHOP	You didn't.
STEVE	Blind fucking luck! Look at me! You tried to kill me! That man was... he was unstoppable.
BISHOP	But you stopped him.
STEVE	Fuck you! You sonofabitch! Give me one good reason I don't blow you away right now! ONE GOD DAMN FAST, Bishop SLAPS the gun away, PINS Steve up against the
BISHOP	Now I'm sorry if you got a little scared. But this isn't coaching girl's softball, is it? This is life or death. Every time you go into this, somebody dies. Every time, it's you or the other man. So stop your crying. He releases Steve who falls to the floor, sucking air.
BISHOP (CONT'D)	You got what you came for, congratulations. You're done Go back to your friends, your women, your whole beautiful life. That used to be my front door. Try to close it on the way out. Bishop starts to go. Steve's words stop him.
STEVE	Bishop. Those things... they don't mean anything to me. This, makes sense. I don't know why. But I think I was meant to do this. And like you said, you could use someone. Bishop studies Steve a long beat. Shakes his head, goes into Almost instantly, the phone rings. Bishop punches on
BISHOP	We should all be so lucky. The phone goes dead. The light on the drive turns GREEN. A second to realize: She's the mark. More pictures, we've
BISHOP (CONT'D)	You get started. I'll make coffee.
STEVE	Bishop... Nemesis. Devine Retribution. ...What did she do? Beat. Unsaid questions asked, unanswered.
STEVE (CONT'D)	Okay. Okay. Forget I asked.
BISHOP (O.S.)	Slow down as soon as you get inside. Security station will be to your left... Steve passes through a door, pauses as two guards talk in the
BISHOP (O.S.) (CONT'D)	How many views?
STEVE	Sixteen, no, eighteen. Four second intervals. One of the men notices Steve who starts forward to ask a
STEVE (CONT'D)	Make that four and a half seconds.
STEVE (O.S.)	These guys are packing Israeli-made Uzis. Couple are actual military. Bishop takes in the other buildings across the street, then
TURKISH ENVOY'S VOICE	No, we're literally locked in here. I'm supposed to be presenting at the UN but I can't do that if everyone is going to panic about security...
TURKISH ENVOY'S VOICE	...This is America. People don't just kill people here. Then she shuts the door. Bishop moves his focus upwards to a Magazine and newspaper clippings about the Mark, showcasing Headlines: "The new (and beautiful) face of Turkey." "The
BISHOP	Work it again.
STEVE	She never leaves. It's like they know we're coming.
BISHOP	Maybe they do. Steve nods, continues pacing, scoops up Bishop's cat and
STEVE	Falls off the rooftop.
BISHOP	Falls or jumps? Steve moves to the wall of pictures, his gaze lingering on I tell you one thing, killing her is not the first thing that jumps to mind... what? Bishop HEARS this, frowns, moves forward. His eyes scan:
BISHOP	Nothing. I'm going for a run. You wanna come?
STEVE	Let me ask you something. You ever not feel like running 5 miles? You like it? Steve REACTS. Didn't hear Bishop come in.
STEVE	I don't know. Feels disturbed.
BISHOP	Always made me feel... understood. Come on.
BISHOP	The Mark is a beautiful woman. Before arriving at her current position, she enjoyed the way men looked at her. That's gone now. She needs to be taken seriously. She hates that men only see the beauty. Magazines, heads of state, all focusing how what a piece of tail she was. Like you did. Steve SQUINTS... Bishop slaps a picture of the pool, the
BISHOP (CONT'D)	Why is he standing here? Wouldn't he get better coverage... here?
STEVE	...He can't see her.
BISHOP	He can't see her. Neither of them can. Beat. PHONE RINGS. Bishop snaps it up. Bishop.
DEAN (O.S.)	Hey, Bishop. Catch you at a bad time? Bishop doesn't respond. Waits...
DEAN (O.S.) (CONT'D)	Always the conversationalist. Anyway, just calling to say we'd like you to go ahead with this one. As soon as you can. Click. Phone goes dead. Bishop hangs it up. Steve looks at
BISHOP	Run it again.
STEVE	Patrol number three moves down the service corridor at 18:50. Five minute window after to make it up top. Three minute climb to position. That's 18:54. Three minute window to engage. Shake, stir, add lime and enjoy. Bishop smiles, looks away.
STEVE (CONT'D)	How'd you get into it? Bishop looks back, surprised. Checks his watch.
BISHOP	...This business, it's not like there's a degree you can go get. It's like most trades, it gets passed down. My father was very good, better than I'll ever be. But no one controls 100%. The nature of the work is that some people know who you are and what you do. A man told his girlfriend, to impress her. The girlfriend told some people she owned money to... Bishop finishes his glass of water.
BISHOP (CONT'D)	I was young. It took me four months to find the people, another to find the girl, and she gave me the Man. That's how I... "got into it."
STEVE	You ever wish you just... walked away? Let it go?
BISHOP	Sure. Every day. But I wasn't wired that way. What about you? Beat. Steve and Bishop, oddly locked... BOOM! BOOM! BOOM!
BISHOP (CONT'D)	Here we go... And they're MOVING.
SECURITY	Fire in the restaurant. Patrols two and five, we're closing down the front entrance.
SECURITY PRO	Excuse me, 'mam. There's a fire next door, nothing to worry about. The Mark nods. The man locks the door behind him, crosses
STEVE	building is going up! Bishop and Steve move on as the startled employees leave.
BISHOP	Ready? Steve hooks on as well, they're both wearing harnesses under Bishop lets himself fall backwards. Jackets strip, reverse to the pattern of the embassy The Mark enters, and hangs up her robe. She goes to the edge ACROSS THE SPACE. The indoor guard checks in on his radio.
WITH THE MARK	She kicks hard, dives under... And we're in her P.O.V. The
ACROSS THE ROOF	The first guard reaches the source of the noise: A plastic
DOWN AT HER!!!!	She opens her mouth to scream... ABOVE THE SURFACE. It's silent. No sign of the violent UNDERWATER. The struggle is violent, silent, terrible in He turns her, stares into her unseeing eyes. Then lets her
GUARD #2 (TURKISH)	It's the second time it's come open. She still swimming?
GUARD #2 (TURKISH)	Oh hell... The Mark floats face-up in the pool, just under the surface.
STEVE	How did it go --
BISHOP	Not yet. As if on cue, an ALARM BLARES. Excited voices come on over
STEVE	Alright, you gotta admire that. You gotta admit, we are a spooky good team... They PUSH through a set of old doors, move fifteen feet to a It's like one moment we're there... the next moment... He ROLLS UP the door. STARES at a NEW WALL OF CEMENT BRICKS.
STEVE (CONT'D)	...we're fucked. Bishop takes in the problem, starts to solve it. He tracks There wasn't any sign of this on the plans. I went over them fifty times!! This isn't supposed to be here! This can't be here! Bishop holds up a finger. "Shhhhhh" They LISTEN. A soft
STEVE (CONT'D)	Bishop... what do we do!?
BISHOP	Duck... Steve looks at Bishop and BOOM! Doors BLOW OPEN, THREE Bishop WRAPS the first man up, uses his Kevlar vest as a Fluid, Bishop REVERSES the man, pushes him AWAY from him, Another down as ANOTHER ATTACKER dives through the door at Bishop SHOVES the last grenade down the front of the dead ... TWO more Security kick open a door, guns fire! Bishop
BISHOP	Hey! Hey! You still here?
STEVE	...It was my fault. I was in charge of the exit. I looked at every work order, every entry in the building logs...
BISHOP	No one controls 100% That's the nature of the beast. Steve swallows, nods as Bishop brings the Buick around a last
BISHOP	Hey! You did good in there. You hear me?. It was asking a lot. You came through. Steve nods, processing, accepting. Another TURN. Bishop Behind them, the police car tears by, lost.
STEVE	You're bleeding.
BISHOP	...Yup.
STEVE	So back there. That was one hundred percent? Bishop looks over, gives nothing. Tiny smile.
STEVE	Do you think you know it, when you've made the mistake you won't survive? Or will it be like the Marks? Wake up on top of the world, never know... Steve glances into the open cabinet where Bishop keeps his
STEVE (CONT'D)	...Oh my God. This is a signed Hendrix Axis, 1967 release. This has gotta be worth... we have to play this. You have to play this.
BISHOP	That one... is for a special moment. Haven't found it yet.
STEVE	You haven't found the... Are you kidding? You have to -- what? Bishop's eyes SHOOT open. He looks out the window where a
BISHOP	This could get... interesting.
MAN	Mr. Bishop? Mr. Dean would like a moment of your time. Off Bishop who... nods. WIDER. The SECURITY PROFESSIONAL is up here with Steve,
STEVE	Do it. I don't care what it costs. Driver pulls the sedan to a stop in front of a large A door opens and a plain woman nods to Bishop.
DEAN	You look like shit. How does Harry McKenna's son figure in?
BISHOP	He's going to be working with me from now on.
DEAN	You sure that's wise?
BISHOP	Do I need your permission?
DEAN	No... And for the record, I don't believe you'd ask for it. Dean grabs a remote control on his desk, points it at the set That was my baby. But my baby has turned into an epic shit-storm and so when the man who caused said epic shit storm suddenly decides to do some soul-searching... What are you doing, Bishop?
BISHOP	The mistake was mine, not the kid's. Dean leans in, intense. Bishop watches the screens. A
DEAN (CONT'D)	I am on some very fucking thin ice right now which means you are on some very fucking this ice as well.
BISHOP	Someone I trained. That could be worth a lot to you. Dean laughs, rises with nervous energy and goes to the
DEAN	And here I thought we were both going to live forever. Bishop smiles. Dean stares at him. Bishop stares back.
DEAN (CONT'D)	You know, in this business, you only get one mistake. So nothing more like that. You take full responsibility.
BISHOP	Yes. The two men, face to face. Then Dean's phone rings. He Hey, Stanley. Yes, we're all sorted out. I just need you to --
BISHOP	The hit, on the woman. What was the reason? Dean looks back, surprised, angered. I'm calling you back. Dean clicks off, takes in this change of rules. A dead
DEAN (CONT'D)	You know, this foul-up, McKenna's son, it's all got some people's panties in a real twirl. This isn't the time for questions. This is the time for survival. Everyone... is expendable. Beat. Dean turns away, picks up the phone again. Yeah, get me Stan again...
LOUISE	Come on, baby. What's the matter? Finally, something does catch his attention: At the gate, a
BISHOP	Steve! Steve...!?
LATER	Bishop tense, in his study, holding the phone which rings...
LATER	Bishop, sitting on his couch. On the TV in front of him, His phone rings. He snatches it up.
BISHOP (CONT'D)	Bishop.
STEVE (O.S.)	You're still alive.
BISHOP	Seems that way.
STEVE (O.S.)	Hey, can you meet me? Something I want to talk with you about. Bishop, silent.
STEVE (O.S.) (CONT'D)	It's important. Come up to the house. Please, okay?
BISHOP	Okay.
STEVE	There you are. Thanks for coming.
BISHOP	What's on your mind? Steve just smiles, shakes his head. Bishop stares at him, Bishop ducks, rolls, his hand moving under his jacket... Bishop rises. Women come to him, touch him, put a party hat
BISHOP	It's not my birthday.
STEVE	When was the last time you celebrated your real birthday? No response from Bishop. Steve nods, swigs the bottle again.
STEVE (CONT'D)	See? You're overdue, buddy.
BISHOP	Who are these people?
STEVE	They think you're a friend of mine, a producer, from Canada. In other words, they're all your best friends. So what movies have you made? Oh, he makes the really violent, disturbing stuff. You wouldn't know it to look at him, I know, but what's locked up away in there... Frightening, man.
MODEL	God, I love those. Which ones --
BISHOP	Mr. KcKenna has a creative relationship with the truth. I don't actually... The model glances around, unsure...
MODEL	Oh, okay. That's funny. So what do you do?
STEVE	Yes, Mr. Bishop. What do you do? Bishop doesn't respond. He's just staring down.
STEVE (CONT'D)	Come on, Mr. Bishop. We're all waiting. Bishop looks up at Steve who SMILES back. A beat, and then
BISHOP	Excuse me... He comes up short, realizes he's staring into the face of the
BISHOP (CONT'D)	Hi.
WOMAN	Hi... This is strange. The Rapper she's with has found a group of his buddies. High-
BISHOP	Is he your...?
WOMAN	No, just a job. I have to...
BISHOP	I know. Go on. She nods, turns away. He also turns, starts moving through
STEVE	Ladies and gentlemen! The man of the hour! A SPOTLIGHT hits Bishop. He squints up as the crowd makes
STEVE (CONT'D)	I know that not many of you know my friend. My good, dear... friend. I mean, he's a man of few words... And he's an art lover! Did you know that? His home is covered with work. It's amazing, what you can find in there. Amazing. A weird beat. Steve, smiling fierce.
STEVE (CONT'D)	Happy birthday, Arthur. Behind Steve, a covered object. Steve now turns to it, pulls
STEVE (O.S.)	Hey, you forgot something. Steve's there, holding the portrait. Bishop nods, takes it.
BISHOP	Sorry... Sorry for leaving. I'm just not used to --
STEVE	No worries, man. It's your party. You can leave it. It's true, isn't it? What you said to me the first time we met.
BISHOP	What's that?
STEVE	This thing we do. Finally, you always do it alone. Bishop nods unconsciously, starts towards his car, forces
BISHOP	Steve... thank you.
STEVE	Uh-oh. I can feel some male bonding coming. We gonna hug it out, Bishop?
BISHOP	No, I'm serious. Thank you. People don't... Anyway, it's been a long time, since someone did something for me. Steve looks back, nods. Strangely dark.
STEVE	Happy Birthday, Arthur. Steve raises a hand, shoots Bishop with a finger. A wink, ON BISHOP. Fighting what his guts are screaming at him. Are you all having fun! SHOUTS and NODS. LAUGHTER.
STEVE (CONT'D)	I despise each and every one of you! MORE SHOUTS, LAUGHTER. Steve LEAPS out into space. Perfect Steve ERUPTS out of the water. Party ROARS back into life. Bishop surveys the room, checks drawers, peers down into the
LOUISE	Hey! Hey baby! Karen's got some amazing E. You need to come try... Steve turns those cool eyes on her. She shrinks. We think
STEVE	Give me a moment. I'll be right there. We'll do that amazing E. And he looks away, back down over the view. A resigned This is Bishop's method, brought into the 21st century. residence... Bishop approaches... takes it in. Touches "Accounts" and the Bishop stares at the image, then touches another image
