CHARACTER	DIALOGUE
JULIUS	What a day, Vincent, we visited our birth place. We bought new clothes. We danced the waltz. We get into a fight -- We've got this great room. It just doesn't get any better than this. VINCE Oh yes it does. showing a clip of the "3 Stooges" at their moronic best. He freezes at the sound of a KNOCK at the DOOR. Embar- You forgot your key -- I know. Lucky I waited up. Julius opens the door, revealing Marnie, who walks in JULIUS * Hi. *
MARNIE	Hi -- Vince and Linda want to be * alone, so I'm afraid I'm going to stay here. Which bed should I take? JULIUS Either... I always sleep on the floor. MARNIE Good night. JULIUS Good night. Julius puts the blanket and pillow from the other bed Silence... MARNIE This mattress is awful. Getting out of bed, she pulls the blanket and pillow MARNIE Sorry. Good night.
JULIUS	Good night.
MARNIE	This mattress is just as bad as the other one. MARNIE This is better... Good night.
JULIUS	Good night.
JULIUS	Are you cold?
MARNIE	It's alright.
JULIUS	No, please, take my shirt. I'm * baking. Julius strips it off and hands it to her. She puts it JULIUS You still cold?
MARNIE	Just my legs. JULIUS Well, I could give you my...
MARNIE	Thanks.
JULIUS	Anything else? MARNIE I'd love a glass of water.
JULIUS	Right. MARNIE Thanks.
MARNIE	Oh, great!
MARNIE	Do you mind if I share your blanket? -- Mine's all wet.
JULIUS	No -- that would be okay. They both lie down under his blanket. Silence... MARNIE Could we switch sides? I like to sleep on the left. JULIUS Sure. She starts to roll over Julius, then pauses directly MARNIE Can I ask you something for a change? JULIUS Anything.
MARNIE	Do you like me? I mean, even a little bit?
JULIUS	I... I'm crazy about you, Marnie. But there's something about me you ought to know. MARNIE What?
JULIUS	I'm a virgin. VINCE -- Eighteen -- nineteen -- LINDA You sick or something? VINCE Julius gave me a few pointers -- -- Seventy-five -- seventy-six -- I don't need to exercise, but Mom's gonna see me for the first * time in thirty-five years, I wanna look my best. LINDA She'll love you whatever you look like.
VINCE	I know she will -- I have that effect on people -- -- One hundred and forty-three -- * one forty-four -- * -- I just hope she's not too disappointed in Julius -- he can't help how weird he seems at the start --
LINDA	I think you're nervous.
VINCE	Hey -- I sleep great every night -- -- what if she's disappointed in me? LINDA C'mere.
VINCE	Five hundred. Don't want to overdo. He goes into her arms. LINDA If she's disappointed in you, then she's a fake -- who could want more from a son?
VINCE	You're right. I couldn't do this without you, Linda.
LINDA	I know. That's why, when we get back, I think we should move in together. VINCE Whoa! Move in together?
LINDA	I'm not saying we have to get married or anything, and it's not about me wanting to keep an eye on you, either. I just want to live with you.
VINCE	I'm no good at playing house -- I'm grouchy in the morning, cranky in the afternoon, moody at night -- LINDA I promise not to try and make you happy unless you want me to. Vince is clearly unnerved by the twin emotional demands
VINCE	Why don't we sleep on this, okay? I mean, I've got a big day tomorrow. It's gonna be great -- taking my best girl to meet my mom.
LINDA	Am I really your best girl? VINCE There's nobody else, Linda, not anymore. LINDA There better not be, because... 'I only have eyes for you...' They kiss.
MARNIE	Are you sure you've never done this before?
JULIUS	I think I would have remembered... Let's get her some flowers.
VINCE	Good idea. One bunch from me, one from Jules.
MARNIE	And one from us -- Julius smiles happily at Vince's thoughtfulness. The car drives up a long, dusty driveway to the entrance, They approach the fortress-like gated entrance, gazing meeting their mother. JULIUS It's very beautiful, isn't it, Vince?
VINCE	Not to mention valuable -- real estate like this must be worth a fortune.
JULIUS	You mustn't always think of money.
VINCE	You got me wrong -- I'm just saying it's nice Mom's loaded -- that's a worry she won't have to have in her old age. Julius smiles at Vince and rings the bell. A MALE
CUSTODIAN	Can I help you? JULIUS We'd like to see Miss Mary Anne Benedict, please.
CUSTODIAN	I'm afraid that's not possible.
VINCE	We've come a long way. I can assure you she's going to be very happy to see us. CUSTODIAN I suggest you write a letter to the Benedict Foundation stating your business. The Custodian politely closes the door in their faces. A foundation? THE QUARTER JULIUS You think it's her? I do.
VINCE	Gotta be. Well, don't just stand there.
LINDA	Introduce yourselves. * As they take a step in the direction of the painter. Hey! back on the island. GARDENER Should you be here? VINCE That depends on how you feel personally about trespassing. GARDNER Is he always funny like that?
JULIUS	We'd like to see Mary Ann Benedict please; is she here?
GARDENER	'Course she's here -- -- climbing over the wall like that, I should call the police --
VINCE	Please don't do that -- look -- this isn't one of your average everyday situations -- she's our mother is the thing.
JULIUS	We're her sons.
VINCE	Twin sons.
GARDENER	-- You're comedians -- VINCE We're kind of a surprise.
GARDENER	I'll bet you are -- follow me. VINCE We were right --
JULIUS	-- It is her --
JULIUS	We thought that that woman --
VINCE	-- Is Mary Ann?
GARDENER	No -- This is an artist's colony; there's a lot of painters.
VINCE	This is some chunk of real estate -- Mom owns it all, I guess. They are heading toward a door in the garden wall.
GARDENER	You can't really own something like that view over there, or that sunset, can you?
VINCE	No, of course not.
JULIUS	I can't wait to meet her.
GARDENER	This way, please. The Gardener ushers them towards a door in the garden
GARDENER	Mary Anne Benedict never understood why people wanted to buy her paintings. But for a brief period they were considered valuable. She used the money to buy Whispering Pines so that young artists would have a place to work. VINCE She's not famous anymore?
GARDENER	She never wanted to be famous. She just wanted to be left alone.
JULIUS	May I ask you a question? Why do you keep referring to her in the past tense? GARDENER Because she passed away, some time ago.
VINCE AND JULIUS	They look like they've been kicked in the stomach. VINCE But -- but you said she was here -- GARDENER She is -- I meant her spirit. Her spirit is always here. Excuse me. The Gardener gently closes the door in their faces. They haven't moved. Linda and Marnie try to console them.
OMITTED 149	
VINCE	Can we get the hell out of here?
PAINTER	What was that all about?
GARDENER	These real estate developers won't be happy until they turn this place into a golf course. PAINTER Now they're climbing over the walls?
GARDENER	They're shameless. They'll try anything. Those men claimed to be my twin sons, if you can believe that. It was really quite disturbing.
PAINTER	Oh, Mary Anne, I am sorry... It's alright... You get over things. * I did have a child once, but he died * at birth... You ought to be so proud of your mother, Vince. She donated her house and her land and all her paintings to help young artists.
VINCE	Do I look like a young artist to you, Linda?
MARNIE	Vince, all she meant was --
VINCE	I know what she meant. And I know why she's here, too. It's got nothing to do with my mother and everything to do with money.
LINDA	You know that's not true.
VINCE	Bull-shit. Julius, who's been quiet and distant throughout, suddenly
JULIUS	Take it easy, Vincent. It's not her fault.
VINCE	You hear that, everybody? The * creature from the black lagoon * just put in his two bits. I * should have my head examined for listening to you in the first place -- deal-of-a-lifetime opportunity and I'm driving around looking for a dead mother.
JULIUS	All I wanted was to make us into a family.
VINCE	Family, my butt. There's no family here. There's just me and three losers -- I'm leaving. LINDA Vince -- quit acting crazy --
MARNIE	He dumped us in the middle of New Mexico.
JULIUS	We'll be fine. And maybe he'll be better off alone. You don't know -- he's got something worth maybe millions in that trunk -- he could get himself killed delivering it. JULIUS He's been getting out of trouble all his life, he's good at it.
MARNIE	He may need you.
JULIUS	I don't know much anymore -- on the island I was smart. Here, I've only made things worse. MARNIE Don't you realize you could make things a lot worse if you don't do something. Julius -- you're still very smart it's just you're not thinking so well right now -- on account of what you found out at Whispering Pines -- but you're not alone, you know -- I mean, you live long enough, everyone's mother dies...
VINCE	Okay, Beetroot -- It's time. I'll be there tomorrow -- where do we meet and trade?
OMITTED 155	
JULIUS	Don't worry, Linda. I found him once, I'll find him again.
MARNIE	Be careful... *
JULIUS	He turns away. MARNIE watching. He puts on his sunglasses and strides into the airport.
CLOSEUP OF JULIUS	standing -- waiting -- trying to pick up the scent... Hollywood. CREEP Got a light, pal? * Julius, without breaking stride, turns his head, looks JULIUS Don't fuck with me... pal. The Creep falls back. Step away from that car, Mr. Benedict.
VINCE	I thought we had a deal here.
BODYGUARD	This is it. VINCE This is what?
BEETROOT	You come here alone, unarmed? You're just a fool who stole a car, aren't you? It's a new, low- * cost fuel-injection system for * jet engines -- worth a fortune to * the company that brings it to the * market first. * What are you waiting for?
VINCE	Five million dollars --
BODYGUARD	You wanna count it? VINCE I trust you. Vince takes the case, gazes at the money, snaps it shut. The Caddy speeds away while Vince clutches the attache
WEBSTER	emerges from the shadows with a powerful pump action * Beetroot has a hole in his head, as well. It's filled with forklifts, cranes and various forms of WEBSTER All I want is the money, Benedict. Just give me what's mine and you can go back to stealing cars and screwing your best friend's wife. VINCE
WEBSTER	FIRING at the sound. He can't see Vince but he pours
WEBSTER	Pack it in, Vince, you're only wasting time -- I don't give a damn about you, just the money -- He's reloaded during this -- moving forward as we... moving in on the shattered window. A bit irritated.
WEBSTER	Vince, if you don't cut this horseshit I may have to hurt you.
JULIUS	Leave my brother alone! Vince, outside, really chugging away now, doing his best
JULIUS	I've got the money. WEBSTER Well don't be shy -- -- come on down.
VINCE	No way... this is bullshit... Julius, you putz. as Julius gracefully shinnies down a cable, lands near WEBSTER Just exactly who are you?
JULIUS	Vincent's twin brother -- we're in this together. WEBSTER Keep your hands that way. JULIUS Don't be nervous -- I hate violence and I never carry guns. Vince peering in through the window he jumped out of, VINCE Goddam ESP-psycho-voodoo bullshit...
WEBSTER	'Shakespeare's Collected Works'?... 'The Mind of Confucius'?... 'Advanced Quantum Mechanics'?... What is this shit?
JULIUS	I needed something to read on the airplane.
WEBSTER	Yeah, well your flying days are over... flying through the air, landing near Webster's feet. Put the goddam gun away -- you're a multimillionaire.
VINCE	hands held high, appears, stands beside Julius.
VINCE AND JULIUS	both with their hands up, look at one another and
VINCE	I am never going to forgive you for this.
JULIUS	You were going to get killed. I tried to distract him so you could escape. VINCE I had escaped. I was on my way to Brazil -- when I felt you. JULIUS So, why didn't you go?
VINCE	Because, thanks to you, I'm now not only a godamn psychic, I've got this disease called a conscience! JULIUS Nobody ever said being good was easy. VINCE How am I going to survive out there? What are my friends going to think?
JULIUS	You haven't got any friends.
WEBSTER	Just what are you two talking about? VINCE Butt out, okay? This is family stuff, we're squabbling, it's personal, just take the money and go sit in the lap of luxury somewhere. Try Brazil. WEBSTER I doesn't work like that, you might talk to people -- Who wants it first.
JULIUS	Shoot him. This whole thing is his fault.
WEBSTER	Whatever you want.
VINCE	-- Hold it, don't I get a say in this? Webster points the shotgun at Vince, starts to squeeze
JULIUS	pulls a gun from his sleeve and blows Webster's weapon VINCE You can be an irritating pain -- but sometimes you come in handy. -- Where'd you get the gun? JULIUS From the dead man in the car. VINCE You should have checked if he had a gun, chump.
WEBSTER	He said he didn't believe in them.
JULIUS	I lied.
VINCE	Ooooh -- you lied? JULIUS I had to. Vince beams with deep fraternal pride. Then he turns to
VINCE	Looks like you messed with the wrong people, wise guy. WEBSTER You got lucky.
WEBSTER	But your luck just ran out. A stream of gas is pouring out of the drums that Webster
WEBSTER	Drop the gun and give me back the case, or we're gonna have ourselves some barbecued Benedict. Julius drops the gun and Vince slowly hands back the
WEBSTER	Well, I guess this is goodbye. He raises the cigarette, ready to throw it. JULIUS Wait a minute. Webster looks up.
JULIUS	You've forgotten something. Webster grips the case tighter.
WEBSTER	I don't think so.
JULIUS	The third rule in a crisis situation.
WEBSTER	The third rule?
JULIUS	Duck. Suddenly the load hanging from the boom of a nearby crane
VINCE	Duck? Duck? You are developing real style, Julius.
JULIUS	drapes his arm around Vince as they walk towards the JULIUS You came back for me.
VINCE	Yeah, yeah, yeah. JULIUS I always knew you would.
VINCE	You're my brother, right? We're family, right? JULIUS Thank you, Vincent.
VINCE	We're a rich family, right?
JULIUS	We're a good family. I'm sorry, Vince, but we have to return the money.
VINCE	Return the money?!? Are you nuts?!? This is dirty money, * Julius -- it doesn't belong to anybody --
JULIUS	-- Including us -- think how much * better you'll feel when it's out of our lives --
VINCE	-- I won't -- I won't feel one bit better -- I'll never feel better, not if I live to be... oh no -- * As the sound of POLICE SIRENS get LOUDER we --
OMITTED 173	
"LONG LOST TWINS RECEIVE REWARD	RETURN CASH, STOLEN ENGINE"
PAINTER	I think you'd better read this...
MARY ANNE (O.S.) *	You stole my family, you lying son of a bitch!
VINCE	Linda, I -- LINDA What the hell are you doing here? VINCE You wouldn't answer my calls or my letters, so I... Look, I made a terrible mistake and I apologize and I want to tell you that I'm a changed man. Linda is almost buying it, but then --
LINDA	How did you get in here? VINCE Well, there was a window in the back that --
LINDA	Typical. She walks past him, approaches her door, puts in the
VINCE	All I ask is for another chance. I know I probably don't deserve it, but --
LINDA	You're right, you don't deserve it. ROSES
VINCE	I had to break into your apartment, but --
LINDA	Vince, they're beautiful. VINCE So, do you forgive me? Linda hesitates.
LINDA	Yes, but... VINCE But? Vince looks at her, understands.
VINCE	You mean, that matter we talked about once and never really resolved.
LINDA	What matter is that?
VINCE	The matter of you and me living together.
LINDA	What about it?
VINCE	Your place or mine? Julius is sorting through a stack of mail while Vince
VINCE	What do we do? Most people on this planet cause problems -- the Benedict Corporation solves them. We're a consulting firm -- a think-tank -- sort of like the Rand Corporation -- only smarter! Tuesday at three. See you then.
JULIUS	Look at this, Vince -- proposals from the Red Cross, UNICEF, the World Health Organization -- we should only have clients who do humanitarian work.
VINCE	Just as long as they pay -- we're not running a charity, you know.
VINCE	Come in!
VINCE AND JULIUS	Confused, just look at her for a moment. MARY ANNE MARY ANNE It's so incredible I'm not even sure which one of you is which. VINCE AND JULIUS THREE OF THEM
MARY ANNE	You see, I didn't believe you, I mean who would believe a story like your story -- crazy -- They lied to me all these years... And they lied to you... But you found one another ... And you found me... Please -- God -- one of you say something.
VINCE	Momma? Mary Anne nods. JULIUS Mamma?
VINCE	MOMMA! They both run to Mary Anne and hug her for all she's
JULIUS	Watching them. Now there are tears on his face, too.
No words are necessary.	Slowly... FADE IN: CLOSE ON WERNER 181 Smiling happily. PULL BACK to reveal we are -- In front of the merry-go-round. Werner purchases a hand- MARY ANNE I just can't get over how alike they are... The three women all turn and gaze affectionately back at -- Vince and Julius both yawn simultaneously.
JULIUS	They kepp you up all night again, too? VINCE Sceaming in stereo.
JULIUS	I think you need your diaper changed. What a surprise -- so do you. VINCE Not you, too -- It's not a competition, you know. They both start pushing their strollers again.
JULIUS	Just think what we'd be like if we'd been raised together.
VINCE	Now that's a scary thought. They both yawn simultaneously once again. The merry-go-round starts moving, and the last image we FADE OUT.
