CHARACTER	DIALOGUE
LEONARDO	I don't know... your brother gets to go on a world-wide training mission and you have to stay home. Might upset me too.
RAPHAEL	Are you trying to make me mad?
LEONARDO	I'm just saying, I'd understand if you were upset. Their intensity ESCALATES.
RAPHAEL	You wouldn't understand the first thing about me, daddy's boy - OOF!. hey both trip over a duct, tumbling in a ball. They stop
LEONARDO	Is that what this is about? You think Splinter likes me best?
RAPHAEL	You'd love that, wouldn't you?
M	WIDER - Don and Mikey are already sitting there.
MICHAELANGELO	So nice of you to join us, gentledudes.
DONATELLO	And by the way, I prefer the classic military corner tuck for my bedsheets.
M	ikey and Don high five. Leo and Raph aren't amused. They
MICHAELANGELO (O.S.)	Whoa! Whawazzat?! The others rush over to the edge with Mikey.
ICHAELANGELO	You dudes see that up there? OFF HIS LOOK - We see LARGE SHADOWS moving with in a large I-
MICHAELANGELO	So what now, captain?
LEONARDO	We need to come up with a plan.
RAPHAEL	Later! Raph RUNS OFF toward the action. But Raph doesn't stop. All three look at each other. Then-
MICHAELANGELO	Welcome home. The boys cross over on a large CONSTRUCTION CRANE and scale ON WALL - Deep CLAW MARKS are carved into the steel, much
DONATELLO	Guys, I've got a bad feeling...
RAPHAEL	Ahh, let's take a tiny peek. They scale to the top floor. Peering over the edge.
MICHAELANGELO	Well, there's a good/bad news scenario for ya. CAM BEGINS TO CRANE UP from Turtles to activity on the floor.
MICHAELANGELO	Good news is that there are a buncha Foot Ninja gettin' the snot kicked out of `em. CAM FINISHES ON FLOOR - Showing SIX FOOT NINJAS and KARAI
ICHAELANGELO (O.S.)	Bad news is WHAT's kickin' the snot out of `em... ON TURTLES - As they've all now crept up to the dark corner
ONATELLO	An interesting conundrum. Do we hold dear the value of life and help the Foot regardless of our tumultuous past?
MICHAELANGELO	I vote for sitting back and enjoying the show. Whaddaya say, leader boy? ON LEO - He's troubled. The burden of "leader" shouldered.
RAPHAEL	Nah. We kick butt. Raph jumps forward! Leo rolls his eyes, as all the Turtles ON LEO - He stops when he comes face to face with Karai.
EONARDO	Who are YOU?! ON KARAI - She pauses a moment. They exchange expert katana The Creature immediately CHASES the boys throughout the The I-Beam is getting dented and twisted with each impact. Raph gets separated at one point, jumping off the side of the SMASH! They fall into Raph's floor.
RAPHAEL	Nice of ya's ta join me. But the Turtles eventually get cornered. And just as the
YEEEAAAAARGGHHH!!!!!	The creature stops. Confused. So are the other three turtles.
MICHAELANGELO	What? I saw it on a nature show once. The creature SCREAMS BACK! Boys freak out. NGLE ABOVE TURTLES - As a large teetering pallet filled with RUH? - The Creature is confused... until it's hit with a ...LIVING VERSIONS OF THE FOUR STONE GENERALS! Sporting HIGH ON MOUTH OF ALLEY - Through the smoke we can see silhouettes - WHOOOOOP! - A POLICE SIREN chirps. Approaching the now-
DONATELLO	Better hit the tunnels, guys. Donnie uses a small prod to prop open a MANHOLE COVER. Don,
LEONARDO	Raph. Save it for another day.
RAPH!	Raph knows he has to go. Reluctantly he enters the sewer. The
A	beat, then Mikey barely pops the lid open for another peek.
MICHAELANGELO (O.S.)	Y'know, it's not that bad, dudes. ON BUILDING - Actually, the place is destroyed. Dented, torn UP ANGLE on the Tower. Dead of night. No one around. A cavernous structure. Dimly lit. High ceiling. A few odd We hear the clicking of Winters' shoes echo as he enters.
WINTERS	What seems to be the problem? Karai and six Ninja are already there.
KARAI	The "problem" is that we were hired to merely patrol the city and report anything "strange" to you.
W	You never said anything about
MONSTERS.	Winters smirks, looking at the mouse who thinks he can take
INTERS	So, your job duties were just redefined. Congratulations on your promotion. SHINK! - Karai pulls out her To and slices the brick in mid-
KARAI	We may be hired help to you, but you should never forget... we are the Foot Clan. ON WINTERS - Condescendingly finds this particularly `cute'.
WINTERS	Oooooooh... It sets the Foot off. They all grab their weapons, moving ...as Winters stands still... and begins to LAUGH. The Foot Ninja leap back. Winters remains confident and
WINTERS	I believe we made a deal, Karai. I expect you to honor it. You do understand "honor", don't you? Karai stews... unblinking stare. Of course she does.
WINTERS	So I don't care what part of "muscle for hire" you don't understand. I hired your muscle. Now exercise the ones attached to your feet and... ...get back to work.
W	a Foot Ninja. Then another to a second Ninja.
INTERS	So I will double... no, no... TRIPLE your pay for your troubles. Are we cool? ON FOOT - They just stare back, blank goggles. Probably
WINTERS	Are we... cool? The Foot don't move. Tense. Karai finally nods. Terse.
WINTERS	Ninjas. No sense of humor. So how did we fare? CORRIDOR ENTRANCE - a hunched SHAPE undulating in chains is Winters approaches it - chained to a high-tech and uplit
WINTERS	So it begins... It SCREAMS. Fights it's restraints. Tires. Breathing heavily.
WINTERS	Were there any problems? AGUILA speaks in a gravelly, hardened voice. He towers over
GENERAL AGUILA	None, my lord.
WINTERS	You see, now THAT'S a good soldier. You two should compare notes. Karai and Aguila stare at each other. Karai obviously not
KARAI	Just what is this all about?
WINTERS	Oh, let's call it a scavenger hunt. I now have the power and know-how, but I need the speed and stealth of an organization such as your own. Not to mention an organization that values discretion.
KARAI	But of course.
WINTERS	You see, I have nine more beasts like this that should be coming to town very soon. Thirteen in all, to be exact. The Four Generals move the monster into a position on the
ARAI	But... why? Why here? Why now?
WINTERS	Instinct, mostly. They're animals at their core. And they recognize something familiar in the air... in the stars. What can I say? I'm a lover of animals. The disk ROTATES. WIDER we see that there are already some
W	we don't fully see. Glowing eyes pierce out of the darkness.
INTERS	So you go and get to know each other. And don't forget... play nice. The Generals turn and walk-push the Foot out of the door.
KARAI	Not now. Our business will be handled at a later time... After they leave, we pause for A BEAT on Winters. Quiet.
MICHAELANGELO	Dudes, did anyone get the license plate of the thing that hit us last night? Oi, my head... Don pours over a thick book on MONSTERS AND MYTHOLOGY.
DONATELLO	Was it just me, or did that creature look familiar?
RAPHAEL	We coulda taken it if you slackers woulda pitched in sooner.
LEONARDO	Fact remains, Raph, that we should have never been there in the first place.
APHAEL	Well, I suppose that we shoulda let Mr. Cuddly-kins continue to spread happiness throughout the city... oh wait... HE WAS A FREAKING MONSTER TRYIN' TA KILL US!!! Good call, fearless leader.
ONATELLO	Come to think of it, it WAS pretty strange to see the Foot too. And who was that woman?
MICHAELANGELO	I dunno, but she sure gave Leo a run for his money.
LEONARDO	This is my fault now, Raph? I'm the only one who has to be responsible!
RAPHAEL	Hey, you're the "trained master", not me.
MICHAELANGELO	Dudes-can-it-here-comes-Splinter. ON DOOR - Splinter walks in, HUMMING to himself.
SPLINTER	Good morning, my sons.
TURTLES	Morning, sensei. Splinter makes himself a TEA. Room is SILENT.
SPLINTER	If anyone needs me, I'll be watching my stories.
S	plinter walks out. OS sound of the TV being turned on. At
LEONARDO	Hothead.
RAPHAEL	Splinter-junior.
NYC DIRT REPORTER (O.S.)	And in the latest of a string of strange criminal activity, a construction site was nearly destroyed last night. Authorities believe a violent battle had taken place earlier that evening. The boys react and rush into the MAIN LIVING AREA.
SPLINTER	My sons, what- Splinter's eyes go wide. He looks at his boys listening to
SPLINTER	I believe you boys have some explaining to do...
M	Splinter looks at the Turtles. Busted, as we-
SPLINTER	Leonardo, I am most disappointed in you. You are the leader of your brothers. I was counting on you to bring order to the chaos of this family.
LEONARDO	But Master Splinter, how can I be expected to do so when Ra-
SPLINTER	There are no excuses when you are the Leader, my student. ON LEO - Biting his tongue. Hard.
SPLINTER	But the involvement of the Foot and their mysterious leader worries me.
ICHAELANGELO	I'm personally worried about a monster running around the streets of New York. But hey, that's just me. Don elbows Mikey back in line.
RAPHAEL	We hafta go out and find who's responsible for this. There ain't no other solution.
SPLINTER	Raphael, there are better ways to use your skills in ninjitsu. Fact- gathering. Analysis. Observation. Direct contact should only be your last resort.
RAPHAEL	Wow, sounds... exciting.
LEONARDO	Save the brute vigilante junk for that Nightwing guy.
N	"Nightwatcher".
LEONARDO	Whatever. Raph stands and exits the room. The others stay silent as we- QUICK SHOTS - Nightwatcher gearing up. ightwatcher emerges from a MAN HOLE. Walks to a long- N BIKE - Explodes out of a BACK ALLEY and into the night. Various shots of Nightwatcher tearing all over the city. On Aggressive and driving music. Various shots of the Stone - The Generals capture a Sloth-like creature, jumping in - The Generals capture a werewolf-like creature in the high-
APRIL (O.S.)	You sure you don't want to spar a bit? April is dressed in work-out gear on a grouping of floor
CASEY	Nah. Ever since you started with the blade weapons you, um... you kinda scare me.
APRIL	Suit yourself. Case?
CASEY	Yeah? Are you happy? I mean, with your life. With me. Casey pauses a beat. Tries to be upbeat.
CASEY	Yeah. Sure. You? April thinks just as much.
APRIL	Yeah. They sit on that for a moment. Casey leans in for a kiss.
CASEY	I'm going outside for some air. Casey slips out onto the fire escape. April knows better.
APRIL	Be safe. BAM! - the leather fist of Nightwatcher slams Burglar back,
IGHTWATCHER	Funny how you jerks don't care about crossing the line `til someone else does it... all over yer HEAD! Night hurls him back into a roof access door, denting it.
BURGLAR	
NIGHTWATCHER	Boy, oh boy, did YOU pick the wrong night to be a criminal... Night cocks his fist just as- Hey champ. You think you're being a little rough on the guy? ight slowly turns around. Menacing. Casey's taken aback.
CASEY	Are you that Nightwatcher fella? A little smaller than I expected.
RAPHAEL	Case? No way!
CASEY	I'm talkin' to you, pal. You think you own these rooftops? Well, lemme teach you a thing'r two. Class is Pain 101. Meet your instructor... Casey Jones. It's getting serious. Casey's bat is suddenly wrapped by You keep on playing with fire, little man, you might just get burnt.
CASEY	Raph?! Is that you?! What-what are you doing?! Are you pretending to be... ON RAPH - His eyes look around for an answer. Nothing.
CASEY	Why would you- -oh. So that would mean... Raph smiles... the first genuine one he's had in a long time.
RAPHAEL	Yep. IN BG - The Burglar tries to get away. Casey and Raph both
RAPHAEL	I dunno, I just got tired of the "nothing". Sitting around waiting for some disaster to cross our paths. Of us battling Utroms and Triceratons or any other friggin' creature... when there was still some guy gettin' mugged 100 feet above the lair. Just didn't seem right. `Specially if we had the means to do somethin' about it. Raph twirls a billy bat between his fingers. Stops.
RAPHAEL	And we did... but turns out I was the only one who was willing to do it, tho. So I just saved up, bought and tweaked a sweet bike, fitted the costume and began moonlighting. Papers called me "The Nightwatcher", so I went with it.
ASEY	"And a legend was born". So what was your handle before that?
RAPHAEL	I kinda liked "The Midnight Marauder"...
CASEY	Stick with Nightwatcher, ninja boy. The guys ever catch on?
RAPHAEL	Pfft. You kiddin' me? Leo's been away for, like, forever. And the other two are so wrapped up in that party business they'd never notice. So what about you? How's things with April? Haven't seen ya's since you two moved in together...
CASEY	They're good... I guess. I dunno, seems like all I do lately is just make her upset. She used to laugh so much... now it's mostly just working all day, and coming home to point out how I'm a screw up. She doesn't like me doing this. And I know she's pretending to not know I'm out tonight. But she knows. And she knows I know she knows. Life just kinda got complicated suddenly... y'know?
RAPHAEL	Yer tellin' me... Casey looks at his old bud.
CASEY	Raph?
RAPHAEL	Yeah?
CASEY	Nice to see ya, man. Raph acknowledges. The moment is broken by a HORRIBLE SHRIEK!
CASEY/RAPHAEL	What was that?! They both spring to their feet and run to the back of the
RAPHAEL	For old time's sake?
CASEY	What the shell. ON RAPH - He stops, mid-replacement of his helmet. Bro. Seriously. The two run and leap across the rooftops. Two vigilantes EDGE OF ROOFTOP - They look out. Silent.
CASEY	I think we lost it.
RAPHAEL	It's gotta be around here somewhere. SCREEEEECH!!! - A large VAMPIRE-LIKE CREATURE flies up from
WAAAAAAAAAAAGGGHHHH!!!!!!!!	It's about to attack when - THUNKA-THUNKA-THUNKA - it's
RAPHAEL	Did I mention we ran into a monster last week?
ABOUT THAT ONE, BUDDY!	They inch closer to the edge. Peek over.
CASEY	The freakin' FOOT?! What about the walking statues? Were you going to mention THOSE?!
RAPHAEL	Nope. Those are a first for me too. We can take `em. One of the generals effortlessly picks up a TRASH DUMPSTER
CASEY	On second thought... The Generals put the Creature in a cell. Wheel it to a
S	HINK! - Casey accidentally knocks a tiny piece of rock from ON GENERALS - they turn around. Look up.
ENERAL GATO	Witnesses. Aguila snarls and fires the tranq gun! Raph dives in front of
GENERAL AGUILA	Fetch. Gato SMILES as the other three board a Transport Vehicle.
CASEY	Not good. Raph takes out NINJA SMOKE PELLETS and throws them on the
NIGHTWATCHER	You ever heard of smoke pellets?
CASEY	Hey - you're the ninja, not me! BOOM! - Gato lands up on the roof and quickly gives chase! Raph and Casey are tearing ass through the alleyways, trying Raph ignores him, looking for a street sign. Then he sees it -
RAPHAEL	Bingo. Raphael quickly dashes left through TRAFFIC!
CASEY	What are we gonna do, Raph? WHAT
ARE WE GONNA-	-hey, cool ride.
RAPHAEL	Hop on. Raph leaves Gato in a cloud of dust... but not for long. Gato A circular OBSIDIAN BLADE lands in his wooden bat. He looks
CASEY	Um, Raph? Raph sees the blade! They manage to switch positions in mid- hisiscrazythisiscrazythisiscrazy. He lets out the clutch as they make the jump! WHAM! - Sparks ...and then -thumpthumpthump- Gato JUMPS DOWN TOWARD THEM!
CASEY	Oh crap. Casey guns it - BUT THE BIKE DOESN'T WORK ANYMORE - as Gato
C	Gato comes close to breaking in. Very tense. Then-
ASEY	Okay, so it was great seein' ya again, Raph. Raph? ON RAPHAEL - He's got a dart in his shoulder, obsidian disks
CASEY	Gotta get you someplace safe, pal. And then, then I need to go buy some new undies. April is finishing up with her workout. She hears the fire
APRIL	Casey, I think we need to talk. I don't want- whoa. OFF HER LOOK - Casey is standing there, bracing the near-
CASEY	Could use a little... help here... Hey April... how ya been?
M	Raph passes out as we-
ICHAELANGELO	My compliments to zee chef. Le brrrraaaaaaapp! Mikey walks to the fridge of leftover birthday cake.
MICHAELANGELO	Anyone for dessert?
EVERYONE	
NO!!	The phone suddenly rings. Don rushes over to the jury-rigged Cowabunga-dude. Waita-slow down April. What happened to Raph? We'll be right there. ON WINDOW - One by one, Leo, Don and Mikey slip into the
M	and Casey. Mikey looks around.
ICHAELANGELO	Whoa... I am in the wrong line of work. Nice pad, kids. Don immediately starts checking Raph out.
DONATELLO	His vital signs seem to be okay. Pupil dilation is normal. Raph weakly pushes Donnie's head away. RAPHAEL Get the... frig offa me.
DONATELLO	Temper is normal too. He's going to be fine. Health-wise, I mean. Otherwise, he's still the same old Raph. Whoa. ON RAPH'S SHELL - Two Obsidian Disks are wedged in his back LOSE ON - Disk. It's beautiful and deadly. Don examines.
DONATELLO	Some sort of stone... probably obsidian, I think. There's an engraving on it. Looks... South American. Aztec? No. It's definitely not Mayan. April swallows hard.
APRIL	It can't be.
DONATELLO	What can't be, April? April sits down on the floor with the disk. Trying to figure
CASEY	Would it help things if I said that we were being chased by a one of those statues you collected for that Winters guy? ON APRIL - Her mouth is agape.
MICHAELANGELO	I'd say that's a big ten-four. It's just a myth... a legend. It can't be.
CASEY	And I suppose that bringing up the thirty-foot flying monster would probably just push this over the edge, huh? ON APRIL - She slowly turns to Casey. Floored.
LEONARDO	What are you talking about Casey?
CASEY	Just some story this Winters guy told us. It all started down in South America. Long before the Ashmecks and the Macaroons.
APRIL	Azteks and Mayans.
CASEY	That's what i said.
APRIL	Sit down, Jones. So there was this guy call Yaotl... CAM PANS TO THE RIGHT - As it passes a FG element, the screen Everyone is gathered around as April finishes. Mikey, in
MICHAELANGELO	Well?! WHAT NEXT?!!!
APRIL	No one knows. The legend stops there. But it's just a legend. Donnie studies the tranq dart under a magnifying glass of
DONATELLO	The micro-tech of this dart is astounding. The molybdenum is of a grade only found in a few select markets... not to mention it's current stock is going for a little more than two-grand an ounce right now. What? I dabble in the market.
EONARDO	So what do we have? We have someone with a lot of money.
ONATELLO	Access to technology... and the means to produce it to exact specs.
RAPHAEL	Not to mention having a keen interest in these monsters... and them four stone jokers.
DONATELLO	If you ask me, it all somehow points to Winters Corp.
LEONARDO	How do you figure that, Donnie? Donatello looks up with MAGNIFYING GOGGLES on. Sarcastic.
DONATELLO	Hello? "Genius"? Well, that, and the fact that this part has a Winters Corporation logo on it.
EONARDO	Do you think he's trying to recreate the events from back then?
RAPHAEL	Well, what would you do with an army of monsters?
MICHAELANGELO	Well, aside from having your own wrestling league, I dunno... MAYBE
LEONARDO	Do bad guys still try to do that?
DONATELLO	Yes, however they're usually mortgage re-fi companies. What about it, April? You just finished working with the guy, right? Does it make sense?
APRIL	Guys! It's a legend!
R	
MICHAELANGELO	Is that "legend" like the ginormous freakin' hairball that attacked us?
APHAEL	Or "legend" like the moving statues and flying creature that attacked me n' Casey?
APRIL	Okay. Fine. I'll help for now... until we prove you're all insane.
LEONARDO	Or until we prove Winters is up to something more than collecting art.
DONATELLO	I'll work with April and see if these Stars of Kikin she told us about can give us any clues.
RAPHAEL	I say we just storm the castle and face this jerk in person!
LEONARDO	Raph, that would be the worst idea yet. We hang back. Analyze. Formulate a plan, THEN storm your castle. Are we clear? Tense stare off between Raph and Leo. Raph moves anyway.
CASEY	Raph. Don't do it, man. I spent my whole life running out of rooms ticked off at the world. I wish I could take most of `em back. Sometimes, just takin' a breather is the best thing to do. ON APRIL - She's listening to Casey... maybe her man-boy is
RAPHAEL	Yeah... whatever. - and bolts out the door.
A	We see the same stars we've been tracking move closer into
PRIL (O.S.)	Think this is all of them, Donnie. ON DOOR - April walks in, holding a 3-foot-high stack of
APRIL	I cleaned out my archives on ancient South America. Might have found something useful. She takes out a hand-drawn map.
APRIL	A map of the stars, as recorded by an Aztec Shaman. They pinpoint the location of the Stars of Kikin... even though the names changed.
DONATELLO	For use in an Aztec calendar. So, if we can cross-reference our current star field, positioning of the Stars of Kikin and backtrack positioning based off of the Aztec
APRIL	-along with taking into account the point of origin of the first occurrence, we should know where another portal could take place. Max, what are you up to? Leo paces back and forth in the main area. Splinter walks in.
SPLINTER	Leonardo, time cannot be moved faster by wearing a groove in our floor.
MICHAELANGELO	Seriously, dude. We're all stressed. Try to chill.
LEONARDO	You're playing video games on the possible eve of Armageddon, Mikey. But I never said I was having fun. Leo looks at the clock.
LEONARDO	Where's Raph?
SPLINTER	Leonardo, a true leader knows the virtue of patience... and when to stop exercising it.
DONATELLO	We're almost done, Leo. You might want to go get him... If you can find him, that is. Leo looks at Splinter, clearly feeling leadership pressure Relatively peaceful. A few freighters off in the distance. Monay, monay, monay, MONAYYYY ...monay! POV FROM WATER - Steadicam shot, watching the man patrol The clicking intensifies. He follows the signal for twenty ..and comes up with a old unopened CAN OF SARDINES.
TREASURE HUNTER	Pfft. Figgers. He turns to leave the beach.
TREASURE HUNTER	Lousy metal detector. "Happy Anniversary" present, my big fat keister. He HURLS the can of sardines over his shoulder. Only, instead PTOOEY! - The tin "key" is spit back onto the sand. He bolts. It's dark. Barely lit in the hallways of the top private The camera travels the long and ornate hallways. Decorated in ictures spanning centuries in age. Some photos. Some
INTERS	To picking up the pieces. ABOVE FIREPLACE - is a suit of armor... THE suit of armor of
WINTERS	What is it? Winters doesn't turn around. Stays in E-FG. Cam adjusts to
GENERAL AGUILA	Two creatures remain, my lord. A long beat. Winters closes his eyes.
WINTERS	Well, by all means then. Let's finish it. ON AGUILA - He squints. Deep in thought and not sharing. Nightwatcher runs along the rooftops. He pauses. He lifts his Classic Diner design, Pete's Diner is closed for the evening. A greasy DINER COOK finishes cleaning up the tables. He INSIDE OF FREEZER - the door slowly opens. The man's face Nightwatcher hears the scream. Runs to the source and looks Night creeps to the freezer. He can hear the CHEWING and the -it's only THREE FEET TALL!
NIGHTWATCHER	Hey there little fella. All that commotion for just little ole y- The Demon SCREAMS! It jumps Night, slamming him to the floor Plates, glasses and utensils fly everywhere, smashing all
T	he creature lunges down again, but this time, Night is A break in the fight. The creature has disappeared. Night ...the Demon swoops in for another attack! Mouth open, fangs
NIGHTWATCHER	Yeah! That's what I thought! Don't mess with the Nightwatcher! Night turns. His helmet is still on. He hits his LIGHTS on
DINER COOK	Pl-pl-please don't hurt me!
NIGHTWATCHER	Whattaya talkin' about? I JUST
DINER COOK	Please, sir. I have kids. Night looks around. He sees the CASH REGISTER on the floor.
NIGHTWATCHER	There ya go, pal. Make sure this is safe. HEY - YOU HEARIN' ME?
HARD TIME BELIEVIN' I'M A GOOD GUY?	Sudddenly - SHINK! - a THROWING STAR is lodged in the cash ll he sees is a panicked man and the large shape of ACK IN DINER - Night slowly lays down the register. Trying
NIGHTWATCHER	This night just keeps gettin' better n' better...
H	Tense stand-off as... Night suddenly bolts out the back as Night suddenly DASHES OUT into traffic! Jumping over passing
LEONARDO	Nice try, amateur. Leo crosses the busy street while still maintaining his e swings and manages to snag Nightwatcher in mid-leap!
LEONARDO	Oof! You're a heavy boy, aren't you? They both land on a fire escape, as Night clamors to the top.
LEONARDO	Okay, someone's been training pretty hard. It begins to spit rain - and becomes a FRANK MILLER DOWNPOUR. Night reaches an area that's a DEAD END. One side of the
LEONARDO	I want you to know that I appreciate your intentions. But you can't change the world like this. INSIDE HELMET - All we hear is rain pouring. Raph can't hear
NIGHTWATCHER	Oh god. He's lecturing.
EONARDO	...so I'm going to give you one chance to just walk away and stop this vigilante nonsense. Leo unsheathes his two katanas. Raph can't hear him.
NIGHTWATCHER	Okay, Leo. Wanna play? Nightwatcher drops TWIN BOLOS. He twirls them with
LEONARDO	What? How did you- ...then he starts goading him on. Pushing Leo. Prodding.
LEONARDO	Goodnight, dark prince. Leo UPPERCUTS Night, knocking his helmet off! His face
LEONARDO	R-raph? What? But Raph doesn't feel like explaining. Refuses defeat.
AAAAAAAAGHH!!	He mule kicks Leo back. Leo tumbles back, still in shock.
RAPHAEL	You're so friggin' smug! You think the world revolves around YOU, dontcha? That we couldn't POSSIBLY survive without the mighty and powerful Leonardo to guide us through our problems, HUH?! Well, I gotta newsflash for ya - we got along just fine without you.
LEONARDO	I was training! Training to be a better leader! For you! Why do you hate me for that?!
RAPHAEL	...and whoever said I wanted to be led? I shoulda gone on that training! OU WEREN'T READY! You're impatient and hot-tempered! And more importantly... I'm better than you. Raph stops in his tracks. Reaches behind his back... and
RAPHAEL	Well, big brother, I'd have to disagree with you on that one. Raph takes a ready stance. Leo does too. And they fight. In another part of the city, the Generals have caught the
KARAI (O.S.)	The Foot report of strange activity five blocks north of your location.
