CHARACTER	DIALOGUE
VINCE	That's the best way -- women love men who are mysterious and devious. It keeps them on their toes -- makes them excited you know what I mean?
JULIUS	No.
VINCE	You do like women, don't you? JULIUS Very much, they're... strange and sensitive and they have compassion. I have the highest respect for women.
VINCE	Now correct me if I'm wrong. You're a virgin, aren't you?
JULIUS	That's private. Vince clocks Julius's reaction as he removes an eviction
VINCE	He's a 230-pound virgin. * VINCE Alright! Alright! I got your food. Yes! 'Liver and Cheese,' 'Chicken Giblets,' all your favorites, Julius.
JULIUS	You named your cat, Julius? VINCE The secret to take-out veal Parmesan is adding a little extra cheese. I know you're probably used to growing your own vegetables and spearing fish in the lagoon, but here on the mainland we just nuke it!
VINCE	Dinner is served! They both freeze and stare at each other for a long beat. It's definitely empty.
WEBSTER	He looks at the Cadillac key. Clearly, he is not happy at
VINCE	So, let me get this right. One of * our fathers was a famous football player, another one was a physicist at M.I.T. --
JULIUS	He won the Nobel Prize.
VINCE	Naturally... so all of our dads were these big shots and Mom was, like, Superwoman, but she didn't survive our delivery. I got sent to an orphanage while you were brought up in a tropical paradise by this scientist you do research for, but who doesn't actually pay you because you don't need money. Did I leave anything out? Julius ignores Vince's cynicism.
JULIUS	I think it's important we try to find our fathers.
VINCE	You mean, all those geniuses who contributed to the... ... Sperm milkshake? * JULIUS Why are you being so immature about this? * Vince throws down his napkin. VINCE Do you know how many times I've heard stories like this? It's every orphan's fantasy: 'My real Mom and Dad were rich and beautiful, but there was a mix-up at the hospital and I got switched with another baby... But one day there's going to be a knock at the door and there they'll be with open arms, crying... "My darling! My treasure! We didn't know! How can we make it up to you?"' I'm telling you this for your own good, Julius. It's a crock. Vince goes over to a trunk, rummages in it, comes up with VINCE I liberated this from my file at the orphanage. Read it and weep. Julius takes the paper and reads aloud.
JULIUS	Dear Sister Anderson, your request for orphans benefits for Vincent Benedict has been denied. According to our files his mother did not die during birth. We have a current address for her at 172 Canyon Glen Drive, Los Angeles. Vincent's case seems to be one of simple abandonment and as such he is inelligible for aid. Vince snatches the paper back. Julius stares at him, VINCE That's right, Julius, she abandoned me.
JULIUS	This letter was written thirty * years ago. We were five years old * -- Our mother... didn't die when we were born... You've known all this time where she was and you never contacted her?
VINCE	I don't know about your momma, Miss Perfect of 1952, but my momma was a slut, and if she's still alive, I hope she's in a lot of pain. She dumped me once -- no way she gonna get a chance to do it again --
JULIUS	Vincent, if they lied to us about Momma for all these years, maybe they lied to her, too. We must find her, we must check this address. * He can't hide the excitement.
VINCE	Julius -- slow down -- I've got no time for this. You go hunt down * Mom, I've got a cash flow problem * to deal with.
VINCE	What! We haven't forgotten about you, Benedict -- You better have our money tomorrow morning. Or else. VINCE Or else what? Suddenly, Vince's living room WINDOWS EXPLODE in a burst JULIUS Everyone seems so angry in America.
GARFIELD	The tests on the lower temperature gaskets look great.
LARSON	Looks like an easy weekend. SECRETARY Mr. Garfield, there's a... *
GARFIELD	Not now.
GARFIELD	Who are you?
WEBSTER	I'm Webster, it's okay.
GARFIELD	on the sound of the name. He looks at Larson. A beat. *
LARSON	Christ, man, you were never * supposed to come here.
GARFIELD	The deal was we were never supposed to meet. You're supposed to be...
WEBSTER	Driving that Cadillac to Texas? Got my driving gloves, got my driving glasses, got my hat... but no car. The car was there! The merchandise was in the trunk! Your instructions were on the cassette! He wants more money. That's what this is about. WEBSTER Let me explain something to you. I have a reputation to uphold. People put their trust in me because they know I always deliver the goods and I always come back with the money. This whole thing is making me look very bad... professionally.
GARFIELD	This is bullshit! The car was there. LARSEN That's right. The parking attendant thought we were off for Hawaii.
WEBSTER	The parking attendant? GARFIELD He liked the car. We'd put on those damn loud shirts so we'd look like tourists -- LARSEN He asked us if we were going surfing. He was a jerk.
WEBSTER	You know, I just realized that in * twenty years of service no other * client has ever seen my face. GARFIELD I don't think that's a problem. Webster pulls out a silencer-equipped pistol and puts WEBSTER Guess you're right. *
OMITTED 78	Secretary.
WEBSTER	Thanks for everything, guys. I'll see what I can do about those Laker tickets. Yeah, I'll tell her. WEBSTER They want you to hold their calls. They're going to be working late.
GRANGER	Yes? JULIUS I'm terribly sorry to disturb your party and I realize this might sound strange, but I'm looking for someone who lived here a long time ago... Mary Anne Benedict. Granger reacts; he's speechless. Julius hands him the
JULIUS	She was my mother. Granger looks at the photo, then at Julius. GRANGER You're Mary Anne's son?
GIRL	Isn't that you, Grandpa?
GRANGER	Why don't you go help your grandma with lunch, honey?
GRANGER	They told your mother that you died at birth... Julius studies them admiringly while Granger looks at the
GRANGER	I guess you could say I'm your father...
JULIUS	One of my fathers -- GRANGER 'Mary Anne Benedict'... I haven't said her name aloud for over 30 years. She was the love of my life. The times I've wondered what would have happened if I'd married her...
JULIUS	Why didn't you?
GRANGER	She turned me down. Said she was afraid to have children. She took it real hard when they told her you died. She even stopped painting. Did you know she painted? JULIUS Until yesterday I didn't even know she might still be alive... Who told her we died?
GRANGER	'We'?
JULIUS	I have a twin brother, Vincent. GRANGER There's two of you? She never * knew that, either.
GRANGER	Mitchell Traven. He supervised the experiment for the government. He's the one responsible for all of this. He still runs the genetics lab at Los Alamos, New Mexico.
JULIUS	I'll go see him. GRANGER Watch out for him -- he's kind of a dickhead, if you know what I mean. No, I don't -- but I'm learning. Mr. Webster, I hope you're happy with the vehicle we chose for your little journey. When you get to Houston, phone 713/555-0342 and * ask for Beetroot McKinley. He will arrange to trade you a briefcase for the merchandise in the trunk. Vince stops the car dead, the Body Shop Owner comes up
BODY SHOP OWNER	New Caddy? Let's check it out. The trunk is filled with a sleeping bag that might contain BODY SHOP OWNER The car's okay -- I'll give you three grand.
VINCE	Sorry -- the car's been promised for a kid's charity. BODY SHOP OWNER Okay, four grand. As Vince starts to drive away: BODY SHOP OWNER Okay -- Six thousand -- that's as high as I'm going... thru
VOICE (V.O.)	Beetroot McKinley talkin'. Who's cloggin' up the line? VINCE -- Uh... Webster -- calling from California. I happen to have some merchandise you might want --
McKINLEY *	Well, bring it to me, son, and let me enrich you. It's the amount of enrichment I want to talk about. McKINLEY Don't try and renegotiate with Old Beetroot, son -- VINCE Look, Beetroot -- if we can't renegotiate we wither and die. I'm not delivering any goddam Cadillac without knowing for sure I got twenty for my cut.
Beetroot. Exploding.	McKINLEY Listen, you little shit-for-brains peckerwood, you're out of your goddam crazy diseased greedy mind! We can see the briefcase now by the way -- it's open and
VINCE	I guess twenty seems a little high to you. I'm a reasonable guy -- I'll take fifteen -- Listen to me, you poor excuse for a warmed over turd, a deal's a deal -- VINCE -- But --
McKINLEY	Don't 'but' me, the deal is five -- I can do better than five here. McKINLEY If you can do better than five million dollars, take it! * VINCE F-five million dollars... He writes down the proper amount now: $5,000,000. Then
VINCE	Beetroot? What?
VINCE	I'll see you in Houston -- after all, fair is fair. I'll just have to find it in my heart to live with your offer... Vince hangs up, jumps up and screams with joy. He puts VINCE Five million dollars!
WEBSTER *	Your boss at the lot told me you * were on duty when the Cadillac * clocked in. Now what's his name? * AL Okay... His name is Vince Benedict.
WEBSTER	That's certainly a beginning.
CARLA	I'm really disappointed in you -- ratting on your best friend. WEBSTER My best friend who's been screwing my wife for three years. CARLA You knew?
AL	All three years.
CARLA	And you never told me until there was a stranger listening? Shit, what about my reputation?
WEBSTER	Where can I find Mister Benedict?
AL	I'm not saying.
WEBSTER	Let me get this right -- You're protecting the weasel who's been * screwing your wife for the past three years. AL He's my friend.
WEBSTER	Well, I guess I'll have to beat it out of you --
CARLA	Stop -- I'll tell -- He lives at 1622 Westridge Place -- He's got an office at the corner of Highland and Hollywood.
AL	Thanks for saving me.
CARLA	I always loved you, Al. It's just I couldn't resist Vince. It's those eyes -- he does this thing with his eyes...
AL	I love you too, Carla.
WEBSTER	door, shaking his No one's gonna believe this one. VINCE 'Going back to Houston, Houston, Houston...' Vince tosses the items into the back seat of the Caddy, VINCE Jesus! Vince, the most amazing thing has happened.
VINCE	You scared the living shit out of me --
JULIUS	I met one of our fathers. He told me of a man in New Mexico who probably knows where Momma is. VINCE Great. Julius, in his fervor, grips Vince by the shoulders.
JULIUS	She didn't abandon you -- she didn't even know you were born!
VINCE	Awww -- that's terrible. Vince removes Julius's hands, slides him away from the
JULIUS	And she was told that I died!
VINCE	Look, Julius, I'm in kind of a hurry. Sammy wants me to take the car to Houston. Much bigger bucks when you raffle for charity in Houston. Julius takes the map from Vince, looks at it.
JULIUS	-- New Mexico is on the way to Houston.
VINCE	A lot of places are on the way to Houston. I'll be back in a few days. Stay in my apartment. Run up my phone bill. Throw wild parties. Take advantage of me.
JULIUS	Vincent, we have to go see this man Traven in New Mexico! VINCE No we don't. JULIUS Yes we do! And I'm coming with you!
VINCE	You know -- you're right. This is fate -- destiny -- But there's no way I'm gonna drive for 1500 miles with you smelling like that --
JULIUS	You're right -- I'll take a shower -- be right back -- cake, complete with lit candles. VINCE Why does everybody have to like me so much? Vince gets out of the car and, although it kills him,
LINDA	Happy birthday, Vince. VINCE Oh please -- It's not my birthday anymore -- MARNIE Happy birthday, Vince. Is Julius around?
VINCE *	He's inside. * Marnie walks into the house. * LINDA Where are you going? VINCE Nowhere --
LINDA	You were going somewhere -- you weren't even going to say goodbye --
VINCE	Okay, okay -- look, you can't tell anybody this -- not even your sister -- but I'm onto something so huge it gives me a rash just thinking about it. LINDA Like what?
VINCE	I got something in here -- -- I don't even know what it is -- that's worth a fortune!
LINDA	A fortune! That's great!
NEIGHBOR	Never sleep with that man. Never loan him money. And never believe a word he tells you -- that's free advice. She slams the door shut.
LINDA	Vince...? VINCE I borrowed a cup of sugar from her once... LINDA I'm coming with you. I'm not letting you out of my sight.
VINCE	No you're not.
LINDA	I am because if you say 'no' one more time -- -- I'll tell everybody you're hiding a fortune in your -- VINCE Okay, okay. Just don't let on to Julius. He thinks we're going in 'Roots' or something. 'Put on your red dress, baby, 'cause we're going out tonight...' She puts the photo back as the sound of SHOWER STOPS.
JULIUS	Marnie -- excuse me -- I was just taking a shower.
MARNIE	I heard you singing -- I baked some cookies for you.
An awkward silence. *	MARNIE * I guess it was a dumb idea. *
JULIUS	Not at all -- I'm really looking * forward to tasting them. * I should put on some clothes -- But I'm not sure...
MARNIE	Oh -- don't mind me. She turns her back to him. JULIUS I hope Vince doesn't mind if I borrow one of his shirts. MARNIE Just don't try wearing his pants. They both turn as --
LINDA	throws open the door, with a big smile on her face.
LINDA	Guess what? Vince just invited us all to go to New Mexico and Texas. Vince comes in behind Linda, trying to conceal his
JULIUS	That's a great idea, Vince. HOLD. Now, from the opposite direction comes another car. and as he does -- As Webster unfolds it, reads Beetroot McKinley's name,
BURT KLANE (O.S.)	Open up, Benedict! I know you're in there!
WEBSTER	Your owner seems to be a very popular fellow these days. Morris has his elbow in a sling and a bandage on his
WEBSTER	Howdy.
BURT KLANE	Who are you? WEBSTER It's not really important, is it? I wanted to feed the cat before I left. Webster starts for the door. Morris (the really big one) BURT KLANE I asked you a question.
WEBSTER	Who are you?
BOB	We're the Klane brothers. That's Burt and Morris -- I'm Bob.
WEBSTER	Interesting genetic pool. You're looking for Vince Benedict, right? The brothers all nod.
WEBSTER	Am I Vince Benedict? Morris stares hard at him, shakes his head.
WEBSTER	So what's the difference who I am?
BURT KLANE	Hit him, Bob.
WEBSTER	Your brothers seem to have a problem with their feet. It could be contagious.
WEBSTER	Have a good, good day. Vince watches through the rearview mirror, knows what's LINDA Did Julius like the cookies? Marnie shrugs.
MARNIE	I'm not sure... he said they'd provide one hundred percent of the average daily requirement of fourteen source vitamins in a high-fiber form that's an integral part of a properly balanced diet.
LINDA	I think that's good.
MARNIE	I really hope so.
VINCE	This ought to fit you. Julius removes the shirt he borrowed from Vince, who
VINCE	Whoa -- get away from that window! There's women and children out there! What is wrong with you?
JULIUS	What? VINCE You allergic to something? JULIUS No. Why? What are those bumps doing all over your body? You're all swelled up. You look like you're about to explode.
JULIUS	We can't all be born beautiful like you, Vince. Some of us -- Julius puts on the T-shirt and looks at himself in a
VINCE	-- Are just born to be bad. It's you, Julius. Oooh, you are so scary... MARNIE Julius... As he walks past, Julius slaps her five. JULIUS Let's rock and roll. He opens the car door and climbs in. VINCE It's his first T-shirt.
MARNIE	Good luck. *
JULIUS	Thank you.
MARNIE	See you later.
VINCE	See if you can get us a room with a king-sized bed, okay? Linda smiles at him, and winks. Julius, misunderstanding
JULIUS	That's not necessary. I always sleep on the floor. Vince looks askance at Julius, then pulls the car away. The Caddy drives through this mysterious town in the VINCE Now promise me something. If this professor Traven says he's never heard of Mom, and us twins, and all our dads, and the experiment, I don't want you to be upset. -- Because this is entirely possible.
JULIUS	You still think I'm making it all up, don't you? TRAVEN I don't know who you are and I * don't know what you're talking * about. Now get the hell out of * here before I call security.
VINCE	Well, that's that. On to Houston. He leads a stunned Julius down the corridor, towards
JULIUS	He's lying!
VINCE	Keep your voice down. This place is crawling with security -- *
JULIUS	For the first time in my life, I am -- -- pissed off!
VINCE	Don't do this to me. I got a car to deliver. The last thing I need is a detour in the slammer -- Julius furiously stops and turns around.
JULIUS	I'm going to make him tell us the truth...
VINCE	No... Julius shrugs Vince aside, approaches Traven and shoves * JULIUS That's our mother -- those are our six fathers -- that's Werner -- and that's you! Start talking! TRAVEN You turned out just like I thought you would, Vincent. What did you do, escape from prison? Vince stops dead, shell-shocked.
VINCE	... How did you know my name? TRAVEN I named you. Vince's jaw drops as he realizes -- *
VINCE *	Holy shit. It's all true. *
LABORATORY DOOR	Chained and padlocked. Traven unlocks it, pulls off the The very same one we saw in our opening, now covered in TRAVEN This room was sealed as soon as your mother gave birth. TRAVEN You came out first, of course... We weren't expecting him.
VINCE	gazes at the "blender" we saw Traven demonstrating in
VINCE	This must be where you made the milkshake... TRAVEN TRAVEN We weren't making milkshakes. We were making the most fully- developed human the world has ever seen. VINCE But instead of just one perfect kid, Mom had two of us -- way to go, Mom.
TRAVEN	Wrong. The embryo split in two, but it didn't split equally. All * the purity and strength went into Julius. All the crap that was left over went into what you see in the mirror every morning. VINCE Whoa -- I'm the crap? JULIUS It's not true, Vince.
VINCE	No, I want to hear this. I'm left-over crap? I'm no good?
JULIUS	He's wrong. TRAVEN Just look at him --
VINCE	You tellin' me I'm a side effect!?! TRAVEN You haven't got the brainpower to understand this -- Vincent, and I haven't got the time -- show's over. Julius grabs Traven, slams him up against the wall.
JULIUS	Tell us where our mother is... * dickhead!
TRAVEN	Whispering Pines... it's an artists colony... two hundred miles north of Santa Fe. JULIUS If you're lying to me. I'll be back. Julius tosses him aside.
VINCE	My life just got flushed down the toilet.
JULIUS	You're wrong, Vincent. Your life's just about to begin. VINCE I'm genetic garbage.
JULIUS	Vincent, we're twins. * VINCE I know this is a touchy subject * for you, Julius. But the fact is, * we don't look the same -- we don't * act the same, we don't talk the * same -- we don't dress the same. *
JULIUS	I know.
VINCE	So how come if we're the same, we're so damn different. *
JULIUS	We had six fathers, Vince. We're different parts of a lot of different people. Vince is starting to get interested again. VINCE Yeah?
JULIUS	And remember, I was taken to a beautiful island, protected, educated, loved, given every opportunity to grow, to dream, to create. But you had none of that.
JULIUS	You had nobody. Nobody to love you, nobody to trust you, nobody to encourage you. All life taught you was that the only person you could count on was yourself. Tears begin to well up in Vince's eyes. JULIUS You're the missing part of my life and I'm the missing part of your life. And when we find our mother we can fill the missing part of hers. We won't be alone anymore, Vince. We can be a family. Vince looks at his brother. A beat.
VINCE	A family? You really think so?
VINCE	With like Thanksgiving dinner? And Christmas trees...
JULIUS	... and a real home where you'll always be welcome. VINCE Always?
JULIUS	Even when you've been bad. JULIUS Is this necessary?
VINCE	I'm not introducing you to my mother dressed like some goatsherder from Albania. You need some new clothes.
SALES CLERK	Can I help you, sir? VINCE Do I look like I need help? Here's the problem. Maybe I'll try on a couple of things myself.
JULIUS	Do I look okay?
VINCE	You look better, put it that way. We got to do something about the way you walk. You're moving a tad stiff, Jules. Ever see * Frankenstein?
JULIUS	I read the book. VINCE That's not gonna help. You got to walk like you're moving in time to music. I'm not talking about military marches now, I mean Aretha Franklin, Otis Redding, Wilson Pickett, Archie Bell and the Drells and a couple of white * guys. *
VINCE	Like this... You just got to try to be cool, you know? Try these on.
Indicating glasses.	Julius puts on sunglasses, snaps his fingers, tries to
JULIUS *	Am I cool now? -- * VINCE * Mr. Ice. *
MARNIE/LINDA	Wow!
JULIUS	We know where to find our momma! VINCE Everything Julius said was true. I'm the product of geniuses! LINDA I always knew that.
VINCE	Of course, but it's nice to make it official. JULIUS * Tommorrow we're going to finally meet our mother. VINCE * And tonight we celebrate! bothering him. JULIUS Vince, you've got to help me -- I've never been out on a date before... what should I do?
VINCE	Talk to her, buy her some drinks, dance with her. Girls like to dance.
JULIUS	Dance?
VINCE	I guess you haven't done that before either. Julius shakes his head.
VINCE	Well -- forget all that disco shit, everyone's seen it. When I really want to romance a girl, I waltz with her.
JULIUS	You dance with them? *
VINCE	It turns them to putty in your hands. He shoves a chair out of the way, making a little room.
VINCE	Okay, come here, put your feet by my feet -- JULIUS -- Thank you for this, Vince --
VINCE	-- I said put your feet by my feet not on my feet! -- Julius looks at his brother, then self-consciously takes
VINCE	I'll lead, you follow. Okay, one, two, three, turn... ... put your arm here -- you're breaking my fingers -- you're not wrestling a boar 300 miles south southwest of Fiji -- don't clench your teeth -- Vince begins to take Julius through the steps slowly at VINCE Well, you've learned to waltz. Now it's time to introduce you to the wonderful world of getting shit-faced. JULIUS Did you know they had beer in ancient Egypt?
MARNIE	Er... no...
JULIUS	Actually it was invented by the Assyrians, but the Eygptians were the first people to perfect the malt fermentation process. LINDA You sure know a lot about beer.
MARNIE	He knows a lot about everything. Julius polishes off the bottle, belches. But it's all from books. Until tonight I never had a beer. All theory, no practice -- the story of my life!
VINCE	Well, we're going to change all that -- aren't we, Marnie? Julius, embarrassed, looks over at Marnie, who's smiling
JULIUS	Can I ask you a question?
MARNIE	Anything... JULIUS Am I shit-faced yet? Linda, surprised, does a spit-take with her beer.
MARNIE	You're getting there. Vince gets to his feet. VINCE Please excuse me -- my back teeth are floating.
JULIUS	I better see if mine are, too. Julius takes off after Vince.
JULIUS	You do that too, huh?
VINCE	Not all the time. Listen, Marnie's got the hots for you. Tonight could be your lucky night...
JULIUS	I don't think she really likes me.
VINCE	Piece of cake. You're nervous 'cause it's your first time. Perfectly natural.
JULIUS	Were you nervous?
VINCE	I was twelve and she was a nun -- that's real pressure. They both finish at the urinals and begin washing at the
VINCE	I got to admit it, Jules -- since I met you, life is getting better all the time. Julius, a little smashed, can't hide his feelings. He
JULIUS	For me, too, Vince! Sometimes I'm so happy, I want to pick you up and hug you! Julius starts to do so, just as another man enters.
VINCE	Hey, cut it out! Not in here! Julius releases Vince, who clocks the other man's
VINCE	Go easy on the beer, okay? Lookin' forward to it.
BEETROOT	Sorry, Webster, looks like I'm doin' business with someone else. WEBSTER I'd do the same thing. You want the delivery, it's not your problem who delivers. If you ever need me, my answering service forwards all messages. And he's gone. BEETROOT Put this in my personal file. God, I love a professional... LINDA Did you tell anybody we were coming to Santa Fe? MARNIE Well, I phoned work and told them we wouldn't be coming in for a few days... Oh, I forgot to tell you -- we've been fired.
LINDA	Let's go to the ladies' room. MARNIE But we just went. Linda takes Marnie by the hand, just as --
BURT AND BOB KLANE	each with a cast on his foot, each supported by a crutch, BURT KLANE Hello, girls -- Do you mind if we sit down and enjoy the music with you?
BURT KLANE	This has gone way past a simple case of loan deliquency. BOB KLANE We don't like getting shot. *
VINCE	What are you talking about? We didn't shoot anybody. BURT KLANE It's no way to do business.
JULIUS	What do you want?
BURT KLANE	We want to take Vince out to the parking lot and kill him. A long beat.
VINCE	That's kind of drastic, don't you think?
MORRIS KLANE	Let's go. JULIUS Don't touch him.
BURT KLANE	This is not your problem -- you * don't want me to hurt these lovely ladies, do you? He pushes his gun into Marnie's side. MARNIE -- Ow!
JULIUS	You moved too soon... BURT KLANE What? JULIUS The second rule in a crisis situation:
MORRIS KLANE	He's starting that funny talk again... JULIUS If you choose to bluff, you must be prepared to have your bluff called. BURT KLANE This is no bluff -- Asshole --
BURT KLANE	Meet my cousins. Get these jerks outside. Without stopping, Julius whips his arms together in front Klanes are out cold.
VINCE	How many of those... rules do you have?
JULIUS	Quite a few. They were formulated by a Kendo swordsman in the 17th century, but their philosophical underpinnings can be applied to many other areas of life. VINCE I bet.
OMITTED A142	
VINCE	Uh... we got cable TV, a fully stocked bar, free ice -- we're in great shape.
JULIUS	Where you going?
VINCE	I thought I'd just go and tuck Linda in for the night.
VINCE	Maybe read her a bedtime story. Don't wait up for me.
