CHARACTER	DIALOGUE
by	v. 04 /2 2/ 88 (P in k) v. 04 /2 7/ 88 (Y el lo w) v. 04 /2 8/ 88 (G re en ) v. 05 /0 2/ 88 (G ol de nrod) v. 05 /2 5/ 88 (C he rr y) v. 06 /1 6/ 88 (T an ) v. 06 /2 2/ 88 (S al mo n) CONSOLIDATED FOURTH DRAFT v. 07 /0 5/ 88 PM ( Mi nt Grn) v. 07 /2 5/ 88 (G ol de nrod) April 27, 1988
WERNER (V.O.)	On his 35th birthday, I decided to tell Julius Benedict the truth about himself...
WERNER (V.O.)	It wasn't that he was the product of a scientific experiment.
WERNER (V.O.)	An experiment designed to produce a physically, mentally and spiritually superior human being. I explained that to him when he was two years old. And it wasn't the complexity of Julius's parentage. He knew that unlike other little boys, he didn't have just one, but half a dozen fathers, all very distinguished men. * Nor was it about the extraordinary woman chosen to be his mother... Julius had long lived with the tragic news that she died giving birth to him. What Julius didn't know, until this very moment, was that, about a minute after he was born... Another nurse emerges from the delivery room, holding up
WERNER (V.O.)	His mother gave birth to another baby...
The angry baby. Fuming.	PULL BACK to reveal: The two of them are in the same crib. The leg of the angry baby. It suddenly lashes out, The angry baby. All smiles now. HOLD ON the two babies in their crib as the following ARNOLD SCHWARZENEGGER DANNY DE VITO TWINS
JULIUS	I have a brother?!!! A greenhouse on the island. Werner, now 70, is bent and old. Julius, in peasant garb
WERNER	He was sent to an orphanage in Los Angeles. At the same time I brought you here to the island. Julius isn't listening. His eyes shine.
JULIUS	I have a twin brother?!! What's his name?
WERNER	Vincent. JULIUS Vincent -- Every time I loved something I called it Vincent -- I called my first computer Vincent! I have to find him! Werner. The ocean spread out below them is vast and WERNER You've been here since you were a baby -- you know nothing of America -- JULIUS I know it is the cradle of democracy and the land of the free; besides, I speak twelve languages -- I'm sure I can get a job.
WERNER	They're a simple people; rather primitive, not like us.
JULIUS	My brother will look after me. Werner hands over a photograph: it's a picture of a JULIUS It's your only copy -- WERNER -- My need for it is only sentimental -- yours may be practical -- Julius slips the photo into his suitcase. JULIUS Thank you -- I'll miss you.
WERNER	I'll miss you.
CONTINUED: (A1) A14	OLD WOMAN * It's sixty miles to the airport, * Julius; be careful. * Julius then bows to the Oriental, who bows back.
JULIUS	It was an honor to study under you, Master. Without warning, the Oriental tries to strike Julius in
ORIENTAL	Ahhh, always on guard. You have learned well, Julius-san. Julius gives a last hug to Werner.
JULIUS	I was just thinking, maybe my brother Vincent is married.
WERNER	And...?
JULIUS	Well, if a woman loved my brother enough to marry him, she might have a sister who'd feel the same way about me. That often happens with twins, you know. WERNER Julius -- please -- don't get your hopes up. Your brother doesn't even know you exist. JULIUS Of course he does. I've always known there was something missing in my life! And deep down, I'm sure Vincent feels the same way! He's probably just like meeeee!
VINCE	You sleep well, honey? Mmmm... like a baby.
VINCE	Me, too. I love this new mattress. It's soft but it's hard at the same time. And I love this new clock. VINCE You've done a great job on this room, Carla. CARLA You really think so? Even the curtains?
VINCE	The curtains are the key to the whole thing. They're colorful... they're brilliant... they're... great curtains.
CARLA	You were great last night, Vince.
VINCE	Naaaw... I think we're going to be very happy here. Suddenly we hear a DOOR downstairs as it OPENS, and a Honey! I'm home!
VINCE	What's he doing back so early?
MAN (O.S.)	Carla? You gonna cook me some breakfast or what?
CARLA	Be right down, sweetheart! Vince checks his appearance in a dresser mirror,
CARLA	Hurry up! I gotta make breakfast!
VINCE	You're wonderful, Carla. Your husband doesn't deserve to kiss your feet. -- and with that, he leaps into space!
VINCE	'Oh what a beautiful morning, Oh what a beautiful day'... Now he does something surprising -- not starting to drive,
VINCE	... 'everything's going my way'...
VINCE	Carla, what a joy to look at you. Is my partner and best friend, Al home from work yet? I am the bringer of good tidings.
VINCE	Stop with that horrible song, you know how I hate birthdays; they're worse than Christmas. Al presents him with the gift.
VINCE	For me?
AL	Carla and I figured, since you were always admiring mine, what the hell...
VINCE	A lighter, just like yours. I don't know what to say, Al. I'm all choked up. CARLA Hello -- the Greco residence... sure. Who may I say is calling... Mr. Burt Klane? Vince, it's for you -- VINCE Good morning, Mr. Klane. I hope you're having a wonderful -- Yes -- no problem -- I have it. Yes. Today. Of course. 'Bye. Vince hangs up. What are you doing talking to a loanshark?
VINCE	That's part of my good news -- You know that money I picked up from the Jaguar we boosted. Well, * I put the money in the stock * market. I got this incredible * tip. * CARLA Oh no. *
VINCE	I can't lose. Ever hear of P.V.T. * Industries? Probably not -- * Secret takeover bid -- AL You put the money on a stock? *
VINCE	A very special stock -- and it was such a sure thing -- I borrowed another 20 grand from the Klane * Brothers. CARLA You borrowed from a loan shark to invest in the stock market? VINCE On margin -- And as of last night I was ten thousand ahead. I'm * going to make a fortune -- turn on the T.V. ... that Wall Street's suffering its worst single-day's losses since October '87. Hardest hit * were Federated Broadcasting, down $18, Waverton Data, down $24 and P.V.T. Industries, down $32. Analysts speculate that even blue chip stocks will not remain immune to... CLOSEUP ON the extremely worried face of Vince as he
AL	You are having one shitty birthday, Vince. VINCE I'm wiped out. I got to get some money -- fast. * AL Well... '88 B.M.W. came in for long term last night...
CARLA	Don't you think you're doing this too often?
VINCE	I'm a desperate man. *
AL	Level three. Stall 25. Vincent approaches the BMW and pretends to be searching
VINCE	This is only four thousand --
OWNER	We're in a recession -- Everything's tough -- you want to try someone else -- no hard feelings. VINCE Forget it.
OWNER	You okay, Vince? You seem a little worried.
VINCE	Me? I laugh myself to sleep every night, and I never sleep alone. I'm doing great! The Owner smiles and turns. Vince continues counting the 'Put on your red dress, baby 'Cause we're going out tonight...' A few passengers turn and look back at --
JULIUS	seated in the rear, still in his peasant garb, the bamboo JULIUS 'I better wear some boxing gloves, In case some fool might want to fight.' STEWARDESS I knew you were trouble the second I laid eyes on you. Julius stares up at her, speechless and mesmerized.
JULIUS	Sorry -- I've never heard this music before -- I love it. * She sighs, leans over him, fastens his seat belt, while
STEWARDESS	The captain wants us to buckle our seat belts because we're expecting a little turbulence.
JULIUS	Thank you, Betty Lou. STEWARDESS I bet you're a football player.
JULIUS	Actually, I'm a horticultural botanist, a mathematician, and a philosopher.
STEWARDESS	Right. And I'm a brain surgeon.
HIJACKER (MAN)	Nobody moves, or else we're gonna have a serious draft in here. Get the captain. I want to discuss our final destination.
JULIUS	turns to the terrified elderly woman beside him who's JULIUS Excuse me, ma'am. -- now a hardcover book comes rocketing through the air, retrieving the hardcover Bible from the floor and -- His mischief shall return upon his own hand, and his violent dealing shall come down upon his own head -- Psalm 7:16. In front now, there is a lot of activity as various pass-
BARTENDER	It's him. He's back.
VINCE	Marnie! How are you? Is your * sister around? * Marnie starts to wipe down the table, spilling crumbs into You total Linda's car. You pawn * her stereo. You declare us as * dependents on your tax return!? VINCE What an amazing memory -- Vince! I knew you'd come back! dependent, and legally blind when it comes to Vincent.
VINCE	I am so sorry for all the miserable things I've done to you.
LINDA	Like what?
MARNIE	Linda! LINDA I'm not going to give him any money. Just take care of my station for a minute.
VINCE	I didn't come here for a loan, sweetheart. I came to say goodbye. It's not safe for me here. People are trying to kill me. Vince starts to rise but Linda pulls him back down.
LINDA	What did you do, Vince?
VINCE	I got involved in the stock market. LINDA I promised Marnie I wouldn't give you money. Vince takes Linda's hand between his and stares into her
LINDA	Don't look at me like that... Don't do that with your eyes... I shouldn't even be here with you.
VINCE	You are here and so am I, Maybe millions of people go by, But they all disappear from view, And I only have eyes for you... Linda. I only have eyes for you. LINDA That is so beautiful. How do you make up that stuff? You're such a poet. VINCE You inspire me. VINCE It's the baby Klane -- I gotta get the hell out. Burt Klane strolls to the middle of the room, then suddenly BURT KLANE Where's the little shit?
LINDA	You gotta be more specific, considering our clientele.
BURT KLANE	Benedict.
LINDA	He wouldn't show his face around here. Right, Marnie? She looks down at -- VINCE
MARNIE	Who, Vincent? * -- That weasel, that creep -- that oily little slug -- that two-bit, two-timing, waste of space -- that pathetic, low-life pocket Romeo.
BURT KLANE	Okay -- enough. BOB KLANE Look what I found crawling around out back. BURT KLANE This is only four thousand --
VINCE	The rest is invested. We're gonna make a fortune. BOB KLANE Shut up. Linda comes over -- Very nervous, she looks around, then
LINDA	I hope this helps -- Please don't hurt him.
BURT KLANE	There you go -- -- Another thousand -- Okay -- This nice lady just bought you a day Vince -- I want it all -- Twenty- thousand -- this time tomorrow. *
VINCE	Twenty -- ? But I just paid -- Just as he opens his mouth, Vince is elbowed again.
BURT KLANE	That's just the interest. The * twenty's the principal. * VINCE That was the most wonderful birthday present anybody ever gave me -- LINDA It's your birthday? Why didn't you tell me?
VINCE	I can't take the kindness. It gives me the shakes. LINDA You'll tremble plenty before we're through, Vince Benedict. They kiss. "flowers" and street food and there's a porno house * druggies and guys slumped unconscious in the gutter and -- There's Julius, case in hand, staring around, taking it
CLOSEUP ON JULIUS	And you can see it on his face: He loves it.
JULIUS	... How wonderful... But Julius is pretty noticable no matter where he goes. Julius, staring at it, shaking his head. JULIUS What an amazing country.
BIKER #1	ROARING up beside Julius, smiling ingratiatingly.
BIKER #1	Got a light, pal?
JULIUS	Sorry, but I don't smoke... pal? BIKER #1 Looking for something for your girl friend?
JULIUS	I... don't have a girl friend. Do women really wear these things? BIKER #1 If you're lucky. You from out of town? *
JULIUS	Yes, a small island in the South * Pacific, about 300 nautical miles south-southwest of Fiji... Biker #2, bounds along, and when he reaches Julius he Not an original plan, certainly, but one that over and over again, always works --
CASE HANDLE	Julius's hand holds fast to it. Then -- As his mouth drops open as we --
JULIUS	just sort of standing there, no big deal, not much effort ending its trip as it collides with a storefront and
CYCLIST #1	stunned, going to his unconscious partner. BIKER #1 What the hell did you do? Julius calmly kneels beside the still form. He puts
JULIUS	I did nothing, the pavement was his enemy.
JULIUS	I would say -- a concussion -- a mild shoulder separation, and ribs to seven are cracked. Get him to a hospital. JULIUS And in the future, you should both consider wearing helmets. A sweet smile. thru VINCE Fifty-three dollars? You gotta * be kidding.
COP	Your vehicle's in a handicapped zone. Vince immediately hunches his shoulder and affects a
VINCE	So? Do I look normal to you?
COP	You don't have a 'handicapped' sticker on your windshield. Driver's license, please.
COP	You've got over 200 outstanding parking tickets, Mr. Benedict. And you just had your birthday? Well, your driver's license just expired -- Happy birthday. *
JULIUS (V.O.)	So, this is where my brother grew up. I'm glad he had so many friends to play with. *
JULIUS	And that's where he must have slept.
MOTHER SUPERIOR	How did you know?
JULIUS	It's the one I would have chosen. It's next to the fire extinguisher. In case of a fire, I could have given the alarm, and saved the other orphans.
MOTHER SUPERIOR	We've only had one fire at St. Charlotte's. Vince Benedict started it, we like to think by accident.
JULIUS	Tell me about him. Was he a good athlete? Did he like chess and poetry?
MOTHER SUPERIOR	I'm certain that God had a purpose when he created Vincent Benedict, but it had nothing to do with chess or poetry. MOTHER SUPERIOR That's odd... the contents of his file are missing. Julius picks up the photo -- a 13-year-old boy leering up
JULIUS	This is him? He looks happy -- *
MOTHER SUPERIOR	He should -- that's Sister Maria, * his biology teacher.
JULIUS	I always liked biology.
MOTHER SUPERIOR	So did Vincent. He disgraced Sister Maria, who had to leave the order. Then he stole all the money from our library fund and ran away.
JULIUS	But I have to find him. Where do you think he might be?
MOTHER SUPERIOR	Jail. A man of his character could only be in jail. You're full of goodness, Julius -- I pray that you never find him. SEVEN FOOTER What're you lookin' at? VINCE At you, you jerk. The Seven Footer rises angrily to his full size. Vince
VINCE	Tyrone Davis, averaged 23 points, eleven rebounds and four blocks a game his senior year. First round pick of the L.A. Clippers and now look at him. SEVEN FOOTER Who're you? VINCE World International Athletics * Representation. Vincent Benedict -- President. I coulda got you a no-cut contract so you wouldn't have to heist T.V. sets for a living --
GUARD	Benedict! Visitor. VINCE Call me when you get out, they're always looking for centers in Italy... -- and as a look of pleasure comes across his face --
GUARD	leading an attractive, powerful inmate into the room.
JULIUS	trying to fight his excitement, watching as the prisoner -- then past him.
Julius makes a smile.	Vince just stares. JULIUS Excuse me, but I'm looking for Vincent Benedict. GUARD You got 'im. Julius turns, looks at Vince, and as he walks back to his wonder of it all. JULIUS emotions are in Vincent... dearest Vincent... I have rowed halfway across the world -- no, wrong, I only rowed one day but I came halfway across * the world -- I know you don't know who I am, but believe me when I say I have been waiting for this * moment all my life... It's hard to tell what Vince is feeling but clearly the VINCE You gotta talk into the phone, * asshole. Julius is confused, momentarily.
JULIUS	Vincent...
VINCE	listening, somewhat amazed. Who is this loony?
JULIUS (V.O.)	... Dearest Vincent... Vince glances quickly around to see that no one is
JULIUS (V.O.)	I know you don't know who I am, but -- I came halfway across the world --
VINCE	-- Whoa. I still got another six hours to pay the money back. You * tell those crummy Klane brothers that harassing a man when he's already in the slammer is beneath even them -- JULIUS -- I don't know any Klane brothers. I'm your brother, Julius. VINCE Huh? Again?
JULIUS	I don't know any Klane Brothers.
VINCE	Yeah. Go on -- I got that part.
JULIUS	My name is Julius -- I'm your twin brother.
VINCE	Obviously -- the minute I sat down I felt like I was looking in a mirror. JULIUS We're not identical twins.
VINCE	I wouldn't be too sure. JULIUS You don't believe a word I've said, do you? VINCE -- That's right. I don't believe a word you said. *
JULIUS	Vincent, I don't lie. I am your brother. Let me help you get out * of here. VINCE Oh... you want to help me get outta here? JULIUS Yes. VINCE Well, money talks, bullshit walks. JULIUS How can bullshit walk? Is that slang?
VINCE	I'm in fast company here -- Listen, you get me outta here, I'll be whatever you want, best friend, brother, nephew, niece, grandma... VINCE Just don't ask me to bend over -- VINCE Listen, 'twinny,' I hope you didn't blow your wad on those tickets, 'cause it's gonna cost a bunch more to release my car.
JULIUS	I have some more money -- VINCE You do?
JULIUS	I am happy to help you, Vincent. You're my brother. I love you.
VINCE	Julius -- look -- ease up on the love talk or I'm gonna be tossing my cookies, all right? JULIUS Tossing cookies, that is more slang?
VINCE	Just gimme your wallet, okay? As Julius sweetly hands it over --
JULIUS	I know what you're thinking?
VINCE	No, you don't.
JULIUS	You're thinking that this whole twin business is what you call 'bullshit.' This is exactly what Vince has been thinking.
VINCE	Actually, I was thinking I'm going to need some more money -- to put gas in my car --
JULIUS	You can take some more money -- VINCE I can? JULIUS Sure...
VINCE	We're brothers -- right? Julius tries to drape an arm around Vince's shoulder.
VINCE	They arrest you, they put you * behind bars, they fine you and * then they hide your car. *
JULIUS	That's -- -- your car, isn't it?
VINCE'S MUSTANG	Which is what Julius is pointing at.
VINCE	Yeah -- How'd you know that was my car.
JULIUS	We're twins! Vince unlocks his side, gets in. Julius, smiling and
JULIUS	I'm so excited -- we'll go to museums together, discuss philosophy together, read books together -- play chess together -- VINCE -- Get lost together -- And on that, he GUNS his CAR the hell away, leaving
JULIUS	Deserted, alone in the sea of cars. AL Hey, the new Sedan DeVille... Very nice. The driver, GARFIELD, just nods, holds out his hand for
AL	You guys must be going to Hawaii, huh? Catch that good surf.
GARFIELD	Something like that. The two men just stare straight ahead, uninterested in
AL	There's plenty of space on level four. The Cadillac accelerates up the ramp.
OUTSIDE CADILLAC	as the men get out, lock the car, wipe off the door SPORTS AGENT - ARTIST'S REPRESENTATIVE IMPORT/EXPORT * AUTOMOBILE SALES - RENTAL - LEASING * WHOLESALE PATIO FURNITURE * His door opens and out come two furniture MOVERS with a
VINCE	What're you doing with my desk?
MOVER	Taking back the furniture -- you're six months behind.
MISS BUSBY	I tried to stop them, Mr. Benedict -- VINCE It was time to redecorate anyway. The PHONE RINGS -- Miss Busby drops to her knees beside MISS BUSBY Vincent Benedict, Incorporated -- Sports agent, artist's representative -- import/export -- automobile sales, rentals, and leasing -- wholesale patio furniture -- How may I help you? Oh, hi. It's Al. As she hands him the phone.
VINCE	Miss Busby -- Stacy -- this is a transition period for the corporation -- Why don't you take a few days off.
MISS BUSBY	... Aah -- all right. Whatever you say, Mr. Benedict... Oh, before I forget... Happy birthday... She hands him a gift-wrapped present which he opens.
VINCE	'Aqua-Velva' -- you shouldn't have -- She takes her purse, smiles, goes. When he's alone, into phone:
VINCE	I hope you got some good news, * Al -- * AL Brand new Caddy on level four.
VINCE	Great, I'll be right over. Vince drops to his knees in order to replace the phone PULL BACK to reveal MORRIS KLANE, the biggest of them all,
MORRIS KLANE	Time's up, Vincent -- Got the money? He bends over, picks Vince up by the neck like a toy doll,
VINCE	In agony, on his knees. It hurts to breath. He finally
VINCE	Did you hit me yet? 'Cause I didn't feel nothin'.
MORRIS KLANE	He grabs Vince again.
MORRIS KLANE	You gotta understand something, Benedict -- I like my work. He pulls Vince groggily up and this time he's going for
JULIUS	These are most unfriendly acts you are committing.
MORRIS KLANE	What? JULIUS I don't know what the problem is, but I'm sure it can be solved without resorting to violence. MORRIS KLANE Okay, okay. JULIUS Good. * Julius lets go of Klane, who gets to his feet, turns
JULIUS	You moved too soon. Klane spins and aims a karate kick at Julius's head. JULIUS An important rule in a crisis * situation -- negotiate first, attack last. You never negotiated. You don't know what kind of enemy I am.
MORRIS KLANE	Who are you?
JULIUS	Vincent's brother.
VINCE	We're twins.
MORRIS KLANE	You're firewood.
JULIUS	You have no respect for logic -- *
JULIUS	-- And I have no respect for those with no respect for logic. You're a very stupid person.
VINCE	Watching as Julius picks up Klane with both hands and
JULIUS	As he heaves Klane across the corridor into the open VINCE
VINCE	Tell your brother 'He messes with me, he messes with my whole family!'
VINCE	I like it when you hit people!
JULIUS	I hate violence. VINCE But you're so good at it. We ought to go into business together. You could be a boxer and I'll be your manager. JULIUS I don't think I could fight for money.
VINCE	No problem. You do the fighting, I'll keep all the money.
JULIUS	I'm worried about you, Vincent. They reach Vince's Mustang and get in.
JULIUS	How much money do you owe? Don't lie -- we're twins, I can feel your pain.
VINCE	Why do you keep saying that? We're not twins, we're not brothers, we're nothing, and you're only in this car because I could use a little protection these days -- JULIUS Twenty thousand? VINCE Due this morning. Suddenly Vince bangs his forehead with the palm of his
VINCE	I don't know where my head is -- I forgot I promised this friend of mine -- Sammy -- I'd pick up his car at the airport -- do me a big favor, okay? Drive this car back from the airport for me. JULIUS I'd love to. Julius reaches into the glove compartment, takes out the VINCE What are you doing with that finger? JULIUS Learning to drive. Vince isn't sure what's going on at this point. Now Vince and Julius's heads are both in motion now --
JULIUS	What's the matter?
VINCE	That dopey Sam -- He did it again. Forgot to leave the keys... A lot of handicapped kids are gonna be really disappointed...
JULIUS	Handicapped children? VINCE This car was supposed to be auctioned off at their charity drive tomorrow. Oh, well, let's go eat.
JULIUS	Maybe we should try to open it ourselves... Vince raises his eyebrows in mock surprise.
VINCE	You think we should do a thing like that?
JULIUS	Of course -- it's for the children... CLOSEUP - SLIM JIM Vince inserts it into the Cadillac's driver's-side * VINCE I saw a guy from the auto club do this once... The door locks suddenly pop up in unison. VINCE Whaddya know? Beginner's luck!
VINCE	As he takes a breath, opens the door, scoots inside -- -- Vince frantically scrambles around, lying on the car Second, the SIREN STOPS. Vince looks out the car window. When the back end is raised to an angle greater than 45 degrees, a mercury switch activates the automatic cutoff system. The alarm's computer thinks the car is being towed away and shuts off.
VINCE	No shit... It's beginning to dawn on Vince that there may be more to A pause. Now the Mustang comes along, Julius at the wheel. He JULIUS Vincent Benedict's car. Vincent! Where are you? Ya see that little dot in your rearview mirror? That's me.
JULIUS	Hi, Vincent. There's a supermarket up ahead. Take your foot off the gas and very -- very -- very gently put it on the brake. JULIUS The brake -- right. Vince's car pulls in a moment later. He gets out, gazes
JULIUS	The brakes worked just fine! VINCE Lemme tell you something about America, Julius -- nobody likes a smart-ass.
LINDA AND MARNIE	are pushing a cart down one of the other aisles. Linda
LINDA	Angel's food or devil's food? MARNIE The answer's obvious.
LINDA	There's only one Vince Benedict. He's a force of nature. MARNIE And that 'poetry' he pretends to write. They're old song lyrics, Linda. Linda stops pushing the cart and looks at her.
LINDA	I know that -- Geez, you don't think I know that -- ? It's so cute, the way he thinks he's tricking me. Anyway, what's wrong about other people's songs? Some guys tell you dirty jokes. It just proves that Vince has a romantic soul. MAGAZINE RACK Adjacent to the express checkout lane where Linda and Excuse me. She reaches past Julius to take a copy of Cosmopolitan.
MARNIE	She's not bad...
JULIUS	I'm sorry. I had no idea these magazines had things like that... inside them. Julius tries to stuff the centerfold back into the maga- MARNIE You didn't? Where've you been? A desert island? JULIUS As a matter of fact, a small tropical island, in the South Pacific, about 300 nautical miles south-southwest of Fiji. I only got here yesterday, but already * I've found my wonderful brother. * MARNIE Your brother? That's right... They all turn and look at Vince, who's pulled his cart
JULIUS	My twin brother, Vincent. Linda and Marnie, stunned, look from Vince to Julius.
VINCE	God you look beautiful in this light. Vince... ? I didn't know you had a brother.
JULIUS	You all know each other?
VINCE	Julius, meet Linda and... Her charming sister, Marnie.
JULIUS	Sisters? MARNIE Twins?
OUTSIDE THE SUPERMARKET B68	
VINCE	Goodbye girls, see you soon. JULIUS Goodbye girls, see you soon. And he guns off too -- only in his excitement he's gone
JULIUS	I've only been drivng for an hour. Now he follows Vince. MARNIE Why do I think I'm going to see him again? Like maybe tomorrow.
JULIUS	Linda is your girl friend, isn't she?
VINCE	Yeah. Kind of. JULIUS Is Marnie your girl friend, too? VINCE Marnie! Marnie hates my guts. She seemed to like you.
JULIUS	She hardly knows me. A beat.
