CHARACTER	DIALOGUE
CAROLINE	Nanotherapy, beta version: Tuesday, March 10, 2011. Female Test subject Number four. Franklin reaches for us, smiles...
FRANKLIN	Here we go, Bright eyes. A MIST fogs our view for a moment.
CAROLINE	Not too much. She needs to be calm, but alert.
VOICE THROUGH INTERCOM	Go ahead - send her through. A LOUD HUM and we start moving, sliding into a tunnel a The focus in his eyes belies the casual dress.
WILL	Start the scan. A TECHIE sits at a computer screen beside Will.
TECHIE	Scanning.
DONNIE	Stuff looks like Kool-aid.
CAROLINE	Go ahead, I'm sure you could use it. Starting the therapy...
FRANKLIN	She's convulsing. Caroline sticks a stethoscope in the tube, listens to Bright Please keep the monkey still. He focuses back on the monitor.
CAROLINE (INTERCOM)	She's not a monkey. Will looks from the monitor to Caroline. His look is
CAROLINE (INTERCOM) (CONT'D)	She's an ape. Chimpanzees, gorillas and orangutans, they're all apes.
WILL	Good to know. Just keep it from moving. She's stung, wonders, why does he have to be such a jerk He's oblivious to this, instead intent on getting the scan
TECHIE	Here we go. Will stares at the scan, his eyes willing the test to Will fights a CONTRACTION OF EXTREME EMOTION that passes
WILL	We're on our way. Good work.
CAROLINE	What is this? Caroline holds up a picture of a tree for Bright Eyes, who Bright Eyes presses a button.
ELECTRONIC VOICE	Tree. Caroline holds up a picture of an acorn.
CAROLINE	And this? The chimp presses another button.
ELECTRONIC VOICE	Acorn.
CAROLINE	Where does the acorn come from? Bright Eyes considers... then presses a button.
ELECTRONIC VOICE	Acorn.
CAROLINE	Yes, but where does the acorn come from?
ELECTRONIC VOICE	Acorn. Bright Eyes interrupts, now pressing three buttons.
ELECTRONIC VOICE	Acorn. Tree. Acorn. The chimp looks at Caroline, who's stunned, trying to process
ELECTRONIC VOICE (CONT'D)	Surprise. The unnatural voice - paired with Bright Eyes' eerily human-
CAROLINE	We started the therapy four weeks ago. This was yesterday. Will's studying the scans. They look good. Real good.
CAROLINE (CONT'D)	There's been clear cell growth. Both on the frontal lobe and the neocortex. She's purposely standing close in order to point this out.
WILL	I see that. But I don't understand the primate behavioral norms. She knows an acorn's a seed. Wouldn't any monkey know that?
CAROLINE	No - it's conceptual. Acorn gives us a tree, which gives us an acorn.
WILL	Abstract thought...
CAROLINE	In a chimpanzee. Unheard of. Will turns the possibilities over in his mind. Caroline
CAROLINE (CONT'D)	You're calling her a monkey just to piss me off, aren't you?
WILL	Start the other's on the 112. And double this one's dose. He pulls away from the BIO LAB, which is tucked in a corner Will enters, his posture almost visually changing with the
WILL	Hey Dad. Walter looks up, whispers...
WALTER	John... is that you?
WILL	It's me. Will.
WALTER	As thou dost, Anthony. .he hears no music. No music...
VOICE	He's been doing that all day. A Home Aide enters, grabs her coat. This is IRENA.
IRENA	He found an old book of his. She pulls a worn paperback of Julius Caesar from Walter's
IRENA (CONT'D)	I had no idea you liked Shakespeare so much, Mr. Walter.
WILL	My mother was the one. She liked Shakespeare... Good night, Walter, hone-ee. She heads out. Will gently takes his father's arm.
I WILL	Come on, Dad.
WILL	Remember I told you we were using Basic Fibroblast Growth Factors on the apes? Well the therapy seems to be working. We've seen definite signs of adult brain neurogenesis. Walter holds up his arms for Will to slide on the pajama top.
WILL (CONT'D)	Board of Directors is coming in a couple weeks to talk about Phase 2 - that's clinical trials. Walter gives no hint he's even listening, much less
WILL (CONT'D)	Human trials, Dad. Soon.
WALTER	I rather tell that what is to be feared than what I fear: for always... I am Caesar... There's no way to reach him tonight. Still Will tries..
WILL	I'm going to make you better - I swear it. His father looks at him. A moment of recognition?
WALTER	John... ? No, Dad, it's me. Will. Will helps the old man under the bedcovers.
WILL (CONT'D)	John's gone. He moves to the door, pausing to take in the diplomas on the Will looks at his father lying there on his back, staring up
FRANKLIN	Good morning, Felix. Bam Bam. Monty. Hey - what's the matter, don't like my cooking? He pauses in front of Bright Eyes, huddled at the back of her
FRANKLIN (CONT'D)	You okay back there?
CAROLINE	Something wrong with Bright Eyes?
FRANKLIN	I'll check on her when we're done. Franklin unlocks a cage and leads a CHIMP - LUCKY - into the From Bright Eyes' vantage point she can see through the open
JACOBS	You could at least try to look excited. Will's too nervous to look excited. He eyes the FOUR SUITS
WILL	I'm not good with this stuff. Jacobs puts a hand on Will's back, leads him inside.
JACOBS	You'll do fine. Just speak English. Keep the science simple.
CAROLINE	Okay. Back it out...
DONNIE	Your turn. Bright Eyes RUSHES FORWARD, HER HANDS GRIPPING THE BARS SO
DONNIE (CONT'D)	C'mon - Let go - She understands what he wants but she won't do it. THAT'S
DONNIE (CONT'D)	Hey! Something's wrong with number four! Franklin looks over - he's still dealing with Lucky on the
FRANKLIN	Be right over - Donnie looks closely at Bright Eyes. There's something
DONNIE	What's the matter with you? Alzheimer's affects the entire neocortex, the hippocampus, and large subcortical regions of the brain...
DONNIE	Now Donnie's smashed up against the bars. Hard. The other Donnie hasn't panicked quite yet, but he's about to.
DONNIE (CONT'D)	Someone get her off of me!
CAROLINE	Hang on - Franklin struggles to hold onto Lucky as Caroline hurries
WILL	In the past, it's been impossible to target specific areas, both because of the Blood Brain Barrier - Jacobs stands, interrupting Will.
JACOBS	What Dr. Rodman has done is to invent a virus that can, for the first time, cross the membrane that protects the brain and deliver a genetic, therapeutic, payload.
WILL	This 'payload' would directly affect the areas of memory, higher function - and, of course, the motherlode: intelligence. The board members stare, trying to comprehend.
BOARD MEMBER	Meaning?
WILL	Meaning. If Phase 2 goes as planned, we're looking at a cure for Alzheimer's. With an elbow prompting from Jacobs, Will takes a SAMPLE VIAL
DONNIE	She's breaking my hand!
CAROLINE	Let go, Bright Eyes! You're hurting him! She tries to help pull Donnie away.
CAROLINE (CONT'D)	Let go! In the next room Franklin's having troubles of his own.
FRANKLIN	Lucky no! Stop! Hit the alarm! Caroline lunges to an ALARM BUTTON and pounds it.
GUARD #1	Uh oh. Guard #2 turns to another screen - where DONNIE IS VISIBLE IN
GUARD #2	Hey, Len...? Bright eyes is pulling Donnie's arm right from its socket...
BOARD MEMBER	What about the safety of the virus?
WILL	Perfectly safe. We're using the most stable - A COMMOTION outside. Someone SCREAMS.
NO!	Lucky turns on Will with a growl, lurching toward him and â¢ BAM! BAM! BAM! Security Guard #1 SHOOTS LUCKY IN THE BACK. Will watches as the chimp - and all of Will's dreams - He spots Jacobs, who looks wrecked. He hurries over to him.
WILL	Are they gone?
JACOBS	Long gone. Will knows the answer, but has to ask anyway.
WILL	Did they say anything before they left? I mean, about Phase 2.
JACOBS	Look around you, for Christ sakes. We'll be lucky if we don't go to jail. Will's gutted - devastated.
WILL	But we're so close.
JACOBS	You think you're the only one who's got something at stake here? I've got my own skin in this game!
WILL	with the 112. Take an already aggressive animal, make it smarter - you're going to get a potentially dangerous
JACOBS	What makes you so damned positive about that? What if this drug does things you don't understand? Are you going to take responsibility for that? Because I'm sure as hell not going to. Here Will hesitates.
JACOBS (CONT'D)	We're not ready for human trials. Hell, we weren't ready for monkey trials.
WILL	They're apes.
JACOBS	This is what we're going to do: You're taking a sabbatical. I'll let the board handle the lawsuit. When this blows over I'll bring you back and we'll start over - we'll do it right this time. With mice. Tiny mice that can't hurt anybody. Will finds to his dismay that he's got nothing to say. His work - destroyed.
Â¢ FRANKLIN	Show you something, boss?
WILL	I don't work here anymore, Franklin.
FRANKLIN	I just put down fifteen animals, Dr. Rodman. The least you could do is give me a moment of your time. Will's shoulders sag with exhaustion. It's been a long,
WILL	of course. It's a creepy, horrible scene.
FRANKLIN	They're all gone.
WILL	I'm sorry, Franklin. Genuinely sorry... What's he got to do to get the hell out of there?
CHIMPANZEE.	Will stares at it for a long moment, his brain overloaded.
WILL (CONT'D)	It's impossible. How could a full- term gestation go unnoticed?
FRANKLIN	They carry small. Must have been pregnant when they brought her in. Will tries to get his mind around the situation.
WILL	Who else knows about this?
FRANKLIN	No one. I'd bring him home, but my brother- in-law works for security. He'd rat me out in a second. That's when will realizes.
WILL	You want me to take him?
FRANKLIN	He's an orphan now.
WILL	I could be thrown in jail. He's a chimpanzee who's been exposed to a possibly dangerous drug.
FRANKLIN	You don't believe that.
WILL	Doesn't matter what I believe.
FRANKLIN	Just for a couple days. Until I can find a sanctuary.
WILL	That's not possible.
FRANKLIN	I heard you outside, fighting to keep them alive.
WILL	I was talking about the work, my
FRANKLIN	she was just trying to protect him.
WILL	What?
FRANKLIN	Bright Eyes - the mother. That's why she wouldn't let anyone into her cage. Will looks down at the helpless baby.
WILL	I'm sorry, Franklin - I'm sorry - but there's nothing I can do here. He's got to be put down like the others.
FRANKLIN	Tell you what, Doc. I'm done for the day. So you be my guest. Franklin hands the LONG NEEDLE to Will. Will readies the needle, brings it close to the chimp's
WILL	Two days. Then you have to figure it out. Will moves down the aisle in a daze, the baby chimp - covered He stops at the powdered formulas, overwhelmed by the array
TEEN CASHIER	Hey man. Congratulations.
WILL	Huh? Oh. Thanks.
IRENA	It's Friday night. I had a date.
WILL	I'm sorry - there was - She doesn't wait to hear his excuse, just moves down the Then Will REACHES INTO HIS JACKET POCKET AND TAKES OUT THE Will stares down at the little creature, trying to decide
WILL	It's okay. It's going to be okay. Awkwardly, he even rocks back and forth a little bit. A LARGE MALE CHIMPANZEE IN THE WILD. He stands at the top of Abruptly he closes it. Looks down at the infant, so peaceful SOUND of a TOILET FLUSH. There's a HONK below, and the chimp watches as a TAXI pulls HUNSIKER - A MAN in an AIRLINE PILOT uniform - kisses his Alice clutches a doll in her hand as she watches her daddy's The chimp watches, riveted, as the Alice BURSTS INTO OUTRAGED
WILL (O.S.)	Caesar! Breakfast! The chimp turns at Will's call. HIS NAME IS CAESAR. AGES 12 and up. 12 and up. Caesar runs past, jumps onto d chair at the kitchen table,
WILL	Please pass the ketchup. Caesar slides the ketchup to Will.
WILL (CONT'D)	Thanks.
CAESAR	You're welcome. NOTE: Whenever Caesar communicates he's signing and there
LAB TECH	Is he going to turn left or right...? The mouse turns left at the cone - and finds his way to a
WILL	There it is. Restored cognitive function.
LAB TECH	Same success rate as the primates. Congratulations.
Â¢ STEWART	He's right on target. Height. Weight... She checks Caesar's ears.
CAESAR	Dairy Queen.
WILL	After. Sit still.
STEWART	What about diet?
WILL	A healthy diet. Fruits, vegetables.
CAESAR	Ice cream. Will ignores him.
STEWART	What's he saying?
WILL	He's hungry. Caesar's angling to climb off the examining table. Will
STEWART	He seems extremely intelligent. How many words does Caesar sign? Beat.
WILL	You know, the basics.
CAESAR	Soft-serve.
STEWART	I've heard of apes learning up to a hundred and fifty words. Is he good with puzzles? Will hesitates.
WILL	He's pretty good.
STEWART	Well, Caesar's healthy, obviously happy. You're doing a great job with him. But there is an anomaly I noticed.
WILL	Like what?
STEWART	When I was examining his eyes, I noticed a strange green pigmentation.
WILL	Green? His heart starts to pound.
STEWART	Green. Never.seen it before. She hands Will an OTOSCOPE.
STEWART (CONT'D)	Take a look. Will peers through the magnification - and sure enough, finds
STEWART (CONT'D)	It's faint, can you pick it up? He sits down in the nearest chair - stunned. She eyes him.
STEWART (CONT'D)	You alright? Want a glass of water?
WILL	No thanks. Sure, that would be good. She gets him one. Concerned, Caesar comes over.
WILL (CONT'D)	Forgot to eat today. Not a big deal. Stewart hands him the glass. He downs it. I'm fine. Stewart puts her hand to the side of his neck. Feels good.
STEWART	Carotid pulse is running a little fast.
WILL	For a human or a chimpanzee? First time he's seen her smile. It lights up her face.
STEWART	Gotta remember to eat.
WILL (O.S.)	You have to move the whole tower to another peg, one block at a time.
WILL	Here's the hard part: you can't put a larger block on top of a smaller one. Caesar studies the puzzle.
WILL (CONT'D)	Understand? Caesar's already started. He methodically begins moving Finished, Caesar looks up at him. Will fumbles in his He did it in fifteen moves.
IRENA	What's the best score?
WILL	Fifteen. Will looks over at Walter, who's staring at the wall. I wonder where he gets such talent?
WILL	It was passed down from his mother.
WILL	At age two Caesar appears to exceed his mother's aptitude. He signs over three hundred words. He exhibits no visible side effects from the therapy...
WILL	Dad. I've got something that's going to make you better. Will closes the door behind him. WE HEAR A RHYTHMIC Caesar's features are more mature. He appears more like a Caesar pumps his legs, eager to get a better look...
WILL	You want turkey or ham?
VOICE (O.S.)	Ham! The happiness - the relief - is clear on his face. Caesar wriggles the harness around so that he can reach the Caesar spots a BALL lying on the grass. He picks it up and
TODD'S BUDDY	Check it. He wants to play. Thrilled at the contact, Caesar throws the ball to Todd. But
TODD	Monkey in the middle. Todd's Buddy LAUGHS. Caesar LAUGHS too, although he's not
WALTER	Caesar!
WILL	He won't go far.
WALTER	You don't know that.
WILL	I do, Dad.
TODD AND FRIEND	Monkey in the middle, monkey in the middle... Caesar's having fun, unaware that the game has become keep- They're making fun of him. "MONKEY", "MONKEY", "MONKEY"... The chanted words ring in
HUNSIKER	Hah! Hah - Will JUMPS INTO THE YARD AND PUTS HIMSELF BETWEEN HUNSIKER
WILL	Hold on - it's okay - he's harmless!
HUNSIKER	Your monkey came onto my property! Threatened my kids! By now Caesar has climbed into Will's arms, burying his head
WILL	It won't happen again...
HUNSIKER	Damn right it won't happen again! I'll press charges if it does! Will holds Caesar close and hurries home. What does he do for fun? Will's brought Caesar in for a check-up. He's a little
WILL	Well we've got puzzles, games, a swing set...
STEWART	My guess is he needs more. More exercise, more space.
WILL	We'll work on that. Stewart continues examining Caesar. Will watches her listen He gets up his nerve. What about you? What do you do for fun? She opens her eyes, looks at him. He thinks she doesn't
WILL (CONT'D)	How about dinner and a movie? Stewart pulls the stethoscope from her ears.
STEWART	I'm sorry, did you say something? He starts to try again - but the moment's gone.
WILL	No - nothing. Caesar meets Will's eyes, obviously disappointed.
WALTER	Take him off the leash.
Â¢ WILL	There's a place up ahead.
WILL	Don't go far. Stay where I can see you. Will takes OFF CAESAR'S HARNESS. The chimpanzee runs, begins The CHIMP DISAPPEARS around a corner. A moment passes, then Remember - stay where I can see you - if you got lost in these woods I'd never find you.
WALTER	Go ahead. Climb! The men sit down on a log, watching as Caesar swings from the RUSTLING LEAVES whisper Caesar upward. He moves with an easy Will's pointing to his watch. â¢ CLOSE ON A HARNESS. Will has it waiting as Caesar lands Will attaches the harness and they walk together. Caesar's
WILL	Sorry to rush you - got to get home and check on Walter. They approach a WOMAN with a LARGE DOG on a leash - a GREAT Is that a chimpanzee?
WILL	Don't worry - he's harmless. Very sweet. The big dog keeps BARKING. Annoyed, Caesar finally turns and gives him a LARGE, Guess he had it coming. Caesar watches as the Woman walks off with the dog, HIS GAZE THEN HIS EYES MOVE TO HIS OWN LEASH. Is he a pet too?
WILL	Where's Dr. Stewart?
S VETERINARIAN	She doesn't work here anymore. Doesn't work here anymore?
WILL	Do you know where she went?
VETERINARIAN	I'm sorry - I don't. Will's deeply disappointed. They find themselves in front of THE PRIMATE ENCLOSURE. Will looks back and forth between the chimps and Caesar.
WILL	Come on. As Will drags Caesar off, the apes in the enclosure climb One BOY walks with a blonde teenage GIRL, books clutched to One of the younger Kids runs by, bopping the Boy on the head.
LIKE ALPHA'S.	He runs two fingers down the length of it. Then WE SEE that WALTER IS STRUGGLING TO EAT BECAUSE HE'S
WILL	Turn it around, Dad. You're using the wrong end. Walter looks at Will, uncomprehending. With care and compassion, Caesar reaches over and helps the Will watches. Heartbroken. He backs away from the cone. A LAB TECH makes a note. Will and Jacobs stand behind him, Will's obviously discouraged.
WILL	The drug's not staying ahead of the disease.
JACOBS	But we're still making progress, right? Will tries to tamp down the frustration he's sure is written
WILL	Sure. At this pace we'll get to trials by the time Hell freezes over. Jacobs - embarrassed in front of the Tech - pulls him aside.
JACOBS	This isn't graduate school - there's a procedure we have to adhere to.
WILL	It'll take forever. I need to start developing a primate version now. Jacobs looks at Will. He's known him a long time.
JACOBS	How's your father? Haven't seen him in a while.
WILL	This isn't about him.
JACOBS	He's worse, isn't he? Will wants to tell Jacobs the truth - he's tempted to tell He's fine.
WILL	Caesar continues to maintain a high level of cognition. But Walter's disease has caught up to the neurogenesis treatment. Nearly all initial improvement has been erased... Will stops recording. KICKS his desk in frustration.
CAESAR	Who Caesar.
WILL	What do you mean?
CAESAR	Who. With effort, Will pulls himself from his own thoughts and
CAESAR (CONT'D)	Who.
WILL	Caesar is an ape. A chimpanzee.
CAESAR	No "what". "Who". Will is taken aback - beginning to realize the intellectual
WILL	Are you asking about your identity? That's abstract thought, Caesar. Caesar couldn't care less about 'abstract thought.'
CAESAR	Walter Will father. Will Caesar father? Will looks at the chimp - sees the intensity, the pain on his This is where you were born. It's the place where I work.
WILL	I never knew your father, but your mother came to live here. This is where you were born.
CAESAR	Caesar mother?
WILL	She was very very smart. And she passed that onto you through her blood. Caesar strains for a better view. Undoes his seatbelt.
CAESAR	Caesar go. Caesar see. Will locks the car door.
WILL	She's not here anymore. I'm sorry, Caesar - she died. That's when I brought you home to live with me and Walter. Caesar's getting worked up - he wants out of the car.
CAESAR	Caesar mother... Will grows concerned.
WILL	No. This is a bad place for you, Caesar. We're going to go now. As Will pulls away Caesar strains for a last glimpse,
VOICE (O.S.)	Let's see if we can find something for you on the TV... The Aide settles on a news show covering preparations for a
TV REPORTER	The Icarus crew is led by Commander Colonel George Taylor. This is his fifth space mission... Abruptly he turns and heads across the room... and OUT THE He's immediately startled by a SUDDEN HONK, the SOUND of That's when Walter comes into Caesar's view.
HUNSIKER	Look at the front of my car you stupid, stupid old man! You should be locked up! Your son's going to pay for that damage - No time for anybody to react. The chimpanzee BODY SLAMS
WALTER	Caesar... Straddling Hunsiker, teeth bared, Caesar pounds him with his
HUNSIKER	Help! Get him off -
WALTER	Caesar... no... Stop! Walter grabs Caesar by the shoulders, tries to pull him back. Then he grabs one of Hunsiker's hands and BITES OFF THE
HUNSIKER	Aaaaaaaah! Walter struggles to his feet and grabs Caesar again. A PULSE
WALTER	Caesar! Caesar hesitates. Blood dripping down his chin, he looks
WALTER (CONT'D)	Please stop. Hunsiker uses the distraction. He scrabbles to his feet and He races after Hunsiker. WALTER FALLS TO THE GROUND. HIS White with terror, Hunsiker - clutching his bleeding hand to Enjoying the chase, taking his time, Caesar grabs a tree with one giant jump, he makes it to the top of a tree across
HUNSIKER	Please no... Caesar pounds his chest, YELLING in triumph. He looks down at Hunsiker, cringing. All at once CAESAR REALIZES WHAT HE'S DONE.
REPORTER (V.0.)	.chimpanzee named Caesar, terrorizing the quiet family enclave and mauling neighbor Douglas Hunsiker, a pilot for Global Airlines.
REPORTER	The defense claimed the chimp was merely trying to protect its owner from perceived aggression. FOOTAGE OF WILL LEAVING A COURTHOUSE, avoiding News Crews.
REPORTER (CONT'D)	The chimpanzee's distraught owner, Wilson Rodman, has raised the animal since he was an infant. He pleaded to keep Caesar at home, citing the ape's remarkable intelligence. Will and a chimpanzee? Jacobs stares at the TV, dumbfounded.
WILL	We're visiting a place called "The Ranch". They have animals.
CAESAR	Real animals?
WILL	You bet. Apes. Chimpanzees, gorillas, orangutans... Caesar GRUNTS, excited.
WILL (CONT'D)	It'll be good. You'll like it very much. Caesar looks at Will, picking up on something.
CAESAR	Will sad?
WILL	What? No, I'm fine. A HOUSE/OFFICE, a LIVING QUARTERS, a HORSE PADDOCK - all
CAESAR	Where animals? Will sees the PRIMATE CAGES in the distance, next to a GIANT
WILL	Inside, I think...
WILL	You must be Mr. Landon. This is Caesar.
MR. LANDON	Nice to meet you, Caesar. This is Dodge, helps me run the place.
WILL	I've been telling Caesar about the animals you have here. How much fun it is.
MR. LANDON	Yes, we have a big play center where the chimpanzees like to climb. Want to see the play center? Caesar nods. Absolutely. Caesar approaches with will and Mr. Landon.
MR. LANDON	What do you think, Caesar? Want to give it a try? Trying to mask his growing dread, Will removes Caesar's
WILL	Go ahead. He watches Caesar - unsuspecting - move through AN OPEN, GATE-
LOCKING IT.	He braces himself. CAESAR TURNS, FINDS WILL'BELOW. What he reads in Will's eyes Caesar SHRIEKS, speeds down the tree.
WILL	It's okay, Caesar. It's going to be okay... The words are for him as much as Caesar. You're going to live here for a while. This is what the Judge says we have to do. WHAT? Caesar can't believe what he's hearing! He The SHRIEKS of the UNSEEN APES continue, feeding Will's
WILL (CONT'D)	They'll take good care of you here.
DODGE	That's about it for visiting hours. Will shoots him a look of daggers.
MR. LANDON	What Dodge means is, in our experience, longer you drag out the leave-taking, harder it is. On both of you. Caesar WHIMPERS, tries to bend the bars apart. When this
WILL	I'm sorry to trick you this way, but you would never have agreed. I was afraid they'd hurt you if they forced you -
MR. LANDON	He'll be fine. Will gives Caesar a last, long look. The pain in his eyes is WE STAY WITH CAESAR as Will forces himself to walk away.
DODGE	Caesar. Hey. I can get you out. Dodge stands at the end of the atrium, BECKONING.
DODGE (CONT'D)	This way. Caesar follows Dodge to the far end of the play area, then
DODGE	Caesar - over here. Dodge stands at a cage door. Caesar sprints for it, as for
DODGE (CONT'D)	Stupid monkey. Then he begins frantically grabbing at the bars, jumping to Caesar lets out a PRIMAL, BLOOD-CURDLING SCREAM. WE FOLLOW He slowly becomes conscious of a RHYTHMIC SCRAPING NOISE, He shoves a PLASTIC 'PLAY REFRIGERATOR' across the cage He repeats this movement over and over - all the time with a
DODGE (O.S.)	Okay, assholes. Dinner time. Rocket - slowly and deliberately, with a last threatening Caesar crawls to the edge of his cage and peers out. The APES enthusiastically receive the food. Dodge shovels
DODGE (CONT'D)	Mmmm mmm. Grade A primate chow. Bet you don't get none of that in the suburbs. Caesar reaches into the disgusting goop and THROWS A HANDFUL
DODGE (CONT'D)	Think that's funny? That funny to you, you hairy prick? Caesar stares at Dodge... then SHOOTS HIM THE FINGER.
RODNEY	Look at that! Infuriated, Dodge grabs a hose, drags it to Caesar's cage.
DODGE	One thing you can count on: Long as there are humans on this earth, you'll always be a monkey in a cage. The BURST from the HOSE sends Caesar flying backwards. The water BLAST is relentless. Eventually, Dodge turns the water off. The two men take a
RODNEY	What about his clothes? Might cause problems with the other apes.
DODGE	Leave 'em.
WALTER (O.S.)	John? Walter enters, looks at Will. John - where's Caesar? The old man looks stricken.
WALTER (CONT'D)	Shouldn't we look for him? Isn't there something we can do? Will looks up at his father. He's just had an idea. Will spots Jacobs,'lunching with his Blackberry, in a corner.
JACOBS	You've been gone a week.
WILL	I was sick.
