CHARACTER	DIALOGUE
KAYLEE	You shouldn't aughta be so clean. It's a dead giveaway you don't belong, you always gotta be tidy. Don't pay anybody in advance. And don't ride in anything with a Capissen 38 engine, they fall right out of the sky.
SIMON	Kaylee. She turns and heads off. Simon starts in the other River... do you want to stay with them?
4 RIVER	It's not safe.
SIMON	No, I fear it's not safe anymore. He's heading off and doesn't hear:
RIVER	For them.
NEWSPERSON (V.O.)	that it was a band of Reavers remains unconfirmed. The only survivors of the massacre apparently locked themselves in the Trade Station vault until -- During this we come around to see that the screen has a We pick up Mal and Kaylee heading down into the bar. Cutting
MAL	It's not my fault the Doc's got no stomach for Rim living --
KAYLEE	It is entirely and for all your fault! If you'd given Simon a moment, just a moment where he didn't think you were gonna throw them off or turn them in, he might've --
MAL	What? Swept you into his cleanly arms? Made tidy love to you? They have reached the guncheck, where Jayne and Wash have
KAYLEE	Don't you dare joke! You know how much I pined on Simon. And him fair sweet on me, I well believe, but he's so worried about being found out --
ZOE	Captain didn't make 'em fugitives.
KAYLEE	But he coulda made 'em family! Steada driving them off. Steada keeping Simon from seein' I was there, when I carried such a torch and we coulda -- goin' on a year now I ain't had nothin' twixt my nethers weren't run on batteries!
MAL	Oh god! I can't know that!
JAYNE	40 I could stand to hear a little more...
KAYLEE	If you had a care for anybody's heart you woulda -- You knew he was gonna leave. We never been but a way station to those two. And how do you know what he feels? He's got River to worry on but he still coulda shown you... if I truly wanted someone bad enough, wouldn't be a thing in the 'verse could stop me from going to her.
KAYLEE	Tell that to Inara. For a moment, Mal is too shocked to react. Kaylee storms out.
MINGO	4 Domestic troubles? MINGO is young, tough -- somewhere between a gangster and a
FANTY	Domestic troubles? FANTY moves out from behind Mingo to reveal that he is
MINGO	'Cause we don't wanna interrupt.
FANTY	A man should keep his house in order.
MAL	Mingo. Fanty.
MINGO	He's Mingo. ,do
MAL	He's Fanty. You're Mingo.
MINGO	Ghahh! How is it you always know?
MAL	Fanty's prettier. Feel to do some business?
MINGO	Bit crowded, isn't it? As you see, we come unencumbered by thugs.
MAL	Which means at least four of the guys already in here are yours. All's one. I'll just keep Jayne with me.
ZOE	Sir, are you sure you don't --
MAL	Go. Go get yourselves a nice romantic meal.
WASH	Those are my two favorite words! Honey... "Meal..."
MAL	It's business. We're fine. They leave and the four remaining men sit. Fanty tosses a Mal's foot nudges a duffel bag of money to Mingo's foot.
MINGO	Quite a crew you've got.
MAL	Yeah, they're a fine bunch of ruebens.
MINGO	How you keep them on that crap boat is the subject of much musing tween me and Fanty.
FANTY	We go on and on.
MAL	So I'm noticing. Is there a problem I don't know of? You got 25% of a sweet take kissing your foot, how come we're not dispersing?
FANTY	Our end is forty, precious.
JAYNE	My muscular buttocks it's forty --
MINGO	It is as of now. Find anyone around going cheaper.
J FANTY	Find anyone around going near a sorry lot like you in the first instance. ANGLE: RIVER has entered, is looking about. You're unlikable, Mal. You got no respect for us above you, you got enemies in every quadrant, and your ship's older than the starting point of time. You's charity cases to such as us.
MAL	Well here's a foul thought. I conjured you two were incompetent; sent us out not knowing there were V0 Reavers about. Now I'm thinking you picked us out because you did.
MINGO	That were a sign of faith, boy. And it doesn't affect our forty per. Danger is, after all, your business.
JAYNE	Reavers ain't business, double dickless. This is all background noise to River, who has moved to the We push in, the light from the CV on River's face, pushing to
RIVER	Miranda. She turns and looks back at the crowd. What happens next happens very fast. She strides silently to the first table -- two men drinking
MAL	River...
JAYNE	V0 Whuhuh? She's taking out a group of four, high kicks and perfect She's everywhere. On tables, chairs, under your legs, using Gorrammit, girl, it's me! She grabs his crotch and squeezes -- his grip loosens and she
SIMON	Eta Kooram Nah Smech! And River drops to the ground, fast asleep.
MAL	I think maybe we ought to leave. Hello again. Yes, it's me. I'm glad you've finally asked for me. An Ensign is revealed looking at a separate monitor:
ENSIGN	We got a pos on a retinal -- man carrying her out is Malcolm Reynolds, captains a Firefly-class transport ship, "Serenity". Bound by law five times, smuggling, tariff dodge... not convicted. Nothing here that would --
THE OPERATIVE	The ship. The name of the ship.
10 (SOFTLY)	Crossref. Malcolm Reynolds. Serenity. He looks over at the Ensign with a small, strange smile on
ENSIGN	Sir?
THE OPERATIVE	Serenity Valley. Bloodiest battle of the entire war. The Independents held the valley for seven weeks, two of them after their high command had surrendered. 68% casualty rate.
ENSIGN	Of course, Sir, I just didn't --
THE OPERATIVE	There. His glasses stop scrolling and Mal's military file opens, a If the feds ever bothered to crossref justice files with war records... Yes. Our Mr. Reynolds was a sergeant, 57th Overlanders. Volunteer. Fought at Serenity till the very last. This man is an issue. This man hates us.
ENSIGN	First Mate Zoe Washburn, formerly Corporal Zoe Alleyne, also in the 57th. Career army, looks like.
THE OPERATIVE	She's followed him far... Give me the crew, registered passengers -- Our Captain is a passionate man, no room there for subtlety. He's bound to have some very obvious... CLOSE ON: THE LENS of his glasses. On it is a slowly moving
THE OPERATIVE	.weakness... Mal stares at her a moment, then:
SIMON	May I see her?
MAL	She's still napping just now. And I believe you've got some storytelling to do. We're out of atmo, plotted for Haven. No one following as of yet.
KAYLEE	Haven? We're gonna see Shepherd Book? We got to lay low. And I could fair use some spiritual guidance right about now. I am a lost lamb; what in hell happened back there?
WASH	Start with the part where Jayne gets knocked out by a ninety pound girl. 'Cause I don't think that's ever getting old.
ZOE	Do we know if anyone was killed?
MAL	It's likely. I know she meant to Ad kill me 'fore the Doc put her to sleep, which how exactly does that work anyhow?
SIMON	Safeword. The people who helped me break River out -- they had intel that River and the other subjects were being embedded with behavioral conditioning. They taught me a safeword, in case... something happened.
KAYLEE	Not sure I get it.
SIMON	A phrase that's encoded in her brain, that makes her fall asleep. If I speak the words, "Eta --
JAYNE	Well don't say it! moo ZOE It only works on her, Jayne.
JAYNE	Oh. Well, now I know that.
MAL	"In case something happened."
SIMON	What?
MAL	You feel to elaborate on what that something might be? I mean they taught you that fancy safeword, they must've figured she was gonna, what -- start uncontrollably crocheting?
SIMON	They never said what --
MAL	And you never did ask. Mal grabs him and throws him against the wall, in his face. Eight months. Eight months you had her on my boat knowing full well she might go monkeyshit at the wrong word and you never said a thing --
SIMON	I brought her out here so they couldn't get to her, I don't even know how they --
MAL	My ship. My crewi You had a gorramn timebomb living with us!
MAL	What if she went off in the middle woo of dinner, or in bunk with Kaylee, did that give you a moment's pause? Simon looks at Kaylee, the truth of Mal's words hitting him.
SIMON	I thought she was getting better.
JAYNE	And I thought they was gettin' off! Didn't we have a intricate plan how they was gonna be not here anymore?
KAYLEE	We couldn't leave them now...
JAYNE	No, now that she's a... killer woman we ought be bringin' 'em tea and dumplings! In earnest, Mal: why'd you bring her back on? Mal looks at Jayne, at all of them. Doesn't have an answer.
SIMON	May I see her. Mal steps aside. Simon enters the locker.
JAYNE	She goes woolly again, we're gonna have to put a bullet to her. It's crossed my mind.
WASH	Can I make a suggestion that doesn't involve violence, or is this the wrong crowd?
ZOE	Honey...
WASH	V0 Fanty and Mingo might be coming hard down on us, or the laws... or maybe nobody could be bunged about a little social brawl. We need to get our bearings. I think we need to talk to Mr. Universe. As he watches the security feed of River's fight his image
MR UNIVERSE	Oh, this is good. This is... .she's beating up all the burly men and I'm having a catharsis, it's happening right now, you guys always bring me the very best violence. You think you're in a hot place?
WASH	That's what we're looking to learn. Is there any follow up, a newswave...
MR UNIVERSE	There is no "news", there's the truth of the signal, what I see, and there's the puppet theatre the V0 Parliament's jesters foist on the somnambulant public. Monkey taught to say the word "monkey" -- lead story on 32 planets. But the slum riots on Hera, not a --
MAL	What about this? Did this make the... puppet theatre?
MR UNIVERSE	No sir. And no lawforce flags, either -- I hadda go into the security feed direct...
MAL	You can do that?
MR UNIVERSE	Can't stop the signal, Mal. Everything goes somewhere and I go everywhere. Security feeds are a traipse to access -- and I wasn't the first one in, this has prints on it -- oh! Look at her go! A0 Everyone is getting bruises and contusions. Contoooosions.
ZOE	So somebody else has been fed this. That doesn't like me too well.
MR UNIVERSE	Zoe, you sultry minx, stop falling in love with me. You're just gonna embarrass yourself. I have a commitment to my Lovebot, it was a very beautiful ceremony, Lenore wrote her own vows, I cried like a baby, a hungry, angry baby. And she falls asleep. Which, she would be sleepy.
MAL	Can you go back? See if anybody spoke with her 'fore she acted up, -40 made any kind of contact with her... Mr Universe works the screen. The image rewinds and stops on Miranda...? Go back further.
MR UNIVERSE	No.. He pulls another screen close, starts working that one.
MAL	Um... please? Mr Universe has a third screen showing the commercial as well -- and it starts breaking down, bursts of
MR UNIVERSE	Friends and potential lovers, I
4DO	have good news and I have the other kind. Good is you're very smart. Someone is talking to her.
WASH	The oaty bar?
MAL	Subliminal. It's a subliminal message broadwaved to trigger her. I been seeing this code pop up all over, last few weeks. And I cannot crack it. It's Alliance and it's high military, so here then is the bad. Someone has gone to enormous trouble to find your little friend. And found her they have. Mal, Zoe and Wash look at each other. Do you all know what it is you're carrying?
RIVER	They're afraid of me.
SIMON	I'm sorry...
RIVER	They should be. What I will show them... Oh God... She starts tearing up, breathing faster... Simon runs his
SIMON	It's okay, it's okay...
RIVER	Show me off like a dog, old men covered in blood, it never touched them but they're drowning in it... so much loss... I don't know what I'm saying. I never know what I'm saying...
SIMON	You said something. When you were triggered, do you remember? The Captain saw you say something on the feed...
RIVER	Miranda.
SIMON	Miranda.
RIVER	Ask her. She'll show you all.
SIMON	Show us what? Who is Miranda? Am I... talking to Miranda now? Nw� She shoots him a look.
RIVER	I'm not a multiple, dumbo.
SIMON	No. Right. But I think somehow when they triggered you it brought this up, this memory --
RIVER	It isn't mine. The memory. I didn't bring it and I shouldn't have to carry it, it isn't mine. Don't make me sleep again.
SIMON	I won't.
RIVER	Put a bullet to me. Bullet in the brain pan, squish.
SIMON	Don't say that. Not ever. We'll get through this. She reaches out and touches his face, affectionately.
RIVER	Things are going to get much much worse.
SIMON	Well, the Captain hasn't tossed us in the airlock, so I'd say we're --
RIVER	He has to see. More than anyone... he has to see what he doesn't want to.
SIMON	River. What will Miranda show us. She thinks.
RIVER	Death.
SIMON	Whose death? And she starts laughing. Quietly at first, then louder, then Black Silence.
BOOK (O.S.)	Lord, I am walking your way. ANGLE: THE RAMP lowers to reveal Shepherd BOOK, a working- Let me in, for my feet are sore, my clothes are ragged.
BOOK (O.S. )	Look in my eyes, Lord, and my sins will play out on them as on a screen. Read them all.
BOOK	Forgive what you can, and send me on my path. I will walk on, until you bid me rest.
MAL	Hope that ain't for me, Shepherd.
BOOK	It's prayer for the dead.
MAL	Then I really hope it ain't for me.
BOOK	It's for the men River might have killed in that bar.
MAL	Weren't River that did it, you know that. Somebody decided her brain was just another piece of property to take, fenced it right Vd up.
BOOK	You got a plan?
MAL	Hiding ain't a plan?
BOOK	It'll do you for a spell, and the folks here'll be glad of the extra coin...
MAL	.but they'll be coming. Alliance is after this girl with a powerful will. I look to hear the tromp of their boots any moment.
BOOK	You won't. This isn't a palms-up military MW run, Mal. No reports broadwaved, no warrants... much as they want her, they want her hid. That means Closed File. Means an Operative, which is trouble you've not known.
MAL	I coulda left her there. I had an out -- hell, I had every reason in the 'verse to leave her lay and haul anchor.
BOOK	Not your way, Mal.
V0 MAL	I have a way? Is that better than a plan?
BOOK	You can play the thug all you want, but there's more to you than you're ever like to 'fess.
MAL	You just think that 'cause my eyes is all sorrowful and pretty.
BOOK	Only one thing is gonna walk you through this, Mal. Belief.
MAL	Sermons make me sleepy, Shepherd. I ain't looking for help from on high. That's a long wait for a train don't come.
BOOK	When I talk about belief, why do you always assume I'm talking about God? They'll come at you sideways. As he continues, we see: The operative comes slowly up the staircase, stands before
BOOK W. (V.0.)	It's how they think: sideways. It's how they move. Sidle up and smile, hit you where you're weak.
BOOK	Sorta man they're like to send believes hard. Kills and never asks why.
MAL	It's of interest to me how much you seem to know about that world.
BOOK	I wasn't born a Shepherd, Mal.
MAL	Have to tell me about that some time.
BOOK	No I don't. He walks away, offering this: Sideways. Mal watches him go, thinking.
TEACHER	River? Eight-year-old River is working away, not paying attention. River, you look tired. I think everybody's a little tired by now; why don't we all lie down. River looks up, scared. All the other children wordlessly A little peace and quiet will make everything better. She starts to lie down herself, right on the grass.
RIVER	No... River. Do as you're told. It's going to be fine. Lie down.
MAL	Whuh huh nuhwhat?
WASH (0.S.)	Mal! You up? Got a wave. I'm a bounce it down to you. He pops up, turns to the screen as the white noise becomes:
MAL	Inara. REVERSE ON: Inara on Mal's screen. We see her from about Mal. I uh, is this a bad time
MAL	Good as any.
INARA	Please tell me you're wearing pants.
MAL	Naked as the day I come cryin'. How's your world?
INARA	Cold. It's autumn here.
MAL	Still at the Training House?
INARA	Right where you left me.
MAL	I remember it as nice enough. picturesque.
INARA	It is that. What about you? Still flying. So what occasi the wave? Not that to see you ain't... well you look very
watching both Mal and Inara on two	Zoe and Wash are secretly at their formal shyness. Jayne enters, wondering what's up...
INARA	Oh. Thank you, I... I guess we have something of a problem here. With the locals, I thought maybe...
MAL	You could use a gun hand?
INARA	I'm hoping not. But if you were close at all, you -- the crew -- could take your ease here a while... and there'd be payment...
MAL	Payment is never not a factor. I could sound out the crew... This pot like to boil over soon?
INARA	Soon. Not right away.
MAL	Well, it would be, I mean I would like to... Kaylee's been missing you something fierce --
KAYLEE	Oh they're so pathetic! I miss her too. I even miss my shuttle, occasionally.
MAL	Yeah, you left a... got some of your stuff in a trunk, never did get a chance to drop it off.
INARA	Oh.
MAL	I didn't look through the... stuff... just sundries I expect. Inara smiles blandly, nods. An awkward beat. Well, it's kind of late where I'm at. I'll send a wave as soon as I can.
INARA	Thank you. She disappears. Mal thinks a moment.
WASH	Inara. Nice to see her again.
ZOE	So, trap?
MAL	Trap.
ZOE	We goin' in? moo MAL It ain't but a few hours out...
WASH	Yeah, but, remember the part where it's a trap?
MAL	If that's the case, then Inara's already caught in it. She wouldn't set us up willing. Might be we got a shot at seeing who's turning these wheels. We go in.
KAYLEE	How can you be sure Inara don't just wanna see you? Sometimes people have feelings -- I'm referring here to people...
MAL	Y'all were watching, I take it. Guilty glances.
KAYLEE	Yes.
MAL	140 You see us fight?
KAYLEE	No.
MAL	Trap.
WASH	We're about seventy miles from the Training house. And nobody on radar... if the Alliance is about, they're laying low.
MAL	They're about. Find us a home. I'll take the shuttle in closer. Zoe, ship is yours. 4dO He starts out, turns back to Zoe. Remember: if anything happens to me, or you don't hear from me within the hour... you take this ship and you come and rescue me.
ZOE	What? And risk my ship? I mean it. It's cold out there. I don't wanna get left. The room is sparsely lush -- not as opulent as the shuttle
MAL	Dear Buddha, please send me a pony, and a plastic rocket, and --
I NAR.A	Mal! What are you doing here?
MAL	You invited me.
INARA	I never thought for a second you'd be stupid enough to come!
MAL	Well that makes you kind of a tease, doesn't it?
INARA	You knew my invitation wasn't on the level --
MAL	Which led me to the conclusion that you must be in some trouble.
INARA	I'm fine! I'm. giddy.
MAL	For a woman schooled in telling men what they wanna hear, you ain't much of a liar.
INARA	Mal, you cannot handle this man. I have to say, I'm impressed that you would come for her yourself. lw� And that you would make it this far in that outfit. I can be very graceful when I need to.
THE OPERATIVE	I've no doubt. Mal sheds his shawl and robe. Inara kneels at the alter,
MAL	What are you doing?
INARA	I'm praying for you, Mal.
THE OPERATIVE	That's very thoughtful. But I mean it when I say you're not in any danger.
MAL	Speak your piece.
THE OPERATIVE	I think you're beginning to understand how dangerous River Tam is.
MAL	She is a mite unpredictable. Mood swings, of a sort.
THE OPERATIVE	It's worse than you know.
MAL	It usually is.
THE OPERATIVE	That girl will rain destruction down on you and your ship. She's an albatross, Captain.
MAL	Way I remember it, albatross was a ship's good luck... til some idiot killed it. Yes, I've read a poem. Try not to faint. The Operative moves further into the room. Whenever he
THE OPERATIVE	I've seen your war record. I know how you must feel about the Alliance.
MAL	You really don't.
THE OPERATIVE	Fair to say. But I have to hope you understand you can't beat us.
MAL	I got no need to beat you. I just wanna go my way.
THE OPERATIVE	And you can do that, once you let me take the girl back home. Give me the opportunity to help you.
MAL	All I gotta do is let you take one more thing away from me. I've had a lot of things taken in my time. And it may just be that this is one too many.
THE OPERATIVE	This psychotic, potentially murderous girl who can't have the slightest awareness of your protection. This is where you "draw the line".
MAL	Well I'm a whimsical soul.
THE OPERATIVE	There's a number of lives that hang in the balance here. Lives under your care. Are they as whimsical as yourself?
MAL	I got no notion that I'm being heroical at all. Any more than I think you're really just a harmless bureaucrat come to help me out. You move like a killer. The Operative is stopped by this. Unhappily, he continues:
THE OPERATIVE	I have a warship in deep orbit, Captain. We locked on to Serenity's pulse beacon the moment you hit atmo. I can speak a word and send a missile to that exact location inside of three minutes. Mal pulls a small device, clipped wires sticking out all
MAL	You do that, best make peace with your dear and fluffy lord.
THE OPERATIVE	Pulse beacon.
MAL	Advice from an old tracker: you J wanna find someone, use your eyes.
THE OPERATIVE	How long do you think you can really run from us?
MAL	Oh, a jack-rabbit, me. 'Sides, I never credited the Alliance with an over-abundance of brains. And if you're the best they got...
THE OPERATIVE	Captain Reynolds, I should tell you so that you don't waste your time: You can't make me angry.
INARA	Oh please. Spend an hour with him. Mal smiles -- then glares at Inara, mouthing "Hey!"
THE OPERATIVE	I need her, Captain. River is... my purpose and I will gather her to me. The brother as well. Whatever else happens is incidental. In the greater scheme.
MAL	Why is it that the greater scheme always makes everything not that great?
THE OPERATIVE	I want to resolve this like civilized men. I'm not threatening you. I'm unarmed.
MAL	Great! He draws and shoots the Operative in the chest. The
THE OPERATIVE	I am of course wearing full body armor. I'm not a moron. He tosses Mal hard against a wall, spinning and blocking a
MAL	No back up? We're making an awful ruckus...
THE OPERATIVE	They'll come when they're needed.
MAL	I'd start whistling.
THE OPERATIVE	Captain, what do you think is going to happen here? They come at each other. The Operative is the much better Mal is more bluster and determination, and the operative's Mal punches wild -- the Operative counters with a spin-kick The Operative goes to his briefcase by the door, pulls out Nothing here is what it seems.
INARA	I know.
THE OPERATIVE	He's not the plucky hero. The Alliance isn't some evil empire. This isn't the grand arena.
INARA	And that's not incense. He turns to look: the incense stick burns away -- rather like It's a flash-bomb: The Operative sails back as everything
THE OPERATIVE	Just a flash bomb. Go! Go!
MAL	.I had him...
INARA	What?
MAL	I think that I was winning! CLOSE ON: THE GRENADE, as a series of bars of light go out
ALLIANCE SOLDIER	Grenade! Everybody dives for cover. The moment they do, Mal and Inara
INARA	Hang on to something.
MAL	4 You sure you remember how it -- He nearly falls over as:
INARA	I told you to hang on.
MAL (O.S. )	I'm fine... These objects are roughly the size of pony-kegs, and clearly
THE OPERATIVE	Forget the pulse beacon, there has to be another way to track the ship -- get a read on the nav sat. It's a registered transport, you must be able to locate -- Sir?
THE OPERATIVE	Have you found a nav sat trajectory? Sir... we've found seven. The Operative looks more unhappy than angry.
THE OPERATIVE	Does he think this is a game? She looks over to one side of the tent, and we see:
INARA (V.0.)	We have every reason to be afraid.
JAYNE	Why, 'cause this guy beat up Mal? That ain't so hard --
MAL	He didn't beat me up --
INARA	Because he's a believer.
INARA (V.0.)	He's intelligent, methodical and devout in his belief that killing River is the right thing to do.
INARA	I honestly think the only reason we haven't been blown out of the air is that he needs to see her.
SIMON	Needs to see her why?
INARA	I'm uncertain. I would say to be sure of the kill, but... I just know he'll kill us all to get to her.
JAYNE	So no hope of a reward, huh?
ZOE	Did he mention a deal of any kind?
MAL	Give the two of them up. Go my way.
JAYNE	Which you was all ready to do not a day ago. What went sour?
MAL	Cutting them loose ain't the same as handing them over.
JAYNE	That so? 'Cause the corpse I'm about to become is having trouble telling the difference.
SIMON	Did he say anything about a "Miranda"?
INARA	What is that?
MAL	Don't know who or what, but it's on River's mind. Conjure it might be the reason he's after her.
INARA	You think maybe it poses some kind of threat to the Alliance?
WASH	Do we care? Are we caring about that?
JAYNE	You dumbass hogs, the only people she's a threat to is us on this boat!
MAL	Look, we get back to Haven in a 'r/ few hours time --
JAYNE	Hiding under the Shepherd's skirts, that's a manful scheme --
MAL	You wanna run this ship?
JAYNE	Yes!
MAL	Well you can't!
JAYNE	Do a damn sight better job'n you. Getting us lashed over a couple of strays... No offense, Doc, I think it's noble as a grape the way you look to River, but she ain't my sister and she ain't your crew. Oh, and neither is she exactly helpless! So where's it writ we gotta lay down our lives for her, which is what you've steered us toward.
MAL	I didn't start this.
JAYNE	No, the Alliance starts the war -- and then you volunteer. Battle of Serenity, Mal: besides Zoe here, how many -- -- I'm talkin' at you -- how many men in your platoon came out of there alive? Mal stares at him.
ZOE	You wanna leave this room.
JAYNE	You're damn right I do. He stalks upstairs. There's a quiet moment.
INARA	This isn't the war, Mal. Mal turns, eyeing her.
MAL	Are you telling me that because you think I don't know --
INARA	You came to the training house looking for a fight.
MAL	I came looking for you.
INARA	I just want to know who I'm dealing with. I've seen too many versions of you to be sure.
MAL	I start fighting a war I guarantee you'll see something new.
