CHARACTER	DIALOGUE
GENERAL SERPIENTE	The final creature. Camera RISES UP until we reach the rooftop where Leo and Raph They battle. In the end, Raph becomes an uncontrollable ball It ends with Raph pinning Leo to the ground... holding a sai Tense. Raph shakes. He looks like he's going to do it... then Raph RUNS AWAY, across a few rooftops. Away from his brother. CLOSE ON LEO - A SHADOW suddenly falls over him. He looks up GATO POV - "reading" Leo on the ground. He frowns.
GENERAL GATO	It is neither monster nor human. CLOSE ON AGUILA - He manages a small smile.
GENERAL AGUILA	Then he shall perfectly serve our purposes... let us inform our commander that the final creature has been captured. ON RAPH - He sees the commotion from afar... as Leo gets Raph runs closer as the Generals lower to the ground and eo!!! Hang on!! But the Caravan is too fast, and eventually loses Raph. Raph gets weak and collapses to his knees on the roof. The April and Don are poring over books at the kitchen. Mikey
SPLINTER	Raphael? What is the matter? I was out, and did... something... something happened and I- ARRRGH!!! Raphael picks up a HEAVY WEIGHT and hurls is across the dojo.
SPLINTER	Raphael! Kneel. Raph stops. Breathing heavy. Falls in line - walking to
RAPHAEL	I did something... I did something really stupid, Master Splinter.
SPLINTER	Go on... I know why you chose him now. I know that there's a reason why he's the better son and I'm not. And I think I made things worse tonight. A WHOLE lot worse... I know you must be ashamed of me, father. Raphael is lost in his guilt. Splinter kneels in front of
SPLINTER	Raphael. You always bear the world's problems on your shoulders. It is an admirable quality when you are a protector of others... plinter gently lays a hand on Raph's shoulder.
SPLINTER	But you must realize that while, at times, you may not be my favorite student, it does not mean that you are my least favorite son. Raphael looks up. Having not thought of it that way.
SPLINTER	You are strong, passionate and loyal to a fault. These are the merits of a great leader as well... but only when tempered with compassion and humility.
RAPHAEL	But Master Splinter, I messed up big tonight... I mean BIG. Splinter chews on this.
SPLINTER	Leonardo? R
APHAEL	Yes. Splinter is grim. Nods. But he moves on.
SPLINTER	Well then, I believe your brothers may be in need of a leader. Raphael looks up. Finally, his shot. He holds his SAIS in one
RAPHAEL	Thank you... father. Mikey bursts in the door, frantic.
MICHAELANGELO	Dudes. I think you're gonna want to check this out. Where's Leo? Raph and Splinter share a look. Raph has to tell the others. April and Donnie sift through their charts and calculations.
DONATELLO	So, the first time that this portal was opened, the Stars of Kikin aligned... ...and that's why it occurred in that specific South American region. Now if we take into account the continual rotation of the Earth since then, as well as the gradual celestial shift that's happened and been recorded over... well, over the course of that mountain of books over there... we now know our new location. Donnie's drawn a NEW LINE from the alignment of the stars.
APRIL	Precisely at 40.748 degrees latitude and -073.985 Degrees longitude. ON OTHERS - HUH?! Mikey air - calculates math in bg.
DONATELLO	New York City.
APRIL	Winters Tower.
DONATELLO	And the alignment is due to occur in precisely- - well... tonight. It sits in the room. Heavy.
MICHAELANGELO	But without Leo... what do we do? No one answers. Splinter looks to Raph. Raph steps up.
RAPHAEL	New York City. Splinter stands to his side.
SPLINTER	Together. The lobby has changed. Shots establishing the jury-rigged - The large Aztec-like calendar on the lobby floor suddenly The disk in the basement is suddenly RAISED up to the lobby - Finally, Winters' office elevator LOWERS from high above. PUSH IN on one cell, as Leo sits hunched over, unconscious Quick shots of April and Casey gearing up. Casey with his off- They both emerge from their rooms, dressed to kill. Casey's
CASEY	Wow.
APRIL	Picked it up on my last trip to Japan. You... like it?
CASEY	Oh... oh yeah. They share the moment. Seeing what they forgot about each
APRIL	Where's your mask?
M	
CASEY	Mask? What mask? April runs into the other room and comes back with her hands
CASEY	No way...
APRIL	I was saving it for our anniversary. Thanks. Almost awkward as Casey leans forward and is about to kiss
APRIL	That's our ride. nd on Raph in passenger seat and Mikey driving.
RAPHAEL	You know I ain't much on speeches. But we can do this. Leo, or no Leo. Not because of our individual strengths... but because of how we function as a team.
ICHAELANGELO	I love you man.
RAPHAEL	Don't push it. April, this is going to be dangerous. You sure you're in?
APRIL	I feel responsible, fellas. I found the Generals for him.
O	
R	Van in full view.
APHAEL (O.S.)	Nice an' incognito there, Mikey.
MICHAELANGELO (O.S.)	Well, I didn't see you offering any suggestions... besides- - a true ninja can hide in plain sight, my son! I heard that! Van takes off as the CAMERA SLOWS in the street, watching it
BUBBLY WEATHER REPORTER (O.C.)	Scientists are calling it the fiercest storm of the new millennium, with Dopler Radar readings coming in off the charts. Authorities are imposing a curfew to avoid possible civilian harm. Stay tuned for more in minutes. FURTHER DOWN THE STREET - We see Winters Tower and the Winters stands with Four Generals in his office, overseeing Karai walks down the center path of the garden, flanked by a
KARAI	As ordered - no one gets in. No one interferes. No one bears witness. SUDDENLY - the security alarm from the front gate BUZZES. N MONITOR - We see CASEY standing there, obscured by a LARGE
KARAI	May I help you?
CASEY	Yeah, hey, I was supposed to drop this off for Mr. Winters. If I don't get this done, I am majorly in the doghouse. You know what I'm sayin', right? Right? The two stare at each other as the CAM ANGLES BEHIND KARAI -
KARAI	Please come in, then.
CASEY	Really!? I mean, "but of course". Casey wheels the crate inside. The gate closes only KARAI HAS
APHAEL	Let's NEVER do this again. And who did that?!
MICHAELANGELO	What?! Why does everyone always call ME out? A long beat. Then...
SPLINTER	I apologize my sons. Everyone looks at sheepish Splinter. A beat. Suddenly- KARAI makes a dramatic entrance, landing in front of April
CASEY	I suppose this is where we all take out our sharp and pointy things?
KARAI	You suppose correctly.
W	
RAPHAEL	PUSH IN - it's LEO. He's slowly waking up - groggy. Muttering -CLUNK! She wobbles and then passes out. When Karai falls out
APRIL	I had the situation under control. You're welcome. Mikey fights the most like Jackie Chan - comical maneuvers
APRIL	Guys! Front door is open. Now! They all charge the front door! Winters is happy. He looks up to the heavens. Checks a time PACE - The final star drifts into position. A LIGHT BURST POV OFFICE ABOVE - Each of the Thirteen Cells LIGHT UP to
WINTERS	Finally... finally! ON GENERALS - they're still. Emotionless. The light sequence gets to Leo's cell... it doesn't light up.
WINTERS	What? His mind reels. Looks down at the cells. Nothing. Then it
WINTERS	What did you do?!
MICHAELANGELO	What do we do, dudes?!
DONATELLO	I'm working on it. Raph grips his sais with renewed strength. Casey looks
RAPHAEL	We get ready for round two. ON CASEY IN CORNER - He reaches into his back, takes out a The Ninjas are locked out!
RAPHAEL	Yeah! Everyone high fives Casey. Except April. She smiles.
APRIL	Nice work, Jones.
CASEY	I have my moments...
DONATELLO	Look! OFF DON'S LOOK - the mayhem builds at the other end of the
DONATELLO	And that would be the swirling vortex to another world, I assume. Cool. They all run over. Mikey runs to a cell.
MICHAELANGELO	Leo! Is that you? RAARRGH! - A claw swoops out. He dodges out of the way.
MICHAELANGELO	I guess that would be a "no". ON RAPH - He finds Leo!
DONATELLO	Out of the way, please.
D	on places a small EXPLOSIVE on a key lock. Raph pulls Leo
RAPHAEL	Hey buddy! Come on, man. Leo, please wake up! Raph holds Leo in his lap on the floor. Looks like Leo is
LEONARDO (O.S.)	Wh-wh-what took you s-so long? WIDER - Leo is alive. Coughs and slowly gets his strength
RAPHAEL	Listen, I - I'm sorry. ANGLE UP - As WINTERS is thrown out the window of his ..just misses it. WHUMP! He crashes onto the floor. ON GROUP - They just stare at him. Back up to the office, ON BALCONY ABOVE - Aguila looks down. Snarls.
CASEY	Is he... is he dead? Mikey takes out a hockey stick from Casey's bag and pokes
MICHAELANGELO	Yup. He's WAY dead, dude. WINTERS GASPS FOR AIR! Startles everyone in the room. Raph can't take it any more. He draws his sais and thrusts
WINTERS	Fascinating...
SPLINTER	Mister Winters. We mean you no harm.
RAPHAEL	No harm?! Whatever! I'm about to give you piercin's in places you never imagined if you don't tell us what's going on.
O	
WINTERS	We were so close... so close. Winters collapses on the floor. Head in hands.
WINTERS	This was our chance. We could have changed it all.
APRIL	We know everything Max. We know you're trying to recreate what Yaotl started 3000 years ago. N WINTERS - He looks up. Sees April. Exhausted, as we- The same red-tinted battlefield we left in Winter's There are things, Miss O'Neil, no one could possibly know... Camera pushes in on YAOTL and his Four Generals high on a ON YAOTL - He takes off his helmet... IT'S WINTERS HIMSELF.
WINTERS (V.O.)	It was I who stood on that battlefield all those years ago. Winters/Yaotl looks out at the death and destruction. He A SHADOW falls over Winters body. He looks up - it's a
WINTERS (V.O.)	And we had to pay a price. The Shaman makes hand gestures, chanting. Winters is pulled N GENERALS - Same electricity. Different effect. They
WINTERS (V.O.)	We were cursed that day. My four comrades-in-arms were turned into stone.
B	Cursed to live on this Earth... immobile... yet fully aware at all times to ponder the crimes we've committed. ON WINTERS - He stands on the battlefield. Alone. As he
WINTERS (V.O.)	My curse was to live... forever. To feel the pain of losing love time and time again. Of boredom. The pain... of time. ACK IN PRESENT DAY. Winters stops walking...
WINTERS	We were doomed to live this way until, as the Shaman put it, "you corrected the mistakes of your past". That's what this is about. Penance, Miss O'Neil. Finally getting a chance to right our wrongs. Our master fails to include crucial points in his tale. ON SHADOWS - The Four Generals thump forward.
GENERAL AGUILA	He fails to discuss the petrified agony of three thousand years.
GENERAL SERPIENTE	Of the torture of taking CENTURIES to merely blink an eye!
GENERAL GATO	Of watching the erosion of your own body throughout centuries.
GENERAL AGUILA	So, while our great leader basked in the warmth of the sun and the glory of fresh air... we rotted in the stone hell that lasted throughout Wmillennia.
INTERS	My brothers, I-
GENERAL AGUILA	WE ARE NO BROTHERS TO YOU! Our brotherhood was broken the day that you condemned us to this eternity.
GENERAL GATO	And now, our Master has tired of feeding on the nectar of life. Of loving his entire life. Of FEELING. So he prefers to end it all. End HIS "misery" at the expense of ours. Aguila walks to the cells. The portal writhes in the bg,
GENERAL AGUILA	But thanks to his cunning, his technology, we are now capable of LIVING... we have now become- - gods.
GENERAL SERPIENTE	And we shall finish what we began all those years ago. We will finally have our victory.
GENERAL GATO	Even with one monster still free, the curse can never be broken!
GENERAL AGUILA	Join us. Join us Yaotl, and live a life eternal with us at your side! ON WINTERS - He waits. A beat.
WINTERS	Never. This was our opportunity! We were wrong! Don't you understand?! And you are weak.
GENERAL AGUILA	Destroy them. Karai sees Winters' condition. Clearly getting screwed by the What does THAT mean?
KARAI	It means we're going to help you. WIDER - 40 Foot Ninja disperse around out of the building,
KARAI	My soldiers will find the thirteenth monster. And you will bring it back here. Hurry - we don't have much time. Karai runs off. April looks over at Winters. He nods, still
CASEY	I got shotgun! BACK ON GENERALS - They move toward Winters! The Turtles Aguila moves forward to Leo. Raph steps in beside him,
RAPHAEL	If you mess with one of us- -you mess with all of us. Aguila smiles at their chutzpa.
GENERAL AGUILA	Challenge accepted. 97 The Portal worsens behind them. Sound and sight. The Eight 97 ...and the fight BEGINS! The Turtles leap, pounce and strike Suddenly a WALKING STICK across his chest stops him!
SPLINTER	They must face them alone. As brothers. Winters debates it in his head for a beat - WHAM! - a
WINTERS	Alright. We have more important things to do! ON PORTAL - A small DEMON makes its way out of the portal!
WINTERS	Help me push the cells into the portal! Splinter does as the two masters also manage to lay some This has got to be the suckiest vehicle to save the world with. - as the Cowabunga Carl van roars around the corner. Tinkling INSIDE VAN - Casey drives, as April, Karai and Four Foot are
CASEY	So... anybody from out of town? LOBBY - The combatants all pair off for their final battle.
LEONARDO	Come to daddy. MOMENTS LATER - SMASH! - Leo steps out, ready for action. Raph and Aguila duke it out in and around the MONSTER CELLS.
RAPHAEL	Sensei! How you guys doing?! ON SPLINTER AND WINTERS - The portal is pulling the cells in.
SPLINTER	Wonderful, my son. WONDERFUL! BACK WITH APRIL AND CASEY - Rush the streets of NYC.
KARAI	My troops have located the final monster. At the harbor docks.
ASEY	Oh, I got this one covered. Casey GUNS IT for the pier, music tinkling. CAM ZOOMS AHEAD - the 13th monster! Looks like a land-locked GIANT CROCODILE. NSIDE THE VAN - Everyone is in shock. The ninjas look at
ASEY	Huh. Now there's somethin' you don't see every day... They pile out of the van.
CASEY	Well, I guess we have to figure out how to get handsome here back to Winters' Tower.
KARAI	We should tie it to the van and drag it back.
CASEY	Wow. You're... hard core. ON CREATURE - A Foot Ninja stands next to the lifeless body.
CASEY	Incoming! ON VAN - As they open the doors to act as shields as - THUNKA Casey guns it, the 12-foot creature mere inches away! BACK IN LOBBY - CRANE DOWN on Winters and Splinter. On the ON PORTAL - A pair of LARGE EYES are threatening to come out.
LEONARDO	They better hurry with that last monster!
RAPHAEL	I'm sure my man Casey's got it all under control...
LEONARDO	That's what I'm afraid of. BACK WITH VAN - CLOSE ON CASEY'S FACE - As he's screaming his WIDER - We see that he's on top of the Van, acting as LIVE
APRIL	What are you doing in here?!
CASEY	Ran outta food. They all look out the back window as the creature pounds BACK IN LOBBY - The Turtles and Generals are at a standstill.
APHAEL	Listen. I'm the last guy to sound like a TV cartoon, but I think we need to work together.
MICHAELANGELO	Teamwork. The more you know... Don clocks Mikey behind the head. Why Raph, no solo act tonight? Raph grins. They stand, backs to back... finally as a TEAM. ON TMNT - The music swells. The brothers act and think as
SPLINTER	Yes. Yes, my sons. The Generals can't keep up. It's enough to distract them to The brothers look at each other. The place is violent with a
RAPHAEL	So who wants ta call it a day?
LEONARDO	I'm in.
DONATELLO	Affirmative.
MICHAELANGELO	Roger dodger, dude. The TMNT launch into their FINAL ATTACK - perfectly in synch The Turtles collapse onto the floor, back to the portal.
SPLINTER	My sons, I am so proud of you all. Then - BOOM! - the Generals' ARMS slam onto the ridge of the
GENERAL AGUILA	Silly children. We are immortals made of stone! The Earth has only BEGUN to feel our wrath! The brothers are screwed. They can't stop the Generals. Until- he Creature tries to stop, but can't on the marble floor. It Winters dives in and pushes the Turtles out of way as the ON STARS - The Stars move out of alignment, ending the cycle. Aguila tries to fight his way out of the portal. WHAM! - Raph and Leo team-roundhouse him back into oblivion!
RAPHAEL	I thought he'd never shut up. WIDER - The portal EXPLODES in a upwards funnel. Silence.
YEAH! WHOOHOO! WE DID IT!	The brothers high five one another. Splinter smiles proud.
CASEY	Oh. I, uh - HUHN! - Casey tosses Karai off of him. April's eye cocks.
APRIL	Don't try to tell me for one second that you didn't enjoy tha- Casey just grabs her, cutting her off and they kiss. Like Raph and Leo look at each other. A beat. Then hug. Brothers Splinter walks over to them. CAM ADJUSTS to show Karai and
KARAI	You are every bit the warriors I was informed you were. You have passed. ON TMNT - they're confused.
LEONARDO	Passed what?
RAPHAEL	You know us?
KARAI	I've known OF you for some time. Savor your victory tonight. For soon we will have further business together.
SPLINTER	What kind of business?
KARAI	The kind that involves familiar faces from your past... ON TURTLES - They all look at each other.
RAPHAEL	She doesn't mean... They look back - and see Karai and the Foot have DISAPPEARED.
RAPHAEL	Winters? ON WINTERS - Looks like he's sobbing. They get concerned. own BLOOD from a cut on his cheek.
ICHAELANGELO	I'm never usually that happy to be bleeding.
DONATELLO	You would be if you were an immortal who couldn't bleed for three thousand years... Winters looks at all the Turtles.
WINTERS	Thank you. Thank you from the bottom of my heart. You've made a very old man, very very happy.
MICHAELANGELO	So, um, what happens now?
MICHAELANGELO	Okay... just a little bit creepy. Oh gawd. I think he's in my n-n- CAM PULLS BACK, out of the building, onto the street. See the Raph comes to Splinter's room.
APHAEL	You wanted to see me Sensei?
SPLINTER	Sit down, Raphael.
RAPHAEL	Thank you, Master Splinter, for your guidance. I can only hope that one day, I will be able to begin the next stage of my training like Leo. Splinter smiles. Reaches into a box and takes out a similar
SPLINTER	That, my son, you already have. Our training works in mysterious ways. But the answer that lies in all our questions... is family. Raph beams as he accepts the "badge". He excitedly stands up. A ROCKIN' NUMBER PLAYS as we cap everyone's adventures.
L	
PLINTER	Ahh. Double chocolate fudge.
RAPHAEL	So we're cool with the whole Nightwatcher thing?
LEONARDO	Yeah, we're cool. Our secret, bro. You got rid of the stuff, right? QUICK SHOT - Nightwatcher's gear burning in a barrel.
EONARDO	What about the bike, tho?
RAPHAEL	Okay, so I couldn't exactly destroy the bike. Let's just say it's in good hands.
LEONARDO	What do you mean?
RAPHAEL	I mean, it's in good hands.
LEONARDO	Oh, you didn't. Raph sheepishly shrugs as we- As Casey roars down the street on the black motorcycle of He drives past WINTERS TOWER - now being converted to a
APRIL	...yes. She wraps her arms around his waist and holds tight for the CAM FOLLOWS for a beat, then rises up the buildings to- All four turtles are horsing around. They get geared up... The boys run, hoot and holler as they fly high on the
RAPHAEL (V.O.)	So what makes a family? Personally, it's more than sharing a roof or a bathroom. It's sharing life... My father taught me that, and I think it's pretty much true... y'know, provided that you don't kill each other in the process. Or that no one touches your stuff. Or makes loud noises when you're trying to sleep. Or...
RAPHAEL (V.O.)	Hey, nobody said it was easy.
