CHARACTER	DIALOGUE
Mr. Langer, got your table waiting.	Harry and his Girl wend their way around tables, we pass Other
So what does a life of bucking the system	all add up to? for a life of leftovers and Christmas mornings. No his and her IRA accounts, no mini van parked in the garage. I think it's made me what I am today. The luckiest son of a bitch on earth. Look at me. I'm positively debonair. I should be illegal I'm lookin' so good. passes a table where a BEATEN SIXTY YEAR OLD dines with life would be like if I was a Regular Joe and came in here once a month with a dame my age' for a porterhouse and a side of spinach. I've wondered... really my age. . . nutshell. Not exactly debonair, am I? Awww, man, it's down right sad. Look at me. I look like I'm about to die. God help me. I do not want to die. To all my thugs that be livin' it up, we say, what I do. To all my... Oh! This is it. Make a right. So baby, you're rich... . really... rich. in The Hamptons. great. She's totally brilliant, but she's not your type. things about me. I don't have a type. She's over thirty. looks to Marin, feigning hurt. have a slight reputation for... waits. RINGGG! doesn't look away. Don't look at me like that. Hamptons to let me know you're a wise ass. Hold on. . . It just so happens, my dear, that women of a certain age, don't date me. You ever think of it that way? No, it's always me. You dames are all alike. Hey... Dames... continues singing along with Ja Rule as Harry Vh-huh.. .I'll call back Monday. Who else? Monday... Monday... Say you couldn't find me. Who? I'll call her later. No, I have it. hangs up, doesn't look in Marin's direction to see if' MARIN Make a right, left at the second fence. turns up the CD, getting herself out of whatever just breasts look in this sweater? Yes you have actually.
So it would be too much to mention it	again. . . laughs, softening, as Harry turns down a dirt driveway, to do things that aren't perfect. got her. Harry parks. She looks over at him but he's Yeah, okay, right... both grab their H overnight bags and step out of the car. just the two of us, for two whole days? sets her bag down, walks to Harry, wraps her arms glad we waited? HARRY
I'm incredibly glad we're finally	going to do it. If that's the same as being glad we waited, then baby doll, I'm ecstatic. smiles then kisses him. He's one of those guys that you kiss them. Let's go for a swim, how long will it take you to change? starts UNBUTTONING HER SWEATER as she dances Mom doesn't allow it. front yard and bring men you're dating here to... when I do it.. or where I do it. SLIPS OFF her sweater and DROPS IT ON HARRY'S HEAD. The fabulous living room, perfect for entertaining an intimate group of friends or that special someone. Behind me, the requisite Hampton's deck complete with pool and ocean view. Your pants, please... provocatively UNZIPS her pants and wriggles out of where tonight I will whip you up a culinary feast of Mac and Cheese. HEARS Harry's ZIPPER UNZIP. She turns, her EYES .. O-kay, going quickly now... Master bedroom is that away... arrive in a warmly decorated GUEST BEDROOM. your favorite show, is where the magic happens. Do we like it? Going once, going twice ... takes Marin's hand and pulls her OUT OF FRAME and ONTO auctioneering someone told me if I was nervous to just picture everyone in the audience in their underwear. This sort of gives that a whole new meaning. So put on your bathing suit. I brought some champagne, I'll put it on ice. MARIN bounces off him like a kid and disappears into the lies there alone for a second. Catches his breath. He of them is ERICA, Marin's Mother. The other is Erica's is in her mid-fifties and is a poster girl for growing old. sister, ZOE is in her forties. Zoe's the loose one. She nods to Zoe, gesturing a nearby knife. Zoe grabs the knife. Okay, stay right where you are. We have a knife. HARRY Do you... live here? 911 and you're not gonna move. Zoe, hand me the phone. of your daughter's. that, Harry SHUTS the fridge door. The Women see he's the city and you what, wandered in here,like high on Ecstasy..?. Shit. I dialed 8-1-1. Honestly, if you just... army. She can break you in half. can't believe she just said that -- no truth in it Yes. I have an intruder in my house. 29 Daniels Lane, Sagaponack. invited me here for the weekend. She's in her room right now, changing. You're dating my daughter? HARRY Now who would've thought that would be worse news? that, Marin ENTERS, in a tiny bikini, sees Harry in his I'm sorry. False alarm. Yeah, no, I'm sure. No, he's not a burglar He's dating my daughter. this weekend, you said you had to write.
Totally.. .but....	You gotta admit, sorta funny You thought he was a burglar? In his boxer shorts? don't know the man. . . I'm sorry, it's not really funny. I'm an idiot. I should've told you I was bringing someone out. were coming. Well. Anyway, here we are. Hello. I'm the mother. three Women turn to Harry who now dangles a long Lobster Harry. Harry, my Mom, Erica... my Aunt, Zoe. Harry's sort of a new friend. I think I mentioned him in an e-mail. We just, totally spur of the moment thought we'd get out of the city for a few days. Honey, does Harry have a robe? You know what? Actually, I think I should just take off. Let you gals enjoy your weekend... shoots her Mom a look. Help! here's what we'll do. Zoe and I will leave. We took a great walk on the beach, we'll go into town for lunch. You two stay. Harry, apologize about the near arrest. very... "macho". I don't think I was exactly "macho" HARRY his underwear in my refrigerator I hope I'm half the man you were, Mrs uh... ERICA Yeah. Okay. Whatever... watches. Dying. hit the road. Ladies...sensational meeting you. Doll, call me. dramatic here. What are we four teenagers? We're all sophisticated people. Why can't we all stay, for the weekend? Your mother's got work to do I've got papers to grade. You'll do your thing, whatever that is and if we want to hang together, we'll hang together. If we don't, we don't. There's no reason why any of us should give up this spectacular weekend. I mean, well, I can "handle" it... Women all look to Harry. He looks at Marin. She's hard to AND ZOE can't even look at them. What is she doing with a guy that age? feel Dave was walking out on her. on me? Why do people assume when you break up after twenty years that the guy's the one who wanted out? Just because once we broke up he shtupped everything that moved... Just trying to figure out why such a smart girl is always with the wrong guy.
Mme. Barry, que je puis vous obtenir	aujourd'hui? Girl stands BEHIND THE CHEESE COUNTER in:
Bonjour je veux une partie de votre	pate merveilleux et de votre meilleur fromage absolu de chevre. and Marin shop near by. Harry listens to Erica out of
She started French lessons after she and	my Dad split up. Part of her "Keep Busy, Don't Look Back" program. She's practically fluent now. Marin, au cas ou nous prende un desset ou devrions jefaire quelgue chose? Laissons quelque chose d'achat. Et ce grand gateau de chocolat? Yeah...well. ..I am fluent. Be right back. crosses to the dessert counter. Erica turns back and Erica notices who's next to her at the cheese counter.
Merci madame.	heads down the aisle, passing Harry whose back is to Woops. Sorry. so very badly do not want to actually touch. Erica company among other things... "Drive By" Records??? Is that a joke? What is that? Okay. That's... "interesting"... headed here. . . rap, I mean I do. It's sort of violent and crude for my taste, not to mention just a tad misogynistic. poetry. can you rhyme with 'Bitch'? places her groceries on the check out counter. How we doin? HARRY me. happy with it? places a plate in front of Harry then runs her finger 90% hard word, 10% talent and so far the talent part hasn't exactly kicked in yet. and Zoe stop what they are doing and turn to Erica. is a bit of a problem, but so far it's about a divorced woman, a writer, she's this high strung, over-amped, controlling, know it all neurotic. . . Who's incredibly cute and lovable. It's a comedy. the big buyer of the night. conducting the auction and apparently every time I did that she misunderstood and I ended up buying cases of outrageously expensive wine. and Marin laugh. so far... leans back, places his arm around Marin's chair. Erica bachelor? in New York Magazine. that I've escaped the noose for so long. "The Escape Artist"? You were once engaged to somebody big. Who was it? Not Joan Collins.. .Wait. ..Carly Simon? Not Martha Stewart.... MARIN not here.
Harry was once engaged to Diane	Sawyer. Okay? I'm impressed.
Yeah, women your age love that	about me. pauses on that one. You know what I mean. your age'. So when was this engagement? adorable lanky girl from Kentucky with the greatest pair of legs I'd ever seen... Never understood her ending up with a job where she never showed them. ERICA she goes into caves in with a shmahtah on her Who cares about her legs? of... You know what? I to eat and run but... dynamic - what's going at this table... . . women. Look at what we have with you and Erica. Harry, been around the block a few right? You're what? Around never been married, which, we know, if you were a woman, be a curse, you'd be an old a spinster, blah, blah, Okay, so instead of pitying they write articles about you, your never marrying, it you illusive and ungettable. a real catch. Then, take my sister here... look at her, she's so the most successful playwright since who? Lillian She's over fifty, and still sits in night night because the available her age want --forgive me honey for saying this, but they want girls that look like Marin so the whole over fifty dating scene is geared completely towards men leaving older women out and as a result that makes the older women more and more productive and more and more interesting, which, in turn, makes them even less desirable because as we all know -- men, especially older men, are threatened and deathly afraid of interesting and accomplished women. It's just so clear. Single older women, as a demographic, are as fucked a group as can ever exist. and Harry's EYES CONNECT for a millisecond. HEAR THE is cleaning up the broken plates, Zoe leans down to you say those things? injustice of it. Thank God men die younger than us. It's the only break we get. on it, don't announce to the world that I stay in night after night after night and by the way, one night after night would have been enough. Did you ever realize, I stay "in" as part of my job. Why do you think I married the director of my plays? He was the only man I ever saw. Anyway, I like staying in and I like this time in my life. Why do I have to defend myself? I was married for 20 years. I'm done. arin ENTERS carrying more dishes. ZOE He's old, he's chauvinistic... .wrong. incredibly smart and and if you had talked him about something other than marital status you would've out how smart he is. He owns 10 different companies...
does that mean he owns ten	companies? He can't that's what that means. Not God forbid, I want him to you two were very spontaneous and and then said he's leaving as soon the sun comes up.
His car doesn't have	your friend. Not mine. I love I love you more. is obviously a ritual between them. Erica kisses HEAR MUSIC coming from Marin's bedroom. Oy. Marvin Gaye. . . turns on the garbage disposal. Zoe sings along, this weekend. She can't commit either. they hear Marin GIGGLING. YELPS. felt it, right? they hear Marin SCREAM. covers her ears with her hands. Then they hear
We were fooling around and he said he	felt funny Hthen he just collapsed. It's nothing. I'm okay maybe it was the lobster... Call 911...tell them to send an ambulance. . . hesitates. Mouth to mouth... nausea, shortness of breath, blood pressure's 170 over 100, pulse 104, respirations 18... Dr. Mercer. Are you in any pain right now? Nurse wheels over an EKG machine, Julian helps hook it
Feel some pressure in my	chest...it's real tight. clenches his fist over his sternum. the pain? JULIAN Where you having intercourse? Hang a nitroglycerine drip. Mr. Langer the EKG shows you have a blocked artery which is not allowing enough oxygen to get to the heart muscle.. . know what kind of medications you take? I take uh... uh. . . Lipitor. . . Uh-huh... .Any thing else? pressure. . . Marin and Zoe ARRIVE in the DOORWAY of the ER. Harry today? Mr. Langer? Viagra. Women grab looks at each other, know they shouldn't be because I put nitroglycerin into your-drip and if you had taken Viagra, the combo would make your heart leap right out of your body... - HARRY'S EYES - PANICKED Metoprolol 5mg... Let's start the thrombolytic protocol. "4000 units of heparin. Mr. Langer, if this works and I have every reason to believe it will, it's going to reverse what's going on so there will be little or no damage to your heart. You with me? Okay, here we go.
Oh, man, what if he doesn't make	it? I don't know who to contact. out to dinner with the guy three times. I hardly know him. a guy who's so old, he takes Viagra. who's so old he's having a heart attack! happen when he was inside you. That could be life altering. rounds the corner of the corridor. Marin rushes toward Your Grandad's gonna be okay. Oh, thank you so much. But he's not my... oh we're not related. He's just a friend.
Sorry.	sweet apologetic smile is not lost on Marin. Zoe and mild heart attack. I gave him something to break up the clot in his artery and it worked beautifully. immediately which means I don't expect any permanent damage. He's very lucky. Thank you. . . be thanked. Another half hour and I don't know if this would've worked. pats her Mom on the back. This was...intense. wipes away a tear. Nothing could surprise her more. something to sleep, it might make him a little loopy at first but then it should knock him out. You're Mrs. Langer? He was having dinner at our house. I just met him this afternoon. Huge fan. daughter, Marin, my sister, Zoe... Pans to ZOE. Sitting next to Marin. She is also handed is all beginning to feel a little like the Step Sisters You're welcome. May I join you? you.
First year of medical school you	learn what can keep you up all night without making you nuts. Green Tea beats everything plus it's a great antioxidant. Cheers. So, urn, do you always work nights? JULIAN me a chance for a real life during the day. . . You know, I heard you had a place in the Hamptons. I really am a very big fan. I honestly think I've seen every play you've ever written. your time. There are some Marin's never even seen. all and I saw the last one twice. nudges Erica as a Nurse enters from the ER. need stitches. . . I'll check on MI. Langer...if he's asleep; you all might want to get some shut eye and come back in the morning. Great to meet you Erica. Ladies. . . Women wave and watch him exit. second he's gone: Okay, now that's a perfect a guy for you. He's adorable. interested in me. ZOE he's not my type, he's like a gorgeous wholesome doctor but, he's perfect for you and hot for you, which makes him really perfect. It's insane. I would never. Shut. Up. then, Harry stumbles into the corridor in his Hospital Harry.... Harry turns around, a little lost, giving the Women
Harry! Over here!	faces them. call Lowell to pick me up? Lowell? wobbles. Is he going to fall? Marin freezes, looks to compliment... You saved my life. Soft.. . I don't remember your name but I thank you from the bottom of my... Ugh. Look at this, even unconscious, he's a lech. Nurses rush out and peel Harry off Erica. standing. Mr. Langer. turns back to the Women, smiling. He likes that idea. sweetheart. I'd like to see that... he walks away, his bare ass shines like a full moon in a life.
Yeah, but just admit that was one	great ass for a guy that age. looks across at a neat as a pin Man in his early forties, ENTERS the Nurse's station. NURSE Are we discharging Hurricane Harry? Come on, I'll take you to him. EXITS the Nurse's Station. Lowell, carrying the houseman, chef... general valet.. interesting job. arrive at: PRIVATE ROOM to have to let you go. sits up too fast, lies right back down. Lowell looks too fast. Doc, tell them. Am I in good shape? How were my tests this morning? Can I hug him? JULIAN stands and indulges Lowell in a deep hug. Lowell's got no thin , but good news here. considering. You have a little extra baggage under your eyes, but I know how to fix that. See what good hands I'm in. Did you meet my gorgeous assistants? Honey, did you bring the CDs? hands Harry a shopping bag full of CDs. These are for you... The man loves Hip Hop. Maybe not this much but... hands Harry another bag. Harry reaches in and pulls out brilliance the other night. I hope it suits you. Wow. This is.. .Jesus, this is the most gorgeous watch I've ever seen. HARRY He likes it. generous of you but I can't accept it.
You save my life and you end up	with some CDs? here and I do get paid you know - We'll pull up the car. EXITS leaving Marin and Harry alone. Harry sits on
Tell me somethin', we haven't actually	had sex yet, have we? that one. smiles, kisses Harry on the cheek. HARRY Come on, let's get outta here. Okay, now slow-ly. prove her wrong, Harry rises quickly. Everyone stands by, I'm fine. soon as Harry spots Erica, he starts to wobble. grabs for Harry as he FALLS OUT OF FRAME AND THE gun.. .can't let you travel quite yet. a car right now and I can't leave you in the parking lot. I'd like you to stay nearby for a few days and let me keep an eye on you 'til you get your strength back. HARRY Hamptons. Where do you want me to go? turns to Erica who very clearly mouths, "FORGET IT!" NT. THE GUEST BEDROOM - SAME TIME enters, placing the new bouquet on the already flower Just promise me you won't make a decision until we talk. Thinking about it ain't promising me. Okay, man, I'm seein' you Friday... Lowell, what was that? Your lunch. hands Harry the cell phone. Rush? No, man, you're livin' the shit. I just got a clean bill of health. hands Harry a NOTE that says: steals a look at Marin, then nods to Kim. ever had in my life. What kind of mustard is this? I don't know. not Dijon, right? this, of course, would never happen to you. .1 come out here for peace and quiet and suddenly I'm a character in a Kaufman and Hart play. And the phone does not stop. And it's never for me! ENTERS with the Bed Tray. takes the bed tray as Lowell EXITS.
The man does not know my name and	I'm doing his dishes. ENTERS, all 5'10" of her. Dave suddenly looks alive. She LEX have any Tylenol?
Tylenol yes. ..	Hi. I'm Lexi, Harry's second assistant. hands Lexi the Tylenol, she thanks her and EXITS. Where should I put this? It's an empty water glass. What are the choices? I'm gettin' outta your hair. pages? I'm not putting pressure on you, I'm just asking. page twelve and the first eleven pages stink.
So you have one good page.	How tall do you think that girl was? Erica can respond, Marin ENTERS. MARIN city with Zoe but if you're driving back, I'd much rather go with you. Wait wait wait wait. You're leaving, Zoe's leaving, the entourage is leaving. And I'm supposed to stay here with him alone? a Nurse in the morning... now... Okay, I can handle this. I'm just going to get into a zen' place, play music, cook, write, focus... Yes. Maybe that's a good thing. Erica turns to find Harry leaning in the doorway ERICA
Part of my play takes place in Paris so	I'm hoping this helps me think. I'm hopin'...How you feeling? only bumping into two chairs and an ottoman. appreciates the thought. Before it has time to become Hello. Yes, he is. Hello. Hey sweets... Oh, you got the flowers? Are they pretty? can't stand this. She puts on her glasses and skims her bit. What's your number doll? squints, can't see what he's writing...backs his head Okay... Call you in a little. hangs up and hands the glasses back to Erica. of the imagination, I think you're all that right for my daughter but I don't really appreciate hearing you on the phone with other women. It's like I'm an accomplice to you cheating, it's... of my business...but... discussed it. proud of that?
Not proud. Just honest. Your daughter	said she likes that about me. hands her the open wine bottle. ERICA shoots her a look and places the salt shaker back on the throws a piece of paper over the phone so she can't see it. Can you hold a see, doll? Hey. want to play the part of the uptight Nurse to your bad boy patient. If you want to have another heart attack, go ahead, it's your life but I have work to do and I don't have time to make another run to the hospital because you're filling your already clogged arteries with smoke but more importantly, I'd rather not have my house smell like a pool hall. holds out a partially filled water glass for Harry to waits. She doesn't say anything. do I bring this out in you? shakes the water glass, waiting for the deposit. He drops effect on a woman before. And what effect do you think you're having on me? know I've never had it before. rolls her eyes as she finishes cleaning up. life. Want me to shut these, sun comes in pretty strong in the morning. Who you talking to at this hour? HARRY pass? Good night, Harry. What's with the turtlenecks? It's the middle of summer. wear? just a turtleneck kinda gal. Erica's TURTLENECK lands on it. Then her BRA, then her really see anything. Just your tits and a little of your- SLAMS HER DOOR. Photos on the wall shake. not good. hardly looks at You Know Who who appears to be fresh course we need her. She's gonna take care of you and feed you and... pretty perky today. Making quite a recovery. . . Sorry for the trouble Mrs. Gimble... Take care, dear. hands her a wad of bills like she's a Maitre'd. Mrs. I was at the drugstore. Your prescriptions were ready. They said take these two with food and this one without. Yip. There you go. Goin' to work, Harry. You saw my ass, you don't see me acting nuts, wearing hats and glasses and weird get ups... Sound of a DOOR SLAM. - Harry flinches. go? How's Erica treating you? Erica. . . work. The woman wears turtlenecks in the middle of the summer. her fun to be around. noticed that. takes Harry's pulse. I actually saw her naked last night. was asleep, I thought her room was the kitchen. are no accidents. why would she be walking around naked when she knows I'm 20 feet away.
Why would you think her bedroom was	the kitchen? morning. around naked. Deep breath... that age naked before. JULIAN and she's a fantastic writer, you know. So, you date her daughter? after the father. Which reminds me...Doc, what (about Mr. Midnight here. . ? When can I be up and running in that department? put for another couple of weeks. just so you know, I'm told after a heart attack, if you can climb a flight of stairs, you can have sex. ERICA to travel at all? Not even by plane? Train? It's been tough, huh? hour, now says he doesn't need one. He's a bit of a workout.. .yeah. Phone RINGS. Hello. Hey...Oh, hi... No, I'm finally getting to it... sees Julian sliding a slip of paper over to her. Looks Pick you up around seven? JULIAN
Like he said, he doesn't need a	nurse. begin to hear strains of another French song. I'm Walking Around The house! Laughs. Even she knows this is funny. Harry arrives at
Listen, I've decided to get over the	whole "you saw me naked" thing. So, we don't have to deal with it anymore. Okay? you all day. or anything. ENTERS cautiously and curiously. venture out there and go for a short walk... HARRY build up to stairs and stuff like that. You wouldn't want to join me? usually like to break once I've started writing so I probably shouldn't, not that a little fresh air would hurt but... marriage proposal. on the internet. thousand websites that mention you? about you now. And not because of last night, but... RICA looked you up too. You grew up in L.A., which I thought nobody did. sorta never heard of, started your own record label at 29, sold it at 45, then started buying and selling boutique companies then invested in a small record company which you turned into the 2nd largest Hip Hop label in the world. fast doesn't it? bends down and picks up A FLAT WHITE STONE, then all over your house. they're so beautiful... ones? Oh, God, what does that mean? I'm controlling, unadventurous, what?
So you're as hard on yourself as	you are on everyone else. is stunned that he caught on to that. Harry bends down, realizes she can't sum this guy up so easily or at all. with all the young girls? I mean, what's the story there, really? please, what the hell does that mean?
If that's what you want... a non	threatening woman, who won't get your number, you get to run the show... by the way. Have you noticed? he goes again. She can't believe he's cute like this. out of the house. Now, you may notice, interestingly, we're walking back toward the house and its getting a little rocky again.
Of course it's getting a little	rocky, we're talking about you. hostility because I'm enjoying your company so much. HARRY watch the sunset. You interested? checks her watch. With your doctor.
Ohhhhh, my doctor, 'cause he's not	too young for you, huh? But we're just having dinner. It's not a date. that he thinks of it that way. may like it. Think of it this way -- he's not threatening, won't get your number, you get to run the show. You might have a hell of a time. we HEAR, DING DONG. hands him a take-out food box. cafeteria. guys turn at once. She looks beautiful, wearing a dress, Julian's back Harry gives Erica the 'OK' sign. We ready..? It'll take two seconds. Har, have a seat. . to see your doctor making.
Your pulse is a little fast but	maybe you're just excited about something. LOOKS AT ERICA'S LEGS again. HARRY I don't think so. I'm not excited about anything. shifts, the hem of her skirt RISING even higher. rises, leaving Harry's eye-line. Back to normal. winces then rises, looks to Erica as she throws a rush back for me and don't do anything I wouldn't do.
