CHARACTER	DIALOGUE
STOICK	You've thrown your lot in with them. You're not a Viking. You're not my son. Stoick pushes through the door, leaving Hiccup alone, Ready the ships! Below on the docks, Vikings load the heavy artillery into the Lastly, Toothless is loaded aboard Stoick's ship, chained
STOICK	Set sail! We head for Helheim's Gate. He then notices HICCUP watching from his familiar cliff-side
STOICK (CONT'D)	Lead us home, Devil.
ON HICCUP	Watching. He's powerless to stop what is happening, but won't
ON HICCUP	Still standing there. The ships have cleared the horizon.
ASTRID	It's a mess. Hiccup doesn't respond. You must feel horrible. You've lost everything. Your father, your tribe, your best friend.
HICCUP	Thank you for summing that up.
HICCUP (CONT'D)	Why couldn't I have killed that dragon when I found him in the woods. It would have been better for everyone.
ASTRID	Yep. The rest of us would have done it. So why didn't you? Hiccup just shakes his head - he really doesn't know.
ASTRID (CONT'D)	Why didn't you?
HICCUP	I don't know. I couldn't.
ASTRID	That's not an answer. Why is this so important to you all of a sudden?
ASTRID	Because I want to remember what you say right now.
HICCUP	Oh for the love of -- I was a coward! I was weak. I wouldn't kill a dragon.
ASTRID	You said 'wouldn't' that time. Whatever! I wouldn't! Three hundred years and I'm the first Viking who wouldn't kill a dragon!
ASTRID	First to ride one, though. Hiccup blinks. He never looked at it that way before.
ASTRID (CONT'D)	So... "Dragon" DeBlois/Sanders Final Draft (Rev.19) 02-13-2010 81. ...I wouldn't kill him because he looked as frightened as I was. I looked at him and I saw myself. Astrid turns to face the open sea.
ASTRID	I bet he's really frightened now. What are you going to do about it? Beat.
HICCUP	Probably something stupid.
ASTRID	Good. But you've already done that. Another beat.
HICCUP	Then something crazy. Astrid smiles.
ASTRID	That's more like it.
STOICK	Sound your positions. Stay within earshot. Shouts pour in from all directions.
VIKING #1	Here. "Dragon" DeBlois/Sanders Final Draft (Rev.19) 02-13-2010 82.
VIKING #2	One length to your stern.
VIKING #3	On your starboard flank.
VIKING #4	Three widths to port.
VIKING #5	Ahead, at your bow.
VIKING #6	Haven't a clue. ON STOICK straining into the fog as the calls continue. Gobber approaches him, speaking under his breath.
GOBBER	Listen... Stoick... I was overhearing some of the men just now and, well, some of them are wondering what it is we're up to here -- not me of course, I know you're always the man with the plan -- but some, not me, are wondering if there is in fact a plan at all, what it might be?
STOICK	Find the nest and take it.
GOBBER	Ah. Of course. Send them running. The old Viking fall-back. Nice and simple.
STOICK	Shhh. Stoick notices that Toothless' ear plates are at the alert, Stoick crosses to the stern of the ship and grabs the tiller,
STOICK (CONT'D)	Step aside. Stoick pulls the ship into a turn, covertly following
VIKING	Bear to port. The order is called out from ship to ship.
FISHLEGS (O.S.)	If you're planning on getting eaten, I'd definitely go with the Gronckle. Hiccup turns to see his fellow recruits, watching him with
TUFFNUT	You were wise to seek help from the world's most deadly weapon. It's me.
HICCUP	Uh...
SNOTLOUT	I love this plan.
HICCUP	I didn't...
RUFFNUT	You're crazy. I like that.
ASTRID	So? What is the plan? Hiccup smiles, glowing in the support of his friends.
GOBBER	Ah. I was wondering where that went. A clicking buzz becomes audible, growing louder. It fills the
STOICK	Stay low and ready your weapons. Stoick's ship suddenly JERKS to a halt as the keel burrows Stoick hops overboard, landing on a sprawling beach. The
STOICK (CONT'D)	We're here. Behind him, several dragon-headed bows pierce the fog. Snotlout nervously reaches for a spear laying near his foot. Uh-uh. Hiccup slows to a stop in front of the teens, with the
SNOTLOUT	Wait! What are you...
HICCUP	Relax. It's okay... it's okay. Hiccup turns and walks away.
SNOTLOUT	Where are you going?! Hiccup pulls a bundle of rope from a supply box.
HICCUP	You're going to need something to help you hold on. The teens eye each other apprehensively, and look up to ALL THE DRAGONS standing in the ring, facing the teens
CLOSE ON	Tree trunks, being sharpened and planted into the sand at Boulders being loaded into catapult baskets.
STOICK	When we crack this mountain open, all hell is going to break loose.
GOBBER	In my undies. Good thing I brought extras. Stoick TURNS to face the men.
STOICK	No matter how this ends, it ends today. He walks toward the base of the volcano wall, back by several A final boulder shatters the fractured wall, creating a deep,
WITH DRAGONS.	Stoick pulls his hammer and rushes into the cave, brazen.
STOICK (CONT'D)	In a chaotic flurry, the dragons suddenly rush out like bats
GOBBER	Is that it? Above the island, dragons POUR from every crevice, fleeing to
VIKINGS	
SPITELOUT	We've done it! Stoick doesn't celebrate. Something is not right. He HEARS A deep, rumbling ROAR echoes from the cavern. The ground The cheering stops. Stoick's expression sinks.
STOICK	This isn't over. Form your ranks! Hold together! The men SCRAMBLE to organize themselves.
STOICK (CONT'D)	Get clear!
"Dragon" DeBlois/Sanders Final Draft (Rev.19) 02-13-2010 87.	
GOBBER	Beard of Thor...what is that? Odin help us. Catapults! The Vikings score direct hits. The burning stones BOUNCE off Stoick races toward the second catapult. He LEAPS and pushes The Vikings scramble in all directions. Get to the ships!
STOICK	No! NO! The Red Death BLASTS the ships like a mile-long flamethrower. Gobber Joins Stoick.
GOBBER	Heh. Smart, that one. Stoick looks up and down the beach for an answer. I was a fool. The monster raises its head to the sky and BELLOWS. The Stoick stops a Viking General.
STOICK (CONT'D)	Lead the men to the far side of the island.
SPITELOUT	Right. Everybody to the far side of the island! The Vikings scatter into the rocks like ants. Satisfied with Gobber drops in beside Stoick, like two soldiers in a trench.
STOICK	Gobber, go with the men.
GOBBER	I think I'll stay, just in case you're thinking of doing something crazy. Stoick grabs him. I can buy them a few minutes if I give that thing someone to hunt. Gobber removes Stoick's hand. Clenches his forearm,
GOBBER	Then I can double that time. Stoick grins. Friends to the bitter end. They BREAK COVER and It spots both of them. He fuels up to fire, glancing back and
GOBBER (CONT'D)	Come on! Fight me!
STOICK	No, me! The Red Death remains focused on Stoick - this is it. It ... a Nadder punches through the flames, banking across the GOBBER AND STOICK, watch slack-jawed, in awe.
HICCUP	Ruff, Tuff, watch your backs! Move Fishlegs! The monster shakes off the blast and snaps in their wake.
TUFFNUT	Look at us, we're on a dragon! We're on dragons, all of us!
HICCUP	Up, let's move it! The dragons climb past the Red Death.
ON THE GROUND	Gobber hobbles over to Stoick.
GOBBER	Every bit the boar-headed, stubborn Viking you ever were. Stoick is speechless.
IN THE AIR	The group circles over the dragon's head.
HICCUP	Fishlegs, break it down.
FISHLEGS	Okay. Heavily armored skull and tail made for bashing and crushing.
FISHLEGS (CONT'D)	Steer clear of both. Small eyes, large nostrils. Relies on hearing and smell.
HICCUP	Okay. Lout, Legs, hang in its blind spot. Make some noise, keep it confused. Ruff, Tuff, find out if it has a shot limit. Make it mad.
RUFFNUT	That's my specialty.
TUFFNUT	Since when? Everyone knows I'm more irritating. See. Just do what I told you. I'll be back as soon as I can.
TUFFNUT	Don't worry, we got it covered!
FISHLEGS	Yeah! Hiccup and Astrid peel away. The teens bank and dive toward
TUFFNUT	Troll!
RUFFNUT	Butt Elf!
TUFFNUT	Bride of Grendel! The Red Death unloads a spray of fire at the twins. They Fishlegs and Snotlout hang behind its eyes, banging away at The Red Death opens all SIX of its eyes, spotting them.
FISHLEGS	Uh, this thing doesn't have a blind spot. "Dragon" DeBlois/Sanders Final Draft (Rev.19) 02-13-2010 91.
ON HICCUP AND ASTRID	... searching for Toothless. Hiccup spots him among the
HICCUP	There! He steers the Nadder over the deck and hands Astrid the Go help the others! She and the Nadder take off. As Hiccup fights his way to Toothless. He unbuckles the
HICCUP (CONT'D)	Okay, hold on. Hold on. He gets to work on the chains.
ON SNOTLOUT AND FISHLEGS	They clang their weapons against their shields, making the
SNOTLOUT	It's working. The huge beast starts to sway its head dizzily.
FISHLEGS	Yeah! It's working. PAN DOWN to reveal that the noise is also confusing the The Red Death thrashes, knocking Snotlout off of his dragon
SNOTLOUT	Agghh! Fishlegs' Gronckle goes down in a spin of confusion.
FISHLEGS	I've lost power on the Gronckle. Snotlout! Do something! He hurls Snotlout his hammer. The Gronkle crashes and skids
FISHLEGS (CONT'D)	I'm okay! ... then flips over, crushing Fishlegs. Less okay.
BACK TO SNOTLOUT	... who eyes the Red Death's gigantic, veiny eyes. He raises
SNOTLOUT	I can't miss! ... and hammers the monster's eyes, playing whack-a-mole.
SNOTLOUT (CONT'D)	What's wrong buddy, got something in your eye? Astrid flies by on her Nadder, catching Snotlout in all his
ASTRID	Yeah! You're the Viking! Snotlout grins, finally vindicated in her eyes. In his
SNOTLOUT	Whoa!
ON THE GROUND	The monster's tail sweeps across the burning ships, snapping
HICCUP	Working at the chains. He can't budge them. Fire licks at his Hiccup and Toothless are thrown into the water in a maelstrom
UNDERWATER	Hiccup swims toward Toothless. They're both caught in a mess Suddenly, a meaty hand grabs Hiccup. Dad... Stoick dives back into the water between flaming flotsam.
UNDERWATER	ON TOOTHLESS, drowning. Stoick appears in front of him. Momentary stillness. They eye each other, through the churned BOOM! In an explosion of sea water, Toothless lands on the
HICCUP (CONT'D)	You got it, bud. Hiccup climbs onto Toothless and buckles himself in.
STOICK	Hiccup. I'm sorry...for everything.
HICCUP	Yeah...me too.
STOICK	You don't have to go up there.
HICCUP	We're Vikings. It's an occupational hazard. They exchange smiles.
STOICK	I'm proud to call you my son. Hiccup beams, taken aback.
HICCUP	Thanks dad. Stoick lets go of Hiccup's arm. Hiccup spurs Toothless on, charged with his father's belief
IN THE AIR	Astrid sees Toothless streaking through the sky, gaining
ASTRID	He's up! She turns to Ruffnut and Tuffnut, who are ARGUING and
ASTRID (CONT'D)	Get Snotlout out of there! IN MID-PUNCH, the twins look over to see Snotlout stranded on
TUFFNUT RUFFNUT	I'm on it! I'm on it!
TUFFNUT	I'm on it first! I'm ahead of you. The twins spot Snotlout on the giant dragon and steer their
RUFFNUT	Hey! Let me drive! The twins peel off, ARGUING as they race each other to the Snotlout sees the Zippleback diving toward him and DASHES
TUFFNUT	I can't believe that worked. The Red Death spots Astrid and INHALES, preparing to blast.
ON THE GROUND	The Vikings watch with dread. They hear the familiar whir of
GOBBER	Night Fury! Get down!
IN THE AIR	A massive BLAST jolts the Red Death's head sideways. Astrid
HICCUP	Did you get her? Toothless grunts.
ON THE GROUND	They fly over the crowd of Vikings and set Astrid down, mid- Go. That thing has wings! Okay, let's see if it can use them! Hiccup pulls Toothless into a turn. They plummet, gaining KABLAM! Toothless unloads a fireball against the Red Death's
ON THE GROUND	The Vikings shield themselves from the dust of the fallen
IN THE AIR	Hiccup looks back as they put distance between them.
HICCUP (CONT'D)	Do you think that did it? Suddenly, the enraged behemoth RISES into frame... flapping
HICCUP (CONT'D)	Well, he can fly. Hiccup and Toothless DIVE into the tangled sea stacks - they The Red Death SMASHES through the canopy of rock and pulls in
ON THE GROUND	Stoick, Gobber, and the Teens watch as Hiccup and Toothless
TEENS	Woohoo! Yeah! A moment later the Red Death SMASHES the sea stacks to dust
HICCUP	Okay Toothless, time to disappear. Toothless PULLS into a steep climb, heading toward the
HICCUP (CONT'D)	Come on bud! The Red Death follows, closing in fast.
HICCUP (CONT'D)	Here it comes! BLAST! They narrowly dodge a column of flame and smoke. They From out of nowhere, Toothless DIVES at the huge dragon,
ON THE GROUND	The Vikings stare up at the sky listening to the resounding
IN THE AIR	HICCUP and TOOTHLESS dive in again and again, using the It BELLOWS in frustration and WHIRLS around, unleashing fire Hiccup sees the glow of fire cutting towards them.
HICCUP (CONT'D)	Watch out! The random blast CLIPS Toothless' tail. It's heavily damaged.
HICCUP (CONT'D)	Okay, time's up. Let's see if this works. He pulls Toothless into a turn. They fly directly into the
HICCUP (CONT'D)	Come on! Is that the best you can do!? Toothless utters an insult too, and they jackknife into a Toothless PUMPS his wings, racing faster than he's ever gone Hiccup glances back to check the tail - it's disintegrating.
HICCUP (CONT'D)	Stay with me buddy. We're good. Just a little bit longer. The Red Death closes the gap. Hiccup tucks in and holds
HICCUP (CONT'D)	Hold, Toothless. The Red Death OPENS his mouth. The familiar gas HISS emanates Hiccup HITS the PEDALS HARD as Toothless extends one wing. Toothless FIRES point blank down the monster's throat. Its As the Red Death chokes on the expanding fireball, he sees
"Dragon" DeBlois/Sanders Final Draft (Rev.19) 02-13-2010 99.	Hiccup and Toothless weave through the monster's massive back They manage to clear the obstacles. Hiccup glances back. He looks forward just in time to see the monster's massive He tries to shift their direction. The last shreds of
HICCUP (CONT'D)	No. No. Hiccup and Toothless can't maneuver - they're dead in the Toothless STRUGGLES with all his might to reach the
ON THE GROUND	The Vikings watch in horror as Hiccup and Toothless disappear A whiteout of ash. And through it comes...
STOICK	Hiccup? Hiccup!? Stoick appears, searching desperately. Everything is
STOICK (CONT'D)	Hiccup!? Son!? Through the ash, Stoick the motionless silhouette of Hiccup. "Dragon" DeBlois/Sanders Final Draft (Rev.19) 02-13-2010 100. Oh son...I did this... Astrid pushes through the crowd, her eyes welling up. Behind them, a ring of Vikings form, keeping a respectful Toothless stirs and groggily rolls his head toward Stoick. I'm so sorry... Toothless unfolds his wings, revealing Hiccup, unconscious,
STOICK (CONT'D)	Hiccup. He scoops Hiccup into his arms. Listens to his heart. Bursts
STOICK (CONT'D)	He's alive! You brought him back alive! The crowd roars. Followed by the dragons. The Vikings look Thank you... for saving my son. Gobber looks Hiccup up and down.
GOBBER	Well, you know... most of him. Stoick glances back at him. Gobber shrugs, redirecting his
CLOSE ON	HICCUP, asleep, his head on a pillow. Healing scars on his Oh, hey Toothless. Toothless excitedly nuzzles and nudges Hiccup.
HICCUP (CONT'D)	Okay, okay! I'm happy to see you too, bud. Now just-- Toothless steps on his groin, causing Hiccup to sit BOLT He looks around, confounded. He's in his bed, moved beside
HICCUP (CONT'D)	I'm in my house. You're in my house. Toothless TEARS around the room, knocking things over, far
HICCUP (CONT'D)	Uh...does my dad know you're in here?! Toothless pauses at the foot of the bed, tongue wagging. He Okay, okay -- no Toothless! Aw, come on... Hiccup shifts to get out of bed... then pauses... sensing He peels back the covers slowly. What he sees startles,
ON THE BARE FLOOR	His booted foot touches down. Followed by a mechanical Hiccup braces himself on the bedpost and tries to stand on Okay...okay... ... but STUMBLES with the first step. Toothless catches
HICCUP (CONT'D)	Thanks bud. Hiccup leans on him like a crutch. They take a few steps Their missing parts form a poetic silhouette as they make Hiccup pries it open (as he did in the opening scene),
HICCUP (CONT'D)	Toothless? Stay here, bud. Hiccup pauses... and cracks the door open again. He peeks ... the Monstrous Nightmare, carrying Snotlout on its back.
SNOTLOUT	Come on guys, get ready! Hold on tight! Here we go! A class of newbie dragon riders follow him through frame on a Under the framework of a MASSIVE BARN, a Nadder BLASTS fire Hiccup takes a step outside, finding Stoick waiting for him
HICCUP	I knew it. I'm dead. Stoick laughs.
STOICK	No, but you gave it your best shot. He puts his arm around Hiccup, steadying him. He gestures to So? What do you think? Hiccup just shrugs, amazed. Below, the plaza, villagers take notice.
VIKING #1	Hey look! It's Hiccup! They rush over, surrounding him with a hero's welcome.
VIKING #2	Hiccup, how you doin' mate?
VIKING #3	It's great to see you up and about. Turns out all we needed was a little more of... ... this. You just gestured to all of me.
GOBBER (O.S.)	Well. Most of you. Gobber pushes through the crowd, beaming proudly.
GOBBER (CONT'D)	That bit's my handiwork. With a little Hiccup flare thrown in. Think it'll do?
HICCUP	I might make a few tweaks. Astrid appears and jabs Hiccup in the arm. Hiccup recoils
ASTRID	That's for scaring me. What, is it always going to be this way? Cause I... She grabs him aggressively... then kisses him. Hoots and ... could get used to it. Gobber presents Hiccup with a rebuilt saddle, rigging, and
GOBBER	Welcome home. Suddenly, Toothless pounces on the crowd, crushing several
VIKING	Night Fury, get down! Toothless eyes the new tail excitedly, tongue wagging. Amidst
CLOSE ON	Hiccup's prosthetic foot, snapping into the modified stirrup. Hiccup and Toothless, saddled up and ready to fly. Astrid You ready? Toothless SNORTS an excited 'yes!' From his mount, Hiccup looks out over the changed world.
HICCUP (V.O.) (CONT'D)	This... is Berk. It snows nine months of the year... and hails the other three. They LEAP into the bright blue sky, together as one. Astrid
HICCUP (CONT'D)	Any food that grows here is tough and tasteless. The people that grow here are even more so. Hiccup and Astrid race their dragons through the village --
HICCUP (V.O.) (CONT'D)	The only upsides are the pets. While other places have...ponies or parrots, we have... Their fellow recruits join them as they take to the open sky, Hiccup and Toothless break from the pack, spinning into the ... dragons.
FADE TO WHITE	
