CHARACTER	DIALOGUE
HICCUP	Just... let me... why don't you... The Nadder spins around and races back toward them like a Astrid untangles herself and tries to pull her axe from
GOBBER	Well done, Astrid. Gobber hobbles off to wrestle the Nadder back into his cave.
ASTRID	Is this some kind of a joke to you? Our parents' war is about to become ours. Figure out which side you're on. She grabs her axe and stomps off. Hiccup watches, stung. A fish... being thrown into the cove. It hits the ground and Hiccup swallows his fear and offers the fish. Doing so As it approaches the fish, Hiccup notices that it's missing
HICCUP	Huh. Toothless. I could've sworn you had... A set of razor sharp teeth emerge from its gums to grab the
HICCUP (CONT'D)	... teeth. The teeth retract again. Toothless presses closer with an expectant look. Hiccup Uh, no. No, I don't have any more. The Fury backs Hiccup against a rock, placing himself the A tense moment passes... then Toothless regurgitates a chunk Hiccup crouches slowly and squeamishly picks it up. Amazed, Hiccup sits up and tries to touch him. Toothless CLOSE ON a sketch of Toothless. Hiccup draws with a stick, Toothless walks off. A moment later, he reappears with an Toothless snorts. Once again, they're face to face. Hiccup In a flash, the dragon is gone, leaving Hiccup astounded.
GOBBER	...and with one twist he took my hand and swallowed it whole. And I saw the look on his face. I was delicious. He must have passed the word, because it wasn't a month before another one of them took my leg.
FISHLEGS	Isn't it weird to think that your hand was inside a dragon. Like if your mind was still in control of it you could have killed the dragon from the inside by crushing his heart or something.
SNOTLOUT	I swear I'm so angry right now. I'll avenge your beautiful hand and your beautiful foot. I'll chop off the legs of every dragon I fight, with my face. He postures to Astrid. She rolls her eyes.
GOBBER	Un-unh. It's the wings and the tails you really want. If it can't fly, it can't get away. A downed dragon is a dead dragon. Alright. I'm off to bed. You should be too. Tomorrow we get into the big boys. Slowly but surely making our way up to the Monstrous Nightmare. But who'll win the honor of killing it? He hobbles off. The teens reflect.
TUFFNUT	It's gonna be me. It's my destiny. See? Tuffnut rolls up his sleeve to reveal a red dragon on his Your mom let you get a tattoo?
TUFFNUT	It's not a tattoo. It's a birthmark.
RUFFNUT	Okay, I've been stuck with you since birth, and that was never there before.
TUFFNUT	Yes it was. You've just never seen me from the left side until now.
SNOTLOUT	It wasn't there yesterday. Is it a birthmark or a today-mark? Hiccup gets up and walks away from the group. Astrid watches With a look of determination. Hiccup picks up a charcoal
CLOSE ON	... a creaking leather bellows. The stone forge glows with The pieces are carried to Hiccup's workbench and laid out in
HICCUP	Hey Toothless. I brought breakfast. I hope you're hungry. Hiccup drops the basket and kicks it over. Fish spill out.
HICCUP (CONT'D)	Okay, that's disgusting. Toothless approaches, settling in to devour the feast.
HICCUP (CONT'D)	Uh..we've got some salmon... Toothless swallows it.
HICCUP (CONT'D)	... some nice Icelandic cod... Swallows those too. ... and a whole smoked eel. Toothless nabs it, chews a few times, then spits it out. He
HICCUP (CONT'D)	No, no, no! It's okay. Yeah, I don't like eel much either. Toothless focuses on the remainder. With the dragon
HICCUP (CONT'D)	Okay. That's it. That's it, just stick with good stuff. And don't you mind me. I'll just be back...here. Minding my own business. Hiccup cautiously approaches the injured tail, but every time
HICCUP (CONT'D)	It's okay. Hiccup drops a knee on top of the tail. Toothless' head juts Okay...okay.. The dragon tenses, slowly spreading his wings. Hiccup straps There. Not too bad. It works. Toothless BOLTS! He snaps his massive wings and takes to the
HICCUP (CONT'D)	Woah! No! No! No! Hiccup struggles to hold on to the tail. As the ground speeds Hiccup sees the folded fin rattling uselessly in opposition
HICCUP (CONT'D)	It's working! Toothless arcs just short of the water and climbs... high
HICCUP (CONT'D)	Yes! Yes, I did it. He glances back at Hiccup, busily holding the tail open while Whoomp! Hiccup is suddenly thrown from the tail in the He bounces across the water's surface and takes a dive. Hiccup resurfaces, roughed up, but beaming. Toothless appears
HICCUP (CONT'D)	Yeah! Today is about teamwork. Work together and you might survive. ON A DOUBLE-WIDE DOOR. Gas seeps through the cracks.
GOBBER (CONT'D)	Now, a wet dragon head can't light its fire. The Hideous Zippleback is extra tricky. One head breathes gas, the other head lights it. Your job is to know which is which.
FISHLEGS	Razor sharp, serrated teeth that inject venom for pre-digestion. Prefers ambush attack, crushing its victims in its... Will you please stop that?
ON SNOTLOUT AND TUFFNUT	Moving nervously through the fog, back to back. Snotlout is
SNOTLOUT	If that dragon shows either of his faces, I'm gonna-- --There! Snotlout and Tuffnut HURL their water into the fog.
ASTRID	Hey!
RUFFNUT	It's us, idiots. Astrid and Ruffnut are soaked.
TUFFNUT	Your butts are getting bigger. We thought you were a dragon. Not that there's anything wrong with a dragon-esque figure. Astrid ELBOWS Snotlout in the face. Ruffnut DROPS Tuffnut
ASTRID	Wait. They FREEZE. A tail SWEEPS out of the fog, taking them down.
TUFFNUT	Oh, I'm hurt. I am very much hurt.
FISHLEGS	Chances of survival are dwindling into single digits now...
HICCUP	Look out! A Zippleback head emerges out of the smoke. Fishlegs hurls
FISHLEGS	Oh. Wrong head. GAS FLOWS around their legs. Fishlegs flees in a panic.
GOBBER	Fishlegs! Beat. A clicking sound comes from behind them. Sparks flash
GOBBER (CONT'D)	Now, Hiccup! The other head sweeps out of the smoke. Hiccup hurls his
HICCUP	Oh, come on! Gobber COVERS his eyes.
GOBBER (CONT'D)	Hiccup! Beat. The Zippleback hesitates. SNIFFS. Then retreats.
HICCUP	BACK! BACK! BACK! Now don't you make me tell you again! The Zippleback retreats through its door and into its cave,
HICCUP (CONT'D)	Yes, that's right. Back into your cage. Hiccup slyly OPENS his vest, revealing the spotted smoked EEL Now think about what you've done. Hiccup turns to the teens and Gobber. They stare, slack-jawed
HICCUP (CONT'D)	Okay! So are we done? Because I've got some things I need to... Hiccup jogs out of the ring, past the speechless group.
HICCUP (CONT'D)	Yep...see you tomorrow. Astrid SNEERS. Something's going on.
HICCUP	Hey! "Dragon" DeBlois/Sanders Final Draft (Rev.19) 02-13-2010 47.
HICCUP	Yeah! Whoa! Hiccup recovers to find Toothless still rolling around in the
FISHLEGS	Hey Hiccup, I've never seen a Gronkle to that before.
TUFFNUT	How'd you do that?
RUFFNUT	It was really cool. He squirms and invents an excuse.
HICCUP	I left my axe back in the ring. He turns and hurries back.
HICCUP (CONT'D)	You guys go on ahead and I'll catch up with you. Astrid watches, suspicious.
FISHLEGS	Hey Hiccup!
SNOTLOUT	What was that? Some kind of trick? What did you do?
TUFFNUT	Hiccup, you're totally going to come in first, there's no question.
GOBBER	Meet the Terrible Terror.
TUFFNUT	Ha. It's like the size of my-- Tuffnut is taken down in a blur.
TUFFNUT (CONT'D)	Get it off! Get it off! Oh! I'm hurt, I am very much hurt! Hiccup stops the Terrible Terror with the same light-patch Wow, he's better than you ever were. She HUFFS, frustrated.
HICCUP	Oh, great.
VIKING	Hiccup. Hiccup nods, trying to look casual. Once the coast is clear,
ASTRID (O.S.)	Hiccup? Hiccup FREEZES. Then frantically tries to pry the ring off
ASTRID (CONT'D)	Are you in there? Too late - she's right outside. ON ASTRID walking along the outside of the Blacksmith's.
HICCUP	Astrid. Hey! Hi Astrid. Hi Astrid. Hi Astrid.
ASTRID	I normally don't care what people do, but you're acting weird. Well, weirder. Toothless spots a nearby sheep and makes a move toward it. As Gobber hobbles through the MUMBLING crowd to find Stoick --
VIKING	Where are the other ships?
SPITELOUT	You don't want to know. Stoick lumbers past Gobber, leaving him staring at the
GOBBER	Well, I trust you found the nest at least?
STOICK	Not even close.
GOBBER	Ah. Excellent. Gobber follows Stoick up the ramp and snags his duffle bag
STOICK	I hope you had a little more success than me.
GOBBER	Well, if by success, you mean that your parenting troubles are over with, then... yes. Stoick stops. What does that mean? A group of merry villagers rush past.
VIKING #1	Congratulations Stoick! Everyone is so relieved.
VIKING #2	Out with the old and in with the new, right?!
VIKING #3	No one will miss that old nuisance!
VIKING #4	The village is throwing a party to celebrate! Stoick is stunned, overwhelmed by the insensitivity. He turns
STOICK	He's... gone?
GOBBER	Yeah...most afternoons. But who can blame him? I mean the life of a celebrity is very rough. He can barely walk through the village without being swarmed by his new fans. Stoick is doubly confused.
STOICK	Hiccup? Who would've thought, eh? He has this...way with the beasts.
HICCUP	Okay there bud, we're gonna take this nice and slow. Hiccup checks a leather cheat sheet, clipped onto his
HICCUP (CONT'D)	Here we go. Here we go...position three, no four. He presses the pedal, causing the tail to flare. They roll Hiccup tucks tight against his neck, thrilled that his new
HICCUP (CONT'D)	Alright, it's go time. It's go time. They dive toward it, lining up to pass through the arch.
HICCUP (CONT'D)	Come on. Come on buddy. Come on buddy! They zip through the arch. A perfect maneuver.
HICCUP (CONT'D)	Yeah! Yes, it worked! The triumph is short-lived. They smack into one of several
HICCUP (CONT'D)	Sorry. They hurtle into another rock pillar. Toothless grumbles.
HICCUP (CONT'D)	My fault. Toothless swats him with his 'ear' plate.
HICCUP (CONT'D)	Yeah, yeah, I'm on it. Position four, no three. They pierce the clouds. For the first time, Hiccup can see
HICCUP (CONT'D)	Yeah! Go baby! Yes! Oh, this is amazing! The wind in my... He spots the leather guide tearing free in the turbulence. Hiccup grabs frantically for the airborne sheet...
HICCUP (CONT'D)	No!
"Dragon" DeBlois/Sanders Final Draft (Rev.19) 02-13-2010 54.	As they slow to a stop, Hiccup goes weightless. The rings of
HICCUP (CONT'D)	Oh gods! Oh no! Without Hiccup, the tail loses control. Hiccup and Toothless
HICCUP (CONT'D)	Alright, okay. You just gotta kinda angle yourself. No, no...come back down towards me. Come back down-- Hiccup extends his arms and legs, giving himself as much With no time to think, Hiccup throws it away and steers Toothless concurs with a happy SQUEAL and a fireball.
HICCUP (CONT'D)	Ah, come on.
HICCUP	Uh..no thanks. I'm good. Several Terrible Terrors land like seagulls, hissing and One grabs the regurgitated fish head and drags it away. Irate, the little dragon paws at the ground and blast
HICCUP (CONT'D)	Not so fireproof on the inside, are you? Hiccup throws the hapless Terror his freshly cooked fish.
HICCUP (CONT'D)	Here you go. The appreciative little dragon gulps down the meal and Everything we know about you guys is wrong.
"Dragon" DeBlois/Sanders Final Draft (Rev.19) 02-13-2010 56.	
HICCUP	Dad! You're back! He skirts the bench, blocking Stoick's view of Toothless, the
HICCUP (CONT'D)	Gobber's not here, so... He strikes an awkwardly casual pose, trying to cover up as
STOICK	I know. I came looking for you. You did? You've been keeping secrets. Hiccup's legs give out. He slides, dragging the table's
HICCUP	I...have?
STOICK	Just how long did you think you could hide it from me? I don't know what you're...
STOICK	Nothing happens on this island without me hearing about it.
HICCUP	Oh? "Dragon" DeBlois/Sanders Final Draft (Rev.19) 02-13-2010 57.
STOICK	So. Let's talk about that dragon. Blood drains from Hiccup's face.
HICCUP	Oh gods. Dad I'm so sorry. I was going to tell you. I just didn't know how to-- Stoick starts laughing. Big, booming. Hiccup stares, baffled.
HICCUP (CONT'D)	You're not...upset?
STOICK	What?! I was hoping for this!
HICCUP	Uh...you were?
STOICK	And believe me, it only gets better! Just wait til you spill a Nadder's guts for the first time. Hiccup's elated expression sinks.
STOICK (CONT'D)	And mount your first Gronckle head on a spear. What a feeling! Stoick laughs and smacks Hiccup on the shoulder, sending him
STOICK (CONT'D)	You really had me going there, son. All those years of the worst Viking Berk has ever seen! Odin, it was rough. I almost gave up on you! Hiccup gets back up, grimacing in the irony of it all.
STOICK (CONT'D)	And all the while, you were holding out on me! Thor almighty! Stoick grabs a stool and sits. His massive frame nearly fills Ahhhhh. With you doing so well in the ring, we finally have something to talk about. Pregnant pause. Hiccup averts his eyes nervously. Stoick After a long, uncomfortable silence...
STOICK (CONT'D)	Oh, I... brought you something. He presents a horned helmet.
STOICK (CONT'D)	To keep you safe in the ring. Wow. Thanks. Hiccup accepts it, looking it over.
STOICK	Your mother would've wanted you to have it. It's half of her breast plate. Stoick taps his own helmet and smiles.
STOICK (CONT'D)	Matching set. Keeps her close, y'know? Hiccup eyes the mismatched helmets, grimacing.
STOICK (CONT'D)	Wear it proudly. You deserve it. You've held up your end of the deal. Stoick beams with pride. Hiccup squirms. He forces a YAWN.
HICCUP	I should really get to bed.
STOICK HICCUP	Yes! Good! Okay. Good talk. See you back at the house.
STOICK	Well..uh..good night. Stoick leaves the room awkwardly, leaving Hiccup looking more Astrid ducks behind a barrier to find Hiccup already there.
ASTRID	Stay out of my way! I'm winning this thing.
HICCUP	Please, by all means. She darts off, CLOSING FAST on the dragon. The crowd above
VIKING IN CROWD	You got it Astrid! Hiccup stands and looks around. Amidst the crowd of Unbeknownst to Hiccup, the Gronckle spots him and makes a bee-
BACK TO ASTRID	... as she catches her breath behind a barrier. She scowls,
ASTRID	This time. This time for sure. Aaaaaaaaaa... And as she clears the barriers, she sees that Hiccup has
ASTRID (CONT'D)	...aaaaaaauGGGGGHHHHHHHH! No! No! Hiccup shrugs, as unhappy with the situation as she is. A loud CLACK ring out. From the crowd above, Gothi, the
STOICK	Wait! Wait!
HICCUP	So, later. Gobber snags Hiccup as he attempts to leave.
GOBBER	Not so fast.
HICCUP	I'm kinda late for-- What? Late for what exactly? Stoick holds out his hands to silence the jabbering crowd.
STOICK	Okay quiet down. The elder has decided. Thrilled, Gobber stands behind Hiccup and Astrid. He points
GOBBER	You've done it! You've done it, Hiccup! You get to kill the dragon!
STOICK	Ha, ha! That's my boy! Hiccup is hoisted onto the recruits' shoulders and carried Heh, heh. Oh yeah! Yes! I can't wait. I am so...
HICCUP	... leaving. We're leaving. Let's pack up. Looks like you and me are taking a little vacation, forever. Toothless is nowhere in sight. Hiccup sets down his basket
HICCUP (CONT'D)	Oh..man... SHINK! Hiccup looks up to the sound of... Aggh! What the-- What are you doing here? She hops off the rock and back him down, spinning her axe
ASTRID	I want to know what's going on. No one just gets as good as you do. Especially you. Start talking! Are you training with someone?
HICCUP	Uh...training? She grabs him by his odd-looking harness.
ASTRID	It better not involve... this.
HICCUP	I know this looks really bad, but you see...this is, uh... They hear a RUSTLE coming from the other side of the cove. You're right! You're right. I'm through with the lies. I've been making... outfits. So you got me. It's time everyone knew. Drag me back. Go ahead. Here we go. He puts her hand back on his harness, getting her to 'drag AAAAUUGGGHHH! Why would you do that?!
ASTRID	That's for the lies. Astrid pounces the hilt of her axe off of Hiccup's laid-out
ASTRID (CONT'D)	And THAT'S for everything else. Hiccup's YELP is answered with A GROWL, coming from the other Oh man. She dives onto Hiccup.
ASTRID	Get down! Run! Run! Astrid pulls her axe, ready to take on Toothless.
HICCUP	No!
HICCUP (CONT'D)	No. It's okay! It's okay... Toothless pulls up short and lands hard, SPRAYING Astrid with She's a friend. Toothless snorts in disagreement. Astrid is frozen. Toothless You just scared him.
ASTRID	I scared him!? Hiccup makes a “be quiet” motion. Who is him?
HICCUP.	Astrid, Toothless. Toothless, Astrid. Astrid backs away, eyeing Hiccup and Toothless together with
HICCUP	We're dead. Satisfied with Astrid's departure, Toothless turns away. Where do you think you're going?
ASTRID	Oh great Odin's ghost, this is it!
ASTRID (CONT'D)	Hiccup! Get me down from here!
HICCUP	You have to give me a chance to explain.
ASTRID	I'm not listening to ANYTHING you have to say!
HICCUP	Then I won't speak. Just let me show you. Hiccup extends a hand.
HICCUP (CONT'D)	Please, Astrid. She eyes him and the dragon, then the ground far, far below.
ASTRID	Now get me down.
HICCUP	Toothless? Down. Gently. Toothless leers mischievously. He spreads his wings slowly.
HICCUP (CONT'D)	See? Nothing to be afraid of. Toothless suddenly LAUNCHES straight upward. Astrid SCREAMS.
HICCUP (CONT'D)	Toothless! What is wrong with you?! Bad dragon! He's not usually like this. Oh no... "Dragon" DeBlois/Sanders Final Draft (Rev.19) 02-13-2010 65. Toothless rockets over the ocean waves, deliberately dipping Toothless, what are you doing?! We need her to like us! Toothless rockets skyward and begins tumbling head over tail.
HICCUP (CONT'D)	And now the spinning. Thank you for nothing you useless reptile. Astrid clamps her hand over her eyes.
ASTRID	Okay! I'm sorry! I'm sorry! Just get me off of this thing. Astrid is defeated, her aggressive energy gone. Satisfied, They level off and head up into the clouds. Astrid opens her Toothless rises above a blanket of clouds... Astrid tucks her arms into Hiccup's vest, burying her chin Toothless climbs past Berk's tallest peaks and heads out over
ASTRID	Alright I admit it. This is pretty cool. It's... amazing. He's amazing. Astrid carefully reaches down and pats Toothless' side.
ASTRID (CONT'D)	So what now? Hiccup groans. It's a problem without an answer.
ASTRID (CONT'D)	Hiccup, your final exam is tomorrow. You know you're going to have to kill... ... kill a dragon.
HICCUP	Don't remind me. A strange, unearthly din approaches. Toothless' ear plates Toothless! What's happening? What is it? Toothless BARKS at him. 'Quiet!' Suddenly, out of the dense cloud, a Monstrous Nightmare
HICCUP (CONT'D)	Get down! Hiccup and Astrid duck. The Nightmare calls out. A Zippleback
ASTRID	What's going on?
HICCUP	I don't know. Toothless. You've got to get us out of here, bud. Toothless HISSES. It looks like they're hauling in their kill. The Zippleback eyes them ravenously.
ASTRID	What does that make us? The dragons BANK and dive in formation, plummeting through They emerge at the base of a massive volcanic caldera, It gives way to a vast, steamy inner chamber, tiered with The arriving dragons fly in, dropping the fish and game into
HICCUP	What my dad wouldn't give to find this. Toothless peels away from the procession, landing on a small Hiccup and Astrid peek around, taking in the busy hive of It's satisfying to know that all of our food has been dumped down a hole.
ASTRID	They're not eating any of it. The Gronckle tries to flee, but before it can, a gargantuan Hiccup and Astrid recoil, terrified. What is that? The monstrous beast SNIFFS the air, seemingly aware of them.
HICCUP	Alright buddy, we gotta get out of here. Now! Toothless takes flight, barely evading the monster's snapping The behemoth dragon lunges for them, snatching a Zippleback Toothless disappears into the winged exodus as thousands of
ASTRID	No, no, it totally makes sense. It's like a giant beehive. They're the workers... and that's their queen. It controls them. She leaps off of Toothless and runs toward the village.
ASTRID (CONT'D)	Let's find your dad.
HICCUP	No, no! Not yet. They'll... kill Toothless.
HICCUP (CONT'D)	Astrid, we have to think this through carefully. Astrid eyes him, incredulous.
ASTRID	Hiccup, we just discovered the dragons' nest...the thing we've been after since Vikings first sailed here. And you want to keep it a secret? To protect your pet dragon? Are you serious? Hiccup stands firm, resolute.
HICCUP	Yes. Astrid's taken aback.
ASTRID	Okay. Then what do we do?
HICCUP	Just give me until tomorrow. I'll figure something out.
ASTRID	Okay. Astrid PUNCHES Hiccup in the arm.
ASTRID (CONT'D)	That's for kidnapping me. Hiccup looks to Toothless for support. Toothless SNORTS, Astrid grabs him. He braces for another hit. She KISSES
ASTRID (CONT'D)	That's for, everything else. In the awkward wake of the moment, Astrid hurries off...
HICCUP	What are you looking at?
STOICK	Well, I can show my face in public again. If someone had told me that in a few short weeks, Hiccup would go from being, well... Hiccup, to placing first in dragon training... I would've tied him to a mast and shipped him off for fear he'd gone mad. Yes! And you know it! But here we are. And no one's more surprised... ON HICCUP standing at the entrance to the ring, listening,
STOICK (CONT'D)	... or more proud than I am. Today, my boy becomes a Viking. TODAY, HE CHEERS and ROARS. Astrid approaches Hiccup.
ASTRID	Be careful with that dragon.
HICCUP	It's not the dragon I'm worried about. What are you going to do?
HICCUP	Put an end to this. She eyes him, dubious.
HICCUP (CONT'D)	I have to try. Astrid. If something goes wrong... just make sure they don't find Toothless. I will. Just promise me it won't go wrong. Hiccup can't. Gobber approaches.
GOBBER	It's time, Hiccup. Knock him dead. Hiccup puts his helmet on and enters the ring. HOOTING and HOLLERING from the stands.
TUFFNUT	Show 'em how it's done, my man! Hiccup locks eyes with Stoick. Stoick nods with a smile. Hrmph. I would've gone for the hammer. Hiccup turns to face a bolted, heavy door. Takes a deep
HICCUP	I'm ready. The door bolt is raised. The crowd grows quiet... BOOM! The doors blast open with a stream of sticky fire. It climbs the walls and chain enclosure like a bat, hissing The crowd grows silent, bracing for the big fight. ON STOICK, also confused.
STOICK	What is he doing? The dragon presses closer, snorting. Hiccup extends his open It's okay. It's okay. The dragon continues to pace, focused on... HICCUP'S HELMET.
HICCUP (CONT'D)	I'm not one of them. GASPS and MURMURS race through the crowd.
STOICK	Stop the fight.
HICCUP	No. I need you all to see this. The crowd gets restless.
HICCUP (CONT'D)	They're not what we think they are. We don't have to kill them. The spell is broken. The Nightmare reacts to Hiccup's sudden
ON TOOTHLESS	His ear plates shoot up. Panic flares in his eyes.
STOICK	Out of my way!
ASTRID	Hiccup! Astrid wedges her axe under the arena gate and squeezes
ASTRID	Hiccup! She picks up a hammer and hurls it at the Monstrous
STOICK	This way! Astrid makes it through, but the Nightmare BLASTS the Suddenly, a terrible roar pierces the din.
GOBBER	Night Fury! Get down! Toothless bounds over the crowd and BLASTS a hole through the The Vikings rush to railings... in time to see a flurry of The Nightmare snarls, circling them. Toothless lunges and Alright, Toothless, go. Get out of here! The crowd is gob-smacked, growing livid.
VIKINGS	Night Fury!
HICCUP	Go! GO!
VIKING	Take it alive! Stoick grabs an axe and charges into the arena. Astrid calls
ASTRID	Stoick no!
HICCUP	Dad! No! He won't hurt you! The other Vikings surround and attack Toothless. He tosses
HICCUP (CONT'D)	No, don't! You're only making it worse! Stoick raises his hammer as he charges for Toothless.
HICCUP (CONT'D)	Toothless! STOP! He pins Stoick and inhales. The familiar hiss of gas builds. Toothless swallows back the blast and turns to Hiccup, not
VIKING	Get him! The crowd rushes him, piling on, and taking Toothless down. No! Please...just don't hurt him. Please don't hurt him.
STOICK	Put it with the others! His burning glare turn to Hiccup.
ON HICCUP	Being shoved into the dank, dimmed hall.
STOICK	I should have known. I should have seen the signs.
HICCUP	Dad.
STOICK	We had a deal! Stoick pauses to say something, but stops short. He SNORTS I know we did... but that was before... ughh, it's all so messed up.
STOICK	So everything in the ring. A trick? A lie? He stomps toward Hiccup. Stops short and points, fighting
HICCUP	I screwed up. I should have told you before now. Take this out on me, be mad at me, but please... just don't hurt Toothless.
STOICK	The dragon? That's what you're worried about? Not the people you almost killed?!
HICCUP	He was just protecting me! He's not dangerous.
STOICK	They've killed HUNDREDS OF US!
HICCUP	And we've killed THOUSANDS OF THEM! They defend themselves, that's all! They raid us because they have to! If they don't bring enough food back, they'll be eaten themselves. There's something else on their island dad...it's a dragon like-- Stoick HUFFS.
STOICK	--Their island? He stomps back... pointing an accusing finger.
STOICK (CONT'D)	So you've been to the nest.
HICCUP	Did I say nest? Hiccup goes silent -- he said too much.
STOICK	How did you find it?!
HICCUP	No... I didn't. Toothless did. Only a dragon can find the island. Stoick GLARES. A moment passes, then an idea takes form on
HICCUP (CONT'D)	Oh no. No, Dad. No. Hiccup chases after him, panicked. Dad. It's not what you think. You don't know what you're up against. It's like nothing you've ever seen. He grabs Stoick by the arm, tugging with all his might. He
HICCUP (CONT'D)	Dad. Please. I promise you that you can't win this one. Nothing.
HICCUP (CONT'D)	No. Dad. No. For once in your life, He throws Hiccup off of him, SWATTING him to the floor.
