CHARACTER	DIALOGUE
Well that wouldn't leave us too	many options would it?
And do we wonder how she writes	that snappy repartee. Let him pick up the check. It'll make him feel older. Erica's shocked expression, the DOOR SLAMS. a message and I'll call you back. looking at your baby pictures... Thinking about you... hangs up, dials another number. Shannon. For Brooke push one, for - hangs up then slowly sits up, letting himself feel as old old Har... rises dizzily, crosses to the bookshelves. He rummages Top of the heap... and the house was built in record time and... It's like a thousand degrees in here. people who need rescuing, that we have a need to take care of someone. Julian, how old are you, like... ERICA than you. More than twenty years than you. you were headed with that thing you just saying, but in terms of us, you want to be friends, right? to be? to see you.
may surprise you but some	consider me quite the guy. never been married. I'm a You wouldn't believe what that is for some women. your own age? taken to quite like this and when happens to you that's never to you before, don't you have to least find out what it is? that much or all that well... with a stick. ERICA my age, the ones I've met...well, I'm not that regular a person and they really like regular.
Men your age may be really stupid,	you ever think of that? There's something radically wrong with the idea that no one loves you. Right to the middle of her shoulder, then her neck. ERICA I'm back... 'Night... writes: Watching Joan Rivers sell jewelry. laughs when he adds: So was your date a date? types: I think so... types: I told ya. (then) You hungry? she types: I just had dinner. writes: Yeah, but women never eat on dates. How does he know everything! hesitates then types: Actually am a little hungry but, writes: Me too. Pajama party? stares at the screen biting her lip. HE does the same. now wearing a bra under he pajamas, checks out her boobs used to having sleepovers. So, what are you hungry for? What are my choices? I mean I know you think I'm not very discriminating but... looks through the fridge. think. I can't imagine what you think of me. Okay, so... Pasta, left over coq au vin, turkey sandwich or grilled cheese. HARRY were great at it. that much anymore. Was one of us just saying something interesting? of you. that. curious but...'
will you tell me first why you only	miss being married at night? Oh, 'cause the phone doesn't ring as much at night and the "alone" thing happens at night and sleeping by myself took some getting used to. But I got the hang of it. You gotta sleep in the middle of the bed. It's absolutely not healthy to have a side when no one has the other side. starts mixing the batter. think of you is right. You are a tower of strength. Ughhhhhhhhhh... . HARRY mutts. No, you know what you are, you're like a great portrait over a fireplace. Words have been invented to describe women like you. Such as? frozen in some painting... defines you. But it's thrilling when your defenses are down arid you're not isolated. That, I believe, is your winning combo. A killer combo actually. maybe you're the only person who ever got me. moment is broken when they HEAR the FRONT DOOR OPEN and ARRIVES IN THE DOORWAY in a knockout of a dress holding and Harry have the air of kids caught making out by one
had this big photography auction	tonight, then I went out with a bunch of people, I checked my messages and got this so sad message from Harry so bored out here. I thought I should come out and at least see how he was doing. Thank you for the gorgeous flowers by the way. They were so huge... nods to herself. Oh, God, he sends them all flowers. Oh, this is too sweet. You're making pancakes? Awwww. And you're both in your pj's. Now I feel I'm interrupting. sleep and this one doesn't sleep either. It's... .What's in the bag? A quart of matzoh ball soup for Harry. I know it's not the remedy for heart problems but it is low cholesterol. But high sodium. favorite raisin-bread. And for me... My favorite Vodka. cell phone RINGS. MARIN Hello? No I'm here, babe. Made record time. Everyone's still there? feeling suddenly frumpy, fixes her hair. Harry watches don't you finish the pancakes and I'll get back to work... pours a healthy Vodka into a glass, grabs some ice.
So your ex-husband stood me up	today. We were supposed to have lunch at Barneys . He never showed up. Was he always like this?
This is what happens after a couple	gets divorced, the kid inherits all the problems. Not that I'm a kid. So how are you, how do you feel? When can you go home? as harry is about to answer, Marin's cell RINGS. She . . you two catch up. . . and just flip these Hin like two seconds. gorgeous, next to him No. I don't. thousand people everyday. Also, let's face it, the guy's insanely old for me. I'd be nuts to keep this going. don't expect it, right? I was thinking... you and Harry... handle it.
But you're only saying that 'cause	you think he and I have had sex. MARIN Never even got close. Swear to God. Just puttin' that out there...'cause for two people who are convinced they got life beat, there's was somethin' cooking in the kitchen last night other than pancakes. Hello. before calling you, even though you've been on my mind since I woke up at 5:15. I'm wondering when we could have dinner again? I have to work the next few nights and if we wait 'til next week, I know you'll chicken out so how's Friday? I know it's like a date night but I think that's good. stops short.
Can you meet me at The Grill at	eight? JULIAN smiles to herself.
He just took care of it for me; He	was an ace. Elegant. Said our fate was to be friends. ...Oh my God. He was breaking up with me. He's a genius. we both feel good about it. I gotta get back. Now Erica, try to think of this as the smartest thing you've ever done for yourself. EXITS and the PHONE RINGS. Hello. Thought you'd like to know your daughter broke up with me. and Erica talk while looking at each other through the ERICA
Made up a story about meeting another	guy. Guess I wasn't so cute with an IV in my arm. someone else. didn't like me anyway. How 'bout I bring you out some lunch and a couple of blood
You're a great woman, Erica.	Is this why my doctor is falling in love with you? For what? Erica kisses him. kisses her again and again. haven't used them for kissing in so long. They've been more that works... both look down at Harry. Hello, Mr. Midnight. Kiss me before you make it go away. HARRY
This could be world class	interesting. Having any doubts? Yes.
But so far the kissing is	spectacular. I'm not grading you, just mentioning it. Brilliant. tries to kiss her neck but the turtleneck is in the way.
Can't get past your damn	turtleneck. . . tries lifting the shirt from the bottom, it's awkward, he Cut it off... Please. a brilliant invitation. He takes the scissors and starts shakes her head, 'no' ...shuts her eyes. Beautiful... kiss and she reaches down for his pants. HARRY Who's the lucky boy... kisses between her breasts, her stomach, heads down and pressure. head POPS BACK INTO FRAME. What????? ARRY -' A MINUTE LATER grabs Harry's glasses, reads the results. One twenty over eighty!!! Baby! TWIRLS AROUND and we FIND HARRY, sprawled nearby, arrives next to him, also out of breath. smiles. He's trying to be his debonair self but
I really thought I was sorta closed for	business. Just never expected this. Nothin's ever surprised me more... Erica snuggles up close. Harry puts his arm around time I cried. I think I'm overwhelmed. Me too. That's the perfect word. attack and I didn't die! pauses. Oh. That kind of overwhelmed. sport Erica gives him a double thumbs up. Let's not brag about this to our doctor, okay? HARRY thing I am is a gentleman. holds her close. You know I'm not good at being monogamous, right? you. looks at her wondering if she's for real. She smiles as York, by myself, and I'd never seen snow before and I didn't have enough money for the bus, so I had to walk. Had no idea how far it was and I'm talking blizzard and I'm in sneakers. Hello? I mean...Hello. Hello. WITH MARIN IN A TAXI IN THE CITY - IT'S POURING hurricane. The news said the winds are like a zillion miles an hour. You are, aren't you. going on now. it amazing?
Yes and thank you for the wonderful	opportunity. SCREAMMMMMMMMMMMS. Erica flips the phone shut, looks to Am I interested in buying aluminum siding. . . ended there. someone like me doesn't write it, where they gonna get it? Real life? Excuse me. What do you call this? Eating eggs by candlelight in our robes after... kisses him, starts to say, "I'm sorry" when he pulls her Paris? E it's just a little bistro on the Left Bank, best roast chicken in the universe. night in. When's your birthday? still know each other by then we go to Paris for our birthdays. Maybe. . . face) . I have no idea how to do this...be intimate but not...The color is draining from your face. Okay, look, I'm gonna pee,take one of your blood pressure pills then when I get back, let's not talk anymore. gets out of bed. sex with. has no idea how to take that. Decides to accept it.
Honey... ?	turns, sees he's getting out of bed, approaching her. room...let you sleep. send the girls home. . .but I am home... so...okay. Good night. This was..This was a great night. For me... soul mates, you know... nods. She knows. hesitates, then moves to one side of the bed and as opens his eyes. He's surprised to see he has his arm Can you see this?
Not really but it looks like it	says eleven. It is eleven... slept eight hours.
Impossible.	turn and finally look at each other. Both look wrinkled,
How ya doin' Ace?	Whoa Nelly...little dizzy. clicker. You know you have a doctor's appointmQnt in an hour. pills, whip us up some french toast, I have ,the best maple syrup ever. ' You are a woman to love. smiles, then walks away with the achey walk of a woman hell does that mean? past few days have done wonders for you. thing. I can do it by the way. Climb a flight of stairs. Several times actually. stands, tucks in his shirt, smiling proudly to himself. Erica?
I know you must know her name by	now. is an amazing woman. Does whatever she can to make me happy. Really. Turns out she's very giving. suddenly riveted to these words. Yeah, well that's wonderful. I think she's wonderful. real moment between them. Julian decides to take the high Give her my best... What the...? This is the second time I've done this now. I get overcome or something. . . after having an episode like you've had. Everything takes on a new meaning. So it's not crazy for a man to do something entirely out of character after having a heart attack? Like crying? HARRY
Yeah and totally changing their	tastes. Like suddenly really liking something they never thought they could like...ever...and I'm talking really liking it. It's...unnerving. anything right now. People have done some wild things after having a heart attack...selling businesses, getting divorced, moving... Some people say it saved their lives. themselves, right? I'll go back to being me, won't I? Hi. Oh. So... Congratulations. That's really. . . great. sure. You think you can deal with me for one more night? CROWDED CLUB - SOUTHAMPTON - THAT NIGHT Okay, here goes... Bought my own music. makes his way TO THE STAGE, hands them his disc. He's wish me luck. Music begins and it is an instrumental version of one of I wish you bluebirds in the spring... To Give your heart a song to sing... And then a kiss, but more than this... I wish you love... arry takes out a sheet of paper and his glasses. Harry sings the rest of the song IN FRENCH. . . Et en juillet une limonade...Pour vous refroidir dans quelque lefy glade... so on... Erica watches knowing something in her life has Here you go, you can have these back now. I confiscated them your first night here... Thank you darlin' ... And I packed you a sandwich, just in case your blood sugar got low. And some of that iced-tea you like, and a nonfat, low cholesterol cookie. And a peach. Got something else? behind her back Erica pulls out a Mason Jar filled with hugs her. Erica awkwardly throws her arms around him gratitude for taking me in and taking care of me and... thing that ever happened to me. I love ya. don't know if it ends in 'ya' if it's an official I love you but... expression looks something like he's in pain. Then. . . MARIN we're talking and he starts looking all weir~ and then he tells me he met someone three weeks ago and it's "really something and then he He tells me he's getting married. Why am I reacting this way? I'm almost thirty years old... Yes, I'm crying, leave me alone. weeks ago. She's four years older than me and she's an Ear, Nose and Throat Doctor. Has he lost his mind? I have a huge auction tonight... Why do I have to be the one to deal with this? Can you please come in? I'm rea:~y upset, my shrink'~ away for two weeks...I know you're working but. . .please. . ? Good to be back? Let's find out. let Harry know I'll be. in the city tonight and he can reach me on my cell...if he wants... Okay? Aw shit. Hello? remarried, but he doesn't even know her and she's like my age. You know what that's like? It's like beyond creepy. And I know he's not replacing me so why does it feel like he is? This is crazy, right? Crying like this... And all the statistics say divorced men almost always remarry. That's just the way they're built. Mom, you want to know the answer to the big mystery of my life? Why I'm always with the wrong guy? This is why. Because the wrong guy can't do this to you. You have some control with the wrong guy. This thing I'm feeling right now. This is my big fear...that some guy could get me unglued like this, like nothing's connected. And this is just my father! I'm just not strong enough to handle this kind of drama.
The drama in life is what makes you	strong. You've never really understood this,but we're not all like you. husband, the man who I still allow to direct my plays.! was getting married to some 33 year old Ear, Nose and Throat Babe, I'd be bonkers. And look at you. You've never looked better, by the way. My anti-depressant is obviously not working. It should cover events like this shouldn't it?
Ugggh, mother, do you know anyone who	doesn't? KNOCK on the door.
Mom, can you do one other really	big thing for me? Just say yes. Anything bubee. with me and Dad and the fiance? not go alone. I already asked him if you could come and he said it was fine and she said it was fine. Look, you're gonna have to meet her too, so, we might as well meet her together. Come on, you know you can handle it.
pauses, thinks M	about it. She knows she can too. your face. That's the gene I didn't get. this evening's sale of Impressionistic and Modern Art. Bidders should know that the auctioneer may open bidding on any lot below the reserve by placing a bid on behalf of the seller. Okay...Let's start with Lot I, the Bonnard drawing. And $5.000 starting with my bidders, $5000 is bid, 5500, 6000, 6500 is mine, 7000 gentleman's bid, 7500 is here, 8000 on the phone. . . JULIAN everything. And can you bring me another. . . takes a look at the menu, then looks away. Thirsty? these slip right down. I'm fine. So, Kristen, where'd you go to... --medical school? Excuse me. too. Mawr . . . but our mothers went to the same college. takes out a pack of cigarettes. MARIN this isn't going badly so far it? I mean for a totally surreal like this. do I like duck? give you a list of everything likes and dislikes. on her own. did go to medical school. not in front of the kids. will tell you this...Dave has one great love in his life. hard liquor. did you order her a Martini? ERICA watch TV or read without the hand down the pants-- Here's my advice after 21 years I say who cares, they're his balls,let him enjoy 'em. I think I swallowed my olive, whole. looks up and sees something that takes her breath away. looks at her menu then her eyes go right back to Harry. air... rises; grabs her purse, almost bumps into a Waiter as Hello... picks up her pace, starts running. Her cell phone RINGS.
Hello?	Harry and Erica on their cells, a block apart. Slow down. You want to kill me? considers it. of a girl. reaches a corner, can't get across, turns the corner. really like you. I do. I love you. swoons and not in a good way. that you're in love with the idea of being in love. like the dumb girl who doesn't get it. never been the dumb girl It ain't so great. a meal with a friend. ago? day, it's my first day back. like seeing you. I do. I'm always by it. what a good time we had. Let's not something great. you some version of the truth. truth doesn't have versions. HARRY been turned upside down. my whole fucking life. I felt with you that... Oh, you don't to- me. existed. You know what that's like a twenty year marriage? To feel for another person that's so the charts, that - not your problem. This is why not good in relationships. You writers are like teachers, who can - do, those who can't write romantic comedies where does not happen in the third it certainly does not to a 55 year old woman. In play I'll be 36 so it won't be pathetic. I'm just too old to crushed.I've written this but I never really got it. know what this is? is heart broken. How's that impervious? ERICA The life I had before I met you. I knew how to do that, could do that forever. Now look at me...what do I do with all this? having dinner with, if that's what you want, it's never going to work with me. Look at me. I'm a middle aged woman, don't let this brown hair fool you, I don't have a real brown hair on my head, I'm almost all grey...that would freak you out, wouldn't it? And I have. high cholesterol and my back hurts every morning and I'm post menopausal and I have osteoperosis and I'm sure arthritis is just around the corner and I know you've seen my vericose veins. Let's face it man, that's not quite the buzz you're lookin' for. TAXI pulls up. gettin' older. ..just like you. opens the back door of the Taxi.
Wait.	turns. is his chance. know how to be a boyfriend. this? You don't know how to be a boyfriend. both out of words. nods. He doesn't give. She ducks into the CAB and it Ouch. grabs his heart. pain, no nauseau, some shortness of breath, was hospitalized a week ago with a coronary thrombosis. Give him 5 mgs of Metoprolol. You h~ving chest pain right now? ARRY sharp, not like before. like to hear. Give him aspirin. heart is not in distress but I'm gonna do a rapid enzyme test to be sure. What were you doing at the onset of the pain? a woman give you chest pain? heard? never got any. All right, well you're battin' a thousand here. Your enzymes look perfect, your EKG is normal and the pain doesn't sound like the kind of pain we worry about. I think what you experienced was normal chest pain associated with stress. give you a heart attack. Mr. Langer, I donlt know what you're up to gallivanting out and about at this hour, but if you were my Dad, I'd make sure you were home, in bed, recuperating. pulls his glasses out of his pocket, puts them on to dial. leave a message. realizes he doesn't know what to say, hangs up, then looks Ouch. 8:20, I'm in the restaurant...just Wondering if you're... hangs up, starts crying again. She takes off her NIGHT, laptop in bed, Erica writes, eating a bagel, wearing writes: Do I hear French Music? she sits up, tries to fix her hair. writes: R U there? answers: Yes. Hello. writes: How are ya? writes: Great... as, she wipes her tears on her sleeve. answers: Pouring out of me now. Go figure. deletes the I miss y... and instead writes: U 2. Okay. Don't forget to put some clothes on. Since .when don't I go out? Just cause some Emergency Room Doctor tells me to stay in bed, doesn't mean I have to turn into a monk. LOWELL
Is there something you'd like me to	do for you, Mr. Langer? doin'?
Would you hate making me something	to eat? think? Funny's a unique thing in a woman. It's fun to be around. watching these two for 5O years. sittin' here watchin' Mamie Van Doren reruns. since I've been home. Every little ache and pain scares the shitout of me...can't get a handle on my emotional life, don't know what I want, don't know if what I felt was because I just had a heart attack or was real. Plus, I feel needy. I never used that word in my life. this? Be honest. And I'm no good at it. Those are very nice pajamas, by the way. Did they used to be mine?
Yes but you gave them to me, you	said you never wore them. They're so elegant. Nice piping... away beautiful things. I'm gonna shut my eyes for a few minutes. Keep Lucy on... nods off and Lowell TURNS OUT THE LIGHT. turns, wiping tears. didn't know you did that. abnormally great at it. it Harry? 'em and leave 'em stuff. fuck, do you?
really. Sometimes. Not right	
now you get my theory about	You gotta self protect. It's dangerous. so your feelings won't get It's just so crazy, it makes want to SCREAMMMMMMMMMMM!!!!
how would you put it if you	to hurt my feelings? love for the rest of your life maybe it won't work out and you'll become unglued. That's a way to live. now? This is good what to you? ERICA it was good, it was electrifying. eyes fill up.
I think you must consider the possibility	that we are more alike than you realize. I let someone in and I had the time of my life. I've never had the time of my life. the deepest part of my heart. . ... what the fuck are you waiting "for?
Not quite.	makes his way down the stairs, through the crowded farm stand. you apologize. mortified by my behavior. I was going to get in touch with you, send you a note or something... been myself lately. What can I say? ulian nods.
Think so.	hesitates then gives him a peck of a kiss. JULIAN
No one on earth would forgive you	for that kiss May I? nods as Julian takes her in his arms and gives her a I forgive you. very distinctly begins to hear the BEATING of her own sits back, still wearing Harry's glasses. Finished at It's funny. leans oyer the sofa, reading over his shoulder. intimidated by your brilliance? gives him a small kiss of appreciation. JULIAN Come here... leans into him and he kisses her fully and sweetly. She It's such a great part. It's supporting but she's a really funny character. There's this totally hilarious scene where she's dating this like chauvinist older guy and just as they're about to do it, the guy moans and she thinks he's just really into her, right? Except he's having a heart attack and she's like creeped out and her mother, who basically despises the guy, rushes in, gives him CPR and saves his life. Why can't we all stay for the weekend? freezes, horrified. Turns, sees him. not you. ..not me? live or he can die.
Death.	It's funnier. around with our heroine, so it won't be too sad. doesn't seem a little harsh? me. It's a work of fiction, Harry. Really...just stuff I made up. Erica, we're ready to do the hospital, 'Do You Take Viagra scene... Should we wait for you? nods, horrified. Broadway. of the truth of you. So to speak.
Sorry to interrupt again but Dave wants	to know, when Henry says, "I love ya", you want that to be 'Ya', not 'You', right? now HEAR Louis Armstrong's La Vie En Rose play throughout RICA feeling all right? they stand in front of the Eiffel Tower backing, FAKE SNOW seeing you. We could've carried on a fun thing for awhile. Why is it you dames want all or nothing? comes to love... Look, Harry, if it's all right with you, I'd like to be friends that?
Anyway, do you actually buy that horse	shit.. .that men and women can be friends once they've had sex? ERICA
friends with my ex-husband, but then	we didn't just have sex. is perfect. I have given the `Can't Be friends' speech for 40 years. I I invented the 'Can't We Be speech. But you know what,now I why they never went for it. You dames one thing right. Sometimes sex does everything. Call me crazy, but I don't see us out on the town, being having dinner, 'cause I'd bet you at some point, one of us will very unfriend like thoughts about other then pass the bread becomes but pass the bread. You get what saying? work that way. I'm moving into another phase of thing. I'm mad at you. almost feels good. about you so much and about how you are and if I your life or... worries about you. Sometimes worrying about you feels like a full time job. have to work that shift anymore. The Stage Manager... the costumes for the dancing Henry's. These gonna work for you? and Erica TURN and SEE a CHORUS LINE of BALDING 60 YEAR to
ARRY	man would punish me like this. Harry turns, glances over at the Woman. She drinks me as "man" in general, the beast women love to hate. Right? I broke her heart then she married some hard working Joe on the rebound, has three great kids. What is so funny? WOMAN JOGGER
